job_id,date_posted,source,company,title,category,raw_category,seniority,location,job_type,skills,tags_raw,salary_min_usd,salary_max_usd,salary_mid_usd,demand_index,scarcity_score,time_to_fill_days_proxy,application_volume_proxy,source_url,description_preview
raw-0044,2026-06-03,Arbeitnow API,Fynn GmbH,Support & Implementation Engineer (m/w/d),Software & Engineering,Consulting,Unspecified,Cologne,,TypeScript; Onboarding; Backend; Finance; API,Consulting; Engineering,66387,95533,80960,77.9,54,37.2,115,https://www.arbeitnow.com/jobs/companies/fynn-gmbh/support-implementation-engineer-cologne-459962,"Wie ein Unternehmen seine Kunden abrechnet, entscheidet darüber, wie es wachsen kann. Subscription-Modelle, nutzungsbasierte Preise, individuelle Vertragskonditionen, die Anforderungen sind vielfältig, die Systeme dahint"
raw-0045,2026-06-03,Arbeitnow API,ARC Intelligence GmbH,Engineering Intern,Data & AI,Software Development,Internship/Student,Berlin,,Data Engineering; Communication; Data Science; Forecasting; JavaScript; TypeScript; Frontend; Backend; Finance; Startup; Python; React,Software Development,38335,55165,46750,74.9,59,39.4,108,https://www.arbeitnow.com/jobs/companies/arc-intelligence-gmbh/engineering-intern-berlin-401279,"ARC Intelligence is building the AI native Finance OS for modern mid market corporations. We help finance teams manage planning, forecasting, reporting, consolidation, and performance management across complex corporate "
raw-0046,2026-06-03,Arbeitnow API,ARC Intelligence GmbH,Fullstack Engineer,Data & AI,Software Development,Mid-level,Berlin,berufserfahren,Forecasting; TypeScript; Full Stack; Frontend; Backend; Testing; Finance; Startup; Python; Design; Cloud; CI/CD,Software Development,69700,100300,85000,75.6,59,39.4,108,https://www.arbeitnow.com/jobs/companies/arc-intelligence-gmbh/fullstack-engineer-berlin-27444,"ARC Intelligence is building the AI native Finance OS for modern mid market corporations. We help finance teams manage planning, forecasting, reporting, consolidation, and performance management across complex corporate "
raw-0047,2026-06-03,Arbeitnow API,Lucid Labs,Werkstudent Founders Associate / Business Development (m/w/d),Product & Project Management,Business Development,Internship/Student,Berlin,Working student,Video Editing; Sales,Business Development,34276,49324,41800,73.7,38,30.3,136,https://www.arbeitnow.com/jobs/companies/lucid-labs/werkstudent-founders-associate-business-development-berlin-203150,"Worum es bei uns geht Bei uns laufen KI-Agenten im operativen Tagesgeschäft echter Unternehmen. Sie prüfen Rechnungen, ordnen Anfragen ein, monitoren Förderlandschaften. Nicht im Pitch-Deck, nicht im Innovation-Lab, sond"
raw-0048,2026-06-03,Arbeitnow API,syte GmbH,AI Enablement Engineer (m/w/d),Software & Engineering,Remote,Mid-level,Münster,berufserfahren,TypeScript; Security; Python; REST; API; AI,Remote; Business Consulting,72160,103840,88000,84.6,62,40.7,104,https://www.arbeitnow.com/jobs/companies/syte-gmbh/ai-enablement-engineer-munster-460934,"Deine Mission Hilf uns, mit KI effizienter zu arbeiten – und gestalte die internen Abläufe eines schnell wachsenden PropTech-Unternehmens mit. Wir sind syte – ein PropTech-Unternehmen aus Münster, das eine KI-gestützte S"
raw-0049,2026-06-03,Arbeitnow API,WasteSide GmbH,Werkstudent:in Expansion & Operations (m/w/d),Marketing & Growth,Management,Internship/Student,Hanover,"Working student, hilfstätigkeit / student",Operations; Startup; Video Editing,Management; Team Leader,27060,38940,33000,79.7,38,30.3,136,https://www.arbeitnow.com/jobs/companies/wasteside-gmbh/werkstudentin-expansion-operations-hanover-126835,"WasteSide wächst – und du bist die treibende Kraft hinter unserem Roll-out in neue Städte! Als Werkstudent:in Expansion (20h/Woche) am Standort Hannover planst du unsere nächsten Schritte in Städten wie Dortmund, Trier, "
raw-0050,2026-06-03,Arbeitnow API,Intermate Media GmbH,Senior Projektmanager:in (gn) Telekommunikation - Social Media & Influencer Marketing,Software & Engineering,Marketing and Communication,Senior/Lead,Berlin,berufserfahren,Communication; Social Media; Video Editing,Marketing and Communication,97416,140184,118800,83.4,48,38.6,123,https://www.arbeitnow.com/jobs/companies/intermate-media-gmbh/senior-projektmanagerin-gn-telekommunikation-social-media-influencer-marketing-berlin-131226,"Jobbeschreibung Intermate x SAMY – Shaping the State of Social Intermate gehört zu den größten Social-Media- und Influencer-Agenturen im DACH-Raum. Mit mehr als 250 Mates in Berlin, Hamburg, Köln und Remote entwickeln wi"
raw-0051,2026-06-03,Arbeitnow API,P&P Group,Marketing Manager Immobilien (m/w/d),Software & Engineering,Marketing and Communication,Senior/Lead,Fürth,berufserfahren,Communication; Design; Cloud,Marketing and Communication,97416,140184,118800,100,56,42.1,112,https://www.arbeitnow.com/jobs/companies/pp-group/marketing-manager-immobilien-furth-6549,"Die P&#x26;P Group ist operativer Immobilieninvestor und Investorenplattform mit Standorten in München, Fürth und London. Mit ausgezeichneter Technikexpertise und über 30-jähriger Historie realisieren wir anspruchsvolle "
raw-0052,2026-06-03,Arbeitnow API,Burner Marketing GmbH,Werkstudent (m/w/d) Recruiting & Marketing,Marketing & Growth,Marketing Manager,Internship/Student,Erlangen,Working student,Social Media; Onboarding,Marketing Manager,27060,38940,33000,75.1,38,30.3,136,https://www.arbeitnow.com/jobs/companies/burner-marketing-gmbh/werkstudent-recruiting-marketing-erlangen-142686,"Was uns auszeichnet? Unser Treibstoff ist ein Kollektiv aus echten Machern, bei dem gegenseitiger Support und das Erreichen von Meilensteinen Hand in Hand gehen. Unser Headquarter dient dabei als kollaborativer Workspace"
raw-0053,2026-06-03,Arbeitnow API,Gauss Robotics,Senior DevOps Engineer,Data & AI,IT,Senior/Lead,Braunschweig,,AI; Kubernetes; TypeScript; Automation; Security; Design; Cloud; AWS,IT,94095,135405,114750,77.8,85,54.5,75,https://www.arbeitnow.com/jobs/companies/gauss-robotics/senior-devops-engineer-braunschweig-390812,"At Gauss Robotics, we are making robotics a commodity by automating the engineering processes behind it. Our automation platform combines artificial intelligence, cloud-native infrastructure, simulation technology, and r"
raw-0054,2026-06-03,Arbeitnow API,aurivus GmbH,Operations & Growth Manager (m/w/d),Software & Engineering,Business Operations,Senior/Lead,Ulm,,Operations; Startup; AI,Business Operations,97416,140184,118800,94,48,38.6,123,https://www.arbeitnow.com/jobs/companies/aurivus-gmbh/operations-growth-manager-ulm-308068,"AI Software Scale-up | Operations | Organisation | Founder Enablement aurivus ist das „OCR für 3D-Scans“: Unsere KI verwandelt unstrukturierte Punktwolken bestehender Industrieanlagen automatisch in intelligente, semanti"
raw-0055,2026-06-03,Arbeitnow API,aurivus GmbH,Senior Project & Operations Manager (m/w/d),Software & Engineering,Business Operations,Senior/Lead,Ulm,berufserfahren,Operations; AI,Business Operations,97416,140184,118800,99.3,48,38.6,123,https://www.arbeitnow.com/jobs/companies/aurivus-gmbh/senior-project-operations-manager-ulm-96333,"DeepTech / AI | Customer Delivery | Operations | Growth Enablement aurivus ist das „OCR für 3D-Scans“: Unsere KI verwandelt unstrukturierte Punktwolken bestehender Industrieanlagen automatisch in intelligente, semantisch"
raw-0056,2026-06-03,Arbeitnow API,Exaris Solutions,Datenexperte (m/w/d) für Healthcare- und Lifescience-Projekte,Data & AI,Data Scientist,Mid-level,Essen,berufserfahren,Data Engineering; Data Science; Frontend; PyTorch; Backend; Python; Excel; SQL; NLP; AWS; CRM,Data Scientist,69700,100300,85000,64.2,75,46.3,88,https://www.arbeitnow.com/jobs/companies/exaris-solutions/datenexperte-fur-healthcare-und-lifescience-projekte-essen-22505,"Die Exaris Solutions führt im Auftrag ihrer Kunden aus dem Healthcare- und Lifescience-Bereich gezielte Recherchen durch, um wichtige Einblicke für Healthcare Professionals (HCPs) zu erhalten. In diesen innovativen Proje"
raw-0057,2026-06-03,Arbeitnow API,Intermate Media GmbH,Client Service Director (gn),Software & Engineering,Marketing and Communication,Senior/Lead,Berlin,berufserfahren,Communication; Social Media; Forecasting; Onboarding,Marketing and Communication,97416,140184,118800,78.2,48,38.6,123,https://www.arbeitnow.com/jobs/companies/intermate-media-gmbh/client-service-director-gn-berlin-451843,"Jobbeschreibung Intermate x SAMY – Shaping the State of Social Intermate gehört zu den größten Social-Media- und Influencer-Agenturen im DACH-Raum. Mit mehr als 250 Mates in Berlin, Hamburg, Köln und Remote entwickeln wi"
raw-0058,2026-06-03,Arbeitnow API,Ecalia,Entwicklungsingenieur:in | F&E Physik & Simulation (m/w/d),Software & Engineering,Development,Mid-level,Stuttgart,berufserfahren,Startup; Python,Development,72160,103840,88000,94.5,46,33.8,125,https://www.arbeitnow.com/jobs/companies/ecalia/entwicklungsingenieurin-fe-physik-simulation-stuttgart-134020,"Wir machen Heizen und Kühlen radikal effizienter. Ecalia ist ein Deep-Tech-Startup aus Stuttgart, das die Kälte- und Wärmepumpentechnik grundlegend neu denkt. Unsere Innovation sind Scroll-Kompressor-Expander-Systeme, di"
raw-0059,2026-06-03,Arbeitnow API,Cyber Insight GmbH,Senior Technical Consultant Cybersecurity - Enterprise & MedTech (m/w/d),Software & Engineering,Consulting,Senior/Lead,Leipzig,berufserfahren,Cybersecurity; Onboarding; Operations; Frontend; Security; Cloud,Consulting; Engineering,97416,140184,118800,76,72,49,91,https://www.arbeitnow.com/jobs/companies/cyber-insight-gmbh/technical-consultant-cybersecurity-customer-success-leipzig-455541,"Cyber Insight entwickelt mit ZYLENTIX eine KI-gestützte Cybersecurity-Plattform für regulierte Enterprise-Kunden, mit besonderem Fokus auf MedTech, Healthcare und Industrie. ZYLENTIX hilft Unternehmen dabei, produktbezog"
raw-0060,2026-06-03,Arbeitnow API,cbs Corporate Business Solutions GmbH,(Senior) Consultant SAP Authorizations / Berechtigungen (m/w/d) in Voll- oder Teilzeit,Data & AI,Consulting,Senior/Lead,Freiburg im Breisgau,"Full-time permanent, mid",Cloud; SAP,Consulting; high school coursework,94095,135405,114750,77.8,61,44.2,106,https://www.arbeitnow.com/jobs/companies/cbs-corporate-business-solutions-gmbh/senior-consultant-sap-authorizations-berechtigungen-in-voll-oder-teilzeit-freiburg-im-breisgau-455011,"Wir sind die Berater der Weltmarktführer: Hochmotivierte Expertinnen und Experten, die als erfolgreiches Team digitale End-to-End-Geschäftsprozesslösungen vorantreiben. Gemeinsam stärken wir die Zukunft der beeindruckend"
raw-0061,2026-06-03,Arbeitnow API,Quantum- Systems GmbH,Senior Purchasing Manager (m/f/d) - Fernride GmbH,Data & AI,Logistics and transportation,Senior/Lead,München,"Full-time permanent, mid",Communication; Automation; Research; Startup; AI,Logistics and transportation; bachelor's degree,94095,135405,114750,83.4,53,40.8,116,https://www.arbeitnow.com/jobs/companies/quantum-systems-gmbh/senior-purchasing-manager-fernride-gmbh-munchen-191054,"Fernride is building the future of autonomous logistics by combining advanced automation technology with human‑guided teleoperations. We enable logistics companies to transition toward safer, more efficient, and more sus"
raw-0062,2026-06-03,Arbeitnow API,Nomios,Werkstudent Human Resources (m/w/d),Cybersecurity & IT,Recruitment and hr,Internship/Student,Frankfurt am Main,"Part-time fixed-term, student (college)",Recruitment; HR; Onboarding; Excel,Recruitment and hr; high school coursework,36080,51920,44000,65.7,43,32.5,129,https://www.arbeitnow.com/jobs/companies/nomios/werkstudent-human-resources-frankfurt-am-main-295590,"Die Mission von Nomios ist es, eine „sichere und vernetzte Zukunft” zu schaffen – mit einem konsequenten Fokus auf erstklassige Cybersicherheitsdienstleistungen. Unternehmen weltweit vertrauen uns, wenn es um die Absiche"
raw-0063,2026-06-03,Arbeitnow API,eBazaaris,Account Manager Marketplace - Fokus Amazon & Online-Apotheken (m/w/d),Marketing & Growth,Remote,Senior/Lead,Berlin,,Advertising; Marketplace; Operations,Remote; Online Marketing,66420,95580,81000,70.9,48,38.6,123,https://www.arbeitnow.com/jobs/companies/ebazaaris/account-manager-marketplace-fokus-amazon-online-apotheken-berlin-494044,"eBazaaris ist die führende Retail Media Agentur mit starkem Fokus auf Amazon und Versandapotheken. Wir unterstützen erfolgreiche Marken dabei, ihr volles Potenzial auf dem Marktplatz auszuschöpfen – von der Content-Optim"
raw-0064,2026-06-03,Arbeitnow API,Muxon,Projektleiter Glasfaserausbau (m/w/d),Software & Engineering,Engineering,Mid-level,Ehingen,berufserfahren,Python; JavaScript; API; Cloud,Engineering,72160,103840,88000,96.9,62,40.7,104,https://www.arbeitnow.com/jobs/companies/muxon/projektleiter-glasfaserausbau-ehingen-320547,"Gehaltsangaben: Diese Position richtet sich an Kandidat:innen mit mehr als 5 Jahren Berufserfahrung. Die Gehaltsspanne liegt je nach Erfahrung zwischen 75.000 und 90.000 € brutto pro Jahr. Arbeitsmodell: Vollzeit, hybrid"
raw-0065,2026-06-03,Arbeitnow API,Priesmeier & Bartsch GbR,Mitarbeiter:in Kundenservice & Social Media (m/w/d),Marketing & Growth,Social Media Manager,Internship/Student,Berlin,hilfstätigkeit / student,Social Media; Shopify,Social Media Manager,27060,38940,33000,67.4,38,30.3,136,https://www.arbeitnow.com/jobs/companies/priesmeier-bartsch-gbr/mitarbeiterin-kundenservice-social-media-berlin-74636,"SiPRi ist eine junge, schnell wachsende Sicherheitsmarke aus Deutschland. Wir entwickeln und vertreiben smarte Sicherheitsprodukte — von Alarm-Fahrradschlössern mit 120-dBAlarm über RFID-Schutz bis hin zu persönlichen Al"
raw-0066,2026-06-03,Arbeitnow API,Muxon,Lead Structural Analysis Engineer - Space,Software & Engineering,Engineering,Senior/Lead,Munich,professional / experienced,Recruitment; Automation; Testing; Python; Design,Engineering,97416,140184,118800,77,56,42.1,112,https://www.arbeitnow.com/jobs/companies/muxon/lead-structural-analysis-engineer-space-munich-488237,"Salary Transparency: This position is intended for candidates with more than 6 years of professional experience. The salary range varies depending on experience, between €90,000 and €110,000 gross per year. Work model: F"
raw-0067,2026-06-03,Arbeitnow API,Chapter Living GmbH,Marketing Manager/in: Schwerpunkt Immobilien & Markenauftritt,Marketing & Growth,Marketing and Communication,Senior/Lead,Berlin,,Communication; Social Media; Design,Marketing and Communication,66420,95580,81000,97.2,48,38.6,123,https://www.arbeitnow.com/jobs/companies/chapter-living-gmbh/marketing-manager-in-schwerpunkt-immobilien-markenauftritt-berlin-438800,"Wir suchen eine engagierte Teilzeitkraft (m/w/d) mit Schwerpunkt im Bereich Marketing, die unser Team im Bereich Immobilien und Markenauftritt unterstützt. In dieser Position bist du verantwortlich für die Entwicklung un"
raw-0068,2026-06-03,Arbeitnow API,Karriereweg GmbH,"Praktikum Automatisierung, Prozesse & KI in der Personalberatung",Marketing & Growth,Process Management,Internship/Student,Gelsenkirchen,"Internship, hilfstätigkeit / student",Sales; CRM,Process Management,27060,38940,33000,77.8,38,30.3,136,https://www.arbeitnow.com/jobs/companies/karriereweg-gmbh/praktikum-automatisierung-prozesse-ki-in-der-personalberatung-gelsenkirchen-317151,"Pflichtpraktikum ab 6 Monaten | Remote-first | Raum für eigene Projekte Du willst im Praktikum nicht nur mitlaufen, sondern eigene Ideen einbringen? Dann bist du bei Karriereweg richtig. Bei uns arbeitest du an echten Pr"
raw-0069,2026-06-03,Arbeitnow API,Progyny Global,Product Designer (UX/UI) (m/f/x),Software & Engineering,Graphic Arts and Communication Design,Mid-level,Berlin,professional / experienced,Communication; Design; User Research; Research; Testing; Startup; Figma; HR,Graphic Arts and Communication Design,72160,103840,88000,72.8,38,30.3,136,https://www.arbeitnow.com/jobs/companies/progyny-global/product-designer-ux-ui-berlin-246881,"Who We Are At Progyny Global, part of the Progyny, Inc. family, we're on a mission to make fertility, pregnancy, and family-forming care accessible worldwide. By combining world-class clinical expertise with innovative t"
raw-0070,2026-06-03,Arbeitnow API,Karriereweg GmbH,Praktikum Digital Marketing in der Personalberatung,Marketing & Growth,Online Marketing,Internship/Student,Gelsenkirchen,"Internship, hilfstätigkeit / student",Design; Sales; SEO; CRM,Online Marketing,27060,38940,33000,76.4,38,30.3,136,https://www.arbeitnow.com/jobs/companies/karriereweg-gmbh/praktikum-digital-marketing-in-der-personalberatung-gelsenkirchen-363544,"Pflichtpraktikum ab 6 Monaten | Remote-first | Raum für eigene Projekte Du willst im Praktikum nicht nur mitlaufen, sondern eigene Ideen einbringen? Dann bist du bei Karriereweg richtig. Bei uns arbeitest du an echten Pr"
raw-0071,2026-06-03,Arbeitnow API,Particula,Senior Quantitative Risk Analyst (Digital Assets),Software & Engineering,Remote,Senior/Lead,Munich,,Research; Testing; Design,Remote; Credit Analysis,97416,140184,118800,75.5,48,38.6,123,https://www.arbeitnow.com/jobs/companies/particula/senior-quantitative-risk-analyst-digital-assets-munich-406069,"Hi, we are Particula, the leading rating provider for digital assets! Our mission? To make the market for digital assets more accessible, secure and transparent for institutional investors. We support issuers, trading fa"
raw-0072,2026-06-03,Arbeitnow API,Indivumed GmbH,(Junior-) Controller (m/w/d),Software & Engineering,Finance,Entry-level,Hamburg,,Finance; Forecasting; Power BI; Excel; SAP,Finance,54120,77880,66000,60.9,38,30.3,136,https://www.arbeitnow.com/jobs/companies/indivumed-gmbh/junior-controller-hamburg-204105,"Indivumed ist ein Biotechnologieunternehmen, das auf Präzisionsonkologie spezialisiert ist. Seit fast 25 Jahren treibt uns unsere übergeordnete Vision an: eine Welt zu schaffen, in der jeder Krebspatientin und jedem Kreb"
raw-0073,2026-06-03,Arbeitnow API,Navius HR & Recruiting,E-Commerce & Performance Marketing Manager (m/w/d) @PIXLIP,Marketing & Growth,Online Marketing,Senior/Lead,Cologne,berufserfahren,Performance Marketing; Testing; Shopify; Design; SEO,Online Marketing,66420,95580,81000,64.8,48,38.6,123,https://www.arbeitnow.com/jobs/companies/navius-hr-recruiting/e-commerce-performance-marketing-manager-at-pixlip-cologne-119093,Die PIXLIP GmbH ist eines der innovativsten Unternehmen für modulare Leuchtrahmen- und Messestandlösungen in Europa. Mit unserem neuen KI-basierten Design-Tool und einer modernen Vertriebsstruktur schaffen wir völlig neu
raw-0074,2026-06-03,Arbeitnow API,Wavestone Germany AG,Lead Scrum Master – Level Chief (m/w/d) (Ref.Nr.: 46940),Software & Engineering,IT,Senior/Lead,Berlin,"Freelance, berufserfahren",Agile; Scrum,IT,97416,140184,118800,46.6,48,38.6,123,https://www.arbeitnow.com/jobs/companies/wavestone-germany-ag/lead-scrum-master-level-chief-refnr-46940-berlin-244233,"Wir suchen einen leitenden Scrum Master, um ein groß angelegtes Projekt zu unterstützen, das ein Netzregelungssystem der nächsten Generation für die Energiewende entwickelt. Hauptziel ist es, die agile Transformation vor"
raw-0075,2026-06-03,Arbeitnow API,Publik. Agentur für Kommunikation GmbH,Art Director / Kommunikationsdesigner (all genders),Marketing & Growth,Public Relations,Senior/Lead,Mannheim,berufserfahren,Communication; Social Media; Design; Figma,Public Relations; Corporate Communication,66420,95580,81000,85.1,48,38.6,123,https://www.arbeitnow.com/jobs/companies/publik-agentur-fur-kommunikation-gmbh/art-director-kommunikationsdesigner-all-genders-mannheim-6219,"Aus guten Ideen machst du starke Kommunikation? Publik ist eine inhabergeführte Agentur in Mannheim mit einem klaren Fokus: Wir machen Kommunikation, die wirkt – strategisch fundiert, kreativ umgesetzt und messbar erfolg"
raw-0076,2026-06-03,Arbeitnow API,Löwen Apotheke,Operations Manager Apotheken,Product & Project Management,Business Operations,Senior/Lead,Munich,,Operations,Business Operations,84132,121068,102600,98.6,48,38.6,123,https://www.arbeitnow.com/jobs/companies/lowen-apotheke/operations-manager-apotheken-munich-253874,"Du erkennst Chancen, bevor andere sie sehen, und bringst Projekte zum Abschluss? Dann gestalte mit uns die Zukunft unseres Apothekenverbunds. Wir suchen keine klassische Filialleitung, sondern eine unternehmerisch denken"
raw-0077,2026-06-03,Arbeitnow API,MultiBase GmbH,Marketing Operations Coordinator,Data & AI,Business Development,Mid-level,Gilching,professional / experienced,Content Strategy; Automation; Operations; Testing; Sales; CRM; AI,Business Development,69700,100300,85000,75.2,43,32.5,129,https://www.arbeitnow.com/jobs/companies/multibase-gmbh/marketing-operations-coordinator-gilching-395732,"Location Remote (European Time Zones) Start As soon as possible Type Full-time About MultiBase MultiBase is a specialist BI and analytics consulting firm. Founded in 1991, we've spent 35 years helping mid-sized DACH comp"
raw-0078,2026-06-03,Arbeitnow API,AISLER,"Software-Entwickler CAD/CAM (m/w/x) (Studentische Hilfskraft, 14h-20h)",Software & Engineering,Software Development,Internship/Student,Aachen,hilfstätigkeit / student,Python,Software Development,39688,57112,48400,100,46,33.8,125,https://www.arbeitnow.com/jobs/companies/aisler/software-entwickler-cad-cam-studentische-hilfskraft-14h-20h-aachen-104641,"Elektronik beherrscht unser Leben. Wir helfen denen, die sie entwickeln und zum Produkt machen. AISLER unterstützt mehr als 90.000 Elektro-Ingenieur:innen weltweit die Elektronikprodukte von Morgen zu entwickeln, indem w"
raw-0079,2026-06-03,Arbeitnow API,AISLER,"Software-Entwickler Plattform (m/w/x) (Studentische Hilfskraft, 14h-20h)",Software & Engineering,Software Development,Internship/Student,Aachen,hilfstätigkeit / student,Kubernetes,Software Development,39688,57112,48400,52.8,46,33.8,125,https://www.arbeitnow.com/jobs/companies/aisler/software-entwickler-plattform-studentische-hilfskraft-14h-20h-aachen-233513,"Elektronik beherrscht unser Leben. Wir helfen denen, die sie entwickeln und zum Produkt machen. AISLER unterstützt mehr als 90.000 Elektro-Ingenieur:innen weltweit die Elektronikprodukte von Morgen zu entwickeln, indem w"
raw-0080,2026-06-03,Arbeitnow API,hey contact heroes GmbH,Junior Projektmanager (m/w/d) im Home Office,Product & Project Management,Remote,Senior/Lead,Hamburg,,Project Management; Customer Service; Operations,Remote; Project Management,84132,121068,102600,70.4,48,38.6,123,https://www.arbeitnow.com/jobs/companies/hey-contact-heroes-gmbh/junior-projektmanager-im-home-office-hamburg-456973,"Steig‘ ein bei der Nummer eins der “work at home”-Dienstleister am Markt – den hey contact heroes! Wir haben uns auf die Fahne geschrieben, sowohl all unsere heroes (unsere Kolleg*innen) als auch unsere Auftraggeber jede"
raw-0081,2026-06-03,Arbeitnow API,hubside - Die Recruitingwerkstatt,Cyber Security Analyst (m/w/d),Software & Engineering,IT,Mid-level,Munich,berufserfahren,Security; Python,IT,72160,103840,88000,89.6,54,37.2,115,https://www.arbeitnow.com/jobs/companies/hubside-die-recruitingwerkstatt/cyber-security-analyst-munich-466420,"Als Cyber Security Analyst (m/w/d) übernehmen Sie eine zentrale Rolle bei der Überwachung, Analyse und Weiterentwicklung der Informationssicherheit. Sie verbinden fundiertes technisches Know-how mit einem ausgeprägten Ve"
raw-0082,2026-06-03,Arbeitnow API,hey contact heroes GmbH,Freelancer als Agent/in (m/w/d) im Mobilfunk Inbound - EU only - Deutsch - 100% Remote,HR & Recruitment,Remote,Unspecified,Berlin,Freelance,Customer Service,Remote; Customer Service,42246,60794,51520,61.1,38,30.3,136,https://www.arbeitnow.com/jobs/companies/hey-contact-heroes-gmbh/freelancer-als-agent-in-im-mobilfunk-inbound-eu-only-deutsch-100-remote-berlin-183597,Kennst du schon die hey contact heroes? Noch nicht? Dann wird’s Zeit! Die hey contact heroes stehen für echte Innovationen im Kundenservice! Wir haben uns auf die Bereitstellung erstklassiger Kundenservice-Lösungen spezi
raw-0083,2026-06-03,Arbeitnow API,Vino Digital,Freelance Shopify Shopbuilder Webdesigner:in (w/m/d) für Weinbranche,Software & Engineering,Remote,Mid-level,Berlin,"Freelance, berufserfahren",Frontend; Shopify; Git,Remote; Online Marketing,72160,103840,88000,62.1,38,30.3,136,https://www.arbeitnow.com/jobs/companies/vino-digital/freelance-shopify-shopbuilder-webdesignerin-fur-weinbranche-berlin-455402,"Hi, wir sind Vino Digital. Wir sind die E-Commerce-Agentur für Winzer und bringen unsere Partnerweingüter mit Shopify nach vorne. Für unsere wachsende Zahl an Shop-Projekten suchen wir feste Freelance-Unterstützung, die "
raw-0084,2026-06-03,Arbeitnow API,brandung GmbH,Data & Web Analyst (m/w/d),Data & AI,Marketing and Communication,Mid-level,Cologne,berufserfahren,Communication; Machine Learning; Data Analytics; Power BI; SQL; API; AI,Marketing and Communication,69700,100300,85000,71.1,59,39.4,108,https://www.arbeitnow.com/jobs/companies/brandung-gmbh/data-web-analyst-cologne-474463,"Dein Spielfeld Strategie &#x26; Beratung : Du entwickelst ganzheitliche Data &#x26; Analytics Strategien und KPI Frameworks. Du berätst Kund:innen zu CDP Lösungen, Customer Journeys und datengestützten Use Cases. Du leit"
