job_id,date_posted,source,company,title,category,raw_category,seniority,location,job_type,skills,tags_raw,salary_min_usd,salary_max_usd,salary_mid_usd,demand_index,scarcity_score,time_to_fill_days_proxy,application_volume_proxy,source_url,description_preview
raw-0168,2026-06-03,Arbeitnow API,Gauss Robotics,Senior DevOps Engineer,Data & AI,IT,Senior/Lead,Braunschweig,,AI; Kubernetes; TypeScript; Automation; Security; Design; Cloud; AWS,IT,94095,135405,114750,76.2,85,54.5,75,https://www.arbeitnow.com/jobs/companies/gauss-robotics/senior-devops-engineer-braunschweig-390812,"At Gauss Robotics, we are making robotics a commodity by automating the engineering processes behind it. Our automation platform combines artificial intelligence, cloud-native infrastructure, simulation technology, and r"
raw-0169,2026-06-03,Arbeitnow API,aurivus GmbH,Operations & Growth Manager (m/w/d),Software & Engineering,Business Operations,Senior/Lead,Ulm,,Operations; Startup; AI,Business Operations,97416,140184,118800,89.6,48,38.6,123,https://www.arbeitnow.com/jobs/companies/aurivus-gmbh/operations-growth-manager-ulm-308068,"AI Software Scale-up | Operations | Organisation | Founder Enablement aurivus ist das „OCR für 3D-Scans“: Unsere KI verwandelt unstrukturierte Punktwolken bestehender Industrieanlagen automatisch in intelligente, semanti"
raw-0170,2026-06-03,Arbeitnow API,aurivus GmbH,Senior Project & Operations Manager (m/w/d),Software & Engineering,Business Operations,Senior/Lead,Ulm,berufserfahren,Operations; AI,Business Operations,97416,140184,118800,95.5,48,38.6,123,https://www.arbeitnow.com/jobs/companies/aurivus-gmbh/senior-project-operations-manager-ulm-96333,"DeepTech / AI | Customer Delivery | Operations | Growth Enablement aurivus ist das „OCR für 3D-Scans“: Unsere KI verwandelt unstrukturierte Punktwolken bestehender Industrieanlagen automatisch in intelligente, semantisch"
raw-0171,2026-06-03,Arbeitnow API,Exaris Solutions,Datenexperte (m/w/d) für Healthcare- und Lifescience-Projekte,Data & AI,Data Scientist,Mid-level,Essen,berufserfahren,Data Engineering; Data Science; Frontend; PyTorch; Backend; Python; Excel; SQL; NLP; AWS; CRM,Data Scientist,69700,100300,85000,61.3,75,46.3,88,https://www.arbeitnow.com/jobs/companies/exaris-solutions/datenexperte-fur-healthcare-und-lifescience-projekte-essen-22505,"Die Exaris Solutions führt im Auftrag ihrer Kunden aus dem Healthcare- und Lifescience-Bereich gezielte Recherchen durch, um wichtige Einblicke für Healthcare Professionals (HCPs) zu erhalten. In diesen innovativen Proje"
raw-0172,2026-06-03,Arbeitnow API,Intermate Media GmbH,Client Service Director (gn),Software & Engineering,Marketing and Communication,Senior/Lead,Berlin,berufserfahren,Communication; Social Media; Forecasting; Onboarding,Marketing and Communication,97416,140184,118800,75.4,48,38.6,123,https://www.arbeitnow.com/jobs/companies/intermate-media-gmbh/client-service-director-gn-berlin-451843,"Jobbeschreibung Intermate x SAMY – Shaping the State of Social Intermate gehört zu den größten Social-Media- und Influencer-Agenturen im DACH-Raum. Mit mehr als 250 Mates in Berlin, Hamburg, Köln und Remote entwickeln wi"
raw-0173,2026-06-03,Arbeitnow API,Ecalia,Entwicklungsingenieur:in | F&E Physik & Simulation (m/w/d),Software & Engineering,Development,Mid-level,Stuttgart,berufserfahren,Startup; Python,Development,72160,103840,88000,88,46,33.8,125,https://www.arbeitnow.com/jobs/companies/ecalia/entwicklungsingenieurin-fe-physik-simulation-stuttgart-134020,"Wir machen Heizen und Kühlen radikal effizienter. Ecalia ist ein Deep-Tech-Startup aus Stuttgart, das die Kälte- und Wärmepumpentechnik grundlegend neu denkt. Unsere Innovation sind Scroll-Kompressor-Expander-Systeme, di"
raw-0174,2026-06-03,Arbeitnow API,cbs Corporate Business Solutions GmbH,(Senior) Consultant SAP Authorizations / Berechtigungen (m/w/d) in Voll- oder Teilzeit,Data & AI,Consulting,Senior/Lead,Freiburg im Breisgau,"Full-time permanent, mid",Cloud; SAP,Consulting; high school coursework,94095,135405,114750,72.8,61,44.2,106,https://www.arbeitnow.com/jobs/companies/cbs-corporate-business-solutions-gmbh/senior-consultant-sap-authorizations-berechtigungen-in-voll-oder-teilzeit-freiburg-im-breisgau-455011,"Wir sind die Berater der Weltmarktführer: Hochmotivierte Expertinnen und Experten, die als erfolgreiches Team digitale End-to-End-Geschäftsprozesslösungen vorantreiben. Gemeinsam stärken wir die Zukunft der beeindruckend"
raw-0175,2026-06-03,Arbeitnow API,Quantum- Systems GmbH,Senior Purchasing Manager (m/f/d) - Fernride GmbH,Data & AI,Logistics and transportation,Senior/Lead,München,"Full-time permanent, mid",Communication; Automation; Research; Startup; AI,Logistics and transportation; bachelor's degree,94095,135405,114750,82.2,53,40.8,116,https://www.arbeitnow.com/jobs/companies/quantum-systems-gmbh/senior-purchasing-manager-fernride-gmbh-munchen-191054,"Fernride is building the future of autonomous logistics by combining advanced automation technology with human‑guided teleoperations. We enable logistics companies to transition toward safer, more efficient, and more sus"
raw-0176,2026-06-03,Arbeitnow API,Nomios,Werkstudent Human Resources (m/w/d),Cybersecurity & IT,Recruitment and hr,Internship/Student,Frankfurt am Main,"Part-time fixed-term, student (college)",Recruitment; HR; Onboarding; Excel,Recruitment and hr; high school coursework,36080,51920,44000,64,43,32.5,129,https://www.arbeitnow.com/jobs/companies/nomios/werkstudent-human-resources-frankfurt-am-main-295590,"Die Mission von Nomios ist es, eine „sichere und vernetzte Zukunft” zu schaffen – mit einem konsequenten Fokus auf erstklassige Cybersicherheitsdienstleistungen. Unternehmen weltweit vertrauen uns, wenn es um die Absiche"
raw-0177,2026-06-03,Arbeitnow API,eBazaaris,Account Manager Marketplace - Fokus Amazon & Online-Apotheken (m/w/d),Marketing & Growth,Remote,Senior/Lead,Berlin,,Advertising; Marketplace; Operations,Remote; Online Marketing,66420,95580,81000,69.9,48,38.6,123,https://www.arbeitnow.com/jobs/companies/ebazaaris/account-manager-marketplace-fokus-amazon-online-apotheken-berlin-494044,"eBazaaris ist die führende Retail Media Agentur mit starkem Fokus auf Amazon und Versandapotheken. Wir unterstützen erfolgreiche Marken dabei, ihr volles Potenzial auf dem Marktplatz auszuschöpfen – von der Content-Optim"
raw-0178,2026-06-03,Arbeitnow API,Muxon,Projektleiter Glasfaserausbau (m/w/d),Software & Engineering,Engineering,Mid-level,Ehingen,berufserfahren,Python; JavaScript; API; Cloud,Engineering,72160,103840,88000,93.9,62,40.7,104,https://www.arbeitnow.com/jobs/companies/muxon/projektleiter-glasfaserausbau-ehingen-320547,"Gehaltsangaben: Diese Position richtet sich an Kandidat:innen mit mehr als 5 Jahren Berufserfahrung. Die Gehaltsspanne liegt je nach Erfahrung zwischen 75.000 und 90.000 € brutto pro Jahr. Arbeitsmodell: Vollzeit, hybrid"
raw-0179,2026-06-03,Arbeitnow API,Priesmeier & Bartsch GbR,Mitarbeiter:in Kundenservice & Social Media (m/w/d),Marketing & Growth,Social Media Manager,Internship/Student,Berlin,hilfstätigkeit / student,Social Media; Shopify,Social Media Manager,27060,38940,33000,62.1,38,30.3,136,https://www.arbeitnow.com/jobs/companies/priesmeier-bartsch-gbr/mitarbeiterin-kundenservice-social-media-berlin-74636,"SiPRi ist eine junge, schnell wachsende Sicherheitsmarke aus Deutschland. Wir entwickeln und vertreiben smarte Sicherheitsprodukte — von Alarm-Fahrradschlössern mit 120-dBAlarm über RFID-Schutz bis hin zu persönlichen Al"
raw-0180,2026-06-03,Arbeitnow API,Muxon,Lead Structural Analysis Engineer - Space,Software & Engineering,Engineering,Senior/Lead,Munich,professional / experienced,Recruitment; Automation; Testing; Python; Design,Engineering,97416,140184,118800,74.8,56,42.1,112,https://www.arbeitnow.com/jobs/companies/muxon/lead-structural-analysis-engineer-space-munich-488237,"Salary Transparency: This position is intended for candidates with more than 6 years of professional experience. The salary range varies depending on experience, between €90,000 and €110,000 gross per year. Work model: F"
raw-0181,2026-06-03,Arbeitnow API,Chapter Living GmbH,Marketing Manager/in: Schwerpunkt Immobilien & Markenauftritt,Marketing & Growth,Marketing and Communication,Senior/Lead,Berlin,,Communication; Social Media; Design,Marketing and Communication,66420,95580,81000,92.6,48,38.6,123,https://www.arbeitnow.com/jobs/companies/chapter-living-gmbh/marketing-manager-in-schwerpunkt-immobilien-markenauftritt-berlin-438800,"Wir suchen eine engagierte Teilzeitkraft (m/w/d) mit Schwerpunkt im Bereich Marketing, die unser Team im Bereich Immobilien und Markenauftritt unterstützt. In dieser Position bist du verantwortlich für die Entwicklung un"
raw-0182,2026-06-03,Arbeitnow API,Karriereweg GmbH,"Praktikum Automatisierung, Prozesse & KI in der Personalberatung",Marketing & Growth,Process Management,Internship/Student,Gelsenkirchen,"Internship, hilfstätigkeit / student",Sales; CRM,Process Management,27060,38940,33000,70.3,38,30.3,136,https://www.arbeitnow.com/jobs/companies/karriereweg-gmbh/praktikum-automatisierung-prozesse-ki-in-der-personalberatung-gelsenkirchen-317151,"Pflichtpraktikum ab 6 Monaten | Remote-first | Raum für eigene Projekte Du willst im Praktikum nicht nur mitlaufen, sondern eigene Ideen einbringen? Dann bist du bei Karriereweg richtig. Bei uns arbeitest du an echten Pr"
raw-0183,2026-06-03,Arbeitnow API,Karriereweg GmbH,Praktikum Digital Marketing in der Personalberatung,Marketing & Growth,Online Marketing,Internship/Student,Gelsenkirchen,"Internship, hilfstätigkeit / student",Design; Sales; SEO; CRM,Online Marketing,27060,38940,33000,70.6,38,30.3,136,https://www.arbeitnow.com/jobs/companies/karriereweg-gmbh/praktikum-digital-marketing-in-der-personalberatung-gelsenkirchen-363544,"Pflichtpraktikum ab 6 Monaten | Remote-first | Raum für eigene Projekte Du willst im Praktikum nicht nur mitlaufen, sondern eigene Ideen einbringen? Dann bist du bei Karriereweg richtig. Bei uns arbeitest du an echten Pr"
raw-0184,2026-06-03,Arbeitnow API,Particula,Senior Quantitative Risk Analyst (Digital Assets),Software & Engineering,Remote,Senior/Lead,Munich,,Research; Testing; Design,Remote; Credit Analysis,97416,140184,118800,73.7,48,38.6,123,https://www.arbeitnow.com/jobs/companies/particula/senior-quantitative-risk-analyst-digital-assets-munich-406069,"Hi, we are Particula, the leading rating provider for digital assets! Our mission? To make the market for digital assets more accessible, secure and transparent for institutional investors. We support issuers, trading fa"
raw-0185,2026-06-03,Arbeitnow API,Navius HR & Recruiting,E-Commerce & Performance Marketing Manager (m/w/d) @PIXLIP,Marketing & Growth,Online Marketing,Senior/Lead,Cologne,berufserfahren,Performance Marketing; Testing; Shopify; Design; SEO,Online Marketing,66420,95580,81000,63,48,38.6,123,https://www.arbeitnow.com/jobs/companies/navius-hr-recruiting/e-commerce-performance-marketing-manager-at-pixlip-cologne-119093,Die PIXLIP GmbH ist eines der innovativsten Unternehmen für modulare Leuchtrahmen- und Messestandlösungen in Europa. Mit unserem neuen KI-basierten Design-Tool und einer modernen Vertriebsstruktur schaffen wir völlig neu
raw-0186,2026-06-03,Arbeitnow API,Wavestone Germany AG,Lead Scrum Master – Level Chief (m/w/d) (Ref.Nr.: 46940),Software & Engineering,IT,Senior/Lead,Berlin,"Freelance, berufserfahren",Agile; Scrum,IT,97416,140184,118800,47,48,38.6,123,https://www.arbeitnow.com/jobs/companies/wavestone-germany-ag/lead-scrum-master-level-chief-refnr-46940-berlin-244233,"Wir suchen einen leitenden Scrum Master, um ein groß angelegtes Projekt zu unterstützen, das ein Netzregelungssystem der nächsten Generation für die Energiewende entwickelt. Hauptziel ist es, die agile Transformation vor"
raw-0187,2026-06-03,Arbeitnow API,Publik. Agentur für Kommunikation GmbH,Art Director / Kommunikationsdesigner (all genders),Marketing & Growth,Public Relations,Senior/Lead,Mannheim,berufserfahren,Communication; Social Media; Design; Figma,Public Relations; Corporate Communication,66420,95580,81000,82,48,38.6,123,https://www.arbeitnow.com/jobs/companies/publik-agentur-fur-kommunikation-gmbh/art-director-kommunikationsdesigner-all-genders-mannheim-6219,"Aus guten Ideen machst du starke Kommunikation? Publik ist eine inhabergeführte Agentur in Mannheim mit einem klaren Fokus: Wir machen Kommunikation, die wirkt – strategisch fundiert, kreativ umgesetzt und messbar erfolg"
raw-0188,2026-06-03,Arbeitnow API,Löwen Apotheke,Operations Manager Apotheken,Product & Project Management,Business Operations,Senior/Lead,Munich,,Operations,Business Operations,84132,121068,102600,90.5,48,38.6,123,https://www.arbeitnow.com/jobs/companies/lowen-apotheke/operations-manager-apotheken-munich-253874,"Du erkennst Chancen, bevor andere sie sehen, und bringst Projekte zum Abschluss? Dann gestalte mit uns die Zukunft unseres Apothekenverbunds. Wir suchen keine klassische Filialleitung, sondern eine unternehmerisch denken"
raw-0189,2026-06-03,Arbeitnow API,MultiBase GmbH,Marketing Operations Coordinator,Data & AI,Business Development,Mid-level,Gilching,professional / experienced,Content Strategy; Automation; Operations; Testing; Sales; CRM; AI,Business Development,69700,100300,85000,72.8,43,32.5,129,https://www.arbeitnow.com/jobs/companies/multibase-gmbh/marketing-operations-coordinator-gilching-395732,"Location Remote (European Time Zones) Start As soon as possible Type Full-time About MultiBase MultiBase is a specialist BI and analytics consulting firm. Founded in 1991, we've spent 35 years helping mid-sized DACH comp"
raw-0190,2026-06-03,Arbeitnow API,AISLER,"Software-Entwickler CAD/CAM (m/w/x) (Studentische Hilfskraft, 14h-20h)",Software & Engineering,Software Development,Internship/Student,Aachen,hilfstätigkeit / student,Python,Software Development,39688,57112,48400,98,46,33.8,125,https://www.arbeitnow.com/jobs/companies/aisler/software-entwickler-cad-cam-studentische-hilfskraft-14h-20h-aachen-104641,"Elektronik beherrscht unser Leben. Wir helfen denen, die sie entwickeln und zum Produkt machen. AISLER unterstützt mehr als 90.000 Elektro-Ingenieur:innen weltweit die Elektronikprodukte von Morgen zu entwickeln, indem w"
raw-0191,2026-06-03,Arbeitnow API,AISLER,"Software-Entwickler Plattform (m/w/x) (Studentische Hilfskraft, 14h-20h)",Software & Engineering,Software Development,Internship/Student,Aachen,hilfstätigkeit / student,Kubernetes,Software Development,39688,57112,48400,50.2,46,33.8,125,https://www.arbeitnow.com/jobs/companies/aisler/software-entwickler-plattform-studentische-hilfskraft-14h-20h-aachen-233513,"Elektronik beherrscht unser Leben. Wir helfen denen, die sie entwickeln und zum Produkt machen. AISLER unterstützt mehr als 90.000 Elektro-Ingenieur:innen weltweit die Elektronikprodukte von Morgen zu entwickeln, indem w"
raw-0192,2026-06-03,Arbeitnow API,hey contact heroes GmbH,Junior Projektmanager (m/w/d) im Home Office,Product & Project Management,Remote,Senior/Lead,Hamburg,,Project Management; Customer Service; Operations,Remote; Project Management,84132,121068,102600,66.5,48,38.6,123,https://www.arbeitnow.com/jobs/companies/hey-contact-heroes-gmbh/junior-projektmanager-im-home-office-hamburg-456973,"Steig‘ ein bei der Nummer eins der “work at home”-Dienstleister am Markt – den hey contact heroes! Wir haben uns auf die Fahne geschrieben, sowohl all unsere heroes (unsere Kolleg*innen) als auch unsere Auftraggeber jede"
raw-0193,2026-06-03,Arbeitnow API,hubside - Die Recruitingwerkstatt,Cyber Security Analyst (m/w/d),Software & Engineering,IT,Mid-level,Munich,berufserfahren,Security; Python,IT,72160,103840,88000,84.8,54,37.2,115,https://www.arbeitnow.com/jobs/companies/hubside-die-recruitingwerkstatt/cyber-security-analyst-munich-466420,"Als Cyber Security Analyst (m/w/d) übernehmen Sie eine zentrale Rolle bei der Überwachung, Analyse und Weiterentwicklung der Informationssicherheit. Sie verbinden fundiertes technisches Know-how mit einem ausgeprägten Ve"
raw-0194,2026-06-03,Arbeitnow API,hey contact heroes GmbH,Freelancer als Agent/in (m/w/d) im Mobilfunk Inbound - EU only - Deutsch - 100% Remote,HR & Recruitment,Remote,Unspecified,Berlin,Freelance,Customer Service,Remote; Customer Service,42246,60794,51520,55.2,38,30.3,136,https://www.arbeitnow.com/jobs/companies/hey-contact-heroes-gmbh/freelancer-als-agent-in-im-mobilfunk-inbound-eu-only-deutsch-100-remote-berlin-183597,Kennst du schon die hey contact heroes? Noch nicht? Dann wird’s Zeit! Die hey contact heroes stehen für echte Innovationen im Kundenservice! Wir haben uns auf die Bereitstellung erstklassiger Kundenservice-Lösungen spezi
raw-0195,2026-06-03,Arbeitnow API,Vino Digital,Freelance Shopify Shopbuilder Webdesigner:in (w/m/d) für Weinbranche,Software & Engineering,Remote,Mid-level,Berlin,"Freelance, berufserfahren",Frontend; Shopify; Git,Remote; Online Marketing,72160,103840,88000,60.6,38,30.3,136,https://www.arbeitnow.com/jobs/companies/vino-digital/freelance-shopify-shopbuilder-webdesignerin-fur-weinbranche-berlin-455402,"Hi, wir sind Vino Digital. Wir sind die E-Commerce-Agentur für Winzer und bringen unsere Partnerweingüter mit Shopify nach vorne. Für unsere wachsende Zahl an Shop-Projekten suchen wir feste Freelance-Unterstützung, die "
raw-0196,2026-06-03,Arbeitnow API,brandung GmbH,Data & Web Analyst (m/w/d),Data & AI,Marketing and Communication,Mid-level,Cologne,berufserfahren,Communication; Machine Learning; Data Analytics; Power BI; SQL; API; AI,Marketing and Communication,69700,100300,85000,69.6,59,39.4,108,https://www.arbeitnow.com/jobs/companies/brandung-gmbh/data-web-analyst-cologne-474463,"Dein Spielfeld Strategie &#x26; Beratung : Du entwickelst ganzheitliche Data &#x26; Analytics Strategien und KPI Frameworks. Du berätst Kund:innen zu CDP Lösungen, Customer Journeys und datengestützten Use Cases. Du leit"
raw-0197,2026-06-03,Arbeitnow API,Bolt Technology,"Senior Software Engineer, Data Platform Insights",Software & Engineering,Unspecified,Senior/Lead,"Berlin, Berlin, Germany",,Kubernetes; Testing; Python; CI/CD; AWS,,97416,140184,118800,66.5,72,49,91,https://www.arbeitnow.com/jobs/companies/bolt-technology/senior-software-engineer-data-platform-insights-berlin-483929,&lt;gh-intro&gt; &lt;text&gt; We're looking for a Senior Software Engineer to join Bolt's Data Platform Insights team. You'll build and evolve the platform that helps Bolt teams create and manage high-quality data produc
raw-0198,2026-06-03,Arbeitnow API,Bolt Technology,Senior Design System Engineer,Software & Engineering,Unspecified,Senior/Lead,"Berlin, Germany",,Design; Figma,,97416,140184,118800,71.6,48,38.6,123,https://www.arbeitnow.com/jobs/companies/bolt-technology/senior-design-system-engineer-berlin-194158,&lt;gh-intro&gt; &lt;text&gt; We're looking for a Senior Design System Engineer to take ownership of the technical architecture of our multi-platform design system. You'll work directly with design system designers and p
raw-0199,2026-06-03,Arbeitnow API,Flix,Senior Full-Stack Engineer (m/f/d) - Station Management & Inventory,Software & Engineering,Unspecified,Senior/Lead,"Berlin, Berlin, Germany",,Communication; Kubernetes; Automation; Operations; Frontend; Backend; Testing; Docker; Design; Azure; Cloud; CI/CD,,97416,140184,118800,72.1,64,45.5,102,https://www.arbeitnow.com/jobs/companies/flix/senior-full-stack-engineer-station-management-inventory-berlin-166995,We are looking for a motivated and curious Senior Full-Stack Engineer (Java/Kotlin) &nbsp;to&nbsp;join our team&nbsp;in&nbsp;Supply&nbsp;Division&nbsp;and drive customer station experience to the next level! &nbsp; In an
raw-0200,2026-06-03,Arbeitnow API,hubside - Die Recruitingwerkstatt,Senior Systemadministrator (m/w/d) Fokus Paketierung SCCM PSDAT,Software & Engineering,IT,Senior/Lead,Munich,berufserfahren,Security; Azure,IT,97416,140184,118800,60.2,64,45.5,102,https://www.arbeitnow.com/jobs/companies/hubside-die-recruitingwerkstatt/senior-systemadministrator-fokus-paketierung-sccm-psdat-munich-237150,Sie möchten moderne Enterprise-Client-Umgebungen aktiv gestalten und stabile sowie effiziente Windows-Arbeitsplätze weiterentwickeln? In dieser Position als Senior Systemadministrator (m/w/d) Enterprise Client Management
raw-0201,2026-06-03,Arbeitnow API,Wavestone Germany AG,Cloud-Infrastruktur-Experte (m/w/d) (Ref.Nr.: 46899),Product & Project Management,IT,Mid-level,Munich,"Freelance, berufserfahren",Cloud; AWS; AI,IT,62320,89680,76000,88.8,54,37.2,115,https://www.arbeitnow.com/jobs/companies/wavestone-germany-ag/cloud-infrastruktur-experte-refnr-46899-munich-419287,Wir suchen für ein innovatives Projekt im Bereich KI-Assistenzsysteme einen Cloud-Infrastruktur Experten zur Unterstützung beim Aufbau und Management einer AWS-basierten Umgebung. Key Facts Start: 15.06.2026 Dauer: Nicht
raw-0202,2026-06-03,Arbeitnow API,haebmau AG,Head of Growth (m/w/d),Marketing & Growth,Marketing and Communication,Senior/Lead,Munich,berufserfahren,Communication; Stakeholder Management; Social Media; Research; Sales; CRM,Marketing and Communication,66420,95580,81000,71.8,48,38.6,123,https://www.arbeitnow.com/jobs/companies/haebmau-ag/head-of-growth-munich-229757,"Beschreibung Als Head of Growth bei haebmau übernimmst du den Lead für New Business Development, Sales und die Entwicklung zukunfts­fähiger Services der Agentur. Gemeinsam mit den Kunden-Units und deinem Growth-Team trei"
raw-0203,2026-06-03,Arbeitnow API,hubside - Die Recruitingwerkstatt,IT M365 Spezialist (m/w/d),Cybersecurity & IT,IT,Mid-level,Munich,berufserfahren,Security; Cloud; SQL,IT,65600,94400,80000,74.9,59,39.4,108,https://www.arbeitnow.com/jobs/companies/hubside-die-recruitingwerkstatt/it-m365-spezialist-munich-180114,"Sie sind erfahren in komplexen Microsoft-Umgebungen und möchten IT-Infrastrukturen nicht nur betreiben, sondern aktiv weiterentwickeln? Dann könnte diese Position als IT M365 Spezialist (m/w/d) genau das Richtige für Sie"
raw-0204,2026-06-03,The Muse API,Sonepar USA Inc,Warehouse Associate,Product & Project Management,Retail,Unspecified,"Baytown, TX",external,AI; Customer Service; Communication; Sales,Retail; Mid Level,57334,82506,69920,86.1,38,30.3,136,https://www.themuse.com/jobs/soneparusainc/warehouse-associate-db87a1,"There's a Place for You at Summit Electric Supply. A career at Summit Electric Supply is more than a job. You're investing in a brighter, more sustainable future together and joining a team that makes a real difference f"
raw-0205,2026-06-02,Remotive API,Coalition Technologies,Copywriter,Software & Engineering,Writing,Unspecified,Worldwide,freelance,Data Analysis; Accounting; Research; Excel; Go; Advertising; Finance; SEO,accounting; excel; research; data analysis; bookkeeping; google sheets; quickbooks; data entry; insurance; G Suite,66387,95533,80960,56,38,30.3,136,https://remotive.com/remote-jobs/writing/copywriter-1749306,"WHO WE'RE LOOKING FOR The ideal copywriter has excellent English writing skills and is excited to write high-quality, SEO-driven content that aligns with detailed, client-specific guidelines. Projects most commonly inclu"
raw-0206,2026-06-02,The Muse API,JPMorgan Chase,"Part Time (20 Hours) Associate Banker, Buenaventura Lakes Branch, Kissimmee, FL",Product & Project Management,Unknown,Unspecified,"Kissimmee, FL",external,Operations,Unknown; Mid Level,57334,82506,69920,90.1,38,30.3,136,https://www.themuse.com/jobs/jpmorganchase/part-time-20-hours-associate-banker-buenaventura-lakes-branch-kissimmee-fl-253417,"At Chase, we are passionate about creating memorable experiences for our clients and employees, making them feel welcomed, valued, and understood. We build lasting relationships by doing the right thing, exceeding expect"
raw-0207,2026-06-02,Remotive API,LawnStarter,"Staff Software Engineer, Product (Belo Horizonte)",Data & AI,Software Development,Senior/Lead,Brazil,full_time,Marketplace; TypeScript; Frontend; Security; Backend; AI/ML; React; UI/UX; REST; AWS; Git; AI,AWS; backend; frontend; php; react; security; UI/UX; AI/ML; jira; react native; documentation; laravel; Typescript; people management; prototyping; engineering management; marketplace; github; REST; datadog,94095,135405,114750,67.3,77,51.1,85,https://remotive.com/remote-jobs/software-development/staff-software-engineer-product-belo-horizonte-2090910,"This is a remote role for candidates located in Belo Horizonte, Brazil About LawnStarter LawnStarter is the nation's leading on-demand marketplace for lawn care and outdoor services, with over $100M in annual bookings. W"
raw-0208,2026-06-02,Remotive API,LawnStarter,"Staff Software Engineer, Product (Florianópolis)",Data & AI,Software Development,Senior/Lead,Brazil,full_time,Marketplace; TypeScript; Frontend; Security; Backend; AI/ML; React; UI/UX; REST; AWS; Git; AI,AWS; backend; frontend; php; react; security; UI/UX; AI/ML; jira; react native; documentation; laravel; Typescript; people management; prototyping; engineering management; marketplace; github; REST; datadog,94095,135405,114750,67.3,77,51.1,85,https://remotive.com/remote-jobs/software-development/staff-software-engineer-product-florianopolis-2090911,"This is a remote role for candidates located in Florianópolis, Brazil About LawnStarter LawnStarter is the nation's leading on-demand marketplace for lawn care and outdoor services, with over $100M in annual bookings. We"
