job_id,date_posted,source,company,title,category,raw_category,seniority,location,job_type,skills,tags_raw,salary_min_usd,salary_max_usd,salary_mid_usd,demand_index,scarcity_score,time_to_fill_days_proxy,application_volume_proxy,source_url,description_preview
raw-0169,2026-06-03,Arbeitnow API,Kevin Kehr,"Werkstudent (m/w/d) – Finance & Beratung (unternehmerisch, leistungsbasiert)",Finance & Business,Finance,Internship/Student,Hamburg,"Full-time permanent, entry",Finance; Onboarding,Finance; high school or equivalent,30668,44132,37400,73.5,38,30.3,136,https://www.arbeitnow.com/jobs/companies/kevin-kehr/werkstudent-finance-beratung-unternehmerisch-leistungsbasiert-hamburg-34063,"Du studierst und willst mehr als einen „Nebenjob“? Du willst Verantwortung, klare Ziele und ein Umfeld, in dem Leistung zählt? Dann ist diese Werkstudentenrolle dein Einstieg in die Finanzberatung, mit strukturiertem Onb"
raw-0170,2026-06-03,Arbeitnow API,A-LEVEL,Team Lead / Head of Online Marketing für stark wachsende Online Marketing Agentur,Data & AI,Management,Senior/Lead,Wiesbaden,,Operations; AI,Management; Team Leader,94095,135405,114750,99.2,53,40.8,116,https://www.arbeitnow.com/jobs/companies/a-level/team-lead-head-of-online-marketing-fur-stark-wachsende-online-marketing-agentur-wiesbaden-466856,"Du willst nicht nur beraten, sondern bauen? Du denkst strategisch, packst aber operativ selbst mit an? Dann ist das deine Chance, gemeinsam mit dem Gründer von 100 Marketing und unserem Kunden Joel eine auf Private-Equit"
raw-0171,2026-06-03,Arbeitnow API,Intermate Media GmbH,Senior Projektmanager:in für Beiersdorf - Social Media und Influencer Marketing (gn),Software & Engineering,Marketing and Communication,Senior/Lead,Berlin,berufserfahren,Communication; Social Media; Onboarding; Video Editing,Marketing and Communication,97416,140184,118800,79.1,48,38.6,123,https://www.arbeitnow.com/jobs/companies/intermate-media-gmbh/senior-projektmanagerin-fur-beiersdorf-social-media-und-influencer-marketing-gn-berlin-381308,"Jobbeschreibung Intermate x SAMY – Shaping the State of Social Intermate gehört zu den größten Social-Media- und Influencer-Agenturen im DACH-Raum. Mit mehr als 250 Mates in Berlin, Hamburg, Köln und Remote entwickeln wi"
raw-0172,2026-06-03,Arbeitnow API,SumUp,Senior Data Scientist,Data & AI,Unspecified,Senior/Lead,"Berlin, Berlin, Germany",,Data Engineering; Machine Learning; Communication; Data Science; Operations; Testing; Python; Design; AI,,94095,135405,114750,80.8,77,51.1,85,https://www.arbeitnow.com/jobs/companies/sumup/senior-data-scientist-berlin-257581,"Team description The AI AML Engineering Squad sits at the intersection of machine learning and financial crime prevention, building the data products and ML systems that keep SumUp's transaction monitoring effective and "
raw-0173,2026-06-03,Arbeitnow API,Taxtalente.de,"Steuerberater (m/w/d) in Hamburg, auf Wunsch mit Partnerperspektive, gesucht - mindestens 90.000€",Software & Engineering,Directors,Unspecified,Hamburg,,Python; JavaScript; API; Cloud,Directors; Chief Executives,66387,95533,80960,96.8,62,40.7,104,https://www.arbeitnow.com/jobs/companies/taxtalentede/steuerberater-in-hamburg-auf-wunsch-mit-partnerperspektive-gesucht-mindestens-90000eur-122507,TaxTalente ist die Nr. 1 Job-Matching Plattform für Jobsuchende in der Steuerberatung. Sie suchen eine positive berufliche Veränderung? Sie möchten den nächsten Schritt in Ihrer Karriere gehen und streben möglicherweise 
raw-0174,2026-06-03,Arbeitnow API,Taxtalente.de,"Steuerberater (m/w/d) in Neuenstein, auf Wunsch mit Partnerperspektive, gesucht - mindestens 90.000€",Software & Engineering,Directors,Unspecified,Neuenstein,,Python; JavaScript; API; Cloud,Directors; Chief Executives,66387,95533,80960,96.8,62,40.7,104,https://www.arbeitnow.com/jobs/companies/taxtalentede/steuerberater-in-neuenstein-auf-wunsch-mit-partnerperspektive-gesucht-mindestens-90000eur-199034,TaxTalente ist die Nr. 1 Job-Matching Plattform für Jobsuchende in der Steuerberatung. Sie suchen eine positive berufliche Veränderung? Sie möchten den nächsten Schritt in Ihrer Karriere gehen und streben möglicherweise 
raw-0175,2026-06-03,Arbeitnow API,Taxtalente.de,"Steuerberater (m/w/d) in Rhens, auf Wunsch mit Partnerperspektive, gesucht - mindestens 90.000€",Software & Engineering,Directors,Unspecified,Rhens,,Python; JavaScript; API; Cloud,Directors; Chief Executives,66387,95533,80960,96.8,62,40.7,104,https://www.arbeitnow.com/jobs/companies/taxtalentede/steuerberater-in-rhens-auf-wunsch-mit-partnerperspektive-gesucht-mindestens-90000eur-314497,TaxTalente ist die Nr. 1 Job-Matching Plattform für Jobsuchende in der Steuerberatung. Sie suchen eine positive berufliche Veränderung? Sie möchten den nächsten Schritt in Ihrer Karriere gehen und streben möglicherweise 
raw-0176,2026-06-03,Arbeitnow API,Taxtalente.de,"Steuerberater (m/w/d) in Pockau-Lengefeld, auf Wunsch mit Partnerperspektive, gesucht - mindestens 90.000€",Software & Engineering,Directors,Unspecified,Pockau-Lengefeld,,Python; JavaScript; API; Cloud,Directors; Chief Executives,66387,95533,80960,96.8,62,40.7,104,https://www.arbeitnow.com/jobs/companies/taxtalentede/steuerberater-in-pockau-lengefeld-auf-wunsch-mit-partnerperspektive-gesucht-mindestens-90000eur-16046,TaxTalente ist die Nr. 1 Job-Matching Plattform für Jobsuchende in der Steuerberatung. Sie suchen eine positive berufliche Veränderung? Sie möchten den nächsten Schritt in Ihrer Karriere gehen und streben möglicherweise 
raw-0177,2026-06-03,Arbeitnow API,Taxtalente.de,"Steuerberater (m/w/d) in Zaisenhausen, auf Wunsch mit Partnerperspektive, gesucht - mindestens 90.000€",Software & Engineering,Directors,Unspecified,Zaisenhausen,,Python; JavaScript; API; Cloud,Directors; Chief Executives,66387,95533,80960,96.8,62,40.7,104,https://www.arbeitnow.com/jobs/companies/taxtalentede/steuerberater-in-zaisenhausen-auf-wunsch-mit-partnerperspektive-gesucht-mindestens-90000eur-50386,TaxTalente ist die Nr. 1 Job-Matching Plattform für Jobsuchende in der Steuerberatung. Sie suchen eine positive berufliche Veränderung? Sie möchten den nächsten Schritt in Ihrer Karriere gehen und streben möglicherweise 
raw-0178,2026-06-03,Arbeitnow API,Taxtalente.de,"Steuerberater (m/w/d) in Hergatz, auf Wunsch mit Partnerperspektive, gesucht - mindestens 90.000€",Software & Engineering,Directors,Unspecified,Hergatz,,Python; JavaScript; API; Cloud,Directors; Chief Executives,66387,95533,80960,96.8,62,40.7,104,https://www.arbeitnow.com/jobs/companies/taxtalentede/steuerberater-in-hergatz-auf-wunsch-mit-partnerperspektive-gesucht-mindestens-90000eur-233014,TaxTalente ist die Nr. 1 Job-Matching Plattform für Jobsuchende in der Steuerberatung. Sie suchen eine positive berufliche Veränderung? Sie möchten den nächsten Schritt in Ihrer Karriere gehen und streben möglicherweise 
raw-0179,2026-06-03,Arbeitnow API,Taxtalente.de,"Steuerberater (m/w/d) in Zweibrücken, auf Wunsch mit Partnerperspektive, gesucht - mindestens 90.000€",Software & Engineering,Directors,Unspecified,Zweibrücken,,Python; JavaScript; API; Cloud,Directors; Chief Executives,66387,95533,80960,96.8,62,40.7,104,https://www.arbeitnow.com/jobs/companies/taxtalentede/steuerberater-in-zweibrucken-auf-wunsch-mit-partnerperspektive-gesucht-mindestens-90000eur-419465,TaxTalente ist die Nr. 1 Job-Matching Plattform für Jobsuchende in der Steuerberatung. Sie suchen eine positive berufliche Veränderung? Sie möchten den nächsten Schritt in Ihrer Karriere gehen und streben möglicherweise 
raw-0180,2026-06-03,Arbeitnow API,Taxtalente.de,"Steuerberater (m/w/d) in Tiefenbronn, auf Wunsch mit Partnerperspektive, gesucht - mindestens 90.000€",Software & Engineering,Directors,Unspecified,Tiefenbronn,,Python; JavaScript; API; Cloud,Directors; Chief Executives,66387,95533,80960,96.8,62,40.7,104,https://www.arbeitnow.com/jobs/companies/taxtalentede/steuerberater-in-tiefenbronn-auf-wunsch-mit-partnerperspektive-gesucht-mindestens-90000eur-133928,TaxTalente ist die Nr. 1 Job-Matching Plattform für Jobsuchende in der Steuerberatung. Sie suchen eine positive berufliche Veränderung? Sie möchten den nächsten Schritt in Ihrer Karriere gehen und streben möglicherweise 
raw-0181,2026-06-03,Arbeitnow API,BC Deutschland GmbH,Personalreferent / HR Officer (m/w/d),Product & Project Management,HR,Mid-level,Ennepetal,berufserfahren,HR,HR,62320,89680,76000,70.7,38,30.3,136,https://www.arbeitnow.com/jobs/companies/bc-deutschland-gmbh/personalreferent-hr-officer-ennepetal-112064,"Gestalten Sie die Zukunft der Verbindungstechnik mit uns! Die BC Deutschland GmbH, ein führender Spezialist für Verbindungstechnik und Teil der renommierten Cooper Turner Beck Gruppe, sucht Verstärkung für ihr Team. Mit "
raw-0182,2026-06-03,Arbeitnow API,Lionflence,Junior Artist Manager / Influencer Manager (m/w/d),Software & Engineering,Marketing and Communication,Senior/Lead,Mülheim,,Communication; Social Media,Marketing and Communication,97416,140184,118800,96.4,48,38.6,123,https://www.arbeitnow.com/jobs/companies/lionflence/junior-artist-manager-influencer-manager-mulheim-246679,"Was wir Dir bieten: Eine spannende Herausforderung, in der du dich weiterentwickeln kannst, rundum den Bereich Artistmanagement Medien/Social Media, Influencer Marketing und den dazugehörigen Technologien (Software Syste"
raw-0183,2026-06-03,Arbeitnow API,Lionflence,Junior Artist Manager / Influencer Manager (m/w/d),Software & Engineering,Marketing and Communication,Senior/Lead,Berlin,,Communication; Social Media,Marketing and Communication,97416,140184,118800,96.4,48,38.6,123,https://www.arbeitnow.com/jobs/companies/lionflence/junior-artist-manager-influencer-manager-berlin-182106,"Was wir Dir bieten: Eine spannende Herausforderung, in der du dich weiterentwickeln kannst, rundum den Bereich Artistmanagement Medien/Social Media, Influencer Marketing und den dazugehörigen Technologien (Software Syste"
raw-0184,2026-06-03,Arbeitnow API,Lionflence,Artist Manager / Influencer Manager (m/w/d) BERLIN,Software & Engineering,Marketing and Communication,Senior/Lead,Berlin,,Communication; Social Media,Marketing and Communication,97416,140184,118800,96.4,48,38.6,123,https://www.arbeitnow.com/jobs/companies/lionflence/artist-manager-influencer-manager-berlin-239192,"Was wir Dir bieten: Eine spannende Herausforderung, in der du dich weiterentwickeln kannst, rundum den Bereich Artistmanagement Medien/Social Media, Influencer Marketing und den dazugehörigen Technologien (Software Syste"
raw-0185,2026-06-03,Arbeitnow API,Lionflence,Trainee Artist Manager / Influencer Manager (m/w/d),Software & Engineering,Training,Internship/Student,Berlin,hilfstätigkeit / student,AI; Social Media,Training; Development,39688,57112,48400,91.6,38,30.3,136,https://www.arbeitnow.com/jobs/companies/lionflence/trainee-artist-manager-influencer-manager-berlin-485665,"Was wir Dir bieten: Eine spannende Herausforderung, in der du dich weiterentwickeln kannst, rundum den Bereich Artistmanagement Medien/Social Media, Influencer Marketing und den dazugehörigen Technologien (Software Syste"
raw-0186,2026-06-03,Arbeitnow API,Lionflence,Trainee Artist Manager / Influencer Manager (m/w/d),Software & Engineering,Training,Internship/Student,Mülheim,hilfstätigkeit / student,AI; Social Media,Training; Development,39688,57112,48400,91.6,38,30.3,136,https://www.arbeitnow.com/jobs/companies/lionflence/trainee-artist-manager-influencer-manager-mulheim-36570,"Was wir Dir bieten: Eine spannende Herausforderung, in der du dich weiterentwickeln kannst, rundum den Bereich Artistmanagement Medien/Social Media, Influencer Marketing und den dazugehörigen Technologien (Software Syste"
raw-0187,2026-06-03,Arbeitnow API,Lionflence,Artist Manager / Influencer Manager (m/w/d),Software & Engineering,Marketing and Communication,Senior/Lead,Mülheim,,Communication; Social Media,Marketing and Communication,97416,140184,118800,96.4,48,38.6,123,https://www.arbeitnow.com/jobs/companies/lionflence/artist-manager-influencer-manager-mulheim-175123,"Was wir Dir bieten: Eine spannende Herausforderung, in der du dich weiterentwickeln kannst, rundum den Bereich Artistmanagement Medien/Social Media, Influencer Marketing und den dazugehörigen Technologien (Software Syste"
raw-0188,2026-06-03,Arbeitnow API,coni+partner AG,Referent COREP-Meldewesen,Software & Engineering,Controlling,Mid-level,Frankfurt am Main,berufserfahren,Finance; Excel,Controlling,72160,103840,88000,77,38,30.3,136,https://www.arbeitnow.com/jobs/companies/conipartner-ag/referent-corep-meldewesen-frankfurt-am-main-178491,"coni + partner ist ein seit 1993 bestehendes Beratungshaus mit Sitz in Zürich und Niederlassungen in Düsseldorf und Shanghai. Unsere Stärke ist die passgenaue Besetzung von Positionen entsprechend der Unternehmenskultur,"
raw-0189,2026-06-03,Arbeitnow API,Eggersmann - Gruppe,Kaufmännischer Mitarbeiter (m/w/d) für Buchhaltung / Büromanagement in Teilzeit,Software & Engineering,Finance,Unspecified,Ibbenbüren,,Finance; ERP,Finance,66387,95533,80960,68,38,30.3,136,https://www.arbeitnow.com/jobs/companies/eggersmann-gruppe/kaufmannischer-mitarbeiter-fur-buchhaltung-buromanagement-in-teilzeit-ibbenburen-406649,"Die BRT HARTNER GmbH ist ein international tätiges Unternehmen mit rund 30 Jahren Erfahrung in der Planung, Produktion und dem Vertrieb von maßgeschneiderten Sondermaschinen in der Sortier- und Recyclingindustrie. Das Un"
raw-0190,2026-06-03,Arbeitnow API,Lucid Labs,Founding Product Manager - KI-Agenten-Plattform (m/w/d),Software & Engineering,Product Management,Senior/Lead,Berlin,,Product Management; Design,Product Management,97416,140184,118800,73.5,48,38.6,123,https://www.arbeitnow.com/jobs/companies/lucid-labs/founding-product-manager-ki-agenten-plattform-berlin-105108,"Das Problem Mittelständische Unternehmen treffen jeden Tag hunderte kleine Entscheidungen. Freigaben, Zuordnungen, Nachverfolgungen. Einzeln nicht komplex, aber in Summe fressen sie ganze Arbeitstage. Klassische Automati"
raw-0191,2026-06-03,Arbeitnow API,admins4bit GmbH,Fachinformatiker für Systemintegration,Cybersecurity & IT,System and Network Administration,Unspecified,Meerbusch,,Security; Cloud,System and Network Administration,60352,86848,73600,88,59,39.4,108,https://www.arbeitnow.com/jobs/companies/admins4bit-gmbh/fachinformatiker-fur-systemintegration-meerbusch-333520,"Deine Rolle Du hast mindestens 5 Jahre Erfahrung im IT-Betrieb und willst mehr als nur Tickets abarbeiten? Bei uns betreust du Kundenumgebungen, entwickelst Systeme weiter und arbeitest aktiv an IT-Projekten. Aufgaben Be"
raw-0192,2026-06-03,The Muse API,Sonepar USA Inc,Warehouse Associate,Product & Project Management,Retail,Unspecified,"Baytown, TX",external,AI; Customer Service; Communication; Sales,Retail; Mid Level,57334,82506,69920,90.1,38,30.3,136,https://www.themuse.com/jobs/soneparusainc/warehouse-associate-db87a1,"There's a Place for You at Summit Electric Supply. A career at Summit Electric Supply is more than a job. You're investing in a brighter, more sustainable future together and joining a team that makes a real difference f"
raw-0193,2026-06-02,Arbeitnow API,Flix,Working Student - Network Planning (m/f/d),Software & Engineering,Unspecified,Internship/Student,"Berlin, Berlin, Germany",,Communication; Backend; Excel; Spark; Sales,,39688,57112,48400,79.5,46,33.8,125,https://www.arbeitnow.com/jobs/companies/flix/working-student-network-planning-berlin-346087,"At Flix, we offer a dynamic work environment with competitive pay, strong growth opportunities, and a tech-driven approach to making travel more accessible, sustainable, and affordable. We're looking for a motivated and "
raw-0194,2026-06-02,Arbeitnow API,KU Europe GmbH,Conversion Rate Optimization (CRO) Specialist|| A/B Tester,Data & AI,Remote,Mid-level,Mülheim,"Freelance, professional / experienced",Google Analytics; Testing; Design,Remote; Quality Assurance; Inspection,69700,100300,85000,69.2,43,32.5,129,https://www.arbeitnow.com/jobs/companies/ku-europe-gmbh/conversion-rate-optimization-cro-specialist-a-b-tester-mulheim-265824,"100% Remote | Full-Time (40 Hours per Week) | Independent Contractor Compensation: Competitive compensation based on skills, experience, and proven results. Important: Applicants must reside outside of Germany and must s"
raw-0195,2026-06-02,Arbeitnow API,Boardwise GmbH,Werkstudent Technical Success Manager (TSM) (m/w/d),Software & Engineering,Remote,Internship/Student,Berlin,"Internship, hilfstätigkeit / student",Customer Service; Backend; Azure,Remote; Customer Service,39688,57112,48400,63.7,54,37.2,115,https://www.arbeitnow.com/jobs/companies/boardwise-gmbh/werkstudent-technical-success-manager-tsm-berlin-161485,"Deine Aufgaben Unterstützung des Technical Success Managers im Tagesgeschäft Pflege und Verwaltung administrativer Prozesse (Projekt-Zeiterfassung, Ticket System (Backend, Reporting)) Unterstützung beim Zeiterfassungsman"
raw-0196,2026-06-02,Arbeitnow API,SumUp,Senior Platform Engineer - Contact Centre,Software & Engineering,Unspecified,Senior/Lead,"Berlin, Berlin, Germany",,Communication; JavaScript; Automation; Operations; Design; API; AI,,97416,140184,118800,92.4,56,42.1,112,https://www.arbeitnow.com/jobs/companies/sumup/senior-platform-engineer-contact-centre-berlin-263066,"Our contact centre platform is what keeps merchant support running across all of SumUp's global markets, handling thousands of interactions every day across the globe. As our Senior Platform Engineer, you'll own the tech"
raw-0197,2026-06-02,Arbeitnow API,SumUp,Backend Engineer - POS,Data & AI,Unspecified,Unspecified,"Berlin, Berlin, Germany",,Kubernetes; Backend; Design; Cloud; CI/CD; Sales; AWS; AI,,64124,92276,78200,79.4,75,46.3,88,https://www.arbeitnow.com/jobs/companies/sumup/backend-engineer-pos-berlin-46044,"SumUp's Point-of-Sale (POS) solution empowers cafes, shops, bars, hair salons, and other businesses to operate efficiently and grow. It offers a wide range of features, including product catalogs, inventory management, b"
raw-0198,2026-06-02,Arbeitnow API,OPTO-MST Sensoren und Systeme GmbH,Head of Operations (m/w/d),Product & Project Management,Management,Senior/Lead,Erfurt,,Operations; ERP,Management; Team Leader,84132,121068,102600,76.8,48,38.6,123,https://www.arbeitnow.com/jobs/companies/opto-mst-sensoren-und-systeme-gmbh/head-of-operations-erfurt-26694,"Die OPTO-MST Sensoren und Systeme GmbH entwickelt und produziert optische Sensor- und Systemlösungen für die präzise Laser-Detektion, -Erkennung und das Laser-Tracking. Unsere Technologien kommen in anspruchsvollen Anwen"
raw-0199,2026-06-02,Remotive API,Coalition Technologies,Copywriter,Software & Engineering,Writing,Unspecified,Worldwide,freelance,Data Analysis; Accounting; Research; Excel; Go; Advertising; Finance; SEO,accounting; excel; research; data analysis; bookkeeping; google sheets; quickbooks; data entry; insurance; G Suite,66387,95533,80960,58.3,38,30.3,136,https://remotive.com/remote-jobs/writing/copywriter-1749306,"WHO WE'RE LOOKING FOR The ideal copywriter has excellent English writing skills and is excited to write high-quality, SEO-driven content that aligns with detailed, client-specific guidelines. Projects most commonly inclu"
raw-0200,2026-06-02,The Muse API,JPMorgan Chase,"Part Time (20 Hours) Associate Banker, Buenaventura Lakes Branch, Kissimmee, FL",Product & Project Management,Unknown,Unspecified,"Kissimmee, FL",external,Operations,Unknown; Mid Level,57334,82506,69920,98.3,38,30.3,136,https://www.themuse.com/jobs/jpmorganchase/part-time-20-hours-associate-banker-buenaventura-lakes-branch-kissimmee-fl-253417,"At Chase, we are passionate about creating memorable experiences for our clients and employees, making them feel welcomed, valued, and understood. We build lasting relationships by doing the right thing, exceeding expect"
raw-0201,2026-06-02,Remotive API,LawnStarter,"Staff Software Engineer, Product (Belo Horizonte)",Data & AI,Software Development,Senior/Lead,Brazil,full_time,Marketplace; TypeScript; Frontend; Security; Backend; AI/ML; React; UI/UX; REST; AWS; Git; AI,AWS; backend; frontend; php; react; security; UI/UX; AI/ML; jira; react native; documentation; laravel; Typescript; people management; prototyping; engineering management; marketplace; github; REST; datadog,94095,135405,114750,69.1,77,51.1,85,https://remotive.com/remote-jobs/software-development/staff-software-engineer-product-belo-horizonte-2090910,"This is a remote role for candidates located in Belo Horizonte, Brazil About LawnStarter LawnStarter is the nation's leading on-demand marketplace for lawn care and outdoor services, with over $100M in annual bookings. W"
raw-0202,2026-06-02,Remotive API,LawnStarter,"Staff Software Engineer, Product (Florianópolis)",Data & AI,Software Development,Senior/Lead,Brazil,full_time,Marketplace; TypeScript; Frontend; Security; Backend; AI/ML; React; UI/UX; REST; AWS; Git; AI,AWS; backend; frontend; php; react; security; UI/UX; AI/ML; jira; react native; documentation; laravel; Typescript; people management; prototyping; engineering management; marketplace; github; REST; datadog,94095,135405,114750,69.1,77,51.1,85,https://remotive.com/remote-jobs/software-development/staff-software-engineer-product-florianopolis-2090911,"This is a remote role for candidates located in Florianópolis, Brazil About LawnStarter LawnStarter is the nation's leading on-demand marketplace for lawn care and outdoor services, with over $100M in annual bookings. We"
raw-0203,2026-06-02,Remotive API,LawnStarter,"Staff Software Engineer, Product (Porto Alegre)",Data & AI,Software Development,Senior/Lead,Brazil,full_time,Marketplace; TypeScript; Frontend; Security; Backend; AI/ML; React; UI/UX; REST; AWS; Git; AI,AWS; backend; frontend; php; react; security; UI/UX; AI/ML; jira; react native; documentation; laravel; Typescript; people management; prototyping; engineering management; marketplace; github; REST; datadog,94095,135405,114750,69.1,77,51.1,85,https://remotive.com/remote-jobs/software-development/staff-software-engineer-product-porto-alegre-2090909,"This is a remote role for candidates located in Porto Alegre, Brazil. About LawnStarter LawnStarter is the nation's leading on-demand marketplace for lawn care and outdoor services, with over $100M in annual bookings. We"
raw-0204,2026-06-02,Remotive API,LawnStarter,"Staff Software Engineer, Product (São Paulo)",Data & AI,Software Development,Senior/Lead,Brazil,full_time,Marketplace; TypeScript; Frontend; Security; Backend; AI/ML; React; UI/UX; REST; AWS; Git; AI,AWS; backend; frontend; php; react; security; UI/UX; AI/ML; jira; react native; documentation; laravel; Typescript; people management; prototyping; engineering management; marketplace; github; REST; datadog,94095,135405,114750,69.1,77,51.1,85,https://remotive.com/remote-jobs/software-development/staff-software-engineer-product-sao-paulo-2090912,"This is a remote role for candidates located in São Paulo. About LawnStarter LawnStarter is the nation's leading on-demand marketplace for lawn care and outdoor services, with over $100M in annual bookings. We're expandi"
raw-0205,2026-06-02,Remotive API,"Clerky, Inc.",Customer Operations & Writing Specialist,Data & AI,Customer Service,Unspecified,Worldwide,full_time,Fundraising; Testing; Startup; AI/ML; AI; Customer Service; Communication; Operations,AI/ML; startup; fundraising; testing,64124,92276,78200,78.2,51,35.9,119,https://remotive.com/remote-jobs/customer-service/customer-operations-writing-specialist-2090942,"Here at Clerky, we build software to make legal paperwork easier for startups and their attorneys. We're profitable and growing sustainably. We're the most popular way for high-growth technology startups to form, and are"
raw-0206,2026-06-02,Remotive API,LawnStarter,"Staff Software Engineer, Product (Campinas)",Data & AI,Software Development,Senior/Lead,Brazil,full_time,Marketplace; TypeScript; Frontend; Security; Backend; AI/ML; React; UI/UX; REST; AWS; Git; AI,AWS; backend; frontend; php; react; security; UI/UX; AI/ML; jira; react native; documentation; laravel; Typescript; people management; prototyping; engineering management; marketplace; github; REST; datadog,94095,135405,114750,69.1,77,51.1,85,https://remotive.com/remote-jobs/software-development/staff-software-engineer-product-campinas-2090913,"This is a remote role for candidates located in Campinas (Brazil) About LawnStarter LawnStarter is the nation's leading on-demand marketplace for lawn care and outdoor services, with over $100M in annual bookings. We're "
raw-0207,2026-06-01,The Muse API,General Motors,Senior Global Sourcing Manager - PCBA/SMT,Software & Engineering,Account Management,Senior/Lead,"Warren, MI",external,Product Management; Communication; Automation; Accounting,Account Management; Senior Level,97416,140184,118800,67.8,48,38.6,123,https://www.themuse.com/jobs/generalmotors/senior-global-sourcing-manager-pcbasmt,"Description This role is based remotely but if you live within a 50-mile radius of Warren, Michigan, you are expected to report to that location three times a week, at minimum. As a Senior Global Sourcing Manager - PCBA/"
raw-0208,2026-05-29,The Muse API,TD Bank,Assistant Store Manager (40) Kings Drive,Marketing & Growth,Retail,Senior/Lead,"Charlotte, NC",external,AI; Communication; Sales,Retail; Senior Level,66420,95580,81000,98.2,48,38.6,123,https://www.themuse.com/jobs/tdbank/assistant-store-manager-40-kings-drive,"Work Location: Charlotte, North Carolina, United States of America Hours: 40 Pay Details: $29.75 - $44.50 USD TD is committed to providing fair and equitable compensation opportunities to all colleagues. Growth opportuni"
