source,source_url,date_posted,company,title,category,location,job_type,tags_raw,description
Arbeitnow API,https://www.arbeitnow.com/jobs/companies/vexcash-ag/mitarbeiter-finanz-und-rechnungswesen-financial-accountant-buchhalter-all-genders-berlin-329762,2026-06-26T12:01:55,Vexcash AG,Mitarbeiter Finanz- und Rechnungswesen/ Financial Accountant/ Buchhalter (all genders),Private Banking,Berlin,berufserfahren,Private Banking,"Die VEXCASH AG ist Deutschlands führender Online-Anbieter für Kurzzeitkredite. Wir bieten unseren Kunden damit eine schnelle und unkomplizierte Überbrückung bis zu Ihrem nächsten Geldeingang. Unserem Service vertrauen bereits mehr als 800.000 Kunden. Dank unserer Innovation sichern sie sich finanzielle Liquidität, ohne sich langfristig binden zu müssen. Wir suchen ab sofort Verstärkung im Finanz- und Rechnungswesen. Aufgaben Kontoführung in der Finanzbuchhaltung Kontenabstimmung der Sach- und Finanzkonten Zahlungsverkehr, Überwachung und Durchführung der Zahlungsläufe Buchen von Bankkonten und Abrechnungen von Kreditkarten Abstimmung mit den operativen Abteilungen zur korrekten und periodengerechten Erfassung der Geschäftsvorfälle in der Finanzbuchhaltung Erstellung von Umsatzsteuervoranmeldungen Mitarbeit bei Monats-, Quartals- und Jahresabschlüssen nach HGB Qualifikation Du hast eine erfolgreich abgeschlossene, adäquate Berufsausbildung oder Studium Du hast nachweisbar mehrere Jahre Berufserfahrung auf diesem Gebiet Du hast Erfahrung mit gängigen ERP-Systemen Du beherrschst Excel Du hast sichere und anwendbare Englischkenntnisse Benefits Moderne und zeitgemäße Arbeitsbedingungen Derzeit das Deutschlandticket zu 100% Derzeit hybrides Arbeiten Derzeit die Mitgliedschaft bei Urban Sports Frische Obstkörbe, warme und kalte Getränke Internationales Umfeld in einem dynamischen, engagierten und kollegialen Team Büro direkt am Hauptbahnhof Berlin im Stil Co-Working Space Ein sicherer Arbeitsplatz in einem Unternehmen, das seit seiner Gründung 2011 eine stetige Erfolgsgeschichte geschrieben hat Wir freuen uns darauf, Dich kennenzulernen! Wenn Du die Motivation hast, Teil unserer Erfolgsgeschichte zu sein, bewirb Dich am besten jetzt gleich. Wer zögert ist selber schuld! Find more English Speaking Jobs in Germany on Arbeitnow"
Arbeitnow API,https://www.arbeitnow.com/jobs/companies/leyselect-gmbh/hr-payroll-specialist-miwid-essen-488042,2026-06-26T12:01:55,LeySelect GmbH,HR Payroll Specialist (mIwId),Compensation and Benefits,Essen,,Compensation and Benefits,"Aufgaben Verwaltung von Arbeitszeit- und Urlaubskonten im Zeiterfassungssystem Erstellung arbeitsvertraglicher Unterlagen, Zeugnisse und Pflege der Personalakten Beratung von Mitarbeitenden und Führungskräften zu abrechnungs- und arbeitsrechtlichen Themen Kommunikation mit Krankenkassen/Behörden sowie Durchführung des Melde- und Bescheinigungswesens Datenaufbereitung fürs Rechnungswesen sowie Prüfung und Umsetzung gesetzlicher Änderungen ngsfähigkeit Qualifikation Kaufmännische Ausbildung und mehrjährige Erfahrung in Entgeltabrechnung/Personaladministration Gute Kenntnisse im Arbeits-, Lohnsteuer- und Sozialversicherungsrecht Sicherer Umgang mit MS Office (v. a. Excel) und HR-/Payroll-Systemen Hohe Dienstleistungsorientierung, Eigeninitiative und selbstständige Arbeitsweise Teamfähigkeit, Zuverlässigkeit, Belastbarkeit sowie starkes Stakeholder-Management Interesse an digitaler HR-Transformation und ausgeprägte Problemlösungsfähigkeit Benefits Du arbeitest in und mit einem interdisziplinären und hochmotivierten Team in interessanten und innovativen Projekten. Die Zufriedenheit der Mitarbeitenden ist zentraler Bestandteil unseres Mandanten. Das Unternehmen ist tolerant, weltoffen sowie neugierig und erkennt frühzeitig Trends und Potentiale für Innovationen und Wachstum. Ein modernes und nachhaltiges Arbeitsumfeld gepaart mit mobiler Arbeit, attraktiver Vergütungsmodelle sowie individueller Entwicklungsmöglichkeiten und Zusatzleistungen sind dabei selbstverständlich. Das bietet dir dein neuer Arbeitgeber: Individuelle Förderung in Form von Fort- und Weiterbildungsmöglichkeiten Eine betriebliche Altersvorsorge sowie Krankenzusatzversicherung Eine ausgewogene Work-Life-Balance Wir bieten ein großes und vielseitiges Netzwerk zu Top Unternehmen und einen direkten Draht zu unseren Mandanten. Wir kennen unsere Mandanten, wissen genau, was diese wollen und wie wir Kandidaten ideal platzieren. In einem ersten Telefonat besprechen wir die Details der Stelle und gleichen die Fähigkeiten und vor allem die Wünsche an einen zukünftigen Arbeitgeber ab. Wir besprechen den Lebenslauf, suchen Verbesserungspotential in der Außenwirkung und kümmern uns um die gesamte Kommunikation mit dem Mandanten. Und das natürlich kostenfrei auf höchstem Niveau! Hier werden Werte wie Wertschätzung, Respekt und Ehrlichkeit großgeschrieben. Find Jobs in Germany on Arbeitnow"
Arbeitnow API,https://www.arbeitnow.com/jobs/companies/finment-gmbh/duales-studium-softwareentwicklung-berlin-64611,2026-06-26T12:01:55,FinMent GmbH,Duales Studium - Softwareentwicklung (m/w/d),Web Development,Berlin,Dual studies,Web Development,"Unsere Mission: “Lass Dein Geld noch effizienter für Dich arbeiten!” Wir sind FinMent - ein schnell wachsendes, zweifach staatlich zertifiziertes FinTech Startup in Berlin. Wir demokratisieren das Wissen und den Zugang zur institutionellen Geldanlage mithilfe von innovativen Technologien, geprüftem Finanzwissen und exklusiven Strategien, die bisher nur institutionellen Investoren (Family Offices) mit +200 Millionen Euro Mindestkapital vorbehalten waren. Neben vielen weiteren Benefits erhälst du exklusiv: Deine finanzielle Freiheit mit zusätzlichem Börseneinkommen: Als Teil vom inneren Kreis erhälst du die einzigartige Möglichkeit kostenlos unser Produkte zu nutzen, um wie unsere Kunden ein regelmäßiges Börseneinkommen zu erzielen und finanziell frei zu werden. (Die Kunden zahlen dafür bis zu 36.000€). Begeisterst du Dich für Finanzen und bist du bereit, in einem profitabel wachsenden FinTech Start Up Deine Karriere durchstarten? Bewirb dich und teile uns mit: Warum sollen wir dir die Chance geben deinen Wunschberuf bei uns ausüben zu können und kostenlos den massiven Vorteil durch unsere Produkte geben, damit du jetzt schon ein gutes zusätzliches Einkommen durch die Börse erhälst? Aufgaben Was Dich erwartet Als Mitglied in unserem Produktentwicklungsteam übernimmst du eine Schlüsselrolle als Programmierer im Frontend und Backend. Full Stack Development: Du wirst in den gesamten Entwicklungszyklus unserer Finanzplattform eingebunden – von der ersten Architektur-Idee bis zum GoLive von Web-Anwendungen. Feature Engineering &#x26; KI: Du lernst, wie man innovative Features rund um den Börsenhandel entwickelt und wie moderne KI-Tools genutzt werden, um smarten und effizienten Code zu schreiben. Systemoptimierung: Du unterstützt und entwickelst unserer Finanzplattform im Front und Backend und optimierst alle unternehmensinternen Prozesse sowie Algorithmen. Agiles Arbeiten &#x26; Impact: In einer dynamischen Startup-Umgebung gestaltest Du unseren Scrum-Prozess aktiv mit – vom Planning bis zur Retrospektive. Du siehst sofort, wie Dein Code den Vermögensaufbau unserer Kunden beeinflusst. Qualifikation Wir gehen davon aus, dass Du ein Experte in deinem Themenbereich sein willst und bereit dafür bist, sich konstant weiterzuentwickeln - auch bei herausfordernden Aufgaben findest Du schnelle Lösungen und überzeugst mit starken Ideen. Tech-DNA &#x26; Begeisterung: Programmieren ist für Dich mehr als nur ein Buzzword. Du hast erste eigene Projekte mit den Technologien wie JavaScript, React.js, Node.js, HTML5, CSS gebaut. Hands-on-Mentalität: Du hast Bock, Dinge anzupacken. Auch wenn Du mal nicht weiterweißt, suchst Du selbstständig nach Lösungen und zeigst Eigeninitiative. Lernhunger &#x26; Ownership: Du willst Dich konstant weiterentwickeln, Verantwortung für Deine Lernfortschritte übernehmen und in unserem High-Performance-Team schnell wachsen. Sprachen: Dein Deutsch ist auf gutem Konversationsniveau (mindestens B2). Dein Englisch ist gut für Konversationen. Man erfüllt nicht immer alle Anforderungen. Das sollte Dich nicht aufhalten. Wenn Du wirklich Lust hast, mit uns zusammenzuarbeiten, freuen wir uns von Dir zu hören! Benefits Was wir bieten Wir bieten dir nicht nur einen Job an, sondern Du wirst ein Mitglied unseres High-Performance-Teams, bestehend aus Digital- und Investment-Experten und nimmst eine bedeutende Rolle bei der Demokratisierung der Geldanlage ein. Daneben bieten wir Dir: Privates Studium + einem überdurchschnittlichen Lohn: 100.000€ Stipendium. Studium an einer angesehen privaten Hochschule, Übernahme Deiner Studiengebühren sowie ein sehr gutes monatliches Gehalt Ein positives Arbeitsumfeld: Wohlfühlatmosphäre und ein kollegialer und familiärer Umgang mit gemeinsamen Freizeitaktivitäten und Teamevents​. Eigener Verantwortungsbereich: Verantwortung für den Erfolg deines Bereichs mit direkter Auswirkung auf die Unternehmensentwicklung. Echte Start-Up Atmosphäre : Kurze Entscheidungswege und direkter Kontakt zu der strategi"
Arbeitnow API,https://www.arbeitnow.com/jobs/companies/finment-gmbh/full-stack-entwickler-nodejs-react-berlin-298224,2026-06-26T12:01:55,FinMent GmbH,Full Stack Entwickler (m/w/d) - Node.js / React,Web Development,Berlin,,Web Development,"Unsere Mission: “Lass Dein Geld noch effizienter für Dich arbeiten!” Wir sind FinMent - ein schnell wachsendes, zweifach staatlich zertifiziertes FinTech Startup in Berlin. Wir demokratisieren das Wissen und den Zugang zur institutionellen Geldanlage mithilfe von innovativen Technologien, geprüftem Finanzwissen und exklusiven Strategien, die bisher nur institutionellen Investoren (Family Offices) mit +200 Millionen Euro Mindestkapital vorbehalten waren. Neben vielen weiteren Benefits erhälst du exklusiv: Deine finanzielle Freiheit mit zusätzlichem Börseneinkommen: Als Teil vom inneren Kreis erhälst du die einzigartige Möglichkeit kostenlos unser Produkte zu nutzen, um wie unsere Kunden ein regelmäßiges Börseneinkommen zu erzielen und finanziell frei zu werden. (Die Kunden zahlen dafür bis zu 36.000€). Begeisterst du Dich für Finanzen und bist du bereit, in einem profitabel wachsenden FinTech Start Up Deine Karriere durchstarten? Bewirb dich und teile uns mit: Warum sollen wir dir die Chance geben deinen Wunschberuf bei uns ausüben zu können und kostenlos den massiven Vorteil durch unsere Produkte geben, damit du jetzt schon ein gutes zusätzliches Einkommen durch die Börse erhälst? Aufgaben Was Dich erwartet Als Mitglied in unserem Produktentwicklungsteam übernimmst du eine Schlüsselrolle als Programmierer im Frontend und Backend. Produktentwicklung. Du bist in den gesamten Entwicklungsprozesses unserer Finanzplattform eingebunden und entwickelst innovative Features rund um Börsenhandel und finanzielle Unabhängigkeit. Innovative Investmentsysteme: Du unterstützt und entwickelst eigenständig in einer dynamischen Startup-Umgebung die nächste Generation intelligenter Investmentsysteme für Privatanleger Full-Stack-Entwicklung: Du treibst unsere Finanzplattform im Frontend und Backend technologisch wie konzeptionell voran. Prozessoptimierung: Du analysierst und optimierst unternehmensinterne Prozesse, Systeme und Algorithmen, um Effizienz, Performance und Qualität unserer Plattform kontinuierlich zu verbessern. Agile Zusammenarbeit: Du gestaltest als Mitglied eines agilen Teams den Scrum-Prozess aktiv mit und begleitest alle Phasen von der Planung bis zur Retro mit. Wir investieren in Deine individuelle Ausbildung, fördern gezielt Deine Weiterentwicklung und machen Dich Schritt-für-Schritt zum Experten – mit dem klaren Ziel auf eine langfristige Zusammenarbeit. Qualifikation Was Du mitbringen solltest Du hast eine hohe Leistungsbereitschaft, Wissensdurst für Finanzthemen und willst Dich persönlich zu einem Spezialisten im Finanzbereich entwickeln. Wir gehen davon aus, dass Du ein Experte in deinem Themenbereich sein willst und bereit dafür bist, sich konstant weiterzuentwickeln - auch bei herausfordernden Aufgaben findest Du schnelle Lösungen und überzeugst mit starken Ideen. Clean Coding. Programmieren ist deine Leidenschaft und du bist ein Clean Coder. Tech-Stack. Du kennst die grundlegenden Technologien wie JavaScript, React.js, Node.js, WordPress, HTML5, CSS. Dabei hast du eine präzise und detailverliebte Arbeitsweise. High Performance. Du bist ein Programmier-Allrounder, der sich durch seine Hands-on-Mentalität stetig weiterentwickeln möchte und Dinge gerne anpackt Verantwortung. Du möchtest und kannst Verantwortung für Deinen Themenbereich übernehmen, um daraus schnell persönlich zu wachsen. Ergebnisorientierung. Du packst Dinge an. Dabei bist du diszipliniert, eigenständig und ergebnisorientiert. Kommunikation. Dein Deutsch ist idealerweise auf B2 Level. Dein Englisch ist gut für Konversationen. Man erfüllt nicht immer alle Anforderungen. Das sollte Dich nicht aufhalten. Wenn Du wirklich Lust hast, mit uns zusammenzuarbeiten, freuen wir uns von Dir zu hören! Benefits Was wir bieten Wir bieten dir nicht nur einen Job an, sondern Du wirst ein Mitglied unseres High-Performance-Teams, bestehend aus Digital- und Investment-Experten und nimmst eine bedeutende Rolle bei der Demokratisierung der Geldanlage ein. Daneben bieten wir Dir"
Arbeitnow API,https://www.arbeitnow.com/jobs/companies/finment-gmbh/junior-webentwickler-nodejs-react-berlin-12749,2026-06-26T12:01:55,FinMent GmbH,Junior Webentwickler (m/w/d) - Node.js / React,Web Development,Berlin,,Web Development,"Unsere Mission: “Lass Dein Geld noch effizienter für Dich arbeiten!” Wir sind FinMent - ein schnell wachsendes, zweifach staatlich zertifiziertes FinTech Startup in Berlin. Wir demokratisieren das Wissen und den Zugang zur institutionellen Geldanlage mithilfe von innovativen Technologien, geprüftem Finanzwissen und exklusiven Strategien, die bisher nur institutionellen Investoren (Family Offices) mit +200 Millionen Euro Mindestkapital vorbehalten waren. Neben vielen weiteren Benefits erhälst du exklusiv: Deine finanzielle Freiheit mit zusätzlichem Börseneinkommen: Als Teil vom inneren Kreis erhälst du die einzigartige Möglichkeit kostenlos unser Produkte zu nutzen, um wie unsere Kunden ein regelmäßiges Börseneinkommen zu erzielen und finanziell frei zu werden. (Die Kunden zahlen dafür bis zu 36.000€). Begeisterst du Dich für Finanzen und bist du bereit, in einem profitabel wachsenden FinTech Start Up Deine Karriere durchstarten? Bewirb dich und teile uns mit: Warum sollen wir dir die Chance geben deinen Wunschberuf bei uns ausüben zu können und kostenlos den massiven Vorteil durch unsere Produkte geben, damit du jetzt schon ein gutes zusätzliches Einkommen durch die Börse erhälst? Aufgaben Was Dich erwartet Als Mitglied in unserem Produktentwicklungsteam übernimmst du eine Schlüsselrolle als Programmierer im Frontend und Backend. Produktentwicklung. Du bist in den gesamten Entwicklungsprozesses unserer Finanzplattform eingebunden und entwickelst innovative Features rund um Börsenhandel und finanzielle Unabhängigkeit. Innovative Investmentsysteme: Du unterstützt und entwickelst eigenständig in einer dynamischen Startup-Umgebung die nächste Generation intelligenter Investmentsysteme für Privatanleger Full-Stack-Entwicklung: Du treibst unsere Finanzplattform im Frontend und Backend technologisch wie konzeptionell voran. Prozessoptimierung: Du analysierst und optimierst unternehmensinterne Prozesse, Systeme und Algorithmen, um Effizienz, Performance und Qualität unserer Plattform kontinuierlich zu verbessern. Agile Zusammenarbeit: Du gestaltest als Mitglied eines agilen Teams den Scrum-Prozess aktiv mit und begleitest alle Phasen von der Planung bis zur Retro mit. Wir investieren in Deine individuelle Ausbildung, fördern gezielt Deine Weiterentwicklung und machen Dich Schritt-für-Schritt zum Experten – mit dem klaren Ziel auf eine langfristige Zusammenarbeit. Qualifikation Was Du mitbringen solltest Du hast eine hohe Leistungsbereitschaft, Wissensdurst für Finanzthemen und willst Dich persönlich zu einem Spezialisten im Finanzbereich entwickeln. Wir gehen davon aus, dass Du ein Experte in deinem Themenbereich sein willst und bereit dafür bist, sich konstant weiterzuentwickeln - auch bei herausfordernden Aufgaben findest Du schnelle Lösungen und überzeugst mit starken Ideen. Clean Coding. Programmieren ist deine Leidenschaft und du bist ein Clean Coder. Tech-Stack. Du kennst die grundlegenden Technologien wie JavaScript, React.js, Node.js, WordPress, HTML5, CSS. Dabei hast du eine präzise und detailverliebte Arbeitsweise. High Performance. Du bist ein Programmier-Allrounder, der sich durch seine Hands-on-Mentalität stetig weiterentwickeln möchte und Dinge gerne anpackt Verantwortung. Du möchtest und kannst Verantwortung für Deinen Themenbereich übernehmen, um daraus schnell persönlich zu wachsen. Ergebnisorientierung. Du packst Dinge an. Dabei bist du diszipliniert, eigenständig und ergebnisorientiert. Kommunikation. Dein Deutsch ist idealerweise auf C1 Level. Dein Englisch ist gut für Konversationen. Man erfüllt nicht immer alle Anforderungen. Das sollte Dich nicht aufhalten. Wenn Du wirklich Lust hast, mit uns zusammenzuarbeiten, freuen wir uns von Dir zu hören! Benefits Was wir bieten Wir bieten dir nicht nur einen Job an, sondern Du wirst ein Mitglied unseres High-Performance-Teams, bestehend aus Digital- und Investment-Experten und nimmst eine bedeutende Rolle bei der Demokratisierung der Geldanlage ein. Daneben bieten wir Dir"
Arbeitnow API,https://www.arbeitnow.com/jobs/companies/finment-gmbh/junior-content-marketing-berlin-433006,2026-06-26T12:01:54,FinMent GmbH,Junior Content Marketing (m/w/d),Marketing and Communication,Berlin,,Marketing and Communication,"Unsere Mission: “Lass Dein Geld noch effizienter für Dich arbeiten!” Wir sind FinMent - ein schnell wachsendes, zweifach staatlich zertifiziertes FinTech Startup in Berlin. Wir demokratisieren das Wissen und den Zugang zur institutionellen Geldanlage mithilfe von innovativen Technologien, geprüftem Finanzwissen und exklusiven Strategien, die bisher nur institutionellen Investoren (Family Offices) mit +200 Millionen Euro Mindestkapital vorbehalten waren. Neben vielen weiteren Benefits erhälst du exklusiv: Deine finanzielle Freiheit mit zusätzlichem Börseneinkommen: Als Teil vom inneren Kreis erhälst du die einzigartige Möglichkeit kostenlos unser Produkte zu nutzen, um wie unsere Kunden ein regelmäßiges Börseneinkommen zu erzielen und finanziell frei zu werden. (Die Kunden zahlen dafür bis zu 36.000€). Begeisterst du Dich für Finanzen und bist du bereit, in einem profitabel wachsenden FinTech Start Up Deine Karriere durchstarten? Bewirb dich und teile uns mit: Warum sollen wir dir die Chance geben deinen Wunschberuf bei uns ausüben zu können und kostenlos den massiven Vorteil durch unsere Produkte geben, damit du jetzt schon ein gutes zusätzliches Einkommen durch die Börse erhälst? Aufgaben Wir gehen davon aus, dass Du ein Experte in deinem Themenbereich sein willst und bereit dafür bist, sich konstant weiterzuentwickeln - auch bei herausfordernden Aufgaben findest Du schnelle Lösungen und überzeugst mit starken Ideen. Was Dich erwartet Entwicklung und Umsetzung von digitalen Kampagnen: Du entwickelst und implementierst innovative Marketingkampagnen entlang der gesamten Customer Journey - datengetrieben, kreativ und wirkungsvoll, um unsere Zielgruppen effektiv ansprechen. Performance-Marketing Ownership: Du steuerst und optimierst eigenverantwortlich unsere Performance-Marketing-Funnel über verschiedene Plattformen und maximierst die Conversion Rates. Growth Marketing: Du identifizierst Wachstumschancen und setzt skalierbare Growth-Strategien ein, um nachhaltiges Unternehmenswachstum zu erzielen. Analyse, Reporting und Optimierung: Du analysierst relevante KPIs, optimierst Kampagnen kontinuierlich und berichtest regelmäßig sowie transparent über Performance und ROI. Interdisziplinären Zusammenarbeit: Du arbeitest eng mit unseren Experten und nutzt modernster Technologie sowie KI zur Erstellung starker Creatives, Landingpages und Content zusammen, um hochwertige und zielgerichtete Inhalte zu entwickeln. Qualifikation Erfahrung. Du hast mindestens ein Jahr praktische Berufserfahrung im Marketing gesammelt und in der Umsetzung von Online Marketing Kampagnen in der Finanzbranche tatkräftig unterstützt und aktiv mitgewirkt . Leidenschaft. Du hast Bock auf genau diesen Job! Du hast eine starke Eigenmotivation und Leidenschaft für sauberes, agiles Prozess- und Projektmanagement. Startup Verantwortung. Du hast nachweislich gerne Verantwortung für deinen Themenbereich übernommen, auch wenn das außerhalb deiner Komfortzone war. Du hast Dinge ohne zu zögern angepackt, warst ergebnisorientiert und zügig in der Umsetzung. Persönliches Wachstum. Du lernst und entwickelst dich eifrig, ob in deinem Job, dem Sektor in dem du arbeitest, aber auch privat! Du suchst proaktiv nach Feedback. Dabei behälst du den Erfolg des Teams im Auge. Smart. Du hast sehr gute analytische und strukturelle Fähigkeiten, um Szenarien im Vorfeld klar durchzudenken. Das was du durchgedacht hast, setzt du strukturiert um. Sprache. Dein Deutsch ist idealerweise auf “Muttersprache” Level oder C2 Niveau. Dein Englisch ist gut für Konversationen. Man erfüllt nicht immer alle Anforderungen. Das sollte Dich nicht aufhalten. Wenn Du wirklich Lust hast, mit uns zusammenzuarbeiten, freuen wir uns von Dir zu hören! Benefits Was wir bieten Wir bieten dir nicht nur einen Job an, sondern Du wirst ein Mitglied unseres High-Performance-Teams, bestehend aus Digital- und Investment-Experten und nimmst eine bedeutende Rolle bei der Demokratisierung der Geldanlage ein. Daneben bieten wir "
Arbeitnow API,https://www.arbeitnow.com/jobs/companies/leyselect-gmbh/it-administrator-mwd-frankfurt-am-main-79643,2026-06-26T12:01:54,LeySelect GmbH,IT-Administrator (m|w|d),System and Network Administration,Frankfurt am Main,,System and Network Administration,"Unser Mandant ist ein auf Cyber Security spezialisiertes Beratungsunternehmen. Als SAP Silber Partner orientiert sich unser Mandant an den Bedürfnissen seiner Kunden und bietet innovative und nachhaltige Lösungen. So baut unser Mandant langfristige, vertrauensvolle, offene und ehrliche Kundenbeziehungen auf. Mit seiner langjährigen Erfahrung in den Bereichen Security Incident Response, IT-Forensik und Krisenmanagement begleitet unser Mandant seine Kunden zudem bei allen Einzelthemen rund um die Sicherheit derer Informationen, Daten und Systeme. Werde Teil des Teams als IT-Administrator (mIwId) und sorge für einen reibungslosen IT-Betrieb. Standort: Großraum Frankfurt I Einstiegsdatum: nach persönlicher Verfügbarkeit Aufgaben Fehlerverfolgung und -analyse auf Second Level Niveau Annahme von IT-Störungsanfragen sowie Fehlerbehebung vor Ort und per Remote-Service-Tools Sicherstellung eines reibungslosen IT-Betriebs im Windows und Linux Umfeld Optimierung und Betreuung der IT-Infrastruktur von Clients und Servern Sicherstellung des Betriebes der Client-Landschaft im Microsoft und Mac Umfeld Störungsbeseitigung Incident Management Qualifikation Abgeschlossene Ausbildung oder Studium in der Informatik oder vergleichbare Qualifikation Erste Erfahrungen in M365-Produkte und Linux Kenntnisse in der Netzwerkadministration, Mobile Device Management und Client Management Kommunikative Fähigkeiten sowie eine hohe Kundenorientierung Benefits Wissenswertes: Als Bestandsteil eines interdisziplinären Teams in einem zunehmend bedeutsamen Bereich, kannst du auf Folgendes gespannt sein: Vielfältige persönliche und fachliche Weiterentwicklungsmöglichkeiten Flexible Arbeitszeiten 30 Urlaubstage Ein offenes Ohr für deine kreativen Ideen Flache Hierarchien und eine familiäre Atmosphäre Job Rad, Zuschuss ÖPNV-Ticket Eine sorgfältige und individuelle Einarbeitung Feelgood-Atmosphäre bei Afterworks,- Sommer und Weihnachtsfeste Bezuschusste betriebliche Altersvorsorge (BAV) Was wir bieten: Wir bieten ein großes und vielseitiges Netzwerk zu Top Unternehmen und einen direkten Draht zu unseren Mandanten. Wir kennen unsere Mandanten, wissen genau, was diese wollen und wie wir Kandidat:innen ideal platzieren. In einem ersten Telefonat besprechen wir die Details der Stelle und gleichen die Fähigkeiten und vor allem die Wünsche an einen zukünftigen Arbeitgeber ab. Wir besprechen den Lebenslauf, suchen Verbesserungspotential in der Außenwirkung und kümmern uns um die gesamte Kommunikation mit dem Mandanten. Und das natürlich kostenfrei auf höchstem Niveau! Hier werden Werte wie Wertschätzung, Respekt und Ehrlichkeit großgeschrieben. Find more English Speaking Jobs in Germany on Arbeitnow"
