job_id,date_posted,source,company,title,category,raw_category,seniority,location,job_type,skills,tags_raw,salary_min_usd,salary_max_usd,salary_mid_usd,demand_index,scarcity_score,time_to_fill_days_proxy,application_volume_proxy,source_url,description_preview
raw-0086,2026-07-06,Arbeitnow API,peeps GmbH,IT Co-Founder/in,Software & Engineering,IT,Unspecified,Würzburg,,TypeScript; Onboarding; Startup; Python; Design; AI,IT,66387,95533,80960,84.3,46,33.8,125,https://www.arbeitnow.com/jobs/companies/peeps-gmbh/it-co-founder-in-wurzburg-268946,"Wir suchen aktuell einen IT Co-Founder / CTO für peeps. peeps ist eine App gegen Einsamkeit, die junge Menschen wieder im echten Leben connected. User können Events entdecken, eigene Treffen erstellen und über gemeinsame"
raw-0087,2026-07-06,Arbeitnow API,PraxisConcierge,Customer Success Manager,Marketing & Growth,Remote,Senior/Lead,Stuttgart,,Customer Service; Onboarding; Startup; Sales,Remote; Customer Service,66420,95580,81000,71.6,48,38.6,123,https://www.arbeitnow.com/jobs/companies/praxisconcierge/customer-success-manager-stuttgart-154528,"Unser Startup PraxisConcierge bringt frischen Schwung ins Gesundheitswesen: Mit innovativen Lösungen schaffen wir eine spürbare Entlastung im Alltag von Arztpraxen, MVZ und Kliniken. Unsere digitale Telefonassistenz verb"
raw-0088,2026-07-06,Arbeitnow API,ENERDOMO Franchisezentrale,Expansionsmanager und Gründercoach im Franchising (m/w/d),Marketing & Growth,Management,Senior/Lead,Königstein im Taunus,berufserfahren,SEO; Google Analytics; Paid Marketing; Content Strategy,Management; Team Leader,66420,95580,81000,47.7,48,38.6,123,https://www.arbeitnow.com/jobs/companies/enerdomo-franchisezentrale/expansionsmanager-und-grundercoach-im-franchising-konigstein-im-taunus-448722,"Du. Wir. ENERDOMO. Um unser Führungsteam am Standort Königstein bei Frankfurt am Main zu stärken, suchen wir zum nächstmöglichen Zeitpunkt einen engagierten und dynamischen Franchise-Expansionsmanager und Gründercoach (m"
raw-0089,2026-07-06,Arbeitnow API,Distribusion Technologies,"Engineering Manager, Core Domain (all genders)",Software & Engineering,Information technology,Senior/Lead,Berlin,"Full-time permanent, manager",Marketplace; Automation; Security; Cloud,Information technology; bachelor's degree,97416,140184,118800,68.8,64,45.5,102,https://www.arbeitnow.com/jobs/companies/distribusion-technologies/engineering-manager-core-domain-all-genders-berlin-259282,"About us Distribusion is the world’s leading ground transportation marketplace and gives travellers seamless access to ground transportation online, from search to ticket purchase. We have built a cutting-edge B2B techno"
raw-0090,2026-07-06,Arbeitnow API,cbs Corporate Business Solutions GmbH,(Senior) Consultant Business Process Management / Supply Chain Management (m/w/d),Data & AI,Consulting,Senior/Lead,Heidelberg,"Full-time permanent, mid",SAP,Consulting; high school coursework,94095,135405,114750,48.6,53,40.8,116,https://www.arbeitnow.com/jobs/companies/cbs-corporate-business-solutions-gmbh/senior-consultant-business-process-management-supply-chain-management-heidelberg-136370,"Wir sind die Berater der Weltmarktführer: Hochmotivierte Expertinnen und Experten, die als erfolgreiches Team digitale End-to-End-Geschäftsprozesslösungen vorantreiben. Gemeinsam stärken wir die Zukunft der beeindruckend"
raw-0091,2026-07-06,Arbeitnow API,4screen,Automotive Product Management Intern (f/m/x),Software & Engineering,Management,Internship/Student,Munich,"Internship, no experience required / student",Product Management; Communication; Sales,Management; Team Leader,39688,57112,48400,77,38,30.3,136,https://www.arbeitnow.com/jobs/companies/4screen/automotive-product-management-intern-munich-50876,Become a part of the 4screen team! At 4screen we are bridging the gap between drivers and their surrounding infrastructure by providing engaging in-car communication directly on the car screen. We have developed the worl
raw-0092,2026-07-06,Arbeitnow API,evoila Frankfurt GmbH,Atlassian Consultant (m/w/d) / Frankfurt a.M. -Hybrid,Software & Engineering,IT,Unspecified,Frankfurt am Main,,Python; JavaScript; API; Cloud,IT,66387,95533,80960,82,62,40.7,104,https://www.arbeitnow.com/jobs/companies/evoila-frankfurt-gmbh/atlassian-consultant-frankfurt-am-hybrid-frankfurt-am-main-187528,"Wir suchen zur Verstärkung unseres Teams in Frankfurt a.M. einen Atlassian Consultant (m/w/d) für unsere Business Unit Modern Collaboration. In dieser Rolle unterstützt du unsere Kunden bei der Einführung, Weiterentwickl"
raw-0093,2026-07-06,Arbeitnow API,beratungsgruppe wirth + partner,Senior Debitorenbuchhalter (m/w/d),Product & Project Management,Accounts Receivable,Senior/Lead,Munich,,Accounting; ERP,Accounts Receivable,84132,121068,102600,53.8,48,38.6,123,https://www.arbeitnow.com/jobs/companies/beratungsgruppe-wirth-partner/senior-debitorenbuchhalter-munich-472227,"Buchhaltung ist Ihr Metier Mit innovativen, komplexen Produkten und Lösungen ist unser Kunde seit Jahren weltweiter Marktführer in seinem Technologiebereich. Als mittelständisches Unternehmen mit Sitz in München und inte"
raw-0094,2026-07-06,Arbeitnow API,likeyaa GmbH,New Business Manager:in im Social Media & Influencer Marketing(w/m/d),Marketing & Growth,Marketing and Communication,Senior/Lead,Dortmund,,Communication; Social Media; CRM,Marketing and Communication,66420,95580,81000,77.8,48,38.6,123,https://www.arbeitnow.com/jobs/companies/likeyaa-gmbh/new-business-managerin-im-social-media-influencer-marketing-dortmund-136626,"Du liebst es, Menschen zu begeistern, weißt wie man Türen öffnet und willst aktiv dazu beitragen, dass likeyaa weiter wächst? Dann bist du bei uns genau richtig. Aufgaben Du identifizierst proaktiv potenzielle Kunden und"
raw-0095,2026-07-06,Arbeitnow API,ms4.IT,Wir suchen IT-Techniker (w/m/d),Software & Engineering,IT,Unspecified,Hamburg,,Python; JavaScript; API; Cloud,IT,66387,95533,80960,82,62,40.7,104,https://www.arbeitnow.com/jobs/companies/ms4it/wir-suchen-it-techniker-hamburg-376788,"Du möchtest abwechslungsreiche IT-Projekte betreuen, direkt mit Kunden arbeiten und Teil eines familiären Teams sein? Dann bist du bei uns genau richtig! Was 2012 als kleiner Handwerksbetrieb begann, ist heute ein etabli"
raw-0096,2026-07-06,Arbeitnow API,Consultport,Growth Marketing Manager,Data & AI,Marketing Manager,Senior/Lead,Berlin,,Google Analytics; Communication; Automation; Sales; SEO; CRM,Marketing Manager,94095,135405,114750,68,53,40.8,116,https://www.arbeitnow.com/jobs/companies/consultport/growth-marketing-manager-berlin-203853,"Consultport is a global platform redefining how businesses access top-tier consulting talent. We connect top companies with world-class consultants and digital experts, helping them drive critical initiatives faster, sma"
raw-0097,2026-07-06,Arbeitnow API,a.s.s. concerts & promotion GmbH,Marketing Manager,Marketing & Growth,Marketing and Communication,Senior/Lead,Hamburg,,Communication; Social Media,Marketing and Communication,66420,95580,81000,87.8,48,38.6,123,https://www.arbeitnow.com/jobs/companies/ass-concerts-promotion-gmbh/marketing-manager-hamburg-143130,Die a.s.s. concerts &#x26; promotion gmbh mit Sitz in Hamburg gehört seit 45 Jahren zu den etablierten und erfolgreichen Tourneeveranstaltern Deutschlands. Seit der Gründung hat sich das Unternehmen stetig in Mitarbeiter
raw-0098,2026-07-06,Arbeitnow API,K-tronik GmbH,Embedded Software Developer (m/w/x) für den Bereich High Power,Software & Engineering,Embedded Systems,Mid-level,Munich,berufserfahren,Docker; Git; C++,Embedded Systems; Firmware Development,72160,103840,88000,54.3,38,30.3,136,https://www.arbeitnow.com/jobs/companies/k-tronik-gmbh/embedded-software-developer-fur-den-bereich-high-power-munich-245178,Projektbeschreibung: Technologie begeistert Sie? Uns auch! Zur Verstärkung unseres Expertenteams bei unserem Kunden aus der Funk- und Kommunikationsbranche suchen wir einen Embedded Software Developer (m/w/x) für den Ber
raw-0099,2026-07-06,Arbeitnow API,K-tronik GmbH,Junior PMO (m/w/x) - International Operations,Product & Project Management,Management,Internship/Student,Munich,berufseinstieg,Operations; Excel,Management; Team Leader,34276,49324,41800,61.8,38,30.3,136,https://www.arbeitnow.com/jobs/companies/k-tronik-gmbh/junior-pmo-international-operations-munich-211149,Projektbeschreibung: echnologie begeistert Sie? Uns auch! Zur Verstärkung unseres Expertenteams bei unserem Kunden aus der Funk- und Kommunikationsbranche suchen wir einen Junior PMO (m/w/x) - International Operations in
raw-0100,2026-07-06,Arbeitnow API,PraxisConcierge,Technischer Kundendienst,Software & Engineering,Remote,Unspecified,Stuttgart,,Startup,Remote; Engineering,66387,95533,80960,70.5,38,30.3,136,https://www.arbeitnow.com/jobs/companies/praxisconcierge/technischer-kundendienst-stuttgart-219108,"Unser Startup PraxisConcierge bringt frischen Schwung ins Gesundheitswesen: Mit innovativen Lösungen schaffen wir eine spürbare Entlastung im Alltag von Arztpraxen, MVZ und Kliniken. Unsere digitale Telefonassistenz verb"
raw-0101,2026-07-06,Arbeitnow API,KNUTH Werkzeugmaschinen GmbH,Werkstudent Recruiting Koordination (m/w/d),Product & Project Management,HR,Internship/Student,Wasbek,Working student,HR,HR,34276,49324,41800,64.7,38,30.3,136,https://www.arbeitnow.com/jobs/companies/knuth-werkzeugmaschinen-gmbh/werkstudent-recruiting-koordination-wasbek-233807,"Seit 1923 steht KNUTH für Qualität, Innovation und Kundennähe in der Werkzeugmaschinen-Branche. Als familiengeführtes Unternehmen in der 4. Generation sind wir mit eigenen Produktions- und Vertriebsstandorten auf vier Ko"
raw-0102,2026-07-06,Arbeitnow API,think about IT GmbH,IT-Systemelektroniker (m/w/d),Software & Engineering,IT,Unspecified,Bochum,,Onboarding; HR,IT,66387,95533,80960,73.9,38,30.3,136,https://www.arbeitnow.com/jobs/companies/think-about-it-gmbh/it-systemelektroniker-bochum-384728,"Die thinkGROUP ist eine erfolgreiche Systemhausgruppe, die ständig nach Innovation strebt und großen Wert auf die kontinuierliche Optimierung unserer internen Prozesse legt. Die Nutzung modernster Technologien ist kein S"
raw-0103,2026-07-06,Arbeitnow API,think about IT GmbH,IT-System Engineer (m/w/d),Software & Engineering,IT,Unspecified,Bochum,,Onboarding,IT,66387,95533,80960,83.2,38,30.3,136,https://www.arbeitnow.com/jobs/companies/think-about-it-gmbh/it-system-engineer-bochum-30759,"Die thinkGROUP ist eine erfolgreiche Systemhausgruppe, die ständig nach Innovation strebt und großen Wert auf die kontinuierliche Optimierung unserer internen Prozesse legt. Die Nutzung modernster Technologien ist kein S"
raw-0104,2026-07-06,Arbeitnow API,think about IT GmbH,Senior IT Administrator (m/w/d),Software & Engineering,IT,Senior/Lead,Bochum,,Onboarding; HR,IT,97416,140184,118800,73.9,48,38.6,123,https://www.arbeitnow.com/jobs/companies/think-about-it-gmbh/senior-it-administrator-bochum-154093,"Die thinkGROUP ist eine erfolgreiche Systemhausgruppe, die ständig nach Innovation strebt und großen Wert auf die kontinuierliche Optimierung unserer internen Prozesse legt. Die Nutzung modernster Technologien ist kein S"
raw-0105,2026-07-06,Arbeitnow API,think about IT GmbH,Team Lead Accounting (m/w/d),Product & Project Management,IT,Senior/Lead,Bochum,,Accounting; Onboarding; ERP; SAP,IT,84132,121068,102600,59.8,48,38.6,123,https://www.arbeitnow.com/jobs/companies/think-about-it-gmbh/team-lead-accounting-bochum-243022,"Die thinkGROUP ist eine erfolgreiche Systemhausgruppe, die ständig nach Innovation strebt und großen Wert auf die kontinuierliche Optimierung unserer internen Prozesse legt. Die Nutzung modernster Technologien ist kein S"
raw-0106,2026-07-06,Arbeitnow API,Consultport,Head of Sales,Data & AI,Management,Senior/Lead,Berlin,,Sales; CRM,Management; Team Leader,94095,135405,114750,65.9,53,40.8,116,https://www.arbeitnow.com/jobs/companies/consultport/head-of-sales-berlin-68699,"Consultport is a global platform redefining how businesses access top-tier consulting talent. We connect top companies with world-class consultants and digital experts, helping them drive critical initiatives faster, sma"
raw-0107,2026-07-06,Arbeitnow API,plus10,Applikationsingenieur (m/w/d) - Kunststoffprozesse,Data & AI,Process Engineering,Mid-level,Stuttgart,berufserfahren,Data Science,Process Engineering,69700,100300,85000,50.9,43,32.5,129,https://www.arbeitnow.com/jobs/companies/plus10/applikationsingenieur-kunststoffprozesse-stuttgart-109318,"plus10 ist ein Fraunhofer IPA Spin-off. Unser KI-Tool Hopper optimiert Spritzgießprozesse in Echtzeit — weniger Ausschuss, kürzere Zykluszeiten, schnelleres Rüsten. Hopper hilft Kunden, den Fachkräftemangel abzufedern, t"
raw-0108,2026-07-06,Arbeitnow API,plus10,Applikationsingenieur (m/w/d) - Kunststoffprozesse,Data & AI,Process Engineering,Mid-level,Augsburg,berufserfahren,Data Science,Process Engineering,69700,100300,85000,50.9,43,32.5,129,https://www.arbeitnow.com/jobs/companies/plus10/applikationsingenieur-kunststoffprozesse-augsburg-422740,"plus10 ist ein Fraunhofer IPA Spin-off. Unser KI-Tool Hopper optimiert Spritzgießprozesse in Echtzeit — weniger Ausschuss, kürzere Zykluszeiten, schnelleres Rüsten. Hopper hilft Kunden, den Fachkräftemangel abzufedern, t"
raw-0109,2026-07-06,Arbeitnow API,TUMI,Mitarbeiter in der Reparaturenabteilung (m/w/d) - TUMI Services GmbH,Product & Project Management,Customer Service,Unspecified,Unna,,Customer Service; Excel; Sales,Customer Service,57334,82506,69920,64.7,38,30.3,136,https://www.arbeitnow.com/jobs/companies/tumi/mitarbeiter-in-der-reparaturenabteilung-tumi-services-gmbh-unna-175050,"Als Teil der Samsonite Gruppe, dem weltweit größten Unternehmen für Reisegepäck mit einer über 100-jährigen Tradition, ist TUMI eine international etablierte Lifestyle-Marke im Premium Segment für Reisegepäck, Businessta"
raw-0110,2026-07-06,Arbeitnow API,AK Supermarkt Villingen,IT Support Mitarbeiter (m/w/d),Software & Engineering,IT,Unspecified,Villingen-Schwenningen,,Python; JavaScript; API; Cloud,IT,66387,95533,80960,82,62,40.7,104,https://www.arbeitnow.com/jobs/companies/ak-supermarkt-villingen/it-support-mitarbeiter-villingen-schwenningen-357221,Zur Verstärkung unserer IT-Abteilung suchen wir zum nächstmöglichen Zeitpunkt einen IT-Support-Mitarbeiter (m/w/d) . Sie sind erste Ansprechperson bei technischen Problemen und unterstützen unsere Mitarbeitenden bei der 
raw-0111,2026-07-06,Arbeitnow API,1KOMMA5˚,Werkstudent:in (m/w/d) - Quality Control Analyst (Wärmepumpe),Software & Engineering,Remote,Internship/Student,Berlin,"Working student, berufseinstieg",Operations; AI,Remote; Business Operations,39688,57112,48400,85.5,38,30.3,136,https://www.arbeitnow.com/jobs/companies/1komma50/werkstudentin-quality-control-analyst-warmepumpe-berlin-496419,1KOMMA5° Bei 1KOMMA5° verfolgen wir eine Vision: Living on wind and sunlight forever for free . Dafür bauen wir mit Heartbeat AI das Energiesystem der Zukunft. Bist du dabei? Wir bringen regionales Handwerk und skalierba
raw-0112,2026-07-06,Arbeitnow API,1KOMMA5˚,Werkstudent:in (m/w/d) - Quality Control Analyst (Photovoltaik),Software & Engineering,Remote,Internship/Student,Berlin,"Working student, berufseinstieg",Operations; AI,Remote; Business Operations,39688,57112,48400,85.5,38,30.3,136,https://www.arbeitnow.com/jobs/companies/1komma50/werkstudentin-quality-control-analyst-photovoltaik-berlin-463916,1KOMMA5° Bei 1KOMMA5° verfolgen wir eine Vision: Living on wind and sunlight forever for free . Dafür bauen wir mit Heartbeat AI das Energiesystem der Zukunft. Bist du dabei? Wir bringen regionales Handwerk und skalierba
raw-0113,2026-07-06,Arbeitnow API,fleetster,Senior Full-Stack Engineer (m/f/x) | hybrid,Software & Engineering,Software Development,Senior/Lead,Munich,,Communication; JavaScript; TypeScript; Onboarding; Frontend; Backend; Node.js; React; SaaS; AWS,Software Development,97416,140184,118800,66.9,56,42.1,112,https://www.arbeitnow.com/jobs/companies/fleetster/senior-full-stack-engineer-hybrid-munich-411763,fleetster is a SaaS company located in Munich that provides smart solutions for global fleets and car-sharers to make customers’ daily fleet life as easy as possible. Our product core is the sophisticated software platfo
raw-0114,2026-07-06,Arbeitnow API,BBHT Beratungsgesellschaft mbH & Co. KG,IT Consultant & Business Analyst (w/m/d),Software & Engineering,Project Management,Mid-level,Münster,berufserfahren,Project Management; Agile,Project Management,72160,103840,88000,49.7,38,30.3,136,https://www.arbeitnow.com/jobs/companies/bbht-beratungsgesellschaft-mbh-co-kg/it-consultant-business-analyst-munster-476880,"Als IT Projektleiter:in oder Business Analyst:in bildest Du die Brücke zwischen Fachbereich und IT. Du analysierst Prozesse, erarbeitest gemeinsam mit unseren Kunden Anforderungen und begleitest deren Realisierung von de"
raw-0115,2026-07-06,Arbeitnow API,BBHT Beratungsgesellschaft mbH & Co. KG,Java Softwareentwickler - Backend & Microservices (w/m/d),Software & Engineering,Software Development,Mid-level,Münster,berufserfahren,Kubernetes; Frontend; Backend; Docker; Design; Cloud; Java; SQL; Git,Software Development,72160,103840,88000,68.4,62,40.7,104,https://www.arbeitnow.com/jobs/companies/bbht-beratungsgesellschaft-mbh-co-kg/java-softwareentwickler-backend-microservices-munster-42442,"Als Java Entwickler:in gestaltest Du von der technischen Konzeption, bis hin zur erfolgreichen Implementierung, die Softwareentwicklungsprojekte unserer Kunden. Dabei bringst Du Dein technisches Know-how in modernen Java"
raw-0116,2026-07-06,Arbeitnow API,BBHT Beratungsgesellschaft mbH & Co. KG,Business Consultant - Banking & Insurance (w/m/d),Product & Project Management,Project Management,Mid-level,Münster,berufserfahren,Project Management,Project Management,62320,89680,76000,50.9,38,30.3,136,https://www.arbeitnow.com/jobs/companies/bbht-beratungsgesellschaft-mbh-co-kg/business-consultant-banking-insurance-munster-274153,"Als Business Consultant analysierst und optimierst Du fachliche Prozesse und unterstützt unsere Kunden dabei, gesetzliche und regulatorische Anforderungen effizient und zukunftssicher in ihren Projekten umzusetzen. Du ar"
raw-0117,2026-07-06,Arbeitnow API,BBHT Beratungsgesellschaft mbH & Co. KG,Business Analyst - Banking Regulation & Reporting (w/m/d),Product & Project Management,Finance,Unspecified,Münster,,Finance; Agile,Finance,57334,82506,69920,56.1,38,30.3,136,https://www.arbeitnow.com/jobs/companies/bbht-beratungsgesellschaft-mbh-co-kg/business-analyst-banking-regulation-reporting-munster-483111,In Deiner fachlichen Rolle als Meldewesenspezialist:in &#x26; Business Analyst:in analysierst und gestaltest Du fachliche Prozesse rund um das aufsichtsrechtliche und statistische Meldewesen. Dabei arbeitest Du an der Sc
raw-0118,2026-07-06,Arbeitnow API,eFLY Marketplace Services GmbH,TikTok & Social Commerce Lead (m/w/d),Marketing & Growth,Marketing and Communication,Senior/Lead,Stuttgart,,Communication; Performance Marketing,Marketing and Communication,66420,95580,81000,83.7,48,38.6,123,https://www.arbeitnow.com/jobs/companies/efly-marketplace-services-gmbh/tiktok-social-commerce-lead-stuttgart-50344,"Als Amazon-Agentur wissen wir, wie Marktplätze funktionieren. Jetzt gehen wir den nächsten Schritt. In dieser neuen Schlüsselposition bist du nicht für ein paar Ads zuständig. Du bist der Architekt unseres TikTok-Cores ."
raw-0119,2026-07-06,Arbeitnow API,DTAD GmbH,Fullstack Developer (m/w/d) remote,Software & Engineering,Software Development,Mid-level,Berlin,berufserfahren,TypeScript; Full Stack; Frontend; Backend; Cloud; AWS,Software Development,72160,103840,88000,65.7,70,44.1,94,https://www.arbeitnow.com/jobs/companies/dtad-gmbh/fullstack-developer-remote-berlin-381511,Wir haben die DTAD GmbH vor über 20 Jahren in Berlin gegründet. Unser Ziel immer vor Augen: Unternehmen zum größtmöglichen Erfolg im Vertrieb zu verhelfen. Mehr als 13.500 Nutzer:innen vertrauen uns und nutzen die DTAD P
raw-0120,2026-07-06,Arbeitnow API,Quantum-Systems GmbH,(Senior) Embedded Software Engineer - Reliant,Software & Engineering,Internet and software,Senior/Lead,Gilching,"Full-time permanent, mid",Communication; Operations; Security; Testing; Design; CI/CD; AI,Internet and software; professional,97416,140184,118800,80.7,56,42.1,112,https://www.arbeitnow.com/jobs/companies/quantum-systems-gmbh/senior-embedded-software-engineer-reliant-gilching-357524,"As an Embedded Software Engineer , you are a key member of our Architecture team, developing and implementing the core embedded software that enables our autonomous long-range VTOL platforms to operate safely, reliably, "
raw-0121,2026-07-06,Arbeitnow API,EPOS CAT GmbH,Spezialist Softwareverteilung (m/w/d),Software & Engineering,System and Network Administration,Unspecified,Ingolstadt,,CI/CD,System and Network Administration,66387,95533,80960,52,38,30.3,136,https://www.arbeitnow.com/jobs/companies/epos-cat-gmbh/spezialist-softwareverteilung-ingolstadt-307320,EPOS ist ein mittelständisches IT-Unternehmen mit Hauptsitz in Ingolstadt und Teil einer internationalen Unternehmensgruppe. Wir sind auf die langfristige Betreuung unserer Kunden im Enterprise-Umfeld spezialisiert und a
raw-0122,2026-07-06,Arbeitnow API,Holzhey-Consulting GmbH,Videograph & Video-Editor (m/w/d),Software & Engineering,Marketing and Communication,Unspecified,Mannheim,,Communication; Editing; Video Editing,Marketing and Communication,66387,95533,80960,72.4,38,30.3,136,https://www.arbeitnow.com/jobs/companies/holzhey-consulting-gmbh/videograph-video-editor-mannheim-343436,"Für dich entsteht starke Videoproduktion nicht durch Bauchgefühl, sondern durch Präzision, Verlässlichkeit und einen sauberen technischen Workflow – bei der Aufnahme genauso wie im Schnitt? Wir produzieren kontinuierlich"
raw-0123,2026-07-06,Arbeitnow API,ATIX AG,IT Consultant Infrastructure Automation (m/w/d),Software & Engineering,Consulting,Mid-level,Garching,berufserfahren,Kubernetes; Automation; Onboarding; Python; Docker; Sales,Consulting; Engineering,72160,103840,88000,69.7,54,37.2,115,https://www.arbeitnow.com/jobs/companies/atix-ag/it-consultant-infrastructure-automation-garching-132616,"Als dynamisches und wachsendes Technologieunternehmen sind wir immer auf der Suche nach Menschen mit großem Potenzial und einer noch größeren Portion Leidenschaft. ATIX-Mitarbeiter:innen sind innovative, technikaffine, L"
raw-0124,2026-07-06,Arbeitnow API,SEOMATIK GmbH,Praktikum Online-Marketing / Marketing / KI / AI,Marketing & Growth,Marketing and Communication,Internship/Student,Bielefeld,"Internship, hilfstätigkeit / student",Communication; Social Media; Startup; SEO; AI,Marketing and Communication,27060,38940,33000,82.2,38,30.3,136,https://www.arbeitnow.com/jobs/companies/seomatik-gmbh/praktikum-online-marketing-marketing-ki-ai-bielefeld-249091,Die SEOMATIK GmbH ist eine der führenden Online-Marketing-Agenturen in Europa. Als Full-Service-Agentur in der digitalen Vermarktung von Produkten und Websites liegen unsere Kernkompetenzen in den Bereichen Suchmaschinen
raw-0125,2026-07-06,Arbeitnow API,ATIX AG,Support- und Operations-Engineer (m/w/d),Software & Engineering,Information Systems,Unspecified,Garching,,Onboarding; Operations,Information Systems,66387,95533,80960,72.8,38,30.3,136,https://www.arbeitnow.com/jobs/companies/atix-ag/support-und-operations-engineer-garching-447697,Zum Ausbau unseres Geschäftsbetriebes suchen wir hochmotivierte Mitarbeiter (m/w/d) für unser Support- und Operations- Team. Das Team bearbeitet technische Support-Anfragen unserer Kunden rund um unser Produkt orcharhino
raw-0126,2026-07-06,Arbeitnow API,pangea energy GmbH,Junior-Ingenieur Energieplanung (m/w/d),Software & Engineering,Power Engineering and Environmental Engineering,Entry-level,Rheine,,Python; JavaScript; API; Cloud,Power Engineering and Environmental Engineering,54120,77880,66000,82,62,40.7,104,https://www.arbeitnow.com/jobs/companies/pangea-energy-gmbh/junior-ingenieur-energieplanung-rheine-119988,"Bei pangea energy planst du keine Heizungsanlage für irgendein Einfamilienhaus. Du entwickelst Energiesysteme, die ganze Quartiere klimaneutral versorgen – mit Wärmepumpen, Wärmenetzen, PV-Anlagen und smarter Steuerung. "
raw-0127,2026-07-06,Arbeitnow API,Sparkasse Karlsruhe,Sachbearbeitung Bauassistenz (m/w/d) mit einem Arbeitszeitumfang von 60%,Product & Project Management,Finance,Unspecified,Karlsruhe,,Finance,Finance,57334,82506,69920,63.5,38,30.3,136,https://www.arbeitnow.com/jobs/companies/sparkasse-karlsruhe/sachbearbeitung-bauassistenz-mit-einem-arbeitszeitumfang-von-60-karlsruhe-127868,"Mit einer Bilanzsumme von über 12 Mrd. €, ca. 1.300 Mitarbeitenden und einer über 213-jährigen Unternehmensgeschichte sind wir eines der größten und das älteste selbstständige Finanzdienstleistungsinstitut unserer Region"
raw-0128,2026-07-06,Arbeitnow API,pangea energy GmbH,(Senior) Ingenieur Wärmenetze / TGA (m(w/d),Software & Engineering,Power Engineering and Environmental Engineering,Senior/Lead,Rheine,,Python; JavaScript; API; Cloud,Power Engineering and Environmental Engineering,97416,140184,118800,82,72,49,91,https://www.arbeitnow.com/jobs/companies/pangea-energy-gmbh/senior-ingenieur-warmenetze-tga-mw-d-rheine-207272,"Wir sind eine Transformationsgesellschaft für die Energiewende – und das meinen wir buchstäblich. Von unserem Standort in Rheine (Münsterland) aus planen und realisieren wir intelligente, sektorgekoppelte Wärmenetze und "
