job_id,date_posted,source,company,title,category,raw_category,seniority,location,job_type,skills,tags_raw,salary_min_usd,salary_max_usd,salary_mid_usd,demand_index,scarcity_score,time_to_fill_days_proxy,application_volume_proxy,source_url,description_preview
raw-0085,2026-05-27,Arbeitnow API,visionm GmbH - part of Talentor (vormals Kaiser Stähler Rekrutierungsberatung),Sepcialist Controlling & Finance (m/w/d),Finance & Business,Controlling,Mid-level,Gera,berufserfahren,Finance; ERP; SAP,Controlling,55760,80240,68000,58.3,38,30.3,136,https://www.arbeitnow.com/jobs/companies/visionm-gmbh-part-of-talentor-vormals-kaiser-stahler-rekrutierungsberatung/sepcialist-controlling-finance-gera-171981,"Sie konnten bereits erste Erfahrungen in den Bereichen Controlling und Finanzen sammeln und möchten in einem internationalen Umfeld weiter wachsen? Dann übernehmen Sie bei unserem Kunden eine spannende Funktion als ""Spec"
raw-0086,2026-05-27,Arbeitnow API,Cordes & Graefe KG,Product Owner Data Platform (m/w/d),Software & Engineering,Business Analyst,Mid-level,Stuhr,berufserfahren,Power BI; Python; Azure; CI/CD,Business Analyst,72160,103840,88000,57.6,54,37.2,115,https://www.arbeitnow.com/jobs/companies/cordes-graefe-kg/product-owner-data-platform-stuhr-178900,"Gestalte datengetriebene Zukunft als Product Owner Data Platform (m/w/d)! Du willst E-Commerce aktiv mitgestalten, innovative Datenprodukte entwickeln und eine moderne Datenplattform kontinuierlich weiterentwickeln? Dann"
raw-0087,2026-05-27,Arbeitnow API,SAPPLIER GmbH,SAP Integration Architect (m/w/d) / 60% Home Office Anteil,Software & Engineering,SAP/ERP Consulting,Unspecified,Mannheim,,ERP; SAP; Cloud; API,SAP/ERP Consulting; Development,66387,95533,80960,70.6,54,37.2,115,https://www.arbeitnow.com/jobs/companies/sapplier-gmbh/sap-integration-architect-60-home-office-anteil-mannheim-379329,"Für ein sehr renommiertes Unternehmen suchen wir zum nächstmöglichen Zeitpunkt einen SAP Integration Architect (m/w/d). Aufgaben Sie konzipieren Integrationskonzepte, arbeiten die vorhandene Integrationsstrategie weiter "
raw-0088,2026-05-27,Arbeitnow API,casavi GmbH,(Senior) Recruiting Manager (m/f/d),Software & Engineering,Remote,Senior/Lead,Munich,professional / experienced,Recruitment; Stakeholder Management; Design; Agile; Sales; SaaS; AI,Remote; Recruitment and Selection,97416,140184,118800,67.8,48,38.6,123,https://www.arbeitnow.com/jobs/companies/casavi-gmbh/senior-recruiting-manager-munich-404701,"Your mission As a Recruiting Manager, your mission is to secure the foundation of our organisation through high-quality recruiting, while concurrently catapulting our recruitment processes into the next technological era"
raw-0089,2026-05-27,Arbeitnow API,SAPPLIER GmbH,SAP Integration Consultant (m/w/d) / 60% Home Office Anteil,Software & Engineering,SAP/ERP Consulting,Unspecified,Mannheim,,ERP; SAP; Cloud; API,SAP/ERP Consulting; Development,66387,95533,80960,70.6,54,37.2,115,https://www.arbeitnow.com/jobs/companies/sapplier-gmbh/sap-integration-consultant-60-home-office-anteil-mannheim-484042,Für ein sehr renommiertes Unternehmen suchen wir zum nächstmöglichen Zeitpunkt einen SAP Integration Consultant (m/w/d). Aufgaben Sie entwickeln und implementieren Integrationsszenarien mithilfe der SAP Integration Suite
raw-0090,2026-05-27,Arbeitnow API,SumUp,Product Analytics Lead,Data & AI,Unspecified,Senior/Lead,"Berlin, Berlin, Germany",,Data Analysis; Communication; Testing; SQL,,94095,135405,114750,61.7,53,40.8,116,https://www.arbeitnow.com/jobs/companies/sumup/product-analytics-lead-berlin-493213,"The Manage My Money (MMM) team builds the financial tools that help merchants stay on top of their money - from business banking and card products to lending, invoicing, and integrated financial insights.&nbsp; It's one "
raw-0091,2026-05-27,Arbeitnow API,Wolt - English,Senior Territory Sales Manager / Vertriebsmitarbeiter (m/w/d),HR & Recruitment,Unspecified,Senior/Lead,"Berlin, Berlin, Germany",,Sales,,61992,89208,75600,76.3,48,38.6,123,https://www.arbeitnow.com/jobs/companies/wolt-english/senior-territory-sales-manager-vertriebsmitarbeiter-berlin-329263,"About Wolt At Wolt, we create technology that brings joy, simplicity and earnings to the neighborhoods of the world. In 2014 we started with delivery of restaurant food. Now we're building the delivery of (almost) everyt"
raw-0092,2026-05-27,Arbeitnow API,VOLENTUM Deutschland GmbH,Leiter Finanzen (m/w/d),Product & Project Management,Management,Senior/Lead,Sankt Andreasberg,teamleitung,Product Management; Project Management; Agile; Stakeholder Management,Management; Team Leader,84132,121068,102600,51.2,48,38.6,123,https://www.arbeitnow.com/jobs/companies/volentum-deutschland-gmbh/leiter-finanzen-sankt-andreasberg-360714,"Unser Mandant ist ein mittelständisches, international tätiges Industrieunternehmen mit Sitz im Südharz. Mit rund 110 Mitarbeitenden, internationalen Verbindungen und einer sehr hohen Fertigungstiefe steht das Unternehme"
raw-0093,2026-05-27,Arbeitnow API,bits&birds GmbH,Corporate Controller (m/w/d),Product & Project Management,Finance,Unspecified,Dresden,,Finance; Risk Management; Accounting,Finance,57334,82506,69920,52.5,38,30.3,136,https://www.arbeitnow.com/jobs/companies/bitsbirds-gmbh/corporate-controller-dresden-445186,"Aufgaben Die Koordination von Planung, Budget und Forecast liegt in deiner Hand – inklusive Weiterentwicklung von Methoden und enger Abstimmung mit den Gesellschaften Du verantwortest das Top-Management-Reporting, stells"
raw-0094,2026-05-27,Arbeitnow API,CoStore Holding GmbH,Content Creator / Video Editor für Startup Founder Team,Marketing & Growth,Social Media Manager,Unspecified,Berlin,Side,Social Media; Operations; Startup; Editing; Video Editing,Social Media Manager,45264,65136,55200,60.1,38,30.3,136,https://www.arbeitnow.com/jobs/companies/costore-holding-gmbh/content-creator-video-editor-fur-startup-founder-team-berlin-265038,"Über CoStore &#x26; Hintergrund der offenen Stelle CoStore entwickelt und betreibt moderne Lagercontainerparks in Deutschland. Unsere Kunden mieten flexible Lagerflächen für Umzug, Renovierung, Gewerbe, Fahrzeuge oder zu"
raw-0095,2026-05-27,Arbeitnow API,CoStore Holding GmbH,Content Creator / Video Editor für Startup Founder Team,Marketing & Growth,Social Media Manager,Internship/Student,Berlin,Working student,Social Media; Operations; Startup; Editing; Video Editing,Social Media Manager,27060,38940,33000,60.1,38,30.3,136,https://www.arbeitnow.com/jobs/companies/costore-holding-gmbh/content-creator-video-editor-fur-startup-founder-team-berlin-493455,"Über CoStore &#x26; Hintergrund der offenen Stelle CoStore entwickelt und betreibt moderne Lagercontainerparks in Deutschland. Unsere Kunden mieten flexible Lagerflächen für Umzug, Renovierung, Gewerbe, Fahrzeuge oder zu"
raw-0096,2026-05-27,Arbeitnow API,Cashlink Technologies GmbH,IKT-Drittparteienrisikomanager (m/w/d),Product & Project Management,Remote,Senior/Lead,Frankfurt am Main,berufserfahren,Finance,Remote; Finance,84132,121068,102600,66.5,48,38.6,123,https://www.arbeitnow.com/jobs/companies/cashlink-technologies-gmbh/ikt-drittparteienrisikomanager-frankfurt-am-main-337638,Deine Aufgaben Du übernimmst den Aufbau und die Weiterentwicklung unseres IKT-Drittparteienrisikomanagements (ICT-Third-Party-Risk-Management): Konzeption &#x26; Weiterentwicklung: Erstellung von IKT-Drittparteienmanagem
raw-0097,2026-05-27,Arbeitnow API,bits&birds GmbH,"Data Analyst (m/w/d) mit Schwerpunkt BI, KPI & AI",Data & AI,IT,Unspecified,Dresden,,Data Analytics; Data Science; Power BI; Tableau; Backend; Finance; Cloud; SAP; AI,IT,64124,92276,78200,58.6,59,39.4,108,https://www.arbeitnow.com/jobs/companies/bitsbirds-gmbh/data-analyst-mit-schwerpunkt-bi-kpi-ai-dresden-175473,"Aufgaben Du konzipierst, entwickelst und pflegst BI-Lösungen sowie Datenmodelle in SAC und stellst dabei Datenqualität und -konsistenz sicher Dabei definierst und implementierst du einheitliche KPI- und Datenstandards im"
raw-0098,2026-05-27,Arbeitnow API,MetPro Verpackungs-Service GmbH,Head of IT Europe (m/w/d),Finance & Business,IT,Senior/Lead,Leonberg,,Cloud; ERP; SAP,IT,75276,108324,91800,67.6,56,42.1,112,https://www.arbeitnow.com/jobs/companies/metpro-verpackungs-service-gmbh/head-of-it-europe-leonberg-402534,"Wir, die MetPro Group, sind ein international tätiger Hersteller und Spezialist für innovative Lösungen im Bereich Korrosionsschutz-Verpackungen. Seit mehr als 40 Jahren vertrauen namhafte Unternehmen aus unterschiedlich"
raw-0099,2026-05-27,Arbeitnow API,ZEP GmbH,"UI/UX Designer, AI-Native (m/w/d) - Remote",Product & Project Management,Remote,Mid-level,Ditzingen,berufserfahren,Design; Figma; UI/UX; SaaS; AI,Remote; Product Design; Industrial Design,62320,89680,76000,69.6,38,30.3,136,https://www.arbeitnow.com/jobs/companies/zep-gmbh/ui-ux-designer-ai-native-remote-ditzingen-224699,"Bei ZEP gestalten wir die Zukunft der Arbeit für 3.000+ Unternehmen im deutschen Mittelstand. Aktuell bauen wir unsere nächste Produktgeneration komplett neu (Laravel/Vue.js) und entwickeln parallel neue AI-Produkte, die"
raw-0100,2026-05-27,Arbeitnow API,Callwey GmbH,Praktikant (M/W/D) Online-Redaktion Awards & Events,Marketing & Growth,Marketing and Communication,Internship/Student,Munich,"Internship, hilfstätigkeit / student",Communication; Social Media; Design; Sales,Marketing and Communication,27060,38940,33000,85.1,38,30.3,136,https://www.arbeitnow.com/jobs/companies/callwey-gmbh/praktikant-online-redaktion-awards-events-munich-122762,"Callwey ist ein unabhängiger Buchverlag, gegründet 1884 von Georg D.W. Callwey als visionärer Fachverlag für Architektur und Design, mit Sitz in München. Callwey steht heute für hochwertige Publikationen mit den Themensc"
raw-0101,2026-05-27,Arbeitnow API,CPU Consulting & Software GmbH,Frontend Entwickler (m/w/d),Software & Engineering,Software Development,Mid-level,Munich,berufserfahren,JavaScript; TypeScript; Frontend; Backend; Testing; Docker; Design; CI/CD; Git,Software Development,72160,103840,88000,62.7,46,33.8,125,https://www.arbeitnow.com/jobs/companies/cpu-consulting-software-gmbh/frontend-entwickler-munich-163356,Deine Rolle Du bist auf der Suche nach einer neuen Herausforderung und die Softwareentwicklung ist deine Leidenschaft? Dabei hältst du die Frontend- Seite immer im Blick? Dann bist du bei uns genau richtig! Über uns Die 
raw-0102,2026-05-27,Arbeitnow API,Lassie,Customer Success - Team Lead (m/w/d),Marketing & Growth,Management,Senior/Lead,Berlin,manager,Operations; Finance,Management; Team Leader,66420,95580,81000,69.8,48,38.6,123,https://www.arbeitnow.com/jobs/companies/lassie/customer-success-team-lead-berlin-101936,"Ready to make a paws-itive impact in the pet world? Join Lassie, the InsurTech company taking the Swedish, German, and French pet markets by storm! We've just secured a whopping $75 million in Series C funding, and we're"
raw-0103,2026-05-27,Arbeitnow API,Invia Flights Germany GmbH,(Senior) UI/UX Designer (m/w/d) - App Design / fluege.de,Data & AI,Graphic Arts and Communication Design,Senior/Lead,Berlin,berufserfahren,Communication; Design; Android; Figma; UI/UX; iOS,Graphic Arts and Communication Design,94095,135405,114750,65.1,53,40.8,116,https://www.arbeitnow.com/jobs/companies/invia-flights-germany-gmbh/senior-ui-ux-designer-app-design-fluegede-berlin-412938,"Einleitung Invia Flights Germany ist bekannt für eines der erfolgreichsten Flugportale in Deutschland – . Wir sind Teil der Invia Group, einem paneuropäischen Marktführer im Online-Reisevertrieb, der führende Reiseportal"
raw-0104,2026-05-27,Arbeitnow API,Codewerk GmbH,Office Management (m/w/d),Software & Engineering,Marketing and Communication,Entry-level,Karlsruhe,berufseinstieg,Communication; Excel,Marketing and Communication,54120,77880,66000,69.8,38,30.3,136,https://www.arbeitnow.com/jobs/companies/codewerk-gmbh/office-management-karlsruhe-494842,"Codewerk steht für Technikbegeisterung, Innovation und Zuverlässigkeit mit flachen Hierarchien, Freiraum und Entwicklungsmöglichkeiten. Ob für Züge oder Industrieanlagen – wir entwickeln die nächste Generation von Softwa"
raw-0105,2026-05-27,Arbeitnow API,Brick GmbH,Werkstudent:in (M/W/D) Content Creation,Marketing & Growth,Social Media Manager,Internship/Student,Erfurt,"Working student, hilfstätigkeit / student",Social Media; Design; Video Editing,Social Media Manager,27060,38940,33000,76.9,38,30.3,136,https://www.arbeitnow.com/jobs/companies/brick-gmbh/werkstudentin-content-creation-erfurt-348662,"Für unsere Marken suchen wir Unterstützung im Bereich Content Creation und Social-Media. Wir suchen dich, wenn du gerne kreativ arbeitest, ein gutes Gespür für visuellen Content und Interesse an Spirituosenthemen hast. G"
raw-0106,2026-05-27,Arbeitnow API,alphacoders,ERP-Softwareentwickler (m/w/d),Software & Engineering,SAP/ERP Consulting,Mid-level,Ulm,berufserfahren,ERP; SAP,SAP/ERP Consulting; Development,72160,103840,88000,54.1,38,30.3,136,https://www.arbeitnow.com/jobs/companies/alphacoders/erp-softwareentwickler-ulm-421968,"Gemeinsam mit unserem Partner, einem international tätigen Industrieunternehmen im Bereich hochwertiger medizintechnischer Systemlösungen, suchen wir einen ERP-Softwareentwickler (m/w/d) im Raum Ulm. In dieser Rolle bist"
raw-0107,2026-05-27,Arbeitnow API,Wurst-Basar Konrad Hinsemann GmbH,Personalsachbearbeiter (m/w/d),Product & Project Management,HR,Mid-level,Ronnenberg,berufserfahren,HR,HR,62320,89680,76000,61.1,38,30.3,136,https://www.arbeitnow.com/jobs/companies/wurst-basar-konrad-hinsemann-gmbh/personalsachbearbeiter-ronnenberg-219239,Als mittelständisches Familienunternehmen in Hannover engagieren wir uns mit vollem Einsatz für hochwertige Lebensmittel. Wir produzieren und verkaufen unsere Produkte in unseren Filialen sowie im Lebensmitteleinzelhande
raw-0108,2026-05-27,Arbeitnow API,myScribe GmbH,Senior Customer Success Manager (m/w/d),Software & Engineering,Customer Service,Senior/Lead,Mannheim,berufserfahren,Customer Service; Onboarding; Cloud; SaaS,Customer Service,97416,140184,118800,64.4,56,42.1,112,https://www.arbeitnow.com/jobs/companies/myscribe-gmbh/senior-customer-success-manager-mannheim-440087,"Worum es geht Wir bauen myScribe, eine KI-gestützte Dokumentationslösung, die ÄrztInnen den Rücken freihalten soll, damit sie sich wieder auf das konzentrieren können, wofür sie eigentlich Medizin studiert haben: Patient"
raw-0109,2026-05-27,Arbeitnow API,eepos GmbH,Senior Administrator (m/w/d),Software & Engineering,IT,Senior/Lead,Wiehl,,Cloud,IT,97416,140184,118800,94.6,56,42.1,112,https://www.arbeitnow.com/jobs/companies/eepos-gmbh/senior-administrator-wiehl-438979,"Die eepos GmbH ist ein erfolgreiches und wachsendes Unternehmen, das 2006 in Wiehl bei Köln gegründet wurde und heute mit über 90 Mitarbeitern zu Kito Crosby gehört. Neben dem Hauptsitz in Wiehl verfügt eepos über 15 wel"
raw-0110,2026-05-27,Arbeitnow API,hyrise GmbH,"Talent Acquisition Associate - TZ 30h, 30-35.000€ + Bonus, 100% Remote, m/f/x",Finance & Business,Remote,Entry-level,Berlin,berufseinstieg,Recruitment; Onboarding; Sales; SaaS; HR,Remote; Recruitment and Selection,41820,60180,51000,59.2,38,30.3,136,https://www.arbeitnow.com/jobs/companies/hyrise-gmbh/talent-acquisition-part-time-30h-remote-german-speaker-berlin-89249,"👋 Über hyrise hyrise wurde 2020 mit einer klaren Mission gegründet: Menschen dabei zu helfen, einen Job zu finden, den sie wirklich lieben. Dafür bringen wir ambitionierte Talente mit schnell wachsenden B2B-Tech-Unterne"
raw-0111,2026-05-27,Arbeitnow API,klahn.net,IT-Systemadministrator (m/w/d) in Kiel,Software & Engineering,IT,Unspecified,Kiel,,Cloud,IT,66387,95533,80960,94.6,46,33.8,125,https://www.arbeitnow.com/jobs/companies/klahnnet/it-systemadministrator-in-kiel-264342,"Du hast keine Lust mehr auf reine Ticketbearbeitung und starre Konzernstrukturen? Bei uns übernimmst du Verantwortung, arbeitest direkt mit Kunden und gestaltest moderne IT-Lösungen aktiv mit. Im Jahr 2017 gründete Chris"
raw-0112,2026-05-27,Arbeitnow API,smartkündigen OHG,Customer Success Manager (B2C) (m/w/d) | 100% remote,HR & Recruitment,Remote,Senior/Lead,Neuss,teamleitung,Customer Service,Remote; Customer Service,61992,89208,75600,52.5,48,38.6,123,https://www.arbeitnow.com/jobs/companies/smartkundigen-ohg/customer-success-manager-b2c-100-remote-neuss-491261,"Wir suchen einen Customer Success Manager (B2C) der eigenverantwortlich einen festen Kundenstamm von ca. 2.000+ Kunden betreut. Du bist der zentrale Ansprechpartner und sorgst dafür, dass unsere Kunden optimal betreut we"
raw-0113,2026-05-27,Arbeitnow API,FITYES GmbH,Creative Designer Remote (m/w/d),Marketing & Growth,Remote,Mid-level,Berlin,berufserfahren,Communication; Social Media; Design; Video Editing; AI,Remote; Marketing and Communication,49200,70800,60000,79.5,38,30.3,136,https://www.arbeitnow.com/jobs/companies/fityes-gmbh/creative-designer-remote-berlin-315887,"Wir sind FITYES Eines der schnellst wachsenden Fitness Systeme in der DACH Region. Wir bauen personallose Smart Gyms mit App, AI Coach und einem Designkonzept, das alle anderen Gyms im wahrsten Sinne alt aussehen lässt. "
raw-0114,2026-05-27,Arbeitnow API,Shereen Patzelt,Werkstudent Vertrieb / Finanzberatung (m/w/d) – Praxis statt Theorie,Finance & Business,Finance,Internship/Student,Chemnitz,"Full-time permanent, entry",Finance; Onboarding,Finance; high school or equivalent,30668,44132,37400,60.6,38,30.3,136,https://www.arbeitnow.com/jobs/companies/shereen-patzelt/werkstudent-vertrieb-finanzberatung-praxis-statt-theorie-chemnitz-355125,"Du studierst und willst mehr als einen „Nebenjob“? Du willst Verantwortung, klare Ziele und ein Umfeld, in dem Leistung zählt? Dann ist diese Werkstudentenrolle dein Einstieg in die Finanzberatung, mit strukturiertem Onb"
raw-0115,2026-05-27,Arbeitnow API,COPA Systeme GmbH & Co. KG,Entwickler für den Bereich Dokumentenmanagementsystem (m/w/d),Software & Engineering,Internet and software,Mid-level,Wesel,"Full-time permanent, mid",JavaScript; SQL; CRM; ERP,Internet and software; high school coursework,72160,103840,88000,61.6,38,30.3,136,https://www.arbeitnow.com/jobs/companies/copa-systeme-gmbh-co-kg/entwickler-fur-den-bereich-dokumentenmanagementsystem-wesel-9145,"Wir sind COPA, das führende Beratungs- und Softwarehaus für die Getränkewirtschaft. An mehreren Standorten in Deutschland vertrauen wir seit mehr als 40 Jahren unseren Kunden aus der Getränkebranche. Wir vergrößern uns! "
raw-0116,2026-05-27,Arbeitnow API,Momenth,"Rezeption, Empfang, Administration Physiotherapie-Praxis - Vollzeit, Teilzeit",Software & Engineering,Administration,Entry-level,Sindelfingen,berufseinstieg,Python; JavaScript; API; Cloud,Administration,54120,77880,66000,85.1,62,40.7,104,https://www.arbeitnow.com/jobs/companies/momenth/rezeption-empfang-administration-physiotherapie-praxis-vollzeit-teilzeit-sindelfingen-270697,"Einleitung: MOMENTH ist ein Gesundheitskonzept im Raum Stuttgart und Ludwigsburg, welches sich zur Aufgabe gemacht hat, Menschen dabei zu unterstützen bewusst mit ihrem Körper umzugehen für mehr Gesundheit, Kraft und Leb"
raw-0117,2026-05-27,Arbeitnow API,Jobbusters® GmbH,Firmenkundenberater (m/w/d),HR & Recruitment,Private Banking,Unspecified,Munich,,Recruitment; HR; Onboarding; Communication,Private Banking,42246,60794,51520,62.2,38,30.3,136,https://www.arbeitnow.com/jobs/companies/jobbusters-gmbh/firmenkundenberater-munich-333592,Wir suchen für unseren Kunden einen Firmenkundenberater (m/w/d) im Bereich Bankgeschäft in Festanstellung am Standort München. Attraktive Rahmenbedingungen und tarifliche konstante Lohnsteigerungen Vergütungspaket 100 % 
raw-0118,2026-05-27,Arbeitnow API,Jobbusters® GmbH,Kundenberater (m/w/d) Bankkaufmann,Software & Engineering,Private Banking,Unspecified,Munich,,HR,Private Banking,66387,95533,80960,61.1,38,30.3,136,https://www.arbeitnow.com/jobs/companies/jobbusters-gmbh/kundenberater-bankkaufmann-munich-244007,"Du suchst die Möglichkeit, dein Expertenwissen anzuwenden und einen Arbeitgeber, der deine Expertenlaufbahn in Form von fachlicher und persönlicher Weiterentwicklung erweitert? Die PRIME HR Agentur® stellt Ihnen gerne di"
raw-0119,2026-05-27,Arbeitnow API,Jobbusters® GmbH,Finanzbuchhalter (m/w/d),Finance & Business,Finance,Unspecified,Passau,,Finance,Finance,51299,73821,62560,66.5,38,30.3,136,https://www.arbeitnow.com/jobs/companies/jobbusters-gmbh/finanzbuchhalter-passau-3238,"Für unseren renommierten Auftraggeber, ein international tätiges Unternehmen suchen wir zum nächstmöglichen Zeitpunkt einen erfahrenen Finanzbuchhalter (m/w/d) in unbefristeter Festanstellung. In dieser Position haben Si"
raw-0120,2026-05-27,Arbeitnow API,Jobbusters® GmbH,Finanzbuchhalter (m/w/d),Finance & Business,Finance,Unspecified,Nuremberg,,Finance,Finance,51299,73821,62560,66.5,38,30.3,136,https://www.arbeitnow.com/jobs/companies/jobbusters-gmbh/finanzbuchhalter-nuremberg-235597,Zahlenjäger/in in der Buchhaltung gesucht! 📍 Standort: Nürnberg 🕰️ Eintritt: so schnell wie dein Taschenrechner rechnet 📄 Beschäftigungsart: Vollzeit Du spürst es genau – da spukt noch etwas im Zahlenwerk. Ein offener
raw-0121,2026-05-27,Arbeitnow API,Jobbusters® GmbH,Buchhalter (m/w/d),Product & Project Management,Finance,Unspecified,Gröbenzell,,Finance,Finance,57334,82506,69920,66.5,38,30.3,136,https://www.arbeitnow.com/jobs/companies/jobbusters-gmbh/buchhalter-grobenzell-51581,"Wir bieten Ihnen die Chance, sich vielseitig einzubringen und Verantwortung zu übernehmen – in einem Unternehmen mit Herz, welches wir persönlich sehr gut kennen und die inhaberführte, freundliche Kultur wertschätzen. Un"
raw-0122,2026-05-27,Arbeitnow API,Jobbusters® GmbH,WEG-Buchhalter (m/w/d),Product & Project Management,Finance,Unspecified,Munich,,Finance,Finance,57334,82506,69920,66.5,38,30.3,136,https://www.arbeitnow.com/jobs/companies/jobbusters-gmbh/weg-buchhalter-munich-432735,"Mit Ihrem scharfen Spürsinn für WEG-Buchhaltung und Ihrer freundlichen, bodenständigen Art sind Sie für Kolleginnen, Kollegen und Eigentümer ein vertrauensvoller Ansprechpartner – fast wie ein guter Hausgeist, der stets "
raw-0123,2026-05-27,Arbeitnow API,XCNT GmbH,Werkstudent (m/w/d) - AI Adoption & Use Case Enablement,Software & Engineering,IT,Internship/Student,Berlin,Working student,AI,IT,39688,57112,48400,81.6,38,30.3,136,https://www.arbeitnow.com/jobs/companies/xcnt-gmbh/werkstudent-ai-adoption-use-case-enablement-berlin-291282,Über uns Wir bei XCNT haben einen klaren Auftrag: Künstliche Intelligenz in echten Unternehmenswert übersetzen. Innerhalb unserer Konzernstruktur bauen wir aktiv die AI-Fähigkeiten auf – mit einem klaren Commitment: Nich
raw-0124,2026-05-27,Arbeitnow API,Omnora GmbH,Account Executive (m/w/d) – B2B SaaS / Enterprise,Software & Engineering,Business Development,Mid-level,Frankfurt am Main,berufserfahren,Sales; SaaS,Business Development,72160,103840,88000,65.9,38,30.3,136,https://www.arbeitnow.com/jobs/companies/omnora-gmbh/account-executive-b2b-saas-enterprise-frankfurt-am-main-328845,"Introduction Als Account Executive bei Omnora übernimmst du eine zentrale Rolle im operativen B2B SaaS Vertrieb mit Fokus auf Enterprise-Kunden und gehobenen Mittelstand. Du verantwortest deine eigene Pipeline, führst De"
raw-0125,2026-05-27,Arbeitnow API,Omnora GmbH,Senior Account Executive (m/w/d),Finance & Business,Business Development,Senior/Lead,Frankfurt am Main,berufserfahren,Sales; SaaS,Business Development,75276,108324,91800,65.9,48,38.6,123,https://www.arbeitnow.com/jobs/companies/omnora-gmbh/senior-account-executive-frankfurt-am-main-361762,"Introduction Du bist verantwortlich für die Leitung und die systematische Weiterentwicklung unseres B2B SaaS Enterprise Neukundenvertriebs. Wir sind davon überzeugt, dass man nur managen kann, was man auch in der Tiefe v"
raw-0126,2026-05-27,Arbeitnow API,Intermarkt Thielen Vertriebs GmbH,Ausbildung zum Fachinformatiker für Systemintegration (m/w/d),Cybersecurity & IT,System and Network Administration,Internship/Student,Geldern,"Apprenticeship, berufseinstieg",ERP,System and Network Administration,36080,51920,44000,57.8,43,32.5,129,https://www.arbeitnow.com/jobs/companies/intermarkt-thielen-vertriebs-gmbh/ausbildung-zum-fachinformatiker-fur-systemintegration-geldern-333418,"Schule geschafft und bereit für eine neue Challengeß Dann starte jetzt deine Ausbildung als Fachinformatiker für Systemintegration (m/w/d) bei uns! Supporte dein Team bei technischen Herausforderungen, arbeite an moderne"
raw-0127,2026-05-27,Arbeitnow API,reif & möller diagnostic-network AG,Marketing-Manager,Cybersecurity & IT,Marketing and Communication,Senior/Lead,Dillingen,,Communication; Social Media; SEO,Marketing and Communication,88560,127440,108000,67.2,53,40.8,116,https://www.arbeitnow.com/jobs/companies/reif-moller-diagnostic-network-ag/marketing-manager-dillingen-125565,"Die reif &#x26; möller diagnostic-network AG ist ein wachsendes Teleradiologie-Netzwerk mit Sitz in Dillingen/Saar. Wir versorgen Krankenhäuser, Kliniken und radiologische Einrichtungen in Deutschland, Österreich und Lie"
raw-0128,2026-05-27,Arbeitnow API,Wavestone Germany AG,Microsoft Fabric-Spezialist (m/w/d) (Ref.Nr.: 46868),Product & Project Management,IT,Mid-level,Kiel,"Freelance, berufserfahren",Product Management; Project Management; Agile; Stakeholder Management,IT,62320,89680,76000,51.1,38,30.3,136,https://www.arbeitnow.com/jobs/companies/wavestone-germany-ag/microsoft-fabric-spezialist-refnr-46868-kiel-409591,"Wir suchen für ein Projekt im Bereich Business Intelligence einen versierten Spezialisten für Microsoft Fabric. Der Fokus liegt auf der technischen Einführung, Konfiguration und Implementierung der Plattform sowie deren "
