source,source_url,date_posted,company,title,category,location,job_type,tags_raw,description
Arbeitnow API,https://www.arbeitnow.com/jobs/companies/taxtalentede/steuerberater-in-wedemark-auf-wunsch-mit-partnerperspektive-gesucht-mindestens-90000eur-147511,2026-07-02T07:00:56,Taxtalente.de,"Steuerberater (m/w/d) in Wedemark, auf Wunsch mit Partnerperspektive, gesucht - mindestens 90.000€",Directors,Wedemark,,Directors; Chief Executives,"TaxTalente ist die Nr. 1 Job-Matching Plattform für Jobsuchende in der Steuerberatung. Sie suchen eine positive berufliche Veränderung? Sie möchten den nächsten Schritt in Ihrer Karriere gehen und streben möglicherweise sogar eine Partnerschaft in einer zukunftsorientierten Kanzlei an? Sie möchten endlich wieder in einem positiven Arbeitsumfeld arbeiten, in dem Sie finanziell und persönlich wertgeschätzt werden? Sie suchen nach Tätigkeiten, die Sie auch wirklich weiterbringen? Sofern Sie sich in mindestens einem der genannten Punkte wiederfinden, sollten Sie sich bei uns melden. Wir haben die attraktivsten Arbeitgeber der Steuerberatungsbranche in unserem Netzwerk und bringen zusammen, was zusammengehört. Grenzenlose Entwicklungschancen mit Partnermöglichkeiten, vielschichtige Tätigkeitsbereiche, Gehälter wie in der Industrie und vieles mehr – melden Sie sich bei uns und wir unterstützen Sie auf Ihrem weiteren Karriereweg! Derzeit suchen wir nach einem Steuerberater (m/w/d) für eine unserer Partner-Kanzleien in Wedemark Bei Rückfragen kannst du dich gerne jederzeit (auch nach deinem Feierabend) direkt telefonisch an Herrn Becker-Koch über folgende Nummer wenden: 015901431130 Aufgaben Wir bringen zusammen, was zusammengehört. Dabei spielt das passende Tätigkeitsprofil natürlich eine entscheidende Rolle. Bei unserer Partnerkanzlei können Sie sich Ihren Aufgabenbereich auf Basis Ihrer persönlichen Stärken und Schwächen selbst zusammenstellen. Erstellung und Review von Jahresabschlüssen Erstellung von Steuererklärungen für Personen- und Kapitalgesellschaften Steuerliche Sonderberatungsprojekte auf Basis individueller Qualifikationen B. in den Bereichen der Erbschaftsteuer oder des Umwandlungssteuerrechts Begleitung von Betriebsprüfungen Teamleitung und Personalverantwortung (optional) Weitere individuell wählbare Tätigkeitsbereiche , die Ihnen Freude bringen Qualifikation Am Ende sollte es für beide Seiten passen. Deshalb wäre es gut, wenn Sie sich in den folgenden Punkten wiederfinden. Kommunikative Art und Freude am Austausch mit Mandanten Sorgfältige , effiziente und gewissenhafte Arbeitsweise Offen für eine digitale Arbeitsweise Führungsverständnis und Verantwortungsbewusstsein gegenüber Mitarbeitern (optional) Ein erfolgreich abgeschlossenes Steuerberaterexamen Leidenschaft für steuerliche Themen Benefits Sie haben genug von 0815 Benefits, von denen Sie nicht wirklich profitieren? Dann sollten Sie einen Blick auf die nachfolgenden Benefits werfen. Außerordentliche Vergütung von 90.000 € bis 130.000 € / Jahr, auf Wunsch auch Partnerperspektive Flexible Gestaltung der Arbeitszeiten sowie die Option auf Home-Office Nettolohnoptimierung mit monatlichen 50,00€ Sachbezugsgutscheinen Umfangreiche Unterstützung bei Weiterbildungsmaßnahmen wie z.B. Fachberater Qualifikationen Modernste Ausstattung mit digitalen Prozessen Starker Teamzusammenhalt und regelmäßige Teamevents Schnell, unkompliziert und effizient Ihren Traumjob finden – ein Versprechen an Sie, dass wir aufgrund unseres selektiven, breit gefächerten und deutschlandweiten Kanzleinetzwerks halten werden. lhre Vorteile mit uns auf einen Blick: Sie führen keine unsinnigen Bewerbungsgespräche mehr, bei denen Sie während des Bewerbungsprozesses merken, dass es (bspw. wegen des Gehalts) sowieso nicht passt - wir klären vor Ihrem Bewerbungsgespräch all Ihre mit uns besprochenen Kriterien mit der Kanzlei ab. Wir führen Ihre Gehaltsverhandlungen und kennen die Gehaltsstrukturen der Branche dabei bestens. 100% Anonymität – solange Sie uns nicht das „Go“ geben und einem Kennenlernen mit Ihrem neuen potentiellen Arbeitgeber zustimmen, erfährt niemand von Ihrem Namen oder Ihren bisherigen Arbeitgebern – Ihre Ihnen wichtigen Kriterien können wir auch zunächst anonym mit unseren Partnerkanzleien klären. Attraktive Kanzleien – die Kanzleien in unserem breit gefächerten Kanzleinetzwerk sind selektiv ausgewählt und heben sich klar von “normalen” Kanzleien ab (z.B. hinsichtlich der Vergütung, "
Arbeitnow API,https://www.arbeitnow.com/jobs/companies/sumup/talent-acquisition-partner-berlin-49251,2026-07-02T06:45:25,SumUp,Talent Acquisition Partner,,"Berlin, Berlin, Germany",,,"About the role You have probably used our card readers to buy a cappuccino or pay your hairdresser already. We are passionate about creating an excellent experience that enables our merchants to start, run, and grow their own businesses. At SumUp, our Tech teams are the backbone that build incredible products and ensure a seamless experience for our millions of merchants. We are seeking a strategic &nbsp;Talent Acquisition Partner to be the force behind their growth. In this role, you will build the talent engine that directly accelerates our product delivery and business objectives. You won't just be filling roles; you will build a predictable, high-quality talent funnel that gives SumUp a competitive edge. Your success will be measured by your ability to secure the critical technical expertise that fuels our innovation. What you'll do: Serve as a key advisor to Engineering, Product, Design, Supply Chain and Logistics leadership, utilizing market intelligence and hiring data to consult on talent strategy, shape role requirements, and influence key hiring decisions. Develop and execute innovative sourcing strategies to build a robust and predictable talent funnel for current and future needs, reducing time-to-hire and ensuring a consistent flow of high-caliber candidates. Drive the end-to-end recruitment lifecycle with a relentless focus on performance metrics, including quality of hire, pipeline velocity, and offer acceptance rates. Continuously refine and scale our recruitment processes to maximise efficiency, improve hiring outcomes, and deliver a best-in-class experience for both candidates and hiring managers. Lead data-informed employer branding initiatives and recruitment campaigns that measurably increase the quality of our inbound applicant pool for critical tech roles. Own the candidate journey from initial contact to onboarding, ensuring every interaction is optimised to engage, attract, and convert top-tier talent. You'll be great for this role if: You are fluent in English; and able to communicate effectively with colleagues across locations in a truly global team. You have demonstrated competence in interviewing, sourcing, and stakeholder management. You possess strong project management, organisational, and negotiation skills. You are an excellent communicator with strong critical thinking and problem-solving abilities. You are adaptable and flexible, with a strong sense of curiosity and learning agility. You are analytical and have a solid understanding of recruiting metrics and how to derive actions from them. You have knowledge of the local talent landscape in Germany and Europe. You currently have legal right to work in Germany.&nbsp; This role doesn't offer relocation or visa sponsorship. Why you should join SumUp The opportunity to work on large scale fintech products used by millions of small businesses around the world A dedicated annual Learning &amp; Development budget for attending conferences and/or advancing your career through further education Enrollment onto our virtual stock ownership program - you will own a stake in SumUp's future success A corporate pension scheme&nbsp; 28 days paid leave + 1 for birthday&nbsp; You'll attend global offsites and/or hackathons. You'd enjoy other great benefits such as Urban Sports Club subsidy, Kita placement assistance, subsidized office lunches and other location-tailored benefits, Babbel language platform subscription and more! Job Application Tip We recognise that candidates feel they need to meet 100% of the job criteria in order to apply for a job. Please note that this is only a guide. If you don't tick every box, it's ok too because it means you have room to learn and develop your career at SumUp. Find Jobs in Germany on Arbeitnow"
Arbeitnow API,https://www.arbeitnow.com/jobs/companies/wellhub/sales-development-senior-manager-berlin-49487,2026-07-02T06:45:25,Wellhub,Sales Development Senior Manager,,"Berlin, Berlin, Germany",,,"Your wellbeing, our mission. Join a company shaping a healthier world. GET TO KNOW US At Wellhub we're revolutionizing workplace wellness. Our platform connects employees worldwide to the best partners for fitness, mindfulness, therapy, nutrition, and sleep—all in one simple subscription. Headquartered in NYC with team members in Europe, North America and South America, we're on a mission to make every company a wellness company.We believe work should be fulfilling, inspiring, and balanced. Here, you'll find a team that values wellbeing, collaboration, and different perspectives, where passion and creativity push boundaries to create real impact. Your contributions will help shape a healthier, more balanced world for you and millions of people globally.&nbsp; Join us in redefining the future of wellbeing! &nbsp; THE OPPORTUNITY We are hiring a&nbsp; Sales Development Senior Manager &nbsp; to join our Sales team in Berlin! &nbsp; This is a hybrid role, requiring a minimum of two days per week in our office. YOUR IMPACT Act as the direct leader and mentor for our front-line Business Development Representative (BDR) team, fostering a culture of growth and purpose. Conduct live call-shadowing and deep-dive reviews to sharpen your team's ability to communicate the transformative power of Wellhub. Take full accountability for a team of 5–8 BDRs, guiding their professional journey and ensuring they hit the milestones that drive our mission forward. Lead the interview process for new talent and execute a seamless onboarding program that gets new starters hitting ""active"" status within 30 days. Excellence in building strong partnerships with marketing and sales. Deeply understand the UK B2B ecosystem to teach your team how to position wellbeing as a ""business-critical"" priority for CHROs and CFOs. Pivot messaging based on market shifts to ensure Wellhub remains a vital solution for companies navigating industry headwinds. Manage the ""speed-to-lead"" for inbound inquiries, ensuring high conversion rates through rigorous qualification. Work with the team to build hyper-personalised outbound ""clusters."" You'll move beyond generic sequences to high-intent, research-backed prospecting. Ensure the team is getting maximum ROI out of Salesforce, LinkedIn Sales Navigator, and AI-assisted prospecting tools. Develop the best-in-class strategies for managing the rep's book of business and running the outreach-prospecting playbook and turning curiosity into attention with intention. Live the mission: inspire and empower others by genuinely caring for your own wellbeing and your colleagues. Bring wellbeing to the forefront of work, and create a supportive environment where everyone feels comfortable taking care of themselves, taking time off, and finding work-life wellness. WHO YOU ARE Proven Track Record: 5+ years in Sales, with at least 1-2 years of experience as a Lead BDR or Front-line Manager. The ""Coach"" DNA: A passion for seeing others succeed. You can look at a conversion funnel and pinpoint exactly where the ""leak"" is-whether it's the initial hook, the discovery call, or the hand-off to the AE. Proven experience managing SDR/BDR teams for a Challenger Brand or a ""non-commodity"" solution. You must demonstrate the ability to create urgency for a product that is not yet a ""household name"" or is perceived as discretionary spend. You have moved beyond ""feature-selling"" and can coach reps to pivot from Product Interest to Business Impact. You should be able to show how you've successfully positioned a solution as ""mission-critical"" during budget-conscious cycles. You are familiar with the HR space and can talk the CHRO language. We recognize that individuals approach job applications differently. We strongly encourage all aspiring applicants to go for it, even if they don't match the job description 100%. We welcome your application and will be delighted to explore if you could be a great fit for our team.&nbsp; &nbsp; WHAT WE OFFER YOU&nbsp; With"
Arbeitnow API,https://www.arbeitnow.com/jobs/companies/wellhub/client-success-account-executive-ii-cologne-79524,2026-07-02T06:45:25,Wellhub,Client Success Account Executive II,,"Cologne, North Rhine-Westphalia, Germany",,,"Your wellbeing, our mission. Join a company shaping a healthier world. GET TO KNOW US At Wellhub we're revolutionizing workplace wellness. Our platform connects employees worldwide to the best partners for fitness, mindfulness, therapy, nutrition, and sleep—all in one simple subscription. Headquartered in NYC with team members in Europe, North America and South America, we're on a mission to make every company a wellness company.We believe work should be fulfilling, inspiring, and balanced. Here, you'll find a team that values wellbeing, collaboration, and different perspectives, where passion and creativity push boundaries to create real impact. Your contributions will help shape a healthier, more balanced world for you and millions of people globally.&nbsp; Join us in redefining the future of wellbeing! &nbsp; THE OPPORTUNITY We are hiring a Client Success Account Executive II &nbsp; to join our Sales team in Cologne! This is a hybrid role, requiring a minimum of two days per week in our office. YOUR IMPACT Own client relationships for a portfolio of large accounts after the point-of-sale throughout the client life cycle, including leading all client meetings/communications virtually and in person. Ensure a trusting and valuable relationship with your HR contacts by sharing our mission to improve employee health, engagement, and happiness. Understand clients' objectives and deliver solutions by developing client-specific growth strategies. Drive initial client launch as well as ongoing, strategic relaunch and awareness events; partner with the Wellhub Wellbeing Engagement Team to assist in end-to-end implementation. Present &amp; implement best practice workflows to the client as well as review member growth rates, suggest member growth strategies, and provide relevant Wellhhub updates. Collaborate closely with the Wellbeing Engagement, Customer Experience, Operations, User Growth Marketing, Fitness Partnerships, and Business Development teams to develop member growth strategies and deliver on client and company goals. Analyze client data; share findings, and develop tailored communication and awareness strategies to increase user engagement to better defeat inactivity. Own the commercial agenda for the clients in your portfolio, including renewing, expanding, and renegotiating contracts on an annual basis. Live the mission: inspire and empower others by genuinely caring for your own wellbeing and your colleagues. Bring wellbeing to the forefront of work, and create a supportive environment where everyone feels comfortable taking care of themselves, taking time off, and finding work-life wellness. WHO YOU ARE An accomplished individual with experience managing client relationships in a client-facing position. A dynamic person with the ability to collaborate with cross-functional teams, work in a team environment, and solve problems creatively and efficiently. An excellent communicator, with superior customer service to internal and external clients. Detail-oriented with a deep understanding of managing multiple clients/projects concurrently. Fluent in monitoring data, analyzing reports, and leveraging results. Able to analyze and improve current job processes/protocols and anticipate/manage change in a quick-moving global business environment. You are an excellent communicator both verbally and written, in Spanish and English Portuguese is a Plus. We recognize that individuals approach job applications differently. We strongly encourage all aspiring applicants to go for it, even if they don't match the job description 100%. We welcome your application and will be delighted to explore if you could be a great fit for our team.&nbsp; &nbsp; WHAT WE OFFER YOU&nbsp; With thoughtful benefits, emotional wellbeing resources, and a culture that empowers you to take ownership of your role and your wellbeing, we create an environment where you can thrive in all dimensions of your life. Our benefits include: WELLHUB: &nbsp; Free Gold me"
Arbeitnow API,https://www.arbeitnow.com/jobs/companies/wellhub/client-success-account-executive-ii-berlin-68778,2026-07-02T06:45:25,Wellhub,Client Success Account Executive II,,"Berlin, Berlin, Germany",,,"Your wellbeing, our mission. Join a company shaping a healthier world. GET TO KNOW US At Wellhub we're revolutionizing workplace wellness. Our platform connects employees worldwide to the best partners for fitness, mindfulness, therapy, nutrition, and sleep—all in one simple subscription. Headquartered in NYC with team members in Europe, North America and South America, we're on a mission to make every company a wellness company.We believe work should be fulfilling, inspiring, and balanced. Here, you'll find a team that values wellbeing, collaboration, and different perspectives, where passion and creativity push boundaries to create real impact. Your contributions will help shape a healthier, more balanced world for you and millions of people globally.&nbsp; Join us in redefining the future of wellbeing! &nbsp; THE OPPORTUNITY We are hiring a Client Success Account Executive II &nbsp; to join our Sales team in Berlin! &nbsp; This is a hybrid role, requiring a minimum of two days per week in our office. YOUR IMPACT Own client relationships for a portfolio of large accounts after the point-of-sale throughout the client life cycle, including leading all client meetings/communications virtually and in person. Ensure a trusting and valuable relationship with your HR contacts by sharing our mission to improve employee health, engagement, and happiness. Understand clients' objectives and deliver solutions by developing client-specific growth strategies. Drive initial client launch as well as ongoing, strategic relaunch and awareness events; partner with the Wellhub Wellbeing Engagement Team to assist in end-to-end implementation. Present &amp; implement best practice workflows to the client as well as review member growth rates, suggest member growth strategies, and provide relevant Wellhhub updates. Collaborate closely with the Wellbeing Engagement, Customer Experience, Operations, User Growth Marketing, Fitness Partnerships, and Business Development teams to develop member growth strategies and deliver on client and company goals. Analyze client data; share findings, and develop tailored communication and awareness strategies to increase user engagement to better defeat inactivity. Own the commercial agenda for the clients in your portfolio, including renewing, expanding, and renegotiating contracts on an annual basis. Live the mission: inspire and empower others by genuinely caring for your own wellbeing and your colleagues. Bring wellbeing to the forefront of work, and create a supportive environment where everyone feels comfortable taking care of themselves, taking time off, and finding work-life wellness. WHO YOU ARE An accomplished individual with experience managing client relationships in a client-facing position. A dynamic person with the ability to collaborate with cross-functional teams, work in a team environment, and solve problems creatively and efficiently. An excellent communicator, with superior customer service to internal and external clients. Detail-oriented with a deep understanding of managing multiple clients/projects concurrently. Fluent in monitoring data, analyzing reports, and leveraging results. Able to analyze and improve current job processes/protocols and anticipate/manage change in a quick-moving global business environment. You are an excellent communicator both verbally and written, in Spanish and English Portuguese is a Plus. We recognize that individuals approach job applications differently. We strongly encourage all aspiring applicants to go for it, even if they don't match the job description 100%. We welcome your application and will be delighted to explore if you could be a great fit for our team.&nbsp; &nbsp; WHAT WE OFFER YOU&nbsp; With thoughtful benefits, emotional wellbeing resources, and a culture that empowers you to take ownership of your role and your wellbeing, we create an environment where you can thrive in all dimensions of your life. Our benefits include: WELLHUB: &nbsp; Free G"
Arbeitnow API,https://www.arbeitnow.com/jobs/companies/palmer-hargreaves-gmbh/trainee-public-relations-pr-hybrid-cologne-178989,2026-07-02T06:01:11,Palmer Hargreaves GmbH,Trainee Public Relations | PR (m/w/d) hybrid,Public Relations,Cologne,"Traineeship, berufseinstieg",Public Relations; Corporate Communication,"palmerhargreaves fokussiert sich als Agentur für Marketing und Kommunikation auf komplexe Themen und Transformationsaufgaben. Inhabergeführt und international präsent, bündeln wir Strategie-, Kreativ-, Content-, Technologie- und Digitalexpertise unter einem Dach und verbinden diese mit tiefem Branchen-Know-how. So entsteht Kommunikation für unsere Kunden, die Wert und Werte schafft. Palmer Hargreaves beschäftigt in Deutschland und England rund 100 Mitarbeitende aus 12 Nationen. Zu unseren Kunden zählen weltbekannte Marken und international agierende Unternehmen wie Audi, Bayer, Bosch, Deutsche Telekom, Ford, Henkel, Miele, Porsche und SAP. Aufgaben Eingebunden in unser Beratungsteam mit Schwerpunkt Consumer Technology bist du eine wichtige Schnittstelle zwischen Agentur und Kunde. Du betreust vielseitige Projekte, immer mit dem Blick auf die Deadline, und greifst dabei auf dein organisatorisches Geschick und deine Stärke für Genauigkeit zurück. Während des zwölfmonatigen Traineeships erkundest du alle Facetten unserer Agentur. Du erhältst wertvolle Einblicke in unser Daily Business und unterstützt die Kommunikation und Koordination mit internationalen Ansprechpersonen. On the Job lernst du Strukturen und Abläufe im Team und in unserer Agentur kennen und entwickelst umfassende Fähigkeiten im Projektmanagement sowie in der Kundenberatung und -führung. Nutze unser internes Weiterbildungsprogramm und das ""On the Job Training"", um dich kontinuierlich weiterzuentwickeln. Qualifikation Du hast eine erfolgreich abgeschlossene Ausbildung und/oder ein Studium, idealerweise mit Schwerpunkt Marketing, Kommunikation oder Medienwissenschaften Du bringst im besten Fall bereits erste Praktika-Erfahrung aus einer Agentur und/oder aus dem Projektgeschäft mit Du hast Neugier und Interesse an Consumer-Tech-Themen – du weißt, was im Markt für Smartphones, Wearables und digitale Produkte gerade passiert, oder möchtest es lernen Du nutzt AI-Tools und Automatisierungslösungen, um Prozesse effizienter zu gestalten, und bist engagiert, KI als selbstverständliche Daily-Business-Ergänzung in deinen Arbeitsalltag einfließen zu lassen Dein Interesse an datengestützten Systemen und deren kontinuierlicher Optimierung ist stark ausgeprägt Du bringst idealerweise eine ausgeprägte Social-Media-Affinität mit Du zeichnest dich durch eine proaktive Hands-on-Mentalität aus Deine Arbeitsweise ist lösungsorientiert, detailgetreu und verbindlich Du verfügst über sichere Präsentations-Skills, auch auf Englisch Benefits Remote-Flexi-Freiheit: Ob irgendwo in Deutschland oder in Köln-Ehrenfeld, ob besonders früh oder ein bisschen später – wo und wann du arbeitest, bestimmst du mit. Sabbatical | Workation: Wenn du mal richtig Fernweh bekommst, dann kannst du europaweit auf Workation gehen. Es soll noch ein bisschen mehr sein? Nimm dir ein Sabbatical. Urlaubs-Paradies: Bei uns gibt’s 30 Tage Urlaub + 2 Goodie-Tage + Sonderurlaub. Innere Werte: Wir halten zusammen und zeigen Wertschätzung. Open-hearted &#x26; open-minded – das sind wir im Job, beim Mentoring, bei Teamevents und beim sozialen Engagement. Wachstums-Booster: Wir fördern dich in unserer agentureigenen Academy, durch regelmäßige Entwicklungsgespräche und dazu gibt’s pro Jahr noch bis zu 5 Weiterbildungstage. Einsteiger-Support: Vom Einarbeitungsbuddy über eine Patenschaft bis zu umfangreichen Onboarding-Modulen – wir lassen dich zum Start nicht allein. Körper-Kicker: Rückenschule, Fitness, Sehtest, Betriebsarzt – denn deine Gesundheit zählt! DogApproved: Hunde machen glücklich. Deshalb sind sie nach Absprache erlaubt. Zukunftssicher: Mit unserer betrieblichen Altersvorsorge blickst du beruhigt in die Zukunft. Corporate Benefits: Profitiere auch außerhalb der Arbeit von einer Vielzahl an Einkaufs- und Reisevorteilen. Das klingt alles spannend für dich? Dann freuen wir aus auf deine Bewerbung! Find Jobs in Germany on Arbeitnow"
