source,source_url,date_posted,company,title,category,location,job_type,tags_raw,description
Arbeitnow API,https://www.arbeitnow.com/jobs/companies/cbre-global-workplace-solutions-data-center-solutions/technical-manager-fur-unsere-rechenzentren-frankfurt-am-main-421116,2026-07-02T14:30:44,CBRE Global Workplace Solutions / Data Center Solutions,Technical Manager (m/w/d) für unsere Rechenzentren,Project Management,Frankfurt am Main,,Project Management,"ÜBER CBRE DATA CENTER SOLUTIONS CBRE Data Center Solutions (DCS) ist Teil der CBRE-Gruppe mit über 130.000 Mitarbeiter*innen weltweit und der weltweit führende Dienstleister für vollständig integrierte Immobilien-, Anlagen- und Technologielösungen für Rechenzentrumsbetreiber auf der ganzen Welt. Als dedizierter Geschäftsbereich innerhalb CBRE widmet sich DCS der Lösung komplexer Herausforderungen in jeder Phase des Lebenszyklus von Rechenzentren. Allein in Deutschland stehen unsere mehr als 1.200 Mitarbeiter*innen kompetent und voller Leidenschaft als strategischer Partner zu Seite. Wir bieten unseren Mitarbeiter*innen die besten Voraussetzungen, sich beruflich und persönlich weiterzuentwickeln und im Zuge Ihrer Karriere Ihr volles Potenzial auszuschöpfen. Starten Sie bei uns durch und verstärken Sie unser Team als Technical Manager (m/w/d) in Frankfurt am Main ! Aufgaben WAS SIE BEI UNS BEWEGEN KÖNNEN Definieren der Roadmap und langfristigen Strategie hinsichtlich der technischen Ausrichtung und Standards für das technische Team sowie das erweiterte CBRE-Team Fördern und Weiterentwickeln des technischen Niveaus und der Kompetenz der technischen Mitarbeitenden in der gesamten Region; sicherstellen, dass Wissen geteilt wird, technische Best Practices angewendet werden und Konsistenz in allen Rechenzentren gewährleistet ist Unterstützung im Business Development‑Prozess und des Projektteams durch Beiträge zu RFI, RFP, Lösungsvorschlägen und Präsentationen Überwachung der Entwicklung und Implementierung aller Verfahren, CE‑Dokumentationen und Betriebsrichtlinien Vernetzung mit anderen Technical Managers innerhalb von DCS, Austausch von Best Practices und Übertragung dieser in die Region Zusammenarbeit mit bevorzugten Lieferanten, um innovative Lösungen zu identifizieren und diese in Kundenstandorten zu implementieren Prüfung von RCA-Berichten und Freigabe des finalen Berichts an die CBRE‑Führungsebene bzw. den Kunden Ableitung von Erfahrungs- und Lerneffekten aus allen Vorfällen, Untersuchungen oder RCA‑Berichten und Weitergabe dieser intern sowie im erweiterten DCS‑Umfeld Etablierung und Pflege einer Kultur der kontinuierlichen Verbesserung im gesamten Team; Identifizierung und Umsetzung von Designverbesserungen gemeinsam mit dem Operations Manager des Kunden und dem CBRE Technical Director Überprüfung, Beitrag und Überwachung aller technischen Schulungsanforderungen, die von CBRE bereitgestellt werden, einschließlich aber nicht beschränkt auf Authorised Person‑ und Senior AP‑Zertifizierungen Unterstützende Eskalationsrolle bei bedeutenden Ereignissen oder multidisziplinären technischen Vorfällen an den Standorten rund um die Uhr; Teilnahme an der Erstellung des Incident‑Reports Überprüfung und Weiterentwicklung der betrieblichen Verfahren und Übungen innerhalb der Rechenzentren Auditierung der Effizienz und Leistung des CE‑Teams; Entwicklung von Effizienzsteigerungen und Innovationen zum Nutzen des Kunden und CBRE Sicherstellen, dass grundlegende Schulungsbedarfe erfüllt werden, Mitarbeitende vollständig kompetent in ihren Rollen sind und ihr zukünftiges Potenzial ausschöpfen können Ausführung weiterer Aufgaben gemäß Vorgabe durch das Senior Management Team Qualifikation DAS BRINGEN SIE MIT Bachelor-Abschluss im Ingenieurwesen oder einer relevanten Fachrichtung, vorzugsweise im Bereich Maschinenbau, Elektrotechnik oder Gebäudetechnik Umfassende Kenntnisse von Rechenzentrumsanlagen wie Generatoren, Kältemaschinen, Kühltürmen, Luftbehandlungsgeräten, USV-Anlagen, Flüssigkühlung, elektrischen Unterverteilungssystemen, Brandmelde- und Löschanlagen sowie Kabelverteilersystemen Technisches Wissen und/oder Erfahrung im Bereich der elektrischen und mechanischen Infrastruktur in einem Rechenzentrumsumfeld Erfahrung in der Zusammenarbeit mit funktionsübergreifenden Teams zur Entwicklung von Systemen, Lösungen und Produkten; Organisations‑, Koordinations‑ und Multitasking‑Fähigkeiten Analytische Fähigkeiten und Erfahrung in der Lösung von "
Arbeitnow API,https://www.arbeitnow.com/jobs/companies/yoummday/werkstudent-people-development-munich-130788,2026-07-02T14:30:44,Yoummday,Werkstudent (m/w/d) People Development,HR,Munich,"Internship, hilfstätigkeit / student",HR,"Deine Mission Wir verändern eine ganze Branche – verändere sie gemeinsam mit uns! ​​​​ You made my da​​​​​​​​y – mit unserer innovativen und marktumwälzenden Plattform geben wir bereits einer Vielzahl von Menschen weltweit Zugang zu einer neuen, flexiblen und selbstbestimmten Arbeitswelt und bieten unseren Kunden durch unsere Software gleichzeitig einen komplett virtuellen und marktrevolutionierenden Kundenservice. Sichere unser weiteres Wachstum und mach mit uns den Unterschied als Werkstudent (m/w/d) People Development in unserem Headquarter in München. Was deine Aufgaben sein werden: Baue mit uns neue Themen auf : Wir entwickeln gerade zentrale Prozesse rund um Performance Management und Feedback. Du bist von Anfang an dabei und hilfst, diese Themen strukturiert aufzubauen. Mach aus Konzepten funktionierende Abläufe : Du unterstützt dabei, Prozesse so weiterzuentwickeln, dass sie nicht nur auf dem Papier gut aussehen, sondern im Alltag wirklich funktionieren. Verstehe, wie alles zusammenhängt: Du arbeitest dich in verschiedene People-Themen ein und lernst, wie Prozesse, Daten und Tools ineinandergreifen – und wie man daraus sinnvolle Lösungen baut. Sorge für Struktur und Klarheit: Du dokumentierst, strukturierst und entwickelst Setups weiter, sodass sie nachvollziehbar und für andere gut nutzbar sind. Dein Skillset Studium &#x26; Fachkenntnisse: Du bist Student:in in einem relevanten Fach wie Psychologie, Wirtschaftspädagogik oder BWL und besitzt bereits erste Berufserfahrung und bist etwa 20 Stunden die Woche verfügbar Hands-on Mentalität &#x26; Kommunikationsstärke: Du hast Lust, dich in neue Themen einzuarbeiten und Verantwortung zu übernehmen und kommunizierst überzeugend in deutscher und englischer Sprache Ordnungsliebe / „Gestalter-Mindset"" : Du arbeitest strukturiert und hast Spaß daran, Dinge sauber aufzubauen Analytisches Denkvermögen: Du denkst gerne einen Schritt weiter und erkennst Zusammenhänge Lösungsorientierung: Du hast ein gutes Gefühl für effiziente Lösungen („Wie geht das einmal richtig?“) Datenaffinität . Du hast erste Erfahrung mit Projekten, Tools oder Daten gesammelt Interesse an Organisationsentwicklung: Du interessierst dich für Menschen, Organisationen und deren Weiterentwicklung Dein Winning Deal Deine Benefits: Neben weekly Pizza und Snacks vor Ort, bieten wir dir außerdem einen Joblunch-Zuschuss (4 x 6,90 € im Monat), eine bezuschusste Wellpass-Mitgliedschaft , Rabatte via "" Corporate Benefits "" sowie grandiose Team- und Companyevents . Dein Arbeitsplatz: Bei uns arbeitest du im flexiblen, hybriden Modell aus einem unserer hundefreundlichen und modernen Offices Dein Footprint: Eine Position in einer profitablen Company , in der du die Freiheit und das Vertrauen erhältst, diese mitzugestalten und mit uns gemeinsam an der “future of work” zu arbeiten. Die Werte: Wir punkten mit einer offenen, authentischen Kultur und einem leistungsstarken sowie humorvollen Team , das sich schon jetzt darauf freut, mit dir mutigeEntscheidungen zu treffen und neue Wege zu gehen, die uns zu nachhaltigen Erfolgen führen. Deine Chance: Bei uns hast du vom ersten Tag an die Möglichkeit, Verantwortung zu übernehmen, Innovationen voranzutreiben und gemeinsam mit einem Team aus Expert:innen das Unternehmen und dich weiterzuentwickeln. Find more English Speaking Jobs in Germany on Arbeitnow"
Arbeitnow API,https://www.arbeitnow.com/jobs/companies/forteil-gmbh-bonify/senior-staff-engineer-berlin-114083,2026-07-02T14:30:44,Forteil GmbH - bonify,Senior Staff Engineer,Software Development,Berlin,professional / experienced,Software Development,"About us Join bonify, Germany’s leading platform for credit scoring and financial management. We are on the mission to revolutionize the FinTech industry and make the credit score and financial data available and transparent for our users. We are seeking a talented Senior Staff Engineer to join our dynamic team in Berlin. We're hiring a Senior Staff Engineer to shape the future of our AWS-based platform and provide technical leadership across the engineering organization. This role goes beyond backend development. You'll drive architecture, platform strategy, cloud evolution, and engineering standards with an end-to-end mindset . We expect strong partnership across the stack and departments to deliver high-quality, reliable outcomes. You will act as a force multiplier across teams, setting technical direction while staying hands-on where leverage is highest. Your tasks Technical Strategy &#x26; Architecture Define and evolve the long-term technical vision for backend services, platform capabilities, and cloud architecture Lead cross-domain architectural initiatives spanning multiple teams and business areas Drive modernization efforts that improve scalability, reliability, security, and developer productivity Establish architectural principles, engineering standards, and technical governance practices Guide major technology decisions including service boundaries, runtime choices, deployment models, and platform investments Evaluate emerging technologies and determine where they create meaningful business value AWS &#x26; Platform Leadership Act as a senior authority on AWS architecture, operational excellence, and cloud-native system design Define best practices for AWS services including Lambda, ECS/Fargate, API Gateway, EventBridge, SQS, SNS, DynamoDB, RDS, CloudFront, and related platform services Drive improvements in cloud security, resilience, disaster recovery, observability, and compliance readiness Lead cloud cost optimization initiatives and establish sustainable operational practices Influence Infrastructure-as-Code, deployment automation, and platform engineering strategy Partner closely with infrastructure and security teams to evolve our platform capabilities Engineering Excellence Raise engineering quality through architectural reviews, design guidance, and technical mentorship Improve system observability, incident response, operational readiness, and reliability engineering practices Reduce organizational complexity through standardization, reusable platform capabilities, and stronger engineering defaults Drive pragmatic decision-making around technical debt, modernization, and platform investments Establish frameworks for measuring and improving engineering effectiveness Cross-Functional Impact Partner with product, design, data, frontend, and infrastructure teams to align technical strategy with business goals Help teams make better technical decisions through coaching, reviews, and architectural consultation Improve end-to-end developer experience through shared tooling, contracts, APIs, and platform capabilities Act as a trusted advisor to engineering leadership on technical risk, roadmap planning, and organizational scaling Full-Stack Perspective Contribute to frontend and full-stack architecture discussions where needed Help establish patterns for frontend-backend integration, shared contracts, performance, and reliability Occasionally contribute hands-on across the stack to unblock critical initiatives or validate architectural approaches Drive improvements to end-to-end customer experience, not just backend systems AWS &#x26; Cloud Expertise Deep expertise designing, building, and operating production systems on AWS at scale and services like Lambda API Gateway EventBridge SQS / SNS ECS / Fargate DynamoDB RDS IAM CloudWatch CloudFront Route53 VPC networking Strong hands-on experience with serverless architectures, event-driven systems, and modern cloud-native platforms Strong understanding of cloud sec"
Arbeitnow API,https://www.arbeitnow.com/jobs/companies/deutscher-bauservice-gmbh/projektmanager-windenergie-mit-dem-schwerpunkt-genehmigungsverfahren-molbergen-60232,2026-07-02T14:00:44,Deutscher Bauservice GmbH,Projektmanager (m/w/d) Windenergie mit dem Schwerpunkt Genehmigungsverfahren,Project Management,Molbergen,,Project Management,"Du hast Bock bei der Planung von deutschlandweiten Windkraft-Projekten mitzuwirken? Die Energiewende in einem dynamischen und wachsenden Geschäftsfeld weiter voranbringen? Du konntest bereits Erfahrung im Genehmigungsmanagement für Windparks sammeln und bist bereit, neue Wege zu gehen? Dann bist Du bei uns genau richtig! Bewirb Dich noch heute und unterstütze unser Team! Aufgaben Du koordinierst und kommunizierst den Genehmigungsprozess von Windparkprojekten mit externen Gutachterbüros Du erstellst eigenverantwortlich Energie-Ertragsprognosen für Windparkprojekte Das Auswerten von Mess- und Produktionsdaten Ausarbeitung von Angeboten Du machst Standortbegehungen Unterstützung bei der Entwicklung und Pflege von Prozessen und Methoden Qualifikation Du verfügst über ein abgeschlossenes naturwissenschaftliches oder ingenieurtechnisches Studium oder eine vergleichbare Ausbildung (z.B. Ingenieur, Physik, Meteorologie, Geowissenschaften, Wirtschaftswissenschaften) Langjährige Berufserfahrung im Genehmigungsverfahren für den Windenergiebereich Freundliches und sicheres Auftreten, gepaart mit Kommunikationsstärke und Kultur- sowie Sozialkompetenz Lösungsorientiertes Denken sowie selbstständige und strukturierte Arbeitsweise Verhandlungssicheres Deutsch und Englisch in Wort und Schrift Die Realisierung von erfolgreichen und zukunftsorientierten Projekten im Bereich der erneuerbaren Energien ist genau dein Ding Du übernimmst gerne Verantwortung und stehst für dein Team ein Der Austausch mit Auftraggebern, Behörden und im Team macht dir Spaß Gelegentliche deutschlandweite Reisebereitschaft sowie Führerschein der Klasse B Benefits Flexible Arbeitszeiten Mobiles Arbeiten Erholungsbeihilfe Betriebliche Altersvorsorge Dienstrad - Leasing Firmenfitnessprogramm (Hansefit) Vollverpflegung im Office Corporate Benefits Hundefreundliches Büro Viele gemeinsame Events und Veranstaltungen Unternehmen mit Start-up-Flair Wir freuen uns auf Dich! Find more English Speaking Jobs in Germany on Arbeitnow"
Arbeitnow API,https://www.arbeitnow.com/jobs/companies/deutscher-bauservice-gmbh/projektmanager-technisches-projektmanagement-fokus-offshore-netzanbindung-molbergen-463127,2026-07-02T14:00:43,Deutscher Bauservice GmbH,Projektmanager Technisches Projektmanagement (m/w/d) Fokus Offshore-Netzanbindung,Project Management,Molbergen,,Project Management,"Wir sind ein verlässlicher Partner für komplexe Infrastrukturprojekte. Zur Verstärkung unserer Projektteams im Umfeld der Energiewende suchen wir zum nächstmöglichen Zeitpunkt erfahrene Projektmanager für das Technische Projektmanagement zur Unterstützung bei der Realisierung von Offshore-Netzanbindungssystemen (O-NAS). Du möchtest die Energiewende in einem dynamischen und wachsenden Geschäftsfeld weiter voranbringen? Dann bist Du bei uns genau richtig! Bewirb Dich noch heute und unterstütze unser Team! Aufgaben Projektsteuerung: End-to-End-Steuerung von Teilprojekten im Bereich Onshore-Installation für Offshore-Netzanbindungssysteme Schnittstellenmanagement: Aktive Koordination zwischen Bauüberwachung, Projektmanagement, Lieferanten und ausführenden Unternehmen Qualitäts- und Sicherheitsmanagement: Sicherstellung der Einhaltung hoher Sicherheits-, Gesundheits- und Qualitätsstandards (HSE) gemäß den Vorgaben des Auftraggebers Reporting: Transparente Steuerung von Baufortschritt, Qualität, Terminen und Kosten sowie Pflege der notwendigen Projektdokumentation Stakeholder-Kommunikation: Regelmäßige Teilnahme an Projektbesprechungen und enge Abstimmung mit dem TenneT-Projektteam Qualifikation Qualifikation: Abgeschlossenes Studium (Ingenieurwesen oder vergleichbar) mit nachweisbarer Erfahrung im technischen Projektmanagement Branchenerfahrung: Idealerweise fundierte Kenntnisse im Bereich der Energiewirtschaft, insbesondere bei der Abwicklung von Linienbaustellen und Konverterstationen (Onshore/Offshore) Baupraktische Projekterfahrung in HOAI-Leistungsphasen 7+8 Sprachkenntnisse: Verhandlungssichere Deutsch- und Englischkenntnisse (jeweils mindestens C1) Führerschein: Klasse B vorhanden Arbeitsweise: Strukturierte, zielorientierte und teamfähige Arbeitsweise. Sie zeichnen sich durch Zuverlässigkeit in der Dokumentation und Prozesssicherheit aus Mobilität: Hohe Reisebereitschaft für regelmäßige Termine an Projektstandorten (u.a. in Hannover, an Baustellen und Produktionsstandorten in Norddeutschland) Benefits Flexible Arbeitszeiten Mobiles Arbeiten Erholungsbeihilfe Betriebliche Altersvorsorge Dienstrad - Leasing Firmenfitnessprogramm (Hansefit) Vollverpflegung im Office Corporate Benefits Hundefreundliches Büro Viele gemeinsame Events und Veranstaltungen Unternehmen mit Start-up-Flair Wir freuen uns auf Dich! Find more English Speaking Jobs in Germany on Arbeitnow"
Arbeitnow API,https://www.arbeitnow.com/jobs/companies/deutscher-bauservice-gmbh/bauleiter-windparkbau-aschersleben-454921,2026-07-02T14:00:43,Deutscher Bauservice GmbH,Bauleiter (m/w/d) - Windparkbau,Engineering,Aschersleben,,Engineering,"Die Welt verändert sich - Du Dich auch? Deine Zukunft beginnt heute! Im Zeitalter der Energiewende setzen wir auf neue Wege und mit dem offiziellen Titel als Wachstumschampion setzen wir nicht nur Maßstäbe in Qualität und Effizienz, sondern sind auch zuverlässiger Partner für innovative Bauprojekte in ganz Deutschland. Für den Bau der kompletten Infrastruktur von Windparks stehst Du gerne als Schnittstelle zwischen Auftraggeber, Kommunen und beauftragten Tiefbauunternehmen zur Verfügung? Dann bist Du bei uns genau richtig! Werde Teil unseres motivierten Teams und trage gemeinsam mit uns einen Teil zur Energiewende bei. Aufgaben Du bist zuständig für die Planung und Koordination der für die Infrastruktur eines Windparks benötigten Gewerke, wie z.B. Gründung, Fundamentbau, Wegebau, Kabeltrassen (intern, extern) und Netzanschlüsse Du erstellst Leistungsverzeichnisse für alle beteiligten Gewerke Du begleitest, koordinierst und kontrollierst die Ausschreibung, Vergabe, Abrechnung sowie Dokumentation und Abnahme aller beteiligten Gewerke Du erstellst und prüfst Aufmaße und gewährleistest den effizienten und wirtschaftlichen Einsatz von Baustoffen sowie Baugeräten Du hast die Eigenverantwortliche Leitung der Baustellen vor Ort und Überwachung der Gewerke Du bist verantwortlich für Arbeitssicherheit, Qualität und Ordnung auf der Baustelle Du hast die Qualität und den Baufortschritt immer im Blick und dokumentierst die Arbeiten Kontrolle der Baustellenmontage vor Ort Qualifikation Du bist geprüfter Polier oder Techniker (m/w/d), hast einen Meister im Straßen- oder Tiefbau oder bist Bauingenieur (m/w/d) oder besitzt eine vergleichbare Ausbildung/Studium z.B. als Elektriker (m/w/d), Kabelbauer (m/w/d) oder Bachelor (B.Eng.) Wirtschaftsingenieurwesen Erneuerbare Energien Du verfügst bereits über langjährige Berufserfahrung im Tiefbau und im Straßenbau und hast bereits erste Windparkprojekte in der Baukoordination begleitet Du verfügst über sichere MS Office-Kenntnisse Du bringst Kenntnisse über die relevanten Vorschriften (DIN18300, ZTV, RSA21, VOB) mit Du hast sehr gute Sprachkenntnisse in Deutsch und hast mindestens einen Führerschein Klasse B Deutschlandweite Reisebereitschaft (nicht am Wochenende) setzen wir voraus Benefits Firmenwagen (mit Privatnutzung) Flexible Arbeitszeiten (abhängig vom Berufsfeld) Erholungsbeihilfe Spesen/Verpflegungsmehraufwendungen Unterkunftsbuchung und Bezahlung übernimmt direkt unser Travelmanagement für dich Mobiles Arbeiten (abhängig vom Berufsfeld) Betriebliche Altersvorsorge Dienstrad - Leasing Firmenfitnessprogramm (Hansefit) Corporate Benefits Viele gemeinsame Events und Veranstaltungen Unternehmen mit Start-up-Flair Wir freuen uns auf Dich! Find more English Speaking Jobs in Germany on Arbeitnow"
Arbeitnow API,https://www.arbeitnow.com/jobs/companies/deutscher-bauservice-gmbh/bauleiter-windparkbau-freiburg-im-breisgau-412837,2026-07-02T14:00:43,Deutscher Bauservice GmbH,Bauleiter (m/w/d) - Windparkbau,Engineering,Freiburg im Breisgau,,Engineering,"Die Welt verändert sich - Du Dich auch? Deine Zukunft beginnt heute! Im Zeitalter der Energiewende setzen wir auf neue Wege und mit dem offiziellen Titel als Wachstumschampion setzen wir nicht nur Maßstäbe in Qualität und Effizienz, sondern sind auch zuverlässiger Partner für innovative Bauprojekte in ganz Deutschland. Für den Bau der kompletten Infrastruktur von Windparks stehst Du gerne als Schnittstelle zwischen Auftraggeber, Kommunen und beauftragten Tiefbauunternehmen zur Verfügung? Dann bist Du bei uns genau richtig! Werde Teil unseres motivierten Teams und trage gemeinsam mit uns einen Teil zur Energiewende bei. Aufgaben Du bist zuständig für die Planung und Koordination der für die Infrastruktur eines Windparks benötigten Gewerke, wie z.B. Gründung, Fundamentbau, Wegebau, Kabeltrassen (intern, extern) und Netzanschlüsse Du erstellst Leistungsverzeichnisse für alle beteiligten Gewerke Du begleitest, koordinierst und kontrollierst die Ausschreibung, Vergabe, Abrechnung sowie Dokumentation und Abnahme aller beteiligten Gewerke Du erstellst und prüfst Aufmaße und gewährleistest den effizienten und wirtschaftlichen Einsatz von Baustoffen sowie Baugeräten Du hast die Eigenverantwortliche Leitung der Baustellen vor Ort und Überwachung der Gewerke Du bist verantwortlich für Arbeitssicherheit, Qualität und Ordnung auf der Baustelle Du hast die Qualität und den Baufortschritt immer im Blick und dokumentierst die Arbeiten Kontrolle der Baustellenmontage vor Ort Qualifikation Du bist geprüfter Polier oder Techniker (m/w/d), hast einen Meister im Straßen- oder Tiefbau oder bist Bauingenieur (m/w/d) oder besitzt eine vergleichbare Ausbildung/Studium z.B. als Elektriker (m/w/d), Kabelbauer (m/w/d) oder Bachelor (B.Eng.) Wirtschaftsingenieurwesen Erneuerbare Energien Du verfügst bereits über langjährige Berufserfahrung im Tiefbau und im Straßenbau und hast bereits erste Windparkprojekte in der Baukoordination begleitet Du verfügst über sichere MS Office-Kenntnisse Du bringst Kenntnisse über die relevanten Vorschriften (DIN18300, ZTV, RSA21, VOB) mit Du hast sehr gute Sprachkenntnisse in Deutsch und hast mindestens einen Führerschein Klasse B Deutschlandweite Reisebereitschaft (nicht am Wochenende) setzen wir voraus Benefits Firmenwagen (mit Privatnutzung) Flexible Arbeitszeiten (abhängig vom Berufsfeld) Erholungsbeihilfe Spesen/Verpflegungsmehraufwendungen Unterkunftsbuchung und Bezahlung übernimmt direkt unser Travelmanagement für dich Mobiles Arbeiten (abhängig vom Berufsfeld) Betriebliche Altersvorsorge Dienstrad - Leasing Firmenfitnessprogramm (Hansefit) Corporate Benefits Viele gemeinsame Events und Veranstaltungen Unternehmen mit Start-up-Flair Wir freuen uns auf Dich! Find more English Speaking Jobs in Germany on Arbeitnow"
