job_id,date_posted,source,company,title,category,raw_category,seniority,location,job_type,skills,tags_raw,salary_min_usd,salary_max_usd,salary_mid_usd,demand_index,scarcity_score,time_to_fill_days_proxy,application_volume_proxy,source_url,description_preview
raw-0167,2026-06-24,Arbeitnow API,Taxtalente.de,"Steuerberater (m/w/d) in Widdern, auf Wunsch mit Partnerperspektive, gesucht - mindestens 90.000€",Software & Engineering,Directors,Unspecified,Widdern,,Python; JavaScript; API; Cloud,Directors; Chief Executives,66387,95533,80960,98.2,62,40.7,104,https://www.arbeitnow.com/jobs/companies/taxtalentede/steuerberater-in-widdern-auf-wunsch-mit-partnerperspektive-gesucht-mindestens-90000eur-23947,TaxTalente ist die Nr. 1 Job-Matching Plattform für Jobsuchende in der Steuerberatung. Sie suchen eine positive berufliche Veränderung? Sie möchten den nächsten Schritt in Ihrer Karriere gehen und streben möglicherweise 
raw-0168,2026-06-24,Arbeitnow API,Taxtalente.de,"Steuerberater (m/w/d) in Kell am See, auf Wunsch mit Partnerperspektive, gesucht - mindestens 90.000€",Software & Engineering,Directors,Unspecified,Kell am See,,Python; JavaScript; API; Cloud,Directors; Chief Executives,66387,95533,80960,98.2,62,40.7,104,https://www.arbeitnow.com/jobs/companies/taxtalentede/steuerberater-in-kell-am-see-auf-wunsch-mit-partnerperspektive-gesucht-mindestens-90000eur-322532,TaxTalente ist die Nr. 1 Job-Matching Plattform für Jobsuchende in der Steuerberatung. Sie suchen eine positive berufliche Veränderung? Sie möchten den nächsten Schritt in Ihrer Karriere gehen und streben möglicherweise 
raw-0169,2026-06-24,Arbeitnow API,Taxtalente.de,"Steuerberater (m/w/d) in Neu Wulmstorf, auf Wunsch mit Partnerperspektive, gesucht - mindestens 90.000€",Software & Engineering,Directors,Unspecified,Neu Wulmstorf,,Python; JavaScript; API; Cloud,Directors; Chief Executives,66387,95533,80960,98.2,62,40.7,104,https://www.arbeitnow.com/jobs/companies/taxtalentede/steuerberater-in-neu-wulmstorf-auf-wunsch-mit-partnerperspektive-gesucht-mindestens-90000eur-154436,TaxTalente ist die Nr. 1 Job-Matching Plattform für Jobsuchende in der Steuerberatung. Sie suchen eine positive berufliche Veränderung? Sie möchten den nächsten Schritt in Ihrer Karriere gehen und streben möglicherweise 
raw-0170,2026-06-24,Arbeitnow API,Taxtalente.de,"Steuerberater (m/w/d) in Malgersdorf, auf Wunsch mit Partnerperspektive, gesucht - mindestens 90.000€",Software & Engineering,Directors,Unspecified,Malgersdorf,,Python; JavaScript; API; Cloud,Directors; Chief Executives,66387,95533,80960,98.2,62,40.7,104,https://www.arbeitnow.com/jobs/companies/taxtalentede/steuerberater-in-malgersdorf-auf-wunsch-mit-partnerperspektive-gesucht-mindestens-90000eur-342748,TaxTalente ist die Nr. 1 Job-Matching Plattform für Jobsuchende in der Steuerberatung. Sie suchen eine positive berufliche Veränderung? Sie möchten den nächsten Schritt in Ihrer Karriere gehen und streben möglicherweise 
raw-0171,2026-06-24,Arbeitnow API,Taxtalente.de,"Steuerberater (m/w/d) in Willstätt, auf Wunsch mit Partnerperspektive, gesucht - mindestens 90.000€",Software & Engineering,Directors,Unspecified,Willstätt,,Python; JavaScript; API; Cloud,Directors; Chief Executives,66387,95533,80960,98.2,62,40.7,104,https://www.arbeitnow.com/jobs/companies/taxtalentede/steuerberater-in-willstatt-auf-wunsch-mit-partnerperspektive-gesucht-mindestens-90000eur-110709,TaxTalente ist die Nr. 1 Job-Matching Plattform für Jobsuchende in der Steuerberatung. Sie suchen eine positive berufliche Veränderung? Sie möchten den nächsten Schritt in Ihrer Karriere gehen und streben möglicherweise 
raw-0172,2026-06-24,Arbeitnow API,Kobau Leipzig,Werkstudent Projektmanagement Innenausbau,Product & Project Management,Management,Internship/Student,Leipzig,,Product Management; Project Management; Agile; Stakeholder Management,Management; Team Leader,34276,49324,41800,56.1,38,30.3,136,https://www.arbeitnow.com/jobs/companies/kobau-leipzig/werkstudent-projektmanagement-innenausbau-leipzig-447231,"Wir suchen ein Teammitglied, das Begeisterung für die Branche mitbringt. Du interessierst dich für die Baubranche und möchtest deine ersten Erfahrungen sammeln? Starte bei uns als Werkstudent oder im Minijob und entwickl"
raw-0173,2026-06-24,Arbeitnow API,Kobau Leipzig,Assistant Office Management (Student / Minijob),Product & Project Management,Management,Internship/Student,Leipzig,,Product Management; Project Management; Agile; Stakeholder Management,Management; Team Leader,34276,49324,41800,56.1,38,30.3,136,https://www.arbeitnow.com/jobs/companies/kobau-leipzig/assistant-office-management-student-minijob-leipzig-380843,"Wir suchen ein Teammitglied, das Begeisterung für die Branche mitbringt. Du interessierst dich für die Baubranche und möchtest deine ersten Erfahrungen sammeln? Starte bei uns als Werkstudent oder im Minijob und entwickl"
raw-0174,2026-06-24,Arbeitnow API,Kobau Leipzig,Junior Projektmanager:in (Student/Minijob),Product & Project Management,Management,Internship/Student,Leipzig,teamleitung,Product Management; Project Management; Agile; Stakeholder Management,Management; Team Leader,34276,49324,41800,56.1,38,30.3,136,https://www.arbeitnow.com/jobs/companies/kobau-leipzig/junior-projektmanagerin-student-minijob-leipzig-335085,"Wir suchen ein Teammitglied, das Begeisterung für die Branche mitbringt. Du interessierst dich für die Baubranche und möchtest deine ersten Erfahrungen sammeln? Starte bei uns als Werkstudent oder im Minijob und entwickl"
raw-0175,2026-06-24,Arbeitnow API,ADITO Software GmbH,Strategic Account Manager (m/w/d),Software & Engineering,Project Management,Senior/Lead,Landshut,berufserfahren,Project Management; Onboarding; CRM,Project Management,97416,140184,118800,65.4,48,38.6,123,https://www.arbeitnow.com/jobs/companies/adito-software-gmbh/strategic-account-manager-landshut-366458,"Du möchtest langfristige Kundenbeziehungen aufbauen, Geschäftspotenziale erschließen und Unternehmen bei ihrer digitalen Weiterentwicklung begleiten? Bei ADITO betreust du Bestandskunden, gewinnst neue Kunden und entwick"
raw-0176,2026-06-24,Arbeitnow API,Kamberi Group Holding GmbH,Gruppenleiter Rechnungswesen & Jahresabschluss (m|w|d),Marketing & Growth,Management,Mid-level,Fulda,berufserfahren,SEO; Google Analytics; Paid Marketing; Content Strategy,Management; Team Leader,49200,70800,60000,43.7,38,30.3,136,https://www.arbeitnow.com/jobs/companies/kamberi-group-holding-gmbh/gruppenleiter-rechnungswesen-jahresabschluss-mwd-fulda-455669,"Die Kamberi Group ist eine inhabergeführte Unternehmensgruppe mit Sitz in Fulda — und eine der vielseitigsten ihrer Art in der Region. Unter einem Dach vereinen wir über ein Dutzend Gesellschaften aus Logistik, Gastronom"
raw-0177,2026-06-24,Arbeitnow API,"OST BAU; Osterburger Straßen-,Tief- und Hochbau GmbH",Vermessungsingenieur/Vermessungstechniker (gn),Software & Engineering,Consulting,Mid-level,Oebisfelde-Weferlingen,berufserfahren,Python; JavaScript; API; Cloud,Consulting; Engineering,72160,103840,88000,98.1,62,40.7,104,https://www.arbeitnow.com/jobs/companies/ost-bau-osterburger-strassen-tief-und-hochbau-gmbh/vermessungsingenieur-vermessungstechniker-gn-oebisfelde-weferlingen-458195,Was wir dir bieten: Attraktive Vergütung und alle Vorteile des Bauhauptgewerbes plus Zuschüsse Persönliche und fachliche Weiterbildungsmöglichkeiten4-Tage-Woche bei Montagetätigkeit nach Absprache und regelmäßiger Freize
raw-0178,2026-06-24,The Muse API,Konica Minolta Business Solutions,Senior Field Account Executive,Cybersecurity & IT,Sales,Senior/Lead,"Plantation, FL",external,Sales; Security; Finance; Video Editing; HR,Sales; Senior Level,88560,127440,108000,66.7,61,44.2,106,https://www.themuse.com/jobs/konicaminoltabusinesssolutions/senior-field-account-executive,About Us This posting reflects an existing vacancy that we are actively recruiting for. Cette annonce correspond à un poste actuellement vacant pour lequel nous recrutons activement. About Konica Minolta Konica Minolta B
raw-0179,2026-06-23,Arbeitnow API,Investmentbuilder Group GmbH,Head of Sales / Vertriebsleiter (m/w/d),Software & Engineering,Management,Senior/Lead,Mainz,teamleitung,Onboarding; Sales; CRM,Management; Team Leader,97416,140184,118800,70.8,48,38.6,123,https://www.arbeitnow.com/jobs/companies/investmentbuilder-group-gmbh/head-of-sales-vertriebsleiter-mainz-68256,"Investmentbuilder ist einer der am schnellsten wachsenden Premiumdienstleister für Unternehmer-Vermögensarchitektur in Deutschland. Wir beraten Unternehmer, Selbstständige und Topverdiener zu Holdingstrukturen, Steueropt"
raw-0180,2026-06-23,The Muse API,Liberty Mutual Insurance,Remote Inside Sales Representative,Marketing & Growth,Sales,Unspecified,"Fort Myers, FL, Jacksonville, FL, Lake Mary, FL, Melbourne, FL, Miami, FL, Orlando, FL, St. Petersburg, FL, Tallahassee, FL, Tampa, FL",external,Sales,Sales; Mid Level,45264,65136,55200,77.1,38,30.3,136,https://www.themuse.com/jobs/libertymutualinsurance/remote-inside-sales-representative-448d7b,"Description Apply Today - Training Classes Begins July and Aug 2026! Are you ready to launch a rewarding career in insurance sales? We're seeking motivated, people-focused individuals to join our Inside Sales Representat"
raw-0181,2026-06-23,The Muse API,Liberty Mutual Insurance,Remote Inside Sales Representative,Marketing & Growth,Sales,Unspecified,"Arlington, TX, Carrollton, TX, Denton, TX, Fort Worth, TX, Frisco, TX, Garland, TX, Irving, TX, Lubbock, TX, McAllen, TX, Plano, TX, Richardson, TX, Waco, TX",external,Sales,Sales; Mid Level,45264,65136,55200,77.1,38,30.3,136,https://www.themuse.com/jobs/libertymutualinsurance/remote-inside-sales-representative-9f633d,"Description Apply Today - Training Classes Begin July and August 2026! Are you ready to launch a rewarding career in insurance sales? We're seeking motivated, people-focused individuals to join our Inside Sales Represent"
raw-0182,2026-06-23,The Muse API,CRH,Local CDL A Driver,Software & Engineering,Business Operations,Unspecified,"Greenville, SC",external,Operations,Business Operations; Mid Level,66387,95533,80960,71.5,38,30.3,136,https://www.themuse.com/jobs/crh/local-cdl-a-driver-e5c44e,"Job ID: 525800 Oldcastle, a CRH company, is reinventing what's possible in building solutions. We are the leading provider of innovative outdoor living products and utility infrastructure solutions for the water, energy,"
raw-0183,2026-06-23,Arbeitnow API,Omnora GmbH,Account Executive (m/w/d) – B2B SaaS / Enterprise,Software & Engineering,Remote,Mid-level,Frankfurt am Main,berufserfahren,Sales; SaaS,Remote; Business Development,72160,103840,88000,61.5,38,30.3,136,https://www.arbeitnow.com/jobs/companies/omnora-gmbh/account-executive-b2b-saas-enterprise-frankfurt-am-main-126193,"Introduction Als Account Executive bei Omnora übernimmst du eine zentrale Rolle im operativen B2B SaaS Vertrieb mit Fokus auf Enterprise-Kunden und gehobenen Mittelstand. Du verantwortest deine eigene Pipeline, führst De"
raw-0184,2026-06-23,Arbeitnow API,Solvis GmbH,Mitarbeiter*in im technischen Vertrieb (m/w/d=Mensch),Software & Engineering,Engineering,Mid-level,Braunschweig,berufserfahren,Python; JavaScript; API; Cloud,Engineering,72160,103840,88000,98,62,40.7,104,https://www.arbeitnow.com/jobs/companies/solvis-gmbh/mitarbeiterin-im-technischen-vertrieb-mensch-braunschweig-246794,"Für unser Team suchen wir eine engagierte Verstärkung im Bereich der Energie-und Systemplanung. In dieser Position unterstützt du die Auslegung und Planung moderner SOLVIS-Energiesysteme, einschließlich Wärmepumpen-, Hyb"
raw-0185,2026-06-23,Arbeitnow API,TOWA - the digital growth company,"Agentic Engineering Expert (m/w/d), München",Data & AI,Software Development,Mid-level,Munich,berufserfahren,AI/ML; AI,Software Development,69700,100300,85000,84.9,51,35.9,119,https://www.arbeitnow.com/jobs/companies/towa-the-digital-growth-company/agentic-engineering-expert-munchen-munich-34281,Wofür wir stehen: „We drive digital transformation end-to-end – from strategy to execution. Creating measurable progress and real impact for our clients.“ Stillstand? Nicht mit uns. Wir glauben: Alles ist BETA – und gena
raw-0186,2026-06-23,Arbeitnow API,TOWA - the digital growth company,"Agentic Engineering Expert (m/w/d), Düsseldorf",Data & AI,Software Development,Mid-level,Düsseldorf,berufserfahren,AI/ML; AI,Software Development,69700,100300,85000,84.9,51,35.9,119,https://www.arbeitnow.com/jobs/companies/towa-the-digital-growth-company/agentic-engineering-expert-dusseldorf-453088,Wofür wir stehen: „We drive digital transformation end-to-end – from strategy to execution. Creating measurable progress and real impact for our clients.“ Stillstand? Nicht mit uns. Wir glauben: Alles ist BETA – und gena
raw-0187,2026-06-23,Arbeitnow API,Instagrid,Working Student (f/m/d) - IT Infrastructure,Software & Engineering,Energy,Internship/Student,Ludwigsburg,"Internship, student (college)",Automation; Onboarding; Cloud,Energy; certification,39688,57112,48400,80.1,46,33.8,125,https://www.arbeitnow.com/jobs/companies/instagrid/working-student-it-infrastructure-ludwigsburg-102098,"At Instagrid, you are part of the clean-tech revolution by bringing pure energy into your region, helping professional workers transitioning away from combustion generators and making it possible for them to experience a"
raw-0188,2026-06-23,Arbeitnow API,INDUMERA GmbH,Senior Marketing Manager (m/w/d),Marketing & Growth,Marketing and pr,Senior/Lead,Herford,"Full-time permanent, entry",Onboarding,Marketing and pr; high school or equivalent,66420,95580,81000,74.9,48,38.6,123,https://www.arbeitnow.com/jobs/companies/indumera-gmbh/senior-marketing-manager-herford-153989,Wir von INDUMERA arbeiten als Agentur und Beratungsunternehmen mit mehr als 130 Industrieunternehmen zusammen und unterstützen diese durch Marketing-Kampagnen beim Wachstum. Wir helfen unseren Kunden neue Aufträge zu gen
raw-0189,2026-06-23,Arbeitnow API,Böttcher & Partner,Top Karrierechance für Führungskraft (all gender) Operations in Süddeutschland,Product & Project Management,Management,Senior/Lead,Munich,teamleitung,Operations,Management; Team Leader,84132,121068,102600,71.5,48,38.6,123,https://www.arbeitnow.com/jobs/companies/bottcher-partner/top-karrierechance-fur-fuhrungskraft-all-gender-operations-in-suddeutschland-munich-107597,Für einen exklusiven Kunden suchen wir eine umsetzungsstarke Führungskraft mit Schwerpunkt Operations. Aufgaben Ein professionelles Umfeld mit klaren Prozessen – wie geschaffen für Führungskräfte aus strukturierten Organ
raw-0190,2026-06-23,Arbeitnow API,Rabe Holding GmbH & Co. KG,IT-Teamleiter (m/w/d) - KI & Digitale Prozesse,Software & Engineering,Internet and software,Mid-level,Zwickau,"Full-time permanent, experienced",Onboarding; AI,Internet and software; vocational,72160,103840,88000,86,38,30.3,136,https://www.arbeitnow.com/jobs/companies/rabe-holding-gmbh-co-kg/it-teamleiter-ki-digitale-prozesse-zwickau-21883,"Wir sind ein lange etabliertes und nach wie vor wachsendes Unternehmen im Bereich Online-Bildung und Finanztraining. Unsere Kurse, Webinare und Kampagnen erreichen tausende Menschen - und hinter jedem erfolgreichen Launc"
raw-0191,2026-06-23,Arbeitnow API,Quantum- Systems GmbH,Swarming Software Engineer (m/f/d),Software & Engineering,Internet and software,Mid-level,Gilching,"Full-time permanent, mid",Communication; Operations; C++; AI,Internet and software; professional,72160,103840,88000,77.9,38,30.3,136,https://www.arbeitnow.com/jobs/companies/quantum-systems-gmbh/swarming-software-engineer-gilching-285961,"As a Swarming Software Engineer (m/f/d), you will be a significant key function of our Swarming team and support our mission of letting swarms of drones fly automatically. With our world-class team, currently 7 team memb"
raw-0192,2026-06-23,Arbeitnow API,CBRE Global Workplace Solutions,Vertriebsingenieur (Angebotskalkulation) (m/w/d),Software & Engineering,Sales Engineer,Unspecified,Frankfurt am Main,,Sales; HR,Sales Engineer,66387,95533,80960,70.9,38,30.3,136,https://www.arbeitnow.com/jobs/companies/cbre-global-workplace-solutions/vertriebsingenieur-angebotskalkulation-frankfurt-am-main-385681,CBRE GLOBAL WORKPLACE SOLUTIONS - UNSER NAME IST PROGRAMM CBRE Global Workplace Solutions (GWS) ist Teil der weltweit führenden CBRE‑Gruppe mit über 140.000 Mitarbeitenden in mehr als 100 Ländern. Als weltweit führender 
raw-0193,2026-06-23,Arbeitnow API,Riverstate Premium Recruiting,Land- und Baumaschinenmechatroniker (m/w/d) | 45.000 €+ (je nach Qualifikation und Erfahrung),Software & Engineering,Automotive Engineering,Unspecified,Böhnhusen,,Python; JavaScript; API; Cloud,Automotive Engineering,66387,95533,80960,97.9,62,40.7,104,https://www.arbeitnow.com/jobs/companies/riverstate-premium-recruiting/land-und-baumaschinenmechatroniker-45000-eur-je-nach-qualifikation-und-erfahrung-bohnhusen-251222,"Eine leistungsgerechte Vergütung in 13,2 Gehältern, 600 € steuerfrei pro Jahr, 30 Tage Urlaub und wenig Außeneinsätze, wenn überhaupt nur im regionalen Umfeld – hier erwartet Sie ein Arbeitsplatz mit klaren Rahmenbedingu"
raw-0194,2026-06-23,Arbeitnow API,Think3DDD GbR,"Pflichtpraktikum Frontend & UX Design (m/w/d) - React, UI/UX & MedTech-Startup",Software & Engineering,Web Development,Internship/Student,Berlin,Internship,JavaScript; Frontend; Backend; Startup; Design; React; Figma; UI/UX,Web Development,39688,57112,48400,67,46,33.8,125,https://www.arbeitnow.com/jobs/companies/think3ddd-gbr/pflichtpraktikum-frontend-ux-design-react-ui-ux-medtech-startup-berlin-292566,"💡 Du suchst ein Pflichtpraktikum oder Praxissemester, in dem du Frontend-Entwicklung und UX Design sinnvoll miteinander verbinden kannst? 🧠 Du möchtest Interfaces gestalten, die nicht nur gut aussehen, sondern im mediz"
raw-0195,2026-06-23,Arbeitnow API,Riverstate Premium Recruiting,Land- und Baumaschinenmechatroniker (m/w/d) | 45.000 €+ (je nach Qualifikation und Erfahrung),Software & Engineering,Automotive Engineering,Mid-level,Penzlin,berufserfahren,Python; JavaScript; API; Cloud,Automotive Engineering,72160,103840,88000,97.9,62,40.7,104,https://www.arbeitnow.com/jobs/companies/riverstate-premium-recruiting/land-und-baumaschinenmechatroniker-45000-eur-je-nach-qualifikation-und-erfahrung-penzlin-483049,"Eine leistungsgerechte Vergütung in 13,2 Gehältern, 600 € steuerfrei pro Jahr, 30 Tage Urlaub und wenig Außeneinsätze, wenn überhaupt nur im regionalen Umfeld – hier erwartet Sie ein Arbeitsplatz mit klaren Rahmenbedingu"
raw-0196,2026-06-23,Arbeitnow API,Riverstate Premium Recruiting,Projektingenieur / Projektleiter TGA / HKLS (m/w/d) | flexibles Arbeiten | 48.000-72.000€,Software & Engineering,Building,Mid-level,Landsberg,berufserfahren,Python; JavaScript; API; Cloud,Building; Supply; Safety Services Engineering,72160,103840,88000,97.9,62,40.7,104,https://www.arbeitnow.com/jobs/companies/riverstate-premium-recruiting/projektingenieur-projektleiter-tga-hkls-flexibles-arbeiten-48000-72000eur-landsberg-196757,"Ob Therme oder Hallenbad hier können Sie zu Ihrem Traumjob schwimmen! Wir suchen Sie als Projektingenieur TGA für Sonderprojekte wie Freizeit- und Hallenbäder, Kurbäder, Thermen, und Bauten für den Eissport. Die Projektv"
raw-0197,2026-06-23,Arbeitnow API,Riverstate Premium Recruiting,Projektingenieur / Projektleiter TGA / HKLS (m/w/d) | flexibles Arbeiten | 48.000-72.000€,Software & Engineering,Building,Unspecified,Erfurt,,Python; JavaScript; API; Cloud,Building; Supply; Safety Services Engineering,66387,95533,80960,97.9,62,40.7,104,https://www.arbeitnow.com/jobs/companies/riverstate-premium-recruiting/projektingenieur-projektleiter-tga-hkls-flexibles-arbeiten-48000-72000eur-erfurt-345731,"Ob Therme oder Hallenbad hier können Sie zu Ihrem Traumjob schwimmen! Wir suchen Sie als Projektingenieur TGA für Sonderprojekte wie Freizeit- und Hallenbäder, Kurbäder, Thermen, und Bauten für den Eissport. Die Projektv"
raw-0198,2026-06-23,Arbeitnow API,clockin GmbH,(Senior) Revenue Operations Manager (all genders),Software & Engineering,Sales,Senior/Lead,Münster,"Full-time permanent, experienced",Sales; Forecasting; Onboarding; Operations; SaaS,Sales; bachelor's degree,97416,140184,118800,63.2,48,38.6,123,https://www.arbeitnow.com/jobs/companies/clockin-gmbh/senior-revenue-operations-manager-all-genders-munster-244958,"Als (Senior) Revenue Operations Manager baust du das operative GTM-Rückgrat: HubSpot als zentrale Revenue-Plattform, automatisierte Sales-Prozesse und die Schnittstelle zwischen Produkt, Vertrieb, Marketing &amp; CS. Dei"
raw-0199,2026-06-23,Arbeitnow API,SIGMA System Audio-Visuell GmbH,Mediengestalter & Medientechniker (50%/50%) (m/w/d),Marketing & Growth,Media,Unspecified,Düsseldorf,,Design; Video Editing,Media; Screen and Web Design,45264,65136,55200,69.8,38,30.3,136,https://www.arbeitnow.com/jobs/companies/sigma-system-audio-visuell-gmbh/mediengestalter-medientechniker-50-50-dusseldorf-198310,"Als Full-Service-Dienstleister für audiovisuelle Lösungen realisieren und betreiben wir Medientechnik in Konferenzräumen, Eventflächen und Arbeitswelten. Unser Leistungsspektrum reicht von der Planung und Installation vo"
raw-0200,2026-06-23,Arbeitnow API,Riverstate Premium Recruiting,Kalkulator TGA (m/w/d) | 60.000 - 90.000 €,Software & Engineering,Building,Mid-level,Berlin,berufserfahren,Onboarding,Building; Supply; Safety Services Engineering,72160,103840,88000,74.8,38,30.3,136,https://www.arbeitnow.com/jobs/companies/riverstate-premium-recruiting/kalkulator-tga-60000-90000-eur-berlin-95834,Ihr technisches Know-how ist gefragt! Eine neue Position in der Kalkulation im Bereich TGA wird bei einem der führenden Hochbau-Unternehmen Deutschlands geschaffen. Hier gestalten Sie aktiv mit und arbeiten dabei an eini
raw-0201,2026-06-23,Arbeitnow API,credicom GmbH,Sachbearbeiter Immobilienkredite Baufinanzierung (m/w/d),HR & Recruitment,Credit Analysis,Unspecified,Berlin,,Recruitment; HR; Onboarding; Communication,Credit Analysis,42246,60794,51520,71.2,38,30.3,136,https://www.arbeitnow.com/jobs/companies/credicom-gmbh/sachbearbeiter-immobilienkredite-baufinanzierung-berlin-431614,"Werde Teil von credicom Bei credicom begleiten wir Menschen auf dem Weg zur passenden Immobilienfinanzierung. Damit aus einer Anfrage ein sauber vorbereiteter Finanzierungsprozess wird, braucht es Menschen, die strukturi"
raw-0202,2026-06-23,Arbeitnow API,gocomo GmbH,(Senior) Operations Controller (m/w/d),Marketing & Growth,Finance,Senior/Lead,Berlin,berufserfahren,Finance; Accounting; Operations; Excel; CRM; ERP,Finance,66420,95580,81000,61.2,48,38.6,123,https://www.arbeitnow.com/jobs/companies/gocomo-gmbh/senior-operations-controller-berlin-256646,"Deine Rolle Du möchtest nicht nur Zahlen analysieren, sondern aktiv dazu beitragen, wie Projekte, Teams und Geschäftsprozesse gesteuert und optimiert werden? Als ( Senior) Operations Controller (m/w/d) arbeitest du an de"
raw-0203,2026-06-23,Arbeitnow API,Simplifier AG,Product Owner - AI Fokus (m|w|d),Software & Engineering,Remote,Unspecified,Würzburg,,Product Management; Azure; AI,Remote; Product Management,66387,95533,80960,67.4,46,33.8,125,https://www.arbeitnow.com/jobs/companies/simplifier-ag/product-owner-ai-fokus-mwd-wurzburg-401320,"WÜRZBURG oder REMOTE | VOLLZEIT Bei Simplifier möchten wir Kandidaten:innen die Möglichkeit bieten, in einem spannenden und sich schnell wandelnden Umfeld mitzuwirken und dabei mit Experten:innen für die Digitalisierung "
raw-0204,2026-06-23,Arbeitnow API,hubside - Die Recruitingwerkstatt,IT Security Coordinator (m/w/d),Cybersecurity & IT,IT,Mid-level,Munich,berufserfahren,Security,IT,65600,94400,80000,64.8,51,35.9,119,https://www.arbeitnow.com/jobs/companies/hubside-die-recruitingwerkstatt/it-security-coordinator-munich-197965,"Sie möchten Cyber-Security-Themen nicht nur begleiten, sondern aktiv mitgestalten? Dann werden Sie Teil eines Teams, das Informationssicherheit, IT und Fachbereiche miteinander verbindet und wichtige Sicherheitsinitiativ"
raw-0205,2026-06-23,Arbeitnow API,ClickScale,PPC Kampagnen Manager/in Google Ads & Meta Ads (m/w/d),Marketing & Growth,Remote,Senior/Lead,Dresden,berufserfahren,Performance Marketing; Social Media,Remote; Marketing Manager,66420,95580,81000,60.9,48,38.6,123,https://www.arbeitnow.com/jobs/companies/clickscale/ppc-kampagnen-manager-in-google-ads-meta-ads-dresden-25367,"Du findest es genauso befriedigend wie wir, wenn die Marketingkampagnen deines Kunden richtig gut laufen? Dir rollen sich die Zähennägel hoch, wenn du Kundenkonten ohne Tracking und ohne Struktur siehst? Du möchtest dem "
raw-0206,2026-06-23,Arbeitnow API,westwind stories,"Werkstudent:in Social Media, Content & Marketing (m/w/d)",Marketing & Growth,Social Media Manager,Internship/Student,Bochum,"Working student, hilfstätigkeit / student",Social Media; Cloud,Social Media Manager,27060,38940,33000,93.2,46,33.8,125,https://www.arbeitnow.com/jobs/companies/westwind-stories/werkstudentin-social-media-content-marketing-bochum-492885,"Du hast deinen eigenen Kanal, deinen Blog, dein Format und du weißt genau, was gerade läuft, bevor es alle machen? Dann lies weiter! Wir sind westwind stories, eine Boutique-Markenagentur aus dem Ruhrgebiet. Wir bauen Ma"
raw-0207,2026-06-23,Arbeitnow API,Weezevent,Client Success Manager,Marketing & Growth,Management,Senior/Lead,Berlin,manager,Operations; CRM,Management; Team Leader,66420,95580,81000,65.9,48,38.6,123,https://www.arbeitnow.com/jobs/companies/weezevent/client-success-manager-berlin-128601,"Weezevent is the French leader in online ticketing and the European leader in cashless payments. Through all the companies forming up the Weezevent Group, it provides a comprehensive suite of solutions including ticketin"
