source,source_url,date_posted,company,title,category,location,job_type,tags_raw,description
Arbeitnow API,https://www.arbeitnow.com/jobs/companies/clue-one-digital-gmbh/account-manager-mwx-hamburg-192051,2026-07-14T05:30:28,Clue One Digital GmbH,"Account Manager (m,w,x)",Online Marketing,Hamburg,berufserfahren,Online Marketing,"Was du wissen solltest Die meisten Stellenanzeigen klingen gleich. Unsere nicht – weil der Job nicht gleich ist. Wir suchen keine Person, die „digitales Marketing kann“. Davon gibt es viele. Wir suchen jemanden, der verstanden hat, warum 80 % des Marketings da draußen nicht funktioniert – und den Ehrgeiz hat, es besser zu machen. Mit Substanz statt Worthülsen. Mit messbarer Wirkung statt hübscher Dashboards. Clue One verbindet Beratung, Umsetzung und Technologie – für Kunden wie AOK, UNICEF, Orlen oder die Sparkasse. Seit 2022 sind wir als Top Consultant ausgezeichnet. Nicht weil wir gut präsentieren, sondern weil wir liefern. Wofür wir stehen Marketing hat ein Glaubwürdigkeitsproblem. Zu viele Kampagnen verbrennen Budget ohne nachweisbare Wirkung. Zu viele Berater verkaufen Frameworks statt Ergebnisse. Zu viele Teams optimieren Metriken, die fürs Geschäft irrelevant sind. Wir glauben: Marketing kann wieder ein richtig guter Job sein. Wenn man versteht, was man tut. Wenn man den gesamten Funnel denkt, nicht nur den eigenen Kanal. Und wenn man Technologie nutzt, um klarer und schneller zu arbeiten. Das ist unsere Mission. Wenn dich das nicht anspricht, ist das völlig okay. Dann ist diese Stelle nicht für dich. Aufgaben Was du bei uns machst Kein Tag sieht gleich aus. Aber die folgenden Dinge wirst du regelmäßig tun: Kunden eigenverantwortlich betreuen. Du bist erste Ansprechperson für deine Accounts. Du verstehst ihre Ziele, koordinierst ihre Anliegen und sorgst dafür, dass geliefert wird – nicht nur, dass alle freundlich bleiben. Projekte selbst steuern. Account Management ist bei uns auch Projektmanagement. Du planst, koordinierst und treibst Projekte hands-on – Timing, Budget, Qualität. Du reichst nicht nur weiter, du sorgst dafür, dass es läuft. Marketing mitdenken. Du redest nicht nur über Marketing, du verstehst die Grundlagen. Du kannst eine Kampagne einordnen und mit unseren Spezialist:innen sinnvoll zusammenarbeiten. Mit Zahlen arbeiten. Du behältst Budgets, Timings und Ergebnisse im Blick. Du weißt, ob ein Projekt läuft – und woran du das misst. Bauchgefühl reicht uns nicht. Mit KI schneller werden. KI ist bei uns Arbeitsrealität. Du nutzt sie für Reporting, Recherche und Organisation – und lernst, wo sie hilft und wo nicht. KI als Werkzeug, nicht als Ersatz fürs Denken. Als Schnittstelle funktionieren. Du übersetzt zwischen Kunde und Spezialist:innen: klare Briefings rein, gute Ergebnisse raus. Du bist der rote Faden im Projekt. Qualifikation Wen wir suchen Mindestens 3 Jahre relevante Erfahrung setzen wir voraus. Aber wichtiger als die Zahl auf dem Papier ist, was du in dieser Zeit wirklich gelernt hast: Du hast Kunden oder Projekte schon eigenverantwortlich betreut – nicht nur zugearbeitet. Du bringst Erfahrung im digitalen Marketing mit. Du weißt in Grundzügen, wie Kampagnen und Kanäle funktionieren. Du arbeitest hands-on und organisiert. Du behältst mehrere Projekte gleichzeitig im Griff, ohne den Überblick zu verlieren. Du denkst mit, statt nur abzuarbeiten. Wenn etwas in die falsche Richtung läuft, sagst du es – statt es durchzuwinken. Du gehst KI und neue Tools offen an – weil du schneller und besser werden willst. Du kommunizierst klar und verbindlich – mit Kunden und Kolleg:innen, auf Deutsch und Englisch. Wen wir nicht suchen Genauso wichtig wie das, was wir suchen, ist das, was wir nicht suchen. Spar dir die Bewerbung, wenn Folgendes auf dich zutrifft: Du verwaltest lieber, als zu treiben. Bei uns reicht niemand nur weiter, was von links nach rechts muss. Du redest über Marketing, verstehst aber die Grundlagen nicht. Ganz ohne Marketing-Bezug wird es bei uns schwer. Du arbeitest an Beziehungen, aber nicht an Ergebnissen. Wer nicht weiß, ob ein Projekt läuft, kann es nicht steuern. Du wartest auf Anweisungen, statt selbst zu denken. Wir brauchen Leute, die Verantwortung übernehmen. Du hast Angst vor KI oder ignorierst das Thema. KI gehört bei uns zum Alltag. Benefits Was wir bieten Wir versprechen keine Din"
Arbeitnow API,https://www.arbeitnow.com/jobs/companies/clue-one-digital-gmbh/senior-account-manager-mwx-hamburg-115484,2026-07-14T05:30:27,Clue One Digital GmbH,"Senior Account Manager (m,w,x)",Online Marketing,Hamburg,teamleitung,Online Marketing,"Was du wissen solltest Die meisten Stellenanzeigen klingen gleich. Unsere nicht – weil der Job nicht gleich ist. Wir suchen keine Person, die „digitales Marketing kann“. Davon gibt es viele. Wir suchen jemanden, der verstanden hat, warum 80 % des Marketings da draußen nicht funktioniert – und den Ehrgeiz hat, es besser zu machen. Mit Substanz statt Worthülsen. Mit messbarer Wirkung statt hübscher Dashboards. Clue One verbindet Beratung, Umsetzung und Technologie – für Kunden wie AOK, UNICEF, Orlen oder die Sparkasse. Seit 2022 sind wir als Top Consultant ausgezeichnet. Nicht weil wir gut präsentieren, sondern weil wir liefern. Wofür wir stehen Marketing hat ein Glaubwürdigkeitsproblem. Zu viele Kampagnen verbrennen Budget ohne nachweisbare Wirkung. Zu viele Berater verkaufen Frameworks statt Ergebnisse. Zu viele Teams optimieren Metriken, die fürs Geschäft irrelevant sind. Wir glauben: Marketing kann wieder ein richtig guter Job sein. Wenn man versteht, was man tut. Wenn man den gesamten Funnel denkt, nicht nur den eigenen Kanal. Und wenn man Technologie nutzt, um klarer und schneller zu arbeiten. Das ist unsere Mission. Wenn dich das nicht anspricht, ist das völlig okay. Dann ist diese Stelle nicht für dich. Aufgaben Was du bei uns machst Kein Tag sieht gleich aus. Aber die folgenden Dinge wirst du regelmäßig tun: Kunden führen, nicht nur betreuen. Du bist die zentrale Vertrauensperson für deine Accounts. Du verstehst ihre Geschäftsziele, denkst mit – und berätst auch dann ehrlich, wenn es unbequem ist. Projekte selbst steuern. Account Management ist bei uns auch Projektmanagement. Du planst, koordinierst und treibst Projekte hands-on – von Budget und Timing bis zur Qualität. Du reichst nicht weiter, du sorgst dafür, dass geliefert wird. Marketing verstehen und mitdenken. Du redest nicht nur über Marketing, du verstehst es. Du kannst eine Kampagne bewerten, eine Strategie hinterfragen und mit unseren Spezialisten auf Augenhöhe diskutieren. Ergebnisse in Geschäftswirkung übersetzen. Du zeigst Kunden, was ihre Investitionen für Umsatz, Leads oder Kundenbindung bedeuten. Du arbeitest mit Zahlen statt mit Bauchgefühl – und kannst einen ROI erklären. Ein Team führen und entwickeln. Du führst ein Team – fachlich und disziplinarisch – und berichtest direkt an die Geschäftsführung. Du gibst ehrliches Feedback, erkennst Potenziale und förderst Wachstum. KI zum echten Hebel machen. KI ist bei uns kein Modewort – sie ist Arbeitsrealität. Du nutzt KI für Analyse, Reporting und Recherche, machst dein Team messbar schneller – und weißt genau, wo menschliches Urteil unersetzlich bleibt. KI als Werkzeug, nicht als Ersatz fürs Denken. Qualifikation Wen wir suchen Mindestens 6 Jahre relevante Erfahrung setzen wir voraus. Aber wichtiger als die Zahl auf dem Papier ist, was du in dieser Zeit wirklich gelernt hast: Du hast Kunden in einer Agentur, Beratung oder auf Unternehmensseite eigenverantwortlich betreut – und Projekte von A bis Z verantwortet. Nicht nur begleitet. Du bringst echte Erfahrung im digitalen Marketing mit. Du weißt, wie Kampagnen, Kanäle und Funnel funktionieren – und redest nicht nur darüber. Du denkst in Geschäftsergebnissen, nicht in Aufgabenlisten. Wenn ein Kunde fragt „Was bringt mir das?“, hast du eine Antwort – mit Zahlen. Du arbeitest hands-on. Du steuerst Projekte selbst, statt sie nur zu delegieren – Timing, Budget und Qualität liegen bei dir. Du hast Erfahrung in der Führung von Teams – fachlich und disziplinarisch. Führung ist für dich Haltung, kein Titel. Du gehst KI und Technologie offensiv an – weil du verstehst, dass sie verändert, wie wir für Kunden arbeiten. Du kommunizierst klar und sicher – mit Kunden und Teams, auf Deutsch und Englisch. Du kannst einer Geschäftsführung in drei Sätzen erklären, warum ein Projekt funktioniert. Wen wir nicht suchen Genauso wichtig wie das, was wir suchen, ist das, was wir nicht suchen. Spar dir die Bewerbung, wenn Folgendes auf dich zutrifft: Du verwaltest lieber, als zu treib"
Arbeitnow API,https://www.arbeitnow.com/jobs/companies/tenmedia-gmbh/projektkoordination-softwareprojekte-berlin-mitte-teilzeit-vollzeit-377053,2026-07-14T05:30:26,TenMedia GmbH,Projektkoordination Softwareprojekte (m/w/d) | Berlin-Mitte | Teilzeit/Vollzeit,Project Management,Berlin,berufserfahren,Project Management,"Seit über 14 Jahren entwickeln wir bei TenMedia Individualsoftware für Mittelstand, öffentliche Hand und KRITIS-Betreiber. Unsere Software läuft dort, wo Ausfälle keine Option sind: in Behörden, bei kritischen Infrastrukturen und im Mittelstand. Wir suchen dich für die ganzheitliche Betreuung unserer Projekte, von der Ausschreibung über das Angebot bis zur Abnahme. Du bist die organisatorische Schaltzentrale zwischen Kunden, Entwicklungsteam und Geschäftsführung und sorgst dafür, dass jedes Projekt von Anfang bis Ende rundläuft. Kein Job aus lauter Einzelaufgaben, sondern ein durchgehender roter Faden. Du begleitest das Projekt über seinen gesamten Lebenszyklus. Aufgaben Deine Aufgaben, von Angebot bis Abnahme Du arbeitest an Ausschreibungen mit und erstellst gemeinsam mit uns umfangreiche IT-Angebote Du pflegst die Scrum-Boards, hältst Tickets und Status nach, klärst offene Punkte mit den Entwicklern und bereitest die Sprints mit vor Du koordinierst und führst Kundenmeetings, meist gemeinsam mit einem Entwickler und gelegentlich mit einer Projektleitung, inklusive Vorbereitung, Protokoll und Nachverfolgung Du wirkst bei Softwaretests und Abnahmen mit und bekommst so ein echtes Gefühl für unsere Projekte Du erstellst die monatlichen Rechnungen und hältst Wiedervorlage und Dokumentation in Ordnung Qualifikation Das bringst du mit Mindestens zwei Jahre Berufserfahrung in Projektkoordination, Projektassistenz, Angebots- oder Vergabewesen Du denkst in Projekten statt in Einzelaufgaben und behältst den roten Faden von Angebot bis Abnahme Organisationsstärke und die Fähigkeit, viele Fäden gleichzeitig in der Hand zu halten Sicheres, freundliches Auftreten in der Kundenkommunikation Ausgeprägte Technik-Affinität: Du verstehst unsere Projekte inhaltlich, kannst IT-Angebote nachvollziehen und Softwaretests mitdenken (Programmieren ist nicht nötig) Verhandlungssichere Deutschkenntnisse (C1/C2), da unsere Projektsprache überwiegend Deutsch ist Sicherer Umgang mit MS Office; moderne KI-Tools nutzen wir im Alltag, du arbeitest dich gern ein Erfahrung mit Scrum oder agilen Abläufen ist ein Plus, kein Muss Benefits Das bieten wir Gehalt 2.800 brutto/Monat bei vorzugsweise 32 Std./Woche (Stundenumfang zwischen 30 und 40 Stunden verhandelbar) Geförderte Zertifizierung als Scrum Master oder Product Owner und individuelles Weiterbildungsbudget Langfristige Kunden aus öffentlicher Hand und Mittelstand Präsenzstelle in Berlin-Mitte, fünf Tage mit Gleitzeit We love Kids! Zuschuss zur Kita und kinderfreundliche Arbeitsbedingungen 30 Urlaubstage, unbefristeter Vertrag, BVG-Fahrausweis, kostenlose Getränke Vierbeinige Kollegen willkommen! Bring deinen Hund mit ins Büro. 🐕 TÜV-Süd-zertifiziertes Unternehmen, zentral zwischen Rosa-Luxemburg-Platz und Alexanderplatz Du fühlst dich angesprochen? Schick uns Anschreiben, Lebenslauf und ggf. Arbeitszeugnisse mit deinem möglichen Eintrittstermin. Wir freuen uns auf dich! ♥️ --- TenMedia GmbH - Software. Entwicklung. Berlin. Weydingerstraße 14-16, 10178 Berlin Tel: +49 30 5 490 650-0 | Ust-Id: DE285186723 | Geschäftsführung: Rami Jabr | Amtsgericht Charlottenburg - HRB: 141523 Find more English Speaking Jobs in Germany on Arbeitnow"
Arbeitnow API,https://www.arbeitnow.com/jobs/companies/itcs-conference-gmbh/werkstudentin-webentwicklung-und-ki-automatisierung-frankfurt-am-main-65240,2026-07-14T01:29:02,ITCS Conference GmbH,Werkstudent*in Webentwicklung und KI-Automatisierung (m/w/d),IT,Frankfurt am Main,"Working student, hilfstätigkeit / student",IT,"Wenn du Informatik, Wirtschaftsinformatik oder etwas Vergleichbares studierst, gern Dinge baust, die wirklich genutzt werden, und sehen willst, wie KI in einem Unternehmen praktisch eingesetzt wird, könnte das hier gut zu dir passen. Der ITCS ist Tech-Konferenz, Jobmesse und Festival in einem. Wir veranstalten unsere Events in mehreren Städten in Deutschland und verbinden Tech, Karriere und Community auf eine Art, die man so nicht überall findet. Unsere WordPress-Webseite ist das Herzstück unserer Events. Aussteller pflegen dort Firmenprofile, Speaker, Vorträge und Stellenanzeigen. Wir wollen diese Daten stärker mit Automatisierungen, APIs und KI-Workflows verbinden und genau dafür suchen wir dich. Bei uns arbeitest du direkt mit der Geschäftsführung, unserem externen Webentwickler und dem Event-Team zusammen. deine Ergebnisse sollen nicht in der Schublade landen, sondern in echten Workflows und auf unseren Events sichtbar werden. Gerade weil technische Rollen häufig männlich geprägt sind, freuen wir uns ausdrücklich auch über Bewerbungen von Frauen. Wenn du Lust hast, bei uns technische Themen praktisch umzusetzen und perspektivisch auch Einblicke in unser Women Career Festival zu bekommen, passt das sehr gut. Aufgaben Deine Mission (wenn du sie annimmst) du entwickelst unsere WordPress-Seite weiter (Theme: Voxel): kleinere Anpassungen, Formulare, Templates und neue Funktionen du arbeitest mit Schnittstellen. Über die WordPress REST API sollen Daten wie Speaker, Vortragstitel und Firmenprofile automatisiert in interne Arbeitslisten fließen du erstellst und betreust Automatisierungen mit Make.com und KI-Tools wie Claude und ChatGPT du testest Änderungen sauber auf einer Staging-Umgebung, dokumentierst deine Arbeit und achtest auf Backups du unterstützt beim Aufbau kleiner interner Tools, Skripte oder Workflows, die wiederkehrende Aufgaben effizienter gestalten du stimmst dich mit unserem externen Webentwickler, dem Event-Team und der Geschäftsführung ab du bringst eigene Ideen ein, wie wir Website, Datenflüsse und AI-Workflows smarter verbinden können Qualifikation Was du mitbringen solltest: Grundkenntnisse in WordPress sowie in PHP oder JavaScript; HTML und CSS sollten dir vertraut sein Grundverständnis von REST APIs oder die Motivation, dich schnell und pragmatisch einzuarbeiten eine strukturierte, eigenständige Arbeitsweise. du dokumentierst, was du baust, und testest sorgfältig Neugier auf KI-Tools und Lust, sie produktiv einzusetzen statt nur auszuprobieren gute Deutschkenntnisse in Wort und Schrift, weil viele interne Prozesse und Inhalte auf Deutsch laufen Bereitschaft, regelmäßig in unser Office in Frankfurt am Main zu kommen. Homeoffice ist nach Absprache möglich Pluspunkte sind: Erfahrung mit Elementor oder dem WordPress-Theme Voxel Erfahrung mit Automatisierungsplattformen wie Make, n8n oder Zapier Python-Kenntnisse für Skripte, Datenverarbeitung oder kleine interne Tools Erfahrung mit Git, Staging-Umgebungen oder sauberen Deployment-Workflows Interesse an KI-Agenten, LLMs, APIs und AI-Workflows Benefits Was wir dir bieten: eine Werkstudentenstelle mit bis zu 20 Stunden pro Woche, flexibel passend zu deinem Studium ein kleines, sympathisches Team mit lockerer Arbeitsatmosphäre und kurzen Wegen echte Verantwortung statt Praktikanten-Aufgaben. Deine Automatisierungen sollen produktiv genutzt werden ein Arbeitsumfeld, das KI-Tools ernsthaft einsetzt und konkrete Use Cases umsetzt direkter Draht zur Geschäftsführung und schnelle Entscheidungen Events, bei denen man direkt sieht, woran man gearbeitet hat. Du kannst live dabei sein die Möglichkeit, perspektivisch auch an neuen Formaten wie unserem Women Career Festival mitzuwirken Homeoffice nach Absprache und Arbeitsplatz in der Innenstadt von Frankfurt Wir suchen niemanden, der nur Tickets abarbeitet, sondern jemanden, der mitdenkt, eigene Ideen einbringt und Lust hat, unsere Event-Plattform Stück für Stück smarter zu machen. Wenn du Bock auf Tech, APIs, KI und ein kle"
Arbeitnow API,https://www.arbeitnow.com/jobs/companies/sumup/android-engineer-berlin-241655,2026-07-13T23:45:28,SumUp,Android Engineer,,"Berlin, Germany",,,"About the role As an Android Engineer in SumUp's Hardware Tribe, you will be part of one of our small and highly skilled cross-functional teams and work together with Product Managers, Backend Engineers, iOS Engineers, Product Designers, and more. You will also be part of and collaborate on a global level with the broader Mobile chapter. You will deal with a variety of topics ranging from improving reliability of Bluetooth implementation within the Android SumUp app and the SumUp SDK, to implementing user-facing features such as screens to interact with card readers, to collaborating on developing technical roadmaps. You should be a mobile engineer with a product mindset who can fully own the features you are working on and remain flexible with changing priorities. The role is based on-site in our office in Berlin. We believe in the power of face-to-face conversations that happen organically when working next to one another. About the team You have probably used our card readers to buy a cappuccino or pay your hairdresser already. In Hardware, we are passionate about creating these beautifully designed card payment devices and accessories that enable our merchants to start, run, and grow their own businesses. In doing so, we deal with a diverse range of engineering topics - industrial and electronic design, embedded systems, all the way to mobile apps and backend services. We believe in open communication and constant learning over strict rules. If you're looking for the chance to innovate and help millions of small independent merchants succeed - join us! What you'll do Ship a variety of payment-related features and services within our Android ecosystem, supporting both our SDKs and the SuperApp Refactor and enhance existing solutions (including Bluetooth Low Energy connections, online/offline payments, and tap-to-pay functionality), and generally improve reliability and performance Work closely with the rest of the team to drive our roadmap and design our developer experience You'll be great for this position if: You're comfortable with Kotlin, Java, and Android framework You have good knowledge of architectural design patterns such as MVVM and MVI, and experience ensuring modularized and scalable app architecture You know what to test, why to test it, and how to write flexible tests that won't break You care about user interaction, usability, and have attention to detail You strive for clean code, but also know how to be pragmatic when needed Why you should join SumUp The opportunity to work on large scale fintech products used by millions of small businesses around the world A dedicated annual Learning &amp; Development budget for attending conferences and/or advancing your career through further education Enrollment onto our virtual stock ownership program - you will own a stake in SumUp's future success A corporate pension scheme&nbsp; 28 days paid leave + 1 for birthday&nbsp; You'll attend global offsites and/or hackathons. You'd enjoy other great benefits such as Urban Sports Club subsidy, Kita placement assistance, subsidized office lunches and other location-tailored benefits, Babbel language platform subscription and more! Job Application Tip We recognise that candidates feel they need to meet 100% of the job criteria in order to apply for a job. Please note that this is only a guide. If you don't tick every box, it's ok too because it means you have room to learn and develop your career at SumUp. Find Jobs in Germany on Arbeitnow"
Arbeitnow API,https://www.arbeitnow.com/jobs/companies/itcs-conference-gmbh/werkstudentin-event-projektmanagement-fur-tech-events-jobmessen-frankfurt-am-main-56040,2026-07-13T21:30:34,ITCS Conference GmbH,Werkstudent*in Event- & Projektmanagement (m/w/d) für Tech-Events & Jobmessen,Marketing and Communication,Frankfurt am Main,"Working student, hilfstätigkeit / student",Marketing and Communication,"Du organisierst gern, behältst auch bei vielen kleinen To-dos den Überblick und hast Lust, echte Events nicht nur vom Schreibtisch aus, sondern auch vor Ort mitzuerleben? Dann könnte das hier gut zu dir passen. Der ITCS ist Tech-Konferenz, Jobmesse und Festival in einem. Wir veranstalten unsere Events in mehreren Städten in Deutschland und verbinden Tech, Karriere und Community auf eine Art, die man so nicht überall findet. Für unser Team in Frankfurt suchen wir eine*n Werkstudent*in im Event- und Projektmanagement für ca. 20 Stunden pro Woche. Du unterstützt uns bei der Vorbereitung, Organisation und Umsetzung unserer Veranstaltungen im Office in Frankfurt und bei unseren Events vor Ort. Social-Media-Affinität ist dabei sehr willkommen, denn rund um unsere Events gibt es immer wieder Inhalte, Einblicke und Themen, die wir nach außen sichtbar machen wollen. Aufgaben Was du bei uns machst: du unterstützt bei der Planung, Koordination und Organisation unserer Tech-Events du hilfst bei der Betreuung von Ausstellern, Partnern und Speakern vor und rund um die Events du pflegst Listen, Unterlagen, Timings und organisatorische Informationen du unterstützt bei Eventmaterialien, Briefings, Checklisten und der Vorbereitung der Messetage du arbeitest eng mit Eventmanagement, Sales, Marketing und Technik zusammen du bist bei unseren Veranstaltungen vor Ort dabei und unterstützt beim Aufbau, am Messetag und bei organisatorischen Aufgaben du hilfst bei Social-Media-Themen rund um unsere Events, z. B. bei Ideen, Content-Vorbereitung, Einblicken vom Event oder einfachen Postings du nutzt digitale Tools und gern auch KI-Tools, um Recherche, Textarbeit, Dokumentation und Arbeitsabläufe effizienter zu gestalten Qualifikation Was du mitbringen solltest: du bist eingeschriebene*r Student*in du hast ca. 20 Stunden pro Woche Zeit du kannst regelmäßig in unser Office in Frankfurt am Main kommen du hast Lust, bei unseren Events in verschiedenen Städten vor Ort mit anzupacken dir ist bewusst, dass Eventeinsätze auch Reisetage und Aufbautage umfassen können. Bei Freitagsveranstaltungen in der Regel mindestens Donnerstag und Freitag, ggf. inklusive Rückreise am Samstag du arbeitest zuverlässig, strukturiert und sorgfältig du kommunizierst gern und freundlich mit unterschiedlichen Ansprechpartnern du hast sehr gute Deutschkenntnisse in Wort und Schrift du bist sicher im Umgang mit Microsoft 365, insbesondere Outlook, Excel und Word du hast Interesse an Social Media und ein gutes Gefühl für Inhalte, Sprache und Zielgruppen du bist offen für den Einsatz von KI-Tools wie ChatGPT, Claude, Canva AI oder ähnlichen Anwendungen Pluspunkte sind: Erste Erfahrung mit Events, Messen, Hochschulgruppen, Vereinen, Gastro, Promotion oder Projektarbeit Erfahrung mit Social Media, Canva, Content-Erstellung oder einfachen Grafik-/Videoformaten Führerschein Klasse B Interesse an Tech-, Karriere- &#x26; AI-Themen Benefits Was wir dir bieten: Eine Werkstudentenstelle mit ca. 20 Stunden pro Woche Ein kleines, sympathisches Team mit lockerer Arbeitsatmosphäre und kurzen Wegen Einblicke in echte Eventorganisation statt Theorie Events, bei denen du direkt siehst, woran du mitgearbeitet hast Ein lockeres, zukunftsorientiertes Umfeld mit spannenden Tech-Themen und Formaten Abwechslungsreiche Aufgaben, bei denen man viel Neues lernt Raum für eigene Ideen, besonders auch im Bereich Social Media und Eventkommunikation Moderne Arbeitsweise mit digitalen Tools und KI-Unterstützung Arbeitsplatz in Frankfurt am Main Wir suchen niemanden, der nur ein paar Stunden „nebenbei“ absitzt, sondern jemanden, der Lust hat, mitzudenken, Verantwortung zu übernehmen und unsere Events wirklich kennenzulernen. Wenn du Bock auf Tech, Events, Social Media und ein kleines Team mit viel Gestaltungsspielraum hast, freuen wir uns auf deine Bewerbung. Find more English Speaking Jobs in Germany on Arbeitnow"
