job_id,date_posted,source,company,title,category,raw_category,seniority,location,job_type,skills,tags_raw,salary_min_usd,salary_max_usd,salary_mid_usd,demand_index,scarcity_score,time_to_fill_days_proxy,application_volume_proxy,source_url,description_preview
raw-0168,2026-06-15,Arbeitnow API,Taxtalente.de,"Steuerberater (m/w/d) in Weyerbusch, auf Wunsch mit Partnerperspektive, gesucht - mindestens 90.000€",Software & Engineering,Directors,Unspecified,Weyerbusch,,Python; JavaScript; API; Cloud,Directors; Chief Executives,66387,95533,80960,93.4,62,40.7,104,https://www.arbeitnow.com/jobs/companies/taxtalentede/steuerberater-in-weyerbusch-auf-wunsch-mit-partnerperspektive-gesucht-mindestens-90000eur-231664,TaxTalente ist die Nr. 1 Job-Matching Plattform für Jobsuchende in der Steuerberatung. Sie suchen eine positive berufliche Veränderung? Sie möchten den nächsten Schritt in Ihrer Karriere gehen und streben möglicherweise 
raw-0169,2026-06-15,Arbeitnow API,Taxtalente.de,"Steuerberater (m/w/d) in Hürth, auf Wunsch mit Partnerperspektive, gesucht - mindestens 90.000€",Software & Engineering,Directors,Unspecified,Hürth,,Python; JavaScript; API; Cloud,Directors; Chief Executives,66387,95533,80960,93.4,62,40.7,104,https://www.arbeitnow.com/jobs/companies/taxtalentede/steuerberater-in-hurth-auf-wunsch-mit-partnerperspektive-gesucht-mindestens-90000eur-296245,TaxTalente ist die Nr. 1 Job-Matching Plattform für Jobsuchende in der Steuerberatung. Sie suchen eine positive berufliche Veränderung? Sie möchten den nächsten Schritt in Ihrer Karriere gehen und streben möglicherweise 
raw-0170,2026-06-15,Arbeitnow API,Taxtalente.de,"Steuerberater (m/w/d) in Goseck, auf Wunsch mit Partnerperspektive, gesucht - mindestens 90.000€",Software & Engineering,Directors,Unspecified,Goseck,,Python; JavaScript; API; Cloud,Directors; Chief Executives,66387,95533,80960,93.4,62,40.7,104,https://www.arbeitnow.com/jobs/companies/taxtalentede/steuerberater-in-goseck-auf-wunsch-mit-partnerperspektive-gesucht-mindestens-90000eur-411377,TaxTalente ist die Nr. 1 Job-Matching Plattform für Jobsuchende in der Steuerberatung. Sie suchen eine positive berufliche Veränderung? Sie möchten den nächsten Schritt in Ihrer Karriere gehen und streben möglicherweise 
raw-0171,2026-06-15,Arbeitnow API,Taxtalente.de,"Steuerberater (m/w/d) in Dobel, auf Wunsch mit Partnerperspektive, gesucht - mindestens 90.000€",Software & Engineering,Directors,Unspecified,Dobel,,Python; JavaScript; API; Cloud,Directors; Chief Executives,66387,95533,80960,93.4,62,40.7,104,https://www.arbeitnow.com/jobs/companies/taxtalentede/steuerberater-in-dobel-auf-wunsch-mit-partnerperspektive-gesucht-mindestens-90000eur-86571,TaxTalente ist die Nr. 1 Job-Matching Plattform für Jobsuchende in der Steuerberatung. Sie suchen eine positive berufliche Veränderung? Sie möchten den nächsten Schritt in Ihrer Karriere gehen und streben möglicherweise 
raw-0172,2026-06-15,Arbeitnow API,Taxtalente.de,"Steuerberater (m/w/d) in Unterreichenbach, auf Wunsch mit Partnerperspektive, gesucht - mindestens 90.000€",Software & Engineering,Directors,Unspecified,Unterreichenbach,,Python; JavaScript; API; Cloud,Directors; Chief Executives,66387,95533,80960,93.4,62,40.7,104,https://www.arbeitnow.com/jobs/companies/taxtalentede/steuerberater-in-unterreichenbach-auf-wunsch-mit-partnerperspektive-gesucht-mindestens-90000eur-234576,TaxTalente ist die Nr. 1 Job-Matching Plattform für Jobsuchende in der Steuerberatung. Sie suchen eine positive berufliche Veränderung? Sie möchten den nächsten Schritt in Ihrer Karriere gehen und streben möglicherweise 
raw-0173,2026-06-15,Arbeitnow API,Taxtalente.de,"Steuerberater (m/w/d) in Weißenbrunn, auf Wunsch mit Partnerperspektive, gesucht - mindestens 90.000€",Software & Engineering,Directors,Unspecified,Weißenbrunn,,Python; JavaScript; API; Cloud,Directors; Chief Executives,66387,95533,80960,93.4,62,40.7,104,https://www.arbeitnow.com/jobs/companies/taxtalentede/steuerberater-in-weissenbrunn-auf-wunsch-mit-partnerperspektive-gesucht-mindestens-90000eur-453929,TaxTalente ist die Nr. 1 Job-Matching Plattform für Jobsuchende in der Steuerberatung. Sie suchen eine positive berufliche Veränderung? Sie möchten den nächsten Schritt in Ihrer Karriere gehen und streben möglicherweise 
raw-0174,2026-06-15,Arbeitnow API,Taxtalente.de,"Steuerberater (m/w/d) in Reinstorf, auf Wunsch mit Partnerperspektive, gesucht - mindestens 90.000€",Software & Engineering,Directors,Unspecified,Reinstorf,,Python; JavaScript; API; Cloud,Directors; Chief Executives,66387,95533,80960,93.4,62,40.7,104,https://www.arbeitnow.com/jobs/companies/taxtalentede/steuerberater-in-reinstorf-auf-wunsch-mit-partnerperspektive-gesucht-mindestens-90000eur-181026,TaxTalente ist die Nr. 1 Job-Matching Plattform für Jobsuchende in der Steuerberatung. Sie suchen eine positive berufliche Veränderung? Sie möchten den nächsten Schritt in Ihrer Karriere gehen und streben möglicherweise 
raw-0175,2026-06-15,Arbeitnow API,Taxtalente.de,"Steuerberater (m/w/d) in Langerringen, auf Wunsch mit Partnerperspektive, gesucht - mindestens 90.000€",Software & Engineering,Directors,Unspecified,Langerringen,,Python; JavaScript; API; Cloud,Directors; Chief Executives,66387,95533,80960,93.4,62,40.7,104,https://www.arbeitnow.com/jobs/companies/taxtalentede/steuerberater-in-langerringen-auf-wunsch-mit-partnerperspektive-gesucht-mindestens-90000eur-260882,TaxTalente ist die Nr. 1 Job-Matching Plattform für Jobsuchende in der Steuerberatung. Sie suchen eine positive berufliche Veränderung? Sie möchten den nächsten Schritt in Ihrer Karriere gehen und streben möglicherweise 
raw-0176,2026-06-15,Arbeitnow API,wabcon,"Projektleiter:in Sicherheitstechnik - elektrotechnische Anlagen und IT-Systeme, hybrid, 75.000 - 90.000",Software & Engineering,Project Management,Senior/Lead,Nuremberg,teamleitung,Project Management; Video Editing,Project Management,97416,140184,118800,52.1,48,38.6,123,https://www.arbeitnow.com/jobs/companies/wabcon/projektleiterin-sicherheitstechnik-elektrotechnische-anlagen-und-it-systeme-hybrid-75000-90000-nuremberg-475665,Unser Kunde ist einer der Marktführer im Bereich Sicherheitstechnologie und mehrfach ausgezeichnet als bester Arbeitgeber Deutschlands. Im Kundenauftrag suchen wir einen erfahrenen technischen Projektleiter (m/w/d) mit e
raw-0177,2026-06-15,Arbeitnow API,QBS Software GmbH,Inside Sales Manager (m/w/d),Software & Engineering,IT,Senior/Lead,Munich,,Sales,IT,97416,140184,118800,80.2,48,38.6,123,https://www.arbeitnow.com/jobs/companies/qbs-software-gmbh/inside-sales-manager-munich-239547,"Bei QBS geht es nicht nur um Software – wir gestalten die Zukunft ihrer Bereitstellung. Wir bringen Softwarehersteller und Fachhändler über eine intelligente, nahtlose und skalierbare Plattform zusammen, die auf beiden S"
raw-0178,2026-06-15,Arbeitnow API,wabcon,Informationsspezialist:in ISMS,Cybersecurity & IT,Quality Assurance,Mid-level,Berlin,berufserfahren,Security,Quality Assurance; Inspection,65600,94400,80000,74.4,51,35.9,119,https://www.arbeitnow.com/jobs/companies/wabcon/informationsspezialistin-isms-berlin-11675,"Unser Kunde ist eine der erfolgreichsten Unternehmensberatungen in Deutschland im Bereich Informationssicherheit mit Sitz in Berlin. Das Unternehmen unterstützt Kunden aus unterschiedlichen Branchen bei der Einführung, W"
raw-0179,2026-06-15,Arbeitnow API,wabcon,"Bauleiter:in Infrastruktur Sicherheitstechnik, GR Nordbayern, 70.000 - 90.000",Software & Engineering,Building,Mid-level,Nuremberg,berufserfahren,Python; JavaScript; API; Cloud,Building; Supply; Safety Services Engineering,72160,103840,88000,93.4,62,40.7,104,https://www.arbeitnow.com/jobs/companies/wabcon/bauleiterin-infrastruktur-sicherheitstechnik-gr-nordbayern-70000-90000-nuremberg-143493,Unser Kunde ist einer der Marktführer im Bereich Sicherheitstechnologie und mehrfach ausgezeichnet als bester Arbeitgeber Deutschlands. Im Kundenauftrag suchen wir einen erfahrenen Bauleiter Infrastruktur Sicherheitstech
raw-0180,2026-06-15,Arbeitnow API,EurA AG,Netzwerkmanager (m/w/d) Photonik,Cybersecurity & IT,System and Network Administration,Senior/Lead,Ellwangen,berufserfahren,Security; Cloud; Risk Management; Technical Support,System and Network Administration,88560,127440,108000,65.8,69,47.7,95,https://www.arbeitnow.com/jobs/companies/eura-ag/netzwerkmanager-photonik-ellwangen-23866,"EurA AG ist eine international renommierte Innovations- und Finanzierungsberatung mit über 200 Mitarbeitenden an mehr als 15 Standorten in Europa. EurA begleitet Unternehmen, Forschungseinrichtungen und Kommunen bei der "
raw-0181,2026-06-15,Arbeitnow API,BUZIL-WERK Wagner GmbH & Co. KG,Vertriebsleiter Private Label/ Business Development (m/w/d),Finance & Business,Business Development,Mid-level,Memmingen,berufserfahren,Forecasting; Onboarding,Business Development,55760,80240,68000,56.7,38,30.3,136,https://www.arbeitnow.com/jobs/companies/buzil-werk-wagner-gmbh-co-kg/vertriebsleiter-private-label-business-development-memmingen-57248,"Wir sind der kompetente Problemlöser und zuverlässige Partner für erstklassige und gleichzeitig effiziente Reinigungslösungen für professionelle Anwender. Über 130 Spezialisten unter einem Dach entwickeln, produzieren un"
raw-0182,2026-06-15,Arbeitnow API,Ing Plus AG,Account & Sales Manager Ostdeutschland,Product & Project Management,Remote,Senior/Lead,Fürth,berufserfahren,Sales,Remote; Management; Team Leader,84132,121068,102600,80.2,48,38.6,123,https://www.arbeitnow.com/jobs/companies/ing-plus-ag/account-sales-manager-ostdeutschland-furth-318191,"Account &#x26; Sales Manager Ostdeutschland Ing.Plus ist Spezialist für intelligente Prozessautomatisierung im Tiefbau und unterstützt Netzbetreiber sowie Ingenieurbüros mit einsatzbereiten, datengetriebenen Lösungen für"
raw-0183,2026-06-15,Arbeitnow API,TecTake GmbH,Senior Infrastructure Engineer (m/w/d),Software & Engineering,System and Network Administration,Senior/Lead,Igersheim,berufserfahren,Security; Azure; Cloud; SaaS,System and Network Administration,97416,140184,118800,68.4,72,49,91,https://www.arbeitnow.com/jobs/companies/tectake-gmbh/senior-infrastructure-engineer-igersheim-284769,"tectake ist ein dynamisches E-Commerce-Unternehmen mit einem breiten und stetig wachsenden Produktsortiment rund um Wohnen, Haushalt, Freizeit und Hobby. Durch kontinuierliche Optimierungen setzen wir unsere erfolgreiche"
raw-0184,2026-06-15,Arbeitnow API,TecTake GmbH,Head of Business Applications & Platforms (m/w/d),Marketing & Growth,Applications Administration,Senior/Lead,Höchberg,berufserfahren,SEO; Google Analytics; Paid Marketing; Content Strategy,Applications Administration,66420,95580,81000,45.6,48,38.6,123,https://www.arbeitnow.com/jobs/companies/tectake-gmbh/head-of-business-applications-platforms-hochberg-132235,"tectake ist ein dynamisches E-Commerce-Unternehmen mit einem breiten und stetig wachsenden Produktsortiment rund um Wohnen, Haushalt, Freizeit und Hobby. Durch kontinuierliche Optimierungen setzen wir unsere erfolgreiche"
raw-0185,2026-06-15,Arbeitnow API,Finmatics GmbH,Kundenberater für Buchhaltungsautomatisierung (m/w/d)_remote,Software & Engineering,Remote,Mid-level,Munich,berufserfahren,Onboarding; SaaS; AI,Remote; Business Consulting,72160,103840,88000,75.5,38,30.3,136,https://www.arbeitnow.com/jobs/companies/finmatics-gmbh/kundenberater-fur-buchhaltungsautomatisierung-remote-munich-341691,"Finmatics - Your AI accountant Mit Fin, dem KI-Buchhalter , macht Finmatics Buchhaltung einfacher, schneller und smarter. Statt Routinearbeiten von Hand zu erledigen, übernimmt unsere Software diese zuverlässig – für Buc"
raw-0186,2026-06-14,Arbeitnow API,Think3DDD GbR,Pflichtpraktikum CAD-Design & FDM 3D-Druck (m/w/d) - Open Source Tools & MedTech-Startup,Software & Engineering,Engineering,Internship/Student,Berlin,Internship,Startup; Design,Engineering,39688,57112,48400,81.9,38,30.3,136,https://www.arbeitnow.com/jobs/companies/think3ddd-gbr/pflichtpraktikum-cad-design-fdm-3d-druck-open-source-tools-medtech-startup-berlin-410050,"🖊️ Du suchst ein Pflichtpraktikum oder Praxissemester, in dem du CAD-Design und FDM 3D-Druck sinnvoll miteinander verbinden kannst? 🖨️ Du möchtest mit modernen, kostengünstigen CAD-Tools passgenaue Bauteile entwerfen –"
raw-0187,2026-06-14,Arbeitnow API,CONCAPE,"Senior IT Consultant - PLM & CAD Systems (a) - 100% | Raum Bodensee, Deutschland",Product & Project Management,IT,Senior/Lead,Munich,,Product Management; Project Management; Agile; Stakeholder Management,IT,84132,121068,102600,50.5,48,38.6,123,https://www.arbeitnow.com/jobs/companies/concape/senior-it-consultant-plm-cad-systems-a-100-raum-bodensee-deutschland-munich-42266,"Ein international tätiges Industrieunternehmen im Bereich Elektronik- und Antriebstechnik entwickelt und produziert hochpräzise elektronische Baugruppen, Steuerungssysteme und mechatronische Komponenten für industrielle "
raw-0188,2026-06-14,Remotive API,Mitre Media,Tech Lead Full-Stack Rails Engineer,Data & AI,Software Development,Senior/Lead,"USA, Canada, USA timezones",full_time,Advertising; Kubernetes; JavaScript; Full Stack; Docker; AI/ML; React; Java; SQL; NLP; Git; API,api; CSS; docker; elasticsearch; fullstack; html; javascript; kubernetes; postgresql; react; ror; ruby/rails; AI/ML; CAD; advertising; Redis; ES6; web applications; MySQL; NLP; fintech; Micro services; github; system architecture,94095,135405,114750,57.5,77,51.1,85,https://remotive.com/remote-jobs/software-development/tech-lead-full-stack-rails-engineer-2069746,"About Mitre Media Mitre Media is redefining FinTech with AI-driven tools that empower millions of investors. Our portfolio, including Dividend.com and MutualFunds.com, leverages LLMs to deliver novel data insights and vi"
raw-0189,2026-06-14,Arbeitnow API,Flix,Senior Product Analyst (m/f/d),Data & AI,Unspecified,Senior/Lead,"München, Bayern, Germany",,Power BI; Testing; Design; SaaS; SQL; AI,,94095,135405,114750,69.2,53,40.8,116,https://www.arbeitnow.com/jobs/companies/flix/senior-product-analyst-munchen-21748,"At Flix, we offer a tech-driven environment where innovation meets real-world impact, with competitive pay, strong growth opportunities, and a culture of collaboration and ownership. &nbsp; We're looking for a Senior Pro"
raw-0190,2026-06-14,Arbeitnow API,AS-Talentbridge,Technischer Einkäufer Stahlbau (m/w/d),Product & Project Management,Management,Unspecified,Zweibrücken,,ERP; SAP,Management; Team Leader,57334,82506,69920,54.3,38,30.3,136,https://www.arbeitnow.com/jobs/companies/as-talentbridge/technischer-einkaufer-stahlbau-zweibrucken-181964,AS Talentbridge ist Ihr idealer Ansprechpartner für Personalbeschaffung und Beratung sowie die Anlaufstelle für Sie als Bewerber. Wir unterstützen Sie mit unserem umfassenden Branchenwissen in der DACH Region und bringen
raw-0191,2026-06-14,Arbeitnow API,AS-Talentbridge,Strategischer Einkäufer Stahlbau (m/w/d),Product & Project Management,Management,Unspecified,Zweibrücken,,ERP; SAP,Management; Team Leader,57334,82506,69920,54.3,38,30.3,136,https://www.arbeitnow.com/jobs/companies/as-talentbridge/strategischer-einkaufer-stahlbau-zweibrucken-177456,AS Talentbridge ist Ihr idealer Ansprechpartner für Personalbeschaffung und Beratung sowie die Anlaufstelle für Sie als Bewerber. Wir unterstützen Sie mit unserem umfassenden Branchenwissen in der DACH Region und bringen
raw-0192,2026-06-14,Arbeitnow API,LevelUp English,Freelance Bookkeeper & Finance Coordinator (m/f/d),Finance & Business,Finance,Entry-level,Berlin,"Freelance, berufseinstieg",Finance; Communication; Automation; Accounting; AI,Finance,41820,60180,51000,75.9,38,30.3,136,https://www.arbeitnow.com/jobs/companies/levelup-english/freelance-bookkeeper-finance-coordinator-berlin-381385,"LevelUp English is a Berlin-based education company delivering English project weeks, holiday camps, and educational experiences for schools and families across Germany. As we continue to grow, we are looking for a relia"
raw-0193,2026-06-14,Arbeitnow API,Reviven,"Founders Associate (Internship, m/f/d)",Software & Engineering,Management,Internship/Student,Berlin,"Internship, no experience required / student",Startup; Sales; AI,Management; Team Leader,39688,57112,48400,86.7,38,30.3,136,https://www.arbeitnow.com/jobs/companies/reviven/founders-associate-internship-berlin-229941,"Acoustic Index is an early-stage bootstrapped startup based in Berlin. We are building the platform where acoustic manufacturers list their products with measurement data, so that planners, architects and acousticians fi"
raw-0194,2026-06-14,Arbeitnow API,bedrop,Produktmanager (m/w/d) Berufserfahren,Cybersecurity & IT,Product Management,Senior/Lead,Mannheim,,Product Management; Design; Excel,Product Management,88560,127440,108000,69.9,53,40.8,116,https://www.arbeitnow.com/jobs/companies/bedrop/produktmanager-berufserfahren-mannheim-234542,bedrop ist kein Start-up im Aufbau – wir sind ein wachstumsstarkes E-Commerce-Unternehmen auf Kurs Richtung dreistellige Millionenumsätze. Unsere Produkte sind erfolgreich am Markt etabliert. Jetzt suchen wir eine erfahr
raw-0195,2026-06-14,Arbeitnow API,Fritz Wellhöfer GmbH & Co. KG,Office & HR Manager*in (m/w/d),Product & Project Management,Administration and Secretariat,Senior/Lead,Sachsen bei Ansbach,berufserfahren,HR,Administration and Secretariat,84132,121068,102600,64.8,48,38.6,123,https://www.arbeitnow.com/jobs/companies/fritz-wellhofer-gmbh-co-kg/office-hr-managerin-sachsen-bei-ansbach-432784,"„Wir haben immer den richtigen Sitzplatz für Sie. “ Art der Stelle: Vollzeit Einsatzort: Alberndorf, Sachsen bei Ansbach Sie möchten nicht nur verwalten, sondern aktiv gestalten? Dann übernehmen Sie bei uns eine zentrale"
raw-0196,2026-06-14,Arbeitnow API,Logic Joe GmbH,Werkstudent:in / Intern:in Entrepreneur in Residence (m/w/d),Marketing & Growth,Remote,Internship/Student,Hamburg,"Internship, berufserfahren",Design; Sales,Remote; Business Development,27060,38940,33000,86.5,38,30.3,136,https://www.arbeitnow.com/jobs/companies/logic-joe-gmbh/werkstudentin-internin-entrepreneur-in-residence-hamburg-425767,"Remote (DACH) mit Reisebereitschaft, oder an einem unserer Standorte (Hamburg · Stuttgart · Reutlingen · Salzburg) · Werkstudium (ca. 20 Std./Woche) oder Vollzeit-Praktikum · ab sofort Logic Joe ist seit 2010 in der Digi"
raw-0197,2026-06-14,Arbeitnow API,Koller & Lode,Junior Sales Manager / Trainee im Vertrieb (m/w/d) | bis 6.000 € | Würzburg,Marketing & Growth,Training,Internship/Student,Würzburg,hilfstätigkeit / student,AI; Sales; CRM,Training; Development,27060,38940,33000,80.4,38,30.3,136,https://www.arbeitnow.com/jobs/companies/koller-lode/junior-sales-manager-trainee-im-vertrieb-bis-6000-eur-wurzburg-491882,"Hey, wir sind die Firma Koller &#x26; Lode. Das hier ist für dich, wenn du … mitten im Studium steckst und merkst, du kannst und willst mehr dein Studium fertig hast und keinen Plan, was jetzt Sache ist deine Ausbildung "
raw-0198,2026-06-14,Arbeitnow API,dexter health,AI Developer (LLM Products) - Remote,Software & Engineering,Remote,Mid-level,Cologne,professional / experienced,Full Stack; Frontend; Backend; Testing; Startup; Python; Design; AI,Remote; Development,72160,103840,88000,77.8,62,40.7,104,https://www.arbeitnow.com/jobs/companies/dexter-health/ai-developer-llm-products-remote-cologne-37116,"👋 Welcome to dexter health! At dexter health, we build AI-powered software for care teams. Our mission is to reduce administrative workload in healthcare so caregivers can spend more time with patients. We are looking f"
raw-0199,2026-06-14,Arbeitnow API,dexter health,Applied AI Developer - Remote,Software & Engineering,Remote,Mid-level,Cologne,professional / experienced,Full Stack; Frontend; Backend; Testing; Startup; Python; Design; AI,Remote; Development,72160,103840,88000,77.8,62,40.7,104,https://www.arbeitnow.com/jobs/companies/dexter-health/applied-ai-developer-remote-cologne-39645,"👋 Welcome to dexter health! At dexter health, we build AI-powered software for care teams. Our mission is to reduce administrative workload in healthcare so caregivers can spend more time with patients. We are looking f"
raw-0200,2026-06-14,Arbeitnow API,dexter health,AI Engineer (LLM) - Remote,Software & Engineering,Remote,Mid-level,Cologne,professional / experienced,Full Stack; Frontend; Backend; Testing; Startup; Python; Design; AI,Remote; Development,72160,103840,88000,77.8,62,40.7,104,https://www.arbeitnow.com/jobs/companies/dexter-health/ai-engineer-llm-remote-cologne-192977,"👋 Welcome to dexter health! At dexter health, we build AI-powered software for care teams. Our mission is to reduce administrative workload in healthcare so caregivers can spend more time with patients. We are looking f"
raw-0201,2026-06-14,Arbeitnow API,Logic Joe GmbH,Werkstudent:in / Intern:in Online Marketing & Paid Ads (Google Ads / Meta) (m/w/d),Marketing & Growth,Remote,Internship/Student,Hamburg,"Internship, berufserfahren",Design; AI,Remote; Online Marketing,27060,38940,33000,100,38,30.3,136,https://www.arbeitnow.com/jobs/companies/logic-joe-gmbh/werkstudentin-internin-online-marketing-paid-ads-google-ads-meta-hamburg-300012,"Remote (DACH) mit Reisebereitschaft, oder an einem unserer Standorte (Hamburg · Stuttgart · Reutlingen · Salzburg) · Werkstudium (ca. 20 Std./Woche) oder Vollzeit-Praktikum · ab sofort Seit 2010 entwickeln und realisiere"
raw-0202,2026-06-14,Arbeitnow API,MILES Mobility,Sales Manager (w/m/x/d),Software & Engineering,Business Development,Senior/Lead,Berlin,berufserfahren,Sales; SaaS; CRM; AI,Business Development,97416,140184,118800,73.8,48,38.6,123,https://www.arbeitnow.com/jobs/companies/miles-mobility/sales-manager-d-berlin-6661,"Join the ride! Wir launchen MILES for Business 2.0 - ein neues Kapitel dafür, wie Unternehmen Shared Mobility für ihre Teams nutzen. Wir bauen unsere B2B Sales Motion gerade neu auf, mit ambitionierten zweistelligen Wach"
raw-0203,2026-06-13,The Muse API,GE Vernova,Senior Commercial Risk Manager APAC,Software & Engineering,Software Engineering,Senior/Lead,"Flexible / Remote, Hefei, China",external,Risk Management; Finance; Sales,Software Engineering; Senior Level,97416,140184,118800,66.8,48,38.6,123,https://www.themuse.com/jobs/gevernova/senior-commercial-risk-manager-apac,"Job Description Summary GE Vernova's Software &amp; Control Solutions (SCS) business line focuses on advanced control systems and digital solutions for the Power Generation, Oil &amp; Gas, and Industrial segments. SCS in"
raw-0204,2026-06-12,Remotive API,Expion Health,Business Transformation Lead,Data & AI,Artificial Intelligence,Senior/Lead,USA,full_time,Automation; Startup; AI/ML; Spark; API; AI; Operations; Finance; Design; Sales,api; AI/ML; automation; healthcare; spark; startup; infrastructure; insurance,94095,135405,114750,73.5,69,47.7,95,https://remotive.com/remote-jobs/artificial-intelligence/business-transformation-lead-2090881,"Title : Business Transformation Lead Location : Fully Remote Reports To : President, Service &amp; Growth Expion Health is building the future of pharmacy economics. As architects of prescription economics, we design how"
raw-0205,2026-06-12,Remotive API,The Obesity Society,Assistant Account Payable,Software & Engineering,Medical,Unspecified,USA,full_time,Accounting; Excel; Communication; Finance,accounting; excel; data entry; outlook,66387,95533,80960,70.1,38,30.3,136,https://remotive.com/remote-jobs/medical/assistant-account-payable-2090989,This role may require you to be on site at times - please check with the employer first. The Accounts Payable Assistant performs accounting and c lerical tasks that are related to accounts payable transactions including 
raw-0206,2026-06-12,Remotive API,Lemon.io,Head of Engineering,Data & AI,Software Development,Senior/Lead,"LATAM, Europe, Central America",full_time,Fundraising; Marketplace; Startup; AI/ML; AI,AI/ML; startup; marketplace; fundraising,94095,135405,114750,68.1,61,44.2,106,https://remotive.com/remote-jobs/software-development/head-of-engineering-2090983,"About Lemon.io Lemon.io is a profitable, growing talent marketplace that connects vetted senior engineers with companies that need them. We’ve been in business for 10 years, have 60 people across Ukraine, Europe, Canada,"
raw-0207,2026-06-11,Remotive API,Coalition Technologies,Office Assistant,Software & Engineering,Marketing,Unspecified,Worldwide,full_time,WordPress; Frontend; Startup; Shopify; Excel; SQL; Git; Data Analysis; Communication,CSS; excel; frontend; git; html; illustrator; magento; photoshop; php; shopify; wordpress; MySQL; startup; responsive; themes; bootstrap; insurance; jQuery; Ajax,66387,95533,80960,59.5,38,30.3,136,https://remotive.com/remote-jobs/marketing/office-assistant-1680495,"WHY YOU SHOULD APPLY: Coalition Technologies is devoted to delivering clients the highest quality work while providing our team a fun, thriving, and innovative environment. Along with the opportunity for tremendous caree"
raw-0208,2026-06-11,The Muse API,KinderCare Learning Companies,Area Manager,Software & Engineering,Account Management,Senior/Lead,"Roseville, CA",external,Customer Service; Research; Sales,Account Management; Senior Level,97416,140184,118800,69.2,48,38.6,123,https://www.themuse.com/jobs/kindercarelearningcompanies/area-manager-48c1bf,"Futures start here. Where first steps, new friendships, and confident learners are born. At KinderCare Learning Companies, the first and only early childhood education provider recognized with the Gallup Exceptional Work"
