source,source_url,date_posted,company,title,category,location,job_type,tags_raw,description
Arbeitnow API,https://www.arbeitnow.com/jobs/companies/taxtalentede/steuerberater-in-ulm-auf-wunsch-mit-partnerperspektive-gesucht-mindestens-90000eur-235329,2026-05-03T13:30:28,Taxtalente.de,"Steuerberater (m/w/d) in Ulm , auf Wunsch mit Partnerperspektive, gesucht - mindestens 90.000€",Directors,Ulm,,Directors; Chief Executives,"TaxTalente ist die Nr. 1 Job-Matching Plattform für Jobsuchende in der Steuerberatung. Sie suchen eine positive berufliche Veränderung? Sie möchten den nächsten Schritt in Ihrer Karriere gehen und streben möglicherweise sogar eine Partnerschaft in einer zukunftsorientierten Kanzlei an? Sie möchten endlich wieder in einem positiven Arbeitsumfeld arbeiten, in dem Sie finanziell und persönlich wertgeschätzt werden? Sie suchen nach Tätigkeiten, die Sie auch wirklich weiterbringen? Sofern Sie sich in mindestens einem der genannten Punkte wiederfinden, sollten Sie sich bei uns melden. Wir haben die attraktivsten Arbeitgeber der Steuerberatungsbranche in unserem Netzwerk und bringen zusammen, was zusammengehört. Grenzenlose Entwicklungschancen mit Partnermöglichkeiten, vielschichtige Tätigkeitsbereiche, Gehälter wie in der Industrie und vieles mehr – melden Sie sich bei uns und wir unterstützen Sie auf Ihrem weiteren Karriereweg! Derzeit suchen wir nach einem Steuerberater (m/w/d) für eine unserer Partner-Kanzleien in Ulm. Bei Rückfragen kannst du dich gerne jederzeit (auch nach deinem Feierabend) direkt telefonisch an Herrn Becker-Koch über folgende Nummer wenden: 015901431130 Aufgaben Wir bringen zusammen, was zusammengehört. Dabei spielt das passende Tätigkeitsprofil natürlich eine entscheidende Rolle. Bei unserer Partnerkanzlei können Sie sich Ihren Aufgabenbereich auf Basis Ihrer persönlichen Stärken und Schwächen selbst zusammenstellen. Erstellung und Review von Jahresabschlüssen Erstellung von Steuererklärungen für Personen- und Kapitalgesellschaften Steuerliche Sonderberatungsprojekte auf Basis individueller Qualifikationen B. in den Bereichen der Erbschaftsteuer oder des Umwandlungssteuerrechts Begleitung von Betriebsprüfungen Teamleitung und Personalverantwortung (optional) Weitere individuell wählbare Tätigkeitsbereiche , die Ihnen Freude bringen Qualifikation Am Ende sollte es für beide Seiten passen. Deshalb wäre es gut, wenn Sie sich in den folgenden Punkten wiederfinden. Kommunikative Art und Freude am Austausch mit Mandanten Sorgfältige , effiziente und gewissenhafte Arbeitsweise Offen für eine digitale Arbeitsweise Führungsverständnis und Verantwortungsbewusstsein gegenüber Mitarbeitern (optional) Ein erfolgreich abgeschlossenes Steuerberaterexamen Leidenschaft für steuerliche Themen Benefits Sie haben genug von 0815 Benefits, von denen Sie nicht wirklich profitieren? Dann sollten Sie einen Blick auf die nachfolgenden Benefits werfen. Außerordentliche Vergütung von 90.000 € bis 130.000 € / Jahr, auf Wunsch auch Partnerperspektive Flexible Gestaltung der Arbeitszeiten sowie die Option auf Home-Office Nettolohnoptimierung mit monatlichen 50,00€ Sachbezugsgutscheinen Umfangreiche Unterstützung bei Weiterbildungsmaßnahmen wie z.B. Fachberater Qualifikationen Modernste Ausstattung mit digitalen Prozessen Starker Teamzusammenhalt und regelmäßige Teamevents Schnell, unkompliziert und effizient Ihren Traumjob finden – ein Versprechen an Sie, dass wir aufgrund unseres selektiven, breit gefächerten und deutschlandweiten Kanzleinetzwerks halten werden. lhre Vorteile mit uns auf einen Blick: Sie führen keine unsinnigen Bewerbungsgespräche mehr, bei denen Sie während des Bewerbungsprozesses merken, dass es (bspw. wegen des Gehalts) sowieso nicht passt - wir klären vor Ihrem Bewerbungsgespräch all Ihre mit uns besprochenen Kriterien mit der Kanzlei ab. Wir führen Ihre Gehaltsverhandlungen und kennen die Gehaltsstrukturen der Branche dabei bestens. 100% Anonymität – solange Sie uns nicht das „Go“ geben und einem Kennenlernen mit Ihrem neuen potentiellen Arbeitgeber zustimmen, erfährt niemand von Ihrem Namen oder Ihren bisherigen Arbeitgebern – Ihre Ihnen wichtigen Kriterien können wir auch zunächst anonym mit unseren Partnerkanzleien klären. Attraktive Kanzleien – die Kanzleien in unserem breit gefächerten Kanzleinetzwerk sind selektiv ausgewählt und heben sich klar von “normalen” Kanzleien ab (z.B. hinsichtlich der Vergütung, Bene"
Arbeitnow API,https://www.arbeitnow.com/jobs/companies/justhome-gmbh/baufinanzierungsberater-bankkaufmann-berlin-307462,2026-05-03T12:30:30,Justhome GmbH,Baufinanzierungsberater / Bankkaufmann (m/w/d),Private Banking,Berlin,berufserfahren,Private Banking,"Die Immobilienfinanzierung ist reif für Veränderung. Willkommen bei Justhome. Wir sind angetreten um als Fintech jeden Tag unsere Kunden und Mitarbeiter zu begeistern – unser Antrieb ist es, die Baufinanzierung neu zu denken . Integriert in die Abläufe beim Makler, Digital im Kundenkontakt, Professionell in der Beratung. Wenn du Lust hast, nicht nur Kredite zu vermitteln, sondern als Teil eines Tech-Teams Immobilienfinanzierung neu zu definieren, dann könnte Justhome dein nächster Karriereschritt sein. Aufgaben Deine Mission als (Senior)-Baufinanzierungsberater Wir suchen nicht nur Berater, sondern Gestalter. Du nutzt unsere Technologie, um Beratung auf ein neues Level zu heben – weg von der Angebotserstellung am Fließband, hin zur Lösungsgestaltung. Exklusive Leads: Durch unsere Integration beim Makler berätst du Kunden, die bereits eine konkrete Immobilie im Blick haben. Keine Kaltakquise, keine Leadlisten ""abtelefonieren"". High-End Beratung: Du strukturierst smarte Finanzierungskonzepte um deine Kunden zu begeistern. Tech-Feedback: Du arbeitest eng mit unserem Produkt-Team zusammen. Dein Feedback aus der Praxis verbessert unsere Algorithmen und Prozesse direkt. Mentorship: Du teilst dein Wissen mit Junior-Kollegen und prägst die Beratungsqualität in unserem wachsenden Team. Qualifikation Was du als erfahrenes Teammitglied mitbringst Ausbildung: Du hast eine Bankausbildung (oder vergleichbar) oder verfügst zwingend über die Sachkundeprüfung nach § 34i GewO . Track Record: Du bist erfahren in der Baufinanzierung, abschlusssicher und kennst die Kniffe, um auch komplexe Fälle bei der Bank durchzubekommen. Europace und eHyp sind für dich keine Fremdwörter Mindset: Du bist ""Tech-Curious"". Du wartest nicht auf Anweisungen, sondern siehst Möglichkeiten. Du hast Lust auf ein schnelles Fintech-Umfeld statt starrer Konzernstrukturen. Ambition: Du hast Lust zu wachsen – inhaltlich und persönlich. Benefits Wie Justhome dich fördert Wettbewerbsfähiges Gehalt: Attraktives Fixgehalt plus ungedeckelte Provision . Top-Performer erzielen bei uns Einkünfte deutlich über dem Marktdurchschnitt . Modernes Arbeitsumfeld: Stylishes Loft-Büro am Rosenthaler Platz (Berlin-Mitte) mit neuester Ausstattung. Mac oder Windows – du hast die Wahl. Modernste Technik, die dich entlastet: Unsere Tools automatisieren, wo es sinnvoll ist – von der Angebotsvorbereitung über den Datenabgleich bis zur Vorqualifizierung. Du behältst die Kontrolle, während KI &#x26; Technik die Fleißarbeit übernehmen. Startup-Kultur statt Konzern: Flache Hierarchien, offene Kommunikation und echte Gestaltungsfreiheit . Lust bekommen? Bewirb dich jetzt und werde Teil von Justhome - wir freuen uns auf dich! Find Jobs in Germany on Arbeitnow"
Arbeitnow API,https://www.arbeitnow.com/jobs/companies/mitte-boutique-padel/expansion-manager-new-markets-berlin-3309,2026-05-03T12:00:27,mitte | Boutique Padel,Expansion Manager - New Markets (m/w/d),Business Development,Berlin,,Business Development,"Wir sind fest davon überzeugt, dass Padel ein magischer Sport ist – einer, der Menschen durch seine einzigartige Kombination aus Leichtigkeit, Dynamik und sozialer Interaktion begeistert. Padel ist für alle da: von Jung bis Alt, vom Anfänger bis zum Profi – jeder kann an dieser Leidenschaft teilhaben. Es ist mehr als nur ein Spiel; es ist ein Erlebnis, das verbindet, Freude bereitet und Freundschaften schafft. mitte ist ein Boutique Padel Club , der erstklassige Spielbedingungen und ein stilvolles Umfeld für unsere dynamische, moderne Community bietet. Unsere Clubs kombinieren hochwertige Einrichtung in zentralen innerstädtischen Standorten mit digitaler Innovation und menschlicher Wärme, um Padel zu einem festen Bestandteil des Alltags zu machen – sei es für ein schnelles Spiel oder als „Third Place“ für verschiedenste Erlebnisse. Was uns besonders macht: Unsere Indoor-Clubs sind so gelegen, dass man sie in unter 15 Minuten erreichen kann – ideal für den urbanen Alltag Unsere vollautomatisierten Systeme sorgen für ein reibungsloses, modernes Spielerlebnis Unsere Community Leader leben Gastfreundschaft und hospitality-like Betreuung und widmen sich voll und ganz der Aufgabe, hervorragende Gastgeber zu sein Unser Interior Design stammt von einem renommierten Boutique-Architekten Unsere Ambition: Die erste Adresse für Padel in Europa zu werden. Aufgaben Als Expansion Manager – New Markets (m/w/d) verantwortest du den Markteintritt und Pipeline-Aufbau in unseren internationalen Wachstumsmärkten. Du arbeitest direkt mit dem CEO / Gründer zusammen und übersetzt unsere Expansionslogik in neue Länder – mit Sensibilität für lokale Marktbedingungen, regulatorische Unterschiede und kulturelle Eigenheiten. Dein Ziel: ein wiederholbarer Markteintritts-Mechanismus, der mitte international skalierbar macht – ohne Qualitätsverlust und mit klarer wirtschaftlicher Logik. Deine Aufgaben: Marktanalyse &#x26; Priorisierung: Du analysierst neue Märkte hinsichtlich Demografie, Wettbewerbsumfeld, regulatorischem Rahmen und wirtschaftlicher Tragfähigkeit – und triffst Empfehlungen zur Priorisierung. Pipeline-Aufbau &#x26; Lead Screening: Du baust lokale Pipelines auf und führst fundierte Ersteinschätzungen durch – mit klaren Deal-KPIs und länderspezifischen Lagekriterien. Finanzielle Bewertung: Du modellierst P&#x26;Ls und CAPEX-Szenarien unter lokalen Bedingungen – mit Blick auf Steuerstrukturen, Lohnniveaus und länderspezifische Cost-Bases. Verhandlung &#x26; Deal Closing: Du führst eigenständig Verhandlungen mit Eigentümern und Maklern – mit dem Verständnis, dass jede Marktverhandlung eigene Spielregeln hat. Genehmigungen &#x26; rechtliche Machbarkeit: Du arbeitest eng mit externen lokalen Beratern zusammen, klärst lokale Bauordnungs- und Genehmigungsfragen und steuerst die rechtliche Prüfung. Markteintritts-Playbook: Du baust ein Playbook für Markteintritte – das jeder neue Markt schneller, präziser und wirkungsvoller macht als der vorherige. Schnittstellen: Du sorgst für einen sauberen Übergang an Architektur, Construction und Launch – und stimmst dich eng mit Brand, Operations und dem CEO ab. Das Besondere an dieser Rolle ist, dass… du den internationalen Wachstumspfad von mitte mitprägst – jeder neue Markt, den du aufschließt, erweitert das Spielfeld. du an der Schnittstelle von Strategie, Markt-Aufbau und Deal-Closing arbeitest – eine seltene Kombination, die internationales Benchmark-Denken erfordert. du echte Deal-Verantwortung trägst – vom Lead bis zur Unterschrift, in mehreren Märkten parallel. du direkt mit dem Gründer / CEO zusammenarbeitest – mit kurzen Entscheidungswegen und echtem Gestaltungsspielraum. Qualifikation Internationale Markterfahrung: Du hast nachweislich in oder für mehrere Märkte gearbeitet – idealerweise mit eigenständiger Verantwortung für Markteintritte oder grenzüberschreitende Deals. Deal- &#x26; Zahlenverständnis: Du bringst starke analytische Fähigkeiten mit, verstehst P&#x26;Ls, CAPEX-Analysen und kannst wirtsch"
Arbeitnow API,https://www.arbeitnow.com/jobs/companies/mitte-boutique-padel/expansion-manager-dach-berlin-460180,2026-05-03T11:30:29,mitte | Boutique Padel,Expansion Manager - DACH (m/w/d),Business Development,Berlin,,Business Development,"Wir sind fest davon überzeugt, dass Padel ein magischer Sport ist – einer, der Menschen durch seine einzigartige Kombination aus Leichtigkeit, Dynamik und sozialer Interaktion begeistert. Padel ist für alle da: von Jung bis Alt, vom Anfänger bis zum Profi – jeder kann an dieser Leidenschaft teilhaben. Es ist mehr als nur ein Spiel; es ist ein Erlebnis, das verbindet, Freude bereitet und Freundschaften schafft. mitte ist ein Boutique Padel Club , der erstklassige Spielbedingungen und ein stilvolles Umfeld für unsere dynamische, moderne Community bietet. Unsere Clubs kombinieren hochwertige Einrichtung in zentralen innerstädtischen Standorten mit digitaler Innovation und menschlicher Wärme, um Padel zu einem festen Bestandteil des Alltags zu machen – sei es für ein schnelles Spiel oder als „Third Place“ für verschiedenste Erlebnisse. Was uns besonders macht: Unsere Indoor-Clubs sind so gelegen, dass man sie in unter 15 Minuten erreichen kann – ideal für den urbanen Alltag Unsere vollautomatisierten Systeme sorgen für ein reibungsloses, modernes Spielerlebnis Unsere Community Leader leben Gastfreundschaft und hospitality-like Betreuung und widmen sich voll und ganz der Aufgabe, hervorragende Gastgeber zu sein Unser Interior Design stammt von einem renommierten Boutique-Architekten Unsere Ambition: Die erste Adresse für Padel in Europa zu werden. Aufgaben Als Expansion Manager – DACH (m/w/d) verantwortest du den Aufbau unserer Pipeline und das Closing von Deals in Deutschland, Österreich und der Schweiz. Du arbeitest direkt mit dem CEO / Gründer zusammen und treibst unsere Greenfield-Expansion vom ersten Lead bis zur Unterschrift. Dein Ziel: ein konstanter Strom hochwertiger Standorte, die wirtschaftlich und strategisch zu mitte passen – mit Tempo, Zahlenkompetenz und Verhandlungsgeschick. Deine Aufgaben: Pipeline-Aufbau &#x26; Lead Screening: Du baust eine belastbare Pipeline auf und führst fundierte Ersteinschätzungen durch – mit klaren Deal-KPIs, Fokus auf Demografie, Wettbewerb, Lagequalität und Machbarkeit. Finanzielle Bewertung: Du modellierst P&#x26;Ls, bewertest Umsatz- und Kostenpotenziale, schätzt CAPEX und Payback – mit Blick auf unser Ziel: EBITDA-positiv innerhalb kurzer Zeit. Verhandlung &#x26; Deal Closing: Du führst Verhandlungen mit Eigentümern und Maklern – zu Mietkonditionen, BKZ und Vertragslaufzeiten. Genehmigungen &#x26; rechtliche Machbarkeit: Du arbeitest eng mit externen Beratern zusammen, klärst baurechtliche Voraussetzungen und begleitest die rechtliche Prüfung. Investment-Freigaben: Du bereitest Investment-Proposal für das interne Committee auf, präsentierst Chancen und Risiken klar und überzeugend. Multi-Projektmanagement &#x26; Reporting: Du hältst parallel mehrere Deals auf Kurs – strukturiert, priorisiert und mit sauberem Pipeline-Reporting an das Management. Schnittstellen: Du sorgst für einen sauberen Übergang an Architektur, Construction und Launch und stimmst dich eng mit Finanzen, Operations und dem CEO ab. Das Besondere an dieser Rolle ist, dass… du den Wachstumsmotor von mitte direkt steuerst – jeder Deal, den du closest, ist ein Stück Unternehmensentwicklung. du echte Deal-Verantwortung trägst – vom Lead bis zur Unterschrift, mit klarer Ownership statt Schichten dazwischen. du an der Schnittstelle von Real Estate, Investment und Operator-Geschäft arbeitest – eine Kombination, die in DACH selten ist und genau das verlangt, was Top-Operatoren auszeichnet. du direkt mit dem Gründer / CEO zusammenarbeitest – mit kurzen Entscheidungswegen und echtem Gestaltungsspielraum. Qualifikation Deal- &#x26; Zahlenverständnis: Du bringst starke analytische Fähigkeiten mit, verstehst P&#x26;Ls, CAPEX-Analysen und kannst wirtschaftliche Machbarkeit fundiert bewerten. Verhandlungssicherheit: Du führst Deal-Gespräche souverän, findest Win-Win-Situationen und holst die besten Konditionen für unser Unternehmen heraus. Berufserfahrung: Mindestens 5 Jahre Erfahrung in einem transaktionsnahen Umfeld – z. B. bei eine"
Arbeitnow API,https://www.arbeitnow.com/jobs/companies/mitte-boutique-padel/head-of-activation-marketing-berlin-166203,2026-05-03T11:30:29,mitte | Boutique Padel,Head of Activation / Marketing (m/w/d),Management,Berlin,,Management; Team Leader,"Wir sind fest davon überzeugt, dass Padel ein magischer Sport ist – einer, der Menschen durch seine einzigartige Kombination aus Leichtigkeit, Dynamik und sozialer Interaktion begeistert. Padel ist für alle da: von Jung bis Alt, vom Anfänger bis zum Profi – jeder kann an dieser Leidenschaft teilhaben. Es ist mehr als nur ein Spiel; es ist ein Erlebnis, das verbindet, Freude bereitet und Freundschaften schafft. mitte ist ein Boutique Padel Club , der erstklassige Spielbedingungen und ein stilvolles Umfeld für unsere dynamische, moderne Community bietet. Unsere Clubs kombinieren hochwertige Einrichtung in zentralen innerstädtischen Standorten mit digitaler Innovation und menschlicher Wärme, um Padel zu einem festen Bestandteil des Alltags zu machen – sei es für ein schnelles Spiel oder als „Third Place“ für verschiedenste Erlebnisse. Was uns besonders macht: Unsere Indoor-Clubs sind so gelegen, dass man sie in unter 15 Minuten erreichen kann – ideal für den urbanen Alltag Unsere vollautomatisierten Systeme sorgen für ein reibungsloses, modernes Spielerlebnis Unsere Community Leader leben Gastfreundschaft und hospitality-like Betreuung und widmen sich voll und ganz der Aufgabe, hervorragende Gastgeber zu sein Unser Interior Design stammt von einem renommierten Boutique-Architekten Unsere Ambition: Die globale Brand für Premium Padel zu werden. Aufgaben Als Head of Activation / Marketing (m/w/d) verantwortest du, wie mitte sichtbar, relevant und wachstumsstark wird – in jeder Stadt, in der wir einen Club eröffnen. Du arbeitest direkt mit dem CEO / Gründer zusammen und sorgst dafür, dass jeder Launch schneller, präziser und wirkungsvoller wird als der vorherige. Dein Ziel: ein skalierbares System, das aus jeder Stadt eine mitte-Stadt macht – mit messbaren Outcomes, lokaler Relevanz und Premium-Tonalität. Deine Aufgaben: City Launch Playbook: Du entwickelst und betreibst das skalierbare Playbook für Club-Eröffnungen in neuen Städten – von lokaler PR und Influencer-Aktivierung über Eröffnungsformate bis hin zu Partnerschaften vor Ort. Lokale Partnerschaften: Du identifizierst und entwickelst Partnerschaften mit lokalen Brands, Sportakteuren und Kulturschaffenden, die unsere Community vor Ort verankern. Community Activation: Du baust wiederkehrende Aktivierungsformate auf, die unsere Community in jeder Stadt lebendig halten – von Member-Formaten bis zu offenen Community-Events. Sponsoring &#x26; Athletes: Du verantwortest unsere Athletes- und Sponsoring-Strategie – von der Auswahl bis zur Aktivierung im Markt. Performance &#x26; Channel Mix: Du verantwortest die Aktivierung mit messbaren Outcomes – von Paid Social und SEA über CRM bis zu lokalen Performance-Hebeln. Du steuerst entlang klarer KPIs, ohne den Premium-Anspruch zu verwässern. Skalierbares Playbook: Alles, was du baust, fließt in ein lebendiges Activation-Playbook ein, das in jeder neuen Stadt ohne Reibung adaptiert werden kann. Schnittstellen: Du arbeitest eng mit Creative, Club Experience und Expansion zusammen, damit Marke, lokales Erlebnis und neue Standorte als ein konsistentes Ganzes wirken. Das Besondere an dieser Rolle ist, dass… du eine Marke lokal in jeder neuen Stadt zum Leben erweckst – nicht in einem Standardformat, sondern mit echtem Gespür für jede Stadt und ihre Eigenheiten. du an der Schnittstelle von Brand und Performance arbeitest – mit einem Premium-Anspruch, der gleichzeitig messbar wachsen muss. du ein Playbook für Skalierung baust – das nicht für eine Stadt funktioniert, sondern für ein deutschlandweites und perspektivisch europäisches Netzwerk. du direkt mit dem Gründer / CEO zusammenarbeitest – mit kurzen Entscheidungswegen und echtem Gestaltungsspielraum. Qualifikation Brand-Activator-Mindset: Du hast nachweislich Marken lokal aktiviert und zum Wachsen gebracht – in einem Umfeld, in dem Premium-Tonalität und messbare Outcomes Hand in Hand gehen. Hybrid aus Brand &#x26; Performance: Du verstehst, dass Aktivierung heute beides braucht – emotionale Br"
Arbeitnow API,https://www.arbeitnow.com/jobs/companies/taxtalentede/steuerberater-in-rottenburg-auf-wunsch-mit-partnerperspektive-gesucht-mindestens-90000eur-199278,2026-05-03T11:30:29,Taxtalente.de,"Steuerberater (m/w/d) in Rottenburg, auf Wunsch mit Partnerperspektive, gesucht - mindestens 90.000€",Directors,Rottenburg,,Directors; Chief Executives,"TaxTalente ist die Nr. 1 Job-Matching Plattform für Jobsuchende in der Steuerberatung. Sie suchen eine positive berufliche Veränderung? Sie möchten den nächsten Schritt in Ihrer Karriere gehen und streben möglicherweise sogar eine Partnerschaft in einer zukunftsorientierten Kanzlei an? Sie möchten endlich wieder in einem positiven Arbeitsumfeld arbeiten, in dem Sie finanziell und persönlich wertgeschätzt werden? Sie suchen nach Tätigkeiten, die Sie auch wirklich weiterbringen? Sofern Sie sich in mindestens einem der genannten Punkte wiederfinden, sollten Sie sich bei uns melden. Wir haben die attraktivsten Arbeitgeber der Steuerberatungsbranche in unserem Netzwerk und bringen zusammen, was zusammengehört. Grenzenlose Entwicklungschancen mit Partnermöglichkeiten, vielschichtige Tätigkeitsbereiche, Gehälter wie in der Industrie und vieles mehr – melden Sie sich bei uns und wir unterstützen Sie auf Ihrem weiteren Karriereweg! Derzeit suchen wir nach einem Steuerberater (m/w/d) für eine unserer Partner-Kanzleien in Rottenburg. Bei Rückfragen kannst du dich gerne jederzeit (auch nach deinem Feierabend) direkt telefonisch an Herrn Becker-Koch über folgende Nummer wenden: 015901431130 Aufgaben Wir bringen zusammen, was zusammengehört. Dabei spielt das passende Tätigkeitsprofil natürlich eine entscheidende Rolle. Bei unserer Partnerkanzlei können Sie sich Ihren Aufgabenbereich auf Basis Ihrer persönlichen Stärken und Schwächen selbst zusammenstellen. Erstellung und Review von Jahresabschlüssen Erstellung von Steuererklärungen für Personen- und Kapitalgesellschaften Steuerliche Sonderberatungsprojekte auf Basis individueller Qualifikationen B. in den Bereichen der Erbschaftsteuer oder des Umwandlungssteuerrechts Begleitung von Betriebsprüfungen Teamleitung und Personalverantwortung (optional) Weitere individuell wählbare Tätigkeitsbereiche , die Ihnen Freude bringen Qualifikation Am Ende sollte es für beide Seiten passen. Deshalb wäre es gut, wenn Sie sich in den folgenden Punkten wiederfinden. Kommunikative Art und Freude am Austausch mit Mandanten Sorgfältige , effiziente und gewissenhafte Arbeitsweise Offen für eine digitale Arbeitsweise Führungsverständnis und Verantwortungsbewusstsein gegenüber Mitarbeitern (optional) Ein erfolgreich abgeschlossenes Steuerberaterexamen Leidenschaft für steuerliche Themen Benefits Sie haben genug von 0815 Benefits, von denen Sie nicht wirklich profitieren? Dann sollten Sie einen Blick auf die nachfolgenden Benefits werfen. Außerordentliche Vergütung von 90.000 € bis 130.000 € / Jahr, auf Wunsch auch Partnerperspektive Flexible Gestaltung der Arbeitszeiten sowie die Option auf Home-Office Nettolohnoptimierung mit monatlichen 50,00€ Sachbezugsgutscheinen Umfangreiche Unterstützung bei Weiterbildungsmaßnahmen wie z.B. Fachberater Qualifikationen Modernste Ausstattung mit digitalen Prozessen Starker Teamzusammenhalt und regelmäßige Teamevents Schnell, unkompliziert und effizient Ihren Traumjob finden – ein Versprechen an Sie, dass wir aufgrund unseres selektiven, breit gefächerten und deutschlandweiten Kanzleinetzwerks halten werden. lhre Vorteile mit uns auf einen Blick: Sie führen keine unsinnigen Bewerbungsgespräche mehr, bei denen Sie während des Bewerbungsprozesses merken, dass es (bspw. wegen des Gehalts) sowieso nicht passt - wir klären vor Ihrem Bewerbungsgespräch all Ihre mit uns besprochenen Kriterien mit der Kanzlei ab. Wir führen Ihre Gehaltsverhandlungen und kennen die Gehaltsstrukturen der Branche dabei bestens. 100% Anonymität – solange Sie uns nicht das „Go“ geben und einem Kennenlernen mit Ihrem neuen potentiellen Arbeitgeber zustimmen, erfährt niemand von Ihrem Namen oder Ihren bisherigen Arbeitgebern – Ihre Ihnen wichtigen Kriterien können wir auch zunächst anonym mit unseren Partnerkanzleien klären. Attraktive Kanzleien – die Kanzleien in unserem breit gefächerten Kanzleinetzwerk sind selektiv ausgewählt und heben sich klar von “normalen” Kanzleien ab (z.B. hinsichtlich der Vergütun"
