job_id,date_posted,source,company,title,category,raw_category,seniority,location,job_type,skills,tags_raw,salary_min_usd,salary_max_usd,salary_mid_usd,demand_index,scarcity_score,time_to_fill_days_proxy,application_volume_proxy,source_url,description_preview
raw-0171,2026-07-06,Arbeitnow API,Taxtalente.de,"Steuerberater (m/w/d) in Malgersdorf, auf Wunsch mit Partnerperspektive, gesucht - mindestens 90.000€",Software & Engineering,Directors,Unspecified,Malgersdorf,,Python; JavaScript; API; Cloud,Directors; Chief Executives,66387,95533,80960,81.9,62,40.7,104,https://www.arbeitnow.com/jobs/companies/taxtalentede/steuerberater-in-malgersdorf-auf-wunsch-mit-partnerperspektive-gesucht-mindestens-90000eur-143427,TaxTalente ist die Nr. 1 Job-Matching Plattform für Jobsuchende in der Steuerberatung. Sie suchen eine positive berufliche Veränderung? Sie möchten den nächsten Schritt in Ihrer Karriere gehen und streben möglicherweise 
raw-0172,2026-07-06,Arbeitnow API,Taxtalente.de,"Steuerberater (m/w/d) in Luckau, auf Wunsch mit Partnerperspektive, gesucht - mindestens 90.000€",Software & Engineering,Directors,Unspecified,Luckau,,Python; JavaScript; API; Cloud,Directors; Chief Executives,66387,95533,80960,81.9,62,40.7,104,https://www.arbeitnow.com/jobs/companies/taxtalentede/steuerberater-in-luckau-auf-wunsch-mit-partnerperspektive-gesucht-mindestens-90000eur-46914,TaxTalente ist die Nr. 1 Job-Matching Plattform für Jobsuchende in der Steuerberatung. Sie suchen eine positive berufliche Veränderung? Sie möchten den nächsten Schritt in Ihrer Karriere gehen und streben möglicherweise 
raw-0173,2026-07-06,Arbeitnow API,Taxtalente.de,"Steuerberater (m/w/d) in Gondelsheim, auf Wunsch mit Partnerperspektive, gesucht - mindestens 90.000€",Software & Engineering,Directors,Unspecified,Gondelsheim,,Python; JavaScript; API; Cloud,Directors; Chief Executives,66387,95533,80960,81.9,62,40.7,104,https://www.arbeitnow.com/jobs/companies/taxtalentede/steuerberater-in-gondelsheim-auf-wunsch-mit-partnerperspektive-gesucht-mindestens-90000eur-51548,TaxTalente ist die Nr. 1 Job-Matching Plattform für Jobsuchende in der Steuerberatung. Sie suchen eine positive berufliche Veränderung? Sie möchten den nächsten Schritt in Ihrer Karriere gehen und streben möglicherweise 
raw-0174,2026-07-06,Arbeitnow API,Taxtalente.de,"Steuerberater (m/w/d) in Gerolzhofen, auf Wunsch mit Partnerperspektive, gesucht - mindestens 90.000€",Software & Engineering,Directors,Unspecified,Gerolzhofen,,Python; JavaScript; API; Cloud,Directors; Chief Executives,66387,95533,80960,81.9,62,40.7,104,https://www.arbeitnow.com/jobs/companies/taxtalentede/steuerberater-in-gerolzhofen-auf-wunsch-mit-partnerperspektive-gesucht-mindestens-90000eur-491306,TaxTalente ist die Nr. 1 Job-Matching Plattform für Jobsuchende in der Steuerberatung. Sie suchen eine positive berufliche Veränderung? Sie möchten den nächsten Schritt in Ihrer Karriere gehen und streben möglicherweise 
raw-0175,2026-07-06,Arbeitnow API,Taxtalente.de,"Steuerberater (m/w/d) in Salzatal, auf Wunsch mit Partnerperspektive, gesucht - mindestens 90.000€",Software & Engineering,Directors,Unspecified,Salzatal,,Python; JavaScript; API; Cloud,Directors; Chief Executives,66387,95533,80960,81.9,62,40.7,104,https://www.arbeitnow.com/jobs/companies/taxtalentede/steuerberater-in-salzatal-auf-wunsch-mit-partnerperspektive-gesucht-mindestens-90000eur-364474,TaxTalente ist die Nr. 1 Job-Matching Plattform für Jobsuchende in der Steuerberatung. Sie suchen eine positive berufliche Veränderung? Sie möchten den nächsten Schritt in Ihrer Karriere gehen und streben möglicherweise 
raw-0176,2026-07-06,Arbeitnow API,Taxtalente.de,"Steuerberater (m/w/d) in Heimsheim, auf Wunsch mit Partnerperspektive, gesucht - mindestens 90.000€",Software & Engineering,Directors,Unspecified,Heimsheim,,Python; JavaScript; API; Cloud,Directors; Chief Executives,66387,95533,80960,81.9,62,40.7,104,https://www.arbeitnow.com/jobs/companies/taxtalentede/steuerberater-in-heimsheim-auf-wunsch-mit-partnerperspektive-gesucht-mindestens-90000eur-420348,TaxTalente ist die Nr. 1 Job-Matching Plattform für Jobsuchende in der Steuerberatung. Sie suchen eine positive berufliche Veränderung? Sie möchten den nächsten Schritt in Ihrer Karriere gehen und streben möglicherweise 
raw-0177,2026-07-06,Arbeitnow API,Taxtalente.de,"Steuerberater (m/w/d) in Mönchengladbach, auf Wunsch mit Partnerperspektive, gesucht - mindestens 90.000€",Software & Engineering,Directors,Unspecified,Mönchengladbach,,Python; JavaScript; API; Cloud,Directors; Chief Executives,66387,95533,80960,81.9,62,40.7,104,https://www.arbeitnow.com/jobs/companies/taxtalentede/steuerberater-in-monchengladbach-auf-wunsch-mit-partnerperspektive-gesucht-mindestens-90000eur-321939,TaxTalente ist die Nr. 1 Job-Matching Plattform für Jobsuchende in der Steuerberatung. Sie suchen eine positive berufliche Veränderung? Sie möchten den nächsten Schritt in Ihrer Karriere gehen und streben möglicherweise 
raw-0178,2026-07-06,Arbeitnow API,TWB Tief- und Wasserbau GmbH,Lohnbuchhalter / Personalsachbearbeiter Entgeltabrechnung (m/w/d),HR & Recruitment,HR,Mid-level,Lübbenau,berufserfahren,HR,HR,45920,66080,56000,64.6,38,30.3,136,https://www.arbeitnow.com/jobs/companies/twb-tief-und-wasserbau-gmbh/lohnbuchhalter-personalsachbearbeiter-entgeltabrechnung-lubbenau-493927,"Gemeinsam Zukunft gestalten – bei der TWB Tief-und Wasserbau GmbH in Boblitz Die TWB Tief- und Wasserbau GmbH ist ein familiengeführtes Unternehmen mit Sitz in Boblitz im Spreewald. Seit 1963 stehen wir für Qualität, Zuv"
raw-0179,2026-07-06,Arbeitnow API,Finanzkanzlei Patrick Sliwka,Finanzberater im Nebenberuf (m/w/d) - Quereinstieg möglich,Product & Project Management,Asset,Unspecified,Wuppertal,Side,Product Management; Project Management; Agile; Stakeholder Management,Asset; Fonds Management,57334,82506,69920,47.9,38,30.3,136,https://www.arbeitnow.com/jobs/companies/finanzkanzlei-patrick-sliwka/finanzberater-im-nebenberuf-quereinstieg-moglich-wuppertal-420391,"Finanzielle Freiheit mitgestalten – für Ihre Kunden und für sich selbst. Sie möchten sich neben Ihrem Hauptberuf ein attraktives zusätzliches Einkommen aufbauen, wertvolle Vertriebskompetenzen entwickeln und Menschen dab"
raw-0180,2026-07-06,Arbeitnow API,Bundesverbraucherhilfe e.V.,Pressesprecher (m/w/d) im Ehrenamt (Homeoffice),Software & Engineering,Remote,Unspecified,Berlin,Side,Communication,Remote; Public Relations; Corporate Communication,66387,95533,80960,100,38,30.3,136,https://www.arbeitnow.com/jobs/companies/bundesverbraucherhilfe-ev/pressesprecher-im-ehrenamt-homeoffice-berlin-81683,"Die Bundesverbraucherhilfe e.V. ist die Stimme der Verbraucherinnen und Verbraucher in Deutschland – unabhängig, innovativ und mit einem klaren Fokus auf den Schutz und die Stärkung ihrer Rechte. Als eine der dynamischst"
raw-0181,2026-07-06,Arbeitnow API,Kevin Kehr,"Werkstudent (m/w/d) – Finance & Beratung (unternehmerisch, leistungsbasiert)",Finance & Business,Finance,Internship/Student,Hamburg,"Full-time permanent, entry",Finance; Onboarding,Finance; high school or equivalent,30668,44132,37400,73.3,38,30.3,136,https://www.arbeitnow.com/jobs/companies/kevin-kehr/werkstudent-finance-beratung-unternehmerisch-leistungsbasiert-hamburg-6294,"Du studierst und willst mehr als einen „Nebenjob“? Du willst Verantwortung, klare Ziele und ein Umfeld, in dem Leistung zählt? Dann ist diese Werkstudentenrolle dein Einstieg in die Finanzberatung, mit strukturiertem Onb"
raw-0182,2026-07-06,Arbeitnow API,AYLASHES,Social Media Video Editor & Content Designer (m/w/d),Marketing & Growth,Remote,Mid-level,Pleidelsheim,berufserfahren,Social Media; Design; Figma; Video Editing,Remote; Social Media Manager,49200,70800,60000,69.5,38,30.3,136,https://www.arbeitnow.com/jobs/companies/aylashes/social-media-video-editor-content-designer-pleidelsheim-152121,AYLASHES ist eine schnell wachsende Beauty Brand für DIY-Wimpern. Unser Ziel: hochwertige Beauty-Produkte mit starkem Social-Media-Content sichtbar machen und unsere Community täglich inspirieren. Für unser Social-Media-
raw-0183,2026-07-06,Arbeitnow API,Nature Heart GmbH & Co KG,Senior Health Copywriter (m/w/d) | 100 % Remote | Vollzeit | Nature Heart,Marketing & Growth,Remote,Senior/Lead,Nidderau,berufserfahren,Communication; Shopify; Sales; SEO,Remote; Marketing and Communication,66420,95580,81000,72.9,48,38.6,123,https://www.arbeitnow.com/jobs/companies/nature-heart-gmbh-co-kg/senior-health-copywriter-100-remote-vollzeit-nature-heart-nidderau-211683,"Über Nature Heart Nature Heart steht für hochwertige Gesundheits- und Naturprodukte mit dem Anspruch, Menschen auf ihrem Weg zu mehr Wohlbefinden zu begleiten. Als wachsendes E-Commerce-Unternehmen entwickeln wir innovat"
raw-0184,2026-07-06,Arbeitnow API,Nature Heart GmbH & Co KG,AI & E-Commerce Automation Specialist (m/w/d) -100 % Remote | Vollzeit | Nature Heart,Software & Engineering,Remote,Mid-level,Nidderau,berufserfahren,Performance Marketing; JavaScript; Automation; Shopify; Python; Sales; API; SEO; CRM; ERP; AI,Remote; Business Development,72160,103840,88000,68.9,54,37.2,115,https://www.arbeitnow.com/jobs/companies/nature-heart-gmbh-co-kg/ai-e-commerce-automation-specialist-100-remote-vollzeit-nature-heart-nidderau-149400,"Nature Heart ist ein innovatives E-Commerce-Unternehmen mit Fokus auf hochwertige Gesundheits- und Naturprodukte. Wir setzen konsequent auf moderne Technologien, KI und Automatisierung, um Prozesse zu optimieren, Kunden "
raw-0185,2026-07-05,Arbeitnow API,Mirakl,"Enterprise Account Executive, Advertising Technology Solutions",Software & Engineering,Unspecified,Unspecified,"Munich, Bavaria, Germany",,Advertising; Marketplace; Sales; AI,,66387,95533,80960,71.5,38,30.3,136,https://www.arbeitnow.com/jobs/companies/mirakl/enterprise-account-executive-advertising-technology-solutions-munich-361412,"About Mirakl: &nbsp; Founded in 2012, Mirakl has been at the forefront of marketplace innovation, empowering every business to compete in the platform economy. Today, Mirakl's operating system combines an enterprise mark"
raw-0186,2026-07-05,Arbeitnow API,Think3DDD GbR,"Praktikum Frontend & 3D-Softwareentwicklung (m/w/d) - three.js, React.js & optional Python",Software & Engineering,IT,Internship/Student,Berlin,Internship,JavaScript; Frontend; Backend; Startup; Python; Design; React; Video Editing,IT,39688,57112,48400,73.9,54,37.2,115,https://www.arbeitnow.com/jobs/companies/think3ddd-gbr/praktikum-frontend-3d-softwareentwicklung-threejs-reactjs-optional-python-berlin-289280,"🔍 Suchst du ein Pflichtpraktikum, Praxissemester oder eine Abschlussarbeit in einem innovativen Umfeld? 💡 Möchtest du deine Fähigkeiten in Frontend-Entwicklung, UX Design und 3D-Technologien praktisch anwenden und dabe"
raw-0187,2026-07-05,Arbeitnow API,IONOS SE,Leitung PPC (w/m/d) - Online Advertising,Data & AI,Marketing and Communication,Unspecified,Berlin,,Communication; Performance Marketing; Generative AI; Data Science; Advertising; Cloud; SEO; AI,Marketing and Communication,64124,92276,78200,71.1,59,39.4,108,https://www.arbeitnow.com/jobs/companies/ionos-se/leitung-ppc-online-advertising-berlin-93981,"Bei IONOS arbeitest Du bei dem führenden europäischen Anbieter von Cloud-Infrastruktur, Cloud-Services und Hosting-Dienstleistungen partnerschaftlich mit unterschiedlichen Teams zusammen. Wir bieten Dir eine Perspektive "
raw-0188,2026-07-05,Arbeitnow API,IONOS SE,Werkstudent (w/m/d) Customer Care Operations,Software & Engineering,Customer Service,Internship/Student,Karlsruhe,Working student,Customer Service; Operations; Cloud; AI,Customer Service,39688,57112,48400,80.9,46,33.8,125,https://www.arbeitnow.com/jobs/companies/ionos-se/werkstudent-customer-care-operations-karlsruhe-18277,"Bei IONOS arbeitest Du bei dem führenden europäischen Anbieter von Cloud-Infrastruktur, Cloud-Services und Hosting-Dienstleistungen partnerschaftlich mit unterschiedlichen Teams zusammen. Wir bieten Dir eine Perspektive "
raw-0189,2026-07-05,Arbeitnow API,IONOS SE,Senior Product Owner (w/m/d) E-Commerce,Software & Engineering,Marketing and Communication,Senior/Lead,Karlsruhe,,Communication; Customer Service; Design; Cloud,Marketing and Communication,97416,140184,118800,91.3,56,42.1,112,https://www.arbeitnow.com/jobs/companies/ionos-se/senior-product-owner-e-commerce-karlsruhe-19820,"Bei IONOS arbeitest Du bei dem führenden europäischen Anbieter von Cloud-Infrastruktur, Cloud-Services und Hosting-Dienstleistungen partnerschaftlich mit unterschiedlichen Teams zusammen. Wir bieten Dir eine Perspektive "
raw-0190,2026-07-05,Arbeitnow API,IONOS SE,(Senior) Website Analyst – E-Commerce Management (w/m/d),Data & AI,Marketing and Communication,Senior/Lead,Karlsruhe,,Communication; Stakeholder Management; Data Engineering; Google Analytics; Tableau; Testing; Cloud; SaaS; SQL,Marketing and Communication,94095,135405,114750,61.4,69,47.7,95,https://www.arbeitnow.com/jobs/companies/ionos-se/senior-website-analyst-e-commerce-management-karlsruhe-53256,"Bei IONOS arbeitest Du bei dem führenden europäischen Anbieter von Cloud-Infrastruktur, Cloud-Services und Hosting-Dienstleistungen partnerschaftlich mit unterschiedlichen Teams zusammen. Wir bieten Dir eine Perspektive "
raw-0191,2026-07-05,Arbeitnow API,IONOS SE,Digital Art Director (w/m/d),Marketing & Growth,Marketing and Communication,Senior/Lead,Karlsruhe,,Communication; Customer Service; Design; Cloud; Figma; UI/UX,Marketing and Communication,66420,95580,81000,78.1,56,42.1,112,https://www.arbeitnow.com/jobs/companies/ionos-se/digital-art-director-karlsruhe-176053,"Bei IONOS arbeitest Du bei dem führenden europäischen Anbieter von Cloud-Infrastruktur, Cloud-Services und Hosting-Dienstleistungen partnerschaftlich mit unterschiedlichen Teams zusammen. Wir bieten Dir eine Perspektive "
raw-0192,2026-07-05,Arbeitnow API,IONOS SE,Call Center Mitarbeiter (w/m/d) Kundenbindung,Marketing & Growth,Customer Service,Unspecified,Karlsruhe,,Customer Service; Cloud,Customer Service,45264,65136,55200,76.6,46,33.8,125,https://www.arbeitnow.com/jobs/companies/ionos-se/call-center-mitarbeiter-kundenbindung-karlsruhe-212877,"Bei IONOS arbeitest Du bei dem führenden europäischen Anbieter von Cloud-Infrastruktur, Cloud-Services und Hosting-Dienstleistungen partnerschaftlich mit unterschiedlichen Teams zusammen. Wir bieten Dir eine Perspektive "
raw-0193,2026-07-05,Arbeitnow API,Activate Media GmbH,Werkstudent UX/UI Grafiker (m/w/d),Design & UX,Remote,Internship/Student,Sachsenheim,"Working student, hilfstätigkeit / student",Design; Figma,Remote; Media; Screen and Web Design,27962,40238,34100,76,38,30.3,136,https://www.arbeitnow.com/jobs/companies/activate-media-gmbh/werkstudent-ux-ui-grafiker-sachsenheim-83242,"Remote Werkstudent (m/w/d) Design / Kreation 14 € / Stunde bis zu 280,-€ pro Woche (bis zu 20 Stunden pro Woche während der Vorlesungszeit) bis zu 560,-€ pro Woche in der vorlesungsfreien Zeit Wer wir sind Activate Media"
raw-0194,2026-07-05,Arbeitnow API,batch2 engineering GmbH,Marketing Manager,Software & Engineering,Remote,Senior/Lead,Eggenfelden,berufserfahren,Communication; Social Media; WordPress,Remote; Marketing and Communication,97416,140184,118800,74.8,48,38.6,123,https://www.arbeitnow.com/jobs/companies/batch2-engineering-gmbh/marketing-manager-eggenfelden-49839,"Wer wir sind Die batch2 engineering GmbH ist ein junges, innovatives und hochspezialisiertes Ingenieurbüro im Zukunftsfeld Batterie- und Wasserstoff-Sicherheit . Unsere Arbeit beginnt dort, wo Dinge kritisch werden: Prod"
raw-0195,2026-07-05,Arbeitnow API,Hannover Möbel GmbH,Ausbildung Bürokauffrau-Bürokaufmann Ausbildung,Marketing & Growth,Marketing and Communication,Unspecified,Isernhagen,,Communication; Startup; Excel,Marketing and Communication,45264,65136,55200,80.2,38,30.3,136,https://www.arbeitnow.com/jobs/companies/hannover-mobel-gmbh/ausbildung-burokauffrau-burokaufmann-ausbildung-isernhagen-312257,HANNOVER ISTIKBAL - Hann-Ist GmbH HANN-IST Möbelhandel GmbH (Hannover Istikbal) ist die Adresse für besondere Möbelstücke. Unsere Produkte werden hauptsächlich aus der Türkei importiert und umfassen unter anderem Boxspri
raw-0196,2026-07-05,Arbeitnow API,frechekoepfe GmbH,Pflichtpraktikum Webentwicklung (flexibler Start möglich!),Software & Engineering,Web Development,Internship/Student,Karlsruhe,Internship,JavaScript; React; Git; AI,Web Development,39688,57112,48400,73.7,38,30.3,136,https://www.arbeitnow.com/jobs/companies/frechekoepfe-gmbh/pflichtpraktikum-webentwicklung-flexibler-start-moglich-karlsruhe-96759,Dein Herz schlägt für (Web-)Entwicklung und für die Erstellung von modernen Websites und Webapps? Du möchtest an spannenden Kundenprojekten erste Erfahrungen sammeln? Das lieben wir! Bewirb dich doch bei uns! Hey! Wir si
raw-0197,2026-07-05,Arbeitnow API,SpotOn Solutions,(Junior) Consultant (m/w/d) Quereinstieg möglich,Software & Engineering,Business Consulting,Entry-level,Cologne,berufseinstieg,Onboarding; Sales; REST; HR,Business Consulting,54120,77880,66000,70.5,38,30.3,136,https://www.arbeitnow.com/jobs/companies/spoton-solutions/junior-consultant-quereinstieg-moglich-cologne-406248,"2026 habe ich mich dazu entschieden, SpotOn zu gründen. Wir sind ein junges, dynamisches Unternehmen, das sich darauf spezialisiert hat, Unternehmen jeder Größe auf der ganzen Welt dabei zu unterstützen, zu wachsen und d"
raw-0198,2026-07-05,Arbeitnow API,SMN SCALE,Video Cutter (m/w/d) Short Format I E-Commerce (Vollzeit/Minijob/Freelance),Marketing & Growth,Remote,Mid-level,Hamburg,berufserfahren,Performance Marketing; Social Media; Video Editing; AI,Remote; Online Marketing,49200,70800,60000,72.7,38,30.3,136,https://www.arbeitnow.com/jobs/companies/smn-scale/video-cutter-short-format-i-e-commerce-vollzeit-minijob-freelance-hamburg-463616,"Dich nerven schlecht geschnittene Werbungen beim scrollen? Uns auch. Wenn du Bock hast… Ads zu cutten, die wirklich Umsatz generieren Ads für die größten Brands in Deutschland zu erstellen Maximale kreative Freiheit beim"
raw-0199,2026-07-05,Arbeitnow API,nüchtern,"Creative Allrounder / Junior Art Director (m,w,d) II Marketing",Marketing & Growth,Graphic Arts and Communication Design,Internship/Student,Berlin,hilfstätigkeit / student,Communication; Design; Figma; Video Editing; CRM,Graphic Arts and Communication Design,27060,38940,33000,75.7,38,30.3,136,https://www.arbeitnow.com/jobs/companies/nuchtern/creative-allrounder-junior-art-director-mwd-ii-marketing-berlin-65942,"Du kannst cutten UND designen? Dein Auge für Marke trifft auf Hands-on-Mentalität, und du willst das komplette visuelle Erscheinungsbild einer wachsenden alkoholfreien Marke verantworten? Dann bist du bei uns genau richt"
raw-0200,2026-07-05,Arbeitnow API,ProviPanda GmbH,Freelance RevOps Expert (Close) Remote - 5h/Woche,Marketing & Growth,Remote,Mid-level,Hamburg,"Freelance, berufserfahren",Communication; Onboarding; Sales; CRM,Remote; Marketing and Communication,49200,70800,60000,80.7,38,30.3,136,https://www.arbeitnow.com/jobs/companies/provipanda-gmbh/freelance-revops-expert-close-remote-5h-woche-hamburg-252980,"ProviPanda ist die größte Vertriebs-Recruiting-Plattform im DACH-Raum mit 40.000+ verifizierte Vertrieblern. Wir wachsen stark und generieren aktuell 8.000+ Inbound Leads, die über Close laufen und suchen jetzt einen erf"
raw-0201,2026-07-05,Arbeitnow API,Francavilla Giuseppe,Mitarbeiter Marktforschung im Homeoffice,HR & Recruitment,Remote,Internship/Student,Munich,"Contract, no experience required / student",Research,Remote; Market Research; Analysis,25256,36344,30800,60.8,38,30.3,136,https://www.arbeitnow.com/jobs/companies/francavilla-giuseppe/mitarbeiter-marktforschung-im-homeoffice-munich-194312,Tasks **Stellenbeschreibung **Ein internationales Unternehmen im Bereich Consumer Insights sucht präzise und detailorientierte Persönlichkeiten zur Verstärkung unseres Teams für Datenerfassung und Online-Marktforschungsp
raw-0202,2026-07-04,Remotive API,IAPWE,Freelance Writer,Marketing & Growth,Writing,Unspecified,Worldwide,freelance,REST; Communication; Finance,REST,45264,65136,55200,77.5,38,30.3,136,https://remotive.com/remote-jobs/writing/freelance-writer-1185979,Our organization is seeking content writers to create articles and blog posts on a variety of topics. The rate of pay is $20 per 100 words (this comes out to approximately $100 per article or $50 per hour). Some topics y
raw-0203,2026-07-03,The Muse API,Applied Materials,Mechanical Design Engineer,Software & Engineering,Science and Engineering,Unspecified,"Bangalore, India",external,Design; AI,Science and Engineering; Entry Level,66387,95533,80960,100,38,30.3,136,https://www.themuse.com/jobs/appliedmaterials/mechanical-design-engineer-480880,"Who We Are Applied Materials is a global leader in materials engineering solutions used to produce virtually every new chip and advanced display in the world. We design, build and service cutting-edge equipment that help"
raw-0204,2026-07-03,The Muse API,CrowdStrike,"Incident Response Consultant - Weekend Shift (Remote, GBR)",Software & Engineering,Project Management,Unspecified,Flexible / Remote,external,Project Management; Cybersecurity; Security; AI; HR,Project Management; Mid Level,66387,95533,80960,64.6,54,37.2,115,https://www.themuse.com/jobs/crowdstrike/incident-response-consultant-weekend-shift-remote-gbr,"As a global leader in cybersecurity, CrowdStrike protects the people, processes and technologies that drive modern organizations. Since 2011, our mission hasn't changed - we're here to stop breaches, and we've redefined "
raw-0205,2026-07-02,The Muse API,"The TJX Companies, Inc.",Verkäufer*in (m/w/d),Data & AI,Data and Analytics,Unspecified,"Vienna, Austria",external,Python; SQL; AI/ML; Data Analysis,Data and Analytics; Mid Level,64124,92276,78200,61.1,59,39.4,108,https://www.themuse.com/jobs/thetjxcompaniesinc/verkauferin-mwd-f4482d,"TK Maxx At TJX Europe, every day brings new opportunities for growth, exploration, and achievement. You'll be part of our vibrant team that embraces diversity, fosters collaboration, and prioritises your development. Whe"
raw-0206,2026-07-02,Remotive API,Coalition Technologies,Copywriter,Software & Engineering,Writing,Unspecified,Worldwide,freelance,Data Analysis; Accounting; Research; Excel; Go; Advertising; Finance; SEO,accounting; excel; research; data analysis; bookkeeping; google sheets; quickbooks; data entry; insurance; G Suite,66387,95533,80960,53.4,38,30.3,136,https://remotive.com/remote-jobs/writing/copywriter-1749306,"WHO WE'RE LOOKING FOR The ideal copywriter has excellent English writing skills and is excited to write high-quality, SEO-driven content that aligns with detailed, client-specific guidelines. Projects most commonly inclu"
raw-0207,2026-07-02,Remotive API,Lemon.io,Senior AI Engineer,Data & AI,Artificial Intelligence,Senior/Lead,"Northern America, LATAM, Europe, APAC",full_time,Project Management; Data Engineering; Data Science; Marketplace; JavaScript; TypeScript; Automation; WordPress; Node.js; Android; Startup; Shopify,.Net; android; C; C#; C++; data science; golang; ios; java; javascript; node.js; php; python; react; ruby/rails; scala; shopify; swift; UI/UX; wordpress; blockchain; AI/ML; automation; project management; react native; rust; unity; electron; spring; laravel; Ethereum; graphic design; Typescript; angular; data engineering; Site Reliability; SOLID; Symfony; startup; marketplace; next.js; flutter,94095,135405,114750,54.4,61,44.2,106,https://remotive.com/remote-jobs/artificial-intelligence/senior-ai-engineer-2090986,Are you a talented Senior AI Engineer looking for a remote job that lets you show your skills and get decent compensation? Look no further than Lemon.io — the marketplace that connects you with hand-picked startups in th
raw-0208,2026-07-02,Remotive API,"Clerky, Inc.",Customer Operations & Writing Specialist,Data & AI,Customer Service,Unspecified,Worldwide,full_time,Fundraising; Testing; Startup; AI/ML; AI; Customer Service; Communication; Operations,AI/ML; startup; fundraising; testing,64124,92276,78200,71.5,51,35.9,119,https://remotive.com/remote-jobs/customer-service/customer-operations-writing-specialist-2090942,"Here at Clerky, we build software to make legal paperwork easier for startups and their attorneys. We're profitable and growing sustainably. We're the most popular way for high-growth technology startups to form, and are"
raw-0209,2026-06-30,The Muse API,Tory Burch,Key Holder,Software & Engineering,Unknown,Unspecified,"Mississauga, Canada",external,Security; Design; Sales,Unknown; Mid Level,66387,95533,80960,77.2,46,33.8,125,https://www.themuse.com/jobs/toryburch/key-holder-a956b8,"We are an American luxury lifestyle brand, founded in 2004. Anchored in the casual elegance of American sportswear, Tory's design philosophy is defined by effortless silhouettes, innovative materials, eclectic juxtaposit"
raw-0210,2026-06-30,The Muse API,TikTok,"Brand Partnership Manager, Entertainment - Global Business Solutions - Hamburg",Marketing & Growth,Entertainment and Travel Services,Senior/Lead,"Hamburg, Germany",external,AI; Performance Marketing; Communication; Advertising; Sales,Entertainment and Travel Services; Senior Level,66420,95580,81000,77.6,48,38.6,123,https://www.themuse.com/jobs/tiktok/brand-partnership-manager-entertainment-global-business-solutions-hamburg,"Responsibilities Our Brand Partnership Team is responsible for driving business, helping advertisers meet their branding goals, and building long term relationships with brands in the Entertainment industry across the DA"
