source,source_url,date_posted,company,title,category,location,job_type,tags_raw,description
Arbeitnow API,https://www.arbeitnow.com/jobs/companies/keyone/marketing-praktikum-customer-lifecycle-growth-manager-bad-homburg-361304,2026-07-13T09:01:41,KeyOne,Marketing-Praktikum: Customer Lifecycle & Growth Manager (m/w/d),Marketing and Communication,Bad Homburg,"Internship, berufseinstieg",Marketing and Communication,"Bei KeyOne bauen wir die KI-Commerce-Infrastruktur der Zukunft. Unser Ziel ist es, Händler und Nutzer über verschiedenste Kanäle hinweg zentral miteinander zu verbinden und so völlig neue Möglichkeiten im E-Commerce zu schaffen. Dabei geht es nicht nur darum, neue Kunden zu gewinnen – sondern vor allem darum, bestehende Nutzer langfristig zu begeistern und aktiv zu halten. Deshalb suchen wir jemanden, der sich ausschließlich mit einer der wichtigsten Aufgaben eines erfolgreichen Unternehmens beschäftigt: Wie schaffen wir es, dass unsere Nutzer regelmäßig zurückkommen, unsere Produkte aktiv nutzen und langfristig zufriedene Kunden bleiben? Aufgaben Entwicklung neuer Ideen, um Nutzer langfristig zu binden Analyse des Nutzerverhaltens und Identifikation von Verbesserungspotenzialen Konzeption und Umsetzung von Reaktivierungsmaßnahmen Unterstützung beim Aufbau automatisierter Customer-Journeys Planung und Durchführung kleiner Experimente und A/B-Tests Auswertung relevanter Kennzahlen wie Retention, Aktivität und Customer Lifetime Value Entwicklung kreativer Konzepte, damit Nutzer häufiger und langfristiger zurückkehren Zusammenarbeit mit Produktentwicklung, Marketing und KI-Teams Qualifikation Du studierst Wirtschaft, Marketing, Wirtschaftsinformatik, Psychologie, Data Science oder einen vergleichbaren Studiengang. Du suchst ein Pflichtpraktikum, ein freiwilliges Praktikum oder eine Werkstudententätigkeit. Du interessierst Dich für digitale Produkte, Start-ups und E-Commerce. Du arbeitest analytisch, denkst lösungsorientiert und bringst gerne eigene Ideen ein. Zahlen schrecken Dich nicht ab – Du möchtest verstehen, warum Nutzer bleiben oder abspringen. Eigeninitiative und Neugier gehören zu Deinen Stärken. Plus: Erste Erfahrungen mit CRM-, Marketing- oder Analyse-Tools Interesse an KI, Automatisierung und datengetriebenem Arbeiten Grundkenntnisse in Google Analytics, Mixpanel oder ähnlichen Tools Benefits Eine Aufgabe mit echtem Einfluss auf den Unternehmenserfolg Viel Eigenverantwortung statt Kaffeekochen Direkte Zusammenarbeit mit unterschiedlichen Teams Moderne Arbeitsweise mit KI und Automatisierung Flexible Arbeitszeiten und Remote-Möglichkeiten Ein junges Team mit kurzen Entscheidungswegen Die Möglichkeit, Deine Ideen unmittelbar umzusetzen und deren Wirkung zu messen Wir freuen uns auf Deine Bewerbung Find more English Speaking Jobs in Germany on Arbeitnow"
Arbeitnow API,https://www.arbeitnow.com/jobs/companies/mpg-care-gmbh/technischer-immobilienmanager-gebaudemanagement-standort-fulda-wurzburg-377621,2026-07-13T09:01:40,MPG Care GmbH,Technischer Immobilienmanager/Gebäudemanagement Standort Fulda/Würzburg,Remote,Fulda,berufserfahren,Remote; Building; Supply; Safety Services Engineering,"Die MPG Care betreibt bundesweit erfolgreich stationäre Pflegeeinrichtungen, die wir im Rahmen der Unternehmensnachfolge übernommen haben. Die MPG Energy GmbH ist ein Unternehmen der MPG Care GmbH. Warum dies Stelle besonders ist: Zentrale Funktion mit Einfluss auf alle Standorte Direkte Zusammenarbeit mit der Geschäftsführung Aufbau interner Kompetenz im Gebäudemanagement Kurze Wege (geografischer Vorteil Fulda) Entwicklungsperspektive innerhalb einer wachsenden Gruppe Aufgaben Steuerung von Wartung, Instandhaltung und technischen Maßnahmen über mehrere Standorte Aufbau und Weiterentwicklung einer einheitlichen Systematik (Wartung / Prüfung / Instandhaltung / Instandsetzung / Sondermaßnahmen) Klärung und Durchsetzung von Zuständigkeiten (Pächter / Verpächter / Dritte) Steuerung externer Dienstleister Enge Abstimmung mit Einrichtungen und Eigentümern Optimierung der Lebenszykluskosten der Immobilien (z. B. Technik, Energie, bauliche Prävention) Bewertung von Investitionen und technischen Lösungen Nachverfolgung offener Themen und Maßnahmen Aufbau von Transparenz gegenüber Geschäftsführung Qualifikation Technische Ausbildung oder Studium (FM, Bau, TGA, Elektrotechnik o.ä.) Erfahrung im technischen Gebäudemanagement Idealerweise Erfahrung mit mehreren Standorten Sehr gute Excel-Kenntnisse, idealerweise FM-/CAFM-Systeme Strukturiert, durchsetzungsstark und lösungsorientiert Wirtschaftlich denkend Benefits 60.000 € – 80.000 € Grundgehalt + Bonus Regelarbeitszeit: 40 Stunden pro Woche (Montag–Freitag) Optional: 4-Tagewoche (Montag–Donnerstag) bei angepasster Arbeitszeit Firmenwagen – auch privat nutzbar Mobiles Arbeiten / Homeoffice 6 Wochen Urlaub Betriebliche Altersvorsorge (bAV) Zusatzleistungen zur Krankenversicherung Zentrale Lage mit kurzen Wegen zu allen Standorten Hoher Gestaltungsspielraum in wachsender Unternehmensgruppe Aufgrund unseres nachhaltigen Wachstums suchen wir zur Unterstützung unserer Heime eine unternehmerisch denkende Persönlichkeit, die das technische Gebäudemanagement über mehrere Standorte hinweg steuert, strukturiert und weiterentwickelt. Find Jobs in Germany on Arbeitnow"
Arbeitnow API,https://www.arbeitnow.com/jobs/companies/matera-gmbh/product-manager-berlin-167112,2026-07-13T08:32:39,Matera GmbH,Product Manager (m/w/d),Product Management,Berlin,berufserfahren,Product Management,"**In a nutshell: ** 📍 Standort: Berlin (hybrid) 🕓 Start: Ab sofort | Vollzeit | unbefristet Als Product Manager (m/w/d) verantwortest Du die Weiterentwicklung unserer SaaS-Lösung für die Immobilienverwaltung (App &#x26; Plattform) in Deutschland. Du setzt die richtigen Prioritäten, arbeitest eng mit unseren Teams in Deutschland und Paris zusammen und bist die zentrale Ansprechperson für den deutschen Markt. Aufgaben Deine Rolle bei Matera: Du entwickelst die Produktvision und -strategie für Deutschland auf Basis von Daten, Markt- und Wettbewerbsanalysen Du priorisierst und verantwortest die Produkt-Roadmap in enger Abstimmung mit den deutschen Teams Du setzt Roadmap-Themen gemeinsam mit Tech, Design, GenAI und Operations um Du erstellst und pflegst PRDs mit klarer Begründung, Kontext und KPI-Zielen Du koordinierst Releases, Kommunikation und Abstimmung mit den Fachbereichen Du misst den Produkterfolg, kommunizierst Ergebnisse und leitest Optimierungen ab Qualifikation Das bringst du mit: Must Have : Du sprichst Deutsch und Französisch auf C2 Niveau. Du lebst in Berlin und arbeitest gerne regelmäßig im Büro mit den Teams Du hast 1–4 Jahre Erfahrung im Produktmanagement, idealerweise im Start-up-Umfeld Du nutzt KI selbstverständlich in Deinem PM-Alltag für Analyse, Automatisierung und Prototyping Du fühlst Dich in einem schnellen, dynamischen Umfeld wohl und treibst Themen eigenständig voran Du arbeitest strukturiert, kommunizierst klar und kollaborierst teamübergreifend Bei Matera garantieren wir Chancengleichheit und Vielfalt. Hier bist du so willkommen, wie du bist! Benefits Deine Aussichten: Vergütung: 55.000–75.000 € brutto pro Jahr , abhängig von Deiner Erfahrung. Matera Benefits wie vergünstigte Urban Sports Club Mitgliedschaft, Lunch-Gutscheine + monatlicher ÖPNV-Zuschuss Einen großen Verantwortungsbereich und echte Gestaltungsfreiheit ab dem ersten Tag: Du bist der Product Manager für das deutsche Produkt und hast maßgeblichen Einfluss auf dessen Entwicklung. Ein Umfeld, in dem Du schnell lernst: Ein erfahrenes französisches Product-Team unterstützt Dich, gleichzeitig arbeitest Du direkt mit dem Country Manager und den operativen Teams zusammen. Ein profitables, stark wachsendes Unternehmen mit einer klaren europäischen Vision. Ein Büro in Berlin mit mindestens drei Präsenztagen pro Woche sowie gelegentlichen Reisen nach Paris, um Zeit mit dem Product- und Tech-Team zu verbringen. Ein ambitioniertes Team mit starkem Zusammenhalt und Spaß an der Arbeit 🙂 Unsere Mission: Unsere Mission bei Matera ist es, Wohnungseigentümer*innen glücklich zu machen! Durch uns können sie ihre Immobilie transparent und einfach selbst verwalten, oder die Verwaltung ganzheitlich in unsere Hände legen und dadurch eine Menge Zeit und Geld sparen. Seit 2017 sind wir auf dem französischen Markt aktiv und machen bereits jeden Tag das Leben von mehr als 100.000 Wohnungseigentümer*innen besser. In Deutschland haben wir seit 2021 ebenfalls einen großartigen Start mit einem ambitionierten Team hingelegt. Um unser Team kennenzulernen und Eindrücke von unserer Kultur zu bekommen, schaue gerne bei uns auf LinkedIn oder auf Instagram vorbei! Find more English Speaking Jobs in Germany on Arbeitnow"
Arbeitnow API,https://www.arbeitnow.com/jobs/companies/kostiuk-gruppe/office-manager-mit-dem-schwerpunkt-personal-organisation-hamburg-84060,2026-07-13T08:32:39,Kostiuk Gruppe,Office Manager (m/w/d) mit dem Schwerpunkt Personal & Organisation,HR,Hamburg,berufserfahren,HR,"30 Stunden | Hamburg Organisation ist Ihre Stärke? Sie behalten auch dann den Überblick, wenn mehrere Themen gleichzeitig laufen, und sorgen dafür, dass im Hintergrund alles reibungslos funktioniert? Dann freuen wir uns darauf, Sie kennenzulernen. Zur Verstärkung unseres Teams suchen wir einen Office Manager (m/w/d) mit Schwerpunkt Personal und Organisation , der unsere Projektleiter im Tagesgeschäft unterstützt und interne Abläufe strukturiert begleitet. Aufgaben Unterstützung im Recruiting-Prozess – von der Bewerberkommunikation bis zur Terminorganisation Organisation und Begleitung des Onboardings neuer Mitarbeitender Allgemeine Personalorganisation Enge Zusammenarbeit mit unseren Projektleiterinnen und Projektleitern Unterstützung bei der Planung und Organisation verschiedener Projekte Erstellung von Listen, Übersichten und organisatorischen Unterlagen Allgemeine Büroorganisation und administrative Aufgaben Die Buchhaltung gehört nicht zu Ihrem Aufgabenbereich. Qualifikation Eine strukturierte, selbstständige Arbeitsweise, Organisationstalent und Spaß daran, Dinge zu koordinieren. Sicherer Umgang mit Microsoft Excel und den gängigen Office-Anwendungen, Zuverlässigkeit und Verantwortungsbewusstsein, Kommunikationsstärke und Teamgeist, Bereitschaft, in einem dynamischen Umfeld zu arbeiten. Nach einer gründlichen Einarbeitung arbeitest du eigenverantwortlich. Als Unternehmensgruppe mit Schwerpunkt Events und Veranstaltungen richtet sich unser Arbeitsalltag nach dem, was auf unseren Projekten passiert. Deshalb gehören – je nach Veranstaltung – auch gelegentliche Abend- und Wochenendeinsätze dazu. Benefits Ein abwechslungsreicher Arbeitsalltag mit vielfältigen Aufgaben Flache Hierarchien und kurze Entscheidungswege Ein motiviertes Team mit enger Zusammenarbeit Eigenverantwortliches Arbeiten nach der Einarbeitung Ein spannendes Umfeld mit abwechslungsreichen Projekten und Veranstaltungen Wichtig zu wissen Unsere Projekte und Veranstaltungen finden nicht ausschließlich zu klassischen Bürozeiten statt. Daher gehören – je nach Veranstaltung – gelegentliche Einsätze am Abend oder an Wochenenden selbstverständlich dazu. Wenn Sie Flexibilität mitbringen und gerne in einem dynamischen Umfeld arbeiten, sind Sie bei uns genau richtig. Find more English Speaking Jobs in Germany on Arbeitnow"
Arbeitnow API,https://www.arbeitnow.com/jobs/companies/matera-gmbh/team-lead-hr-scale-up-berlin-399721,2026-07-13T08:32:39,Matera GmbH,Team Lead HR | Scale Up,Management,Berlin,teamleitung,Management; Team Leader,"In a nutshell: Du bist bei uns genau richtig, wenn du Lust hast als Teamlead HR mit uns von 100 auf 300 Mitarbeitende zu skalieren. Dabei wirst du ein Team aus einem Recruiter, einer HR Managerin sowie Werkstudierenden leiten und motivieren. Arbeite mit uns im Berliner Office (hybrid) und betreue alle strategischen HR Themen in enger Zusammenarbeit mit unserem General Manager Moritz. Starte ab sofort in Vollzeit. Aufgaben Deine Rolle bei Matera: Du übernimmst federführend strategische Themen wie HR Policy, Personalplanung, Gehaltsstrukturen Du baust Strukturen aus und optimierst unsere Prozesse Du agierst als Schnittstelle zwischen dem französischen und deutschen Team. Du motivierst und entwickelst das HR Team. Qualifikation Das bringst du mit: Du hast Erfahrung mit HR generalistischen Themen und im Scaling Du gehst Probleme strukturiert an und bleibst dran, bis du eine geeignete Lösung gefunden hast Du zeichnest dich durch ausgeprägte kommunikative Fähigkeiten aus und baust schnell Verbindungen mit Menschen auf Du bist sehr gut darin, die Erwartungen verschiedener Menschengruppen zusammenzubringen Du sprichst fließend Deutsch und kannst auch auf Englisch kommunizieren Bei Matera garantieren wir Chancengleichheit und Vielfalt. Hier bist du so willkommen, wie du bist! Benefits Deine Aussichten: Vergütung von 65.000-80.000€ plus Benefits Gestalte das Wachstum des führenden deutschen Start-ups in der Immobilienbranche Eigenverantwortliches Arbeiten mit Gestaltungsfreiraum in einer Start-up-Atmosphäre Ein herzliches Team, das sich gegenseitig hilft und gemeinsam auf die Ziele hinarbeitet:) Unsere Mission: Unsere Mission bei Matera ist es, Wohnungseigentümer*innen glücklich zu machen! Durch uns können sie ihre Immobilie transparent und einfach selbst verwalten, oder die Verwaltung ganzheitlich in unsere Hände legen und dadurch eine Menge Zeit und Geld sparen. Seit 2017 sind wir auf dem französischen Markt aktiv und machen bereits jeden Tag das Leben von mehr als 100.000 Wohnungseigentümer*innen besser. In Deutschland haben wir seit 2021 ebenfalls einen großartigen Start mit einem ambitionierten Team hingelegt. Um unser Team kennenzulernen und Eindrücke von unserer Kultur zu bekommen, schaue gerne bei uns auf LinkedIn oder auf Instagram vorbei! Find Jobs in Germany on Arbeitnow"
Arbeitnow API,https://www.arbeitnow.com/jobs/companies/dr-sasse-gruppe/operations-manager-facility-tenant-services-munich-75416,2026-07-13T08:32:39,Dr. Sasse Gruppe,Operations Manager Facility & Tenant Services (m/w/d),Engineering,Munich,,Engineering,"Die Dr. Sasse Gruppe ist ein familiengeführtes, international tätiges Unternehmen. Als Anbieter von integrierten Facility-Management-Dienstleistungen sind wir seit 50 Jahren Kompetenzpartner für die Immobilienwirtschaft, Industrie- und Freizeitunternehmen, den Handel sowie für das Luftverkehrs- und Transportwesen. Aktuell sind rund 9.500 Mitarbeitende für die Dr. Sasse Gruppe und ihre Beteiligungen tätig. Für einen der modernsten Büro- und Innovationsstandorte Deutschlands am Flughafen München suchen wir Sie als Operations Manager Facility &#x26; Tenant Services (m/w/d) . Sie verstehen sich als Gastgeber, Führungskraft und Dienstleistungsmanager zugleich? Sie möchten nicht nur Gebäude betreiben, sondern gemeinsam mit Ihrem Team ein Umfeld schaffen, in dem sich Mieter und Nutzer bestens betreut fühlen? Dann freuen wir uns darauf, Sie kennenzulernen. Aufgaben Gesamtverantwortung für die operativen Facility- und Tenant-Services des Standorts Zentraler und vertrauensvoller Ansprechpartner für Auftraggeber, Mieter und Nutzer in allen operativen Fragestellungen Aufbau und Pflege langfristiger Kundenbeziehungen sowie aktive Betreuung der Anliegen unserer Mieter mit dem Ziel einer hohen Kundenzufriedenheit Sicherstellung einer exzellenten, vertragsgerechten Leistungserbringung unter Einhaltung vereinbarter Qualitäts-, Termin- und Servicestandards Führung, Motivation und Weiterentwicklung der operativen Teams sowie bedarfsgerechte Personal- und Einsatzplanung Steuerung und Koordination sämtlicher technischer und infrastruktureller Dienstleistungen Partnerschaftliche Steuerung interner Fachbereiche und externer Dienstleister Verantwortung für die Einhaltung gesetzlicher Vorgaben, technischer Regelwerke sowie interner Qualitäts- und Sicherheitsstandards Ganzheitliche Budgetverantwortung, Wirtschaftlichkeitskontrolle sowie Identifikation und Umsetzung von Optimierungs- und Effizienzpotenzialen Sicherstellung einer strukturierten, revisionssicheren Dokumentation sowie Erstellung transparenter Reportings Förderung der Digitalisierung operativer Prozesse sowie Einsatz moderner Technologien und KI-Anwendungen zur kontinuierlichen Verbesserung von Qualität, Transparenz und Effizienz Qualifikation Erfolgreich abgeschlossenes Studium im Bereich Facility Management, Gebäudetechnik, Wirtschaftsingenieurwesen oder eine vergleichbare Qualifikation (ein Masterabschluss ist von Vorteil) Mehrjährige Berufserfahrung im Facility Management oder im Betrieb anspruchsvoller Immobilien Solides technisches Grundverständnis sowie Interesse an gebäudetechnischen Zusammenhängen Kenntnisse der wesentlichen technischen Gewerke (z. B. HLKS, Elektrotechnik, Brandschutz oder Gebäudeautomation), um Leistungen fachlich beurteilen und steuern zu können Sie verstehen sich als Führungskraft und Manager. Ihr Anspruch ist es, unterschiedliche Gewerke, Menschen und Dienstleistungen erfolgreich zu koordinieren – nicht selbst Spezialist jedes einzelnen Fachgebiets zu sein. Mehrjährige Führungserfahrung sowie Freude daran, Mitarbeitende zu entwickeln und Teams erfolgreich zu steuern Ausgeprägte Kommunikationsstärke, Empathie und ein sicheres Auftreten gegenüber Kunden, Mietern, Nutzern und Mitarbeitenden Hohe Kunden- und Dienstleistungsorientierung sowie die Fähigkeit, unterschiedliche Interessen zusammenzuführen und nachhaltige Lösungen zu entwickeln Ausgeprägtes wirtschaftliches Verständnis sowie Erfahrung in Budgetverantwortung, Kostenkontrolle und Kennzahlensteuerung Hohe Sorgfalt und Verlässlichkeit bei der Dokumentation von Prozessen, Leistungen und Entscheidungen Strukturierte, eigenverantwortliche und lösungsorientierte Arbeitsweise mit hohem Qualitätsanspruch Sicherer Umgang mit MS Office sowie Offenheit für digitale Systeme, moderne Technologien und den Einsatz von Künstlicher Intelligenz zur Steuerung, Dokumentation und Optimierung von Facility-Management-Prozessen Führerschein der Klasse B Das macht Sie erfolgreich in dieser Rolle Sie sind ein hervorragender Kommuni"
Arbeitnow API,https://www.arbeitnow.com/jobs/companies/inlogy-gmbh/testerin-paderborn-358119,2026-07-13T08:32:38,INLOGY GmbH,Tester:in,Quality Assurance,Paderborn,berufserfahren,Quality Assurance; Inspection,"Bei uns findest du Aufgaben, die dich fordern und weiterbringen. Hier kannst du mitgestalten, Verantwortung übernehmen und mit deinem Code etwas bewegen. Lust auf ein Team, das dich unterstützt und gemeinsam Großes schafft? Aufgaben Selbständige fachliche Beratung und Unterstützung im Umfeld: Problemanalyse, Qualitätssicherung Dokumentation von Ergebnissen Erstellen von Testdaten Erstellen von Testfällen Nachtesten entwickelter Features im Reviewprozess im SCRUM-Team Integrationstests auf Testumgebung Qualifikation Langjährige Fachkenntnis in den Bereichen: ISTQB (alternativ TmaP oder Ignite) Foundation Ausbildung und Testerfahrung (idealerweise aus agilem Umfeld) Erfahrungen mit Test-Tools für Testmanagement (z.B. ALM/HPQC) und Testautomatisierung (z.B. Ranorex, UFT/QTP, Selenium) gewissenhaftes Arbeiten, langfristige Verfügbarkeit, Verständnis für Dokumentationsanforderungen Einschlägige Erfahrung im Testumfeld aus einem anderen, optimalerweise ähnlichen Projekt Beherrschung der deutschen und englischen Sprache in Wort und Schrift Benefits WORAUF DU DICH FREUEN KANNST Offene Gehaltsstruktur Flexible Arbeitszeiten und Homeoffice Ein motiviertes, kollegiales Team mit echter Wertschätzung Spannende, abwechslungsreiche Projekte statt Routineaufgaben Regelmäßige Team-Events und eine offene Feedbackkultur Moderne Technologien und Tools, die dich in deiner Arbeit unterstützen Wir sind neugierig auf dich und machen dir den Einstieg leicht. Zeig uns einfach, wer du bist und was du draufhast. Ganz ohne Floskeln und Bewerbungsritualen. Find Jobs in Germany on Arbeitnow"
Arbeitnow API,https://www.arbeitnow.com/jobs/companies/lohnklar-ug/hr-managerin-lohnbuchhaltung-berlin-460553,2026-07-13T08:32:38,Lohnklar UG,HR Manager:in / Lohnbuchhaltung (w/m/d),Remote,Berlin,berufseinstieg,Remote; Administration,"Berlin, Deutschland (hybrid, Remote) · Teilzeit / Vollzeit/ Werkstudent:in / Minijob Bei Lohnklar machen wir Payroll, HR und Buchhaltung so, dass Unternehmen sie endlich verstehen – und Teams wieder Zeit fürs Wesentliche haben. Wir arbeiten digital, pragmatisch und auf Augenhöhe. Kein Kanzlei-Sprech, kein Chaos – dafür klare Prozesse, gute Tools und Mandant:innen, die unsere Arbeit wirklich schätzen. Aufgaben Eigenverantwortliche Lohn- und Gehaltsabrechnungen für unsere Mandant:innen Melde- und Bescheinigungswesen gegenüber Behörden, Krankenkassen und Sozialversicherungsträgern Pflege und Verwaltung von Personalstammdaten sowie digitalen Personalakten Unterstützung bei HR-Prozessen: Onboarding, Vertragswesen, Zeugnisse Ansprechpartner:in für Mandant:innen und deren Mitarbeitende bei lohnsteuer- und sozialversicherungsrechtlichen Fragen Enge Zusammenarbeit mit Buchhalter:innen, Steuerkanzleien und dem Geschäftsführer Durchführung von HR Projekten mit den Kunden Qualifikation Kaufmännische Ausbildung oder Studium mit HR-/Payroll-Schwerpunkt (z. B. BWL, Wirtschaftsrecht, Personalmanagement) Erste praktische Erfahrung in der Lohn- und Gehaltsabrechnung – Werkstudent:innen willkommen, wenn ihr wisst, worum es geht Kenntnisse im Lohnsteuer- und Sozialversicherungsrecht – kein Lexikon auswendig, aber Grundverständnis ist Pflicht Strukturierte, zuverlässige Arbeitsweise – du fragst, wenn etwas unklar ist, und lieferst trotzdem pünktlich Kommunikationsstärke auf Deutsch, sowohl intern als auch mit Mandant:innen (freundlich, klar, lösungsorientiert) Das ist ein Plus, aber kein Muss Erfahrung mit Agenda, DATEV Lohn und Gehalt oder ähnlichen Systemen Verständnis für HR-Digitalisierung und Prozessautomatisierung Interesse, in einer wachsenden Boutique-Beratung mitzugestalten Benefits 33 Tage Urlaub – plus Weihnachten &#x26; Silvester frei Jobticket / Deutschlandticket 50 € Sachzuwendungen (z. B. Benefits-/Gutscheinkarte) steuerfrei Hybrides Arbeiten: Mandant:innen vor Ort oder remote Modernes Equipment Weiterbildungsbudget &#x26; Jobbike (nach der Probezeit) Direkte Zusammenarbeit mit dem Geschäftsführer – du lernst hier mehr als in drei Jahren Konzern Klingt nach dir? Dann schick uns deinen Lebenslauf und ein paar Zeilen zu dir. Kein Anschreiben-Zirkus nötig. Wir melden uns schnell zurück. Find more English Speaking Jobs in Germany on Arbeitnow"
Arbeitnow API,https://www.arbeitnow.com/jobs/companies/k-tronik-gmbh/entwickler-fur-analoge-hardware-munich-410306,2026-07-13T08:32:38,K-tronik GmbH,Entwickler für analoge Hardware (m/w/d),Engineering,Munich,berufserfahren,Engineering,"Projektbeschreibung: Zur Unterstützung unseres Teams bei einem renommierten Kunden aus der Luft- und Raumfahrtbranche in München suchen wir zum nächstmöglichen Zeitpunkt einen Analog-Hardware-Design-Ingenieur (m/w/d) in Festanstellung bei K-tronik. Klingt das interessant? Dann freuen wir uns auf Ihre Bewerbung! Aufgaben: Entwicklung elektrischer Schaltungen gemäß den internen Entwicklungsstandards für die Luftfahrt (Belastungsanalyse, Toleranzanalyse, Entwurfsbegründung) auf der Grundlage von Anforderungen auf Platinenebene und vorläufigen Entwurfsideen - Analoge Simulation verschiedener Funktionen - Berücksichtigung der EMV-Anforderungen - Umsetzung des Entwurfs in Schaltpläne (Tool: ZUKEN) - Festlegung von Layout-Vorgaben für die entwickelten Schaltungen - Verifizierung der entwickelten Schaltungen auf Steckplatinen Qualifikationen: Entwurf analoger Schaltungen im Luftfahrtbereich für Bordausrüstung (mindestens 5 Jahre Erfahrung) - Mixed-Signal-Entwicklung (z. B. LVDT, Frequenzaufzeichnung, ADC-Entwicklung, digitale Cores wie MPC5777, Speicherentwicklung wie DDR3, Datenbus-Entwicklung wie RS422, …) - Analytische Entwurfsmethoden (Toleranzanalyse, Belastungsanalyse) - Schaltungssimulation (z. B. PSpice, LTSpice, MathCad) - Einsatz von Schaltplan- und Layout-Tools (z. B. Zuken) - Verifizierung analoger Schaltungen - Fachkenntnisse im DO-254- und Avionik-Prozess (Normen, Anforderungen, Rückverfolgbarkeit usw.) - Fließende Englischkenntnisse Benefits: Kollegiales und freundschaftliches Arbeitsklima Flexible Arbeitszeiten 30 Urlaubstage und flexible Urlaubsplanung Regelmäßige Team-Events Auszeichnung als Kununu TOP Company Corporate Benefits (Mitarbeiterangebote) Kostenlose Getränke Individuelle Weiterbildungsmöglichkeiten 360° Betreuung: Feedbackgespräche, Karriereplanung, Unterstützung bei Umzug, etc. Find Jobs in Germany on Arbeitnow"
