job_id,date_posted,source,company,title,category,raw_category,seniority,location,job_type,skills,tags_raw,salary_min_usd,salary_max_usd,salary_mid_usd,demand_index,scarcity_score,time_to_fill_days_proxy,application_volume_proxy,source_url,description_preview
raw-0085,2026-06-03,Arbeitnow API,MainTea GmbH,Grafiker:in (all genders) // Vollzeit // ab August // Frankfurt am Main,Marketing & Growth,Graphic Arts and Communication Design,Unspecified,Frankfurt am Main,,Communication; Design; Social Media; Startup,Graphic Arts and Communication Design,45264,65136,55200,93.8,38,30.3,136,https://www.arbeitnow.com/jobs/companies/maintea-gmbh/grafikerin-all-genders-vollzeit-ab-august-frankfurt-am-main-198231,"Du suchst eine spannende Herausforderung in einem innovativen Food-Startup? Dann bist du bei uns genau richtig! Wir sind ein junges, aufstrebendes Unternehmen mit mittlerweile über 29 Leuten im Team. Unter unserem Dach v"
raw-0086,2026-06-03,Arbeitnow API,Bolt Technology,"Senior Software Engineer, Data Platform Insights",Software & Engineering,Unspecified,Senior/Lead,"Berlin, Berlin, Germany",,Kubernetes; Testing; Python; CI/CD; AWS,,97416,140184,118800,67.5,72,49,91,https://www.arbeitnow.com/jobs/companies/bolt-technology/senior-software-engineer-data-platform-insights-berlin-483929,&lt;gh-intro&gt; &lt;text&gt; We're looking for a Senior Software Engineer to join Bolt's Data Platform Insights team. You'll build and evolve the platform that helps Bolt teams create and manage high-quality data produc
raw-0087,2026-06-03,Arbeitnow API,Bolt Technology,Senior Design System Engineer,Software & Engineering,Unspecified,Senior/Lead,"Berlin, Germany",,Design; Figma,,97416,140184,118800,73.6,48,38.6,123,https://www.arbeitnow.com/jobs/companies/bolt-technology/senior-design-system-engineer-berlin-194158,&lt;gh-intro&gt; &lt;text&gt; We're looking for a Senior Design System Engineer to take ownership of the technical architecture of our multi-platform design system. You'll work directly with design system designers and p
raw-0088,2026-06-03,Arbeitnow API,Flix,Senior Full-Stack Engineer (m/f/d) - Station Management & Inventory,Software & Engineering,Unspecified,Senior/Lead,"Berlin, Berlin, Germany",,Communication; Kubernetes; Automation; Operations; Frontend; Backend; Testing; Docker; Design; Azure; Cloud; CI/CD,,97416,140184,118800,73.9,64,45.5,102,https://www.arbeitnow.com/jobs/companies/flix/senior-full-stack-engineer-station-management-inventory-berlin-166995,We are looking for a motivated and curious Senior Full-Stack Engineer (Java/Kotlin) &nbsp;to&nbsp;join our team&nbsp;in&nbsp;Supply&nbsp;Division&nbsp;and drive customer station experience to the next level! &nbsp; In an
raw-0089,2026-06-03,Arbeitnow API,hubside - Die Recruitingwerkstatt,Senior Systemadministrator (m/w/d) Fokus Paketierung SCCM PSDAT,Software & Engineering,IT,Senior/Lead,Munich,berufserfahren,Security; Azure,IT,97416,140184,118800,61.8,64,45.5,102,https://www.arbeitnow.com/jobs/companies/hubside-die-recruitingwerkstatt/senior-systemadministrator-fokus-paketierung-sccm-psdat-munich-237150,Sie möchten moderne Enterprise-Client-Umgebungen aktiv gestalten und stabile sowie effiziente Windows-Arbeitsplätze weiterentwickeln? In dieser Position als Senior Systemadministrator (m/w/d) Enterprise Client Management
raw-0090,2026-06-03,Arbeitnow API,Wavestone Germany AG,Cloud-Infrastruktur-Experte (m/w/d) (Ref.Nr.: 46899),Product & Project Management,IT,Mid-level,Munich,"Freelance, berufserfahren",Cloud; AWS; AI,IT,62320,89680,76000,88.9,54,37.2,115,https://www.arbeitnow.com/jobs/companies/wavestone-germany-ag/cloud-infrastruktur-experte-refnr-46899-munich-419287,Wir suchen für ein innovatives Projekt im Bereich KI-Assistenzsysteme einen Cloud-Infrastruktur Experten zur Unterstützung beim Aufbau und Management einer AWS-basierten Umgebung. Key Facts Start: 15.06.2026 Dauer: Nicht
raw-0091,2026-06-03,Arbeitnow API,haebmau AG,Head of Growth (m/w/d),Marketing & Growth,Marketing and Communication,Senior/Lead,Munich,berufserfahren,Communication; Stakeholder Management; Social Media; Research; Sales; CRM,Marketing and Communication,66420,95580,81000,76.2,48,38.6,123,https://www.arbeitnow.com/jobs/companies/haebmau-ag/head-of-growth-munich-229757,"Beschreibung Als Head of Growth bei haebmau übernimmst du den Lead für New Business Development, Sales und die Entwicklung zukunfts­fähiger Services der Agentur. Gemeinsam mit den Kunden-Units und deinem Growth-Team trei"
raw-0092,2026-06-03,Arbeitnow API,hubside - Die Recruitingwerkstatt,IT M365 Spezialist (m/w/d),Cybersecurity & IT,IT,Mid-level,Munich,berufserfahren,Security; Cloud; SQL,IT,65600,94400,80000,78.3,59,39.4,108,https://www.arbeitnow.com/jobs/companies/hubside-die-recruitingwerkstatt/it-m365-spezialist-munich-180114,"Sie sind erfahren in komplexen Microsoft-Umgebungen und möchten IT-Infrastrukturen nicht nur betreiben, sondern aktiv weiterentwickeln? Dann könnte diese Position als IT M365 Spezialist (m/w/d) genau das Richtige für Sie"
raw-0093,2026-06-03,Arbeitnow API,Shereen Patzelt,Werkstudent Vertrieb / Finanzberatung (m/w/d) – Praxis statt Theorie,Finance & Business,Finance,Internship/Student,Chemnitz,"Full-time permanent, entry",Finance; Onboarding,Finance; high school or equivalent,30668,44132,37400,73.6,38,30.3,136,https://www.arbeitnow.com/jobs/companies/shereen-patzelt/werkstudent-vertrieb-finanzberatung-praxis-statt-theorie-chemnitz-158216,"Du studierst und willst mehr als einen „Nebenjob“? Du willst Verantwortung, klare Ziele und ein Umfeld, in dem Leistung zählt? Dann ist diese Werkstudentenrolle dein Einstieg in die Finanzberatung, mit strukturiertem Onb"
raw-0094,2026-06-03,Arbeitnow API,Finanzmaxx,"Proband in der Verbrauchermarktforschung (m/w/d), Nebenjob - remote",Marketing & Growth,Remote,Unspecified,Leipzig,Side,Communication,Remote; Marketing and Communication,45264,65136,55200,100,38,30.3,136,https://www.arbeitnow.com/jobs/companies/finanzmaxx/proband-in-der-verbrauchermarktforschung-nebenjob-remote-leipzig-170416,"Du möchtest dir nebenbei etwas dazuverdienen, ohne lange Umfragen auszufüllen oder komplizierte Online-Aufgaben zu erledigen? Dann könnte diese flexible Tätigkeit im Bereich Verbraucher- und Marktforschung interessant fü"
raw-0095,2026-06-03,Arbeitnow API,Recuvia,Werkstudent (m/w/d) Social Media,Data & AI,Social Media Manager,Internship/Student,Berlin,"Working student, hilfstätigkeit / student",Social Media; Performance Marketing; Design; Video Editing; HR,Social Media Manager,38335,55165,46750,73.1,43,32.5,129,https://www.arbeitnow.com/jobs/companies/recuvia/werkstudent-social-media-berlin-45099,"Über uns Recuvia ist eine People-Systems-Boutique für Gründer:innen, Scale-ups und mittelständische Unternehmen mit Fokus auf nachhaltiges Wachstum. Wir verbinden Menschen, Prozesse und Technologie zu klaren, skalierbare"
raw-0096,2026-06-03,Arbeitnow API,PIN AG,Recruiter Schwerpunkt Operations (m/w/d),HR & Recruitment,Recruitment and Selection,Entry-level,Berlin,berufseinstieg,Recruitment; Operations,Recruitment and Selection,34440,49560,42000,75,38,30.3,136,https://www.arbeitnow.com/jobs/companies/pin-ag/recruiter-schwerpunkt-operations-berlin-24725,"Du gehst offen auf Menschen zu, telefonierst gerne und hast schnell ein gutes Gespür dafür, wer wirklich passt? Dann suchen wir wahrscheinlich genau dich. Bei uns zählt kein Recruiting nach Schema F, sondern Tempo, Kommu"
raw-0097,2026-06-03,Arbeitnow API,spized GmbH,Werkstudent*in (m/w/d) Social Media,Marketing & Growth,Social Media Manager,Internship/Student,Cologne,Working student,Social Media; Onboarding; Design,Social Media Manager,27060,38940,33000,82.9,38,30.3,136,https://www.arbeitnow.com/jobs/companies/spized-gmbh/werkstudentin-social-media-cologne-148503,"Das Trikot ist das Aushängeschild eines Vereins. Ein Trikot ist Liebe, Emotion, Verantwortung &#x26; Tradition. Doch meist haben nur Profiteams die Möglichkeit, ihre Trikots individuell zu gestalten. Hier setzen wir an: "
raw-0098,2026-06-03,Arbeitnow API,Hywax GmbH,Project Engineer / Projektingenieur Verfahrenstechnik (m/w/d),Software & Engineering,Project Management,Mid-level,Hamburg,,Project Management; Operations; SAP,Project Management,72160,103840,88000,67.6,38,30.3,136,https://www.arbeitnow.com/jobs/companies/hywax-gmbh/project-engineer-projektingenieur-verfahrenstechnik-hamburg-371224,Die Hywax GmbH ist Teil der internationalen AWAX Group mit ca. 700 Mitarbeitenden. Am Standort im Hamburger Hafen produzieren rund 300 Mitarbeitende und 24 Auszubildende ein breites Spektrum an Paraffinwachsen auf minera
raw-0099,2026-06-03,Arbeitnow API,Riverstate Premium Recruiting,Obermonteur SHK (m/w/d) | bis zu 58.000 €,Software & Engineering,Building,Mid-level,Landshut,berufserfahren,Python; JavaScript; API; Cloud,Building; Supply; Safety Services Engineering,72160,103840,88000,96.9,62,40.7,104,https://www.arbeitnow.com/jobs/companies/riverstate-premium-recruiting/obermonteur-shk-bis-zu-58000-eur-landshut-436720,"Vorarbeitermentalität, Verantwortung für Baustellen mit bis zu 3 Mio. € Projektvolumen, bis zu 58.000 € Jahresgehalt, 30 Urlaubstage, keine Wochenendarbeit, bezahlte Fahrzeiten sowie tägliche Heimkehr im Raum Landshut un"
raw-0100,2026-06-03,Arbeitnow API,Intermate Media GmbH,Junior Data Analyst (gn),Software & Engineering,Marketing and Communication,Entry-level,Berlin,berufseinstieg,Communication; Social Media; Python; Excel,Marketing and Communication,54120,77880,66000,93,46,33.8,125,https://www.arbeitnow.com/jobs/companies/intermate-media-gmbh/junior-data-analyst-gn-berlin-211654,"Jobbeschreibung Intermate x SAMY – Shaping the State of Social Intermate gehört zu den größten Social-Media- und Influencer-Agenturen im DACH-Raum. Mit mehr als 250 Mates in Berlin, Hamburg, Köln und Remote entwickeln wi"
raw-0101,2026-06-03,Arbeitnow API,Jobbusters® GmbH,Bilanzbuchhalter / Senior Accountant (m/w/d),Product & Project Management,Finance,Senior/Lead,Augsburg,,Finance; Accounting; Excel; ERP,Finance,84132,121068,102600,65.6,48,38.6,123,https://www.arbeitnow.com/jobs/companies/jobbusters-gmbh/bilanzbuchhalter-senior-accountant-augsburg-265800,"Die Jobbusters vermittelt im Rahmen der Direktvermittlung an ein erfolgreiches, familiengeführtes Produktionsunternehmen mit langjähriger Tradition und internationaler Ausrichtung. Unser Mandant entwickelt und produziert"
raw-0102,2026-06-03,Arbeitnow API,Revent Capital,Team & Operations Associate,Software & Engineering,Business Operations,Entry-level,Berlin,entry,Operations; Accounting; Finance; Design; AI,Business Operations,54120,77880,66000,86.1,38,30.3,136,https://www.arbeitnow.com/jobs/companies/revent-capital/team-operations-associate-berlin-485786,"Revent is an early stage venture firm backing Europe's most talented founders building companies that truly matter. We focus on the founders who don't just want to build a unicorn but want to leave a legacy, to improve o"
raw-0103,2026-06-03,Arbeitnow API,PE Automotive GmbH & Co. KG,Koordination Marketing (m/w/d),Marketing & Growth,Marketing and Communication,Mid-level,Wuppertal,berufserfahren,Communication; HR,Marketing and Communication,49200,70800,60000,90.3,38,30.3,136,https://www.arbeitnow.com/jobs/companies/pe-automotive-gmbh-co-kg/koordination-marketing-wuppertal-325835,"Sind Sie bereit für eine Karriere auf der Überholspur? Dann kommen Sie ins PE-Team! Als Teil der weltweit agierenden BPW Gruppe sind wir seit mehr als 75 Jahren der Spezialist, wenn es um Ersatzteile für Nutzfahrzeuge ge"
raw-0104,2026-06-03,Arbeitnow API,Firstlead GmbH,Trainee (m/w/d) im Projektmanagement,Marketing & Growth,Training,Entry-level,Berlin,berufseinstieg,AI,Training; Development,36900,53100,45000,100,38,30.3,136,https://www.arbeitnow.com/jobs/companies/firstlead-gmbh/trainee-im-projektmanagement-berlin-45195,"Wir sind ADCELL - eines der schnellstwachsenden Affiliate Marketing Netzwerke im deutschsprachigen Raum! Seit unserer Gründung im Jahr 2003 setzen wir konsequent auf Technologie, Daten und Innovation, um maßgeschneiderte"
raw-0105,2026-06-03,Arbeitnow API,Whow Games GmbH,Senior Analytics Engineer - Monetization (m/w/d),Data & AI,Data Scientist,Senior/Lead,Hamburg,,Data Engineering; Tableau; Python; Design; Sales; SQL,Data Scientist,94095,135405,114750,74.5,69,47.7,95,https://www.arbeitnow.com/jobs/companies/whow-games-gmbh/senior-analytics-engineer-monetization-hamburg-457204,"We are Whow Games — and you can become part of it! We are a team of more than 50 people from a wide range of nationalities: passionate gamers, experienced game developers, and marketing professionals dedicated to the pla"
raw-0106,2026-06-03,Arbeitnow API,mITblick AG,IT Recruiter / HR Manager,Software & Engineering,Recruitment and Selection,Senior/Lead,Stuttgart,berufserfahren,Recruitment; Agile; HR,Recruitment and Selection,97416,140184,118800,57.4,48,38.6,123,https://www.arbeitnow.com/jobs/companies/mitblick-ag/it-recruiter-hr-manager-stuttgart-261950,"mITblick ist Experte der ersten Stunde in den Bereichen Agile Transformation, Agiles Requirements Engineering und Scrum. Unser Wissen und unsere Lösungsansätze geben wir in Trainings, Beratungseinsätzen und herausfordern"
raw-0107,2026-06-03,Arbeitnow API,Förderinitiative Deutschland,Vertriebsleitung B2B Fördermittelberatung im Government Funding (m/w/d),Marketing & Growth,Management,Senior/Lead,Munich,teamleitung,Sales; CRM,Management; Team Leader,66420,95580,81000,77.8,48,38.6,123,https://www.arbeitnow.com/jobs/companies/forderinitiative-deutschland/vertriebsleitung-b2b-fordermittelberatung-im-government-funding-munich-320149,"Wir sind eine spezialisierte Beratung für Fördermittel und Government Funding mit Sitz in München-Schwabing . Wir helfen innovativen, technologiegetriebenen mittelständischen Unternehmen , das volle Potenzial staatlicher"
raw-0108,2026-06-03,Arbeitnow API,ARC Intelligence GmbH,Head of GTM,Software & Engineering,Management,Senior/Lead,Berlin,,Communication; Forecasting; Automation; Finance; Startup; Sales; SaaS; ERP; AI,Management; Team Leader,97416,140184,118800,75.6,48,38.6,123,https://www.arbeitnow.com/jobs/companies/arc-intelligence-gmbh/head-of-gtm-berlin-114020,"ARC Intelligence is building the AI native Finance OS for modern mid market corporations. We help finance teams manage planning, forecasting, reporting, consolidation, and performance management across complex corporate "
raw-0109,2026-06-03,Arbeitnow API,Horn Glass Industries AG,Controller (m/w/d),Software & Engineering,Finance,Entry-level,Plößberg,berufseinstieg,Finance; Excel,Finance,54120,77880,66000,77.1,38,30.3,136,https://www.arbeitnow.com/jobs/companies/horn-glass-industries-ag/controller-plossberg-167490,HORN zählt zu den international führenden Anbietern hochwertiger Lösungen und Dienstleistungen rund um die Glasschmelze für ca. 650 Kunden in über 75 Ländern. Mit der weltweit anerkannten Spitzentechnologie tragen wir da
raw-0110,2026-06-03,Arbeitnow API,Tech-Recruiting.de,SAP EWM Inhouse Consultant (m/w/d) in Minden (Hybrid),Design & UX,IT,Mid-level,Minden,berufserfahren,Testing; Design; SAP,IT,50840,73160,62000,72.7,38,30.3,136,https://www.arbeitnow.com/jobs/companies/tech-recruitingde/sap-ewm-inhouse-consultant-in-minden-hybrid-243320,"Du willst SAP nicht nur am Laufen halten, sondern logistische Prozesse wirklich gestalten – dort, wo Customizing und Prozessdesign echten Impact haben statt im Ticket-Klein-Klein zu versanden? Für ein international tätig"
raw-0111,2026-06-03,Arbeitnow API,trafficdesign GmbH,Business Development Manager:in - New Business (m/w/d),Cybersecurity & IT,Business Development,Senior/Lead,Cologne,berufserfahren,Automation; Startup; Sales; CRM,Business Development,88560,127440,108000,75.3,53,40.8,116,https://www.arbeitnow.com/jobs/companies/trafficdesign-gmbh/business-development-managerin-new-business-cologne-451266,"Du brennst dafür, neue Türen zu öffnen, und gibst dich nicht mit „mal schauen, was reinkommt“ zufrieden? ✨ Bei trafficdesign sind wir High-End-Agentur und Growth-Partner für internationale Brands und für unser New-Busine"
raw-0112,2026-06-03,Arbeitnow API,trafficdesign GmbH,People Manager:in (m/w/d) People & Culture · Development · Administration,Software & Engineering,Administration,Senior/Lead,Cologne,berufserfahren,Onboarding; Operations; AI; HR,Administration,97416,140184,118800,84,48,38.6,123,https://www.arbeitnow.com/jobs/companies/trafficdesign-gmbh/people-managerin-people-culture-development-administration-cologne-241642,"Du brennst dafür, Menschen wachsen zu sehen, sie zu begleiten, zu bestärken und mit den richtigen Impulsen zu fördern, damit sie über sich hinauswachsen? ✨ Bei trafficdesign sind wir laut kununu einer der bestbewerteten "
raw-0113,2026-06-03,Arbeitnow API,Volksbank Eisenberg eG,Anlageberater (m/w/d),Product & Project Management,Asset,Entry-level,Eisenberg,berufseinstieg,Product Management; Project Management; Agile; Stakeholder Management,Asset; Fonds Management,46740,67260,57000,49.3,38,30.3,136,https://www.arbeitnow.com/jobs/companies/volksbank-eisenberg-eg/anlageberater-eisenberg-116857,Werde Teil unseres starken Teams! Wir suchen zur Verstärkung unseres Teams einen engagierten und motivierten Anlageberater (m/w/d) in Vollzeit oder Teilzeit Als Anlageberater begleitest du unsere Kunden bei wichtigen fin
raw-0114,2026-06-03,Arbeitnow API,Intercon Solutions GmbH,Sympathischer IT Support (m/w/d) gesucht,Software & Engineering,Helpdesk,Unspecified,Herford,,Python; JavaScript; API; Cloud,Helpdesk,66387,95533,80960,96.8,62,40.7,104,https://www.arbeitnow.com/jobs/companies/intercon-solutions-gmbh/sympathischer-it-support-gesucht-herford-313461,"Du bist technikbegeistert, arbeitest gerne mit Menschen und möchtest den nächsten Schritt in Deiner IT-Karriere gehen? Dann bist Du hier genau richtig! Für ein modernes und erfolgreiches Systemhaus suchen wir Verstärkung"
raw-0115,2026-06-03,Arbeitnow API,PONTON GmbH,"Marketing Manager (m/w/d) für IT-Dienstleistungen ab sofort, in Voll- oder Teilzeit, befristet als Elternzeitvertretung bis zum 31.05.2028",Marketing & Growth,Marketing Manager,Senior/Lead,Hamburg,berufserfahren,Social Media; CRM,Marketing Manager,66420,95580,81000,74.3,48,38.6,123,https://www.arbeitnow.com/jobs/companies/ponton-gmbh/marketing-manager-fur-it-dienstleistungen-ab-sofort-in-voll-oder-teilzeit-befristet-als-elternzeitvertretung-bis-zum-31052028-hamburg-222192,Als Stabstelle baust du unseren Marketingbereich weiter auf und entwickelst diesen kontinuierlich. Im Team mit hochqualifizierten Kolleg:innen unterstützt du die Geschäftsleitung bei Vertriebsaktivitäten und übernimmst e
raw-0116,2026-06-03,Arbeitnow API,Blindleister GmbH,Werkstudent/in - Founders Associate (Business) (m/w/d),Software & Engineering,Business Development,Internship/Student,Berlin,Working student,Startup,Business Development,39688,57112,48400,83.3,38,30.3,136,https://www.arbeitnow.com/jobs/companies/blindleister-gmbh/werkstudent-in-founders-associate-business-berlin-268375,"Die Energiewende hat ein Problem, über das kaum jemand spricht: Stabilität. Während Wind- und Solarparks grünen Strom liefern, verschwinden mit den konventionellen Kraftwerken auch die physikalischen Standbeine unseres N"
raw-0117,2026-06-03,Arbeitnow API,Fine Dine Verlags GmbH,Senior Performance Marketing Manager (m/w/d),Marketing & Growth,Remote,Senior/Lead,Ulm,teamleitung,Performance Marketing,Remote; Marketing Manager,66420,95580,81000,55.5,48,38.6,123,https://www.arbeitnow.com/jobs/companies/fine-dine-verlags-gmbh/senior-performance-marketing-manager-ulm-271620,"Vielleicht kommt dir das bekannt vor: → Du optimierst Kampagnen, aber hast keinen echten Einfluss auf die Gesamtstrategie → Agenturen treffen Entscheidungen, die du nicht wirklich kontrollierst → Du siehst riesiges Poten"
raw-0118,2026-06-03,Arbeitnow API,BonaTea GmbH,Werkstudent (m/w/d) Performance Marketing Amazon,Marketing & Growth,Marketing and Communication,Internship/Student,Nuremberg,,Communication; Performance Marketing; Startup; Excel,Marketing and Communication,27060,38940,33000,80.5,38,30.3,136,https://www.arbeitnow.com/jobs/companies/bonatea-gmbh/werkstudent-performance-marketing-amazon-nuremberg-289314,"Unsere Reise begann Ende 2021 in einer WG, aus der einfachen Not heraus, ein besonderes Tee-Geschenk für Fabi's Mama zu finden. Heute sind wir ein schnell wachsendes Start-Up, welches den konservativen Tee-Markt aufmisch"
raw-0119,2026-06-03,Arbeitnow API,Publik. Agentur für Kommunikation GmbH,PR-Consultant Online (all genders),Marketing & Growth,Public Relations,Unspecified,Mannheim,,Communication; Social Media; SEO,Public Relations; Corporate Communication,45264,65136,55200,81.4,38,30.3,136,https://www.arbeitnow.com/jobs/companies/publik-agentur-fur-kommunikation-gmbh/pr-consultant-online-all-genders-mannheim-35889,"Du verbindest strategisches Denken mit digitaler Expertise und gutem Content? Publik ist eine inhabergeführte Agentur in Mannheim mit einem klaren Fokus: Wir machen Kommunikation, die wirkt – strategisch fundiert, kreati"
raw-0120,2026-06-03,Arbeitnow API,audius SE,Software Support & Testing Spezialist (m/w/d) für Microsoft Dynamics CRM,Software & Engineering,IT,Unspecified,Weinstadt,,Customer Service; Operations; Testing; Cloud; Sales; SQL; CRM,IT,66387,95533,80960,77.5,46,33.8,125,https://www.arbeitnow.com/jobs/companies/audius-se/software-support-testing-spezialist-fur-microsoft-dynamics-crm-weinstadt-205992,"Gemeinsam mit unseren Kolleginnen und Kollegen entwickeln wir kundenindividuelle Business Software auf Basis von Microsoft Dynamics 365, Sales, Customer Service, Field Service, Project Operations und Marketing. Sie möcht"
raw-0121,2026-06-03,Arbeitnow API,Think3DDD GbR,"Praktikum Online Marketing & Media Design (m/w/d) - Content Creation, Social Media & Startup-Kultur",Cybersecurity & IT,Marketing and Communication,Internship/Student,Berlin,Internship,Communication; Social Media; Startup; Design; Cloud; HR,Marketing and Communication,36080,51920,44000,91.4,51,35.9,119,https://www.arbeitnow.com/jobs/companies/think3ddd-gbr/praktikum-online-marketing-media-design-content-creation-social-media-startup-kultur-berlin-209072,"🎨 Du suchst ein Pflichtpraktikum oder Praxissemester, in dem du deine Kreativität im Media Design mit strategischem Online Marketing verbinden kannst? 📱 Möchtest du nicht nur Posts planen, sondern eine Marke wirklich m"
raw-0122,2026-06-03,Arbeitnow API,eFLY Marketplace Services GmbH,Werkstudent (m/w/d) Sales & Marketing,Marketing & Growth,Marketing and Communication,Internship/Student,Stuttgart,Working student,Communication; Sales; CRM,Marketing and Communication,27060,38940,33000,88.4,38,30.3,136,https://www.arbeitnow.com/jobs/companies/efly-marketplace-services-gmbh/werkstudent-sales-marketing-stuttgart-358010,Du möchtest die Dynamik im Vertrieb hautnah miterleben und hast Lust auf echten Kundenkontakt? Dann bist du bei uns genau richtig! Als Werkstudent (m/w/d) im Bereich Sales und Marketing unterstützt du unser Team aktiv vo
raw-0123,2026-06-03,Arbeitnow API,ECE Marketplaces GmbH & Co. KG,Haustechniker (m/w/d) - Rhein-Galerie Ludwigshafen,Software & Engineering,Building,Mid-level,Ludwigshafen,berufserfahren,Python; JavaScript; API; Cloud,Building; Supply; Safety Services Engineering,72160,103840,88000,96.8,62,40.7,104,https://www.arbeitnow.com/jobs/companies/ece-marketplaces-gmbh-co-kg/haustechniker-rhein-galerie-ludwigshafen-253808,"Willkommen bei der ECE Group. Als Experte für komplexe und nachhaltig erfolgreiche Immobilien erschaffen wir Shopping-, Arbeits- und Wohnwelten am Puls der Zeit. Mit 3.100 Mitarbeiterinnen und Mitarbeitern sind wir in 12"
raw-0124,2026-06-03,Arbeitnow API,eFLY Marketplace Services GmbH,Werkstudent (m/w/d) Google Marketing & Analytics,Data & AI,Marketing and Communication,Internship/Student,Stuttgart,Working student,Communication; Design,Marketing and Communication,38335,55165,46750,100,43,32.5,129,https://www.arbeitnow.com/jobs/companies/efly-marketplace-services-gmbh/werkstudent-google-marketing-analytics-stuttgart-19622,Du möchtest Theorie gegen echte Praxis tauschen und die Welt des datengetriebenen Marketings kennenlernen? Dann bist du bei uns genau richtig! Als Werkstudent (m/w/d) unterstützt du unser Team aktiv bei der Gestaltung un
raw-0125,2026-06-03,Arbeitnow API,Think3DDD GbR,"Pflichtpraktikum Backend Softwareentwicklung & KI (m/w/d) - Python, APIs & MedTech",Data & AI,Software Development,Internship/Student,Berlin,Internship,Machine Learning; Data Science; TensorFlow; Frontend; PyTorch; Backend; Startup; Python; Design; REST,Software Development,38335,55165,46750,69,83,49.7,77,https://www.arbeitnow.com/jobs/companies/think3ddd-gbr/pflichtpraktikum-backend-softwareentwicklung-ki-python-apis-medtech-berlin-61238,"💡 Du suchst ein Pflichtpraktikum, in dem du Backend-Entwicklung mit Python und modernen Technologien praxisnah anwenden kannst? 🧠 Du interessierst dich für KI, Datenverarbeitung oder medizinische Anwendungen – und möch"
raw-0126,2026-06-03,Arbeitnow API,Kizuna Personalberatung GmbH,Personalreferent (m/w/d),Software & Engineering,Personnel Specialist,Mid-level,Konstanz,berufserfahren,Onboarding; HR,Personnel Specialist,72160,103840,88000,68.7,38,30.3,136,https://www.arbeitnow.com/jobs/companies/kizuna-personalberatung-gmbh/personalreferent-konstanz-471385,"Für eine renommierte, mittelständische Unternehmensgruppe in der Region Konstanz suchen wir aktuell einen Personalreferenten (m/w/d) . Unser Mandant bietet Ihnen einen sicheren und abwechslungsreichen Arbeitsplatz im Per"
