job_id,date_posted,source,company,title,category,raw_category,seniority,location,job_type,skills,tags_raw,salary_min_usd,salary_max_usd,salary_mid_usd,demand_index,scarcity_score,time_to_fill_days_proxy,application_volume_proxy,source_url,description_preview
raw-0001,2026-05-28,Arbeitnow API,TE-Time GmbH,Systemeinrichtung & Support,Software & Engineering,Remote,Mid-level,Hamburg,berufserfahren,Onboarding; Excel; CRM; ERP,Remote; IT,72160,103840,88000,56.3,38,30.3,136,https://www.arbeitnow.com/jobs/companies/te-time-gmbh/systemeinrichtung-support-hamburg-401054,"TREELAX Partner digitalisiert die Baumpflege. Wir sind ein schnell wachsendes Softwareunternehmen und helfen Fachbetrieben in ganz Deutschland, ihre Abläufe einfacher, effizienter und moderner zu gestalten – mit einer So"
raw-0002,2026-05-28,Arbeitnow API,AKmira optronics GmbH,Werkstudent / in Webdesign & Marketing (m/w/d),Marketing & Growth,Public Relations,Internship/Student,Potsdam,"Working student, hilfstätigkeit / student",Communication; Social Media; WordPress; Startup; Design; Figma,Public Relations; Corporate Communication,27060,38940,33000,71.1,38,30.3,136,https://www.arbeitnow.com/jobs/companies/akmira-optronics-gmbh/werkstudent-in-webdesign-marketing-potsdam-367638,"Du bist kreativ, digital unterwegs und hast Bock auf modernes Design &#x26; Marketing in einem Start Up Medizin / Defence ? Dann komm in unser Team und arbeite mit uns an coolen Projekten, starken Marken und modernen Web"
raw-0003,2026-05-28,Arbeitnow API,ANGEHEUERT GmbH Personalberatung,Geschäftsführer (m/w/d) Produktentwicklung & Vertrieb,Software & Engineering,IT,Unspecified,Düsseldorf,,Sales; AI,IT,66387,95533,80960,79.2,38,30.3,136,https://www.arbeitnow.com/jobs/companies/angeheuert-gmbh-personalberatung/geschaftsfuhrer-produktentwicklung-vertrieb-dusseldorf-203962,"Ein etabliertes B2B Softwareunternehmen sucht eine unternehmerisch geprägte Führungspersönlichkeit, die nicht nur strategisch denkt, sondern aktiv ins operative Geschehen eingreift und Veränderung konsequent umsetzt. Ges"
raw-0004,2026-05-28,Arbeitnow API,smartmicro,Embedded Softwareentwickler Traffic Management Systems(m/w/d),Software & Engineering,Software Development,Mid-level,Braunschweig,berufserfahren,Python; Design; C++,Software Development,72160,103840,88000,81.6,46,33.8,125,https://www.arbeitnow.com/jobs/companies/smartmicro/embedded-softwareentwickler-traffic-management-systems-braunschweig-245732,"Einleitung Wir sind smartmicro, der führende Spezialist für leistungsstarke Automobil- und Verkehrsradar- sowie Radar-/Kamera-Hybridsensortechnologie. Wir entwerfen, entwickeln und fertigen Hightech-Sensoren für autonome"
raw-0005,2026-05-28,Arbeitnow API,smartmicro,Algorithm Engineer - Radar Tracking (m/f/d),Software & Engineering,Software Development,Mid-level,Braunschweig,professional / experienced,Communication; Python; Design,Software Development,72160,103840,88000,93.8,46,33.8,125,https://www.arbeitnow.com/jobs/companies/smartmicro/algorithm-engineer-radar-tracking-braunschweig-265716,"Introduction We are smartmicro, the leading specialist in high-performance automotive and traffic radar- and radar/camera hybrid sensor technology. We design, develop and manufacture high-tech sensors for autonomous driv"
raw-0006,2026-05-28,Arbeitnow API,smartmicro,Algorithm Engineer - Radar Tracking (m/f/d),Software & Engineering,Software Development,Mid-level,Braunschweig,berufserfahren,Python; Design,Software Development,72160,103840,88000,98.1,46,33.8,125,https://www.arbeitnow.com/jobs/companies/smartmicro/algorithm-engineer-radar-tracking-braunschweig-82684,"Einleitung Wir sind smartmicro, der führende Spezialist für leistungsstarke Automobil- und Verkehrsradar- sowie Radar-/Kamera-Hybridsensortechnologie. Wir entwerfen, entwickeln und fertigen Hightech-Sensoren für autonome"
raw-0007,2026-05-28,Arbeitnow API,smartmicro,Embedded Software Developer Traffic Management Systems (m/f/d),Software & Engineering,Software Development,Mid-level,Braunschweig,professional / experienced,Communication; Testing; Python; Design; C++,Software Development,72160,103840,88000,78.7,46,33.8,125,https://www.arbeitnow.com/jobs/companies/smartmicro/embedded-software-developer-traffic-management-systems-braunschweig-38123,"Introduction We are smartmicro, the leading specialist in high-performance automotive and traffic radar- and radar/camera hybrid sensor technology. We design, develop and manufacture high-tech sensors for autonomous driv"
raw-0008,2026-05-28,Arbeitnow API,smartmicro,Application Software Engineer Traffic Management Sensors (m/f/d),Software & Engineering,Engineering,Mid-level,Braunschweig,berufserfahren,Python; Design; C++,Engineering,72160,103840,88000,81.6,46,33.8,125,https://www.arbeitnow.com/jobs/companies/smartmicro/application-software-engineer-traffic-management-sensors-braunschweig-417362,"Einleitung Wir sind smartmicro, der führende Spezialist für leistungsstarke Automobil- und Verkehrsradar- sowie Radar-/Kamera-Hybridsensortechnologie. Wir entwerfen, entwickeln und fertigen Hightech-Sensoren für autonome"
raw-0009,2026-05-28,Arbeitnow API,smartmicro,Algorithm Engineer - Perception / Sensor Fusion (m/f/d),Software & Engineering,Software Development,Mid-level,Braunschweig,professional / experienced,Communication; Research; Testing; Python; Design,Software Development,72160,103840,88000,80.6,46,33.8,125,https://www.arbeitnow.com/jobs/companies/smartmicro/algorithm-engineer-perception-sensor-fusion-braunschweig-380842,"Introduction We are smartmicro, the leading specialist in high-performance automotive and traffic radar- and radar/camera hybrid sensor technology. We design, develop and manufacture high-tech sensors for autonomous driv"
raw-0010,2026-05-28,Arbeitnow API,smartmicro,Algorithmen Ingenieur - Perception / Sensor Fusion (m/w/d),Software & Engineering,Software Development,Mid-level,Braunschweig,berufserfahren,Python; Design,Software Development,72160,103840,88000,98.1,46,33.8,125,https://www.arbeitnow.com/jobs/companies/smartmicro/algorithmen-ingenieur-perception-sensor-fusion-braunschweig-228709,"Einleitung Wir sind smartmicro, der führende Spezialist für leistungsstarke Automobil- und Verkehrsradar- sowie Radar-/Kamera-Hybridsensortechnologie. Wir entwerfen, entwickeln und fertigen Hightech-Sensoren für autonome"
raw-0011,2026-05-28,Arbeitnow API,smartmicro,Application Software Engineer Traffic Management Sensors (m/f/d),Software & Engineering,Engineering,Mid-level,Braunschweig,professional / experienced,Communication; Testing; Python; Design; C++,Engineering,72160,103840,88000,78.7,46,33.8,125,https://www.arbeitnow.com/jobs/companies/smartmicro/application-software-engineer-traffic-management-sensors-braunschweig-397669,"Introduction We are smartmicro, the leading specialist in high-performance automotive and traffic radar- and radar/camera hybrid sensor technology. We design, develop and manufacture high-tech sensors for autonomous driv"
raw-0012,2026-05-28,Arbeitnow API,bits&birds GmbH,IT Leiter,Software & Engineering,IT,Senior/Lead,Tübingen,teamleitung,Security; Cloud; ERP,IT,97416,140184,118800,68.6,64,45.5,102,https://www.arbeitnow.com/jobs/companies/bitsbirds-gmbh/it-leiter-tubingen-486360,Gemeinsam die digitale Zukunft eines traditionsreichen Wissenschaftsverlags gestalten. Mohr Siebeck ist ein international tätiger wissenschaftlicher Fachverlag mit Sitz in Tübingen. Seit 1801 verbindet das familiengeführ
raw-0013,2026-05-28,Arbeitnow API,NoscAi GmbH,Customer Success Manager (m/w/d) – KI-Praxissoftware,Software & Engineering,Sales,Senior/Lead,Hamburg,"Full-time permanent, experienced",Sales; Onboarding; SaaS,Sales; vocational,97416,140184,118800,62.5,48,38.6,123,https://www.arbeitnow.com/jobs/companies/noscai-gmbh/customer-success-manager-ki-praxissoftware-hamburg-99120,"Über ClinicOS NoscAi entwickelt ClinicOS – die KI-gestützte Praxissoftware, die deutsche Ärzte wirklich entlastet. Cloudbasiert, Made in Germany, DSGVO-konform. Unsere Plattform übernimmt Dokumentation, Arztbriefe, Termi"
raw-0014,2026-05-28,Arbeitnow API,NoscAi GmbH,Account Executive (m/w/d) – KI-Praxissoftware,Software & Engineering,Sales,Mid-level,Hamburg,"Full-time permanent, experienced",Sales; SaaS,Sales; vocational,72160,103840,88000,66.3,38,30.3,136,https://www.arbeitnow.com/jobs/companies/noscai-gmbh/account-executive-ki-praxissoftware-hamburg-5736,"Über ClinicOS NoscAi entwickelt ClinicOS – die KI-gestützte Praxissoftware, die deutsche Ärzte wirklich entlastet. Cloudbasiert, Made in Germany, DSGVO-konform. Unsere Plattform übernimmt Dokumentation, Arztbriefe, Termi"
raw-0015,2026-05-28,Arbeitnow API,NoscAi GmbH,Vertriebsmitarbeiter Healthcare (m/w/d) – KI-Praxissoftware,Software & Engineering,Sales,Mid-level,Hamburg,"Full-time permanent, experienced",Sales,Sales; vocational,72160,103840,88000,76.5,38,30.3,136,https://www.arbeitnow.com/jobs/companies/noscai-gmbh/vertriebsmitarbeiter-healthcare-ki-praxissoftware-hamburg-106004,"Über ClinicOS NoscAi entwickelt ClinicOS – die KI-gestützte Praxissoftware, die deutsche Ärzte wirklich entlastet. Cloudbasiert, Made in Germany, DSGVO-konform. Unsere Plattform übernimmt Dokumentation, Arztbriefe, Termi"
raw-0016,2026-05-28,Arbeitnow API,Kevin Kehr,"Werkstudent (m/w/d) – Finance & Beratung (unternehmerisch, leistungsbasiert)",Finance & Business,Finance,Internship/Student,Hamburg,"Full-time permanent, entry",Finance; Onboarding,Finance; high school or equivalent,30668,44132,37400,60.9,38,30.3,136,https://www.arbeitnow.com/jobs/companies/kevin-kehr/werkstudent-finance-beratung-unternehmerisch-leistungsbasiert-hamburg-52448,"Du studierst und willst mehr als einen „Nebenjob“? Du willst Verantwortung, klare Ziele und ein Umfeld, in dem Leistung zählt? Dann ist diese Werkstudentenrolle dein Einstieg in die Finanzberatung, mit strukturiertem Onb"
raw-0017,2026-05-28,Arbeitnow API,Janitza electronics GmbH,Product Manager (m/w/d) Software,Software & Engineering,Internet and software,Senior/Lead,Wetzlar,"Full-time permanent, mid",Python; JavaScript; API; Cloud,Internet and software; high school coursework,97416,140184,118800,85.4,72,49,91,https://www.arbeitnow.com/jobs/companies/janitza-electronics-gmbh/product-manager-software-wetzlar-294595,"Mit zukunftsweisenden Hard- und Software-Lösungen ermöglicht Janitza die Energie zu messen, auszuwerten und verfügbar zu machen. Janitza trägt so dazu bei, dass Unternehmen Ressourcen schonen, produktiv bleiben und erfol"
raw-0018,2026-05-28,Arbeitnow API,Care Marketing,Traineeprogramm zum Filialleiter (m/w/d) Vertrieb & Führung,HR & Recruitment,Training,Internship/Student,Dresden,hilfstätigkeit / student,AI,Training; Development,25256,36344,30800,81.9,38,30.3,136,https://www.arbeitnow.com/jobs/companies/care-marketing/traineeprogramm-zum-filialleiter-vertrieb-fuhrung-dresden-483991,"Du möchtest Karriere machen, Verantwortung übernehmen und langfristig eine eigene Filiale führen? Dann starte jetzt dein Traineeprogramm im Vertrieb bei uns in Dresden. Wir suchen motivierte Persönlichkeiten, die sich im"
raw-0019,2026-05-28,Arbeitnow API,Seminarkontor GmbH,Bildungsberater/in für geförderte Weiterbildungen gesucht,Marketing & Growth,Marketing and Communication,Unspecified,Leinfelden-Echterdingen,,Communication; CRM,Marketing and Communication,45264,65136,55200,71.1,38,30.3,136,https://www.arbeitnow.com/jobs/companies/seminarkontor-gmbh/bildungsberater-in-fur-geforderte-weiterbildungen-gesucht-leinfelden-echterdingen-471644,"Die Seminarkontor GmbH ist ein Bildungs- und Beratungsunternehmen mit Schwerpunkt auf geförderten Weiterbildungen, Bildungsgutscheinen und praxisnahen Qualifizierungen für Unternehmen und Beschäftigte. Zur Verstärkung un"
raw-0020,2026-05-28,Arbeitnow API,einsnulleins IT-Service Hannover/Göttingen,IT-Systemadministrator (m/w/d) (Fachinformatiker Systemintegration),Cybersecurity & IT,System and Network Administration,Unspecified,Laatzen,,Security; Azure; Cloud,System and Network Administration,60352,86848,73600,65,67,42.8,98,https://www.arbeitnow.com/jobs/companies/einsnulleins-it-service-hannovergottingen/it-systemadministrator-fachinformatiker-systemintegration-laatzen-141521,Übernimm Projektverantwortung und gestalte mit uns die IT von morgen! Du suchst eine neue berufliche Herausforderung als IT-Systemadministrator / IT-Techniker (m/w/d) in der IT-Branche? Dann verstärke schon bald unser Te
raw-0021,2026-05-28,Arbeitnow API,smartkündigen OHG,Customer Success Manager (B2C) (m/w/d) | 100% remote | attraktive Provision,HR & Recruitment,Remote,Senior/Lead,Neuss,teamleitung,Customer Service,Remote; Customer Service,61992,89208,75600,52.8,48,38.6,123,https://www.arbeitnow.com/jobs/companies/smartkundigen-ohg/customer-success-manager-b2c-100-remote-attraktive-provision-neuss-213781,"Wir suchen einen Customer Success Manager (B2C) der eigenverantwortlich einen festen Kundenstamm von ca. 2.000+ Kunden betreut. Du bist der zentrale Ansprechpartner und sorgst dafür, dass unsere Kunden optimal betreut we"
raw-0022,2026-05-28,Arbeitnow API,smartkündigen OHG,Teilzeit/Werkstudent Social Media Ads Manager (m/w/d) 100 % Remote,Marketing & Growth,Remote,Internship/Student,Neuss,,Social Media; Design,Remote; Social Media Manager,27060,38940,33000,90,38,30.3,136,https://www.arbeitnow.com/jobs/companies/smartkundigen-ohg/teilzeit-werkstudent-social-media-ads-manager-100-remote-neuss-81907,"Wir suchen Verstärkung im Online-Marketing! Du liebst es, mit Social Media zu arbeiten und kennst dich mit Werbeanzeigen aus? Dann bist du bei uns genau richtig. Zur Unterstützung unseres Teams suchen wir eine motivierte"
raw-0023,2026-05-28,Arbeitnow API,smartkündigen OHG,Remote Social Media Ads Manager (m/w/d) - Teilzeit/Werkstudent,Marketing & Growth,Remote,Internship/Student,Neuss,,Social Media; Design,Remote; Social Media Manager,27060,38940,33000,90,38,30.3,136,https://www.arbeitnow.com/jobs/companies/smartkundigen-ohg/remote-social-media-ads-manager-teilzeit-werkstudent-neuss-288362,"Wir suchen Verstärkung im Online-Marketing! Du liebst es, mit Social Media zu arbeiten und kennst dich mit Werbeanzeigen aus? Dann bist du bei uns genau richtig. Zur Unterstützung unseres Teams suchen wir eine motivierte"
raw-0024,2026-05-28,Arbeitnow API,SumUp,Data Analyst,Data & AI,Unspecified,Unspecified,"Cologne, North Rhine-Westphalia, Germany",,Communication; Tableau; Finance; Design; Cloud; SQL,,64124,92276,78200,75.6,51,35.9,119,https://www.arbeitnow.com/jobs/companies/sumup/data-analyst-cologne-84626,Data Analyst – Consumer&nbsp; About the team The Consumer tribe is building the financial products that small businesses and their customers rely on — from credit and BNPL to everyday banking services. As the tribe scale
raw-0025,2026-05-28,Arbeitnow API,SumUp,iOS Engineer - Design System,Software & Engineering,Unspecified,Unspecified,"Berlin, Germany",,Technical Support; Communication; Android; Testing; Design; iOS,,66387,95533,80960,66.3,38,30.3,136,https://www.arbeitnow.com/jobs/companies/sumup/ios-engineer-design-system-berlin-251517,"As an iOS Engineer in the Design System team , you will translate SumUp's design language into an easy-to-use, reusable library of user interface components and experience patterns, enabling product teams to build cohesi"
raw-0026,2026-05-28,Arbeitnow API,SumUp,Senior Android Engineer - Mobile Platform,Software & Engineering,Unspecified,Senior/Lead,"Berlin, Berlin, Germany",,Android; CI/CD,,97416,140184,118800,51.2,48,38.6,123,https://www.arbeitnow.com/jobs/companies/sumup/senior-android-engineer-mobile-platform-berlin-400723,"About the Team Join SumUp's Mobile Platform Squad as a Senior Android Engineer and become a cornerstone of our rapidly expanding Android ecosystem. With significant investment in flagship products, we are empowering our "
raw-0027,2026-05-28,Arbeitnow API,Wolt - English,Senior Account Manager (m/w/d),Marketing & Growth,Unspecified,Senior/Lead,"Stuttgart, Baden-Württemberg, Germany",,Sales,,66420,95580,81000,76.5,48,38.6,123,https://www.arbeitnow.com/jobs/companies/wolt-english/senior-account-manager-stuttgart-82048,"About Wolt At Wolt, we create technology that brings joy, simplicity and earnings to the neighborhoods of the world. In 2014 we started with delivery of restaurant food. Now we're building the delivery of (almost) everyt"
raw-0028,2026-05-28,Arbeitnow API,Linear Service GmbH,Entwicklung einer Brand- und Kommunikationsstrategie für das Rebranding einer B2B-Software im Nonprofit-Sektor.,Software & Engineering,Remote,Mid-level,Berlin,"Freelance, berufserfahren",WordPress; Startup; Design; SEO,Remote; Strategic Marketing,72160,103840,88000,66.5,38,30.3,136,https://www.arbeitnow.com/jobs/companies/linear-service-gmbh/entwicklung-einer-brand-und-kommunikationsstrategie-fur-das-rebranding-einer-b2b-software-im-nonprofit-sektor-berlin-274933,"Linear Software ist seit über 30 Jahren Marktführer für Vereins- und Verbandsverwaltung im deutschsprachigen Raum — mit 60.000 Installationen und einer Kundschaft, die auf Verlässlichkeit, nicht auf Hype setzt. Wir mache"
raw-0029,2026-05-28,Arbeitnow API,BlickSolutions GmbH,Senior Product Manager/in (100% Remote),Software & Engineering,Remote,Senior/Lead,Frankfurt am Main,,Product Management; Shopify; Design; SaaS,Remote; Product Management,97416,140184,118800,66.3,48,38.6,123,https://www.arbeitnow.com/jobs/companies/blicksolutions-gmbh/senior-product-manager-in-100-remote-frankfurt-am-main-443678,"Wir entwickeln Apps für Merchants auf Shopify . Dabei braucht unser Strategie-, Design- und Entwicklungsteam Unterstützung. Und zwar dich. Als Senior Product Manager koordinierst du Anforderungen, Konzept und die Umsetzu"
raw-0030,2026-05-28,Arbeitnow API,JobRad Loop,Elektriker:in (m/w/d) für Anlagen- und Gebäudetechnik,Software & Engineering,Engineering,Mid-level,Kabelsketal,berufserfahren,Python; JavaScript; API; Cloud,Engineering,72160,103840,88000,85.4,62,40.7,104,https://www.arbeitnow.com/jobs/companies/jobrad-loop/elektrikerin-fur-anlagen-und-gebaudetechnik-kabelsketal-140232,Lust auf eine besondere Herausforderung? Du bist Elektriker:in / Elektroniker:in und willst eigenverantwortlich Anlagen betreuen und Störungen lösen? Unsere 20.000 qm Neubau-Fahrradwerkstatt in Kabelsketal bei JobRad® Lo
raw-0031,2026-05-28,Arbeitnow API,Taxtalente.de,"Steuerberater (m/w/d) in Flein, auf Wunsch mit Partnerperspektive, gesucht - mindestens 90.000€",Software & Engineering,Directors,Unspecified,Flein,,Python; JavaScript; API; Cloud,Directors; Chief Executives,66387,95533,80960,85.4,62,40.7,104,https://www.arbeitnow.com/jobs/companies/taxtalentede/steuerberater-in-flein-auf-wunsch-mit-partnerperspektive-gesucht-mindestens-90000eur-255343,TaxTalente ist die Nr. 1 Job-Matching Plattform für Jobsuchende in der Steuerberatung. Sie suchen eine positive berufliche Veränderung? Sie möchten den nächsten Schritt in Ihrer Karriere gehen und streben möglicherweise 
raw-0032,2026-05-28,Arbeitnow API,Taxtalente.de,"Steuerberater (m/w/d) in Reinsdorf, auf Wunsch mit Partnerperspektive, gesucht - mindestens 90.000€",Software & Engineering,Directors,Unspecified,Reinsdorf,,Python; JavaScript; API; Cloud,Directors; Chief Executives,66387,95533,80960,85.4,62,40.7,104,https://www.arbeitnow.com/jobs/companies/taxtalentede/steuerberater-in-reinsdorf-auf-wunsch-mit-partnerperspektive-gesucht-mindestens-90000eur-213256,TaxTalente ist die Nr. 1 Job-Matching Plattform für Jobsuchende in der Steuerberatung. Sie suchen eine positive berufliche Veränderung? Sie möchten den nächsten Schritt in Ihrer Karriere gehen und streben möglicherweise 
raw-0033,2026-05-28,Arbeitnow API,Taxtalente.de,"Steuerberater (m/w/d) in Bredenbek, auf Wunsch mit Partnerperspektive, gesucht - mindestens 90.000€",Software & Engineering,Directors,Unspecified,Bredenbek,,Python; JavaScript; API; Cloud,Directors; Chief Executives,66387,95533,80960,85.4,62,40.7,104,https://www.arbeitnow.com/jobs/companies/taxtalentede/steuerberater-in-bredenbek-auf-wunsch-mit-partnerperspektive-gesucht-mindestens-90000eur-414098,TaxTalente ist die Nr. 1 Job-Matching Plattform für Jobsuchende in der Steuerberatung. Sie suchen eine positive berufliche Veränderung? Sie möchten den nächsten Schritt in Ihrer Karriere gehen und streben möglicherweise 
raw-0034,2026-05-28,Arbeitnow API,Taxtalente.de,"Steuerberater (m/w/d) in Schopp, auf Wunsch mit Partnerperspektive, gesucht - mindestens 90.000€",Software & Engineering,Directors,Unspecified,Schopp,,Python; JavaScript; API; Cloud,Directors; Chief Executives,66387,95533,80960,85.4,62,40.7,104,https://www.arbeitnow.com/jobs/companies/taxtalentede/steuerberater-in-schopp-auf-wunsch-mit-partnerperspektive-gesucht-mindestens-90000eur-414653,TaxTalente ist die Nr. 1 Job-Matching Plattform für Jobsuchende in der Steuerberatung. Sie suchen eine positive berufliche Veränderung? Sie möchten den nächsten Schritt in Ihrer Karriere gehen und streben möglicherweise 
raw-0035,2026-05-28,Arbeitnow API,Taxtalente.de,"Steuerberater (m/w/d) in Neubiberg, auf Wunsch mit Partnerperspektive, gesucht - mindestens 90.000€",Software & Engineering,Directors,Unspecified,Neubiberg,,Python; JavaScript; API; Cloud,Directors; Chief Executives,66387,95533,80960,85.4,62,40.7,104,https://www.arbeitnow.com/jobs/companies/taxtalentede/steuerberater-in-neubiberg-auf-wunsch-mit-partnerperspektive-gesucht-mindestens-90000eur-487097,TaxTalente ist die Nr. 1 Job-Matching Plattform für Jobsuchende in der Steuerberatung. Sie suchen eine positive berufliche Veränderung? Sie möchten den nächsten Schritt in Ihrer Karriere gehen und streben möglicherweise 
raw-0036,2026-05-28,Arbeitnow API,Taxtalente.de,"Steuerberater (m/w/d) in Gross-Umstadt, auf Wunsch mit Partnerperspektive, gesucht - mindestens 90.000€",Software & Engineering,Directors,Unspecified,Gross-Umstadt,,Python; JavaScript; API; Cloud,Directors; Chief Executives,66387,95533,80960,85.4,62,40.7,104,https://www.arbeitnow.com/jobs/companies/taxtalentede/steuerberater-in-gross-umstadt-auf-wunsch-mit-partnerperspektive-gesucht-mindestens-90000eur-118521,TaxTalente ist die Nr. 1 Job-Matching Plattform für Jobsuchende in der Steuerberatung. Sie suchen eine positive berufliche Veränderung? Sie möchten den nächsten Schritt in Ihrer Karriere gehen und streben möglicherweise 
raw-0037,2026-05-28,Arbeitnow API,Taxtalente.de,"Steuerberater (m/w/d) in Oberottmarshausen, auf Wunsch mit Partnerperspektive, gesucht - mindestens 90.000€",Software & Engineering,Directors,Unspecified,Oberottmarshausen,,Python; JavaScript; API; Cloud,Directors; Chief Executives,66387,95533,80960,85.4,62,40.7,104,https://www.arbeitnow.com/jobs/companies/taxtalentede/steuerberater-in-oberottmarshausen-auf-wunsch-mit-partnerperspektive-gesucht-mindestens-90000eur-485508,TaxTalente ist die Nr. 1 Job-Matching Plattform für Jobsuchende in der Steuerberatung. Sie suchen eine positive berufliche Veränderung? Sie möchten den nächsten Schritt in Ihrer Karriere gehen und streben möglicherweise 
raw-0038,2026-05-28,Arbeitnow API,Taxtalente.de,"Steuerberater (m/w/d) in Lichtenfels, auf Wunsch mit Partnerperspektive, gesucht - mindestens 90.000€",Software & Engineering,Directors,Unspecified,Lichtenfels,,Python; JavaScript; API; Cloud,Directors; Chief Executives,66387,95533,80960,85.4,62,40.7,104,https://www.arbeitnow.com/jobs/companies/taxtalentede/steuerberater-in-lichtenfels-auf-wunsch-mit-partnerperspektive-gesucht-mindestens-90000eur-163397,TaxTalente ist die Nr. 1 Job-Matching Plattform für Jobsuchende in der Steuerberatung. Sie suchen eine positive berufliche Veränderung? Sie möchten den nächsten Schritt in Ihrer Karriere gehen und streben möglicherweise 
raw-0039,2026-05-28,Arbeitnow API,PROFISHOP GmbH,Praktikum im Finanzwesen | Finance and Accounting | eCommerce,Finance & Business,Finance,Internship/Student,Bremen,Internship,Finance; Accounting; Excel,Finance,30668,44132,37400,56,38,30.3,136,https://www.arbeitnow.com/jobs/companies/profishop-gmbh/praktikum-im-finanzwesen-finance-and-accounting-ecommerce-bremen-311102,"Dein Praktikum bei PROFISHOP – Gestalte die Zukunft des eCommerce mit uns! Wir bei PROFISHOP lieben, was wir tun: Den digitalen Handel revolutionieren. Mit über 1,5 Millionen Produkten und innovativen Ideen gestalten wir"
raw-0040,2026-05-28,Arbeitnow API,New Soul,Founders Associate: Strategy and Expansion (m/f/d),Software & Engineering,Other,Mid-level,Berlin,professional / experienced,Communication; Operations; Design; AI,Other,72160,103840,88000,87.6,38,30.3,136,https://www.arbeitnow.com/jobs/companies/new-soul/founders-associate-strategy-and-expansion-berlin-275407,"Redefining the Architecture of Health Massage is one of the oldest forms of healing. At newsoul , we are finally giving it the modern, premium stage it deserves. By merging high-end architectural design with data-driven,"
raw-0041,2026-05-28,Arbeitnow API,New Soul,Area Manager Süd (m/w/d),Product & Project Management,Remote,Senior/Lead,Berlin,berufserfahren,Operations; Startup; Sales,Remote; Management and Consulting,84132,121068,102600,70.4,48,38.6,123,https://www.arbeitnow.com/jobs/companies/new-soul/area-manager-sud-berlin-162574,Deine Aufgaben Du bist Leiter:in unserer lokalen Teams und eine Schlüsselkomponente unseres operativen Erfolges: Leitung und Motivation der Teams : Du führst und coachst lokale Teams in bis zu 10 Studios im Süden Deutsch
