source,source_url,date_posted,company,title,category,location,job_type,tags_raw,description
Arbeitnow API,https://www.arbeitnow.com/jobs/companies/belong-cosmetics/praktikum-founders-associate-founder-in-residence-fokus-social-media-growth-hamburg-482907,2026-07-10T07:59:03,belong. cosmetics,Praktikum (m/w/d): Founder's Associate / Founder in Residence (Fokus Social Media & Growth),Social Media Manager,Hamburg,Internship,Social Media Manager,"Wer wir sind? belong. cosmetics ist eine 100 % female-founded Clean-Skincare-Brand aus Hamburg – entwickelt für die allersensibelsten Hautzustände. Vegan, hormonfrei, Made in Germany, ohne Duftstoffe, Silikone und alles, was Haut nicht braucht. High Standards statt leerer Versprechen, High-End-Design statt medizinisch anmutender Tuben. Wir sind Ende Mai 2026 gelauncht und mitten in der spannendsten Phase, die ein Startup haben kann: Alles wächst, alles bewegt sich, nichts ist in Stein gemeißelt. Genau jetzt suchen wir dich! Aufgaben Deine Mission bei uns Bei uns gibt's keinen Kaffee zu kochen. Du bist die rechte Hand der Gründerinnen. Dein Fokus: gemeinsam mit uns dafür zu sorgen, dass unsere Brand im digitalen Raum unübersehbar ist. Social Media &#x26; Content Creation: Du konzipierst, produzierst und schneidest kreativen Content für TikTok, Instagram Reels und LinkedIn. Du schreibst Skripte, entwickelst Hooks und hast ein Gespür für Trends, bevor sie welche sind. Egal, ob für organischen oder bezahlten Content. Social Media Strategie: Du entwickelst mit uns unsere Kanal- und Content-Strategie, analysierst, was performt, und testest neue Formate. Deine Ideen gehen nicht in ein Slide-Deck, sondern live. Personal Branding der Gründerinnen: Du unterstützt beim Aufbau des persönlichen Auftritts unserer Gründerin Julia Kiener – insbesondere bei Instagram &#x26; TikTok. Influencer- &#x26; Creator-Relations: Du identifizierst passende Creator, baust Beziehungen auf und unterstützt bei unseren Kooperationen. Allrounder-Mentalität (Deine größte Opportunity): In einem Early-Stage-Startup gibt es keine starren Grenzen. Du bist dir nicht zu schade, auch mal Aufgaben außerhalb deines eigentlichen Marketing-Fokus zu übernehmen: sei es im Operations-Bereich, beim Customer Support oder beim Packen der ersten großen B2B-Bestellungen. Für dich ist das keine lästige Pflicht, sondern die geile Chance, ungefiltert jeden Bereich einer D2C-Brand von Grund auf zu verstehen. Warum dieser Job besonders ist Näher geht nicht: Du arbeitest direkt mit den Gründerinnen und siehst, wie eine Brand von innen entsteht, von Produktentscheidung bis Retail-Pitch. Early Stage, Female-Founded, Skincare: Eine Kombination, die es so selten gibt – und ein Umfeld, in dem deine Arbeit ab Tag 1 sichtbar ist. Absolute Wachstumsphase: Du lernst in Monaten, wofür andere Jahre brauchen: Brand Building, Social Media, E-Commerce, Startup-Operations. Was du bei uns nicht bekommst Ehrlichkeit gehört zu unseren Standards. Damit wir beide keine Zeit verschwenden: Kein Frontalunterricht: Es gibt bei uns keine Onboarding-Academy und keine Schulungswochen. Wir erklären dir natürlich alles, was du brauchst, aber du lernst am besten beim Mitlaufen. Kein dauerhaftes An-die-Hand-Nehmen: Wenn du feste Strukturen und eine dauerhaft enge Anleitung brauchst, um gut zu arbeiten, ist das völlig okay – aber dann sind wir nicht das richtige Umfeld für dich. Du bekommst Kontext, Feedback und Verantwortung, aber niemand kontrolliert oder schreibt täglich deine To-do-Liste. Keine fertigen Prozesse: Vieles bei uns entsteht gerade erst. Wer offene Fragen als Einladung versteht und Lösungen entwickelt, ist bei uns genau richtig. Kurz: Wir suchen jemanden, die/der sich Dinge selbst erschließen kann, Fragen stellt, wenn es hakt und nicht darauf wartet, dass Wissen vorbeigebracht wird. Qualifikation Das bringst du mit Du suchst ein vorgeschriebenes Pflichtpraktikum im Rahmen deines Studiums (Dauer: 6 Monate) Du suchst ein freiwilliges Praktikum zur Orientierung (Dauer: strikt auf max. 3 Monate begrenzt) Selbstständige Lernweise: Du erschließt dir Neues selbst. Durch Ausprobieren, Nachfragen und Abgucken bei den Besten. Kein Silo-Denken: Du hast Bock auf das Gesamtbild und bist dir für keine Aufgabe zu schade, wenn es das Team voranbringt. Social-Media-Native: Du kennst die Algorithmen von TikTok und Instagram in- und auswendig. Idealerweise hast du schon eigenen Content kreiert. Videoschnitt-Skills: CapC"
Arbeitnow API,https://www.arbeitnow.com/jobs/companies/my-humancapital-gmbh/sap-inhouse-consultant-business-partner-munich-83178,2026-07-10T07:30:36,MY Humancapital GmbH,SAP Inhouse Consultant Business Partner (m/w/d),IT,Munich,,IT,"SAP Inhouse Consultant Business Partner (m/w/d) - Vollzeit | München | Homeoffice-Möglichkeit Im Auftrag unseres Partnerunternehmens in München suchen wir Sie zum nächstmöglichen Zeitpunkt als „SAP Inhouse Consultant Business Partner (m/w/d)“. Aufgaben Sie übernehmen die IT-seitige Betreuung und Weiterentwicklung des SAP Business Partners in einer modernen S/4HANA-Systemlandschaft Dabei unterstützen Sie die Fachbereiche Finance und Abrechnungsmanagement und sorgen für eine reibungslose Integration der SAP-Lösungen Sie beraten interne Fachbereiche, arbeiten eng mit externen SAP-Dienstleistern zusammen und entwickeln praxisorientierte Lösungen Von der Anforderungsanalyse über Konzeption, Implementierung und Test bis hin zum laufenden Betrieb begleiten Sie den gesamten Software-Lifecycle Zudem wirken Sie an der kontinuierlichen Optimierung bestehender SAP-Prozesse und Anwendungen mit Qualifikation Grundlage bildet ein abgeschlossenes Studium der Informatik, Wirtschaftsinformatik oder eine vergleichbare Qualifikation Idealerweise bringen Sie Berufserfahrung als SAP Inhouse Consultant (m/w/d), SAP Consultant (m/w/d), SAP Application Manager (m/w/d) oder SAP-Berater (m/w/d) mit Sie verfügen über fundierte Kenntnisse im SAP Business Partner sowie über Erfahrung mit S/4HANA und der Anbindung von Legacy-Systemen Darüber hinaus besitzen Sie gute Kenntnisse der SAP-Finanzprozesse und haben Interesse, sich in weitere SAP-Module einzuarbeiten Eine analytische, lösungsorientierte Arbeitsweise, Kommunikationsstärke sowie Freude an der Zusammenarbeit mit Fachbereichen und externen Partnern runden Ihr Profil ab Benefits Work-Life-Balance : Freuen Sie sich auf flexible Arbeitszeiten sowie eine anteilige Homeoffice-Möglichkeit Sicherheit : Kaum eine Branche bietet eine derartige Sicherheit wie der Öffentliche Dienst Weiterentwicklung : Es gibt zahlreiche Weiterbildungs- und Entwicklungsmöglichkeiten Zentrale Lage : Moderne Büroräumlichkeiten im Herzen von München mit optimaler Verkehrsanbindung Teamspirit : Sie können sich auf flache Hierarchien und eine offene Unternehmenskultur freuen Sie finden das Stellenprofil interessant? Dann freuen wir uns auf Ihre Bewerbung. Für Rückfragen steht Simon Schneider gerne unter 089 954 287 111 zur Verfügung. Find Jobs in Germany on Arbeitnow"
Arbeitnow API,https://www.arbeitnow.com/jobs/companies/my-humancapital-gmbh/personalreferent-personalentwicklung-ausbildung-munich-467736,2026-07-10T07:30:35,MY Humancapital GmbH,Personalreferent Personalentwicklung & Ausbildung (m/w/d),HR,Munich,,HR,"Personalreferent Personalentwicklung (m/w/d) - Vollzeit | München Im Auftrag unseres Partnerunternehmens in München suchen wir Sie zum nächstmöglichen Zeitpunkt als „Personalreferent Personalentwicklung &#x26; Ausbildungsmanagement (m/w/d)“. Aufgaben Sie betreuen Nachwuchskräfte in fachlichen, organisatorischen und persönlichen Fragestellungen während ihrer Ausbildungs- oder Studienzeit Als Ansprechpartner führen Sie ausbildungsbegleitende Gespräche und unterstützen die individuelle Entwicklung der Nachwuchskräfte Darüber hinaus übernehmen Sie administrative Aufgaben im Ausbildungsmanagement und stellen einen reibungslosen Ablauf sicher Sie wirken bei Auswahlverfahren sowie Einstellungsprozessen mit und begleiten diese organisatorisch Zusätzlich arbeiten Sie eng mit internen Fachbereichen zusammen und unterstützen die Weiterentwicklung des Nachwuchskräftemanagements Qualifikation Grundlage bildet ein abgeschlossenes Studium im Bereich Human Resources, Betriebswirtschaft, Wirtschaftsrecht oder Rechtswissenschaften, alternativ eine Ausbildung mit Weiterbildung zum Personalfachkaufmann (m/w/d) oder Personalfachwirt (m/w/d) Idealerweise bringen Sie Berufserfahrung als Personalreferent (m/w/d), HR Generalist (m/w/d), Ausbildungskoordinator (m/w/d) oder Referent Personalentwicklung (m/w/d) mit Sie verfügen über Erfahrung in der Betreuung von Nachwuchskräften, Auszubildenden oder dual Studierenden sowie idealerweise im Ausbildungs- oder Hochschulumfeld Zusätzlich sind Kenntnisse in administrativen HR-Prozessen sowie ein sicherer Umgang mit den gängigen MS-Office-Anwendungen wünschenswert Wichtig sind Kommunikationsstärke, Eigeninitiative, Organisationsgeschick sowie eine selbstständige und strukturierte Arbeitsweise Benefits Work-Life-Balance : Freuen Sie sich auf flexible Arbeitszeiten im Gleitzeitmodell Sicherheit : Kaum eine Branche bietet eine derartige Sicherheit wie der Öffentliche Dienst Weiterentwicklung : Es gibt zahlreiche Weiterbildungs- und Entwicklungsmöglichkeiten Onboarding : Sie erwartet eine professionelle Einarbeitung von den Experten der Abteilung Teamspirit : Sie können sich auf flache Hierarchien und eine offene Unternehmenskultur freuen Sie finden das Stellenprofil interessant? Dann freuen wir uns auf Ihre Bewerbung. Für Rückfragen steht Kaan Akdemir gerne unter 089 954 287 109 zur Verfügung. Find Jobs in Germany on Arbeitnow"
Arbeitnow API,https://www.arbeitnow.com/jobs/companies/my-humancapital-gmbh/senior-full-stack-java-entwickler-munich-158575,2026-07-10T07:30:34,MY Humancapital GmbH,(Senior) Full Stack Java Entwickler (m/w/d),Software Development,Munich,,Software Development,"(Senior) Full Stack Java Entwickler (m/w/d) - Vollzeit | München | Homeoffice-Möglichkeit Im Auftrag unseres Partnerunternehmens in München suchen wir Sie zum nächstmöglichen Zeitpunkt als „(Senior) Full Stack Java Entwickler (m/w/d)“. Aufgaben Sie entwickeln Geschäftsprozessanwendungen im Gesundheitswesen und arbeiten in agilen Softwareentwicklungsprojekten mit Als Full Stack Entwickler konzipieren, implementieren und testen Sie moderne Anwendungen mit Java im Backend sowie JavaScript-Technologien im Frontend Darüber hinaus beraten Sie Fachbereiche bei Prozessanalysen und entwickeln effiziente technische Lösungen Sie gestalten System- und Integrationsarchitekturen mit und stellen eine hohe Softwarequalität durch moderne Entwicklungsstandards sicher Zusätzlich übernehmen Sie im DevOps-Team den Betrieb, die Wartung und die kontinuierliche Weiterentwicklung bestehender Anwendungen und Services Qualifikation Grundlage bildet ein abgeschlossenes Studium der Informatik, Wirtschaftsinformatik oder Softwaretechnik beziehungsweise eine Ausbildung als Fachinformatiker Anwendungsentwicklung (m/w/d) mit entsprechender Berufserfahrung Idealerweise bringen Sie Berufserfahrung als Java-Entwickler (m/w/d), Softwareentwickler (m/w/d), Full Stack Entwickler (m/w/d) oder Software Engineer (m/w/d) mit Sie verfügen über fundierte Kenntnisse in Java, Spring, Containerisierung, CI/CD-Pipelines sowie in modernen Webtechnologien wie TypeScript, Vue.js oder vergleichbaren SPA-Frameworks Zusätzlich sind Erfahrungen mit DevOps, IT-Security, OIDC sowie Clean-Code-Prinzipien und Softwarearchitekturen erforderlich Wichtig sind analytisches Denkvermögen, Teamfähigkeit sowie Interesse an modernen Technologien und der kontinuierlichen Weiterentwicklung von Softwarelösungen Benefits Work-Life-Balance : Freuen Sie sich auf flexible Arbeitszeiten sowie eine anteilige Homeoffice-Möglichkeit Sicherheit : Kaum eine Branche bietet eine derartige Sicherheit wie der Öffentliche Dienst Weiterentwicklung : Es gibt zahlreiche Weiterbildungs- und Entwicklungsmöglichkeiten Zentrale Lage : Moderne Büroräumlichkeiten im Herzen von München mit optimaler Verkehrsanbindung Teamspirit : Sie können sich auf flache Hierarchien und eine offene Unternehmenskultur freuen Sie finden das Stellenprofil interessant? Dann freuen wir uns auf Ihre Bewerbung. Für Rückfragen steht Simon Schneider gerne unter 089 954 287 111 zur Verfügung. Find Jobs in Germany on Arbeitnow"
Arbeitnow API,https://www.arbeitnow.com/jobs/companies/digitale-leute-school/software-entwicklerin-mentorin-ai-software-engineering-bootcamp-cologne-209077,2026-07-10T07:30:34,Digitale Leute School,Software-Entwickler:in / Mentor:in (AI Software Engineering Bootcamp),Software Development,Cologne,berufserfahren,Software Development,"Die Digitale Leute School ist Teil der Digitale-Leute-Plattform – einem führenden Netzwerk für Produkt-, Design- und Tech-Professionals in Deutschland. Wir bilden in intensiven Online-Bootcamps die nächste Generation von AI Software Engineers, Product Managern und Product Designern aus. Unser Ziel: Talente fit machen für die Arbeit in modernen Tech-Teams – mit echten Projekten, Live-Sessions und Mentor:innen aus der Praxis. Deine Rolle: Als Mentor:in im AI Software Engineering Bootcamp begleitest du Teilnehmende auf ihrem Weg in die Tech-Branche. Du bist ihr Sparringspartner, Coach und Ansprechpartner bei technischen Fragen – und entwickelst dich dabei in allen modernen Engineering-Tools weiter (Claude Code, Cursor, Open AI/Codex, N8N). Aufgaben Unterstützung der Teilnehmenden bei Fragen zu modernen Web- und AI-Technologien Durchführung von 1:1-Mentorings, Gruppenformaten und Code-Reviews Feedback zu Projekten, Experimenten und Architekturentscheidungen geben Zusammenarbeit mit unseren Top-Trainer:innen aus führenden Tech-Companies (Airbnb, Miro, Shopify, Atlassian, Delivery Hero u.a.) Weiterentwicklung von Lernmaterialien und Unterstützung bei der Entwicklung des Curriculums Begleitung der Teilnehmenden durch alle Phasen des Bootcamps Qualifikation Erste Erfahrung in der Softwareentwicklung mit modernen Technologien (z. B. JavaScript, TypeScript, Python, React, Node.js) Begeisterung für moderne AI Developer Tools Freude an Wissensvermittlung, Coaching und Teamarbeit Selbstständige, strukturierte Arbeitsweise und gute Kommunikationsfähigkeiten Optional: Erfahrung mit Online-Lernplattformen, Cloud-Umgebungen und GitHub Benefits Zusammenarbeit mit führenden Software Engineers Europas – direkter Zugang zu deren Know-how und Arbeitsweise Lernchance: Du vertiefst dein Wissen in AI-gestütztem Software Engineering Flexibles Remote-Arbeitsmodell – Optional: Office-Tage in Köln Persönliche Weiterentwicklung durch interne Workshops &#x26; Didaktik-Coaching Sinnvolle Arbeit: Du hilfst anderen, ihre Tech-Karriere zu starten – und baust deine eigene Expertise aus Modernes Toolset (Miro, Notion, Slack, GitHub, Zoom etc.) Warum diese Position perfekt für dich ist Diese Rolle ist ideal, wenn du deine Coding-Karriere weiterentwickeln möchtest, aber dabei mehr Tiefe, Sinn und Impact suchst: Du arbeitest mit führenden Tech-Profis, lernst neue AI-Technologien kennen und unterstützt Menschen dabei, ihre Karriere zu transformieren. Find Jobs in Germany on Arbeitnow"
Arbeitnow API,https://www.arbeitnow.com/jobs/companies/digitale-leute-school/software-entwicklerin-mentorin-ai-software-engineering-bootcamp-cologne-220210,2026-07-10T07:30:34,Digitale Leute School,Software-Entwickler:in / Mentor:in (AI Software Engineering Bootcamp),Software Development,Cologne,berufserfahren,Software Development,"Die Digitale Leute School ist Teil der Digitale-Leute-Plattform – einem führenden Netzwerk für Produkt-, Design- und Tech-Professionals in Deutschland. Wir bilden in intensiven Online-Bootcamps die nächste Generation von AI Software Engineers, Product Managern und Product Designern aus. Unser Ziel: Talente fit machen für die Arbeit in modernen Tech-Teams – mit echten Projekten, Live-Sessions und Mentor:innen aus der Praxis. Deine Rolle: Als Mentor:in im AI Software Engineering Bootcamp begleitest du Teilnehmende auf ihrem Weg in die Tech-Branche. Du bist ihr Sparringspartner, Coach und Ansprechpartner bei technischen Fragen – und entwickelst dich dabei selbst in allen modernen Tools wie Claude Code, Cursor, Open AI/ Codex, N8N weiter. Aufgaben Unterstützung der Teilnehmenden bei Fragen zu modernen Web- und AI-Technologien Durchführung von 1:1-Mentorings, Gruppenformaten und Code-Reviews Feedback zu Projekten, Experimenten und Architekturentscheidungen geben Zusammenarbeit mit unseren Top-Trainer:innen aus führenden Tech-Companies (Airbnb, Miro, Shopify, Atlassian, Delivery Hero u.a.) Weiterentwicklung von Lernmaterialien und Unterstützung bei der Weiterentwicklung des Curriculums Begleitung der Teilnehmenden durch alle Phasen des Bootcamps Qualifikation Erste Erfahrung in der Softwareentwicklung mit modernen Technologien (z. B. JavaScript, TypeScript, Python, React, Node.js) Begeisterung für moderne AI Developer Tools Freude an Wissensvermittlung, Coaching und Teamarbeit Selbstständige, strukturierte Arbeitsweise und gute Kommunikationsfähigkeiten Optional: Erfahrung mit Online-Lernplattformen, Cloud-Umgebungen und GitHub Benefits Zusammenarbeit mit führenden Software Engineers Europas – direkter Zugang zu deren Know-how und Arbeitsweise Lernchance: Du vertiefst dein Wissen in AI-gestütztem Software Engineering Flexibles Remote-Arbeitsmodell - Optional: Office-Tage in Köln möglich. Persönliche Weiterentwicklung durch interne Workshops &#x26; Didaktik-Coaching Sinnvolle Arbeit: Du hilfst anderen, ihre Tech-Karriere zu starten – und baust deine eigene Expertise aus Warum diese Position perfekt für dich ist Diese Rolle ist ideal, wenn du deine Coding-Karriere weiterentwickeln möchtest, aber dabei mehr Tiefe, Sinn und Impact suchst: Du arbeitest mit führenden Tech-Profis, lernst neue AI-Technologien kennen und unterstützt Menschen dabei, ihre Karriere zu transformieren. Find more English Speaking Jobs in Germany on Arbeitnow"
Arbeitnow API,https://www.arbeitnow.com/jobs/companies/atlas-titan-ost-gmbh/projektingenieur-tga-fur-umspannwerke-frankfurt-am-main-462063,2026-07-10T07:30:34,ATLAS TITAN Ost GmbH,Projektingenieur TGA für Umspannwerke (m/w/d),Building,Frankfurt am Main,berufserfahren,Building; Supply; Safety Services Engineering,"Für ein anspruchsvolles Energieinfrastrukturprojekt im Raum Frankfurt am Main übernehmen Sie die technische Unterstützung bei der Errichtung eines Umspannwerks zur Versorgung eines Rechenzentrums. Im Mittelpunkt der Position stehen die Planung, Koordination und technische Begleitung der technischen Gebäudeausrüstung sowie die Sicherstellung einer reibungslosen Zusammenarbeit aller beteiligten Fachbereiche. Aufgaben Planung, Prüfung und Koordination der technischen Gebäudeausrüstung (TGA) für Umspannwerks-, Betriebs- und Technikgebäude Fachliche Bearbeitung der Gewerke wie z.B. Heizung, Lüftung, Klima/Kälte sowie versorgungstechnischer Anlagen einschließlich der technischen Schnittstellen Prüfung und Bewertung von Planungsunterlagen, Leistungsverzeichnissen, technischen Konzepten sowie Unterstützung bei Planungsänderungen und der Ausführungsplanung Koordination von Fachplanern, Lieferanten, Gutachtern und ausführenden Unternehmen sowie Unterstützung der Bauleitung bei Qualität, Terminen, Kosten und Arbeitssicherheit Begleitung von Abnahmen, Inbetriebnahmen und Mängelverfolgung sowie Sicherstellung einer vollständigen Projekt- und Revisionsdokumentation Qualifikation Abgeschlossenes Studium der Versorgungstechnik, Gebäudetechnik, Energietechnik oder eine vergleichbare Qualifikation Mehrjährige Berufserfahrung in der Planung oder Umsetzung von TGA-Anlagen, idealerweise im Umfeld von Energieinfrastruktur-, Industrie- oder Umspannwerksprojekten Fundierte Kenntnisse der TGA-Gewerke sowie relevanter Normen und Richtlinien Strukturierte, eigenverantwortliche Arbeitsweise, ausgeprägte Kommunikationsfähigkeit sowie sehr gute Deutschkenntnisse in Wort und Schrift Benefits Unbefristeter Arbeitsvertrag und 30 Tage Urlaub Professionelle Betreuung durch feste Ansprechpartner Gezielte Weiterbildungsmöglichkeiten zur fachlichen und persönlichen Weiterqualifizierung Umfangreiches Gesundheitsförderungsprogramm (u.a. Firmenfitness und private Krankenzusatzversicherung) Zuschuss vermögenswirksame Leistung und betriebliche Altersvorsorge Regelmäßige Mitarbeiterveranstaltungen zum Austausch von fachlichen Themen und Erfahrungen Individuelle Lösung für moderne Arbeitsausstattung zur Ermöglichung von flexiblem Arbeiten Mit JobRad die Möglichkeit zum Fahrrad-Leasing Find more English Speaking Jobs in Germany on Arbeitnow"
Arbeitnow API,https://www.arbeitnow.com/jobs/companies/mousebouncer-gmbh/community-customer-success-manager-munich-237516,2026-07-10T07:30:33,mousebouncer GmbH,Community & Customer Success Manager (m/w/d),Customer Service,Munich,berufserfahren,Customer Service,"Gestalte mit uns die Zukunft smarter Katzenklappen Wir sind mousebouncer GmbH , das Team hinter ZeroMOUSE – einer KI-gestützten Erweiterung für Katzenklappen, die verhindert, dass Katzen Mäuse und andere Beutetiere ins Haus bringen. Unsere Produkte werden bereits von über 20.000 Kunden genutzt und gehören zu den innovativsten Lösungen im Bereich Smart Pet Tech. Unsere Mission ist es, Technologie zu entwickeln, die den Alltag von Haustierbesitzern spürbar verbessert. Damit unsere Kunden nicht nur ein großartiges Produkt erhalten, sondern auch jederzeit hervorragend betreut werden, suchen wir eine engagierte Persönlichkeit für den Bereich Online Reputation &#x26; Community Management . Aufgaben Du bist die Stimme von ZeroMOUSE im Internet und sorgst dafür, dass Kunden sich jederzeit gut aufgehoben fühlen. Zu deinen Aufgaben gehören unter anderem: Betreuung unserer Bewertungen auf Trustpilot, Amazon, Google und weiteren Plattformen Freundliche und professionelle Beantwortung von Kundenbewertungen Beobachtung von Social Media, Foren und Communitys (z. B. Reddit, Facebook, YouTube) Unterstützung bei der Lösung von Kundenproblemen gemeinsam mit unserem Support-Team Identifikation wiederkehrender Kritikpunkte und Ableitung von Verbesserungsvorschlägen Erstellung von monatlichen Reports zur Markenwahrnehmung und Kundenzufriedenheit Aufbau und Pflege einer positiven Online-Community Sammeln und Aufbereiten von Kundenstimmen, Erfolgsgeschichten und Testimonials Unterstützung bei der Erstellung von FAQ-, Hilfe- und Informationsinhalten Zusammenarbeit mit Produktentwicklung, Support und Marketing Qualifikation Ausgeprägte Kommunikationsfähigkeit und sehr gutes schriftliches Deutsch Gute Englischkenntnisse in Wort und Schrift Freude am Umgang mit Menschen und an kundenorientierten Lösungen Empathie, Geduld und diplomatisches Geschick Selbstständige und strukturierte Arbeitsweise Sicherer Umgang mit digitalen Tools Interesse an Technik und KI-Produkten Idealerweise hast du bereits Erfahrung in einem oder mehreren dieser Bereiche: Customer Success Customer Support Community Management Online-Marketing E-Commerce Amazon oder Shopify Trustpilot oder andere Bewertungsplattformen Benefits Das erwartet dich Eine sinnstiftende Tätigkeit mit direktem Einfluss auf unsere Kunden Ein innovatives KI-Produkt mit internationalem Wachstum Flache Hierarchien und schnelle Entscheidungen Flexible Arbeitszeiten Hybrides Arbeiten oder Remote (nach Absprache) Moderne Arbeitsmittel Viel Eigenverantwortung und Gestaltungsspielraum Ein motiviertes Team mit kurzen Entscheidungswegen Arbeitszeit 20–30 Stunden pro Woche Die Arbeitszeiten können flexibel gestaltet werden. Wichtig ist uns lediglich, dass Kundenanfragen und Bewertungen zeitnah bearbeitet werden. Arbeitsort Hybrid oder Remote – regelmäßige Abstimmungen mit unserem Team in Unterschleißheim bei München. Warum diese Stelle besonders ist Du bist nicht einfach für Bewertungen verantwortlich. Du sorgst dafür, dass tausende Katzenbesitzer täglich positive Erfahrungen mit unserer Marke machen. Du erkennst Verbesserungspotenziale frühzeitig, gibst wichtige Impulse an unsere Produktentwicklung weiter und hilfst aktiv dabei, unsere Marke international weiter auszubauen. Bewirb dich jetzt Wenn du Lust hast, Verantwortung zu übernehmen und gemeinsam mit uns eine der innovativsten Marken im Bereich Smart Pet Tech weiterzuentwickeln , freuen wir uns auf deine Bewerbung. Sende uns deinen Lebenslauf sowie ein kurzes Anschreiben mit deiner Motivation und deinem möglichen Eintrittstermin. Find Jobs in Germany on Arbeitnow"
