source,source_url,date_posted,company,title,category,location,job_type,tags_raw,description
Arbeitnow API,https://www.arbeitnow.com/jobs/companies/smartkundigen-ohg/social-media-ads-manager-online-marketing-100-remote-neuss-267835,2026-05-20T07:30:33,smartkündigen OHG,Social Media Ads Manager (m/w/d) Online Marketing | 100 % Remote,Remote,Neuss,,Remote; Social Media Manager,"Wir suchen Verstärkung im Online-Marketing! Du liebst es, mit Social Media zu arbeiten und kennst dich mit Werbeanzeigen aus? Dann bist du bei uns genau richtig. Zur Unterstützung unseres Teams suchen wir eine motivierte Person, die unsere Social Media Kanäle mit Leben füllt – und vor allem performante Ads schaltet. Aufgaben Planung, Erstellung und Betreuung von Social Media Ads (Meta Ads – Facebook &#x26; Instagram, TikTok Ads, LinkedIn Ads) Analyse und Optimierung laufender Kampagnen (Performance, Zielgruppen, Budgets) Unterstützung bei der Pflege und dem Posten von organischen Beiträgen auf unseren Kanälen Enge Abstimmung mit unserem Team zu Inhalten, Zielen und Budgeteinsatz Qualifikation Erste Erfahrung im Schalten und Auswerten von Social Media Ads (z. B. aus Studium, Agentur oder Projekten) Verständnis für Zielgruppen, Conversion und Kampagnenstrukturen Gespür für gutes Design und ansprechende Texte Eigenständige, strukturierte Arbeitsweise und Freude an digitalen Themen Laptop/PC bereits vorhanden Benefits Flexible Arbeitszeiten (Werkstudent oder Teilzeit – ca. 20-25 Stunden/Woche) Möglichkeit zur remote Arbeit Eigenverantwortliches Arbeiten mit viel Gestaltungsspielraum Ein freundliches, offenes Team und kurze Entscheidungswege Interesse geweckt? Dann freuen wir uns auf deine Bewerbung mit kurzem Lebenslauf und ggf. Referenzen oder Beispielen bisheriger Kampagnen. Bitte sende alles per E-Mail an [deine Mailadresse] mit dem Betreff „Social Media Ads Manager (m/w/d) Find Jobs in Germany on Arbeitnow"
Arbeitnow API,https://www.arbeitnow.com/jobs/companies/smartkundigen-ohg/remote-social-media-ads-manager-werkstudent-teilzeit-neuss-128040,2026-05-20T07:30:33,smartkündigen OHG,Remote Social Media Ads Manager (m/w/d) - Werkstudent/Teilzeit,Remote,Neuss,,Remote; Social Media Manager,"Wir suchen Verstärkung im Online-Marketing! Du liebst es, mit Social Media zu arbeiten und kennst dich mit Werbeanzeigen aus? Dann bist du bei uns genau richtig. Zur Unterstützung unseres Teams suchen wir eine motivierte Person, die unsere Social Media Kanäle mit Leben füllt – und vor allem performante Ads schaltet. Aufgaben Planung, Erstellung und Betreuung von Social Media Ads (Meta Ads – Facebook &#x26; Instagram, TikTok Ads, LinkedIn Ads) Analyse und Optimierung laufender Kampagnen (Performance, Zielgruppen, Budgets) Unterstützung bei der Pflege und dem Posten von organischen Beiträgen auf unseren Kanälen Enge Abstimmung mit unserem Team zu Inhalten, Zielen und Budgeteinsatz Qualifikation Erste Erfahrung im Schalten und Auswerten von Social Media Ads (z. B. aus Studium, Agentur oder Projekten) Verständnis für Zielgruppen, Conversion und Kampagnenstrukturen Gespür für gutes Design und ansprechende Texte Eigenständige, strukturierte Arbeitsweise und Freude an digitalen Themen Laptop/PC bereits vorhanden Benefits Flexible Arbeitszeiten (Werkstudent oder Teilzeit – ca. 20-25 Stunden/Woche) Möglichkeit zur remote Arbeit Eigenverantwortliches Arbeiten mit viel Gestaltungsspielraum Ein freundliches, offenes Team und kurze Entscheidungswege Interesse geweckt? Dann freuen wir uns auf deine Bewerbung mit kurzem Lebenslauf und ggf. Referenzen oder Beispielen bisheriger Kampagnen. Bitte sende alles per E-Mail an [deine Mailadresse] mit dem Betreff „Social Media Ads Manager (m/w/d) Find Jobs in Germany on Arbeitnow"
Arbeitnow API,https://www.arbeitnow.com/jobs/companies/bruggen-engineering-gmbh/projektingenieur-lichtsignalanlagen-in-mannheim-1587-18692,2026-05-20T07:30:32,BRÜGGEN ENGINEERING GmbH,Projektingenieur (m/w/d) Lichtsignalanlagen in Mannheim (1587),Engineering,Mannheim,,Engineering,"Ihre Karriere in der Verkehrstechnik. Gestalten Sie mit BRÜGGEN ENGINEERING die Zukunft des öffentlichen Nahverkehrs und tragen Sie zur Optimierung moderner Verkehrslösungen bei. Als Projektingenieur (m/w/d) übernehmen Sie die Planung, Entwicklung und Inbetriebnahme innovativer Lichtsignalanlagen zur Bevorrechtigung des ÖPNV. Mit Ihrer Expertise sorgen Sie für eine effiziente Verkehrssteuerung und unterstützen Kommunen bei der Stadt- und Verkehrsplanung. Aufgaben Planung &#x26; Entwicklung: Konzeption, Planung und Umsetzung von Projekten zur Priorisierung des ÖPNV auf Stadtbahn- und Buslinien. Technische Steuerung: Planung und Begleitung neuer oder geänderter Lichtsignalsteuerungen bis zur Inbetriebnahme. Stadtplanung: Erarbeitung von Stellungnahmen zur Verkehrs- und Stadtplanung mit Fokus auf den ÖPNV. Umsteigeanlagen: Mitarbeit an der Konzeption und Detailplanung von Umsteigeanlagen unter Berücksichtigung der Verkehrssicherheit. Optimierung: Auswertung und Verbesserung von Schaltfolgen sowie Verknüpfung von Verkehrsrechnern. Genehmigungsmanagement: Sicherstellung der Einhaltung behördlicher Vorgaben und Auflagen. Qualifikation Qualifikation: Abgeschlossenes Studium im Bau-, Verkehrs- oder Elektroingenieurwesen (Bachelor oder vergleichbar). Softwarekenntnisse: Versierter Umgang mit MS Office, SAP und CAD-Tools. Kompetenzen: Präsentations- und Moderationsfähigkeiten sowie analytisches und konzeptionelles Denkvermögen. Arbeitsweise: Selbstständige, zielorientierte und strukturierte Arbeitsweise. Soft Skills: Ausgeprägte Kommunikationsstärke und Teamfähigkeit. Benefits Attraktive Konditionen: Freuen Sie sich auf eine unbefristete Vollzeitstelle bei BRÜGGEN ENGINEERING in Mannheim, mit einer Vergütung, die Ihre Expertise würdigt. Innovationsführerschaft: Arbeiten Sie an spannenden Verkehrs- und Stadtplanungsprojekten mit direkter Relevanz für den ÖPNV. Dynamisches Team: Werden Sie Teil eines Teams, das Wert auf persönliches Wachstum und eine Kultur der Unterstützung und Förderung legt. Wir freuen uns auf Ihre aussagekräftigen Bewerbungsunterlagen mit Angabe Ihres frühesten Starttermins und Ihrer Gehaltsvorstellung. Ihr Ansprechpartner für Ihre Bewerbung ist: Dipl.-Ing. (FH) Christian Bitz Find more English Speaking Jobs in Germany on Arbeitnow"
Arbeitnow API,https://www.arbeitnow.com/jobs/companies/bruggen-engineering-gmbh/projektleiter-verkehrsanlagen-in-mannheim-1588-52428,2026-05-20T07:30:32,BRÜGGEN ENGINEERING GmbH,Projektleiter (m/w/d) Verkehrsanlagen in Mannheim (1588),Engineering,Mannheim,,Engineering,"Ihre Karriere in der Verkehrstechnik. Ihre Karriere bei BRÜGGEN ENGINEERING in der Planung und Umsetzung moderner Infrastrukturprojekte – gestalten Sie mit uns die Mobilität von morgen. Als Projektleiter (m/w/d) im Bereich Verkehrsanlagen steuern Sie anspruchsvolle Projekte zur Optimierung des öffentlichen Nahverkehrs (ÖPNV) und übernehmen Verantwortung für deren Planung, Entwicklung und Realisierung. Mit Ihrem organisatorischen Geschick und Ihrer Kommunikationsstärke sorgen Sie für reibungslose Abläufe und eine erfolgreiche Projektumsetzung. Aufgaben Projektentwicklung: Konzeption und Planung von Projekten zur Bevorrechtigung des ÖPNV bei Stadtbahn- und Buslinien. Planungsbegleitung: Unterstützung und Überwachung der Umsetzung neuer oder geänderter Lichtsignalsteuerungen bis zur Inbetriebnahme. Projektsteuerung: Koordination von Bau-, Betriebs- und Instandhaltungsmaßnahmen sowie Überwachung von Fremdleistungen hinsichtlich Qualität, Kosten und Terminvorgaben. Prüfung &#x26; Budgetkontrolle: Prüfung von Bauunterlagen und Sicherstellung der Einhaltung von Budget-, Zeit- und Qualitätszielen. Genehmigungsmanagement: Sicherstellung der Einhaltung aller behördlichen Vorgaben und Auflagen. Qualifikation Qualifikation: Abgeschlossenes Studium im Bau-, Verkehrs- oder Elektroingenieurwesen (Master oder vergleichbar) mit Erfahrung im ÖPNV und der Planung von Lichtsignalanlagen. Fachkenntnisse: Sicherer Umgang mit MS Office und erste Erfahrung in der Leitung von Projekten. Kompetenzen: Analytisches Denkvermögen, Planungs- und Organisationsgeschick. Soft Skills: Teamfähigkeit, souveränes Auftreten und ausgeprägte Kommunikationsstärke. Benefits Attraktive Konditionen: Freuen Sie sich auf eine unbefristete Vollzeitstelle bei BRÜGGEN ENGINEERING in Mannheim, mit einer Vergütung, die Ihre Expertise würdigt. Innovationsführerschaft: Arbeiten Sie an spannenden Verkehrsprojekten, die den ÖPNV zukunftssicher gestalten. Dynamisches Team: Werden Sie Teil eines Teams, das Wert auf persönliches Wachstum und eine Kultur der Unterstützung und Förderung legt. Wir freuen uns auf Ihre aussagekräftigen Bewerbungsunterlagen mit Angabe Ihres frühesten Starttermins und Ihrer Gehaltsvorstellung. Ihr Ansprechpartner für Ihre Bewerbung ist: Dipl.-Ing. (FH) Christian Bitz Find more English Speaking Jobs in Germany on Arbeitnow"
Arbeitnow API,https://www.arbeitnow.com/jobs/companies/fork-unstable-media/senior-backend-developer-hamburg-178358,2026-05-20T07:30:32,Fork Unstable Media,Senior Backend Developer (m/w/d),Marketing and Communication,Hamburg,berufserfahren,Marketing and Communication,"Du hast Lust auf kreative und herausfordernde Projekte? Dann bist du als erfahrene:r Backend Entwickler:in (m/w/d) in unserem Team an einem unserer Standorte in Hamburg oder Berlin genau richtig. Fork ist eine Agentur für digitale Lebensaspekte. Wir schaffen besondere Erlebnisse, die Herzen und Köpfe gewinnen, indem wir maßgeschneiderte Systeme, die mit unseren Kund:innen wachsen, entwickeln. Wir suchen begabte und sympathische Forkies - Frauen, Männer und alle Gendersternchen dazwischen oder darüber hinaus - um gemeinsam spannende Projekte zu entwickeln. Aufgaben Konzeption und Entwicklung von wartbaren Software-Architekturen im Team, basierend auf aktuellen Webstandards Identifizierung und Vorantreiben von Optimierungspotenzialen in Projekten und Prozessen Arbeiten in einem interdisziplinären Umfeld Freiraum für deine Weiterentwicklung und eigene Ideen Flexibles Arbeiten ist für uns selbstverständlich Transparente Firmen-Kommunikation und offene Feedback-Kultur Auseinandersetzung mit zukunftsfähigen Technologien und Methoden, die kontinuierlich in unseren Dev-Stack integriert werden Viel Humor, Empathie und guten Musikgeschmack Regelmäßige Team-Events TechTime: Monatlich frei einteilbare Zeit, um sich an unseren internen Standards oder der Entwicklung unserer Infrastruktur zu beteiligen oder sich weiterzubilden Qualifikation Langjährige Praxis in der Software-Entwicklung (idealerweise 5+ Jahre) mit Fokus auf komplexe PHP-Projekte Fundierte Kenntnisse in PHP-Frameworks wie Symfony oder Laravel Expertise in Ibexa DXP, TYPO3 oder Craft CMS sowie die Erfahrung, komplexe Plattform-Strukturen effizient und nachhaltig aufzusetzen Routine in der Serveradministration, Docker-Umgebungen und dem Aufbau automatisierter CI/CD-Pipelines Praxisnahe Expertise in der Anbindung von Drittsystemen (ERP, PIM, CRM) via REST- oder GraphQL-Schnittstellen Ein tiefes Verständnis für Clean Code, objektorientierte Programmierung und agile Entwicklungsmethoden Souveränität als technischer Sparringspartner für unsere Projektleiter und Kunden – von der ersten Evaluierung bis zur verständlichen Vermittlung komplexer Lösungen Echte Leidenschaft für Web-Technologien sowie den Drive, eigene Ideen in einem innovativen Team selbstständig voranzutreiben Eine strukturierte Arbeitsweise mit einem klaren Fokus auf lösungsorientierte Ergebnisse Weil du bei uns genau so sein darfst, wie du bist. Neben flexiblen Arbeitszeitmodellen, agilen Arbeitsmethoden und integrierten Projekten erwartet dich bei uns ein umfangreiches Weiterbildungsangebot und Führungskräfte auf Augenhöhe. Werde jetzt Teil unserer inhabergeführten Agenturgruppe und erfinde mit uns zusammen Kommunikation jenseits der ausgetretenen Pfade neu. Find Jobs in Germany on Arbeitnow"
Arbeitnow API,https://www.arbeitnow.com/jobs/companies/fork-unstable-media/senior-fullstack-developer-hamburg-489317,2026-05-20T07:30:32,Fork Unstable Media,Senior Fullstack Developer (m/w/d),Marketing and Communication,Hamburg,berufserfahren,Marketing and Communication,"Lust auf kreative und herausfordernde Projekte im Bereich Web-Technologien? Wir suchen erfahrene Fullstack Entwickler:innen (m/w/d) für unser Team in Hamburg, Berlin oder Köln. Fork ist eine Agentur, die 1996 gegründet wurde, seit 2011 zur fischerAppelt-Gruppe gehört und auf Brand Design und Brand Technology spezialisiert ist. Wir suchen begabte und sympathische Forkies, um gemeinsam spannende Projekte zu entwickeln. Aufgaben Verantwortung: Konzeption und Entwicklung wartbarer, skalierbarer Software-Architekturen Teamwork: Enger Austausch mit Konzeption und Design in einem modernen, agilen Umfeld Innovation: Kontinuierliche Auseinandersetzung mit innovativen Technologien für unseren Dev-Stack Entwicklung: Freiraum für deine Ideen, regelmäßige Weiterbildung und transparente Feedback-Kultur TechTime: Monatlich frei einteilbare Zeit für interne Standards, Infrastruktur oder deine persönliche Fortbildung Kultur: Hybrides Arbeiten, regelmäßige Events sowie viel Humor, Empathie und guter Musikgeschmack Qualifikation Erfahrung: Praxis in der Fullstack-Entwicklung und Souveränität in komplexen Architekturfragen Tech-Stack : Fundierte Kenntnisse in HTML, CSS, JavaScript, TypeScript sowie modernen Frameworks wie React und Next.js Modern Web: Sicherer Umgang mit Headless CMS, API-First-Architekturen und modernen Deployment-Workflows Design-Verständnis: Du hast ein tiefes UX/UI-Verständnis und arbeitest kreative Konzepte gemeinsam mit unserem Design-Team technisch aus Sparringspartner: Du berätst intern und extern – von der ersten Evaluierung bis zur Vermittlung komplexer Lösungen Arbeitsweise: Eigeninitiative, lösungsorientiertes Denken und die Lust, technische Standards aktiv mitzugestalten Kommunikation: Sehr gute Deutschkenntnisse sowie eine klare, präzise Ausdrucksweise zeichnen dich aus Es macht Spaß, mit uns zusammenzuarbeiten. Wir bieten Brot-und-Butter-Jobs und steile Lernkurven. Wir unterstützen Dich bei Deiner persönlichen Entwicklung und bringen gemeinsam das große Ganze voran. Neben flexiblen Arbeitszeitmodellen, agilen Arbeitsmethoden und integrierten Projekten erwartet dich bei uns ein umfangreiches Weiterbildungsangebot. Find more English Speaking Jobs in Germany on Arbeitnow"
Arbeitnow API,https://www.arbeitnow.com/jobs/companies/fritz-graefer-gmbh-co-kg/fachberater-im-innendienst-fur-werkzeuge-und-oder-baubeschlag-fur-unsern-standort-gartringen-32602,2026-05-20T07:30:31,FRITZ GRAEFER GmbH & Co. KG,Fachberater im Innendienst (m/w/d) für Werkzeuge und/oder Baubeschlag für unsern Standort Gärtringen,Customer Service,Gärtringen,,Customer Service,"Graefer steht seit über 90 Jahren für Verlässlichkeit, Fachkompetenz und gelebte Partnerschaft. Als traditionsreiches Unternehmen in Mülheim an der Ruhr und weiteren Standorten in Bonn , Gärtringen und Neu-Ulm beliefern wir Handwerk, Industrie, Behörden und Kommunen mit hochwertigen Eisenwaren, Baubeschlägen, Werkzeugen, Arbeitsschutz und Sicherheitstechnik. Unsere lange Unternehmensgeschichte ist geprägt von Beständigkeit, Qualität und dem Anspruch, unseren Kunden jeden Tag die bestmögliche Lösung zu bieten. Genauso wichtig wie unsere Kunden sind uns die Menschen, die hinter diesem Erfolg stehen. Als Arbeitgeber legen wir großen Wert auf ein Arbeitsumfeld, in dem sich jeder wohlfühlt und seine Stärken einbringen kann. Ein respektvoller Umgang miteinander, flache Hierarchien und kurze Entscheidungswege prägen unsere Zusammenarbeit. Wir fördern individuelle Entwicklungsmöglichkeiten und unterstützen unsere Mitarbeitenden dabei, ihre Fähigkeiten kontinuierlich auszubauen und Verantwortung zu übernehmen. Was uns besonders auszeichnet, ist unser familiäres Miteinander: Viele unserer Mitarbeitenden sind seit vielen Jahren Teil des Teams – ein Zeichen für Vertrauen, Wertschätzung und ein Arbeitsklima, in dem man gerne bleibt. Bei Graefer arbeiten Menschen, die anpacken, sich gegenseitig unterstützen und gemeinsam etwas bewegen wollen. Für den nächstmöglich Zeitpunkt suchen wir eine/n Fachberater im Innendienst (m/w/d) für Werkzeuge und/oder Baubeschlag für unseren Standort Gärtringen . Aufgaben Durchführung aktiver und individueller telefonischer Kundenbetreuung und -beratung Beratung in Kundenanfragen und Ausarbeitung individueller Lösungen Angebotserstellung, Auftragsannahme und -abwicklung Aufnahme und Abwicklung von Retouren, Gutschriften, Reklamationen und Reparaturen enge Zusammenarbeit mit unserem Vertriebsaußendienst Qualifikation eine abgeschlossene kaufmännische Berufsausbildung Warenkenntnisse in den oben genannten Fachbereichen Betriebswirtschaftliches Verständnis sicherer Umgang mit dem Computer kundenorientierte Arbeitsweise Zuverlässigkeit, Gewissenhaftigkeit und Teamfähigkeit gute Kommunikationsfähigkeit Benefits erforderlichen Handlungsspielraum bei leistungsgerechtem Gehalt, vermögenswirksame Leistungen und betriebliche Altersvorsorge einen attraktiven Arbeitsplatz mit einem herausfordernden Aufgabengebiet einen unbefristeten Arbeitsvertrag mit guten Zukunftsperspektiven die Möglichkeit viel Verantwortung zu übernehmen ein kollegiales Team das sich auf Ihre Unterstützung freut Corporate Benefits Mitarbeiterrabatte Sie sind interessiert und suchen eine abwechslungsreiche und langfristige Beschäftigung? Dann freuen wir uns über Ihre vollständigen Bewerbungsunterlagen mit Lebenslauf und Anschreiben unter Angabe Ihres frühstmöglichen Eintrittstermins und Ihrer Gehaltsvorstellungen. Find Jobs in Germany on Arbeitnow"
Arbeitnow API,https://www.arbeitnow.com/jobs/companies/mkp-gmbh/projektmanager-vertragsmanagement-weimar-110525,2026-05-20T07:30:30,MKP GmbH,Projektmanager (m/w/d) Vertragsmanagement,Project Management,Weimar,berufserfahren,Project Management,"Gestalten Sie Projekte ganzheitlich – von der Akquise bis zum Abschluss. In dieser Rolle verbinden Sie Technik, Wirtschaft und Vertragsmanagement und übernehmen eine zentrale Funktion in der erfolgreichen Steuerung unserer Projekte. Sie arbeiten eng mit Projektleitung und Management zusammen und entwickeln sich – je nach Erfahrung – Schritt für Schritt oder direkt zu einer wichtigen Schnittstelle im Unternehmen. Aufgaben Unterstützung der fachlichen Projektleitung bei Angebotserstellung, Kalkulation und Vertragsprüfung (HOAI, VOB, BGB) Mitwirkung bei Vertragsgestaltung und Vertragsverhandlungen Projektcontrolling (Kosten, Stunden, Leistungsfortschritt) auf Projekt- und Teamebene Unterstützung im Nachtrags- und Claimmanagement Nachkalkulation und kaufmännische Projektauswertung Qualifikation Ein erfolgreich abgeschlossenes Studium des Wirtschaftsingenieurwesens, des Bauingenieurwesens oder ein betriebswirtschaftliches Studium Im Idealfall verfügen Sie über mehrjährige Praxis im Bauprojektmanagement sowie im Vertrags- oder Claimmanagement Engagierte Absolventinnen und Absolventen mit ersten Praxiserfahrungen sind ebenso willkommen Analytische, strukturierte und eigenständige Arbeitsweise Teamfähigkeit und sicheres Auftreten Sehr gute Deutschkenntnisse in Wort und Schrift (mindestens Niveau C1) zur sicheren Kommunikation mit Auftraggebern Benefits Einstiegsmöglichkeiten für Absolventinnen und Absolventen sowie Perspektiven für Berufserfahrene Spannende Projekte mit Entwicklungsmöglichkeiten im Projekt- und Vertragsmanagement Enge Zusammenarbeit mit Projektleitung und Management Individuelle Arbeitsmodelle in Bezug auf Arbeitszeit und Arbeitsort Zusatzleistungen wie betriebliches Gesundheitsmanagement, Fahrradleasing oder Jobticket Wertschätzende Unternehmenskultur sowie regelmäßige Firmenveranstaltungen und Teamevents Gemeinsam schaffen wir Lösungen, die Zukunft tragen. Schicken Sie uns Ihre Bewerbung bitte mit Anschreiben, Lebenslauf und Zeugnissen (alle im PDF Format). Find Jobs in Germany on Arbeitnow"
Arbeitnow API,https://www.arbeitnow.com/jobs/companies/cigus-gmbh/softwareentwickler-ki-produktionsautomatisierung-aalen-134235,2026-05-20T07:20:14,cigus GmbH,Softwareentwickler KI & Produktionsautomatisierung (m/w/d),Engineering,Aalen,"Full-time permanent, entry",Engineering; master's degree,"Hochtechnologie und Innovation... …aktiv mitgestalten und vorantreiben – für diese Position suchen wir eine engagierte Persönlichkeit (m/w/d), die mit Ideenreichtum, Verantwortungsbewusstsein und fachlicher Kompetenz überzeugt. Als Beratungsunternehmen unterstützen wir unseren Kunden bei der Suche nach einer passenden Person, die Herausforderungen nicht als Hürde, sondern als spannende Möglichkeit zur Weiterentwicklung versteht. Das erwartet dich: Entwicklung von Algorithmen zur Automatisierung und Standardisierung industrieller Produktionsprozesse Steuerung und Überwachung der Softwareentwicklung für automatisierte Produktionsanlagen der Brillenglasfertigung Entwicklung und Optimierung von Modulen zur KI-basierten Bilderkennung und Bildauswertung Durchführung von Code Reviews sowie Optimierung bestehender Anwendungen in Python und C# Definition der Softwarearchitektur für industrielle Vision- und Machine-Learning-Systeme Qualifizierung, Validierung und Verifizierung von Softwarelösungen gemäß definierten Qualitätsprozessen Unterstützung bei Schnittstellen- und Randbedingungen für Machine Learning und KI-basierte Systeme Für diese Position sind bestimmte fachliche und persönliche Voraussetzungen hilfreich. Die folgenden Anforderungen geben dir einen Überblick darüber, welche Erfahrungen und Eigenschaften für diese Rolle von Vorteil sind. Was du mitbringen solltest: Bachelor- oder Masterabschluss in Informatik , Physik oder Software Engineering Erfahrung in DevOps sowie idealerweise Softwareentwicklung im industriellen Fertigungsumfeld Solide Kenntnisse in Python , C, C++, C# (.NET/.NET Core) und Microsoft Azure Erfahrung mit Performance-Optimierung von Softwarelösungen bis zur Serienreife Kenntnisse in Softwarearchitektur , Maschinenschnittstellen und industriellen Kommunikationsprotokollen Grundkenntnisse in Client-/Server-Programmierung, Steuerungstechnik und MS SQL Server Verständnis für Secure Coding , cloudbasierte Lösungen und agile Entwicklungsmethoden wie Scrum Find Jobs in Germany on Arbeitnow"
Arbeitnow API,https://www.arbeitnow.com/jobs/companies/clockin-gmbh/senior-software-architect-all-genders-munster-382572,2026-05-20T07:20:14,clockin GmbH,Senior Software Architect (all genders),Information technology,Münster,"Full-time permanent, mid",Information technology; high school or equivalent,"Als Senior Software Architect prägst du clockins Architektur hands-on: Du entscheidest, was technisch trägt, treibst AI-First und Internationalisierung voran und gibst unserem Engineering-Team das Fundament für skalierbares Wachstum. Deine Aufgaben Du triffst zentrale Architektur- und Design-Entscheidungen, holst Input aus dem Engineering-Team ein und stimmst strategische Themen gemeinsam mit dem CTO ab. Du verbesserst die Struktur unserer Laravel-Codebase etablierst klare Modul-Interfaces sowie einen Service Layer für mehr Wartbarkeit und Testbarkeit. Du entwirfst die Architektur für unsere Internationalisierung und geographische Expansion, inklusive der Entscheidung zur globalen Authentication-Strategie. Du baust unsere AI- und Agent-Infrastruktur für Workflow-Automation und MCP aus und schaffst damit die Grundlage für schnelle, sichere AI-Features. Für Integrationen zu Drittsystemen entwickelst du eine event-driven Architektur. Du dokumentierst Architektur und Entscheidungen pragmatisch und maschinenlesbar (ADRs, C4), führst Code- und Design-Reviews durch und entwickelst das Engineering-Team fachlich weiter. Das bringst du mit Du bringst mehrjährige Erfahrung als Software Architect, Lead Engineer oder Staff Engineer in skalierenden SaaS-Produkten mit. Moderne Backend-Architekturen, Modularisierung, Domain-Driven Design und Service-Layer-Patterns sind dein Zuhause. Praxiserfahrung mit einem Hyperscaler (idealerweise AWS) gehört zu deinem Werkzeugkasten, Laravel/PHP, TypeScript und Python sind ein klares Plus. AI-Coding-Tools wie Claude Code nutzt du täglich und hast bereits Erfahrung im Design AI-naher Systeme (Agents, Tool/Function Calling, MCP, RAG). Erfahrung mit event-driven Architekturen, globaler Infrastruktur oder ausgelagerten Auth-Lösungen (Auth0, Cognito, WorkOS) macht dich für uns besonders interessant. Du überzeugst durch Argument und Substanz, triffst Entscheidungen unter Unsicherheit und baust bei wichtigen Themen auch selbst Prototypen. Sehr gute Deutsch- und Englischkenntnisse runden dein Profil ab. Unsere Benefits Unbefristete Festanstellung Home-Office Möglichkeit, flexible Arbeitszeiten Betriebliche Altersvorsorge Modernste Ausstattung (MacBook, Google) und höhenverstellbare Tische Strukuriertes Onboarding inkl. Buddy Dienstrad Prepaid Gutscheinkarte EGYM Wellpass Corporate Benefits Weiterbildungsangebote Kostenlose Getränke und Snacks Kostenlose Parkplätze Regelmäßige Teamevents (Teamfrühstück, Weihnachts- und Sommerfeiern, monatliche clockin Events) Find more English Speaking Jobs in Germany on Arbeitnow"
