source,source_url,date_posted,company,title,category,location,job_type,tags_raw,description
Arbeitnow API,https://www.arbeitnow.com/jobs/companies/my-humancapital-gmbh/objektverwalter-facility-management-munich-435043,2026-05-04T14:30:34,MY Humancapital GmbH,Objektverwalter Facility Management (m/w/d),Building,Munich,,Building; Supply; Safety Services Engineering,"Im Auftrag unseres Partnerunternehmens in München suchen wir Sie zum nächstmöglichen Zeitpunkt als „Objektleiter (m/w/d) Facility Management“. Aufgaben Als Objektleiter Facility Management (m/w/d) verantworten Sie den technischen Betrieb von Immobilien inkl. Betreiberpflichten und Compliance Zudem führen und steuern Sie das Technikteam, planen Einsätze und koordinieren Ressourcen effizient Auch organisieren Sie Instandhaltungs-, Umbau- und Reparaturmaßnahmen inklusive Qualitätssicherung und Budgetsteuerung Darüber hinaus entwickeln Sie Prozesse, Instandhaltungsstrategien und stellen die Einhaltung gesetzlicher Vorschriften sicher Zusätzlich übernehmen Sie Reporting, stimmen sich regelmäßig mit Auftraggebern ab und fungieren als zentrale Schnittstelle zu Behörden Qualifikation Sie verfügen über eine technische Ausbildung oder ein Studium, z. B. im Facility Management, Bauingenieurwesen, Elektrotechnik oder eine vergleichbare Qualifikation Zudem bringen Sie mehrjährige Erfahrung als technischer Objektverwalter (m/w/d), technischer Property Manager (m/w/d) oder Leiter (m/w/d) Facility Management oder einem ähnlichen Bereich Auch besitzen Sie fundierte Kenntnisse relevanter Vorschriften, Normen sowie im Bereich Arbeitssicherheit und Betreiberverantwortung Darüber hinaus überzeugen durch Organisationstalent und Entscheidungsstärke Zudem arbeiten Sie sicher mit MS Office und CAFM-Systemen und besitzen einen Führerschein der Klasse B Benefits Work-Life-Balance : Freuen Sie sich auf flexible Arbeitszeiten im Gleitzeitmodell Moderne Ausstattung: Moderne Büroräumlichkeiten mit neuster technischer Ausstattung Onboarding : Ihre erfahrenen Kollegen stehen Ihnen während der Einarbeitung mit Rat und Tat zur Seite Teamspirit: Familiäres Umfeld, sympathische Kollegen und ein wertschätzendes Miteinander Vielseitigkeit : Freuen Sie sich aufspannende und abwechslungsreiche Tätigkeiten in einem dynamischen Umfeld Sie finden das Stellenprofil interessant? Dann freuen wir uns auf Ihre Bewerbung. Senden Sie uns Ihre Unterlagen. Für Rückfragen steht Ihnen Simon Schneider gerne unter 089 954 287 111 zur Verfügung. Find more English Speaking Jobs in Germany on Arbeitnow"
Arbeitnow API,https://www.arbeitnow.com/jobs/companies/heiko-ulrich/datenerfasser-in-engen-296976,2026-05-04T14:30:34,Heiko Ulrich,Datenerfasser/in,Private Banking,Engen,"Side, berufseinstieg",Private Banking,"Due liebst den Kontakt mit Menschen, arbeitest präzise und möchstest neben deinem Hauptberuf finanziell wachsen? Dann haben wir etwas für dich. Hier spielt es keine Rolle woher du kommst oder wo du stehst, es geht nur darum wo du hin willst. Du Hilfst leidenschaftlich gerne Menschen und möchtest Teil eines wachsenden Teams sein, mit viel Spiel, Spaß und Spannung, dann bist du bei uns richtig. Aufgaben Sorgfältige Datenaufnahme von Kundendaten Einarbeitung in unsere internen Analysetools Teilnahme an Team-Calls und Workshops Qualifikation Zuverlässige und selbstständige Arbeitsweise Hohe Lernbereitschaft und Motivation Erste Erfahrungen mit digitalen Anwendungen von Vorteil PC, Laptop oder Tablet sowie stabile Internetverbindung Benefits Flexible Arbeitszeiten – arbeite wann und wo du willst Attraktive Vergütung ab 25 € pro Stunde Leistungsorientiertes Einkommen mit Entwicklungspotenzial Strukturierte Einarbeitung – auch ohne Vorkenntnisse Persönliche Betreuung und regelmäßige Coachings (Fachwissen &#x26; Mindset) Viele warten auf den perfekten Moment – doch der kommt selten. Wer wirklich etwas verändern will, fängt an und entwickelt sich unterwegs weiter. Genau dabei unterstützen wir dich. „Warte nicht auf Chancen – erschaffe sie dir.“ Find Jobs in Germany on Arbeitnow"
Arbeitnow API,https://www.arbeitnow.com/jobs/companies/zimmermann-brase-partner-steuerberatungsgesellschaft-mbb/werkstudent-fur-ki-rpa-zur-prozessoptimierung-karlsruhe-86556,2026-05-04T14:30:34,Zimmermann-Brase + Partner Steuerberatungsgesellschaft mbB,Werkstudent für KI & RPA zur Prozessoptimierung (m/w/d),IT,Karlsruhe,Working student,IT,"Unsere Story – gewachsen aus Überzeugung. Es gibt Überzeugungen, die bleiben und genau das macht uns aus. Schon unsere Gründerin Martina Zimmermann-Brase hat früh daran geglaubt, dass man in der Steuerberatung mehr erreichen kann, wenn man Menschen ehrlich begegnet, Verantwortung teilt und gemeinsam anpackt. Auf dieser Basis sind wir in den letzten drei Jahrzehnten Schritt für Schritt von einer Einzelkanzlei zu einem Team aus über 30 Kollegen an unseren zwei Standorten in Karlsruhe-Neureut und Pfinztal gewachsen. Genauso überzeugt sind wir davon, dass die Zukunft der Steuerberatung digital ist. Mit Emma, unserer RPA-Lösung, und dem gezielten Einsatz von KI gestalten wir unsere Verwaltungsprozesse schlanker, schneller und smarter. In dieser Struktur bekommst Du die Chance, an realen Automatisierungsprojekten mitzuarbeiten, eigene Ideen einzubringen und praktisch zu erleben, wie KI und RPA in einer Kanzlei wirklich funktionieren. Dabei gilt für Dich derselbe Anspruch wie für alle bei uns: Wir arbeiten nur mit Menschen zusammen, mit denen es wirklich passt. Denn gute Arbeit entsteht dort, wo jede Stimme zählt und man gemeinsam Lösungen entwickelt. Unabhängig davon, ob Du zwei Jahrzehnte oder zwei Semester Erfahrung mitbringst. Aufgaben Deine Rolle – Aufgaben mit Vielfalt und Tiefe. Bei uns bist Du als Werkstudent (m/w/d) nicht für reine Hilfsarbeiten da, sondern fester Bestandteil unseres Teams für Digitalisierung und Prozessoptimierung. Gemeinsam mit erfahrenen Kollegen analysierst Du Abläufe, hilfst dabei, KI- und RPA-Lösungen weiterzuentwickeln und siehst direkt, wie aus Deinen Ideen echte Verbesserungen im Kanzleialltag werden. Wir hören zu, trauen Dir Verantwortung zu und geben Dir regelmäßig Feedback, damit Du an Deinen Aufgaben wachsen kannst – fachlich wie persönlich, im richtigen Tempo neben Deinem Studium. Zu Deinen Aufgaben gehören unter anderem: Unterstützung bei der Analyse und Optimierung von Verwaltungsprozessen Mitarbeit bei der Implementierung und Weiterentwicklung von KI- und RPA-Lösungen Dokumentation und Testing von automatisierten Prozessen Allgemeine Unterstützung im Projektmanagement Qualifikation Dein Profil – fachlich stark, menschlich passend. Uns ist wichtig, dass Du Dich in unserer Art zu arbeiten wiederfindest. Bei uns geht es um klare Strukturen ohne Chaos, um ein Team, in dem Feedback ernst genommen wird, und um die Möglichkeit, Dich einzubringen, so, wie es zu Dir passt. Entscheidend ist nicht, dass Du schon alles kannst – entscheidend ist, dass Du neugierig bist, sorgfältig arbeitest und Lust hast, Dich gemeinsam mit uns in das Thema KI und Prozessautomatisierung reinzudenken. Studium im Bereich Wirtschaftsinformatik, Informatik, BWL oder vergleichbar Interesse an KI, Automatisierung und digitalen Prozessen Strukturierte und selbstständige Arbeitsweise Erste Kenntnisse in RPA oder Programmierung sind von Vorteil, aber kein Muss Benefits Deine Benefits – mehr als ein Arbeitsplatz. Bei uns wirst Du von Anfang an als vollwertiges Teammitglied gesehen. Wir möchten Dich in die Welt der Steuerberatung einführen und Dir zeigen, wie vielseitig dieser Beruf ist. Dabei unterstützen wir Dich individuell und sorgen dafür, dass Du fachlich wie persönlich wachsen kannst. Und natürlich profitierst Du bei uns auch von vielen Vorteilen, die den Unterschied machen: Spannende Einblicke in moderne Automatisierungstechnologien Flexible Arbeitszeiten (ideal neben dem Studium) Möglichkeit, praktische Erfahrung in einem zukunftsorientierten Bereich zu sammeln Mitarbeit an realen Projekten mit direktem Impact Kontakt: Dein Kontakt – einfach und direkt. Klingt nach einem Umfeld, das zu Dir passt? Dann freuen wir uns darauf, Dich kennenzulernen und bald von Dir zu hören. Deine Ansprechpartnerin: Alexandra Hübner HR Find more English Speaking Jobs in Germany on Arbeitnow"
Arbeitnow API,https://www.arbeitnow.com/jobs/companies/zimmermann-brase-partner-steuerberatungsgesellschaft-mbb/werkstudent-fur-ki-rpa-zur-prozessoptimierung-pfinztal-407530,2026-05-04T14:30:33,Zimmermann-Brase + Partner Steuerberatungsgesellschaft mbB,Werkstudent für KI & RPA zur Prozessoptimierung,IT,Pfinztal,Working student,IT,"Unsere Story – gewachsen aus Überzeugung. Es gibt Überzeugungen, die bleiben und genau das macht uns aus. Schon unsere Gründerin Martina Zimmermann-Brase hat früh daran geglaubt, dass man in der Steuerberatung mehr erreichen kann, wenn man Menschen ehrlich begegnet, Verantwortung teilt und gemeinsam anpackt. Auf dieser Basis sind wir in den letzten drei Jahrzehnten Schritt für Schritt von einer Einzelkanzlei zu einem Team aus über 30 Kollegen an unseren zwei Standorten in Karlsruhe-Neureut und Pfinztal gewachsen. Genauso überzeugt sind wir davon, dass die Zukunft der Steuerberatung digital ist. Mit Emma, unserer RPA-Lösung, und dem gezielten Einsatz von KI gestalten wir unsere Verwaltungsprozesse schlanker, schneller und smarter. In dieser Struktur bekommst Du die Chance, an realen Automatisierungsprojekten mitzuarbeiten, eigene Ideen einzubringen und praktisch zu erleben, wie KI und RPA in einer Kanzlei wirklich funktionieren. Dabei gilt für Dich derselbe Anspruch wie für alle bei uns: Wir arbeiten nur mit Menschen zusammen, mit denen es wirklich passt. Denn gute Arbeit entsteht dort, wo jede Stimme zählt und man gemeinsam Lösungen entwickelt. Unabhängig davon, ob Du zwei Jahrzehnte oder zwei Semester Erfahrung mitbringst. Aufgaben Deine Rolle – Aufgaben mit Vielfalt und Tiefe. Bei uns bist Du als Werkstudent (m/w/d) nicht für reine Hilfsarbeiten da, sondern fester Bestandteil unseres Teams für Digitalisierung und Prozessoptimierung. Gemeinsam mit erfahrenen Kollegen analysierst Du Abläufe, hilfst dabei, KI- und RPA-Lösungen weiterzuentwickeln und siehst direkt, wie aus Deinen Ideen echte Verbesserungen im Kanzleialltag werden. Wir hören zu, trauen Dir Verantwortung zu und geben Dir regelmäßig Feedback, damit Du an Deinen Aufgaben wachsen kannst – fachlich wie persönlich, im richtigen Tempo neben Deinem Studium. Zu Deinen Aufgaben gehören unter anderem: Unterstützung bei der Analyse und Optimierung von Verwaltungsprozessen Mitarbeit bei der Implementierung und Weiterentwicklung von KI- und RPA-Lösungen Dokumentation und Testing von automatisierten Prozessen Allgemeine Unterstützung im Projektmanagement Qualifikation Dein Profil – fachlich stark, menschlich passend. Uns ist wichtig, dass Du Dich in unserer Art zu arbeiten wiederfindest. Bei uns geht es um klare Strukturen ohne Chaos, um ein Team, in dem Feedback ernst genommen wird, und um die Möglichkeit, Dich einzubringen, so, wie es zu Dir passt. Entscheidend ist nicht, dass Du schon alles kannst – entscheidend ist, dass Du neugierig bist, sorgfältig arbeitest und Lust hast, Dich gemeinsam mit uns in das Thema KI und Prozessautomatisierung reinzudenken. Studium im Bereich Wirtschaftsinformatik, Informatik, BWL oder vergleichbar Interesse an KI, Automatisierung und digitalen Prozessen Strukturierte und selbstständige Arbeitsweise Erste Kenntnisse in RPA oder Programmierung sind von Vorteil, aber kein Muss Benefits Deine Benefits – mehr als ein Arbeitsplatz. Bei uns wirst Du von Anfang an als vollwertiges Teammitglied gesehen. Wir möchten Dich in die Welt der Steuerberatung einführen und Dir zeigen, wie vielseitig dieser Beruf ist. Dabei unterstützen wir Dich individuell und sorgen dafür, dass Du fachlich wie persönlich wachsen kannst. Und natürlich profitierst Du bei uns auch von vielen Vorteilen, die den Unterschied machen: Spannende Einblicke in moderne Automatisierungstechnologien Flexible Arbeitszeiten (ideal neben dem Studium) Möglichkeit, praktische Erfahrung in einem zukunftsorientierten Bereich zu sammeln Mitarbeit an realen Projekten mit direktem Impact Dein Kontakt – einfach und direkt. Klingt nach einem Umfeld, das zu Dir passt? Dann freuen wir uns darauf, Dich kennenzulernen und bald von Dir zu hören. Deine Ansprechpartnerin: Alexandra Hübner HR Find Jobs in Germany on Arbeitnow"
Arbeitnow API,https://www.arbeitnow.com/jobs/companies/taxtalentede/steuerberater-in-cleebronn-auf-wunsch-mit-partnerperspektive-gesucht-mindestens-90000eur-48456,2026-05-04T14:30:33,Taxtalente.de,"Steuerberater (m/w/d) in Cleebronn , auf Wunsch mit Partnerperspektive, gesucht - mindestens 90.000€",Directors,Cleebronn,,Directors; Chief Executives,"TaxTalente ist die Nr. 1 Job-Matching Plattform für Jobsuchende in der Steuerberatung. Sie suchen eine positive berufliche Veränderung? Sie möchten den nächsten Schritt in Ihrer Karriere gehen und streben möglicherweise sogar eine Partnerschaft in einer zukunftsorientierten Kanzlei an? Sie möchten endlich wieder in einem positiven Arbeitsumfeld arbeiten, in dem Sie finanziell und persönlich wertgeschätzt werden? Sie suchen nach Tätigkeiten, die Sie auch wirklich weiterbringen? Sofern Sie sich in mindestens einem der genannten Punkte wiederfinden, sollten Sie sich bei uns melden. Wir haben die attraktivsten Arbeitgeber der Steuerberatungsbranche in unserem Netzwerk und bringen zusammen, was zusammengehört. Grenzenlose Entwicklungschancen mit Partnermöglichkeiten, vielschichtige Tätigkeitsbereiche, Gehälter wie in der Industrie und vieles mehr – melden Sie sich bei uns und wir unterstützen Sie auf Ihrem weiteren Karriereweg! Derzeit suchen wir nach einem Steuerberater (m/w/d) für eine unserer Partner-Kanzleien in Cleebronn. Bei Rückfragen kannst du dich gerne jederzeit (auch nach deinem Feierabend) direkt telefonisch an Herrn Becker-Koch über folgende Nummer wenden: 015901431130 Aufgaben Wir bringen zusammen, was zusammengehört. Dabei spielt das passende Tätigkeitsprofil natürlich eine entscheidende Rolle. Bei unserer Partnerkanzlei können Sie sich Ihren Aufgabenbereich auf Basis Ihrer persönlichen Stärken und Schwächen selbst zusammenstellen. Erstellung und Review von Jahresabschlüssen Erstellung von Steuererklärungen für Personen- und Kapitalgesellschaften Steuerliche Sonderberatungsprojekte auf Basis individueller Qualifikationen B. in den Bereichen der Erbschaftsteuer oder des Umwandlungssteuerrechts Begleitung von Betriebsprüfungen Teamleitung und Personalverantwortung (optional) Weitere individuell wählbare Tätigkeitsbereiche , die Ihnen Freude bringen Qualifikation Am Ende sollte es für beide Seiten passen. Deshalb wäre es gut, wenn Sie sich in den folgenden Punkten wiederfinden. Kommunikative Art und Freude am Austausch mit Mandanten Sorgfältige , effiziente und gewissenhafte Arbeitsweise Offen für eine digitale Arbeitsweise Führungsverständnis und Verantwortungsbewusstsein gegenüber Mitarbeitern (optional) Ein erfolgreich abgeschlossenes Steuerberaterexamen Leidenschaft für steuerliche Themen Benefits Sie haben genug von 0815 Benefits, von denen Sie nicht wirklich profitieren? Dann sollten Sie einen Blick auf die nachfolgenden Benefits werfen. Außerordentliche Vergütung von 90.000 € bis 130.000 € / Jahr, auf Wunsch auch Partnerperspektive Flexible Gestaltung der Arbeitszeiten sowie die Option auf Home-Office Nettolohnoptimierung mit monatlichen 50,00€ Sachbezugsgutscheinen Umfangreiche Unterstützung bei Weiterbildungsmaßnahmen wie z.B. Fachberater Qualifikationen Modernste Ausstattung mit digitalen Prozessen Starker Teamzusammenhalt und regelmäßige Teamevents Schnell, unkompliziert und effizient Ihren Traumjob finden – ein Versprechen an Sie, dass wir aufgrund unseres selektiven, breit gefächerten und deutschlandweiten Kanzleinetzwerks halten werden. lhre Vorteile mit uns auf einen Blick: Sie führen keine unsinnigen Bewerbungsgespräche mehr, bei denen Sie während des Bewerbungsprozesses merken, dass es (bspw. wegen des Gehalts) sowieso nicht passt - wir klären vor Ihrem Bewerbungsgespräch all Ihre mit uns besprochenen Kriterien mit der Kanzlei ab. Wir führen Ihre Gehaltsverhandlungen und kennen die Gehaltsstrukturen der Branche dabei bestens. 100% Anonymität – solange Sie uns nicht das „Go“ geben und einem Kennenlernen mit Ihrem neuen potentiellen Arbeitgeber zustimmen, erfährt niemand von Ihrem Namen oder Ihren bisherigen Arbeitgebern – Ihre Ihnen wichtigen Kriterien können wir auch zunächst anonym mit unseren Partnerkanzleien klären. Attraktive Kanzleien – die Kanzleien in unserem breit gefächerten Kanzleinetzwerk sind selektiv ausgewählt und heben sich klar von “normalen” Kanzleien ab (z.B. hinsichtlich der Vergütung"
Arbeitnow API,https://www.arbeitnow.com/jobs/companies/taxtalentede/steuerberater-in-heilbronn-auf-wunsch-mit-partnerperspektive-gesucht-mindestens-90000eur-160949,2026-05-04T14:30:33,Taxtalente.de,"Steuerberater (m/w/d) in Heilbronn, auf Wunsch mit Partnerperspektive, gesucht - mindestens 90.000€",Directors,Heilbronn,,Directors; Chief Executives,"TaxTalente ist die Nr. 1 Job-Matching Plattform für Jobsuchende in der Steuerberatung. Sie suchen eine positive berufliche Veränderung? Sie möchten den nächsten Schritt in Ihrer Karriere gehen und streben möglicherweise sogar eine Partnerschaft in einer zukunftsorientierten Kanzlei an? Sie möchten endlich wieder in einem positiven Arbeitsumfeld arbeiten, in dem Sie finanziell und persönlich wertgeschätzt werden? Sie suchen nach Tätigkeiten, die Sie auch wirklich weiterbringen? Sofern Sie sich in mindestens einem der genannten Punkte wiederfinden, sollten Sie sich bei uns melden. Wir haben die attraktivsten Arbeitgeber der Steuerberatungsbranche in unserem Netzwerk und bringen zusammen, was zusammengehört. Grenzenlose Entwicklungschancen mit Partnermöglichkeiten, vielschichtige Tätigkeitsbereiche, Gehälter wie in der Industrie und vieles mehr – melden Sie sich bei uns und wir unterstützen Sie auf Ihrem weiteren Karriereweg! Derzeit suchen wir nach einem Steuerberater (m/w/d) für eine unserer Partner-Kanzleien in Heilbronn. Bei Rückfragen kannst du dich gerne jederzeit (auch nach deinem Feierabend) direkt telefonisch an Herrn Becker-Koch über folgende Nummer wenden: 015901431130 Aufgaben Wir bringen zusammen, was zusammengehört. Dabei spielt das passende Tätigkeitsprofil natürlich eine entscheidende Rolle. Bei unserer Partnerkanzlei können Sie sich Ihren Aufgabenbereich auf Basis Ihrer persönlichen Stärken und Schwächen selbst zusammenstellen. Erstellung und Review von Jahresabschlüssen Erstellung von Steuererklärungen für Personen- und Kapitalgesellschaften Steuerliche Sonderberatungsprojekte auf Basis individueller Qualifikationen B. in den Bereichen der Erbschaftsteuer oder des Umwandlungssteuerrechts Begleitung von Betriebsprüfungen Teamleitung und Personalverantwortung (optional) Weitere individuell wählbare Tätigkeitsbereiche , die Ihnen Freude bringen Qualifikation Am Ende sollte es für beide Seiten passen. Deshalb wäre es gut, wenn Sie sich in den folgenden Punkten wiederfinden. Kommunikative Art und Freude am Austausch mit Mandanten Sorgfältige , effiziente und gewissenhafte Arbeitsweise Offen für eine digitale Arbeitsweise Führungsverständnis und Verantwortungsbewusstsein gegenüber Mitarbeitern (optional) Ein erfolgreich abgeschlossenes Steuerberaterexamen Leidenschaft für steuerliche Themen Benefits Sie haben genug von 0815 Benefits, von denen Sie nicht wirklich profitieren? Dann sollten Sie einen Blick auf die nachfolgenden Benefits werfen. Außerordentliche Vergütung von 90.000 € bis 130.000 € / Jahr, auf Wunsch auch Partnerperspektive Flexible Gestaltung der Arbeitszeiten sowie die Option auf Home-Office Nettolohnoptimierung mit monatlichen 50,00€ Sachbezugsgutscheinen Umfangreiche Unterstützung bei Weiterbildungsmaßnahmen wie z.B. Fachberater Qualifikationen Modernste Ausstattung mit digitalen Prozessen Starker Teamzusammenhalt und regelmäßige Teamevents Schnell, unkompliziert und effizient Ihren Traumjob finden – ein Versprechen an Sie, dass wir aufgrund unseres selektiven, breit gefächerten und deutschlandweiten Kanzleinetzwerks halten werden. lhre Vorteile mit uns auf einen Blick: Sie führen keine unsinnigen Bewerbungsgespräche mehr, bei denen Sie während des Bewerbungsprozesses merken, dass es (bspw. wegen des Gehalts) sowieso nicht passt - wir klären vor Ihrem Bewerbungsgespräch all Ihre mit uns besprochenen Kriterien mit der Kanzlei ab. Wir führen Ihre Gehaltsverhandlungen und kennen die Gehaltsstrukturen der Branche dabei bestens. 100% Anonymität – solange Sie uns nicht das „Go“ geben und einem Kennenlernen mit Ihrem neuen potentiellen Arbeitgeber zustimmen, erfährt niemand von Ihrem Namen oder Ihren bisherigen Arbeitgebern – Ihre Ihnen wichtigen Kriterien können wir auch zunächst anonym mit unseren Partnerkanzleien klären. Attraktive Kanzleien – die Kanzleien in unserem breit gefächerten Kanzleinetzwerk sind selektiv ausgewählt und heben sich klar von “normalen” Kanzleien ab (z.B. hinsichtlich der Vergütung"
Arbeitnow API,https://www.arbeitnow.com/jobs/companies/flexcube/social-media-manager-remote-berlin-289530,2026-05-04T14:30:33,Flexcube,Social Media Manager - Remote,Remote,Berlin,,Remote; Marketing and Communication,"We are a Swiss modular furniture brand selling premium metal furniture systems through our online configurator in Germany and Switzerland. Our customers design their own sideboards, shelves, desks and lowboards by choosing size, color and layout. We are looking for an experienced Social Media Manager who will take full ownership of our social media presence with one clear goal: grow our channels and build a community around modern interior design and modular furniture. Tasks What you will do Content &#x26; Channel Growth Develop and execute a content strategy for Instagram (And if possible TikTok and Pinterest aswell) Create, schedule and publish content (we can provide images and you create the storytelling around them) Grow our follower base and engagement rate with a clear monthly growth plan Analyze performance weekly and adjust strategy based on data Influencer &#x26; Cooperation Management Research and identify interior design influencers, architects, interior stylists and home decor creators in the DACH region (Germany, Austria, Switzerland) Reach out to influencers, negotiate cooperations and manage the full process from first contact to content delivery Organize product placements, unboxings, room makeovers and other collaboration formats Community &#x26; Brand Engage with followers, respond to comments and DMs Monitor trends in the interior design and furniture space Bring ideas for campaigns and content series that drive engagement and reach Requirements What we are looking for 2+ years of experience managing social media (either for your own succesful channel or for a brand) Proven track record of growing a social media channel (show us the numbers) Strong understanding of Instagram algorithms and best practices Excellent English communication skills (German is a plus but not required) Self-starter who can work independently and take ownership Available for at least 20 hours per week Benefits Long-term remote position with flexible hours A premium product that looks great on camera Creative freedom to shape the brand's social presence Performance-based bonus opportunities tied to growth targets In your application letter, please specify which social media channels you have managed, whether for a company, client, project, or your own personal brand. Include the current or previous follower count for the channel and, where possible, the growth you achieved. Find more English Speaking Jobs in Germany on Arbeitnow"
