job_id,date_posted,source,company,title,category,raw_category,seniority,location,job_type,skills,tags_raw,salary_min_usd,salary_max_usd,salary_mid_usd,demand_index,scarcity_score,time_to_fill_days_proxy,application_volume_proxy,source_url,description_preview
raw-0083,2026-06-15,Arbeitnow API,think about IT GmbH,Team Lead Finanzbuchhaltung (m/w/d),Product & Project Management,Finance,Senior/Lead,Bochum,,Finance; Onboarding; ERP; SAP,Finance,84132,121068,102600,61.9,48,38.6,123,https://www.arbeitnow.com/jobs/companies/think-about-it-gmbh/team-lead-finanzbuchhaltung-bochum-322976,"Die thinkGROUP ist eine erfolgreiche Systemhausgruppe, die ständig nach Innovation strebt und großen Wert auf die kontinuierliche Optimierung unserer internen Prozesse legt. Die Nutzung modernster Technologien ist kein S"
raw-0084,2026-06-15,Arbeitnow API,SIERA Alliance,Technische Mitarbeit Umwelttechnik (m/w/d),Software & Engineering,Engineering,Unspecified,Heidelberg,,Python; JavaScript; API; Cloud,Engineering,66387,95533,80960,93.6,62,40.7,104,https://www.arbeitnow.com/jobs/companies/siera-alliance/technische-mitarbeit-umwelttechnik-heidelberg-345746,"Rund 800 Mitarbeiterinnen und Mitarbeiter arbeiten in der SIERA an der Vision für eine bessere Zukunft in den Bereichen Umweltschutz und Klima, Wasser und Ökosysteme, Kreislaufwirtschaft, städtische Nachhaltigkeit und In"
raw-0085,2026-06-15,Arbeitnow API,think about IT GmbH,IT-Systemelektroniker (m/w/d),Software & Engineering,IT,Unspecified,Bochum,,Onboarding; HR,IT,66387,95533,80960,64,38,30.3,136,https://www.arbeitnow.com/jobs/companies/think-about-it-gmbh/it-systemelektroniker-bochum-12694,"Die thinkGROUP ist eine erfolgreiche Systemhausgruppe, die ständig nach Innovation strebt und großen Wert auf die kontinuierliche Optimierung unserer internen Prozesse legt. Die Nutzung modernster Technologien ist kein S"
raw-0086,2026-06-15,Arbeitnow API,think about IT GmbH,IT-System Engineer (m/w/d),Software & Engineering,IT,Unspecified,Bochum,,Onboarding,IT,66387,95533,80960,62.8,38,30.3,136,https://www.arbeitnow.com/jobs/companies/think-about-it-gmbh/it-system-engineer-bochum-8871,"Die thinkGROUP ist eine erfolgreiche Systemhausgruppe, die ständig nach Innovation strebt und großen Wert auf die kontinuierliche Optimierung unserer internen Prozesse legt. Die Nutzung modernster Technologien ist kein S"
raw-0087,2026-06-15,Arbeitnow API,SAC GmbH,Ausbildung zum Fachinformatiker für Systemintegration (m/w/d) für 2026,Software & Engineering,Helpdesk,Internship/Student,Darmstadt,Apprenticeship,Python; JavaScript; API; Cloud,Helpdesk,39688,57112,48400,93.6,62,40.7,104,https://www.arbeitnow.com/jobs/companies/sac-gmbh/ausbildung-zum-fachinformatiker-fur-systemintegration-fur-2026-darmstadt-335181,"Darmstadt | ab 01.08.2026 | Vollzeit Wir suchen Nachwuchs-Talente für unser IT Service Team! Aufgaben Erlangen von Kenntnissen im Bereich komplexer Hard- und Softwaresysteme Analysieren von Kundenproblemen, erstellen von"
raw-0088,2026-06-15,Arbeitnow API,think about IT GmbH,Senior IT Administrator (m/w/d),Software & Engineering,IT,Senior/Lead,Bochum,,Onboarding; HR,IT,97416,140184,118800,64,48,38.6,123,https://www.arbeitnow.com/jobs/companies/think-about-it-gmbh/senior-it-administrator-bochum-133643,"Die thinkGROUP ist eine erfolgreiche Systemhausgruppe, die ständig nach Innovation strebt und großen Wert auf die kontinuierliche Optimierung unserer internen Prozesse legt. Die Nutzung modernster Technologien ist kein S"
raw-0089,2026-06-15,Arbeitnow API,think about IT GmbH,Senior IT-Project Manager (m/w/d),Product & Project Management,IT,Senior/Lead,Bochum,,Project Management; Onboarding,IT,84132,121068,102600,58.7,48,38.6,123,https://www.arbeitnow.com/jobs/companies/think-about-it-gmbh/senior-it-project-manager-bochum-489587,"Die thinkGROUP ist eine erfolgreiche Systemhausgruppe, die ständig nach Innovation strebt und großen Wert auf die kontinuierliche Optimierung unserer internen Prozesse legt. Die Nutzung modernster Technologien ist kein S"
raw-0090,2026-06-15,Arbeitnow API,Ratepay GmbH,Senior Software Engineer - Fullstack (m/f/d),Software & Engineering,Software Development,Senior/Lead,Berlin,professional / experienced,Communication; JavaScript; Onboarding; Full Stack; Frontend; Backend; Testing; Docker; Design; Cloud; Agile; Java,Software Development,97416,140184,118800,70.6,64,45.5,102,https://www.arbeitnow.com/jobs/companies/ratepay-gmbh/senior-software-engineer-fullstack-berlin-78333,"At Ratepay, we develop next-generation payment solutions that power the checkout experience for some of Germany’s largest online retailers and marketplaces. As a Senior Software Engineer (m/f/d), you’ll play a key role i"
raw-0091,2026-06-15,Arbeitnow API,KSi International GmbH,Marketing Manager E-Commerce (m/w/d),Marketing & Growth,Marketing and Communication,Senior/Lead,Dresden,,Communication; Testing; SEO,Marketing and Communication,66420,95580,81000,69.4,48,38.6,123,https://www.arbeitnow.com/jobs/companies/ksi-international-gmbh/marketing-manager-e-commerce-dresden-419093,"Durch deine motivierte, konstruktive und aufgeschlossene Persönlichkeit treibst du Projekte voran und siehst Herausforderungen als Chance für Wachstum. Als Teamplayer bist du immer bereit, anderen eine helfende Hand zu r"
raw-0092,2026-06-15,Arbeitnow API,EterniTeam GmbH,Unternehmensnachfolger (m/w/d),Software & Engineering,Directors,Unspecified,Gütersloh,,Operations,Directors; Chief Executives,66387,95533,80960,67.5,38,30.3,136,https://www.arbeitnow.com/jobs/companies/eterniteam-gmbh/unternehmensnachfolger-gutersloh-352461,"Wer sind wir? EterniTeam hat die Lösung für Deutschlands größtes Problem im Unternehmertum: die Unternehmensnachfolge. Mit einem neuen, revolutionären Ansatz sichern wir die Nachfolge einiger der gut 1 Millionen Unterneh"
raw-0093,2026-06-15,Arbeitnow API,EterniTeam GmbH,Unternehmensnachfolger (m/w/d),Software & Engineering,Directors,Unspecified,Rheda-Wiedenbrück,,Operations,Directors; Chief Executives,66387,95533,80960,67.5,38,30.3,136,https://www.arbeitnow.com/jobs/companies/eterniteam-gmbh/unternehmensnachfolger-rheda-wiedenbruck-141063,"Wer sind wir? EterniTeam hat die Lösung für Deutschlands größtes Problem im Unternehmertum: die Unternehmensnachfolge. Mit einem neuen, revolutionären Ansatz sichern wir die Nachfolge einiger der gut 1 Millionen Unterneh"
raw-0094,2026-06-15,Arbeitnow API,CRX Markets AG,Working Student Marketing (m/f/x),Software & Engineering,Marketing Assistant,Internship/Student,Munich,"Working student, professional / experienced",Communication; Advertising; Marketplace; Automation; Design; Sales,Marketing Assistant,39688,57112,48400,70.8,38,30.3,136,https://www.arbeitnow.com/jobs/companies/crx-markets-ag/working-student-marketing-munich-132586,"CRX Markets operates as the leading global marketplace for working capital financing, connecting corporates and financing partners for competitive, market-driven solutions on both sides of the balance sheet. Trusted by l"
raw-0095,2026-06-15,Arbeitnow API,Staffomatic,(Senior) Product Designer (m/w/d) · Hamburg | Hybrid,Software & Engineering,Remote,Senior/Lead,Hamburg,berufserfahren,Design; Product Management; User Research; Research; Testing; AI,Remote; Product Design; Industrial Design,97416,140184,118800,72.6,48,38.6,123,https://www.arbeitnow.com/jobs/companies/staffomatic/senior-product-designer-hamburg-hybrid-296231,"Staffomatic ist die digitale Plattform für Dienstplanung und Zeiterfassung, gebaut für Teams in Gastronomie, Retail, Events und mehr. Tausende Unternehmen im DACH-Markt nutzen unser Produkt täglich, um Schichten zu plane"
raw-0096,2026-06-15,Arbeitnow API,Kloepfel Group,Leiter Direkter Einkauf (m/w/d),Product & Project Management,Business Development,Mid-level,Cologne,berufserfahren,Product Management; Project Management; Agile; Stakeholder Management,Business Development,62320,89680,76000,50.8,38,30.3,136,https://www.arbeitnow.com/jobs/companies/kloepfel-group/leiter-direkter-einkauf-cologne-122083,"Was kommt auf Dich zu? Fachliche und disziplinarische Führung des Teams Direkter Einkauf Entwicklung und Umsetzung einer globalen Beschaffungsstrategie für kunststoffbasierte Rohstoffe, Halbzeuge und Komponenten Verantwo"
raw-0097,2026-06-15,Arbeitnow API,Janitza electronics GmbH,Messtechnikentwickler (m/w/d) Firmware,Software & Engineering,Engineering,Entry-level,Lahnau,"Full-time permanent, entry",Python; JavaScript; API; Cloud,Engineering; high school coursework,54120,77880,66000,93.6,62,40.7,104,https://www.arbeitnow.com/jobs/companies/janitza-electronics-gmbh/messtechnikentwickler-firmware-lahnau-438104,"Mit zukunftsweisenden Hard- und Software-Lösungen ermöglicht Janitza die Energie zu messen, auszuwerten und verfügbar zu machen. Janitza trägt so dazu bei, dass Unternehmen Ressourcen schonen, produktiv bleiben und erfol"
raw-0098,2026-06-15,Arbeitnow API,Janitza electronics GmbH,Messtechnikentwickler (m/w/d) Hardware,Software & Engineering,Engineering,Entry-level,Lahnau,"Full-time permanent, entry",ERP,Engineering; high school coursework,54120,77880,66000,55.7,38,30.3,136,https://www.arbeitnow.com/jobs/companies/janitza-electronics-gmbh/messtechnikentwickler-hardware-lahnau-164412,"Mit zukunftsweisenden Hard- und Software-Lösungen ermöglicht Janitza die Energie zu messen, auszuwerten und verfügbar zu machen. Janitza trägt so dazu bei, dass Unternehmen Ressourcen schonen, produktiv bleiben und erfol"
raw-0099,2026-06-15,Arbeitnow API,Janitza electronics GmbH,Produktmanager (m/w/d) Hardware,Software & Engineering,Engineering,Senior/Lead,Lahnau,"Full-time permanent, entry",Agile,Engineering; high school coursework,97416,140184,118800,51.1,48,38.6,123,https://www.arbeitnow.com/jobs/companies/janitza-electronics-gmbh/produktmanager-hardware-lahnau-432033,"Mit zukunftsweisenden Hard- und Software-Lösungen ermöglicht Janitza die Energie zu messen, auszuwerten und verfügbar zu machen. Janitza trägt so dazu bei, dass Unternehmen Ressourcen schonen, produktiv bleiben und erfol"
raw-0100,2026-06-15,Arbeitnow API,TechBiz Global GmbH,Senior Verification Engineer,Software & Engineering,Engineering,Senior/Lead,Aachen,"Full-time permanent, experienced",Communication; Recruitment; Python; Git,Engineering; bachelor's degree,97416,140184,118800,73.9,56,42.1,112,https://www.arbeitnow.com/jobs/companies/techbiz-global-gmbh/senior-verification-engineer-aachen-396413,"At TechBiz Global, we are providing recruitment service to our TOP clients from our portfolio. We are currently seeking an Senior Verification Engineer specialist to join one of our clients ' teams that d evelops RISC-V "
raw-0101,2026-06-15,Arbeitnow API,idealo internet GmbH,(Senior) Backend Developer – Product Creation & Assignment (m/w/d),Data & AI,Internet and software,Senior/Lead,Berlin,"Full-time permanent, experienced",Machine Learning; Communication; Kubernetes; Backend; Testing; Python; Docker; Spark; Cloud; Java; AWS; AI,Internet and software; professional,94095,135405,114750,68.8,85,54.5,75,https://www.arbeitnow.com/jobs/companies/idealo-internet-gmbh/senior-backend-developer-product-creation-assignment-berlin-267115,"As a (Senior) Backend Developer in our Product Creation &amp; Assignment Team, you will help us build the systems behind the automated expansion of the idealo product catalogue. At idealo, products are the comparable ent"
raw-0102,2026-06-15,Arbeitnow API,DS Projektentwicklung GmbH,Baustellenkoordinator / Bauüberwacher (m/w/d),Software & Engineering,Engineering,Unspecified,Nuremberg,,HR,Engineering,66387,95533,80960,65.1,38,30.3,136,https://www.arbeitnow.com/jobs/companies/ds-projektentwicklung-gmbh/baustellenkoordinator-bauuberwacher-nuremberg-35234,"Ihre Zukunft beginnt jetzt… Sie sind gerne auf Baustellen unterwegs, erkennen Probleme frühzeitig und scheuen sich nicht davor, klare Ansagen zu machen? Sie haben Freude daran, Abläufe zu kontrollieren, Termine nachzuhal"
raw-0103,2026-06-15,Arbeitnow API,Moby Digg GmbH,Senior Projektmanager*in (f/m/d),Marketing & Growth,Marketing and Communication,Senior/Lead,Munich,berufserfahren,Communication,Marketing and Communication,66420,95580,81000,95.6,48,38.6,123,https://www.arbeitnow.com/jobs/companies/moby-digg-gmbh/senior-projektmanagerin-munich-186459,"Wir suchen ab sofort eine/n Senior Projektmanager*in (f/m/d) in Vollzeit (40 Std./Woche) in München bei 5 Tagen Home Office / Monat. Als Senior Projektmanager*in (f/m/d) verantwortest du die erfolgreiche Planung, Steueru"
raw-0104,2026-06-15,Arbeitnow API,SIERA Alliance,Fachbereichsleitung Boden- und Grundwassergutachten / Altlasten (m/w/d),Software & Engineering,Engineering,Unspecified,Heidelberg,,Python; JavaScript; API; Cloud,Engineering,66387,95533,80960,93.6,62,40.7,104,https://www.arbeitnow.com/jobs/companies/siera-alliance/fachbereichsleitung-boden-und-grundwassergutachten-altlasten-heidelberg-76709,"Rund 800 Mitarbeiterinnen und Mitarbeiter arbeiten in der SIERA an der Vision für eine bessere Zukunft in den Bereichen Umweltschutz und Klima, Wasser und Ökosysteme, Kreislaufwirtschaft, städtische Nachhaltigkeit und In"
raw-0105,2026-06-15,Arbeitnow API,Moby Digg GmbH,Account Manager*in / Client Partner*in (f/m/d),Marketing & Growth,Marketing and Communication,Senior/Lead,Munich,,Communication,Marketing and Communication,66420,95580,81000,95.6,48,38.6,123,https://www.arbeitnow.com/jobs/companies/moby-digg-gmbh/account-managerin-client-partnerin-munich-246877,Wir suchen ab sofort eine/n Account Director / Client Partner (f/m/d) in Vollzeit (40 Std./Woche) in München bei 5 Tagen Home Office / Monat. Als Account Director / Client Partner (f/m/d) verantwortest du den langfristig
raw-0106,2026-06-15,Arbeitnow API,Volt Venture GmbH,Team Lead IT (m/w/d),Software & Engineering,Management,Senior/Lead,Münster,teamleitung,Onboarding; Full Stack,Management; Team Leader,97416,140184,118800,56.3,56,42.1,112,https://www.arbeitnow.com/jobs/companies/volt-venture-gmbh/team-lead-it-munster-267341,"Du möchtest nicht nur Software entwickeln, sondern die technische Zukunft eines Unternehmens aktiv mitgestalten? Die Volt Venture GmbH ist ein junges mittelständisches Unternehmen aus Münster, das mit der Marke Clevertro"
raw-0107,2026-06-15,Arbeitnow API,Caspar Health,Business Segment Lead B2B SaaS / Software Features - (alle Identitäten),Software & Engineering,Remote,Senior/Lead,Berlin,berufserfahren,Project Management; Sales; SaaS,Remote; Project Management,97416,140184,118800,63.2,48,38.6,123,https://www.arbeitnow.com/jobs/companies/caspar-health/business-segment-lead-b2b-saas-software-features-alle-identitaten-berlin-283210,"Das erwartet Dich Dein Hebel für die Gesundheitsversorgung von morgen Bei Caspar Health arbeiten wir an der Gesundheitsversorgung von morgen – digital, nachhaltig und ganzheitlich. Unsere innovativen Lösungen verändern d"
raw-0108,2026-06-15,Arbeitnow API,Jan Pethe Interim Management & Consulting GmbH - JPIMC®,Head of Accounting + Controlling (m/w/d) | Berlin [Hybrid],Product & Project Management,Management,Senior/Lead,Berlin,teamleitung,Accounting; Excel,Management; Team Leader,84132,121068,102600,56.9,48,38.6,123,https://www.arbeitnow.com/jobs/companies/jan-pethe-interim-management-consulting-gmbh-jpimc/head-of-accounting-controlling-berlin-hybrid-398655,Für unseren Mandanten suchen wir eine/n Head of Accounting &#x26; Controlling (m/w/d) am Standort Berlin in unbefristeter Festanstellung mit der punktuellen Möglichkeit zu Hybrid Work. Unser Mandant ist ein etablierter A
raw-0109,2026-06-15,Arbeitnow API,IDKOM Networks GmbH,Network Security Engineer (m/w/d),Software & Engineering,IT Security,Mid-level,Kempten,berufserfahren,Security; Cloud,IT Security,72160,103840,88000,87.4,54,37.2,115,https://www.arbeitnow.com/jobs/companies/idkom-networks-gmbh/network-security-engineer-kempten-245467,ID.KOM – UNSER HERZ SCHLÄGT DIGITAL! Lassen spannende IT-Projekte und neue Technologien auch Dich pulsieren? Kannst Du Dir etwas unter „selbständiger Teamarbeit“ vorstellen? Wünschst Du Dir einen modernen und flexiblen A
raw-0110,2026-06-15,Arbeitnow API,AMC Holding GmbH,Ausbildung Zum Fachinformatiker Anwendungsentwicklung (M/W/D),Software & Engineering,Software Development,Internship/Student,Hamburg,"Apprenticeship, berufseinstieg",Python; JavaScript; API; Cloud,Software Development,39688,57112,48400,93.5,62,40.7,104,https://www.arbeitnow.com/jobs/companies/amc-holding-gmbh/ausbildung-zum-fachinformatiker-anwendungsentwicklung-hamburg-269819,Die AMC Holding GmbH aus Hamburg ist auf Softwareentwicklung für das Gesundheitswesen spezialisiert. Auf dem Markt für Krankenhausinformationssysteme haben wir mit unserem webbasierten System CLINIXX® Maßstäbe gesetzt un
raw-0111,2026-06-15,Arbeitnow API,etalytics GmbH,Internship / Thesis: Angular Frontend Development (f/m/d),Software & Engineering,Web Development,Internship/Student,Darmstadt,Internship,TypeScript; Frontend; Testing; API,Web Development,39688,57112,48400,69.8,46,33.8,125,https://www.arbeitnow.com/jobs/companies/etalytics-gmbh/internship-thesis-angular-frontend-development-darmstadt-330952,"Do you want to make a real impact? At etalytics, you’ll work on smart solutions that help reduce energy consumption and lower CO₂ emissions while taking your Angular frontend skills to the next level. You’ll be an integr"
raw-0112,2026-06-15,Arbeitnow API,Refarm GmbH,Pflichtpraktikum / Praxissemester - nachhaltiges Marketing,Marketing & Growth,Marketing and Communication,Internship/Student,Karlsruhe,Internship,Communication; Social Media; Design; Video Editing; SEO,Marketing and Communication,27060,38940,33000,71.9,38,30.3,136,https://www.arbeitnow.com/jobs/companies/refarm-gmbh/pflichtpraktikum-praxissemester-nachhaltiges-marketing-karlsruhe-225664,"Du bist auf der Suche nach einem sinnstiftenden Pflichtpraktikum , bei dem Du nicht nur zuschaust, sondern aktiv Verantwortung übernimmst? Dann bist Du bei uns genau richtig! Bei Refarm in Karlsruhe sind wir ein kleines,"
raw-0113,2026-06-15,Arbeitnow API,ANGEHEUERT GmbH Personalberatung,Bilanzbuchhalter (m/w/d),Finance & Business,Finance,Unspecified,Föhren,,Finance; Onboarding; ERP; SAP,Finance,51299,73821,62560,61.9,38,30.3,136,https://www.arbeitnow.com/jobs/companies/angeheuert-gmbh-personalberatung/bilanzbuchhalter-fohren-398013,"Als Bilanzbuchhalter:in trägst du direkt zur finanziellen Stabilität eines Unternehmens bei, das auf erneuerbare Energien setzt und nachhaltige Lösungen für Privat- und Gewerbekunden entwickelt. In dieser Position unters"
raw-0114,2026-06-15,Arbeitnow API,ANGEHEUERT GmbH Personalberatung,Controller (m/w/d),Product & Project Management,Finance,Unspecified,Föhren,,Finance; Excel; SAP,Finance,57334,82506,69920,64.7,38,30.3,136,https://www.arbeitnow.com/jobs/companies/angeheuert-gmbh-personalberatung/controller-fohren-300477,"Unser Kunde aus der Branche der erneuerbaren Energien verfolgt das Ziel, nachhaltige Energieversorgung für Privatkunden, Unternehmen und Industrie zugänglich zu machen. Das Unternehmen gehört zu den etablierten Anbietern"
raw-0115,2026-06-15,Arbeitnow API,Maier Heiztechnik GmbH,Projektleiter SHK/TGA (m/w/d),Product & Project Management,Project Management,Mid-level,Köngen,berufserfahren,Project Management,Project Management,62320,89680,76000,54.5,38,30.3,136,https://www.arbeitnow.com/jobs/companies/maier-heiztechnik-gmbh/projektleiter-shk-tga-kongen-454669,"Ihre Aufgaben Selbstständige Planung, Abwicklung und Koordination von Projekten Erstellung von Angeboten, Nachträgen und regelmäßiger Ausmaß Fachliche Führung und Koordination der Monteure, Obermonteure und Subunternehme"
raw-0116,2026-06-15,Arbeitnow API,eFLY Marketplace Services GmbH,Pflichtpraktikum Online Marketing Manager (m/w/d),Marketing & Growth,Marketing and Communication,Internship/Student,Stuttgart,Internship,Communication; Excel,Marketing and Communication,27060,38940,33000,80.3,38,30.3,136,https://www.arbeitnow.com/jobs/companies/efly-marketplace-services-gmbh/pflichtpraktikum-online-marketing-manager-stuttgart-382417,In der Rolle des Online Marketing Managers kalkulierst und steuerst du die Werbebudgets unserer Kunden. Ziel ist es die bestmögliche Sichtbarkeit mit einem vorgegebenen Budget zu erreichen. Um die Fortschritte der Arbeit
raw-0117,2026-06-15,Arbeitnow API,eFLY Marketplace Services GmbH,Pflichtpraktikum im Bereich Grafikdesign (m/w/d),Software & Engineering,Marketing and Communication,Unspecified,Stuttgart,,Communication; Performance Marketing; Social Media; Design,Marketing and Communication,66387,95533,80960,76.5,38,30.3,136,https://www.arbeitnow.com/jobs/companies/efly-marketplace-services-gmbh/pflichtpraktikum-im-bereich-grafikdesign-stuttgart-159768,"Wir suchen dich für ein spannendes Praktikum im Grafikdesign , um unser Team bei der Entwicklung kreativer und ansprechender Designs für unsere Kunden zu unterstützen. Du wirst visuelle Konzepte für verschiedene Kanäle g"
raw-0118,2026-06-15,Arbeitnow API,CaraConsult GmbH,IT Engineer für digitale Lösungen und technische Systeme (m/w/d),Software & Engineering,Consulting,Mid-level,Bad Homburg,berufserfahren,Python; JavaScript; API; Cloud,Consulting; Engineering,72160,103840,88000,93.5,62,40.7,104,https://www.arbeitnow.com/jobs/companies/caraconsult-gmbh/it-engineer-fur-digitale-losungen-und-technische-systeme-bad-homburg-72835,"Gestalte IT, Daten und digitale Lösungen mit echtem Praxisbezug Du hast bereits Erfahrung im IT-Umfeld gesammelt und möchtest technische Themen nicht nur verwalten, sondern aktiv weiterentwickeln? Du arbeitest gerne an u"
raw-0119,2026-06-15,Arbeitnow API,eFLY Marketplace Services GmbH,Online Marketing Manager (m/w/d),Marketing & Growth,Marketing Manager,Senior/Lead,Stuttgart,,Excel; SEO,Marketing Manager,66420,95580,81000,57.5,48,38.6,123,https://www.arbeitnow.com/jobs/companies/efly-marketplace-services-gmbh/online-marketing-manager-stuttgart-119044,In der Rolle des Online Marketing Managers kalkulierst und steuerst du die Werbebudgets unserer Kunden. Ziel ist es die bestmögliche Sichtbarkeit mit einem vorgegebenen Budget zu erreichen. Um die Fortschritte der Arbeit
raw-0120,2026-06-15,Arbeitnow API,eFLY Marketplace Services GmbH,Werkstudent (m/w/d) Google Marketing & Analytics,Data & AI,Marketing and Communication,Internship/Student,Stuttgart,Working student,Communication; Design,Marketing and Communication,38335,55165,46750,94.4,43,32.5,129,https://www.arbeitnow.com/jobs/companies/efly-marketplace-services-gmbh/werkstudent-google-marketing-analytics-stuttgart-97140,Du möchtest Theorie gegen echte Praxis tauschen und die Welt des datengetriebenen Marketings kennenlernen? Dann bist du bei uns genau richtig! Als Werkstudent (m/w/d) unterstützt du unser Team aktiv bei der Gestaltung un
raw-0121,2026-06-15,Arbeitnow API,VT Netzwelt GmbH,Werkstudent:in Founder's Associate (m/w/d) - Internal Projects & Strategy,Marketing & Growth,IT,Internship/Student,Berlin,Working student,Operations; Startup; AI,IT,27060,38940,33000,82.7,38,30.3,136,https://www.arbeitnow.com/jobs/companies/vt-netzwelt-gmbh/werkstudentin-founders-associate-internal-projects-strategy-berlin-303565,"Standort: Berlin (Hybrid möglich) | Start: ab sofort | Vergütung: überdurchschnittliche 22–25 €/Stunde (je nach Profil) Du willst wissen, wie ein digitales Unternehmen wirklich von innen funktioniert? Wir sind VT Netzwel"
raw-0122,2026-06-15,Arbeitnow API,eFLY Marketplace Services GmbH,Werkstudent (m/w/d) Sales & Marketing,Marketing & Growth,Marketing and Communication,Internship/Student,Stuttgart,Working student,Communication; Sales; CRM,Marketing and Communication,27060,38940,33000,76,38,30.3,136,https://www.arbeitnow.com/jobs/companies/efly-marketplace-services-gmbh/werkstudent-sales-marketing-stuttgart-420189,Du möchtest die Dynamik im Vertrieb hautnah miterleben und hast Lust auf echten Kundenkontakt? Dann bist du bei uns genau richtig! Als Werkstudent (m/w/d) im Bereich Sales und Marketing unterstützt du unser Team aktiv vo
raw-0123,2026-06-15,Arbeitnow API,VT Netzwelt GmbH,Werkstudent Produktmanagement (w/m/d) Techagentur,Marketing & Growth,Product Management,Internship/Student,Berlin,Working student,Product Management; Startup; Design; Agile; AI,Product Management,27060,38940,33000,75.4,38,30.3,136,https://www.arbeitnow.com/jobs/companies/vt-netzwelt-gmbh/werkstudent-produktmanagement-techagentur-berlin-171540,"Standort: Berlin (Hybrid möglich) | Start: ab sofort Vergütung: überdurchschnittliche 22 - 25€/Stunde Du willst wissen, wie digitale Produkte wirklich gebaut werden? Wir sind VT Netzwelt – eine Techagentur mit Fokus auf "
raw-0124,2026-06-15,Arbeitnow API,Audia Akustik GmbH,Werkstudent HR (m/w/d),Marketing & Growth,HR,Internship/Student,Sömmerda,Working student,HR,HR,27060,38940,33000,65.1,38,30.3,136,https://www.arbeitnow.com/jobs/companies/audia-akustik-gmbh/werkstudent-hr-sommerda-304761,"Du studierst im Bereich HR/ Betriebswirtschaftslehre oder Wirtschaftspsychologie und möchtest wertvolle Praxiserfahrung in einem innovativen Umfeld sammeln? Du bist ein Kommunikationstalent, digital affin und willst hint"
raw-0125,2026-06-15,Arbeitnow API,Parte Verwaltung GmbH,WEG-Verwalter / Immobilienverwalter (m/w/d),Finance & Business,Finance,Mid-level,Essen,berufserfahren,Finance; HR,Finance,55760,80240,68000,70.4,38,30.3,136,https://www.arbeitnow.com/jobs/companies/parte-verwaltung-gmbh/weg-verwalter-immobilienverwalter-essen-289960,"Das bewegen Sie bei uns: In Ihrer Rolle betreuen und verwalten Sie eigenständig Wohnungseigentümergemeinschaften. Sie bereiten Eigentümerversammlungen vor, führen diese durch und sorgen für eine strukturierte Nachbereitu"
