job_id,date_posted,source,company,title,category,raw_category,seniority,location,job_type,skills,tags_raw,salary_min_usd,salary_max_usd,salary_mid_usd,demand_index,scarcity_score,time_to_fill_days_proxy,application_volume_proxy,source_url,description_preview
raw-0126,2026-06-24,Arbeitnow API,mammaly,Marketing - Praktikant / Working Student (all genders),Marketing & Growth,Marketing and Communication,Internship/Student,Berlin,"Working student, no experience required / student",Communication; Social Media; Research,Marketing and Communication,27060,38940,33000,80.3,38,30.3,136,https://www.arbeitnow.com/jobs/companies/mammaly/marketing-praktikant-working-student-all-genders-berlin-365344,"Tasks Creator Management &#x26; Akquise: Du betreust unsere bestehenden Affiliate-Partner und identifizierst proaktiv neue, passende Profile, um unser Netzwerk strategisch auszubauen. Kampagnen-Management &#x26; Tracking"
raw-0127,2026-06-24,Arbeitnow API,Kölner Wirtschaftsberatung,Trainee (m/w/d) Consulting,Finance & Business,Finance,Entry-level,Cologne,,Finance,Finance,41820,60180,51000,69.5,38,30.3,136,https://www.arbeitnow.com/jobs/companies/kolner-wirtschaftsberatung/trainee-consulting-cologne-78270,"Wir von der MLP Wirtschaftsberatung bieten ambitionierten Talenten die Möglichkeit, im Rahmen eines viermonatigen Traineeprogramms die vielseitige Welt der Finanz- und Unternehmensberatung kennenzulernen. Steigen Sie an "
raw-0128,2026-06-24,Arbeitnow API,Langer & Laumann Ing.-Büro GmbH,"Mitarbeiter Support, technischer Vertrieb (m/w/d) - Vollzeit",Marketing & Growth,Customer Service,Mid-level,Steinfurt,berufserfahren,Customer Service; Onboarding; CRM; ERP,Customer Service,49200,70800,60000,61.2,38,30.3,136,https://www.arbeitnow.com/jobs/companies/langer-laumann-ing-buro-gmbh/mitarbeiter-support-technischer-vertrieb-vollzeit-steinfurt-94857,"Du hast Spaß daran, Technik zu verstehen und Kollegen weltweit zu unterstützen? Dann komm in unser Support-Team! Aufgaben Technischer Support: telefonische Unterstützung von Servicetechnikern und Monteuren bei der Inbetr"
raw-0129,2026-06-24,Arbeitnow API,Yalwa GmbH,Quality Assurance Engineer (m/f/d),Software & Engineering,Internet and software,Entry-level,Wiesbaden,"Full-time permanent, entry",Communication; JavaScript; Automation; Android; Testing; Design; CI/CD; Sales; SQL; Git; API; iOS,Internet and software; high school coursework,54120,77880,66000,69.1,38,30.3,136,https://www.arbeitnow.com/jobs/companies/yalwa-gmbh/quality-assurance-engineer-wiesbaden-288665,"Full-Time • First Experience • Wiesbaden • (m/f/d) At Yalwa, bringing people together is our mission. We strive to make the digital world a place where people build real-life connections. Working at Yalwa means being par"
raw-0130,2026-06-24,Arbeitnow API,Plusnet GmbH,Werkstudent im Onlinevertrieb - Schwerpunkt SEO und Content Management (m/w/d),Marketing & Growth,Telecommunication,Internship/Student,Köln,"Part-time fixed-term, student (college)",Communication; SEO,Telecommunication; high school or equivalent,27060,38940,33000,72.9,38,30.3,136,https://www.arbeitnow.com/jobs/companies/plusnet-gmbh/werkstudent-im-onlinevertrieb-schwerpunkt-seo-und-content-management-koln-471184,"Liebe*r Student*in heute bewerben wir uns bei dir und stellen dir unser Unternehmen, unsere Leistungen und Besondere an Plusnet vor: Wir leben und gestalten Kommunikation Die Plusnet GmbH, eine Tochtergesellschaft der En"
raw-0131,2026-06-24,Arbeitnow API,Nord-Ostsee Automobile,(Senior) HR Assistant (m/w/d),Product & Project Management,Automotive,Senior/Lead,Hamburg,"Full-time permanent, entry",HR,Automotive; vocational,84132,121068,102600,65.1,48,38.6,123,https://www.arbeitnow.com/jobs/companies/nord-ostsee-automobile/senior-hr-assistant-hamburg-60291,"Lust auf Leistung Nord-Ostsee Automobile ist Teil der internationalen Van Mossel Automotive Group, einer der erfolgreichsten Automobilhandelsgruppen Europas. Gemeinsam verbinden wir regionale Stärke mit internationaler K"
raw-0132,2026-06-24,Arbeitnow API,Nailscamp GmbH,Junior Digital Graphic Designer,Marketing & Growth,Graphic Arts and Communication Design,Entry-level,Berlin,,Communication; Design; Cloud; AI,Graphic Arts and Communication Design,36900,53100,45000,97.1,46,33.8,125,https://www.arbeitnow.com/jobs/companies/nailscamp-gmbh/junior-digital-graphic-designer-berlin-74629,"We are Proglow, a fast-growing B2C beauty brand specializing in nail products and nail polish, based in Berlin and Saarbrücken, Germany. With our two brands Ongle24 and Proglow we are the market leader in France and are "
raw-0133,2026-06-24,Arbeitnow API,Tangany GmbH,HR Generalist mit Office Management (w/m/d),Software & Engineering,HR,Mid-level,Munich,berufserfahren,HR; Onboarding,HR,72160,103840,88000,70.1,38,30.3,136,https://www.arbeitnow.com/jobs/companies/tangany-gmbh/hr-generalist-mit-office-management-munich-340523,"Tangany mit Sitz in München ist ein hoch innovatives Technologieunternehmen mit einer marktführenden B2B-Lösung für die Verwahrung digitaler Assets auf der Blockchain (z. B. Kryptowährungen, tokenisierte Vermögenswerte, "
raw-0134,2026-06-24,Arbeitnow API,GUGGENMOS Personalmanagement GmbH & Co. KG,Vertriebsleiter (m/w/d) | Ref.-Nr. 10618,Product & Project Management,Management,Unspecified,Marktoberdorf,,Product Management; Project Management; Agile; Stakeholder Management,Management; Team Leader,57334,82506,69920,56.1,38,30.3,136,https://www.arbeitnow.com/jobs/companies/guggenmos-personalmanagement-gmbh-co-kg/vertriebsleiter-ref-nr-10618-marktoberdorf-235739,Als mittelständisches Unternehmen aus dem Bereich Bau- / Land- / Forst- und Kommunaltechnik suchen wir zur Verstärkung unseres Teams im Allgäu einen Vertriebsleiter (m/w/d) . Aufgaben nationale und internationale Händler
raw-0135,2026-06-24,Arbeitnow API,trafficdesign GmbH,Strategic Growth Manager:in - New Business (m/w/d),Marketing & Growth,Business Development,Senior/Lead,Cologne,berufserfahren,Sales,Business Development,66420,95580,81000,77.3,48,38.6,123,https://www.arbeitnow.com/jobs/companies/trafficdesign-gmbh/strategic-growth-managerin-new-business-cologne-155509,"Du gibst dich nicht damit zufrieden, nur zu verwalten, was reinkommt, sondern willst als echter Hunter das Wachstum einer High-End-Agentur aktiv mitgestalten? ✨ Als Strategic Growth Manager:in – New Business (m/w/d) bei "
raw-0136,2026-06-24,Arbeitnow API,jemix GmbH,"Werkstudent (m/w/d) – Prozesse, ERP & ISMS / ISO 27001",Product & Project Management,Business Operations,Internship/Student,Berlin,"Working student, berufseinstieg",Operations; Excel; ERP,Business Operations,34276,49324,41800,62.8,38,30.3,136,https://www.arbeitnow.com/jobs/companies/jemix-gmbh/werkstudent-prozesse-erp-isms-iso-27001-berlin-151969,"Deine Aufgaben: Du willst verstehen, wie ein IT-Unternehmen intern funktioniert – und aktiv dabei helfen, Prozesse effizienter, sicherer und zertifizierungsfähig zu machen? Als Werkstudent (m/w/d) unterstützt du uns beim"
raw-0137,2026-06-24,Arbeitnow API,jemix GmbH,Werkstudent (m/w/d) – HaloPSA & Cloud-Integrationen,Software & Engineering,Software Development,Internship/Student,Berlin,"Working student, berufseinstieg",Cloud; REST,Software Development,39688,57112,48400,84.6,46,33.8,125,https://www.arbeitnow.com/jobs/companies/jemix-gmbh/werkstudent-halopsa-cloud-integrationen-berlin-433862,"Deine Aufgaben: Du hast einen IT-Hintergrund und Lust, dich tief in ein modernes PSA-System einzuarbeiten? Bei uns drehst du dich voll und ganz um HaloPSA – von Funktionen über Konfiguration bis zu Integrationen und Schn"
raw-0138,2026-06-24,Arbeitnow API,jemix GmbH,Werkstudent (m/w/d) – AI Engineer,Data & AI,Software Development,Internship/Student,Berlin,"Working student, berufseinstieg",Data Science; AI,Software Development,38335,55165,46750,72.9,43,32.5,129,https://www.arbeitnow.com/jobs/companies/jemix-gmbh/werkstudent-ai-engineer-berlin-434296,"Deine Aufgaben: Du willst nicht nur über KI reden, sondern aktiv an einem KI-Betriebssystem und einer Agentic Platform mitbauen? Bei uns hilfst du als Werkstudent (m/w/d) dabei, unsere Produktentwicklung im Bereich KI-Ag"
raw-0139,2026-06-24,Arbeitnow API,Kokenschmidt GmbH,Projektingenieur (m/w/d) im Bereich Antragswesen - Wasserwirtschaft / Entwässerung,Software & Engineering,Power Engineering and Environmental Engineering,Unspecified,Meppen,,Python; JavaScript; API; Cloud,Power Engineering and Environmental Engineering,66387,95533,80960,98.2,62,40.7,104,https://www.arbeitnow.com/jobs/companies/kokenschmidt-gmbh/projektingenieur-im-bereich-antragswesen-wasserwirtschaft-entwasserung-meppen-394327,Für den Bereich Antragswesen der Kokenschmidt GmbH in Meppen suchen wir Sie als Projektingenieur (m/w/d) im Bereich Wasserwirtschaft/ Entwässerung. Aufgaben Sie bearbeiten Genehmigungsanträge nach dem Wasserhaushaltsgese
raw-0140,2026-06-24,Arbeitnow API,Return,Junior Projektmanager Batteriespeicher (m/w/d) Hamburg | Vollzeit | Hybrid,Software & Engineering,Engineering,Senior/Lead,Hamburg,berufseinstieg,Python; JavaScript; API; Cloud,Engineering,97416,140184,118800,98.2,72,49,91,https://www.arbeitnow.com/jobs/companies/return/junior-projektmanager-batteriespeicher-hamburg-vollzeit-hybrid-233387,"Wir treiben die Energiewende voran – und du kannst dabei sein! Bei Return entwickelst du Batteriespeicherprojekte, die darüber entscheiden, ob erneuerbare Energie wirklich im System ankommt – oder verloren geht. Wir baue"
raw-0141,2026-06-24,Arbeitnow API,TLGG,Werkstudent:in - Social Media (w/m/d),Marketing & Growth,Marketing and Communication,Internship/Student,Berlin,Working student,Communication; Social Media; Editing; Design; Video Editing,Marketing and Communication,27060,38940,33000,72.4,38,30.3,136,https://www.arbeitnow.com/jobs/companies/tlgg/werkstudentin-social-media-berlin-89877,Willkommen bei Omnicom Precision Marketing Germany Omnicom Precision Marketing Germany vereint die führenden Digital- und Precision-Marketing-Agenturen von Omnicom unter einem Dach. Mit rund 700 Mitarbeitenden und als ei
raw-0142,2026-06-24,Arbeitnow API,Riverstate Premium Recruiting,"Bauleiter / Planer TGA - HLS (m/w/d) | 65.000 € - 79.000 € (Tarifvertrag, zzgl. Sonderzahlungen)",Software & Engineering,Building,Mid-level,Frankfurt am Main,berufserfahren,Onboarding,Building; Supply; Safety Services Engineering,72160,103840,88000,75.1,38,30.3,136,https://www.arbeitnow.com/jobs/companies/riverstate-premium-recruiting/bauleiter-planer-tga-hls-65000-eur-79000-eur-tarifvertrag-zzgl-sonderzahlungen-frankfurt-am-main-165019,"37-Stunden-Woche, bis zu 79.000 € Jahresgehalt, 30 Urlaubstage (+ Heiligabend und Silvester frei), tarifliche Sonderzahlungen von rund 1,5 Monatsgehältern und ein langfristig sicherer Arbeitsplatz mitten in Frankfurt – g"
raw-0143,2026-06-24,Arbeitnow API,Reshape Energy Group,Projektabwickler / Operations Manager (m/w/d): Fokus Fachpartnermanagement,Product & Project Management,Project Management,Senior/Lead,Cologne,,Project Management; Operations,Project Management,84132,121068,102600,66.1,48,38.6,123,https://www.arbeitnow.com/jobs/companies/reshape-energy-group/projektabwickler-operations-manager-fokus-fachpartnermanagement-cologne-93957,"Die Energie5, eine dynamische Tochtergesellschaft von Reshape Energy, treibt die Energiewende durch innovative Lösungen für erneuerbare Energien in und auf Gewerbeimmobilien voran. Unser Fokus liegt auf gewerblichen Phot"
raw-0144,2026-06-24,Arbeitnow API,KJ Commerce,"Praktikum E-Commerce, Brand & Social Media (m/w/d)",Marketing & Growth,Trade Marketing,Internship/Student,Frankfurt am Main,Internship,Social Media,Trade Marketing,27060,38940,33000,77.3,38,30.3,136,https://www.arbeitnow.com/jobs/companies/kj-commerce/praktikum-e-commerce-brand-social-media-frankfurt-am-main-154207,"KJ Commerce ist eine Frankfurter E-Commerce-Holding zwischen Consulting und eigenem Brand Building. Wir beraten und skalieren führende E-Commerce-Marken – und bauen parallel unser eigenes Portfolio aus Mode-, Schmuck- un"
raw-0145,2026-06-24,Arbeitnow API,German Tote Serv.-u.Bet. GmbH,Content Creator (Video & Grafik) im Pferderennsport (m/w/d),Marketing & Growth,Social Media Manager,Unspecified,Neustadt am Rübenberge,,Social Media; Video Editing,Social Media Manager,45264,65136,55200,67.3,38,30.3,136,https://www.arbeitnow.com/jobs/companies/german-tote-serv-ubet-gmbh/content-creator-video-grafik-im-pferderennsport-neustadt-am-rubenberge-48018,"Die German Tote Service- und Beteiligungs GmbH ist ein Tochterunternehmen des größten europäischen Wettanbieters, der PMU (Pari Mutuel Urbain) und im Mitbesitz der deutschen Galopp-Rennvereine. Unter der Marke WETTSTAR v"
raw-0146,2026-06-24,Arbeitnow API,Linde AMT Schluechtern GmbH,Technischer Fachsachbearbeiter Industrial Coating Service (m/w/d),Software & Engineering,Engineering,Unspecified,Ratingen,,Python; JavaScript; API; Cloud,Engineering,66387,95533,80960,98.2,62,40.7,104,https://www.arbeitnow.com/jobs/companies/linde-amt-schluechtern-gmbh/technischer-fachsachbearbeiter-industrial-coating-service-ratingen-230129,"Die Linde AMT GmbH ist das marktführende deutsche Unternehmen für die Entwicklung, den Vertrieb und die Produktion von Verschleiß- und Korrosionsschutzschichten durch Thermisches Spritzen für einen breiten Industriekreis"
raw-0147,2026-06-24,Arbeitnow API,Linde AMT Schluechtern GmbH,Technischer Fachsachbearbeiter Luftfahrt (m/w/d),Software & Engineering,Engineering,Unspecified,Ratingen,,Python; JavaScript; API; Cloud,Engineering,66387,95533,80960,98.2,62,40.7,104,https://www.arbeitnow.com/jobs/companies/linde-amt-schluechtern-gmbh/technischer-fachsachbearbeiter-luftfahrt-ratingen-138634,"Die Linde AMT GmbH ist das marktführende deutsche Unternehmen für die Entwicklung, den Vertrieb und die Produktion von Verschleiß- und Korrosionsschutzschichten durch Thermisches Spritzen für einen breiten Industriekreis"
raw-0148,2026-06-24,Arbeitnow API,Staking Facilities GmbH,(Senior) Systems Engineer (Solana) - Remote Germany/Europe (m/f/d),Software & Engineering,Remote,Senior/Lead,Munich,professional / experienced,Communication; Operations; Security; Design,Remote; IT,97416,140184,118800,79.5,56,42.1,112,https://www.arbeitnow.com/jobs/companies/staking-facilities-gmbh/senior-systems-engineer-solana-remote-germany-europe-munich-465669,Staking Facilities is a well established blockchain infrastructure company with more than 9 years of history. We operate critical 24/7/365 high-performance bare-metal private infrastructure. We operate clusters for the b
raw-0149,2026-06-24,Arbeitnow API,Investmentbuilder Group GmbH,Account Manager / Fulfillment Manager (m/w/d),Software & Engineering,Consulting,Senior/Lead,Mainz,berufserfahren,Onboarding,Consulting,97416,140184,118800,75.1,48,38.6,123,https://www.arbeitnow.com/jobs/companies/investmentbuilder-group-gmbh/account-manager-fulfillment-manager-mainz-428033,"Investmentbuilder ist einer der am schnellsten wachsenden Premiumdienstleister für Unternehmer-Vermögensarchitektur in Deutschland. Wir beraten Unternehmer, Selbstständige und Topverdiener zu Holdingstrukturen, Steueropt"
raw-0150,2026-06-24,Arbeitnow API,agex IT gmbh,Python Entwicker (w/m/d) gesucht! Ref.Nr. 4201!,Software & Engineering,IT,Unspecified,Berlin,,Kubernetes; Python; React; SQL; Git,IT,66387,95533,80960,65.9,54,37.2,115,https://www.arbeitnow.com/jobs/companies/agex-it-gmbh/python-entwicker-gesucht-refnr-4201-berlin-439747,Für einen international agierenden Kunden suchen wir einen Python Entwicker (w/m/d). Bitte nur Bewerbungen aus DE! Aufgaben Pflege und Weiterentwicklung von Python-Webanwendungen zur Sicherstellung eines stabilen Betrieb
raw-0151,2026-06-24,Arbeitnow API,amc Group,Werkstudent KI & Unternehmensentwicklung (m/w/x),Data & AI,Process Management,Internship/Student,Munich,"Working student, hilfstätigkeit / student",Data Science,Process Management,38335,55165,46750,48.3,43,32.5,129,https://www.arbeitnow.com/jobs/companies/amc-group/werkstudent-ki-unternehmensentwicklung-munich-50787,"Künstliche Intelligenz verändert die Art, wie Unternehmen arbeiten – und wie Beratung erbracht wird. Bei der amc gestalten wir diese Entwicklung aktiv mit. Im Rahmen unserer KI-Initiative entwickeln wir neue Arbeitsweise"
raw-0152,2026-06-24,Arbeitnow API,Kevin Kehr,"Werkstudent (m/w/d) – Finance & Beratung (unternehmerisch, leistungsbasiert)",Finance & Business,Finance,Internship/Student,Hamburg,"Full-time permanent, entry",Finance; Onboarding,Finance; high school or equivalent,30668,44132,37400,72.3,38,30.3,136,https://www.arbeitnow.com/jobs/companies/kevin-kehr/werkstudent-finance-beratung-unternehmerisch-leistungsbasiert-hamburg-347406,"Du studierst und willst mehr als einen „Nebenjob“? Du willst Verantwortung, klare Ziele und ein Umfeld, in dem Leistung zählt? Dann ist diese Werkstudentenrolle dein Einstieg in die Finanzberatung, mit strukturiertem Onb"
raw-0153,2026-06-24,Arbeitnow API,eFLY Marketplace Services GmbH,Junior Google Performance & Analytics Manager (m/w/d),Data & AI,Marketing and Communication,Senior/Lead,Stuttgart,,Communication; Excel,Marketing and Communication,94095,135405,114750,79.5,53,40.8,116,https://www.arbeitnow.com/jobs/companies/efly-marketplace-services-gmbh/junior-google-performance-analytics-manager-stuttgart-346606,"In dieser Position bist du für die operative Umsetzung unseres Google-Marketings zuständig. Während die Strategie und das technische Setup vorgegeben werden, verantwortest du das fehlerfreie Einbuchen, die tägliche Pfleg"
raw-0154,2026-06-24,Arbeitnow API,AdKochMarketing GmbH,Junior Account Manager (m/w/d) - Kundenbetreuung & Projektmanagement,Marketing & Growth,Marketing and Communication,Senior/Lead,Hamburg,,Communication; Social Media,Marketing and Communication,66420,95580,81000,87.9,48,38.6,123,https://www.arbeitnow.com/jobs/companies/adkochmarketing-gmbh/junior-account-manager-kundenbetreuung-projektmanagement-hamburg-20087,"Du möchtest Verantwortung übernehmen, eng mit Kunden zusammenarbeiten und gleichzeitig lernen, wie erfolgreiche Recruiting- und Marketingprojekte gesteuert werden? Wir suchen motivierte Mitarbeiter (m/w/d) für die Kunden"
raw-0155,2026-06-24,Arbeitnow API,Beutler Saghari & Partner GmbH,"Praktikum ""Social Media/ Content Manager"" (m/w/d), Remote",Marketing & Growth,Remote,Internship/Student,Iserlohn,Internship,Social Media,Remote; Social Media Manager,27060,38940,33000,77.3,38,30.3,136,https://www.arbeitnow.com/jobs/companies/beutler-saghari-partner-gmbh/praktikum-social-media-content-manager-remote-iserlohn-292625,"Auch für uns - eine erfolgreiche, bundesweit tätige Direct Search Agentur mit Sitz in Iserlohn und Gummersbach - gewinnt das Thema Social Media und Onlinemarketing immer mehr an Bedeutung. Als Headhunter/ Personalberater"
raw-0156,2026-06-24,Arbeitnow API,Clariness GmbH,Inside Sales Executive (f/m/d),Marketing & Growth,Business Development,Unspecified,Berlin,,Customer Service; Communication; Research; Sales; CRM,Business Development,45264,65136,55200,70.8,38,30.3,136,https://www.arbeitnow.com/jobs/companies/clariness-gmbh/inside-sales-executive-berlin-225775,"Clariness is looking for an Inside Sales Executive (f/md/) based in Berlin or UK. - Full-time; unlimited - About the role: As an Inside Sales Executive, you will play an important role in supporting our commercial growth"
raw-0157,2026-06-24,Arbeitnow API,Arbeiter-Samariter-Bund Kreisverband Lübben e.V.,IT-Administrator (m/w/d),Software & Engineering,System and Network Administration,Mid-level,Lübben,berufserfahren,Python; JavaScript; API; Cloud,System and Network Administration,72160,103840,88000,98.2,62,40.7,104,https://www.arbeitnow.com/jobs/companies/arbeiter-samariter-bund-kreisverband-lubben-ev/it-administrator-lubben-303622,Der Arbeiter-Samariter-Bund Kreisverband Lübben e. V. ist mit knapp 300 Mitarbeitenden und zahlreichen Einrichtungen einer der größten sozialen Dienstleister im Landkreis Dahme-Spreewald. Von ambulanter und teilstationär
raw-0158,2026-06-24,Arbeitnow API,vedisys AG,Projektmanager für Softwareprodukte im ÖPNV (m/w/d) in Darmstadt,Software & Engineering,Project Management,Senior/Lead,Griesheim,berufserfahren,Project Management; Testing,Project Management,97416,140184,118800,62.8,48,38.6,123,https://www.arbeitnow.com/jobs/companies/vedisys-ag/projektmanager-fur-softwareprodukte-im-opnv-in-darmstadt-griesheim-434759,Als Teil unseres Projektmanagement-Teams übernimmst du eine zentrale Rolle in der Steuerung und Umsetzung von webbasierten Softwarelösungen im ÖPNV. Du bist die entscheidende Schnittstelle zwischen unseren Kunden und der
raw-0159,2026-06-24,Arbeitnow API,TenMedia GmbH,Fachinformatiker für Anwendungsentwicklung (m/w/d) | Vollzeit,Software & Engineering,Software Development,Unspecified,Berlin,,JavaScript; Full Stack; WordPress; Frontend; Backend; Docker; Azure; Scrum; AWS; Git,Software Development,66387,95533,80960,59.2,62,40.7,104,https://www.arbeitnow.com/jobs/companies/tenmedia-gmbh/fachinformatiker-fur-anwendungsentwicklung-vollzeit-berlin-449512,"Du willst im Herzen Berlins an Software mitbauen, die echte Kunden täglich nutzen? Dann bist du bei TenMedia richtig. Wir entwickeln seit über 14 Jahren Individualsoftware und suchen ab sofort einen Fachinformatiker für "
raw-0160,2026-06-24,Arbeitnow API,TenMedia GmbH,Tech Content Manager / Online-Redakteur (m/w/d) | Berlin-Mitte | Festanstellung,Software & Engineering,Online Marketing,Senior/Lead,Berlin,,Scrum; Video Editing; SEO,Online Marketing,97416,140184,118800,51.6,48,38.6,123,https://www.arbeitnow.com/jobs/companies/tenmedia-gmbh/tech-content-manager-online-redakteur-berlin-mitte-festanstellung-346635,"Du willst nicht nur über Software schreiben, sondern direkt neben den Entwicklern sitzen, die sie bauen? Dann bist du bei TenMedia richtig. Wir entwickeln seit über 14 Jahren Individualsoftware im Herzen Berlins und such"
raw-0161,2026-06-24,Arbeitnow API,TenMedia GmbH,Traumpraktikum mit Perspektive: Werde Fachinformatiker für Anwendungsentwicklung (m/w/d) bei uns in Berlin!,Software & Engineering,Software Development,Internship/Student,Berlin,Internship,JavaScript; WordPress; Frontend; Backend; Scrum; Git; C#,Software Development,39688,57112,48400,62.5,46,33.8,125,https://www.arbeitnow.com/jobs/companies/tenmedia-gmbh/traumpraktikum-mit-perspektive-werde-fachinformatiker-fur-anwendungsentwicklung-bei-uns-in-berlin-166665,TenMedia ist ein erfolgreiches Softwareunternehmen im Herzen Berlins. Wir sind seit über 14 Jahren auf den Betrieb und die Entwicklung von Individualsoftware spezialisiert. Wir suchen ab sofort einen Praktikanten (m/w/d)
raw-0162,2026-06-24,Arbeitnow API,TenMedia GmbH,Projektkoordination Softwareprojekte (m/w/d) | Berlin-Mitte | Teilzeit/Vollzeit,Software & Engineering,Project Management,Unspecified,Berlin,,Project Management; Scrum,Project Management,66387,95533,80960,55.5,38,30.3,136,https://www.arbeitnow.com/jobs/companies/tenmedia-gmbh/projektkoordination-softwareprojekte-berlin-mitte-teilzeit-vollzeit-107802,"Seit über 14 Jahren entwickeln wir bei TenMedia Individualsoftware für Mittelstand, öffentliche Hand und KRITIS-Betreiber. Unsere Software läuft dort, wo Ausfälle keine Option sind: in Behörden, bei kritischen Infrastruk"
raw-0163,2026-06-24,Arbeitnow API,PartSpace GmbH,Senior Finance Manager (m/w/d),Software & Engineering,Finance,Senior/Lead,Munich,berufserfahren,Finance; Stakeholder Management; Forecasting; Accounting; Sales; SaaS,Finance,97416,140184,118800,57.6,48,38.6,123,https://www.arbeitnow.com/jobs/companies/partspace-gmbh/senior-finance-manager-munich-268871,"Werde Teil von PartSpace und gestalte mit uns die Zukunft der Bauteilbeschaffung! PartSpace ist ein wachstumsstarkes, innovatives Tech-Unternehmen mit einer klaren Mission: Mit Künstlicher Intelligenz und echten Engineer"
raw-0164,2026-06-24,Arbeitnow API,Taxtalente.de,"Steuerberater (m/w/d) in Steinkirchen, auf Wunsch mit Partnerperspektive, gesucht - mindestens 90.000€",Software & Engineering,Directors,Unspecified,Steinkirchen,,Python; JavaScript; API; Cloud,Directors; Chief Executives,66387,95533,80960,98.2,62,40.7,104,https://www.arbeitnow.com/jobs/companies/taxtalentede/steuerberater-in-steinkirchen-auf-wunsch-mit-partnerperspektive-gesucht-mindestens-90000eur-445016,TaxTalente ist die Nr. 1 Job-Matching Plattform für Jobsuchende in der Steuerberatung. Sie suchen eine positive berufliche Veränderung? Sie möchten den nächsten Schritt in Ihrer Karriere gehen und streben möglicherweise 
raw-0165,2026-06-24,Arbeitnow API,Taxtalente.de,"Steuerberater (m/w/d) in Regensburg, auf Wunsch mit Partnerperspektive, gesucht - mindestens 90.000€",Software & Engineering,Directors,Unspecified,Regensburg,,Python; JavaScript; API; Cloud,Directors; Chief Executives,66387,95533,80960,98.2,62,40.7,104,https://www.arbeitnow.com/jobs/companies/taxtalentede/steuerberater-in-regensburg-auf-wunsch-mit-partnerperspektive-gesucht-mindestens-90000eur-449824,TaxTalente ist die Nr. 1 Job-Matching Plattform für Jobsuchende in der Steuerberatung. Sie suchen eine positive berufliche Veränderung? Sie möchten den nächsten Schritt in Ihrer Karriere gehen und streben möglicherweise 
raw-0166,2026-06-24,Arbeitnow API,Taxtalente.de,"Steuerberater (m/w/d) in Cottbus, auf Wunsch mit Partnerperspektive, gesucht - mindestens 90.000€",Software & Engineering,Directors,Unspecified,Cottbus,,Python; JavaScript; API; Cloud,Directors; Chief Executives,66387,95533,80960,98.2,62,40.7,104,https://www.arbeitnow.com/jobs/companies/taxtalentede/steuerberater-in-cottbus-auf-wunsch-mit-partnerperspektive-gesucht-mindestens-90000eur-410236,TaxTalente ist die Nr. 1 Job-Matching Plattform für Jobsuchende in der Steuerberatung. Sie suchen eine positive berufliche Veränderung? Sie möchten den nächsten Schritt in Ihrer Karriere gehen und streben möglicherweise 
