source,source_url,date_posted,company,title,category,location,job_type,tags_raw,description
Arbeitnow API,https://www.arbeitnow.com/jobs/companies/gocomo-gmbh/ai-engineer-berlin-437124,2026-05-19T10:00:36,gocomo GmbH,AI Engineer (m/w/d),Software Development,Berlin,berufserfahren,Software Development,"Deine Rolle Als AI Engineer bei gocomo übernimmst du die Verantwortung für die KI-Systeme hinter alfred, unserem Enterprise-SaaS-Produkt für Social-Media-Analytics. alfred verarbeitet monatlich tausende Nutzeranfragen über eine konversationelle KI-Oberfläche und analysiert dabei mehr als 750.000 Inhalte aus verschiedenen Plattformen. In einem kleinen, interdisziplinären Team (5–10 Personen) bist du die zentrale Ansprechperson für alle KI-relevanten Themen. Du arbeitest eng mit Frontend-, Daten- und Infrastruktur-Teams zusammen, um Features zu entwickeln, die direkt auf die Bedürfnisse unserer Kund:innen einzahlen. Deine Aufgaben Entwicklung und Betrieb eines produktionsreifen RAG-Agents (FastAPI) zur Verarbeitung von Kundenanfragen sowie Routing an spezialisierte Sub-Agenten (Text2SQL, API-Integrationen, Vektorsuche über Social-Media-Daten) Konzeption, Implementierung und Skalierung eines multimodalen Data-Enrichment-Services zur automatisierten Kategorisierung und Annotation von Social-Media-Inhalten (LLMs, Computer Vision, Audio-Transkription) Aufbau und Weiterentwicklung des Alfred Hub als kundenorientierte Plattform für KI-gestützte Workflows, insbesondere zur Kombination von Datenabruf und Annotation Mitwirkung bei Architekturentscheidungen in den Bereichen Retrieval, Routing, Evaluation und Deployment sowie Definition der technischen KI-Strategie im Unternehmen Weiterentwicklung unserer KI-Produkte: Anforderungsdefinition, Entwicklung, Deployment, Monitoring und kontinuierliche Optimierung basierend auf Nutzerfeedback Fachliche Führung eines Junior AI Engineers, inklusive technischer Anleitung, Code-Reviews und Förderung der individuellen Weiterentwicklung Dein Profil Du hast nachweisbare Erfahrung in der Entwicklung und im produktiven Einsatz von RAG-Systemen oder AI-Agents (über Prototypen hinaus) Du verfügst über sehr gute Python-Kenntnisse und hast praktische Erfahrung mit FastAPI Du bist mit gängigen LLM-APIs (z. B. OpenAI, Anthropic oder vergleichbaren) bestens vertraut, insbesondere in den Bereichen Prompt Engineering, Function Calling sowie im Umgang mit Kosten- und Latenzoptimierung Du fühlst dich wohl damit, den gesamten Stack eines KI-Systems zu verantworten – von Datenpipelines über Modellintegration und API-Design bis hin zu Deployment und Observability Du verfügst über fließende Deutschkenntnisse auf C2-Niveau sowie sehr gute Englischkenntnisse Idealerweise bringst du zusätzlich Erfahrung mit multimodalen KI-Systemen (z. B. Computer Vision), modernen AI-Frameworks und Tools aus unserem Stack sowie im Bereich Social Media Analytics mit; Erfahrung in dynamischen, schnell wachsenden Teams ist ebenfalls ein Plus Warum wir? Attraktives Gehalt &#x26; flexibles Arbeiten – Bei uns arbeitest du hybrid, mit Workation-Möglichkeit und flexiblen Arbeitszeiten, damit du Job und Leben optimal verbinden kannst Top-Equipment für dich – Damit du effizient arbeiten kannst, stellen wir dir modernste Technik zur Verfügung Offene Unternehmenskultur &#x26; Entwicklungsmöglichkeiten – Wir leben eine transparente Feedbackkultur und bieten dir Raum für deine persönliche und fachliche Weiterentwicklung Legendäre Team-Events &#x26; Offsites – Ob After-Work, Team-Retreat oder große Offsites – wir feiern unsere Erfolge und stärken den Teamgeist Sachbezug &#x26; Fitness-Benefit – monatlicher Sachbezug von 50€ zur freien Nutzung, u.a. für eine vollständig abgedeckte Mitgliedschaft bei Urban Sports Club (M-Plan). Betriebliche Altersvorsorge (bAV) – Wir unterstützen dich dabei, frühzeitig für deine Zukunft vorzusorgen Hundefreundliches Büro im Herzen Berlins – Dein Vierbeiner ist bei uns herzlich willkommen und freut sich auf neue Büro-Buddies Find Jobs in Germany on Arbeitnow"
Arbeitnow API,https://www.arbeitnow.com/jobs/companies/gocomo-gmbh/ai-engineer-berlin-110999,2026-05-19T10:00:35,gocomo GmbH,AI Engineer (m/w/d),Software Development,Berlin,professional / experienced,Software Development,"Your role As an AI Engineer at gocomo, you take ownership of the AI systems behind alfred—our enterprise SaaS product for social media analytics. alfred processes thousands of user requests per month through a conversational AI interface and analyzes more than 750,000 pieces of content across various platforms. In a small, interdisciplinary team (5–10 people), you serve as the primary point of contact for all AI-related topics. You work closely with frontend, data, and infrastructure teams to develop features that directly address the needs of our customers. Your mission Develop and operate production-ready RAG agents (FastAPI) to handle customer requests, including routing to specialized sub-agents (Text2SQL, API integrations, vector search over social media data). Design, implement, and scale a multimodal data-enrichment service for automated categorization and annotation of social media content (LLMs, computer vision, audio transcription). Build and continuously improve the Alfred Hub as a customer-oriented platform for AI-powered workflows—especially to combine data retrieval and annotation. Contribute to architecture decisions across retrieval, routing, evaluation, and deployment, and help define the company’s technical AI strategy. Advance our AI products: translate requirements into development, deploy, monitor, and continuously optimize based on user feedback. Provide subject-matter leadership for a junior AI engineer, including technical guidance, code reviews, and support for individual growth. Your profile You have proven experience in building and operating RAG systems or AI agents in production (beyond prototypes). You have excellent Python skills and practical experience with FastAPI. You are highly familiar with common LLM APIs (e.g., OpenAI, Anthropic, or similar), especially in prompt engineering, function calling, and handling cost and latency optimization. You are comfortable owning the entire stack of an AI system—from data pipelines through model integration and API design to deployment and observability. You have fluent German (C2 level) and very good English skills. Ideally, you also bring experience with multimodal AI systems (e.g., computer vision), modern AI frameworks and tools from our stack, and in social media analytics. Experience working in dynamic, fast-growing teams is a plus. Why us? Attractive compensation &#x26; flexible working — hybrid work with the option for workations and flexible hours, so you can balance your job and life in the best way. Best-in-class equipment — so you can work efficiently, we provide you with modern technology. Open company culture &#x26; growth opportunities — transparent feedback culture, plus room to develop both personally and professionally. Legendary team events &#x26; offsites — after-work get-togethers, team retreats, and big offsites—we celebrate our wins and strengthen team spirit. Benefits &#x26; fitness — monthly benefit allowance of €50 for free use, including a fully covered Urban Sports Club membership (M plan). Company pension scheme (bAV) — we support you in planning for your future early. Dog-friendly office in the heart of Berlin — your four-legged companion is very welcome and will enjoy meeting new office buddies. Find more English Speaking Jobs in Germany on Arbeitnow"
Arbeitnow API,https://www.arbeitnow.com/jobs/companies/ecoturn-gmbh/business-intelligence-specialist-munich-318174,2026-05-19T09:30:30,Ecoturn GmbH,Business Intelligence Specialist (m/w/d),Remote,Munich,,Remote; IT,"Schwerpunkt Reporting, Dashboards &#x26; datengetriebene Analyseprozesse Worum es geht Wir bauen unsere datengetriebene Unternehmenssteuerung weiter aus. Dafür suchen wir eine analytisch starke Persönlichkeit, die unsere Reporting-, Dashboard- und BI-Strukturen aktiv weiterentwickelt und Unternehmensdaten in echte Entscheidungsgrundlagen übersetzt. Die Rolle verbindet Business Intelligence, Datenanalyse und moderne Reportingprozesse mit direkter Nähe zu Finance und Unternehmenssteuerung. Dabei geht es nicht nur um Reports, sondern um Transparenz, Automatisierung und den sinnvollen Einsatz moderner Analyse- und AI-gestützter Lösungen. Deine Rolle Du entwickelst unsere BI- und Reportinglandschaft aktiv weiter und sorgst dafür, dass Daten sauber aufbereitet, sinnvoll visualisiert und operativ nutzbar werden. Dashboards, Datenmodelle, Automatisierung und moderne Analyseansätze laufen in deiner Rolle zusammen. Du arbeitest eng mit Finance, Management und operativen Teams zusammen und bringst Struktur in komplexe Daten- und Reportingprozesse. Aufgaben Reporting weiterentwickeln - Du entwickelst Dashboards, KPI-Strukturen und Reports, die echte Entscheidungen ermöglichen – nicht nur Zahlen darstellen. Daten nutzbar machen - Du analysierst Unternehmensdaten, erkennst Muster und leitest daraus konkrete Handlungsempfehlungen ab. Prozesse automatisieren - Du identifizierst Potenziale für Automatisierung sowie moderne AI-gestützte Analyse- und Reportinglösungen und hilfst dabei, Prozesse effizienter und skalierbarer zu gestalten. Datenstrukturen verbessern - Du arbeitest an konsistenten Datenmodellen, Datenqualität und nachvollziehbaren Reportingstrukturen. Schnittstellen verbinden - Du arbeitest eng mit Finance, Management und operativen Bereichen zusammen und übersetzt Anforderungen in sinnvolle BI- und Reportinglösungen. Qualifikation Analytisches Denkvermögen und strukturierte Arbeitsweise Interesse an datengetriebenem Arbeiten, BI und modernen Analyseprozessen Erste oder mehrjährige Erfahrung im Bereich Business Intelligence, Reporting oder Datenanalyse Sicherer Umgang mit Excel und digitalen Tools Verständnis für betriebswirtschaftliche Kennzahlen und Zusammenhänge Eigenverantwortliche Arbeitsweise und hoher Qualitätsanspruch Erfahrung mit Power BI oder vergleichbaren BI-Tools Grundkenntnisse in SQL oder Datenmodellen Interesse an Automatisierung und AI-gestützten Analyseprozessen Background in Wirtschaftsinformatik, Finance oder Data Analytics Benefits Moderne BI-, Reporting- und AI-Themen mit direktem Einfluss auf Unternehmensentscheidungen Viel Gestaltungsspielraum beim Aufbau und der Weiterentwicklung unserer Daten- und Reportinglandschaft Direkter Draht zu Finance und Geschäftsführung Schnelle Entscheidungen statt Konzernprozesse Entwicklungsmöglichkeiten für Junior- bis Senior-Level 100 % Remote innerhalb Deutschlands Hardware deiner Wahl Ein Umfeld, in dem Eigeninitiative ausdrücklich gewünscht ist Die Möglichkeit, Prozesse und Strukturen eines wachsenden Unternehmens aktiv mitzugestalten Kein Match? Wenn du analytisch denkst, gerne mit Daten arbeitest und moderne BI- und Analyseprozesse spannend findest, freuen wir uns trotzdem auf deine Bewerbung. Nicht jede Karriere verläuft geradlinig – entscheidend ist für uns, dass du Themen vorantreibst und Verantwortung übernehmen möchtest. Find more English Speaking Jobs in Germany on Arbeitnow"
Arbeitnow API,https://www.arbeitnow.com/jobs/companies/bedrop/senior-team-lead-crm-manager-mit-perspektive-head-of-crm-mannheim-32197,2026-05-19T09:30:30,bedrop,Senior / Team Lead CRM Manager (m/w/d) mit Perspektive Head of CRM,CRM,Mannheim,,CRM; Direct Marketing,"Während unsere Großeltern noch regelmäßig natürliche Produkte wie Honig und Propolis in die Ernährung der Familie zur Unterstützung des Immunsystems integrierten, findet man heute so gut wie keine natürlichen Produkte mehr. Genau das wollen wir mit bedrop ändern! Aus alt mach neu - wir möchten mit natürlichen Bienenprodukten das körperliche Wohlbefinden der Menschen und die Hautpflege unterstützen. Unsere Mission: Wir von bedrop wollen die Kraft der Bienenprodukte wieder zurück ins Bewusstsein der Menschen bringen. Für diese Mission benötigen wir Unterstützung! Aufgaben Verantwortung für die CRM- &#x26; Lifecycle-Marketing-Strategie inkl. Roadmap-Entwicklung Steuerung zentraler Performance-KPIs (Umsatz, Retention, LTV, CAC-Optimierung) Entwicklung und Umsetzung datengetriebener Customer Journeys und Lifecycle-Kampagnen Aufbau und Optimierung skalierbarer CRM-Architektur (Tools, Daten, Automatisierung) Durchführung von Testing- &#x26; Experiment-Frameworks zur kontinuierlichen Optimierung Enge Zusammenarbeit mit Marketing, Product und Tech Stakeholdern Loyality Programm (Honeybee Club) Abo/Subscription Modelle Leadership &#x26; Entwicklung Fachliche Verantwortung für CRM-Initiativen und perspektivisch Teamführung Mentoring von Junior- und Mid-Level-Profilen Mitgestaltung von Teamaufbau, Prozessen und CRM-Kompetenzen im Unternehmen Dein Fokus &#x26; wichtig für uns Strategisches CRM-Denken: die richtige Botschaft zur richtigen Zeit für die richtige Zielgruppe Analytischer Ansatz: datenbasierte Entscheidungen und klarer Performance-Fokus Erstellung von performancestarkem Copywriting für E-Mails (Betreffzeilen, Inhalte &#x26; Aufbau) Ownership-Mindset und Interesse daran, perspektivisch mehr Verantwortung zu übernehmen Qualifikation Mindestens 3–5 Jahre Erfahrung im CRM / E-Mail Marketing Erfahrung mit Klaviyo Du solltest bereits mit einem CRM-/E-Mail-Marketing-Tool gearbeitet haben Stark in Copywriting (verkaufsstark &#x26; edukativ) Sicher im Umgang mit Daten und KPIs Erfahrung mit Tools wie Canva, Slack und Notion Fließend Deutsch und gute Englischkenntnisse Benefits Eine langfristige Perspektive in einem schnell wachsenden Health / Food Scale-up kollegiale Zusammenarbeit in gutem Betriebsklima flache Hierarchien faire Vergütung betriebliche Altersvorsorge abwechslungsreiche und interessante Tätigkeit Scale-up Flair: Du arbeitest eng mit einem dynamischen und hochmotivierten Team zusammen Partizipationsmöglichkeiten an fachübergreifender Unternehmensentwicklung Mitarbeiter-Veranstaltungen (sofern möglich) Netzwerken auf verschiedenen Events und Termine, u.a. Judith Williams Einstellung ab sofort Werde Teil von bedrop. Bewirb dich jetzt! Wir freuen uns. Find more English Speaking Jobs in Germany on Arbeitnow"
Arbeitnow API,https://www.arbeitnow.com/jobs/companies/isg-automation-gmbh/elektroingenieur-projektingenieur-projektleitung-gebaudeautomatisierung-hamburg-53232,2026-05-19T09:30:30,ISG - automation GmbH,"Elektroingenieur, Projektingenieur (m/w/d) Projektleitung Gebäudeautomatisierung",Automation Engineering,Hamburg,,Automation Engineering,"Übernehmen Sie Verantwortung – als Projektleiter (m/w/d) Gebäudeautomation Die ISG – automation GmbH ist ein unabhängiges, inhabergeführtes Ingenieurbüro für Gebäude-, Industrie- und Schiffsautomation mit Sitz in Rostock. Seit 2013 entwickeln wir ganzheitliche Automationslösungen, die Innovation, Effizienz und Praxis verbinden. Mit einem engagierten Team erfahrener Ingenieure realisieren wir anspruchsvolle Projekte für öffentliche und private Auftraggeber. Zur Verstärkung unseres Teams suchen wir einen Projektleiter , Elektroingenieur , Projektingenieur oder Meister / Techniker (w/m/d) mit technischem Know-how, Führungskompetenz und Leidenschaft für intelligente Gebäudetechnik. Aufgaben Eigenverantwortliche Leitung und Steuerung von Bauprojekten im Bereich Gebäudeautomation (HOAI LP1–LP9) Fachplanung von Automations- und MSR-Anlagen für Neu- und Bestandsgebäude Projektmanagement, Inbetriebnahmemanagement und Qualitätssicherung Entwicklung von Automationskonzepten, Erstellung von GA-Musterlösungen, Lastenheften und Leistungsbeschreibungen Erstellung technischer Dokumentationen, MSR-Schemata und Funktionslisten Abstimmung mit Bauherren, Architekten, Fachplanern und Nachunternehmern Unterstützung bei Kundenberatung, Vertragsverhandlungen und Projektcontrolling Förderung und fachliche Unterstützung von Teammitgliedern Qualifikation Abgeschlossenes Studium in Elektrotechnik, Automatisierungstechnik, Gebäudeautomation oder vergleichbarer Fachrichtung von Vorteil Mehrjährige Berufserfahrung in Planung und Projektierung von Gebäudeautomationssystemen Fundierte Kenntnisse in MSR-Technik, GA-Systemen und Kommunikationsprotokollen (z. B. KNX, BACnet, Modbus) Erfahrung mit CAD-Software (TRIC, AutoCAD) und sicherer Umgang mit MS Office Ausgeprägte Kommunikationsstärke, Organisationstalent und Eigeninitiative Gute Deutsch- und Englischkenntnisse in Wort und Schrift Grundkenntnisse in Kalkulation, HOAI, VOB und technischen Normen Reisebereitschaft (Schwerpunkt Norddeutschland) Benefits Firmenwagen zur privaten Nutzung Flexible, eigenverantwortliche Arbeitszeiten &#x26; Homeoffice-Möglichkeit EGYM Wellpass für Fitness &#x26; Gesundheit Jobrad-Leasing für nachhaltige Mobilität Gezielte Weiterbildungsmöglichkeiten (z. B. GA-Fachwirt) Flache Hierarchien, kurze Entscheidungswege &#x26; offenes Team Obligatorischer Obstkorb, Team-Events &#x26; gemeinsamer Austausch Optional: Zuschuss zum Jobticket oder ÖPNV-Ticket Werden Sie Teil eines innovativen Ingenieurbüros – gestalten Sie Automationsprojekte mit echtem Mehrwert. Bewerben Sie sich jetzt! Find Jobs in Germany on Arbeitnow"
Arbeitnow API,https://www.arbeitnow.com/jobs/companies/isg-automation-gmbh/elektroingenieur-projektingenieur-projektleitung-gebaudeautomatisierung-berlin-456946,2026-05-19T09:30:30,ISG - automation GmbH,"Elektroingenieur, Projektingenieur (m/w/d) Projektleitung Gebäudeautomatisierung",Automation Engineering,Berlin,,Automation Engineering,"Übernehmen Sie Verantwortung – als Projektleiter (m/w/d) Gebäudeautomation Die ISG – automation GmbH ist ein unabhängiges, inhabergeführtes Ingenieurbüro für Gebäude-, Industrie- und Schiffsautomation mit Sitz in Rostock. Seit 2013 entwickeln wir ganzheitliche Automationslösungen, die Innovation, Effizienz und Praxis verbinden. Mit einem engagierten Team erfahrener Ingenieure realisieren wir anspruchsvolle Projekte für öffentliche und private Auftraggeber. Zur Verstärkung unseres Teams suchen wir einen Projektleiter , Elektroingenieur , Projektingenieur oder Meister / Techniker (w/m/d) mit technischem Know-how, Führungskompetenz und Leidenschaft für intelligente Gebäudetechnik. Aufgaben Eigenverantwortliche Leitung und Steuerung von Bauprojekten im Bereich Gebäudeautomation (HOAI LP1–LP9) Fachplanung von Automations- und MSR-Anlagen für Neu- und Bestandsgebäude Projektmanagement, Inbetriebnahmemanagement und Qualitätssicherung Entwicklung von Automationskonzepten, Erstellung von GA-Musterlösungen, Lastenheften und Leistungsbeschreibungen Erstellung technischer Dokumentationen, MSR-Schemata und Funktionslisten Abstimmung mit Bauherren, Architekten, Fachplanern und Nachunternehmern Unterstützung bei Kundenberatung, Vertragsverhandlungen und Projektcontrolling Förderung und fachliche Unterstützung von Teammitgliedern Qualifikation Abgeschlossenes Studium in Elektrotechnik, Automatisierungstechnik, Gebäudeautomation oder vergleichbarer Fachrichtung von Vorteil Mehrjährige Berufserfahrung in Planung und Projektierung von Gebäudeautomationssystemen Fundierte Kenntnisse in MSR-Technik, GA-Systemen und Kommunikationsprotokollen (z. B. KNX, BACnet, Modbus) Erfahrung mit CAD-Software (TRIC, AutoCAD) und sicherer Umgang mit MS Office Ausgeprägte Kommunikationsstärke, Organisationstalent und Eigeninitiative Gute Deutsch- und Englischkenntnisse in Wort und Schrift Grundkenntnisse in Kalkulation, HOAI, VOB und technischen Normen Reisebereitschaft (Schwerpunkt Norddeutschland) Benefits Firmenwagen zur privaten Nutzung Flexible, eigenverantwortliche Arbeitszeiten &#x26; Homeoffice-Möglichkeit EGYM Wellpass für Fitness &#x26; Gesundheit Jobrad-Leasing für nachhaltige Mobilität Gezielte Weiterbildungsmöglichkeiten (z. B. GA-Fachwirt) Flache Hierarchien, kurze Entscheidungswege &#x26; offenes Team Obligatorischer Obstkorb, Team-Events &#x26; gemeinsamer Austausch Optional: Zuschuss zum Jobticket oder ÖPNV-Ticket Werden Sie Teil eines innovativen Ingenieurbüros – gestalten Sie Automationsprojekte mit echtem Mehrwert. Bewerben Sie sich jetzt! Find Jobs in Germany on Arbeitnow"
Arbeitnow API,https://www.arbeitnow.com/jobs/companies/bela-aqua-gmbh/digital-growth-content-manager-zusmarshausen-420731,2026-05-19T09:30:29,Bela Aqua GmbH,Digital Growth & Content Manager (m/w/d),Marketing and Communication,Zusmarshausen,,Marketing and Communication,"Gesucht wird eine moderne, digital denkende Persönlichkeit, die Marketing, Content, Systeme und Wachstum gekonnt miteinander verbindet. Die Position verbindet kreatives Marketing mit digitalem Verständnis, Content Creation, E-Commerce und einer modernen KI-gestützten Arbeitsweise. Aufgaben Digitales Wachstum &#x26; Kampagnen: Planung und Umsetzung digitaler Marketingkampagnen, Funnels und Customer Journeys inklusive Analyse und Optimierung relevanter KPIs, Conversion-Rates sowie Performance-Marketing-Maßnahmen (Meta- &#x26; Google Ads, SEO) Content &#x26; Creative: Erstellung von Content und Marketingmaterialien für Social Media, Newsletter, Shop, Website und Print sowie Nutzung moderner KI-Tools zur effizienten Content- und Design-Erstellung. E-Commerce &#x26; Systeme: Pflege und Weiterentwicklung des Shopify-Stores sowie Unterstützung digitaler Prozesse und Workflows zwischen Shopify, Odoo und weiteren Systemen. Qualifikation Strukturierte, moderne und eigenverantwortliche Arbeitsweise Interesse an digitalen Marken, E-Commerce und Wachstum Erfahrung mit Shopify, Marketingtools oder CMS-Systemen Gespür für Design, Content und Markenauftritt Grundverständnis für SEO, Performance Marketing, Meta Ads und Google Ads Offenheit gegenüber KI-Tools und digitalen Automationen Grundkenntnisse in HTML/CSS Erfahrung mit Odoo oder ERP-Systemen von Vorteil Benefits Mitarbeit am Aufbau innovativer Marken im Bereich Wasser, Gesundheit und Lifestyle Direkte Mitgestaltung und flache Hierachien mit schnellen Entscheidungswegen Moderne, effiziente und KI-gestützte Arbeitsprozesse Unbefristete Festanstellung in einem etablierten Familienunternehmen mit über 19 Jahren Marktpräsenz Leistungsgerechte Vergütung und attraktive Zusatzleistungen Die Bela Aqua GmbH gehört seit vielen Jahren zu den führenden Unternehmen im Bereich moderner Wasseraufbereitung im deutschsprachigen Raum. Wir verbinden Premium-Qualität, moderne Technologien und innovative Konzepte – und entwickeln unsere Markenwelt kontinuierlich weiter. Find Jobs in Germany on Arbeitnow"
Arbeitnow API,https://www.arbeitnow.com/jobs/companies/dicos/it-operations-consultant-monitoring-infrastruktur-darmstadt-85823,2026-05-19T09:30:29,DICOS,IT Operations Consultant Monitoring & Infrastruktur (m/w/d),Consulting,Darmstadt,berufserfahren,Consulting; Engineering,"DICOS ist ein unabhängiges Software- und Beratungsunternehmen mit Sitz in Darmstadt. Seit mehr als 25 Jahren entwickeln wir leistungsfähige IT-Lösungen für namhafte Kunden – mit Fokus auf Automation, Software Development sowie API- und Infrastructure Management. Wir wachsen kontinuierlich – und freuen uns auf Menschen, die mit uns die Zukunft der IT gestalten möchten. Aufgaben Deine Erfahrung aus der IT-Administration setzt Du ein, um in anspruchsvollen Projekten für Großkonzerne zentrale IT-Monitoring-Lösungen aufzubauen und weiterzuentwickeln. In Teamarbeit integrierst Du Herstellerlösungen in komplexe IT-Landschaften und passt sie an die individuellen Kundenanforderungen an. Im Anschluss stellst Du den zuverlässigen und leistungsfähigen Betrieb sicher. Als verlässlicher Ansprechpartner begleitest Du unsere Kunden bei Fragen, Optimierungswünschen und neuen Herausforderungen. Darüber hinaus vertiefst Du fortlaufend Dein Wissen im Bereich IT-Infrastruktur- und Monitoring-Management und erwirbst Zertifizierungen – insbesondere für IBM-Technologien. Qualifikation Nach Deinem Bachelor-Abschluss hast Du einige Jahre als IT-Administrator gearbeitet und bringst Erfahrung in der Überwachung und dem Betrieb von IT-Umgebungen mit: On-premises, in der Cloud oder hybrid. Dir macht es Spaß, technische Herausforderungen anzugehen und passende Lösungen zu entwickeln. Mit Linux, Windows, Scriptsprachen sowie Begriffen wie REST oder IP bist Du vertraut. Kubernetes / OpenShift sind Dir nicht fremd. Optional bringst du Erfahrungen mit Monitoring-Tools oder der Netcool-Suite von IBM mit. Beratungskompetenz und Kommunikationsstärke in Deutsch (mind. C1 Level) und Englisch runden Dein Profil ab. Benefits DAS ERWARTET DICH: Wir sind rund 70 Kolleginnen und Kollegen, die gemeinsam an sicheren und zukunftsfähigen IT-Lösungen arbeiten – fachlich stark, menschlich auf Augenhöhe. Wir schätzen den offenen Austausch, kurze Entscheidungswege und die Freiheit, Arbeit flexibel zu gestalten. Ob im Büro oder remote: Wir legen Wert auf ein Umfeld, in dem man sich wohlfühlt – mit moderner Ausstattung, Snacks &#x26; Getränken und einem lebendigen Miteinander. Und weil Zusammenarbeit mehr ist als Arbeit, kommen wir auch nach Feierabend gern zusammen: beim Spieleabend, Grillen oder auf ein gemeinsames Feierabendgetränk. WARUM GENAU DU zu uns passt? Weil Du Lösungen von der Stange langweilig findest, kein Durchschnittstyp bist und Lust hast, mitzudenken, mitzureden und mitzugestalten! Find Jobs in Germany on Arbeitnow"
