source,source_url,date_posted,company,title,category,location,job_type,tags_raw,description
Arbeitnow API,https://www.arbeitnow.com/jobs/companies/12minutes-gmbh/social-media-creatorin-fur-family-brand-teilzeit-oder-freelance-100-remote-und-flexibel-berlin-90666,2026-06-28T10:00:29,12minutes GmbH,"Social Media Creatorin für Family Brand (Teilzeit oder Freelance, 100% remote und flexibel)",Remote,Berlin,,Remote; Marketing and Communication,"Wir suchen eine kreative, schnelle und social-native Person (m/w(d), die Lust hat, unsere trendy Erste-Hilfe-Sets für Familien ouchie und unseren Erste-Hilfe-Kurs 12minutes auf Instagram, TikTok &#x26; Co. sichtbar zu machen. Die Stelle ist 100% remote, komplett flexibel in der Zeiteinteilung. Du liebst gute Hooks, erkennst Trends früh, kannst aus einer Produktidee ein starkes Reel-Konzept machen und hast keine Scheu, direkt mit Menschen auf Social Media zu schreiben? Dann passt du wahrscheinlich ziemlich gut zu uns. Aufgaben Du entwickelst Content-Ideen für Instagram, TikTok und Reels; von Hooks über Skripte bis zu einfachen Storyboards. Du beantwortest Anfragen und Kommentare auf Instagram, TikTok und anderen Social-Kanälen. Du recherchierst passende Creator:innen und Influencer:innen, schreibst sie an und koordinierst Kooperationen. Du beobachtest Trends, Sounds, Formate und Wettbewerber und übersetzt sie in konkrete Content-Ideen für unsere Marken. Du unterstützt bei der Planung des Redaktionskalenders und bringst eigene kreative Ideen ein. Qualifikation Du verstehst Instagram, TikTok und Creator-Marketing nicht nur theoretisch, sondern nutzt die Plattformen selbst aktiv. Du kannst gut schreiben: locker, klar, charmant Du hast ein gutes Gespür für Ästhetik, Trends, Zielgruppen und Social-Media-Dynamiken. Du arbeitest selbstständig, zuverlässig und schnell. Erfahrung mit Canva, CapCut, Instagram, TikTok, Notion oder ähnlichen Tools ist ein Plus. Noch wichtiger als ein perfekter Lebenslauf: Du hast Lust, Dinge auszuprobieren, aus Daten und Feedback zu lernen und mit uns Marken aufzubauen, die Menschen wirklich erreichen. Benefits Ein kleines, unternehmerisches Team mit kurzen Wegen und viel Gestaltungsspielraum. Produkte und Marken mit echtem Potenzial, starken Geschichten und viel Social-Media-Fit. Kein Konzern-Blabla, sondern ehrliches Testing, schnelle Umsetzung und viel Raum für eigene Ideen. Flexible Zusammenarbeit: Minijob, Teilzeit oder Freelance möglich 10-20 Stunden die Woche. Ganz wichtig, bitte schick uns (sonst können wir deine Bewerbung nicht prüfen): Einen Link zu einem von dir erstellen Beispiel Post zu 12minutes und ouchie. Bitte füge die Link (Wetransfer, Google Drive oä) dazu direkt in dein Anschreiben ein! Wir freuen uns auch besonders über die Bewerbung von Mamas! Find Jobs in Germany on Arbeitnow"
Arbeitnow API,https://www.arbeitnow.com/jobs/companies/jobbusters-gmbh/bilanzbuchhalter-senior-accountant-augsburg-102782,2026-06-28T10:00:29,Jobbusters® GmbH,Bilanzbuchhalter / Senior Accountant (m/w/d),Finance,Augsburg,,Finance,"Die Jobbusters vermittelt im Rahmen der Direktvermittlung an ein erfolgreiches, familiengeführtes Produktionsunternehmen mit langjähriger Tradition und internationaler Ausrichtung. Unser Mandant entwickelt und produziert hochwertige Spezialprodukte für anspruchsvolle Industriekunden und steht für Qualität, Innovation sowie nachhaltiges Wachstum. Zur Verstärkung des Finance-Teams suchen wir zum nächstmöglichen Zeitpunkt einen engagierten Bilanzbuchhalter / Senior Accountant (m/w/d) . Aufgaben Eigenständige Erstellung und Analyse von Monats-, Quartals- und Jahresabschlüssen gemäß HGB Unterstützung bei der Aufstellung des Konzernabschlusses sowie bei Konsolidierungsprozessen innerhalb der Unternehmensgruppe Überwachung und kontinuierliche Verbesserung von Abschluss- und Berichtsprozessen hinsichtlich Qualität und Termintreue Betreuung zentraler Bereiche der Finanzbuchhaltung und Sicherstellung reibungsloser Abläufe Abstimmung von Haupt- und Nebenbuchkonten sowie konzerninternen Verrechnungen Kompetente Schnittstelle für externe Prüfer, Berater und interne Fachbereiche Organisation und Begleitung von Jahresabschluss-, Steuer- und Betriebsprüfungen Fachliche Unterstützung des Managements bei finanzwirtschaftlichen und bilanziellen Fragestellungen Mitwirkung bei steuerlichen Sachverhalten und der Erstellung behördlicher MeldungenIdentifikation von Optimierungspotenzialen innerhalb der Finanzprozesse und deren Umsetzung Weiterentwicklung digitaler Arbeitsabläufe, Reporting-Instrumente und Automatisierungslösungen Mitarbeit in unternehmensweiten Projekten mit Bezug zu Finance, Reporting und Compliance Qualifikation Abgeschlossenes Studium mit Schwerpunkt Finanzen, Rechnungswesen oder Controlling beziehungsweise eine vergleichbare Qualifikation, beispielsweise als Bilanzbuchhalter (IHK) Mehrjährige praktische Erfahrung im Bereich Accounting, Finanzbuchhaltung oder Abschlusserstellung Fundiertes Wissen in der Rechnungslegung nach HGB und sicherer Umgang mit Jahresabschlüssen Kenntnisse im Konzernrechnungswesen oder in Konsolidierungsprozessen sind von Vorteil Souveränes Auftreten gegenüber externen Prüfern, Steuerberatern und internen Stakeholdern Anwenderkenntnisse in ERP-Systemen, idealerweise im Umfeld moderner Microsoft-LösungenSehr gute Fähigkeiten im Umgang mit Excel sowie ein ausgeprägtes Verständnis für Zahlen und Prozesse Begeisterung für digitale Transformation, Prozessoptimierung und moderne Finanzorganisationen Strukturierte, eigenverantwortliche und zielorientierte Arbeitsweise Kommunikationsstärke, analytisches Denkvermögen und ein hohes Maß an Verantwortungsbewusstsein Gute Englischkenntnisse für den Austausch mit internationalen Ansprechpartnern Benefits Eine vielseitige Position mit hoher Eigenverantwortung und langfristiger Perspektive Direkte Zusammenarbeit mit Entscheidungsträgern in einem erfolgreichen mittelständischen Unternehmensumfeld Kurze Kommunikationswege und ein unkompliziertes, kollegiales Miteinander Möglichkeit, Prozesse aktiv mitzugestalten und eigene Ideen einzubringen Modernes Arbeitsumfeld mit Fokus auf Innovation und DigitalisierungIndividuelle Förderung durch fachliche und persönliche Weiterbildungsangebote Gute Verkehrsanbindung und komfortable Erreichbarkeit des StandortsFahrradleasing-Angebot für eine nachhaltige Mobilität Attraktive Rahmenbedingungen inklusive zusätzlicher Benefits Dann freuen wir uns auf Ihre Bewerbung. Die Jobbuster begleiten Sie während des gesamten Bewerbungsprozesses und steht Ihnen als persönlicher Ansprechpartner jederzeit zur Verfügung. Bewerben Sie sich jetzt und gestalten Sie die Zukunft eines erfolgreichen mittelständischen Unternehmens aktiv mit. Find Jobs in Germany on Arbeitnow"
Arbeitnow API,https://www.arbeitnow.com/jobs/companies/jobbusters-gmbh/bilanzbuchhalter-munich-474493,2026-06-28T10:00:28,Jobbusters® GmbH,Bilanzbuchhalter (m/w/d),Finance,Munich,,Finance,"Die Jobbusters vermitteln im Rahmen der Direktvermittlung für den Standort München an einen Exportweltmeister (50 Länder) und internationaler Ausrichtung aus dem technischen Bereich. Unser Mandant entwickelt und produziert hochwertige Spezialprodukte für anspruchsvolle Industriekunden und steht für Qualität, Innovation sowie nachhaltiges Wachstum. Zur Verstärkung des Finance-Teams suchen wir zum nächstmöglichen Zeitpunkt einen engagierten Bilanzbuchhalter (m/w/d) . Aufgaben Eigenverantwortliche Erstellung von Monats-, Quartals- und Jahresabschlüssen nach HGB Mitwirkung bei der Erstellung des Konzernabschlusses einschließlich Konsolidierung von Tochtergesellschaften Sicherstellung einer hohen Abschlussqualität sowie termingerechter Reporting- und Abschlussprozesse Verantwortung für ausgewählte Bereiche der laufenden Finanzbuchhaltung Durchführung von Konten-, Intercompany- und SaldenabstimmungenAnsprechpartner für Wirtschaftsprüfer, Steuerberater, Betriebsprüfer sowie interne Fachabteilungen Vorbereitung und Begleitung von Jahresabschluss- und Betriebsprüfungen Unterstützung der Geschäftsführung bei bilanziellen, betriebswirtschaftlichen und prozessbezogenen Fragestellungen Mitarbeit bei steuerlichen Themenstellungen und statistischen Meldungen Analyse, Optimierung und Digitalisierung von Accounting- und Finance-Prozessen Aktive Mitgestaltung effizienter Workflows, Automatisierungen und moderner Reporting-Strukturen Mitarbeit an bereichsübergreifenden Projekten und Sonderthemen Qualifikation Erfolgreich abgeschlossenes betriebswirtschaftliches Studium mit Schwerpunkt Rechnungswesen, Finanzen oder Controlling oder eine Weiterbildung zum geprüften Bilanzbuchhalter (IHK) Mehrjährige Berufserfahrung im Finanz- und Rechnungswesen eines mittelständischen Unternehmens oder Konzerns Fundierte Kenntnisse in der Bilanzierung und Abschlusserstellung nach HGB Erfahrung in der Konzernkonsolidierung von VorteilSicheres Auftreten im Umgang mit Wirtschaftsprüfern und Steuerberatern Gute ERP-Kenntnisse, idealerweise in Microsoft Dynamics 365 Business Central Sehr gute Excel-Kenntnisse sowie eine ausgeprägte Zahlen- und ProzessaffinitätInteresse an Digitalisierung, Automatisierung und modernen Finance-Strukturen Selbstständige, strukturierte und lösungsorientierte ArbeitsweiseUnternehmerisches Denken, Kommunikationsstärke und Verantwortungsbewusstsein Gute Englischkenntnisse für die Zusammenarbeit mit internationalen Gesellschaften Benefits Verantwortungsvolle Schlüsselposition mit direktem Einfluss auf die Weiterentwicklung des Finanzbereichs Langfristige Perspektive in einem erfolgreichen und wirtschaftlich stabilen Unternehmen Flache Hierarchien und kurze EntscheidungswegeHoher Gestaltungsspielraum bei der Optimierung von Prozessen und Strukturen Moderne Arbeitsumgebung mit zukunftsorientierten Digitalisierungsprojekten Individuelle Weiterbildungs- und Entwicklungsmöglichkeiten Sehr gute Erreichbarkeit mit öffentlichen Verkehrsmitteln Fahrradleasing (JobRad)Attraktives Vergütungspaket sowie zusätzliche Sozialleistungen Dann freuen wir uns auf Ihre Bewerbung. Die Jobbuster begleiten Sie während des gesamten Bewerbungsprozesses und steht Ihnen als persönlicher Ansprechpartner jederzeit zur Verfügung. Bewerben Sie sich jetzt und gestalten Sie die Zukunft eines erfolgreichen mittelständischen Unternehmens aktiv mit. Find more English Speaking Jobs in Germany on Arbeitnow"
Arbeitnow API,https://www.arbeitnow.com/jobs/companies/jobbusters-gmbh/finanzbuchhalter-nuremberg-261065,2026-06-28T10:00:27,Jobbusters® GmbH,Finanzbuchhalter (m/w/d),Finance,Nuremberg,,Finance,"Zahlenjäger/in in der Buchhaltung gesucht! 📍 Standort: Nürnberg 🕰️ Eintritt: so schnell wie dein Taschenrechner rechnet 📄 Beschäftigungsart: Vollzeit Du spürst es genau – da spukt noch etwas im Zahlenwerk. Ein offener Posten hier, ein Buchungsdifferenzchen dort. Du lässt dich nicht so leicht erschrecken? Dann lies weiter! Unser A Partner ist ein familiengeführtes Unternehmen in der Immobilienbranche, das sich auf die Beratung und Konzeption von Immobilienportfolios für Privatanleger spezialisiert hat. Mit einem Hintergrund der Professionalität, effizienten Prozessen und hochwertigen Investments setzt unser A-Partner seit seiner Gründung Maßstäbe in der Immobilienwelt. In München schlägt das Herz eines wahren Spezialisten für zielgerichtete Immobilieninvestment-Beratung – und genau dort suchen wir dich. Aufgaben Eigenständige Bearbeitung der Finanzbuchhaltung für verschiedene Gesellschaften Erstellung von Umsatzsteuervoranmeldungen und weiteren steuerlichen Meldungen Mitwirkung bei der Erstellung von Jahresabschlüssen Vorbereitung und Durchführung von Lohn- und Gehaltsabrechnungen Ansprechpartner/in für steuerliche Fragestellungen sowie Korrespondenz mit Finanzbehörden Allgemeine Verwaltungsaufgaben im Bereich Finanzbuchhaltung und Steuern Qualifikation Abgeschlossene kaufmännische Ausbildung – idealerweise als Buchhalter/in oder Steuerfachangestellte/r Mehrjährige Berufserfahrung in der Finanzbuchhaltung Fundierte Kenntnisse im Umgang mit DATEV und den rechtlichen Grundlagen der Buchhaltung Strukturierte und eigenständige Arbeitsweise, hohes Verantwortungsbewusstsein und analytisches Denkvermögen Teamfähigkeit und Kommunikationsstärke Benefits Modernes Hybrid Working (60/40): Genieße die perfekte Balance aus mobilem Arbeiten und persönlichem Austausch im Büro – flexibel und zeitgemäß. Individuell gestaltbare Arbeitszeiten: Dank eines flexiblen Gleitzeitmodells mit fairem Überstundenausgleich bleibt Raum für Work-Life-Balance und persönliche Bedürfnisse. Großzügige Urlaubsgestaltung: Mit 30 Urlaubstagen und der zusätzlichen Option, Urlaubstage hinzuzukaufen, steht deiner Erholung nichts im Weg. Komfortabel und nachhaltig unterwegs: Profitiere von einem attraktiven Zuschuss zum Deutschlandticket und komme umweltfreundlich und kostengünstig ans Ziel. Zukunft aktiv gestalten: Mit einer betrieblichen Altersvorsorge investierst du schon heute in deine finanzielle Sicherheit von morgen. Klingt nach Ihrer nächsten beruflichen Station? Dann freuen wir uns auf Ihre Bewerbung! Find Jobs in Germany on Arbeitnow"
Arbeitnow API,https://www.arbeitnow.com/jobs/companies/careful-service-gmbh/personalsachbearbeiter-personalwesen-lohnabrechnung-recklinghausen-223445,2026-06-28T08:00:30,careful-service GmbH,Personalsachbearbeiter (m/w/d) Personalwesen & Lohnabrechnung,HR,Recklinghausen,berufserfahren,HR,"Verstärken Sie unser Team! Die careful-service GmbH ist seit über 11 Jahren auf die bundesweite Organisation und Koordination der häuslichen 24-Stunden-Betreuung spezialisiert. Zur Verstärkung unseres Teams in Recklinghausen suchen wir zum nächstmöglichen Zeitpunkt eine langjährig erfahrene Personalkraft für den Bereich Personalwesen und Lohnabrechnung. Wenn Sie Wert auf ein kollegiales Arbeitsumfeld, kurze Entscheidungswege und eine langfristige Perspektive legen, freuen wir uns darauf, Sie kennenzulernen. Aufgaben Ihre Aufgaben Eigenverantwortliche Durchführung der monatlichen Lohn- und Gehaltsabrechnung mit DATEV Pflege und Verwaltung aller Personalstammdaten Erstellung von Arbeitsverträgen, Vertragsänderungen, Bescheinigungen und sonstigen personalrelevanten Dokumenten Ansprechpartner/in für Mitarbeitende, Sozialversicherungsträger, Krankenkassen und Behörden in lohn- und personalrelevanten Fragestellungen Bearbeitung von Ein- und Austritten sowie Fehlzeiten, Urlauben und Krankmeldungen Vorbereitung und Begleitung von Prüfungen durch Sozialversicherungsträger und Behörden Unterstützung der Geschäftsführung in allen Bereichen des Personalmanagements Mitwirkung bei der Personalgewinnung und Bewerberverwaltung Enge Zusammenarbeit mit unserem Dispositionsteam in Moers Nach entsprechender Einarbeitung Mitwirkung bei der Personaleinsatzplanung unserer Betreuungskräfte Qualifikation Ihr Profil Mehrjährige, idealerweise langjährige Berufserfahrung im Personalwesen und in der Lohnabrechnung Sehr gute Kenntnisse in DATEV Lohn- und Gehaltsabrechnung Sicherer Umgang mit den Bereichen Arbeitsrecht, Sozialversicherung und Lohnsteuer Strukturierte, sorgfältige und eigenverantwortliche Arbeitsweise Hohe Vertrauenswürdigkeit und Diskretion im Umgang mit personenbezogenen Daten Ausgeprägte Kommunikationsfähigkeit und Teamgeist Sicherer Umgang mit den gängigen MS-Office-Anwendungen Benefits Was wir Ihnen bieten Einen sicheren und langfristig ausgerichteten Arbeitsplatz in einem etablierten Unternehmen Eine überdurchschnittliche Vergütung entsprechend Ihrer Qualifikation und Berufserfahrung 30 Tage Urlaub Flache Hierarchien und kurze Entscheidungswege Direkte Zusammenarbeit mit der Geschäftsführung Ein freundliches und wertschätzendes Arbeitsumfeld Eine gründliche Einarbeitung in unsere betrieblichen Abläufe Die Möglichkeit, Ihre langjährige Erfahrung aktiv einzubringen und mitzugestalten Bei besonderer Eignung ist die Position der Personaleitung geplant Besonders willkommen Wir suchen ausdrücklich keine Berufseinsteiger. Gesucht wird eine erfahrene Persönlichkeit, die ihr Fachgebiet beherrscht, selbstständig arbeitet und ihre langjährige Berufserfahrung gewinnbringend in unser Unternehmen einbringen möchte. Bewerberinnen und Bewerber mit jahrzehntelanger Erfahrung im Personalwesen sind ausdrücklich willkommen. Erfahrung ist für uns keine Frage des Alters, sondern ein wertvoller Erfolgsfaktor. Find Jobs in Germany on Arbeitnow"
Arbeitnow API,https://www.arbeitnow.com/jobs/companies/taxtalentede/steuerberater-in-woltersdorf-auf-wunsch-mit-partnerperspektive-gesucht-mindestens-90000eur-458084,2026-06-28T06:30:35,Taxtalente.de,"Steuerberater (m/w/d) in Woltersdorf, auf Wunsch mit Partnerperspektive, gesucht - mindestens 90.000€",Directors,Woltersdorf,,Directors; Chief Executives,"TaxTalente ist die Nr. 1 Job-Matching Plattform für Jobsuchende in der Steuerberatung. Sie suchen eine positive berufliche Veränderung? Sie möchten den nächsten Schritt in Ihrer Karriere gehen und streben möglicherweise sogar eine Partnerschaft in einer zukunftsorientierten Kanzlei an? Sie möchten endlich wieder in einem positiven Arbeitsumfeld arbeiten, in dem Sie finanziell und persönlich wertgeschätzt werden? Sie suchen nach Tätigkeiten, die Sie auch wirklich weiterbringen? Sofern Sie sich in mindestens einem der genannten Punkte wiederfinden, sollten Sie sich bei uns melden. Wir haben die attraktivsten Arbeitgeber der Steuerberatungsbranche in unserem Netzwerk und bringen zusammen, was zusammengehört. Grenzenlose Entwicklungschancen mit Partnermöglichkeiten, vielschichtige Tätigkeitsbereiche, Gehälter wie in der Industrie und vieles mehr – melden Sie sich bei uns und wir unterstützen Sie auf Ihrem weiteren Karriereweg! Derzeit suchen wir nach einem Steuerberater (m/w/d) für eine unserer Partner-Kanzleien in Woltersdorf Bei Rückfragen kannst du dich gerne jederzeit (auch nach deinem Feierabend) direkt telefonisch an Herrn Becker-Koch über folgende Nummer wenden: 015901431130 Aufgaben Wir bringen zusammen, was zusammengehört. Dabei spielt das passende Tätigkeitsprofil natürlich eine entscheidende Rolle. Bei unserer Partnerkanzlei können Sie sich Ihren Aufgabenbereich auf Basis Ihrer persönlichen Stärken und Schwächen selbst zusammenstellen. Erstellung und Review von Jahresabschlüssen Erstellung von Steuererklärungen für Personen- und Kapitalgesellschaften Steuerliche Sonderberatungsprojekte auf Basis individueller Qualifikationen B. in den Bereichen der Erbschaftsteuer oder des Umwandlungssteuerrechts Begleitung von Betriebsprüfungen Teamleitung und Personalverantwortung (optional) Weitere individuell wählbare Tätigkeitsbereiche , die Ihnen Freude bringen Qualifikation Am Ende sollte es für beide Seiten passen. Deshalb wäre es gut, wenn Sie sich in den folgenden Punkten wiederfinden. Kommunikative Art und Freude am Austausch mit Mandanten Sorgfältige , effiziente und gewissenhafte Arbeitsweise Offen für eine digitale Arbeitsweise Führungsverständnis und Verantwortungsbewusstsein gegenüber Mitarbeitern (optional) Ein erfolgreich abgeschlossenes Steuerberaterexamen Leidenschaft für steuerliche Themen Benefits Sie haben genug von 0815 Benefits, von denen Sie nicht wirklich profitieren? Dann sollten Sie einen Blick auf die nachfolgenden Benefits werfen. Außerordentliche Vergütung von 90.000 € bis 130.000 € / Jahr, auf Wunsch auch Partnerperspektive Flexible Gestaltung der Arbeitszeiten sowie die Option auf Home-Office Nettolohnoptimierung mit monatlichen 50,00€ Sachbezugsgutscheinen Umfangreiche Unterstützung bei Weiterbildungsmaßnahmen wie z.B. Fachberater Qualifikationen Modernste Ausstattung mit digitalen Prozessen Starker Teamzusammenhalt und regelmäßige Teamevents Schnell, unkompliziert und effizient Ihren Traumjob finden – ein Versprechen an Sie, dass wir aufgrund unseres selektiven, breit gefächerten und deutschlandweiten Kanzleinetzwerks halten werden. lhre Vorteile mit uns auf einen Blick: Sie führen keine unsinnigen Bewerbungsgespräche mehr, bei denen Sie während des Bewerbungsprozesses merken, dass es (bspw. wegen des Gehalts) sowieso nicht passt - wir klären vor Ihrem Bewerbungsgespräch all Ihre mit uns besprochenen Kriterien mit der Kanzlei ab. Wir führen Ihre Gehaltsverhandlungen und kennen die Gehaltsstrukturen der Branche dabei bestens. 100% Anonymität – solange Sie uns nicht das „Go“ geben und einem Kennenlernen mit Ihrem neuen potentiellen Arbeitgeber zustimmen, erfährt niemand von Ihrem Namen oder Ihren bisherigen Arbeitgebern – Ihre Ihnen wichtigen Kriterien können wir auch zunächst anonym mit unseren Partnerkanzleien klären. Attraktive Kanzleien – die Kanzleien in unserem breit gefächerten Kanzleinetzwerk sind selektiv ausgewählt und heben sich klar von “normalen” Kanzleien ab (z.B. hinsichtlich der Vergütun"
Arbeitnow API,https://www.arbeitnow.com/jobs/companies/taxtalentede/steuerberater-in-bargfeld-stegen-auf-wunsch-mit-partnerperspektive-gesucht-mindestens-90000eur-6795,2026-06-28T06:30:34,Taxtalente.de,"Steuerberater (m/w/d) in Bargfeld-Stegen, auf Wunsch mit Partnerperspektive, gesucht - mindestens 90.000€",Directors,Bargfeld-Stegen,,Directors; Chief Executives,"TaxTalente ist die Nr. 1 Job-Matching Plattform für Jobsuchende in der Steuerberatung. Sie suchen eine positive berufliche Veränderung? Sie möchten den nächsten Schritt in Ihrer Karriere gehen und streben möglicherweise sogar eine Partnerschaft in einer zukunftsorientierten Kanzlei an? Sie möchten endlich wieder in einem positiven Arbeitsumfeld arbeiten, in dem Sie finanziell und persönlich wertgeschätzt werden? Sie suchen nach Tätigkeiten, die Sie auch wirklich weiterbringen? Sofern Sie sich in mindestens einem der genannten Punkte wiederfinden, sollten Sie sich bei uns melden. Wir haben die attraktivsten Arbeitgeber der Steuerberatungsbranche in unserem Netzwerk und bringen zusammen, was zusammengehört. Grenzenlose Entwicklungschancen mit Partnermöglichkeiten, vielschichtige Tätigkeitsbereiche, Gehälter wie in der Industrie und vieles mehr – melden Sie sich bei uns und wir unterstützen Sie auf Ihrem weiteren Karriereweg! Derzeit suchen wir nach einem Steuerberater (m/w/d) für eine unserer Partner-Kanzleien in Bargfeld-Stegen Bei Rückfragen kannst du dich gerne jederzeit (auch nach deinem Feierabend) direkt telefonisch an Herrn Becker-Koch über folgende Nummer wenden: 015901431130 Aufgaben Wir bringen zusammen, was zusammengehört. Dabei spielt das passende Tätigkeitsprofil natürlich eine entscheidende Rolle. Bei unserer Partnerkanzlei können Sie sich Ihren Aufgabenbereich auf Basis Ihrer persönlichen Stärken und Schwächen selbst zusammenstellen. Erstellung und Review von Jahresabschlüssen Erstellung von Steuererklärungen für Personen- und Kapitalgesellschaften Steuerliche Sonderberatungsprojekte auf Basis individueller Qualifikationen B. in den Bereichen der Erbschaftsteuer oder des Umwandlungssteuerrechts Begleitung von Betriebsprüfungen Teamleitung und Personalverantwortung (optional) Weitere individuell wählbare Tätigkeitsbereiche , die Ihnen Freude bringen Qualifikation Am Ende sollte es für beide Seiten passen. Deshalb wäre es gut, wenn Sie sich in den folgenden Punkten wiederfinden. Kommunikative Art und Freude am Austausch mit Mandanten Sorgfältige , effiziente und gewissenhafte Arbeitsweise Offen für eine digitale Arbeitsweise Führungsverständnis und Verantwortungsbewusstsein gegenüber Mitarbeitern (optional) Ein erfolgreich abgeschlossenes Steuerberaterexamen Leidenschaft für steuerliche Themen Benefits Sie haben genug von 0815 Benefits, von denen Sie nicht wirklich profitieren? Dann sollten Sie einen Blick auf die nachfolgenden Benefits werfen. Außerordentliche Vergütung von 90.000 € bis 130.000 € / Jahr, auf Wunsch auch Partnerperspektive Flexible Gestaltung der Arbeitszeiten sowie die Option auf Home-Office Nettolohnoptimierung mit monatlichen 50,00€ Sachbezugsgutscheinen Umfangreiche Unterstützung bei Weiterbildungsmaßnahmen wie z.B. Fachberater Qualifikationen Modernste Ausstattung mit digitalen Prozessen Starker Teamzusammenhalt und regelmäßige Teamevents Schnell, unkompliziert und effizient Ihren Traumjob finden – ein Versprechen an Sie, dass wir aufgrund unseres selektiven, breit gefächerten und deutschlandweiten Kanzleinetzwerks halten werden. lhre Vorteile mit uns auf einen Blick: Sie führen keine unsinnigen Bewerbungsgespräche mehr, bei denen Sie während des Bewerbungsprozesses merken, dass es (bspw. wegen des Gehalts) sowieso nicht passt - wir klären vor Ihrem Bewerbungsgespräch all Ihre mit uns besprochenen Kriterien mit der Kanzlei ab. Wir führen Ihre Gehaltsverhandlungen und kennen die Gehaltsstrukturen der Branche dabei bestens. 100% Anonymität – solange Sie uns nicht das „Go“ geben und einem Kennenlernen mit Ihrem neuen potentiellen Arbeitgeber zustimmen, erfährt niemand von Ihrem Namen oder Ihren bisherigen Arbeitgebern – Ihre Ihnen wichtigen Kriterien können wir auch zunächst anonym mit unseren Partnerkanzleien klären. Attraktive Kanzleien – die Kanzleien in unserem breit gefächerten Kanzleinetzwerk sind selektiv ausgewählt und heben sich klar von “normalen” Kanzleien ab (z.B. hinsichtlich der Verg"
