source,source_url,date_posted,company,title,category,location,job_type,tags_raw,description
Arbeitnow API,https://www.arbeitnow.com/jobs/companies/recare-deutschland-gmbh/senior-implementation-manager-hospital-berlin-363,2026-07-22T13:20:15,Recare Deutschland GmbH,Senior Implementation Manager (Hospital) (m/w/d),Healthcare,Berlin,"Full-time permanent, experienced",Healthcare; bachelor's degree,"Über Recare Als eines der führenden deutschen HealthTech-Unternehmen gestalten wir das Entlassmanagement neu – technologiegetrieben, patientenzentriert und frei von Bürokratie. Neben unserer marktführenden SaaS-Plattform entwickeln wir KI-Lösungen, die Prozesse in Kliniken und bei Nachversorgern radikal vereinfachen, Fachkräfte entlasten und den Fokus zurück auf die Patientinnen und Patienten legen. Bereits heute vernetzen wir zwei Drittel aller deutschen Krankenhäuser mit über 650 Rehakliniken und 25.000 Pflege- und Homecare-Anbietern. Mit aktuell rund 100 Mitarbeitenden wachsen wir weiter – und suchen Menschen mit Haltung, die das Gesundheitssystem mit uns verbessern wollen. Das erwartet dich als unser Senior Implementation Manager (Hospital) (m/w/d): Arbeit mit Purpose – deine Tätigkeit hat positiven Einfluss auf Patientinnen und Patienten, ihre Angehörigen und medizinische Fachkräfte im Gesundheitswesen. Unternehmenskultur – wir setzen auf flache Hierarchien, die eine hohe Performance und eine starke Teamdynamik fördern. Wir pflegen einen Umgang, der von gegenseitigem Respekt, Loyalität und Anerkennung geprägt ist, und streben gemeinsam nach unseren Zielen und erwarten das Gleiche von dir. Flexibilität – möchtest du dein Kind aus der Kita abholen? Machst du gerne Sport in der Mittagspause? Wir unterstützen dich dabei. Wir sind ein Remote-freundliches Unternehmen, bei dem du flexible Arbeitszeiten hast. Nach Absprache kannst du gerne auch Workations machen. Edenred-Karte – die du nach deinen Bedürfnissen nutzen kannst. Zusatz-Urlaubstag – damit du deinen Geburtstag mit deinen Liebsten feiern kannst, hast du ihn frei. Deine Rolle als Senior Implementation Manager (Hospital) (m/w/d): Du sorgst dafür, dass unsere AI-Lösungen dort ankommen, wo sie den größten Unterschied machen: im Klinikalltag. Als Senior Implementation Manager übernimmst du die Verantwortung für komplexe Kundenrollouts und steuerst unsere größten und strategisch wichtigsten Implementierungsprojekte – von der ersten Planung bis zum erfolgreichen Go-Live und darüber hinaus. Du bist die zentrale Schnittstelle zwischen unseren Klinik-Kunden und den internen Recare-Teams. Mit deiner Erfahrung im Krankenhausumfeld schaffst du Vertrauen auf Augenhöhe, navigierst komplexe Stakeholder-Strukturen und sorgst dafür, dass unsere Lösungen nachhaltig im klinischen Alltag verankert werden. Du steuerst komplexe End-to-End-Rollouts unserer Recare AI Suite in Krankenhäusern – von der Discovery-Phase über Planung und Umsetzung bis zum erfolgreichen Go-Live und der Übergabe in den Regelbetrieb. Als verantwortliche Person für die Umsetzung koordinierst du alle relevanten Stakeholder auf Kundenseite und intern: von Klinikleitung und IT über medizinische Fachbereiche bis hin zu unseren Teams aus Clinical Solution Consulting, Interoperability, Customer Success und Product. Du entwickelst robuste Rollout-Pläne, steuerst Abhängigkeiten, moderierst Entscheidungen und sorgst dafür, dass Projekte auch bei hoher Komplexität erfolgreich umgesetzt werden. Du führst unsere Kunden durch Veränderungsprozesse und stellst sicher, dass Enablement, Trainings und die Hypercare-Phase optimal vorbereitet und umgesetzt werden. Du behältst den Blick für Skalierbarkeit: Du erkennst wiederkehrende Herausforderungen, verbesserst unsere Prozesse und hilfst dabei, unsere Implementierungsmethodik kontinuierlich weiterzuentwickeln. Bei strategisch wichtigen Großkunden und Multi-Site-Rollouts übernimmst du eine führende Rolle und arbeitest eng mit Sales, Product und Customer Success zusammen. So stellen wir uns dich als unseren Senior Implementation Manager (Hospital) (m/w/d) vor: Du bringst mindestens 5 Jahre Erfahrung in Implementierung, Customer Delivery, Professional Services oder Projektmanagement mit – idealerweise im SaaS- oder HealthTech-Umfeld. Erfahrung im Krankenhausumfeld ist für diese Rolle ein Muss . Du kennst die Strukturen, Entscheidungswege und Herausforderungen in Kliniken und kannst dich sich"
Arbeitnow API,https://www.arbeitnow.com/jobs/companies/ode-international-gmbh/praktikum-vertrieb-marketing-pflichtpraktikum-6-monate-berlin-385663,2026-07-22T13:00:33,ODE International GmbH,Praktikum Vertrieb & Marketing (m/w/d) Pflichtpraktikum (6 Monate),Training,Berlin,Internship,Training; Development,"Hi, wir sind ODE – der High-End-Aperitif aus Berlin. Wir entwickeln außergewöhnliche Geschmackserlebnisse und stehen für moderne Drinks mit Haltung. Good Taste meets Good Times – und du bist mittendrin. Als Praktikant*in im Bereich Vertrieb &#x26; Marketing bist du kein Zuschauendes, sondern aktiver Teil unseres Teams. Du übernimmst eigene Projekte, sammelst echte Praxis im B2B-Vertrieb sowie Marketing und lernst hautnah, wie eine moderne Premium-Marke aufgebaut und skaliert wird. Aufgaben Deine Aufgaben B2B-Vertrieb &#x26; Account Management: Du übernimmst nach der Einarbeitung eigenständig die Betreuung kleinerer B2B-Kunden (Gastro/Retail) und identifizierst aktiv neue Potentiale in Berlin. Event-Leitung vor Ort: Du planst Tastings, Promotions und Pop-ups nicht nur mit, sondern setzt sie eigenverantwortlich vor Ort um und begeisterst die Szene für ODE. POS-Aktivierung &#x26; Trade Marketing: Du bist in der Berliner Gastro- und Handels-Szene unterwegs, setzt Werbemittel um und sorgst dafür, dass ODE am Point of Sale perfekt inszeniert ist. Eigene Marketing-Projekte: Du steuerst eigene kleine Teilprojekte (z. B. lokale Gastro-Kooperationen oder Sampling-Aktionen) von der Idee bis zur Umsetzung. CRM &#x26; Vertriebs-Orga: Du unterstützt bei der Pflege unserer Kundendaten, Reportings und der Vorbereitung von Angeboten F&#x26;B-Community: Du bewegst dich aktiv in der Berliner Food-&#x26;-Beverage-Szene, knüpfst Kontakte Qualifikation Was du mitbringst Pflichtpraktikum: Du absolvierst ein vorgeschriebenes Pflichtpraktikum im Rahmen deines Studiums für 6 Monate . Leidenschaft: Du brennst für Food, Drinks, Hospitality und die Berliner F&#x26;B-Szene. Macher-Mentalität: Du arbeitest strukturiert, packst gerne an ( Hands-on ) und übernimmst gerne Verantwortung für eigene Aufgaben. Kommunikationsstärke: Du bist offen, gehst direkt auf Menschen zu und hast Lust auf Netzwerken bei Kundenterminen und Events. Flexibilität: Du hast Lust, uns auch mal auf Abend-Events oder Messen zu begleiten. Teamspirit: Du hast Freude an enger Zusammenarbeit in einem dynamischen Startup-Umfeld. Benefits Was wir dir bieten Laufzeit: 6 Monate (Pflichtpraktikum) Aufwandsentschädigung 500 € / Monat Drinks &#x26; Vibe: Monatliches Produkt-Kontingent für den Eigenbedarf sowie Zugang zu exklusiven Branchen-Events &#x26; Tastings. Echte Steilvorlage: Tiefe Einblicke in Vertrieb, Marketing &#x26; Brand Building – mit echter Verantwortung statt Kaffeekochen. Network: Direkte Anbindung an die Berliner F&#x26;B- und Startup-Szene, flache Hierarchien und ein motiviertes Team. Wir freuen uns auf deine Bewerbung mit einem kurzen Motivationsschreiben und Lebenslauf. Wenn du in unser Suchprofil passt, erhältst zeitnah eine Rückmeldung von uns. Danach freuen wir uns auf ein gemeinsames Gespräch mit dir und im besten Fall werden wir danach Kolleg*innen und verfolgen dasselbe Ziel: den weltbesten Aperitif herzustellen, zu vermarkten, zu vertreiben und den natürlichen Geschmack in die Aperitif-Welt zu bringen. Find more English Speaking Jobs in Germany on Arbeitnow"
Arbeitnow API,https://www.arbeitnow.com/jobs/companies/ymmd-talent/kundenservice-im-homeoffice-arbeiten-sie-von-zuhause-munchen-72429,2026-07-22T13:00:33,YMMD Talent,Kundenservice im Homeoffice (m/w/d) Arbeiten Sie von Zuhause,Remote,München,"Freelance, berufseinstieg",Remote; Management; Team Leader,"Sie möchten ortsunabhängig arbeiten und Teil eines modernen Kundenservice-Teams werden? Dann bieten wir Ihnen die Möglichkeit, vollständig im Homeoffice für namhafte Unternehmen tätig zu werden. Sie arbeiten in spannenden Kundenservice-Projekten, erhalten eine umfassende Einarbeitung und profitieren von einer langfristigen Zusammenarbeit mit vielfältigen Entwicklungsmöglichkeiten. Aufgaben Bearbeitung eingehender Kundenanfragen per Telefon Freundliche und serviceorientierte Kundenbetreuung Terminvereinbarungen und Terminkoordination Dokumentation der Kundengespräche Nutzung moderner Kundenservice-Systeme Einhaltung der Qualitäts- und Servicevorgaben Selbstständiges Arbeiten im Homeoffice Es handelt sich ausschließlich um Projekte ohne Kaltakquise. Qualifikation Wohnsitz innerhalb der Europäischen Union Selbstständigkeit oder Gewerbeanmeldung im jeweiligen EU-Land oder in Deutschland Gute Deutschkenntnisse in Wort und Schrift Sicherer Umgang mit dem PC Stabile Internetverbindung USB-Headset Ruhiger Arbeitsplatz Freundliches und professionelles Auftreten Hohe Serviceorientierung und Zuverlässigkeit Benefits 100 % Homeoffice Bezahlte Schulungen und Einarbeitung Flexible Arbeitszeiten je nach Projekt Viele verschiedene Projekte aus unterschiedlichen Branchen Regelmäßig neue Projekte und Einsatzmöglichkeiten Langfristige Zusammenarbeit Moderne Arbeitsumgebung Persönliche Unterstützung während der gesamten Zusammenarbeit Empfehlungsprogramm mit attraktiven Prämien gemäß den aktuellen Teilnahmebedingungen Sie möchten flexibel arbeiten und Teil spannender Kundenservice-Projekte werden? Dann freuen wir uns auf Ihre Nachricht. Gerne informieren wir Sie unverbindlich über die verfügbaren Projekte und begleiten Sie auf dem Weg zu Ihrer neuen Tätigkeit im Homeoffice. Find more English Speaking Jobs in Germany on Arbeitnow"
Arbeitnow API,https://www.arbeitnow.com/jobs/companies/michelsen-gebaude-und-liegenschaftsmanagement-gmbh/werkstudentin-fur-social-media-marketing-kiel-184319,2026-07-22T13:00:33,Michelsen Gebäude- und Liegenschaftsmanagement GmbH,Werkstudent:in (m/w/d) für (Social-Media-) Marketing,Marketing and Communication,Kiel,"Working student, hilfstätigkeit / student",Marketing and Communication,"Du hast Lust, nicht nur Content zu posten, sondern eine Marke aktiv mit aufzubauen? Dann bist du bei uns genau richtig! Wir sind die Michelsen Gebäude- und Liegenschaftsmanagement GmbH , ein inhabergeführtes Familienunternehmen aus Kiel und kümmern uns täglich darum, Immobilien sauber, gepflegt und sicher zu halten. Mit rund 70 Mitarbeitenden gehören wir zu den etablierten Dienstleistern in Schleswig-Holstein. Unsere Teams sind in den Bereichen Gebäudereinigung, Hausmeisterservice, Gartenpflege sowie Winterdienst tätig. Außerdem unterstützen wir unsere Kunden mit Dienstleistungen wie Abfallmanagement, Entrümpelungen und vielen weiteren Services rund um Immobilien. Bisher sind wir auf Facebook aktiv und besitzen ein älteres Instagram-Profil. Jetzt möchten wir unseren Außenauftritt modernisieren – und genau dabei sollst du eine entscheidende Rolle spielen. Aufgaben Entwicklung und Umsetzung einer modernen Social-Media-Strategie Aufbau und Weiterentwicklung unserer Social-Media-Kanäle (Instagram, Facebook und perspektivisch LinkedIn sowie weitere Plattformen) Planung, Erstellung und Veröffentlichung von kreativem Content (Beiträge, Reels, Stories und Kurzvideos) Begleitung unserer Mitarbeitenden im Arbeitsalltag, um authentische Einblicke hinter die Kulissen zu schaffenFotografieren und Filmen auf Baustellen, in Wohnanlagen und bei unseren Teams im Einsatz Bearbeitung von Bildern und Videos mit modernen Content-Tools Entwicklung neuer Ideen für Recruiting-Kampagnen und Employer Branding Erstellung von Inhalten für Stellenanzeigen und Personalmarketing Unterstützung bei Marketingaktionen, Veranstaltungen und Unternehmensprojekten Beobachtung aktueller Social-Media-Trends und Entwicklung neuer Content-Ideen Auswertung der Performance unserer Beiträge und Ableitung neuer Maßnahmen Unterstützung bei der Pflege (und Erneuerung) unserer Website und weiterer Marketingmaterialien Qualifikation Laufendes Studium im Bereich Marketing, Kommunikation, Medien, BWL, Wirtschaftspsychologie oder einem vergleichbaren Studiengang Begeisterung für Social Media und digitale Kommunikation Sicheres Gespür für Trends, Design und Storytelling Erfahrung mit Instagram, Facebook und idealerweise LinkedIn Erste Kenntnisse in gängigen Bildbearbeitungsprogrammen oder Programmen zur Videobearbeitung Spaß am Fotografieren und Filmen mit Smartphone oder Kamera Kreativität und ein gutes Auge für ansprechenden Content Eigenständige, strukturierte und zuverlässige Arbeitsweise Offenheit gegenüber Menschen – du hast keine Scheu, unsere Teams bei ihrer Arbeit zu begleiten Sehr gute Deutschkenntnisse in Wort und Schrift Idealerweise einen Führerschein Benefits Viel Gestaltungsspielraum und die Möglichkeit, unsere Social-Media-Präsenz nahezu von Grund auf aufzubauen Eigene Projekte und Verantwortung statt reiner Zuarbeit Ein offenes Team mit kurzen Entscheidungswegen Flexible Arbeitszeiten, die sich mit deinem Studium vereinbaren lassen Moderne ArbeitsmittelEin abwechslungsreicher Arbeitsalltag – kein Tag ist wie der andere Direkter Austausch mit der Geschäftsführung und die Möglichkeit, eigene Ideen wirklich umzusetzen Kostenlose Getränke sowie regelmäßige Teamevents Die Chance, ein Unternehmen sichtbar mitzugestalten und ein aussagekräftiges Portfolio für deine spätere Karriere aufzubauen Wir freuen uns, dich kennenzulernen! Find Jobs in Germany on Arbeitnow"
Arbeitnow API,https://www.arbeitnow.com/jobs/companies/zweygart-fachhandelsgruppe-gmbh-co-kg/sachbearbeiter-buchhaltung-gartringen-145217,2026-07-22T13:00:32,Zweygart Fachhandelsgruppe GmbH & Co. KG,Sachbearbeiter Buchhaltung (m/w/d),Finance,Gärtringen,,Finance,"Aufgaben Prüfung und Buchung von Eingangsrechnungen Prüfung, Kontierung und Buchung von Geschäftsvorfällen Abstimmung von Konten (Haupt- und Nebenbuch) Klärung und Abstimmung von Differenzen Mitwirkung bei Monats-, Quartals- und Jahresabschlüssen Verbuchung und Abstimmung der Kassenbelege Unterstützung bei der Einhaltung gesetzlicher Vorschriften (HGB, UStG, KStG etc.) Bereitstellung von Informationen für Management, Steuerberater und Banken Anlagenbuchhaltung Beurteilung von steuerlichen Gescäftsvorfällen (Kreditoren/ Debitoren) Unterstützung bei der Weiterentwicklung und Optimierung von Prozessen Qualifikation Abgeschlossene kaufmännische Ausbildung, idealerweise mit Zusatzqualifikation als Finanzbuchhalter/in Mehrjährige Berufserfahrung in der Finanzbuchhaltung Sicherer Umgang mit MS Office und gängigen ERP-Systemen Gute Deutschkenntnisse, Englischkenntnisse von Vorteil Selbstständige, präzise und vertrauliche Arbeitsweise Ausgeprägte Teamfähigkeit, Flexibilität und Hands-on-Mentalität Verantwortungsbewusstsein und sehr gute Organisationsfähigkeiten Sicherer Umgang mit sensiblen Daten Benefits unbefristete Festanstellung mit guten Zukunftsperspektiven und Weiterbildungsmöglichkeiten 30 Urlaubstage Mitarbeiterrabatte, Corporate Benefits und Fahrradleasing Vermögenswirksame Leistungen und betriebliche Altersvorsorge Flache Hierarchien, kurze Entscheidungswege und Gestaltungsspielraum Direkte Anbindung zur S-Bahn/Autobahn und kostenlose Parkplätze Auswahl an kalten und warmen Getränken, Joghurt und frischem Obst Geregelte Arbeitszeiten und freitags früh ins Wochenende Home-Office Möglichkeit Find more English Speaking Jobs in Germany on Arbeitnow"
Arbeitnow API,https://www.arbeitnow.com/jobs/companies/syte-gmbh/team-lead-sdr-munster-243028,2026-07-22T13:00:31,syte GmbH,Team Lead SDR (m/w/d),Business Development,Münster,berufserfahren,Business Development,"Deine Mission Als Team Lead SDR (m/w/d) bei syte formst du die Menschen, die den ersten Kontakt zur Immobilienwirtschaft herstellen. Du führst ein Team von rund fünf SDRs – und machst aus Talenten die Vertriebler*innen, die unsere KI-Plattform zu den Entscheider*innen der Branche tragen. Du steuerst das Team und die Pipeline, schärfst die Strategie und sorgst dafür, dass jede*r im Team weiß, warum die individuelle Arbeit zählt. Damit baust du das Fundament für ein Produkt, das echte Entscheidungen in einer der wichtigsten Branchen unserer Zeit prägt. Das passt zu Dir? Dann suchen wir Dich zum nächstmöglichen Zeitpunkt in Berlin oder Münster . Deine Mission: Führung &#x26; Entwicklung: Du führst ein Team von rund fünf SDRs – durch 1:1s, Coaching, Pipeline-Reviews und kontinuierliches Skill-Building. Du entwickelst Junior-Talente zu starken SDRs und bereitest sie optimal auf den nächsten Karriereschritt als Account Executive (AE) vor. Performance-Steuerung: Du verantwortest die Team-Ziele – Anzahl qualifizierter Deals, generierte Pipeline und Conversion entlang des Funnels. Du steuerst datenbasiert über HubSpot und greifst früh ein, wenn Kennzahlen vom Plan abweichen. Prozess &#x26; Enablement: Du schärfst Playbooks, Sequenzen, Qualifizierungskriterien und Outbound-Strategie. Du sorgst dafür, dass jede*r SDR mit dem richtigen Messaging an die richtigen Accounts rangeht. Recruiting &#x26; Onboarding: Du baust das Team zusammen mit unserer Talent Acquisition Managerin weiter aus, führst Interviews und optimierst ein strukturiertes Onboarding, das neue SDRs schnell produktiv macht. Schnittstelle zu Sales &#x26; Marketing: Du stimmst Dich eng mit den AEs zur Lead-Qualität und mit Marketing zur Kampagnen- und Account-Strategie ab. Du sorgst für saubere Übergaben und ein gemeinsames Verständnis von Pipeline-Qualität. Dein Profil Mehrjährige Erfahrung im B2B-SaaS-Vertrieb: Du bringst 3+ Jahre Berufserfahrung im B2B-SaaS-Sales mit – idealerweise mit Outbound-Schwerpunkt. Du kennst die SDR-Welt aus eigener Praxis, bevor du sie geführt hast. Nachgewiesene Führungserfahrung : Du hast bereits ein SDR- oder BDR-Team erfolgreich aufgebaut, geführt und nachweislich auf Ziele entwickelt – beispielsweise im Startup-Kontext oder in schnellwachsenden Organisationen. Ein datengetriebener Führungsstil: Du steuerst über Kennzahlen, erkennst Muster im Funnel und triffst Entscheidungen auf Basis von Zahlen, nicht Bauchgefühl. Sicherer Umgang mit CRM- und Sales-Engagement-Tools (HubSpot von Vorteil). Kommunikationsgeschick: Du hast einen wertschätzenden und motivierenden Kommunikationsstil und weißt, wie man Teams motiviert und voranbringt. Ein echtes Coaching-Mindset : Du hast Freude daran, andere besser zu machen, und misst deinen Erfolg am Wachstum deines Teams. Sprache und Standort: Du kommunizierst verhandlungssicher auf Deutsch und Englisch. Du bist bereit, mehrmals wöchentlich aus unserem Office in Berlin oder Münster zu arbeiten. Dein Einstiegstermin und Einsatzort Startdatum : zum nächstmöglichen Zeitpunkt Einsatzort : Münster oder Berlin (ca. 3-4 Tage/Woche im Office) Deine Benefits Dein attraktives Gehalt: Wir sorgen dafür, dass jeder Aspekt deiner Reise bei syte motivierend ist. Wir kennen deinen Wert! Deine Beteiligung: VSOP-Programm: In Abhängigkeit von Rolle und Verantwortungsbereich ist eine virtuelle Unternehmensbeteiligung Teil deines individuellen Vergütungspakets. Deine Hardware: Unser syte-Team ist mit modernster Software und Apple-Hardware ausgestattet. Dein Team: Einmal im Quartal trifft sich das gesamte Team für zwei Tage zum Arbeiten und um gemeinsam Erfolge zu feiern. Deine Flexibilität: Neben gemeinsamen Workations hast du auch privat die Möglichkeit, aus dem Ausland zu arbeiten. Dein Hund im Büro: Dein vierbeiniger Begleiter ist bei uns herzlich willkommen und darf jederzeit mit dir ins Office kommen. Dein persönliches Benefit-Budget: 2.200,00 € jährlich für das, was dir wichtig ist: Upskilling : Dir steht jeweils ein Budget "
Arbeitnow API,https://www.arbeitnow.com/jobs/companies/picoquant-gmbh/produktionsingenieur-fur-mikroskopie-systeme-und-fluoreszenzspektrometer-berlin-63876,2026-07-22T13:00:30,PicoQuant GmbH,Produktionsingenieur für Mikroskopie-Systeme und Fluoreszenzspektrometer (m/w/d),Development,Berlin,,Development,"Wir bei PicoQuant sind spezialisiert auf die Entwicklung und Herstellung von Geräten für elektrooptische Messungen. Unser Team besteht aus rund 120 Mitarbeitenden mit unterschiedlichen Fachrichtungen aus Wissenschaft und Ingenieurwesen. Diese Stelle ist in unserer Produktionsabteilung zu besetzen und beinhaltet die Produktion von zeitaufgelösten Mikroskopiesystemen. Beginn: ab sofort Arbeitszeitmodell: Vollzeit/Teilzeit (mind. 35 Std./Woche) Arbeitsort: Berlin-Adlershof Einstiegsgehalt: 48.000€ - 55.000€ (brutto) pro Jahr bei 40h/Woche, je nach Branchen- und genereller Berufserfahrung Aufgaben Du produzierst hochmoderne zeitaufgelöste Mikroskopie- und Spektroskopiesysteme. Du baust optomechanische Komponenten auf und justierst diese präzise. Du dokumentierst die durchgeführten Arbeiten sorgfältig und führst umfassende Testreihen an den Systemen durch. Du stellst durch konsequente Qualitätssicherung die hohe Leistungsfähigkeit und Zuverlässigkeit unserer Produkte sicher. Qualifikation Du verfügst über ein abgeschlossenes ingenieurwissenschaftliches Studium im Bereich Physik, Laser- und Optotechnologien oder bringst eine vergleichbare Qualifikation als Techniker (m/w/d) mit. Du hast praktische Erfahrung im Aufbau und in der Justage von optomechanischen Komponenten und Systemen. Du bringst grundlegende Kenntnisse in der konfokalen Mikroskopie und Fluoreszenzspektroskopie mit. Du zeichnest dich durch ein ausgeprägtes funktionsübergreifendes Prozessdenken sowie ein hohes Qualitäts- und Prozessverständnis aus. Du arbeitest analytisch, strukturiert und lösungsorientiert. Du überzeugst durch deine hohe Flexibilität, Teamfähigkeit und dein ausgeprägtes technisches Verständnis. Sehr gute Deutschkenntnisse auf dem Sprachniveau C1 sowie gute Englischkenntnisse auf dem Niveau B2 runden dein Profil ab. Benefits Du bekommst einen unbefristeten Vertrag. Du profitierst von einem Gehaltsrahmen zwischen 48.000 € und 55.000 € brutto jährlich, abhängig von Deiner Branchen- und Berufserfahrung, es gibt auch jährliche Gehaltsrunden. Wir ermöglichen Dir 30 Tage Urlaub, flexible Arbeitszeiten, sowie eine individuelle Einarbeitung. Du kannst von Sport- und Massageangebote vor Ort profitieren, um Deine Gesundheit und Dein Wohlbefinden zu fördern. Ein Dienstfahrrad-Leasing oder ein Zuschuss zum Jobticket (Deutschlandticket Job) und eine gute Verkehrsanbindung verbessern Deine Mobilität. Regelmäßige Events wie Sommerfest, Weihnachtsfeier, Teamevents und eine Lunch-Lotterie stärken den Zusammenhalt und fördern eine kollegiale Zusammenarbeit. Wir fördern Deine berufliche Weiterentwicklung und bieten eine betriebliche Altersvorsorge. Dein Arbeitsplatz befindet sich an einem der innovativsten Orte von Berlin – dem WISTA Campus in Adlershof. Werde Teil eines engagierten, internationalen und freundlichen Teams mit Leidenschaft für neue Technologien, die weltweit von führenden Forschern und Nobelpreisträgern genutzt werden. Der Arbeitsplatz befindet sich an einem der innovativsten Orte von Berlin – dem WISTA Campus in Adlershof. Interessiert? Bewirb dich jetzt und erlebe High-Tech hautnah in Berlin. Find Jobs in Germany on Arbeitnow"
