source,source_url,date_posted,company,title,category,location,job_type,tags_raw,description
Arbeitnow API,https://www.arbeitnow.com/jobs/companies/taxtalentede/steuerberater-in-nideggen-auf-wunsch-mit-partnerperspektive-gesucht-mindestens-90000eur-270911,2026-07-09T06:30:33,Taxtalente.de,"Steuerberater (m/w/d) in Nideggen, auf Wunsch mit Partnerperspektive, gesucht - mindestens 90.000€",Directors,Nideggen,,Directors; Chief Executives,"TaxTalente ist die Nr. 1 Job-Matching Plattform für Jobsuchende in der Steuerberatung. Sie suchen eine positive berufliche Veränderung? Sie möchten den nächsten Schritt in Ihrer Karriere gehen und streben möglicherweise sogar eine Partnerschaft in einer zukunftsorientierten Kanzlei an? Sie möchten endlich wieder in einem positiven Arbeitsumfeld arbeiten, in dem Sie finanziell und persönlich wertgeschätzt werden? Sie suchen nach Tätigkeiten, die Sie auch wirklich weiterbringen? Sofern Sie sich in mindestens einem der genannten Punkte wiederfinden, sollten Sie sich bei uns melden. Wir haben die attraktivsten Arbeitgeber der Steuerberatungsbranche in unserem Netzwerk und bringen zusammen, was zusammengehört. Grenzenlose Entwicklungschancen mit Partnermöglichkeiten, vielschichtige Tätigkeitsbereiche, Gehälter wie in der Industrie und vieles mehr – melden Sie sich bei uns und wir unterstützen Sie auf Ihrem weiteren Karriereweg! Derzeit suchen wir nach einem Steuerberater (m/w/d) für eine unserer Partner-Kanzleien in Nideggen Bei Rückfragen kannst du dich gerne jederzeit (auch nach deinem Feierabend) direkt telefonisch an Herrn Becker-Koch über folgende Nummer wenden: 015901431130 Aufgaben Wir bringen zusammen, was zusammengehört. Dabei spielt das passende Tätigkeitsprofil natürlich eine entscheidende Rolle. Bei unserer Partnerkanzlei können Sie sich Ihren Aufgabenbereich auf Basis Ihrer persönlichen Stärken und Schwächen selbst zusammenstellen. Erstellung und Review von Jahresabschlüssen Erstellung von Steuererklärungen für Personen- und Kapitalgesellschaften Steuerliche Sonderberatungsprojekte auf Basis individueller Qualifikationen B. in den Bereichen der Erbschaftsteuer oder des Umwandlungssteuerrechts Begleitung von Betriebsprüfungen Teamleitung und Personalverantwortung (optional) Weitere individuell wählbare Tätigkeitsbereiche , die Ihnen Freude bringen Qualifikation Am Ende sollte es für beide Seiten passen. Deshalb wäre es gut, wenn Sie sich in den folgenden Punkten wiederfinden. Kommunikative Art und Freude am Austausch mit Mandanten Sorgfältige , effiziente und gewissenhafte Arbeitsweise Offen für eine digitale Arbeitsweise Führungsverständnis und Verantwortungsbewusstsein gegenüber Mitarbeitern (optional) Ein erfolgreich abgeschlossenes Steuerberaterexamen Leidenschaft für steuerliche Themen Benefits Sie haben genug von 0815 Benefits, von denen Sie nicht wirklich profitieren? Dann sollten Sie einen Blick auf die nachfolgenden Benefits werfen. Außerordentliche Vergütung von 90.000 € bis 130.000 € / Jahr, auf Wunsch auch Partnerperspektive Flexible Gestaltung der Arbeitszeiten sowie die Option auf Home-Office Nettolohnoptimierung mit monatlichen 50,00€ Sachbezugsgutscheinen Umfangreiche Unterstützung bei Weiterbildungsmaßnahmen wie z.B. Fachberater Qualifikationen Modernste Ausstattung mit digitalen Prozessen Starker Teamzusammenhalt und regelmäßige Teamevents Schnell, unkompliziert und effizient Ihren Traumjob finden – ein Versprechen an Sie, dass wir aufgrund unseres selektiven, breit gefächerten und deutschlandweiten Kanzleinetzwerks halten werden. lhre Vorteile mit uns auf einen Blick: Sie führen keine unsinnigen Bewerbungsgespräche mehr, bei denen Sie während des Bewerbungsprozesses merken, dass es (bspw. wegen des Gehalts) sowieso nicht passt - wir klären vor Ihrem Bewerbungsgespräch all Ihre mit uns besprochenen Kriterien mit der Kanzlei ab. Wir führen Ihre Gehaltsverhandlungen und kennen die Gehaltsstrukturen der Branche dabei bestens. 100% Anonymität – solange Sie uns nicht das „Go“ geben und einem Kennenlernen mit Ihrem neuen potentiellen Arbeitgeber zustimmen, erfährt niemand von Ihrem Namen oder Ihren bisherigen Arbeitgebern – Ihre Ihnen wichtigen Kriterien können wir auch zunächst anonym mit unseren Partnerkanzleien klären. Attraktive Kanzleien – die Kanzleien in unserem breit gefächerten Kanzleinetzwerk sind selektiv ausgewählt und heben sich klar von “normalen” Kanzleien ab (z.B. hinsichtlich der Vergütung, "
Arbeitnow API,https://www.arbeitnow.com/jobs/companies/taxtalentede/steuerberater-in-eberswalde-auf-wunsch-mit-partnerperspektive-gesucht-mindestens-90000eur-252856,2026-07-09T06:30:32,Taxtalente.de,"Steuerberater (m/w/d) in Eberswalde, auf Wunsch mit Partnerperspektive, gesucht - mindestens 90.000€",Directors,Eberswalde,,Directors; Chief Executives,"TaxTalente ist die Nr. 1 Job-Matching Plattform für Jobsuchende in der Steuerberatung. Sie suchen eine positive berufliche Veränderung? Sie möchten den nächsten Schritt in Ihrer Karriere gehen und streben möglicherweise sogar eine Partnerschaft in einer zukunftsorientierten Kanzlei an? Sie möchten endlich wieder in einem positiven Arbeitsumfeld arbeiten, in dem Sie finanziell und persönlich wertgeschätzt werden? Sie suchen nach Tätigkeiten, die Sie auch wirklich weiterbringen? Sofern Sie sich in mindestens einem der genannten Punkte wiederfinden, sollten Sie sich bei uns melden. Wir haben die attraktivsten Arbeitgeber der Steuerberatungsbranche in unserem Netzwerk und bringen zusammen, was zusammengehört. Grenzenlose Entwicklungschancen mit Partnermöglichkeiten, vielschichtige Tätigkeitsbereiche, Gehälter wie in der Industrie und vieles mehr – melden Sie sich bei uns und wir unterstützen Sie auf Ihrem weiteren Karriereweg! Derzeit suchen wir nach einem Steuerberater (m/w/d) für eine unserer Partner-Kanzleien in Eberswalde Bei Rückfragen kannst du dich gerne jederzeit (auch nach deinem Feierabend) direkt telefonisch an Herrn Becker-Koch über folgende Nummer wenden: 015901431130 Aufgaben Wir bringen zusammen, was zusammengehört. Dabei spielt das passende Tätigkeitsprofil natürlich eine entscheidende Rolle. Bei unserer Partnerkanzlei können Sie sich Ihren Aufgabenbereich auf Basis Ihrer persönlichen Stärken und Schwächen selbst zusammenstellen. Erstellung und Review von Jahresabschlüssen Erstellung von Steuererklärungen für Personen- und Kapitalgesellschaften Steuerliche Sonderberatungsprojekte auf Basis individueller Qualifikationen B. in den Bereichen der Erbschaftsteuer oder des Umwandlungssteuerrechts Begleitung von Betriebsprüfungen Teamleitung und Personalverantwortung (optional) Weitere individuell wählbare Tätigkeitsbereiche , die Ihnen Freude bringen Qualifikation Am Ende sollte es für beide Seiten passen. Deshalb wäre es gut, wenn Sie sich in den folgenden Punkten wiederfinden. Kommunikative Art und Freude am Austausch mit Mandanten Sorgfältige , effiziente und gewissenhafte Arbeitsweise Offen für eine digitale Arbeitsweise Führungsverständnis und Verantwortungsbewusstsein gegenüber Mitarbeitern (optional) Ein erfolgreich abgeschlossenes Steuerberaterexamen Leidenschaft für steuerliche Themen Benefits Sie haben genug von 0815 Benefits, von denen Sie nicht wirklich profitieren? Dann sollten Sie einen Blick auf die nachfolgenden Benefits werfen. Außerordentliche Vergütung von 90.000 € bis 130.000 € / Jahr, auf Wunsch auch Partnerperspektive Flexible Gestaltung der Arbeitszeiten sowie die Option auf Home-Office Nettolohnoptimierung mit monatlichen 50,00€ Sachbezugsgutscheinen Umfangreiche Unterstützung bei Weiterbildungsmaßnahmen wie z.B. Fachberater Qualifikationen Modernste Ausstattung mit digitalen Prozessen Starker Teamzusammenhalt und regelmäßige Teamevents Schnell, unkompliziert und effizient Ihren Traumjob finden – ein Versprechen an Sie, dass wir aufgrund unseres selektiven, breit gefächerten und deutschlandweiten Kanzleinetzwerks halten werden. lhre Vorteile mit uns auf einen Blick: Sie führen keine unsinnigen Bewerbungsgespräche mehr, bei denen Sie während des Bewerbungsprozesses merken, dass es (bspw. wegen des Gehalts) sowieso nicht passt - wir klären vor Ihrem Bewerbungsgespräch all Ihre mit uns besprochenen Kriterien mit der Kanzlei ab. Wir führen Ihre Gehaltsverhandlungen und kennen die Gehaltsstrukturen der Branche dabei bestens. 100% Anonymität – solange Sie uns nicht das „Go“ geben und einem Kennenlernen mit Ihrem neuen potentiellen Arbeitgeber zustimmen, erfährt niemand von Ihrem Namen oder Ihren bisherigen Arbeitgebern – Ihre Ihnen wichtigen Kriterien können wir auch zunächst anonym mit unseren Partnerkanzleien klären. Attraktive Kanzleien – die Kanzleien in unserem breit gefächerten Kanzleinetzwerk sind selektiv ausgewählt und heben sich klar von “normalen” Kanzleien ab (z.B. hinsichtlich der Vergütung"
Arbeitnow API,https://www.arbeitnow.com/jobs/companies/taxtalentede/steuerberater-in-weilerswist-auf-wunsch-mit-partnerperspektive-gesucht-mindestens-90000eur-168664,2026-07-09T06:30:30,Taxtalente.de,"Steuerberater (m/w/d) in Weilerswist, auf Wunsch mit Partnerperspektive, gesucht - mindestens 90.000€",Directors,Weilerswist,,Directors; Chief Executives,"TaxTalente ist die Nr. 1 Job-Matching Plattform für Jobsuchende in der Steuerberatung. Sie suchen eine positive berufliche Veränderung? Sie möchten den nächsten Schritt in Ihrer Karriere gehen und streben möglicherweise sogar eine Partnerschaft in einer zukunftsorientierten Kanzlei an? Sie möchten endlich wieder in einem positiven Arbeitsumfeld arbeiten, in dem Sie finanziell und persönlich wertgeschätzt werden? Sie suchen nach Tätigkeiten, die Sie auch wirklich weiterbringen? Sofern Sie sich in mindestens einem der genannten Punkte wiederfinden, sollten Sie sich bei uns melden. Wir haben die attraktivsten Arbeitgeber der Steuerberatungsbranche in unserem Netzwerk und bringen zusammen, was zusammengehört. Grenzenlose Entwicklungschancen mit Partnermöglichkeiten, vielschichtige Tätigkeitsbereiche, Gehälter wie in der Industrie und vieles mehr – melden Sie sich bei uns und wir unterstützen Sie auf Ihrem weiteren Karriereweg! Derzeit suchen wir nach einem Steuerberater (m/w/d) für eine unserer Partner-Kanzleien in Weilerswist Bei Rückfragen kannst du dich gerne jederzeit (auch nach deinem Feierabend) direkt telefonisch an Herrn Becker-Koch über folgende Nummer wenden: 015901431130 Aufgaben Wir bringen zusammen, was zusammengehört. Dabei spielt das passende Tätigkeitsprofil natürlich eine entscheidende Rolle. Bei unserer Partnerkanzlei können Sie sich Ihren Aufgabenbereich auf Basis Ihrer persönlichen Stärken und Schwächen selbst zusammenstellen. Erstellung und Review von Jahresabschlüssen Erstellung von Steuererklärungen für Personen- und Kapitalgesellschaften Steuerliche Sonderberatungsprojekte auf Basis individueller Qualifikationen B. in den Bereichen der Erbschaftsteuer oder des Umwandlungssteuerrechts Begleitung von Betriebsprüfungen Teamleitung und Personalverantwortung (optional) Weitere individuell wählbare Tätigkeitsbereiche , die Ihnen Freude bringen Qualifikation Am Ende sollte es für beide Seiten passen. Deshalb wäre es gut, wenn Sie sich in den folgenden Punkten wiederfinden. Kommunikative Art und Freude am Austausch mit Mandanten Sorgfältige , effiziente und gewissenhafte Arbeitsweise Offen für eine digitale Arbeitsweise Führungsverständnis und Verantwortungsbewusstsein gegenüber Mitarbeitern (optional) Ein erfolgreich abgeschlossenes Steuerberaterexamen Leidenschaft für steuerliche Themen Benefits Sie haben genug von 0815 Benefits, von denen Sie nicht wirklich profitieren? Dann sollten Sie einen Blick auf die nachfolgenden Benefits werfen. Außerordentliche Vergütung von 90.000 € bis 130.000 € / Jahr, auf Wunsch auch Partnerperspektive Flexible Gestaltung der Arbeitszeiten sowie die Option auf Home-Office Nettolohnoptimierung mit monatlichen 50,00€ Sachbezugsgutscheinen Umfangreiche Unterstützung bei Weiterbildungsmaßnahmen wie z.B. Fachberater Qualifikationen Modernste Ausstattung mit digitalen Prozessen Starker Teamzusammenhalt und regelmäßige Teamevents Schnell, unkompliziert und effizient Ihren Traumjob finden – ein Versprechen an Sie, dass wir aufgrund unseres selektiven, breit gefächerten und deutschlandweiten Kanzleinetzwerks halten werden. lhre Vorteile mit uns auf einen Blick: Sie führen keine unsinnigen Bewerbungsgespräche mehr, bei denen Sie während des Bewerbungsprozesses merken, dass es (bspw. wegen des Gehalts) sowieso nicht passt - wir klären vor Ihrem Bewerbungsgespräch all Ihre mit uns besprochenen Kriterien mit der Kanzlei ab. Wir führen Ihre Gehaltsverhandlungen und kennen die Gehaltsstrukturen der Branche dabei bestens. 100% Anonymität – solange Sie uns nicht das „Go“ geben und einem Kennenlernen mit Ihrem neuen potentiellen Arbeitgeber zustimmen, erfährt niemand von Ihrem Namen oder Ihren bisherigen Arbeitgebern – Ihre Ihnen wichtigen Kriterien können wir auch zunächst anonym mit unseren Partnerkanzleien klären. Attraktive Kanzleien – die Kanzleien in unserem breit gefächerten Kanzleinetzwerk sind selektiv ausgewählt und heben sich klar von “normalen” Kanzleien ab (z.B. hinsichtlich der Vergütun"
Arbeitnow API,https://www.arbeitnow.com/jobs/companies/flexit-consulting-gmbh/ai-integration-engineer-llm-agents-rag-dusseldorf-300997,2026-07-09T06:00:40,FlexIT Consulting GmbH,AI Integration Engineer | LLM Agents & RAG (w/m/d),Consulting,Düsseldorf,berufserfahren,Consulting; Engineering,"Düsseldorf | 1x/Woche vor Ort, sonst mobiles Arbeiten | 80.000–110.000 € / Jahr Unser Auftraggeber ist ein etablierter IT- und Digitalisierungsdienstleister eines großen Unternehmensverbunds in der Immobilienbranche im Raum Düsseldorf. Der Anspruch: KI nicht als Pilotprojekt, sondern als festen Bestandteil des Tagesgeschäfts – End-to-End, produktiv, im laufenden Betrieb. Dafür baut der Kunde ein schlagkräftiges 3-köpfiges Team auf, das Prozesse identifiziert, als KI-Skill konzipiert und ausrollt. Als AI Integration Engineer berichtest du direkt an den Teamleiter und bist die treibende Kraft im Tagesgeschäft. Aufgaben End-to-End-Verantwortung für KI-Skills &#x26; Agenten: von der Use-Case-Idee bis zur API-basierten Bereitstellung im laufenden Betrieb Prozesse mit LLMs &#x26; Tools (u. a. Langdock) in belastbare Lösungen überführen – inkl. Modellwahl zwischen High-End- und kosteneffizienten Modellen Schnittstellen &#x26; Systemanbindungen eigenständig konzipieren und umsetzen – u. a. Anbindung von SAP als führendem System Produktivbetrieb sauber vorbereiten: Testing, Dokumentation, Versionierung, Rollout-Begleitung direkt in den FachbereichenMitgestaltung des Governance-Modells sowie Wissenstransfer für den langfristigen internen Weiterbetrieb Kritische, fundierte Bewertung von Modellen, Plattformen und technischen Stacks – technisch, wirtschaftlich und ethisch Aufbau und Betrieb von Cloud- und On-Premise-Infrastruktur (Microsoft Azure inkl. Azure AI Foundry, Linux) Qualifikation Studium in (Wirtschafts-)Informatik, Mathematik, Data Science, Physik o. ä. MINT-Fach Nachweisbare Praxiserfahrung mit Machine Learning, LLMs und Agenten-Architekturen Erfahrung mit produktiven (nicht nur prototypischen) KI-Lösungen: LLMs, Agenten, Prompt-/Skill-Design, RAG, Tool-Use Sichere Python- und PowerShell-Kenntnisse, eigenständige Schnittstellenentwicklung, Routine in Cloud- und On-Premise-Umgebungen (idealerweise Azure/Azure AI Foundry, Linux) Hands-on-Mentalität, Lieferorientierung, Teamfähigkeit, echte Neugier Sehr gute Deutsch -, gute Englischkenntnisse Plus: Datenschutz, EU-KI-Verordnung, SAP und Unternehmensdatenlandschaften Benefits Vergütung &#x26; Arbeitszeit: Top Gehalt, mobiles Arbeiten (nur 1x/Woche ins Büro) Gesundheitsmanagement: Zuschuss für Gym-Mitgliedschaft, präventive Vorsorgeuntersuchungen, betriebsärztlicher Dienst Kommunikation auf Augenhöhe: flache Hierarchien, stetiger Austausch mit Führungskräften Akademie &#x26; Entwicklung: umfangreiches Onboarding, Trainings, Talentförderung und Diversitätsprogramme Familienservice: Beratung zu Kinderbetreuung und Pflege von Angehörigen Rundum-sorglos-Paket: 30 Tage Urlaub plus Sonderurlaubstage, neueste Technikausstattung, kostenlose Parkplätze, Fahrrad-Leasing, Corporate Benefits Teamevents: Sommerfeste, Weihnachtsfeiern, Karneval Interesse geweckt? Dann freue ich mich auf deine Bewerbung! Bei Fragen zur Position stehe ich dir gerne vorab zur Verfügung. Ben Hermann Recruiter FlexIT Consulting 0211 / 54 55 87-17 Find Jobs in Germany on Arbeitnow"
Arbeitnow API,https://www.arbeitnow.com/jobs/companies/ces-consulting-engineers-salzgitter-gmbh/accountant-finanzbuchhaltung-no-2604-braunschweig-186775,2026-07-09T06:00:39,CES Consulting Engineers Salzgitter GmbH,Accountant (Finanzbuchhaltung) No. 2604,Finance,Braunschweig,,Finance,"Über uns CES Consulting Engineers Salzgitter GmbH ist eine international tätige Ingenieur- und Beratungsgesellschaft mit Sitz in Braunschweig. Seit mehr als 70 Jahren planen und begleiten wir Projekte in den Bereichen Wasserversorgung, Abwasserentsorgung, Wasserbau und kommunale Infrastruktur. Wir arbeiten weltweit an Lösungen, die Lebensbedingungen verbessern, Ressourcen schützen und nachhaltige Entwicklung ermöglichen. Zur Verstärkung unseres Teams suchen wir eine zuverlässige und engagierte Persönlichkeit, die Freude an Zahlen, Teamarbeit und internationaler Zusammenarbeit hat. Aufgaben Status: Festanstellung Voll- oder Teilzeit Start: Q3 2026 Duration: Unbefristet Position: Accountant / Finanzbuchhalter/in Qualification: Kaufmännische Ausbildung, Weiterbildung im Rechnungswesen oder vergleichbare Qualifikation Country: Deutschland Sector: Water Supply / Wastewater / Hydraulic Engineering / Public Infrastructure Ihre Aufgaben Nach erfolgreicher Einarbeitung unterstützen Sie ausgewählte internationale Projekte in kaufmännischen Fragen und arbeiten eng mit Projektteams und externen Partnern zusammen. Am Standort Braunschweig übernehmen Sie Aufgaben in der laufenden Finanzbuchhaltung für die Projekte der Gesellschaft, insbesondere in der Debitoren- und Kreditorenbuchhaltung. Sie prüfen und bearbeiten Eingangs- und Ausgangsrechnungen. Sie unterstützen Monats- und Jahresabschlüsse, stimmen Konten und offene Posten ab, erstellen monatliche Rechnungsabgrenzungen, buchen Rückstellungen und wirken bei der Zusammenarbeit mit Wirtschaftsprüfern mit. Qualifikation Ihr Profil Abgeschlossene Ausbildung als Steuerfachangestellte/r, Finanzbuchhalter/in oder Bilanzbuchhalter/in oder eine vergleichbare Qualifikation im Rechnungswesen. Fundierte Kenntnisse im Bereich Finanzbuchhaltung. Berufserfahrung in der Finanzbuchhaltung, idealerweise in einem internationalen Umfeld. Sicherer Umgang mit MS Office, insbesondere Excel, sowie Erfahrung mit gängiger Buchhaltungssoftware. Strukturierte, zuverlässige und teamorientierte Arbeitsweise mit Freude an klaren Prozessen und guter Zusammenarbeit. Gute Deutsch- und Englischkenntnisse in Wort und Schrift; weitere Fremdsprachenkenntnisse sind von Vorteil. Benefits Unser Angebot Eine abwechslungsreiche Aufgabe in einem internationalen Umfeld, in dem Ihre Arbeit unmittelbar zum Erfolg nachhaltiger Infrastrukturprojekte beiträgt. Anspruchsvolle Projekte mit gesellschaftlicher Relevanz und nachhaltigem Nutzen für unsere Kunden und Partner. Eine unbefristete Festanstellung in Voll- oder Teilzeit mit attraktiver Vergütung in einem zukunftsorientierten Unternehmen. Flexible Arbeitszeitmodelle mit der Möglichkeit, an zwei bis drei Tagen pro Woche mobil zu arbeiten. Eine familienbewusste Arbeitsorganisation, bei der Kinderbetreuungszeiten nach Möglichkeit berücksichtigt werden. Regelmäßige Möglichkeiten zur fachlichen und persönlichen Weiterentwicklung, insbesondere im Bereich Finanzbuchhaltung, internationale Projektabrechnung und kaufmännische Prozesse. Haben wir Ihr Interesse geweckt? Dann freuen wir uns auf Ihre Bewerbung mit Angabe Ihrer Gehaltsvorstellung. Bitte beziehen Sie sich in Ihrer Bewerbung auf die ausgeschriebene Stelle: “Application for: Accountant - No. 2604” Find more English Speaking Jobs in Germany on Arbeitnow"
Arbeitnow API,https://www.arbeitnow.com/jobs/companies/medienagentur-y-ohg/videografin-kameramannfrau-in-voll-oder-teilzeit-offenburg-346622,2026-07-08T23:59:02,Medienagentur Y OHG,Videograf:in / Kameramann:frau (m/w/d) in Voll- oder Teilzeit,Marketing and Communication,Offenburg,,Marketing and Communication,"Du suchst nach einer neuen Herausforderung und hast Bock auf ein junges, dynamisches, motiviertes Team mit tollen Kunden und Projekten? Wenn du vollen Drive mitbringst, High-End-Produktionen von der ersten Bildidee bis zum finalen Cut prägen willst und ein echtes Auge für Ästhetik hast, bist du bei uns genau richtig. Bei uns ziehst du nicht nur stur Aufträge durch, sondern bringst deine eigene Motivation ein und gibst unseren Projekten deinen eigenen visuellen Stempel. Aufgaben Eigenverantwortliche Vorbereitung, Planung und Durchführung von Videoproduktionen Professioneller Videoschnitt und Postproduktion von Kunden- und Agenturprojekten Kameraführung, Lichtsetzung und Audio-Verantwortung bei On-Site-Drehs Handling, Pflege und Verantwortung für unser Kamera-, Licht- und Audio-Equipment Datenmanagement, Sortierung und Strukturierung von Rohmaterial Mitarbeit an der Konzeption von Storyboards, Moodboards und kreativen Videokonzepten Unterstützung beim Color Grading, um den Produktionen den finalen High-End-Look zu verpassen Qualifikation Du hast eine relevante Ausbildung/Studium abgeschlossen oder bringst nachweisbare Berufserfahrung im Bereich Film/Video mit. Fundierte praktische Erfahrung hinter der Kamera und im Umgang mit professionellem Equipment. Sicherer Umgang mit gängiger Schnittsoftware (z. B. Premiere Pro, DaVinci Resolve) und der Adobe Creative Cloud. Ein ausgeprägtes Auge für Bildkomposition, Licht, Rhythmus, Pacing und Ästhetik. Eigeninitiative, Zuverlässigkeit am Set und eine strukturierte Arbeitsweise in der Postproduktion. Teamplayer, der eine offene Feedbackkultur schätzt und Lust hat, gemeinsam im Team visuelle Highlights zu setzen. Benefits Eine Anstellung in Vollzeit oder Teilzeit mit abwechslungsreichen Projekten Flexibles Arbeiten: Remote-Anteile + modernes Office in Offenburg mit allem, was man braucht (und High-End-Equipment) Ein Umfeld, in dem du wirklich mitgestaltest statt nur Aufträge abzuarbeiten Regelmäßiges Feedback &#x26; Raum für deine persönliche und fachliche Weiterentwicklung Raum für eigene Ideen – volle Verantwortung für deine Projekte und Drehs Teamevents, Lern-Sessions und ein motiviertes, kreatives Team Wertschätzung, Vertrauen und viel kreativer Freiraum Find more English Speaking Jobs in Germany on Arbeitnow"
