source,source_url,date_posted,company,title,category,location,job_type,tags_raw,description
Arbeitnow API,https://www.arbeitnow.com/jobs/companies/my-humancapital-gmbh/projektleiter-technisches-gebaudemanagement-dresden-250718,2026-06-26T17:00:37,MY Humancapital GmbH,Projektleiter Technisches Gebäudemanagement (m/w/d) Dresden,Engineering,Dresden,,Engineering,"Projektleiter Technisches Gebäudemanagement (m/w/d) gesucht – Vollzeit | Dresden Im Auftrag unseres Partnerunternehmens in Dresden suchen wir Sie zum nächstmöglichen Zeitpunkt als „Projektleiter Technisches Gebäudemanagement (m/w/d)“ Aufgaben Sie leiten Umbau- und Modernisierungsprojekte von der Bedarfsermittlung über die Planung bis zur erfolgreichen Umsetzung Sie koordinieren Planungsbüros, Dienstleister und ausführende Unternehmen und stellen die Einhaltung von Terminen, Kosten und Qualitätsstandards sicher Darüber hinaus begleiten Sie Inbetriebnahmen, Abnahmen und Qualitätsprüfungen technischer Anlagen Sie betreuen die Gerätewirtschaft, pflegen Stammdaten im SAP-System und unterstützen interne Ansprechpartner während des gesamten Lebenszyklus technischer Anlagen Zusätzlich verantworten Sie die Dokumentation von Räumen, Anlagen und technischen Daten sowie die Koordination von Inventuren Qualifikation Grundlage bildet ein abgeschlossenes Studium, bspw. als Ingenieur Versorgungstechnik (m/w/d), Ingenieur Technische Gebäudeausrüstung (m/w/d) oder eine Weiterbildung zum staatlich geprüften Techniker Versorgungstechnik (m/w/d) oder eine vergleichbare Qualifikation Idealerweise bringen Sie Berufserfahrung als Projektleiter Gebäudetechnik (m/w/d), Projektmanager Technisches Gebäudemanagement (m/w/d), Ingenieur Versorgungstechnik (m/w/d) oder Techniker Versorgungstechnik (m/w/d) mit Sie verfügen über Erfahrung in der Steuerung technischer Projekte sowie idealerweise über Kenntnisse im technischen Gebäudemanagement Zusätzlich sind Kenntnisse in SAP sowie Erfahrungen mit CAD-Anwendungen von Vorteil Wichtig sind Organisationsstärke, Kommunikationsfähigkeit, Durchsetzungsvermögen sowie sehr gute Deutschkenntnisse in Wort und Schrift Benefits Work-Life-Balance : Freuen Sie sich auf flexible Arbeitszeiten im Gleitzeitmodell Sicherheit : Kaum eine Branche bietet eine derartige Sicherheit wie der Öffentliche Dienst Entwicklung : Firmenintern gibt es zahlreiche Weiterbildungs- und Entwicklungsmöglichkeiten Vielseitigkeit : Freuen Sie sich aufspannende und abwechslungsreiche Tätigkeiten in einem dynamischen Umfeld Teamspirit : Sie erwarten flache Hierarchien, kurze Entscheidungswege sowie eine wertschätzende Zusammenarbeit Sie finden das Stellenprofil interessant? Dann freuen wir uns auf Ihre Bewerbung. Für Rückfragen steht Ihnen Simon Schneider gerne unter 089 954 287 111 zur Verfügung. Find more English Speaking Jobs in Germany on Arbeitnow"
Arbeitnow API,https://www.arbeitnow.com/jobs/companies/my-humancapital-gmbh/berechnungsingenieur-strukturanalyse-munich-299529,2026-06-26T17:00:37,MY Humancapital GmbH,Berechnungsingenieur Strukturanalyse (m/w/d),Engineering,Munich,,Engineering,"Im Auftrag unseres Partnerunternehmens suchen wir Sie zum nächstmöglichen Zeitpunkt als „ Berechnungsingenieur FEM &#x26; Strukturanalyse (m/w/d) “. Aufgaben Sie führen strukturmechanische Analysen und FEM-Berechnungen zur Bewertung von Bauteilen, Baugruppen und komplexen technischen Systemen durch Sie erstellen und optimieren Berechnungsmodelle, definieren Randbedingungen und Lastfälle und bewerten die Ergebnisse hinsichtlich Festigkeit und Belastbarkeit Darüber hinaus entwickeln Sie technische Verbesserungsvorschläge und präsentieren Berechnungsergebnisse gegenüber internen und externen Ansprechpartnern Sie analysieren Strukturbelastungen, Deformationen und Versagensmechanismen und unterstützen bei numerischen sowie analytischen Berechnungen Zusätzlich begleiten Sie Versuche und Tests und arbeiten an der Weiterentwicklung von Berechnungsmethoden und Materialmodellen mit Qualifikation Grundlage bildet ein abgeschlossenes Studium der Fahrzeugtechnik, des Maschinenbaus, der Luft- und Raumfahrttechnik, Computational Mechanics oder einer vergleichbaren Ingenieurwissenschaft Idealerweise bringen Sie Berufserfahrung als Berechnungsingenieur (m/w/d), Simulationsingenieur (m/w/d), FEM-Ingenieur (m/w/d) oder Entwicklungsingenieur (m/w/d) mit Sie verfügen über Kenntnisse in der FEM-Berechnung, Simulation und Strukturanalyse sowie über praktische Erfahrungen mit HyperMesh, HyperWorks, Ansys oder vergleichbaren Tools Zusätzlich sind Kenntnisse relevanter Berechnungsrichtlinien und Methoden, beispielsweise FKM-Richtlinie oder VDI 2230, sowie Linux-Kenntnisse von Vorteil Wichtig sind Teamfähigkeit, analytisches Denkvermögen, eine strukturierte Arbeitsweise sowie verhandlungssichere Deutsch- und Englischkenntnisse in Wort und Schrift Benefits Work-Life-Balance : Flexible Arbeitszeiten im Gleitzeitmodell Sicherheit : Kaum ein Arbeitgeber bietet eine derartige Sicherheit wie dieser Zentrale Lage : Moderne Büroräumlichkeiten mit guter Verkehrsanbindung Modernes Umfeld : Sie erwartet eine moderne Arbeitsumgebung mit neuester Technik Weiterentwicklung : Auf Sie warten zahlreiche interne und externe Weiterbildungs- und Entwicklungsmöglichkeiten Sie finden das Stellenprofil interessant? Dann freuen wir uns auf Ihre Bewerbung. Für Rückfragen steht Ihnen Simon Schneider gerne unter 089 954 287 111 zur Verfügung. Find more English Speaking Jobs in Germany on Arbeitnow"
Arbeitnow API,https://www.arbeitnow.com/jobs/companies/my-humancapital-gmbh/sachbearbeiter-customer-service-und-kundenbetreuung-munich-433400,2026-06-26T17:00:36,MY Humancapital GmbH,Sachbearbeiter Customer Service und Kundenbetreuung (m/w/d),Customer Service,Munich,,Customer Service,"Im Auftrag unseres Partnerunternehmens suchen wir Sie zum nächstmöglichen Zeitpunkt als „ Sachbearbeiter Customer Service &#x26; Kundenbetreuung (m/w/d) “. Aufgaben Sie betreuen Kunden serviceorientiert zu auftragsbezogenen Fragestellungen in deutscher und englischer Sprache Sie erfassen Aufträge und sorgen für eine ordnungsgemäße Abwicklung sowie Fakturierung Darüber hinaus erstellen und prüfen Sie Kostenvoranschläge und bearbeiten eingehende Kundenrückmeldungen Sie koordinieren die Bearbeitung bestätigter Aufträge und behalten Termine sowie den Bearbeitungsstatus im Blick Zusätzlich unterstützen Sie das Team bei allgemeinen administrativen und organisatorischen Aufgaben Qualifikation Grundlage bildet eine abgeschlossene kaufmännische Ausbildung, beispielsweise als Kaufmann für Büromanagement (m/w/d), Industriekaufmann (m/w/d), Kaufmann im Groß- und Außenhandelsmanagement (m/w/d) oder Kaufmann für Dialogmarketing (m/w/d) Idealerweise bringen Sie Berufserfahrung als Kundenbetreuer (m/w/d), Mitarbeiter Customer Service (m/w/d), Sachbearbeiter Kundenservice (m/w/d) oder Mitarbeiter Vertriebsinnendienst (m/w/d) mit Sie verfügen über eine ausgeprägte Serviceorientierung und Erfahrung im Umgang mit Kundenanfragen sowie in der lösungsorientierten Bearbeitung von Anliegen Zusätzlich sind gute Kenntnisse in MS Office sowie idealerweise Erfahrungen mit SAP wünschenswert Wichtig sind Kommunikationsstärke, Organisationsgeschick, Problemlösungskompetenz sowie gute Englischkenntnisse in Wort und Schrift Benefits Work-Life-Balance : Geregelte Arbeitszeiten von Montag bis Freitag ohne Schichtarbeit Krisensicherheit : Langfristige Jobmöglichkeit bei einem krisensicheren Arbeitgeber Zentrale Lage : Moderne Büroräumlichkeiten im Herzen von München mit optimaler Verkehrsanbindung Modernes Umfeld : Sie erwartet eine moderne Arbeitsumgebung mit neuester Technik Weiterentwicklung : Auf Sie warten zahlreiche interne und externe Weiterbildungs- und Entwicklungsmöglichkeiten Sie finden das Stellenprofil interessant? Dann freuen wir uns auf Ihre Bewerbung. Für Rückfragen steht Ihnen Kaan Akdemir gerne unter 089 954 287 109 zur Verfügung. Find more English Speaking Jobs in Germany on Arbeitnow"
Arbeitnow API,https://www.arbeitnow.com/jobs/companies/my-humancapital-gmbh/kreditorenbuchhalter-sap-munich-273573,2026-06-26T17:00:36,MY Humancapital GmbH,Kreditorenbuchhalter SAP (m/w/d),Finance,Munich,,Finance,"Im Auftrag unseres Kunden suchen wir Sie für den Standort München zum nächstmöglichen Zeitpunkt als „ Kreditorenbuchhalter SAP (m/w/d) “. Aufgaben Als Kreditorenbuchhalter (m/w/d) prüfen, erfassen und verbuchen Eingangsrechnungen in SAP Sie erstellen Belastungsanzeigen, Weiterberechnungen sowie Zahlläufe für nationale und internationale Lieferanten Darüber hinaus prüfen Sie Reisekostenabrechnungen und berücksichtigen Zahlungsziele sowie Skontofristen Sie pflegen Kreditoren- und Debitorenstammdaten und stellen eine hohe Datenqualität sicher Zusätzlich unterstützen Sie Monats-, Quartals- und Jahresabschlüsse durch Kontenabstimmungen sowie die Buchung von Rückstellungen Qualifikation Sie verfügen über eine erfolgreich abgeschlossene Ausbildung im kaufmännischen Bereich, beispielsweise als Bürokaufmann (m/w/d), Steuerfachangestellter (m/w/d), Kaufmann für Büromanagement (m/w/d), Industriekaufmann (m/w/d) oder eine vergleichbare Qualifikation Darüber hinaus bringen Sie Berufserfahrung als Kreditorenbuchhalter (m/w/d), Debitorenbuchhalter (m/w/d) oder Finanzbuchhalter (m/w/d) mit Im Umgang mit SAP im Finanzbereich sind Sie sicher Ihre Arbeitsweise ist strukturiert und zuverlässig, zudem besitzen Sie ein ausgeprägtes Zahlenverständnis Sichere Deutschkenntnisse und grundlegende Englischkenntnisse runden Ihr Profil ab Benefits Flexibilität: Genießen Sie die Freiheit durch flexible Arbeitszeiten mit anteiliger Homeoffice-Möglichkeit Onboarding: Sie erwartet eine professionelle Einarbeitung von den Experten der Abteilung Weiterbildung- und Entwicklungsmöglichkeiten: Ihre persönliche und fachliche Entwicklung wird gefördert Teamspirit: Freuen Sie sich auf eine flache Hierarchie, schnelle Entscheidungswege sowie regelmäßige Firmenevents Sie finden das Stellenprofil interessant? Dann freuen wir uns auf Ihre Bewerbung. Senden Sie uns Ihre Unterlagen. Für Rückfragen steht Ihnen Simon Schneider gerne unter 089 954 287 111 zur Verfügung. Find Jobs in Germany on Arbeitnow"
Arbeitnow API,https://www.arbeitnow.com/jobs/companies/my-humancapital-gmbh/technischer-projektmanager-munich-394682,2026-06-26T17:00:36,MY Humancapital GmbH,Technischer Projektmanager (m/w/d),Project Management,Munich,,Project Management,"Technischer Projektmanager (m/w/d) gesucht – Vollzeit | München Im Auftrag unseres Partnerunternehmens in München suchen wir Sie zum nächstmöglichen Zeitpunkt als „Technischer Projektmanager (m/w/d)“ Aufgaben Sie bearbeiten nationale und internationale Projekte im Bereich technischer Ausbildungs- und Lernlösungen und übernehmen schrittweise Verantwortung für eigene Teilprojekte Als Teil des Projektteams erstellen und prüfen Sie Ausbildungsbedarfsanalysen, Ausbildungskonzepte sowie fachliche Drehbücher für Lerninhalte Sie konzipieren und bewerten digitale Lernmedien und Lernprogramme und stellen deren fachliche und didaktische Qualität sicher Darüber hinaus koordinieren Sie interne und externe Schnittstellen und begleiten Reviews, Tests sowie Abnahmen mit Kunden und Projektbeteiligten Zusätzlich beraten Sie bei der Entwicklung von Ausbildungskonzepten und unterstützen die erfolgreiche Umsetzung technischer Trainingsprojekte Qualifikation Grundlage bildet ein abgeschlossenes Studium der Ingenieurwissenschaften, Fahrzeugtechnik, Maschinenbau, Elektrotechnik, Physik oder einer vergleichbaren technischen beziehungsweise naturwissenschaftlichen Fachrichtung Idealerweise bringen Sie Berufserfahrung als Technischer Projektmanager (m/w/d), Projektingenieur (m/w/d), Technischer Redakteur (m/w/d) oder Referent Technische Ausbildung (m/w/d) mit Sie verfügen bereits über einschlägige Erfahrung in der Konzeption, Entwicklung oder Durchführung technischer Ausbildungen, Trainingsmaßnahmen oder Lernprogramme Zusätzlich sind Kenntnisse in der Kraftfahrzeug-, Nutzfahrzeug- oder Systemtechnik von Vorteil sowie ein ausgeprägtes technisches Verständnis erforderlich Wichtig sind Kommunikationsstärke, Teamfähigkeit, ein professionelles Auftreten sowie sehr gute Englischkenntnisse und Reisebereitschaft im In- und Ausland Benefits IG-Metall-Tarifvertrag : Hier erwartet Sie eine attraktive Bezahlung nach dem IG-Metall Tarifvertrag Onboarding : Ihre erfahrenen Kollegen stehen Ihnen während der Einarbeitung mit Rat und Tat zur Seite Entwicklung : Firmenintern gibt es zahlreiche Weiterbildungs- und Entwicklungsmöglichkeiten Vielseitigkeit : Freuen Sie sich aufspannende und abwechslungsreiche Tätigkeiten in einem dynamischen Umfeld Teamspirit : Sie erwarten flache Hierarchien, kurze Entscheidungswege sowie eine wertschätzende Zusammenarbeit Sie finden das Stellenprofil interessant? Dann freuen wir uns auf Ihre Bewerbung. Für Rückfragen steht Ihnen Kaan Akdemir gerne unter 089 954 287 109 zur Verfügung. Find more English Speaking Jobs in Germany on Arbeitnow"
Arbeitnow API,https://www.arbeitnow.com/jobs/companies/my-humancapital-gmbh/projektassistenz-heilbronn-53161,2026-06-26T17:00:36,MY Humancapital GmbH,Projektassistenz (m/w/d) Heilbronn,Project Management,Heilbronn,,Project Management,"Projektassistenz (m/w/d) gesucht – Vollzeit | Heilbronn Im Auftrag unseres Partnerunternehmens in Heilbronn suchen wir Sie zum nächstmöglichen Zeitpunkt als „Projektassistenz (m/w/d)“. Aufgaben Als Projektassistenz (m/w/d) unterstützen organisatorische und administrative Abläufe im Projektmanagement Als zentrale Ansprechperson koordinieren Sie Termine, Informationen und operative Prozesse mit internen und externen Beteiligten Sie pflegen Daten und administrative Systeme und stellen eine hohe Qualität der Dokumentation und Auswertungen sicher Darüber hinaus unterstützen Sie bei der Planung, Organisation und Nachbereitung von Veranstaltungen und Besprechungen Zusätzlich erstellen Sie Präsentationen, Berichte und weitere Unterlagen und tragen zu einem reibungslosen Tagesgeschäft bei Qualifikation Grundlage bildet eine abgeschlossene kaufmännische Ausbildung, beispielsweise als Kaufmann für Büromanagement (m/w/d), Industriekaufmann (m/w/d), Verwaltungsfachangestellter (m/w/d) oder alternativ ein abgeschlossenes Studium Idealerweise bringen Sie Berufserfahrung als Projektassistenz (m/w/d), Teamassistenz (m/w/d), Projektsachbearbeiter (m/w/d) mit Sie verfügen über sehr gute Kenntnisse in Outlook, Excel, PowerPoint und Word Zusätzlich sind Erfahrungen in der Datenpflege, mit administrativen Systemen sowie idealerweise in der Veranstaltungsorganisation von Vorteil Sehr gute Deutsch- und Englischkenntnisse runden Ihr Profil ab Benefits Sicherheit : Kaum ein Arbeitgeber bietet eine derartige Sicherheit wie der Öffentliche Dienst Onboarding : Ihre erfahrenen Kollegen stehen Ihnen während der Einarbeitung mit Rat und Tat zur Seite Entwicklung : Firmenintern gibt es zahlreiche Weiterbildungs- und Entwicklungsmöglichkeiten Vielseitigkeit : Freuen Sie sich aufspannende und abwechslungsreiche Tätigkeiten in einem dynamischen Umfeld Teamspirit : Sie erwarten flache Hierarchien, kurze Entscheidungswege sowie eine wertschätzende Zusammenarbeit Sie finden das Stellenprofil interessant? Dann freuen wir uns auf Ihre Bewerbung. Für Rückfragen steht Ihnen Anna-Maria Holz gerne unter 089 954 287 105 zur Verfügung. Find Jobs in Germany on Arbeitnow"
Arbeitnow API,https://www.arbeitnow.com/jobs/companies/my-humancapital-gmbh/3d-artist-blender-realtime-anwendungen-munich-282377,2026-06-26T17:00:36,MY Humancapital GmbH,3D Artist Blender & Realtime-Anwendungen (m/w/d),Graphic Arts and Communication Design,Munich,,Graphic Arts and Communication Design,"3D Artist (m/w/d) gesucht – Vollzeit | München Im Auftrag unseres Partnerunternehmens in München suchen wir Sie zum nächstmöglichen Zeitpunkt als „3D Grafikdesigner / 3D Artist (m/w/d)“. Aufgaben Sie erstellen komplexe 3D-Animationen und 3D-Grafiken für digitale Lern- und Trainingsanwendungen mit Blender Als Teil des Entwicklungsteams entwickeln Sie Assets und Szenen für VR-, AR- und Realtime-Anwendungen auf Basis von Game Engines wie Unity oder Godot Sie bereiten bestehende CAD-Daten auf, optimieren Modelle für Echtzeitanwendungen und reduzieren Geometrien bedarfsgerecht Darüber hinaus modellieren Sie 3D-Objekte und erstellen Texturen, Materialien sowie Shader für unterschiedliche Einsatzszenarien Zusätzlich entwickeln Sie bestehende 3D-Grafiken und Animationen weiter und passen diese an neue Anforderungen an Qualifikation Grundlage bildet eine technische oder gestalterische Ausbildung, beispielsweise als Mediengestalter Digital und Print (m/w/d), Technischer Produktdesigner (m/w/d), Gamedesigner (m/w/d) oder Technischer Systemplaner (m/w/d), alternativ ein entsprechendes Studium Sie bringen bereits mindestens erste Berufserfahrung als 3D Artist (m/w/d), Technical Artist (m/w/d), 3D Grafikdesigner (m/w/d) oder Multimedia Designer (m/w/d) mit Sie verfügen über sehr gute Kenntnisse in Blender sowie über praktische Erfahrung in der Erstellung von 3D-Modellen, Animationen und Realtime-Inhalten Zusätzlich sind gute Kenntnisse in Adobe Photoshop, Illustrator und After Effects sowie Erfahrungen mit Game Engines wie Unity oder Godot wünschenswert Wichtig sind technisches Verständnis, Teamfähigkeit sowie eine selbstständige und strukturierte Arbeitsweise Benefits IG-Metall-Tarifvertrag : Hier erwartet Sie eine attraktive Bezahlung nach dem IG-Metall Tarifvertrag Onboarding : Ihre erfahrenen Kollegen stehen Ihnen während der Einarbeitung mit Rat und Tat zur Seite Entwicklung : Firmenintern gibt es zahlreiche Weiterbildungs- und Entwicklungsmöglichkeiten Vielseitigkeit : Freuen Sie sich aufspannende und abwechslungsreiche Tätigkeiten in einem dynamischen Umfeld Teamspirit : Sie erwarten flache Hierarchien, kurze Entscheidungswege sowie eine wertschätzende Zusammenarbeit Sie finden das Stellenprofil interessant? Dann freuen wir uns auf Ihre Bewerbung. Für Rückfragen steht Ihnen Kaan Akedmir gerne unter 089 954 287 109 zur Verfügung. Find more English Speaking Jobs in Germany on Arbeitnow"
Arbeitnow API,https://www.arbeitnow.com/jobs/companies/my-humancapital-gmbh/sachbearbeiter-logistik-materialdisposition-munich-227609,2026-06-26T17:00:35,MY Humancapital GmbH,Sachbearbeiter Logistik & Materialdisposition (m/w/d),Consulting,Munich,,Consulting,"Im Auftrag unseres Partnerunternehmens in München suchen wir Sie zum nächstmöglichen Zeitpunkt als „Sachbearbeiter Logistik &#x26; Materialdisposition (m/w/d)“. Aufgaben Als Sachbearbeiter (m/w/d) unterstützen Sie bei der Planung und Sicherstellung der Ersatzteilversorgung Dabei koordinieren Sie als Schnittstelle die Zusammenarbeit zwischen Produktion, Intralogistik, Materialkoordination und Fertigung Sie betreuen logistische Abläufe und unterstützen bei der termingerechten Steuerung von Material- und Warenflüssen Darüber hinaus wirken Sie an projektübergreifenden Aufgabenstellungen innerhalb der Fachabteilung mit Zusätzlich begleiten Sie Kurz- und Sonderprojekte und tragen zur erfolgreichen Umsetzung logistischer Anforderungen bei Qualifikation Grundlage bildet eine abgeschlossene kaufmännische Ausbildung, beispielsweise als Industriekaufmann (m/w/d), Kaufmann für Spedition und Logistikdienstleistung (m/w/d), Kaufmann für Groß- und Außenhandelsmanagement (m/w/d) oder Fachkraft für Lagerlogistik (m/w/d) Idealerweise bringen Sie Berufserfahrung als Logistikkoordinator (m/w/d), Disponent Materialwirtschaft (m/w/d), Sachbearbeiter Logistik (m/w/d) oder Mitarbeiter Supply Chain Management (m/w/d) mit Sie verfügen über fundierte Kenntnisse in den Bereichen Logistik, Disposition und Materialwirtschaft Zusätzlich sind ein sicherer Umgang mit MS Office sowie idealerweise Kenntnisse in SAP und erste Erfahrungen in der Projektarbeit wünschenswert Wichtig sind Kommunikationsstärke, Eigeninitiative, Problemlösungskompetenz sowie eine selbstständige, verantwortungsbewusste und teamorientierte Arbeitsweise Benefits IG-Metall-Tarifvertrag : Hier erwartet Sie eine attraktive Bezahlung nach dem IG-Metall Tarifvertrag sowie eine anteilige Homeoffice-Möglichkeit Onboarding : Ihre erfahrenen Kollegen stehen Ihnen während der Einarbeitung mit Rat und Tat zur Seite Entwicklung : Firmenintern gibt es zahlreiche Weiterbildungs- und Entwicklungsmöglichkeiten Vielseitigkeit : Freuen Sie sich aufspannende und abwechslungsreiche Tätigkeiten in einem dynamischen Umfeld Teamspirit : Sie erwarten flache Hierarchien, kurze Entscheidungswege sowie eine wertschätzende Zusammenarbeit Sie finden das Stellenprofil interessant? Dann freuen wir uns auf Ihre Bewerbung. Für Rückfragen steht Ihnen Kaan Akedmir gerne unter 089 954 287 109 zur Verfügung. Find Jobs in Germany on Arbeitnow"
Arbeitnow API,https://www.arbeitnow.com/jobs/companies/my-humancapital-gmbh/kreditsachbearbeiter-munich-143213,2026-06-26T17:00:35,MY Humancapital GmbH,Kreditsachbearbeiter (m/w/d),Credit Analysis,Munich,,Credit Analysis,"Kreditsachbearbeiter (m/w/d) gesucht – unbefristet | Vollzeit | München Im Auftrag unseres Partnerunternehmens in München suchen wir Sie zum nächstmöglichen Zeitpunkt als „Kreditsachbearbeiter (m/w/d)“. Aufgaben Als Kreditsachbearbeiter (m/w/d) betreuen Sie das bestehende Kreditengagement und übernehmen die Folge- und Bestandsbearbeitung im Kreditgeschäft Dabei bearbeiten Sie Darlehensauszahlungen und stellen eine ordnungsgemäße Abwicklung sicher Sie verwalten Kreditsicherheiten eigenverantwortlich und sorgen für eine vollständige und rechtssichere Dokumentation Darüber hinaus pflegen Sie die relevanten Systeme der Marktfolge Aktiv und gewährleisten eine hohe Datenqualität Zusätzlich bearbeiten Sie Bestandskreditanträge, unterstützen interne Fachbereiche und wirken an der Optimierung von Prozessen und Projekten mit Qualifikation Grundlage bildet eine abgeschlossene Ausbildung als Bankkaufmann (m/w/d), Kaufmann für Versicherungen und Finanzanlagen (m/w/d), Sparkassenkaufmann (m/w/d) oder Finanzassistent (m/w/d) Idealerweise bringen Sie Berufserfahrung als Kreditsachbearbeiter (m/w/d), Mitarbeiter Marktfolge Aktiv (m/w/d), Kreditreferent (m/w/d) oder Sachbearbeiter Kreditgeschäft (m/w/d) mit Sie verfügen über Kenntnisse im Kreditgeschäft sowie idealerweise im Kredit- und Sicherheitenrecht Zusätzlich sind Erfahrungen in der Bearbeitung von Kreditengagements, Darlehen oder Sicherheiten von Vorteil Wichtig sind eine strukturierte und sorgfältige Arbeitsweise, Serviceorientierung sowie eine ausgeprägte Kommunikations- und Teamfähigkeit Benefits Sicherheit : Festanstellung im Rahmen der Direktvermittlung Zentrale Lage : Moderne Büroräumlichkeiten im Herzen von München mit optimaler Verkehrsanbindung Onboarding: Ihre erfahrenen Kollegen stehen Ihnen während der Einarbeitung mit Rat und Tat zur Seite Entwicklung: Firmenintern gibt es zahlreiche Weiterbildungs- und Entwicklungsmöglichkeiten Teamspirit: Sie erwarten flache Hierarchien, kurze Entscheidungswege sowie eine wertschätzende Zusammenarbeit Sie finden das Stellenprofil interessant? Dann freuen wir uns auf Ihre Bewerbung. Für Rückfragen steht Ihnen Simon Schneider gerne unter 089 954 287 111 zur Verfügung. Find Jobs in Germany on Arbeitnow"
