source,source_url,date_posted,company,title,category,location,job_type,tags_raw,description
Arbeitnow API,https://www.arbeitnow.com/jobs/companies/tippingpoints-gmbh/managerin-finanzen-controlling-fur-nachhaltige-kommunikationsagentur-bonn-320322,2026-07-09T10:00:41,tippingpoints GmbH,Manager:in Finanzen & Controlling (m/w/d) für nachhaltige Kommunikationsagentur,Controlling,Bonn,berufserfahren,Controlling,"Du hast Zahlen im Blick, denkst wirtschaftlich und möchtest mit Deiner Arbeit einen echten Beitrag zu einer nachhaltigeren Zukunft leisten? Du arbeitest gerne strukturiert, verlierst auch bei komplexen Projekten nicht den Überblick und hast Lust, gemeinsam mit unserem Team die finanzielle Steuerung unserer Agentur weiterzuentwickeln? Dann sollten wir uns kennenlernen. Wir sind tippingpoints – eine Kommunikationsagentur, die ausschließlich an Nachhaltigkeitsthemen arbeitet. Unsere Projekte beschäftigen sich mit Klimaschutz, nachhaltiger Mobilität, Ernährung, erneuerbaren Energien oder einer fairen Gesellschaft. Zu unseren Kunden zählen Bundes- und Landesministerien, Stiftungen, Städte, Verbände und Think Tanks. Zunehmend begleiten wir außerdem Unternehmen, die ihre Transformation glaubwürdig vorantreiben möchten. Nachhaltigkeit endet für uns nicht bei unseren Projekten. Wir möchten auch als Organisation Verantwortung übernehmen und entwickeln unsere Arbeitsweise kontinuierlich weiter – transparent, selbstorganisiert und wirtschaftlich solide. Dafür suchen wir Dich als zentrale Ansprechperson im Bereich Finanzen &#x26; Controlling. Die Stelle kann – je nach Wunsch – in Teil- oder Vollzeit besetzt werden und ist vorzugsweise an unserem Standort in Bonn angesiedelt. Auch eine Tätigkeit an unserem Berliner Standort ist möglich. Aufgaben Finanzplanung, Liquiditätssteuerung und betriebswirtschaftliche Auswertungen für die Agentur Erstellung von Forecasts und betriebswirtschaftlichen Analysen als Grundlage für strategische Entscheidungen sowie Sparringspartner:in der Geschäftsführung in finanziellen Fragestellungen Vorbereitung der monatlichen Finanzbuchhaltung mit DATEV Unternehmen Online Vorbereitung und Begleitung von Jahresabschlüssen in enger Zusammenarbeit mit unserer Steuerberatung Verantwortung für Gehaltszahlungen sowie weitere wiederkehrende Finanz- bzw. administrative Personalprozesse Unterstützung unserer Projektleiter bei Budgetplanung, Kalkulation und laufender Kostenkontrolle, Abwicklung und Abrechnung von Förderprojekte Verantwortung für die kontinuierliche Weiterentwicklung unserer Finanz- und Controllingprozesse Qualifikation Mehrjährige Erfahrung im Bereich Finanzen, Controlling, Buchhaltung oder Steuerberatung Eine kaufmännische Ausbildung, ein betriebswirtschaftliches Studium oder eine vergleichbare Qualifikation Freude daran, Zahlen zu analysieren und daraus Handlungsempfehlungen abzuleiten Selbstständige, strukturierte und sorgfältige Arbeitsweise Sicherer Umgang mit Office sowie idealerweise DATEV oder vergleichbarer Buchhaltungssoftware Lust darauf, Verantwortung zu übernehmen und Prozesse aktiv weiterzuentwickeln Kommunikationsstärke und die Fähigkeit, finanzielle Zusammenhänge verständlich zu vermitteln Wünschenswert sind Vorerfahrungen mit einer ERP Agentursoftware wie Moco Benefits Eine sinnstiftende Tätigkeit mit Projekten, die gesellschaftlichen Wandel voranbringen Eine Schlüsselrolle mit viel Gestaltungsspielraum und direktem Austausch mit der Geschäftsführung. Flexible Arbeitszeiten und die Möglichkeit, mobil zu arbeiten Ein engagiertes, herzliches Team mit hoher Eigenverantwortung Sechs Wochen Urlaub Zuschuss zum Deutschlandticket sowie zur betrieblichen Altersvorsorge Regelmäßige Teamtage, gemeinsame Mittagessen und eine Unternehmenskultur, in der Zusammenarbeit wichtiger ist als Ellenbogen Wir glauben nicht, dass Lebensläufe perfekt sein müssen. Wenn Du Dich in der Beschreibung wiederfindest und Lust hast, unsere Agentur mitzugestalten, freuen wir uns auf Deine Bewerbung – auch wenn Du nicht jeden einzelnen Punkt erfüllst. Uns ist wichtig, dass sich bei uns Menschen mit unterschiedlichen Perspektiven, Erfahrungen und Lebenswegen willkommen fühlen. Deshalb freuen wir uns über Bewerbungen unabhängig von ethnischer und sozialer Herkunft, Nationalität, Geschlecht, Religion oder Weltanschauung, Alter, Behinderung, sexueller Orientierung oder Familienstand. Schick uns Deine Unterlagen zusammen mit Deinem "
Arbeitnow API,https://www.arbeitnow.com/jobs/companies/hey-contact-heroes-gmbh/kundenberater-in-bei-einem-energieversorger-100-home-office-hamburg-327249,2026-07-09T10:00:41,hey contact heroes GmbH,Kundenberater/in bei einem Energieversorger - 100% Home-Office,Remote,Hamburg,,Remote; Customer Service,"Kennst du schon die Hey Contact Heroes? Noch nicht? Dann wird’s Zeit! Steig‘ ein bei der Nummer eins der “work at home”-Dienstleister am Markt und werde auch du ein Hero! Wir haben uns auf die Fahne geschrieben, sowohl all unsere Heroes als auch unsere Auftraggeber jeden Tag zu begeistern. Du suchst einen sicheren Job, den Du im Home-Office ausüben kannst? Wenn von deiner Seite aus auch noch Kommunikation und Empathie zu deinen Stärken zählen und du Spaß hast, Kunden eines Wasserversorgers im Großraum Hamburg zu beraten, dann solltest du eines jetzt tun: bewirb dich bei uns! Wir sind ein junges, dynamisches und schnell wachsendes Unternehmen im Bereich Customer Service. Das Besondere an uns: Hey Contact Heroes“ steht für 100% agiles Arbeiten. Das heißt, bei uns gibt es keinen festen Arbeitsort. Alle Mitarbeiter*innen arbeiten ausschließlich im Home-Office. Unsere Mission ist es hierbei, unsere Auftraggeber in ihrem Segment zum Marktführer aufsteigen zu lassen. Was uns dabei zugutekommt: viel Engagement, Leidenschaft, flexible Ressourcen, langjähriges Fachwissen und unsere internationale Teamstruktur. Jetzt fehlst nur noch du in unserem Team! Aufgaben Deine Mission: Du betreust Kundinnen und Kunden eines kommunalen Auftraggebers telefonisch und schriftlich. Du beantwortest Fragen zu Anliegen rund um den Kundenservice. Du erfasst, bearbeitest und dokumentierst Kundenanfragen sorgfältig in den vorgesehenen Systemen. Du findest lösungsorientierte Antworten und sorgst für eine positive Kundenerfahrung. Du leitest komplexere Anliegen bei Bedarf an die zuständigen Fachbereiche weiter. Qualifikation Dein Profil: Du hast eine abgeschlossene kaufmännische Ausbildung oder mehrjährige Erfahrung im Kundenservice. Du verfügst über erste Produkt- und Branchenkenntnisse, idealerweise im kommunalen Umfeld oder in der Energiewirtschaft. Du arbeitest sorgfältig, zuverlässig und serviceorientiert. Du hast eine hohe Kundenorientierung und bleibst auch in herausfordernden Gesprächen freundlich und professionell. Du bringst ausgeprägte soziale und kommunikative Fähigkeiten mit. Du hast einen ruhigen, geeigneten Arbeitsplatz im Home-Office. Benefits Unser Angebot: 100% Home-Office Ein sicheres Projektumfeld bei einem kommunalen Auftraggeber Strukturierte Einarbeitung und verständliche Prozesse Moderne technische Ausstattung für deine Arbeit im Home-Office Ein kollegiales Team, das dich unterstützt Gute Entwicklungsmöglichkeiten bei den hey contact heroes Über uns Wir sind die hey contact heroes – ein moderner Kundenservice-Dienstleister mit Sitz in Hamburg. Wir unterstützen Unternehmen und öffentliche Auftraggeber mit professionellem Kundenservice, digitalen Prozessen und starken Teams im Home-Office. Bei uns zählen Servicequalität, Teamgeist und eine offene Kommunikation. Wir suchen Menschen, die Lust haben, Verantwortung zu übernehmen und Kundinnen und Kunden jeden Tag ein gutes Serviceerlebnis zu bieten. Bewirb dich jetzt Du hast Erfahrung im Kundenservice? Dann freuen wir uns auf deine Bewerbung als Kundenberater/in bei einem Energieversorger. Werde Teil der hey contact heroes und unterstütze ein wichtiges Kundenservice-Projekt im Großraum Hamburg. Find Jobs in Germany on Arbeitnow"
Arbeitnow API,https://www.arbeitnow.com/jobs/companies/qatna-medical-gmbh/praktikumsplatz-im-bereich-entwicklung-ab-september-2026-hechingen-392355,2026-07-09T10:00:41,Qatna Medical GmbH,Praktikumsplatz im Bereich Entwicklung ab September 2026 (m/w/d),Development,Hechingen,Internship,Development,"Qatna Medical GmbH ist ein Medizintechnikunternehmen mit Sitz in Hechingen, Baden-Württemberg. Unsere Medizinprodukte “Made in Germany” werden mit höchsten Qualitätsstandards entwickelt, hergestellt und vermarktet. Wir investieren in neueste Technologien und haben uns auf minimal-invasive Anwendungen spezialisiert. Kurze Entscheidungswege und schnelle Reaktionszeiten sowie ein junges, dynamisches Team zeichnen uns aus. Aufgaben Eigenständige Durchführung von kleinen Entwicklungsprojekten Mitarbeit bei laufenden Entwicklungsprojekten Durchführung von Messungen im Labor und in der Produktion Qualifikation Laufendes technisches/medizintechnisches Studium Idealerweise Kenntnisse in der Konstruktion mit CAD (SolidWorks) Teamorientierte und selbständige Arbeitsweise Benefits Wissens- und Erfahrungsvermittlung durch fachkundige Kolleginnen und Kollegen Solide Basis und interessante Kontakte für Deine berufliche Zukunft Besonderes Miteinander und dynamisches Team Auf Wunsch: Unterstützung bei der Erstellung der Bachelor-/ Master-Thesis Bereit für eine neue Herausforderung? Bewerben Sie sich jetzt – ganz einfach ohne Anschreiben und Lebenslauf über unser Bewerbungsformular auf der Website. Wir freuen uns auf Ihre Bewerbung! Find Jobs in Germany on Arbeitnow"
Arbeitnow API,https://www.arbeitnow.com/jobs/companies/karo-energieberatung-gmbh/projektmanager-nachhaltiges-bauen-und-qng-tostedt-103422,2026-07-09T10:00:40,KARO Energieberatung GmbH,Projektmanager (m/w/d) Nachhaltiges Bauen und QNG,Power Engineering and Environmental Engineering,Tostedt,berufserfahren,Power Engineering and Environmental Engineering,"Wir sind ein wachsendes Energieberatungs- und Planungsbüro mit Sitz in Tostedt, im Speckgürtel von Hamburg. Unser Team besteht aus 19 engagierten Kolleginnen und Kollegen – von Planern und Ingenieuren bis hin zu Bautechnikern und kaufmännischen Mitarbeitenden. Wir unterstützen unsere Kunden bei Bauvorhaben aller Art – sei es Neubau oder Bestandsgebäude, Wohn- oder Nichtwohngebäude. Unser Service umfasst die persönliche Beratung vor Ort, die Prüfung von Angeboten, die Beantragung von Fördermitteln sowie die Erstellung aller notwendigen Planungen und Berechnungen. Wir begleiten die Projekte bis zur Abnahme, prüfen Rechnungen und kümmern uns um die Auszahlung der Fördermittel. Da unser Arbeitsaufkommen stetig wächst und unsere Projekte immer umfangreicher werden, suchen wir tatkräftige Unterstützung, um weiterhin die besten Lösungen für unsere Kunden zu realisieren. Aufgaben Du erstellst Wärme- und Energienachweise für Neubau- und Bestandsprojekte Du entwickelst und bewertest Energie- und Wärmeschutzkonzepte Du begleitest Neubauprojekte im Hinblick auf das QNG und energieeffizientes Bauen Du erstellst Nachweise, Dokumentationen sowie Zertifizierungsunterlagen Du berätst zu staatlichen Förderprogrammen und entwickelst passende Fördermittelstrategien Du arbeitest eng mit Architekten, Fachplanern und Bauherren zusammen Qualifikation Du hast ein abgeschlossenes Studium im Bereich Ingenieurwesen oder Architektur (Bachelor oder Master) oder alternativ eine abgeschlossene handwerkliche Ausbildung mit Meistertitel Du verfügst über Erfahrung in den Bereichen Bauphysik, Wärmeschutz, energieeffizientes Bauen sowie idealerweise im QNG Du kennst dich mit relevanten Normen und Nachweisverfahren, beispielsweise dem GEG, aus oder bist bereit, dich in diese Themen einzuarbeiten Du arbeitest selbstständig, strukturiert und organisiert und zeichnest dich durch eine ergebnisorientierte Arbeitsweise aus Du denkst lösungsorientiert, übernimmst Verantwortung und bringst dich mit Engagement aktiv ins Team ein Du kommunizierst sicher, trittst freundlich und professionell auf und arbeitest gerne mit Kunden sowie Kollegen zusammen Benefits Einen sicheren, unbefristeten Vollzeitjob mit fairem und verlässlichem Gehalt Flexible Arbeitszeiten sowie 30 Tage Urlaub für eine gute Work-Life-Balance Die Möglichkeit, regelmäßig im Home-Office zu arbeiten Zusätzliche Leistungen wie betriebliche Altersvorsorge sowie Urlaubs- und Weihnachtsgeld Weitere attraktive Mitarbeiter-Benefits Und vor allem: ein modernes Arbeitsumfeld sowie ein kollegiales Team, das unterstützt und in dem man gerne zusammenarbeitet Wenn du Lust hast, in einem motivierten Team deine Fähigkeiten in einem abwechslungsreichen Umfeld einzubringen, freuen wir uns sehr auf deine Bewerbung! * Bitte beachten Sie, dass Sie sich mit dieser Bewerbung für eine Position bei der KARO Energieberatung GmbH bewerben, welche Teil der Prokuras Unternehmensgruppe ist. Die Bearbeitung Ihrer Bewerbung erfolgt zentral durch die Personalabteilung unserer Muttergesellschaft. Diese wird sich im Laufe des Bewerbungsprozesses mit Ihnen in Verbindung setzen. Wir bitten Sie daher um etwas Geduld und versichern Ihnen, dass Ihre Bewerbung mit größter Sorgfalt bearbeitet wird. Find more English Speaking Jobs in Germany on Arbeitnow"
Arbeitnow API,https://www.arbeitnow.com/jobs/companies/your-showdown-gmbh/werkstudentin-im-hr-berlin-44403,2026-07-09T10:00:40,Your Showdown GmbH,Werkstudent*in im HR (w/m/d),Recruitment and Selection,Berlin,"Working student, hilfstätigkeit / student",Recruitment and Selection,"Du willst dort arbeiten, wo andere den Spaßfaktor ihres Jahres erleben? Wir sind ein innovatives Freizeit- und Eventkonzept auf 1.000 bis 2.000 m² großen Flächen. Ob Teamevents, JGA oder Großveranstaltungen mit bis zu 200 Personen – bei uns treten Teams in einem genialen Mix aus Quiz, Taktik und Action gegeneinander an. Wir lieben es, Menschen zu begeistern und unvergessliche Erlebnisse zu schaffen. Wir sind ein schnell wachsendes, dynamisches Start-up und immer auf der Suche nach neuen Talenten. Als Werkstudent:in im HR hilfst du unserem HR-Team, die besten Leute an Bord zu holen, sorgst für einen smoothen Onboarding-Prozess und unterstützt uns bei allen möglichen HR-Admin-Tasks. Du hast Bock auf Recruiting, HR-Themen und willst in einem innovativen Umfeld mit coolen Leuten arbeiten? Dann bist du bei uns genau richtig! Aufgaben 📋Was du machst: Support im Recruiting/Bewerbermanagement: Du schreibst coole Stellenausschreibungen, postest sie auf Jobplattformen und koordinierst Interviews – von der Terminabsprache bis zur Absage.Du sortierst Bewerbungen, planst Termine und hältst den Kontakt zu unseren Kandidat*innen. Onboarding-Buddy: Du kümmerst dich darum, dass unsere Newbies sich vom ersten Tag an wohlfühlen und alles haben, was sie brauchen. HR-Admin: Du pflegst Mitarbeiterdaten, erstellst Verträge, Zeugnisse und andere Dokumente. Mitarbeit an coolen HR-Projekten: Du bringst deine Ideen ein und unterstützt uns bei allem, was gerade ansteht – von Prozessoptimierungen bis hin zu neuen Projekten. HR-Daten up-to-date halten: Ob Datenbanken oder HR-Reports – du sorgst dafür, dass alles immer topaktuell ist. HR Trendsetter: Du bist den neuesten HR Marketing Trends auf der Spur und setzt diese gemeinsam mit unserem Marketing Team um. Qualifikation 👍 Was du mitbringst: Du bist eingeschriebene*r Student*in (idealerweise im Bereich Personal, Wirtschaft oder Psychologie). Du behältst immer den Überblick und weißt, wie man Prioritäten setzt. Du bist ein Kommunikationsprofi. Ob per Mail oder im Gespräch – du kannst gut mit Leuten und bist dabei freundlich und verbindlich. Themen wie Recruiting und Onboarding catchen dich! Erste HR-Erfahrungen? Das wäre mega! Ein sicherer Umgang mit GSuite Produkten ist ein Plus. Du zeichnest dich durch deine präzise Arbeitsweise aus. Auch bei Admin-Aufgaben bleibst du strukturiert und detailorientiert. Benefits 🎈 Was wir bieten: Gestaltungsspielraum: Bring deine eigenen Ideen ein und gestalte aktiv den Erfolg unseres Unternehmens mit. Mitbestimmung: Du bekommst die Gelegenheit, von Anfang an dabei zu sein und grundlegend mitzubestimmen, wie wir uns entwickeln. Wachstum: Nutze die Chance, dich schnell weiterzuentwickeln und im Team aufzusteigen. Teamspirit: Freu dich auf ein energiegeladenes, junges Team und eine entspannte Arbeitsatmosphäre. Mentoring: Du arbeitest direkt mit unserem CFO zusammen, tauschst dich täglich mit unseren Expert*innen aus und profitierst von deren Erfahrung. Faire Vergütung: Ein attraktiver Stundenlohn in Höhe von 15 €. Wir freuen uns auf deine Bewerbung! Find more English Speaking Jobs in Germany on Arbeitnow"
Arbeitnow API,https://www.arbeitnow.com/jobs/companies/karo-energieberatung-gmbh/projektmanager-energieberatung-sanierung-tostedt-156418,2026-07-09T09:30:30,KARO Energieberatung GmbH,Projektmanager (m/w/d) Energieberatung & Sanierung,Power Engineering and Environmental Engineering,Tostedt,berufserfahren,Power Engineering and Environmental Engineering,"Wir sind ein wachsendes Energieberatungs- und Planungsbüro mit Sitz in Tostedt, im Speckgürtel von Hamburg. Unser Team besteht aus 19 engagierten Kolleginnen und Kollegen – von Planern und Ingenieuren bis hin zu Bautechnikern und kaufmännischen Mitarbeitenden. Wir unterstützen unsere Kunden bei Bauvorhaben aller Art – sei es Neubau oder Bestandsgebäude, Wohn- oder Nichtwohngebäude. Unser Service umfasst die persönliche Beratung vor Ort, die Prüfung von Angeboten, die Beantragung von Fördermitteln sowie die Erstellung aller notwendigen Planungen und Berechnungen. Wir begleiten die Projekte bis zur Abnahme, prüfen Rechnungen und kümmern uns um die Auszahlung der Fördermittel. Da unser Arbeitsaufkommen stetig wächst und unsere Projekte immer umfangreicher werden, suchen wir tatkräftige Unterstützung, um weiterhin die besten Lösungen für unsere Kunden zu realisieren. Aufgaben Du erstellst Energieausweise (Bedarfs- und Verbrauchsausweise) für Wohn- und Nichtwohngebäude Du entwickelst individuelle Sanierungsfahrpläne (iSFP) und bewertest Maßnahmen hinsichtlich Energieeffizienz und Wirtschaftlichkeit Du führst energetische Fachplanungen sowie Wärmeschutznachweise durch Du planst und begleitest anspruchsvolle Effizienzhauskonzepte für Wohn- und Nichtwohngebäude – von der Planung bis zur Umsetzung Du berätst Hausbesitzer zu energetischen Modernisierungen und nachhaltigen Sanierungslösungen Du unterstützt unsere Kunden bei der Auswahl, Beantragung und Abwicklung passender Fördermittel und Förderprogramme Du arbeitest eng mit Architekten, Fachplanern und weiteren Projektbeteiligten zusammen und koordinierst die Abstimmung im Projekt Qualifikation Du hast ein abgeschlossenes Studium im Bereich Ingenieurwesen oder Architektur (Bachelor oder Master) oder alternativ eine abgeschlossene handwerkliche Ausbildung mit Meistertitel Du verfügst über Erfahrung in der energetischen Sanierung von Bestandsgebäuden Du hast idealerweise Erfahrung in der Erstellung von Energieausweisen sowie individuellen Sanierungsfahrplänen (iSFP) Du kennst dich mit Förderprogrammen und Fördermitteln (z. B. BAFA und KfW) aus Du bringst ein gutes Verständnis für Energieverbräuche, CO₂-Bilanzen und Wirtschaftlichkeitsbetrachtungen mit Du arbeitest selbstständig, strukturiert und zuverlässig und behältst auch bei mehreren Projekten den Überblick Du denkst lösungsorientiert, arbeitest gerne im Team und überzeugst durch Engagement sowie Verantwortungsbewusstsein Du kommunizierst sicher, trittst freundlich und professionell auf und hast Freude daran, Kunden kompetent zu beraten Benefits Einen sicheren, unbefristeten Vollzeitjob mit fairem und verlässlichem Gehalt Flexible Arbeitszeiten sowie 30 Tage Urlaub für eine gute Work-Life-Balance Die Möglichkeit, regelmäßig im Home-Office zu arbeiten Zusätzliche Leistungen wie betriebliche Altersvorsorge sowie Urlaubs- und Weihnachtsgeld Weitere attraktive Mitarbeiter-Benefits Und vor allem: ein modernes Arbeitsumfeld sowie ein kollegiales Team, das unterstützt und in dem man gerne zusammenarbeitet Wenn du Lust hast, in einem motivierten Team deine Fähigkeiten in einem abwechslungsreichen Umfeld einzubringen, freuen wir uns sehr auf deine Bewerbung! * Bitte beachten Sie, dass Sie sich mit dieser Bewerbung für eine Position bei der KARO Energieberatung GmbH bewerben, welche Teil der Prokuras Unternehmensgruppe ist. Die Bearbeitung Ihrer Bewerbung erfolgt zentral durch die Personalabteilung unserer Muttergesellschaft. Diese wird sich im Laufe des Bewerbungsprozesses mit Ihnen in Verbindung setzen. Wir bitten Sie daher um etwas Geduld und versichern Ihnen, dass Ihre Bewerbung mit größter Sorgfalt bearbeitet wird. Find Jobs in Germany on Arbeitnow"
Arbeitnow API,https://www.arbeitnow.com/jobs/companies/your-showdown-gmbh/werkstudentin-im-bereich-finance-berlin-27734,2026-07-09T09:30:29,Your Showdown GmbH,Werkstudent*in im Bereich Finance (w/m/d),Finance,Berlin,Working student,Finance,"Du willst dort arbeiten, wo andere den Spaßfaktor ihres Jahres erleben? Wir sind ein innovatives Freizeit- und Eventkonzept auf 1.000 bis 2.000 m² großen Flächen. Ob Teamevents, JGA oder Großveranstaltungen mit bis zu 200 Personen – bei uns treten Teams in einem genialen Mix aus Quiz, Taktik und Action gegeneinander an. Wir lieben es, Menschen zu begeistern und unvergessliche Erlebnisse zu schaffen. Als Werkstudent*in im Bereich Finance arbeitest du direkt mit unserem CFO zusammen. Dabei wirst du mit allen üblichen Finanzthemen Berührungspunkte haben (u. a. Finanzierung, Controlling, Planung und Reporting). Hast du Lust, unsere Finance-Abteilung auf ein neues Level zu hieven und in einem innovativen Umfeld mit coolen Leuten zu arbeiten? Dann bist du bei uns genau richtig! Aufgaben 📋 Was du machst: Buchhaltung: Du kontierst unsere Kreditorenrechnungen und bereitest somit die Freigabe der Fachabteilungen adressatengerecht vor. Planung &#x26; Budgetierung: Du unterstützt beim jährlichen Planungsprozess, um sowohl das Budget als auch die strategische Planung des Unternehmens so präzise wie möglich vorzubereiten. Reporting: Du unterstützt den CFO dabei, Prozesse aufzusetzen, um das Controlling im Unternehmen zu optimieren und geeignete Berichtsstrukturen aufzubauen. Du bleibst am Ball und lässt nicht locker. Datenabgleich &#x26; -pflege: Du verstehst Datenbanken, pflegst Finanzdaten, erstellst Berichte und andere Dokumente – immer mit viel Genauigkeit und Präzision. Software- &#x26; KI-Integration: Du testest und implementierst neue Softwarelösungen sowie innovative KI-Tools im Finance-Bereich, optimierst unsere internen Workflows durch gezieltes Prompting und treibst die Digitalisierung unserer Prozesse aktiv voran. Qualifikation 👍 Was du mitbringst: Du bist eingeschriebene*r BWL-Student*in (idealerweise mit Schwerpunkt Accounting, Controlling oder Finance). Du behältst immer den Überblick und weißt, wie man Prioritäten setzt. Du bist technisch versiert und verstehst Zusammenhänge schnell. Daten und große Tabellen machen dir keine Angst, sondern bereiten dir Freude. Erste Berufserfahrung im Finance-Bereich? Wäre super! Du zeichnest dich durch deine präzise Arbeitsweise aus. Auch bei Admin-Aufgaben bleibst du strukturiert und detailorientiert. Du bist technikaffin, arbeitest dich schnell in neue Tools ein, bringst ein Verständnis für KI-Tools mit und hast idealerweise erste Erfahrungen im Prompten. Benefits 🎈 Was wir bieten: Gestaltungsspielraum: Bring deine eigenen Ideen ein und gestalte aktiv den Erfolg unseres Unternehmens mit. Mitbestimmung: Du bekommst die Gelegenheit, von Anfang an dabei zu sein und grundlegend mitzubestimmen, wie wir uns entwickeln. Wachstum: Nutze die Chance, dich schnell weiterzuentwickeln und im Team aufzusteigen. Teamspirit: Freu dich auf ein energiegeladenes, junges Team und eine entspannte Arbeitsatmosphäre. Mentoring: Du arbeitest direkt mit unserem CFO zusammen, tauschst dich täglich mit unseren Expert*innen aus und profitierst von deren Erfahrung. Faire Vergütung: Ein attraktiver Stundenlohn in Höhe von 15 €. Wir freuen uns auf deine Bewerbung! Find Jobs in Germany on Arbeitnow"
