source,source_url,date_posted,company,title,category,location,job_type,tags_raw,description
Arbeitnow API,https://www.arbeitnow.com/jobs/companies/immovara-gmbh/laravel-developer-ai-first-proptech-korntal-munchingen-239743,2026-05-05T06:30:41,Immovara GmbH,Laravel Developer (m/w/d) - AI-First PropTech,Remote,Korntal-Münchingen,berufserfahren,Remote; Software Development,"Immovara ist ein junges Start-up, das innovative Produkte für die Immobilienbranche entwickelt (RentUpp). AI ist bei uns nicht nur Feature, sondern die Grundlage unserer gesamten Arbeitsweise - wir nennen das ""AI-First"". Unser Stack: Laravel, Vue.js, Inertia.js - dazu PostgreSQL und AWS. Und natürlich die AI-Werkzeuge, die zum jeweiligen Zeitpunkt die besten am Markt sind. Aufgaben Was Du bei uns machst: Features bauen: von der Idee bis zum Deployment. Keine Wasserfall-Specs, sondern Eigenverantwortung. Mit AI Lösungen entwickeln : Claude Code, LLM-APIs und AI-gestützte Workflows sind bei uns kein Experiment, sondern der Standard. Du baust Features schneller, weil Du AI als Multiplikator einsetzt. Produkt mitgestalten : Du sitzt mit am Tisch, wenn wir neue Produkte und Features planen. Deine Meinung zählt vom ersten Tag. Infrastruktur mitbauen : CI/CD, Datenbank-Architektur, API-Design - pragmatisch und ohne Silos. Qualifikation Du passt zu uns, wenn: Du eigene Projekte gebaut hast - ob SaaS-Tool, Open-Source-Projekt, App oder Bot. Zeig uns, was Du gebaut hast. Das zählt mehr als jedes Zeugnis. Du AI als Entwicklungswerkzeug nutzt - Claude Code, Cursor, Codex oder ähnliche Tools sind für Dich keine Spielerei, sondern Alltag. Du weißt, wie man mit AI schneller und besser entwickelt. Du Dich in Laravel, Vue.js und SQL wohlfühlst und Du schlechten AI Slop von exzellentem Code unterscheiden kannst. Du eigenständig arbeitest - nicht weil Du musst, sondern weil Du es so willst. Du Startup-Tempo magst: Morgens die Idee, nachmittags auf Staging, abends live im Produkt. Benefits Was wir bieten: Direkter Impact: Kleines Team, großes Produkt. Was Du baust, nutzen Kunden noch am gleichen Tag. AI-First in der Praxis: AI ist bei uns nicht das Produkt-Feature, sondern die Art wie wir arbeiten. Claude Code, LLM-gestützte Workflows, agentic Development - Du lernst hier, wie Software-Entwicklung zukünftig überall aussehen wird. Flexibles Remote-Modell: Arbeite von wo Du willst. Wir arbeiten remote, aber synchron - kurze Wege, schnelle Abstimmung. Echte Verantwortung: Keine Hierarchie-Ebenen zwischen Dir und den Entscheidungen. Tolles Team: Wir halten zusammen, helfen uns gegenseitig und haben Spaß an dem, was wir bauen. Schick uns keine Standardbewerbung. Schick uns: Links zu Deinen Projekten: GitHub, deployed Apps, was auch immer Du gebaut hast. Kein Anschreiben nötig. Dein Code spricht für sich. Welche Entwicklung im Bereich AI findest Du aktuell am spannendsten und was willst Du als nächstes ausprobieren? Optional: Dein LinkedIn oder CV. Find more English Speaking Jobs in Germany on Arbeitnow"
Arbeitnow API,https://www.arbeitnow.com/jobs/companies/fino-data-services-gmbh/it-administrator-all-genders-100-homeoffice-kassel-297355,2026-05-05T06:30:41,fino data services GmbH,IT Administrator - (all genders) - 100% Homeoffice,Remote,Kassel,,Remote; IT,"Zur Verstärkung unseres IT-Teams innerhalb unserer Unternehmensgruppe suchen wir eine engagierte Persönlichkeit im Bereich IT-Support und Systemadministration für die fino taxtech GmbH. Die fino taxtech GmbH ist ein innovatives Softwareunternehmen mit Sitz in Kassel, das sich auf die Digitalisierung von Steuerprozessen spezialisiert hat und moderne SaaS-Lösungen für Steuerberater und Unternehmen entwickelt. In dieser Rolle sind Sie zentrale Ansprechperson für die Mitarbeitenden der fino taxtech GmbH bei technischen Fragestellungen und tragen maßgeblich zur Stabilität, Sicherheit und Weiterentwicklung der IT-Infrastruktur bei. Sie arbeiten in einer modernen, überwiegend Windows-basierten Umgebung mit Cloud-Anbindungen (insbesondere AWS) und unterstützen sowohl den operativen IT-Betrieb als auch Infrastruktur- und Digitalisierungsprojekte. Aufgaben Benutzerunterstützung und Fehlerbehebung: Unterstützung bei IT-Problemen im Tagesgeschäft, Diagnose und Behebung von Hardware- und Softwarestörungen sowie Unterstützung der Anwender in einer überwiegend Windows-basierten Umgebung mit einzelnen macOS-Geräten. Installation und Konfiguration: Installation und Konfiguration von PCs, Laptops und Peripheriegeräten (z. B. Drucker). Einrichtung von Benutzerkonten in Microsoft Active Directory und Entra ID, Softwareinstallationen sowie Durchführung von Updates über Action1. Netzwerkmanagement: Verwaltung und Überwachung der Netzwerkinfrastruktur (LAN, WAN, VPN) sowie Unterstützung bei der Fehleranalyse und Störungsbehebung. Betreuung der AWS-Netzwerkkomponenten (VPC, Route 53, ELB). Server-Management, Monitoring und Backup-Management: Administration und Überwachung der AWS-basierten Serverlandschaft (EC2, S3, RDS, ElastiCache mit Valkey und Redis, ELB, Lambda), kontinuierliches Monitoring zur Sicherstellung von Stabilität und Performance sowie Verwaltung und Kontrolle von Backup- und Wiederherstellungssystemen. Mitarbeit an der Pflege und Weiterentwicklung der Infrastruktur über Terraform (Infrastructure as Code) sowie Betreuung containerisierter Workloads (Docker). Datensicherung und Wiederherstellung: Durchführung und Überwachung regelmäßiger Backups sowie Mitwirkung an Disaster-Recovery-Konzepten und Datenwiederherstellungen. Betreuung cloudbasierter Speicherlösungen (insbesondere AWS S3). Sicherheitsmanagement: Unterstützung bei der Umsetzung von IT-Sicherheitsmaßnahmen, Verwaltung von Antivirenlösungen und Firewalls sowie Sensibilisierung der Mitarbeitenden für IT-Sicherheit. Mitarbeit bei der Absicherung cloudbasierter Systeme, insbesondere Verwaltung von Berechtigungen über AWS IAM im Serverbereich sowie Identity-Management für Mitarbeitende über Microsoft Active Directory und Entra ID. Dokumentation und Berichterstattung: Dokumentation von IT-Systemen, Prozessen und Änderungen sowie Pflege einer Wissensdatenbank und Erstellung von Berichten. Schulung und Weiterbildung: Durchführung von Anwenderschulungen zu IT-Systemen, neuen Anwendungen und Sicherheitsrichtlinien. Hardwarewartung und -reparatur: Wartung, Austausch und Fehlerbehebung von IT-Hardware sowie Überwachung der technischen Infrastruktur und Bearbeitung von Garantie- und Servicefällen. Projektunterstützung: Mitarbeit bei IT-Projekten, Unterstützung bei Rollouts neuer Systeme und enge Zusammenarbeit mit Fachabteilungen und externen Dienstleistern. Unterstützung bei cloudbezogenen Infrastrukturprojekten auf Basis von AWS und Terraform. Helpdesk-Management: Annahme, Priorisierung und Bearbeitung von Support-Tickets in Jira sowie Eskalation komplexer Störungen und Sicherstellung einer schnellen Problemlösung. Qualifikation Abgeschlossene IT-Ausbildung oder vergleichbare Qualifikation Erfahrung im IT-Support (1st &#x26; 2nd Level) sowie in der Benutzerbetreuung Gute Kenntnisse in Windows-Umgebungen, Grundkenntnisse in macOS Erfahrung mit Active Directory und Microsoft Entra ID (User- und Rechteverwaltung) Kenntnisse in Installation, Konfiguration und Wartung von Clients und Periphe"
Arbeitnow API,https://www.arbeitnow.com/jobs/companies/togrund-gmbh/support-mitarbeiter-viersen-194447,2026-05-05T06:30:41,Togrund GmbH,Support Mitarbeiter (m/w/d),IT,Viersen,berufserfahren,IT,"Die Togrund GmbH ist ein etabliertes mittelständisches Unternehmen mit Sitz in Viersen. Wir stehen für Zuverlässigkeit, Qualität und kontinuierliche Weiterentwicklung unserer digitalen Prozesse. Zur Verstärkung unseres Teams suchen wir einen engagierten Support Mitarbeiter (m/w/d) mit ausgeprägter Software‑Affinität. Aufgaben Anwender‑Support für interne Softwarelösungen Betreuung, Pflege und Weiterentwicklung von ERP‑, CRM‑ und Warenwirtschaftssystemen Analyse und Behebung von Software‑ und Prozessstörungen Unterstützung bei Software‑Rollouts, Updates und Systemanpassungen Mitarbeit bei der Einführung und Nutzung von KI‑gestützten Anwendungen Schnittstelle zwischen Fachabteilungen und externen IT‑Dienstleistern Dokumentation von Supportfällen und Prozessen Qualifikation Abgeschlossene Ausbildung oder Studium im IT‑, kaufmännischen oder technischen Bereich Praktische Erfahrung mit ERP-, CRM‑ oder Warenwirtschaftssystemen Gute Software‑ und IT‑Affinität Grundkenntnisse oder Praxiserfahrung im Bereich Künstliche Intelligenz (KI) Analytische und strukturierte Arbeitsweise Hohe Service‑ und Kundenorientierung Teamfähigkeit und Kommunikationsstärke Gute Deutschkenntnisse in Wort und Schrift Benefits Einen sicheren Arbeitsplatz in einem wachsenden Unternehmen Abwechslungsreiche Aufgaben mit hohem Praxisbezug Flache Hierarchien und kurze Entscheidungswege Moderne Arbeitsumgebung Angenehmes, kollegiales Team Leistungsgerechte Vergütung Betriebliche Altersversorgung 🔹 Hinweis: Home Office ist für diese Position nicht möglich – der Arbeitsplatz befindet sich ausschließlich am Standort Viersen. Hast du Lust, in einem familiengeführten Unternehmen und einem jungen Team zu arbeiten, in dem du dich entfalten kannst? Dann bewirb dich jetzt! Find more English Speaking Jobs in Germany on Arbeitnow"
Arbeitnow API,https://www.arbeitnow.com/jobs/companies/buro-happold/senior-ingenieur-hkls-mit-schwerpunkt-mieterausbau-berlin-290418,2026-05-05T06:30:41,Buro Happold,Senior Ingenieur HKLS (m/w/d) mit Schwerpunkt Mieterausbau,Engineering,Berlin,,Engineering,"Du bist erfahrener Ingenieur (m/w/d) im Bereich HKLS / Mieterausbau und auf der Suche nach einer neuen Herausforderung in Berlin ? Vielleicht ist diese Position bei Buro Happold genau das, was Du suchst! Aufgaben Du übernimmst je nach Bedarf die Rolle als Lead Designer oder Project Lead (PL) und unterstützt aktiv alle Phasen der Projektabwicklung Du leitest mehrere Projekte gleichzeitig und arbeitest effizient auch unter engen Deadlines Du erstellst hochwertige mechanische Gebäudetechnik‑Planungen (HKLS) in den Leistungsphasen LP2–LP8 Du planst, verteilst und überwachst Ressourcen, um reibungslose Projektabläufe und eine gute Teamunterstützung sicherzustellen Du vertrittst Buro Happold eigenständig in Meetings mit Auftraggebern, Architekt:innen und externen Partnerinnen und Partnern Du arbeitest effektiv mit interdisziplinären Teams zusammen – auch mit Kolleg:innen an anderen Standorten Du unterstützt die Akquise, indem du RFPs prüfst, technische Inhalte vorbereitest und an Projektpräsentationen teilnimmst Du bringst dich in Prozessoptimierungen ein und treibst positive Veränderungen im Team voran Du unterstützt Kolleg:innen durch Mentoring, Delegation und fachliche Anleitung Du leitest oder unterstützt die mechanische oder elektrische Planung und sorgst für eine starke interdisziplinäre Koordination Qualifikation Mehrjährige Erfahrung in der mechanischen Gebäudetechnik (HKLS). HK - Erfahrung Fundierte Erfahrung in den Leistungsphasen LP2–LP8 sowie Kenntnisse in interdisziplinärer Planung Erfahrung in der Ressourcenplanung und -steuerung über verschiedene Projektteams hinweg Kenntnisse in Revit, Linear, MagiCAD und Orca Eine proaktive, lösungsorientierte Arbeitsweise – du sprichst Herausforderungen offen an und bringst mögliche Lösungen mit Fähigkeit, Veränderungen voranzutreiben, Prozesse zu verbessern und die Teamorganisation mitzugestalten Sehr gute Kommunikationsfähigkeiten in Deutsch und Englisch Starkes Verständnis für die Schnittstellen zwischen mechanischen, elektrischen und weiteren Gewerken Erfahrung mit Projekten im kommerziellen Sektor (vorteilhaft, aber nicht zwingend) Benefits eine einzigartige, interdisziplinäre Umgebung mit internationalen Großprojekten Zusammenarbeit mit unseren Niederlassungen rund um die Welt ein modernes Büro im Herzen Berlins mit professionellen, technisch hochwertig ausgestatteten Arbeitsplätzen hybrides Arbeiten vom Büro und aus dem Home-Office sowie Flexibilität unserer Positionen für Teilzeit und Vollzeit 30 Urlaubstage Ein Jahresgehalt von 70.000 bis 73.000 EUR Sprachkurse für unsere Mitarbeiterinnen und Mitarbeiter regelmäßige Teamevents, Sportangebote, Sommerfest, Weihnachtsfest sowie musikalische und kulturelle Events (Konzerte, Filmabende, Karaoke etc.) ein Mental-Wellbeing-Programm sowie ein individuelles Benefit-Programm mit den Schwerpunkten Sport, Mobilität und Altersvorsorge Angebot von Weiterbildungen und ein strukturierter Karrierepfad jährliche Entwicklungsgespräche, flache Hierarchien und kurze Kommunikationswege mit der Möglichkeit, neue Ideen einzubringen Mitgestaltung von Beginn der Karriere an (YEF- Young Employee Forum) Lunchroulette Interested? Intrigued? Inspired? – Wir freuen uns auf Deine Bewerbung! Find Jobs in Germany on Arbeitnow"
Arbeitnow API,https://www.arbeitnow.com/jobs/companies/buro-happold/projektleiter-hkls-mit-schwerpunkt-mieterausbau-berlin-258761,2026-05-05T06:00:48,Buro Happold,Projektleiter HKLS (m/w/d) mit Schwerpunkt Mieterausbau,Engineering,Berlin,,Engineering,"Du bist erfahrener Ingenieur (m/w/d) im Bereich HKLS / Mieterausbau und auf der Suche nach einer neuen Herausforderung in Berlin ? Vielleicht ist diese Position bei Buro Happold genau das, was Du suchst! Aufgaben Du übernimmst je nach Bedarf die Rolle als Lead Designer oder Project Lead (PL) und unterstützt aktiv alle Phasen der Projektabwicklung Du leitest mehrere Projekte gleichzeitig und arbeitest effizient auch unter engen Deadlines Du erstellst hochwertige mechanische Gebäudetechnik‑Planungen (HKLS) in den Leistungsphasen LP2–LP8 Du planst, verteilst und überwachst Ressourcen, um reibungslose Projektabläufe und eine gute Teamunterstützung sicherzustellen Du vertrittst Buro Happold eigenständig in Meetings mit Auftraggebern, Architekt:innen und externen Partnerinnen und Partnern Du arbeitest effektiv mit interdisziplinären Teams zusammen – auch mit Kolleg:innen an anderen Standorten Du unterstützt die Akquise, indem du RFPs prüfst, technische Inhalte vorbereitest und an Projektpräsentationen teilnimmst Du bringst dich in Prozessoptimierungen ein und treibst positive Veränderungen im Team voran Du unterstützt Kolleg:innen durch Mentoring, Delegation und fachliche Anleitung Du leitest oder unterstützt die mechanische oder elektrische Planung und sorgst für eine starke interdisziplinäre Koordination Qualifikation 8–10 Jahre Erfahrung in der mechanischen Gebäudetechnik (HKLS). HK - Erfahrung ist erforderlich Fundierte Erfahrung in den Leistungsphasen LP2–LP8 sowie Kenntnisse in interdisziplinärer Planung Erfahrung in der Ressourcenplanung und -steuerung über verschiedene Projektteams hinweg Kenntnisse in Revit, Linear, MagiCAD und Orca Eine proaktive, lösungsorientierte Arbeitsweise – du sprichst Herausforderungen offen an und bringst mögliche Lösungen mit Erfahrung in Personalführung oder direktem Mentoring sowie Interesse an der Weiterentwicklung von Kolleg:innen Fähigkeit, Veränderungen voranzutreiben, Prozesse zu verbessern und die Teamorganisation mitzugestalten Sehr gute Kommunikationsfähigkeiten in Deutsch und Englisch Sicherer Umgang mit remote oder international arbeitenden Teams Starkes Verständnis für die Schnittstellen zwischen mechanischen, elektrischen und weiteren Gewerken Erfahrung mit Projekten im kommerziellen Sektor (vorteilhaft, aber nicht zwingend) Benefits eine einzigartige, interdisziplinäre Umgebung mit internationalen Großprojekten Zusammenarbeit mit unseren Niederlassungen rund um die Welt ein modernes Büro im Herzen Berlins mit professionellen, technisch hochwertig ausgestatteten Arbeitsplätzen hybrides Arbeiten vom Büro und aus dem Home-Office sowie Flexibilität unserer Positionen für Teilzeit und Vollzeit 30 Urlaubstage Ein Jahresgehalt von 79.000 bis 82.000 EUR Sprachkurse für unsere Mitarbeiterinnen und Mitarbeiter regelmäßige Teamevents, Sportangebote, Sommerfest, Weihnachtsfest sowie musikalische und kulturelle Events (Konzerte, Filmabende, Karaoke etc.) ein Mental-Wellbeing-Programm sowie ein individuelles Benefit-Programm mit den Schwerpunkten Sport, Mobilität und Altersvorsorge Angebot von Weiterbildungen und ein strukturierter Karrierepfad jährliche Entwicklungsgespräche, flache Hierarchien und kurze Kommunikationswege mit der Möglichkeit, neue Ideen einzubringen Mitgestaltung von Beginn der Karriere an (YEF- Young Employee Forum) Lunchroulette Interested? Intrigued? Inspired? – Wir freuen uns auf Deine Bewerbung! Find more English Speaking Jobs in Germany on Arbeitnow"
Arbeitnow API,https://www.arbeitnow.com/jobs/companies/noris-network-ag/junior-it-service-manager-nuremberg-145559,2026-05-05T06:00:48,noris network AG,Junior IT Service Manager (m/w/d),Remote,Nuremberg,berufseinstieg,Remote; IT,"Die noris network AG bietet Unternehmen Lösungen in den Bereichen IT-Outsourcing, Cloud Services, Network &#x26; Security und Datacenter. Technologische Basis dieser Services ist eine leistungsfähige IT-Infrastruktur mit einem eigenen Hochleistungs-Backbone und mehreren Hochsicherheitsrechenzentren. Seit 1993 haben wir uns zu einem der IT-Spezialisten mit mehr als 500 Mitarbeitenden entwickelt. Das alles wäre aber nicht möglich ohne ein starkes Team. Deswegen legen wir Wert auf die permanente Weiterentwicklung und Förderung aller Mitarbeitender und sind auf der Suche nach Verstärkung an den Standorten Nürnberg, Aschheim, Berlin und remote (innerhalb Deutschlands) – durch Dich? Aufgaben Unterstützung bei der Betreuung von Kundenbeziehungen und Mitwirkung an der Optimierung von IT-Services Erstellung und Aufbereitung von Service Reports sowie Unterstützung bei der regelmäßigen Berichterstattung Vorbereitung und Nachbereitung von Service Meetings inklusive Protokollführung Mitarbeit im Service Level Management, insbesondere bei der Überwachung und Dokumentation kundenspezifischer SLAs Unterstützung bei der Identifikation von Kundenanforderungen und beim kontinuierlichen Verbesserungsprozess Mitwirkung bei der Kommunikation von Störungsursachen (RCA) und Maßnahmen im Problem Management Unterstützung bei der Vor- und Nachbereitung von Prüfungshandlungen und Audits Abstimmung mit internen Organisationseinheiten zur Sicherstellung der Servicequalität Qualifikation Erfolgreich abgeschlossenes Studium der Wirtschaftsinformatik, BWL oder vergleichbare Fachausbildung Erste Berufserfahrung (1–2 Jahre) im Bereich IT-Dienstleistungen oder IT Service Management wünschenswert ITIL Foundation Zertifizierung oder die Bereitschaft, diese zeitnah zu erwerben Grundlegendes Verständnis von IT-Infrastrukturen und -Services (Colocation-, Managed- und Cloud Services) Hohes Maß an Service- und Kundenorientierung sowie Lernbereitschaft Strukturierte und sorgfältige Arbeitsweise, Teamfähigkeit und Kommunikationsstärke Verhandlungssichere Deutsch- und gute Englischkenntnisse in Wort und Schrift Benefits Unbefristeter Arbeitsvertrag und flexible Arbeitszeiten Arbeiten an verschiedenen Standorten möglich (z.B. Nürnberg, Aschheim, Berlin) oder auch zu 100% remote Hochwertiges Equipment: Laptop und Firmenhandy auch zur privaten Nutzung Individuelle Förderung und Weiterentwicklung durch Inhouse-Trainings und externe Schulungen Kinderbetreuungskostenzuschuss (pro Monat/Kind) und Corporate Benefits Attraktive Firmenevents (inkl. Reisekostenübernahme), kollegiales und wertschätzendes Arbeitsumfeld sowie Duz-Kultur ab dem ersten Tag Gesundheitsmanagement (z.B. kostenlose Massage), Jobrad Leasing und attraktiver Zuschuss zum Deutschlandticket Welcome Day, direkter Ansprechpartner (m/w/d) und strukturierte Einarbeitungsphase Getränke for free (auch Softdrinks) und frisches Obst an den Standorten Wir haben Dein Interesse geweckt? Dann freuen wir uns über Deine aussagekräftige Bewerbung mit Angabe Deiner Gehaltsvorstellung und dem Eintrittsdatum auf unserem Jobportal. Für Deine Fragen zu uns oder der Stelle stehen wir Dir gerne zur Verfügung. Find more English Speaking Jobs in Germany on Arbeitnow"
Arbeitnow API,https://www.arbeitnow.com/jobs/companies/noris-network-ag/it-service-manager-nuremberg-240971,2026-05-05T06:00:47,noris network AG,IT Service Manager (m/w/d),Remote,Nuremberg,berufserfahren,Remote; IT,"Die noris network AG bietet Unternehmen Lösungen in den Bereichen IT-Outsourcing, Cloud Services, Network &#x26; Security und Datacenter. Technologische Basis dieser Services ist eine leistungsfähige IT-Infrastruktur mit einem eigenen Hochleistungs-Backbone und mehreren Hochsicherheitsrechenzentren. Seit 1993 haben wir uns zu einem der IT-Spezialisten mit mehr als 500 Mitarbeitenden entwickelt. Das alles wäre aber nicht möglich ohne ein starkes Team. Deswegen legen wir Wert auf die permanente Weiterentwicklung und Förderung aller Mitarbeitender und sind auf der Suche nach Verstärkung an den Standorten Nürnberg, Aschheim, Berlin und remote (innerhalb Deutschlands) – durch Dich? Aufgaben Weiterentwicklung von Kundenbeziehungen sowie stetige Optimierung der IT-Services Service Level Management, insbesondere Qualitätskontrolle und -sicherung für kundenspezifische SLAs Identifikation von Kundenanforderungen und Mitwirkung am kontinuierlichen Verbesserungsprozess Eskalationsinstanz bei Störungen und Ableitung von Optimierungsmaßnahmen Moderation und Durchführung von Service Meetings Regelmäßige Berichterstattung auf Basis der erstellten Service Reports und Kanalisierung von Kundenanforderungen Abstimmung mit dem Vertrieb bei vertraglichen und kaufmännischen Fragestellungen zur Etablierung einer hohen Kundenzufriedenheit Begleitung von Prüfungshandlungen und Audits Kommunikation von Störungsursachen (RCA) und Maßnahmen zur nachhaltigen Behebung im Problem Management Qualifikation Erfolgreich abgeschlossenes Studium der Wirtschaftsinformatik, BWL oder vergleichbare Fachausbildung mit mindestens 5 Jahre Berufserfahrung im Management von IT-Dienstleistungen ITIL-Zertifizierung mindestens auf Foundation-Level, idealerweise weiterführende Qualifikation (z. B. ITIL Managing Professional oder ISO 20000) Fundiertes Verständnis von IT-Infrastrukturen und -Services (Colocation-, Managed- und Cloud Services) Hohes Maß an Service-, Qualitäts- und Kundenorientierung Ausgeprägtes Organisationstalent, Durchsetzungs- und Kommunikationsvermögen sowie hohes Engagement Verhandlungssichere Deutsch- und Englischkenntnisse in Wort und Schrift Benefits Unbefristeter Arbeitsvertrag und flexible Arbeitszeiten Arbeiten an verschiedenen Standorten möglich (z.B. Nürnberg, Aschheim, Berlin) oder auch zu 100% remote Hochwertiges Equipment: Laptop und Firmenhandy auch zur privaten Nutzung Individuelle Förderung und Weiterentwicklung durch Inhouse-Trainings und externe Schulungen Kinderbetreuungskostenzuschuss (pro Monat/Kind) und Corporate Benefits Attraktive Firmenevents (inkl. Reisekostenübernahme), kollegiales und wertschätzendes Arbeitsumfeld sowie Duz-Kultur ab dem ersten Tag Gesundheitsmanagement (z.B. kostenlose Massage), Jobrad Leasing und attraktiver Zuschuss zum Deutschlandticket Welcome Day, direkter Ansprechpartner (m/w/d) und strukturierte Einarbeitungsphase Getränke for free (auch Softdrinks) und frisches Obst an den Standorten Wir haben Dein Interesse geweckt? Dann freuen wir uns über Deine aussagekräftige Bewerbung mit Angabe Deiner Gehaltsvorstellung und dem Eintrittsdatum auf unserem Jobportal. Für Deine Fragen zu uns oder der Stelle stehen wir Dir gerne zur Verfügung. Find more English Speaking Jobs in Germany on Arbeitnow"
