source,source_url,date_posted,company,title,category,location,job_type,tags_raw,description
Arbeitnow API,https://www.arbeitnow.com/jobs/companies/ebert-hera-esser-group/technischer-produktdesigner-fachrichtung-maschinen-anlagentechnik-marl-95933,2026-06-29T08:30:45,Ebert HERA Esser Group,Technischer Produktdesigner - Fachrichtung Maschinen & Anlagentechnik (m/w/d),Engineering,Marl,berufserfahren,Engineering,"Für die EH Engineering GmbH in Marl suchen wir schnellstmöglich einen Technischen Produktdesigner (m/w/d) Fachrichtung Maschinen &#x26; Anlagentechnik Über uns Die Ebert HERA Esser Group ist ein gewachsener Firmenverbund und international erfolgreich in der Instandhaltung technischer Großanlagen im Bereich Raffinerie, Petrochemie und Chemie tätig. Die EH Engineering GmbH ist aus diesem Firmenverbund gewachsen und betreut eben diese Kunden mit Engineeringleistungen. Primär im Brownfield werden unsere Betriebsnahen Projekte in direkter Zusammenarbeit mit unseren Bauherren bewältigt. Aufgaben Planung und Konstruktion im Rohr- und Anlagenbau Erstellung von Rohrleitungs- und Anlagenplanungen Planung von Stahlbaukonstruktionen CAD-Konstruktion im Bereich Rohr- und Anlagenbau Aufstellungs- und Layoutplanung Durchführung von Aufmaßen vor Ort Einsatz von 3D-Laserscanning Erstellung und Bearbeitung von Punktewolken Enge Zusammenarbeit mit den Bereichen Berechnung, Fertigung und Montage Qualifikation Abgeschlossene Ausbildung als Technischer Zeichner / CAD-Konstrukteur (m/w/d) im Maschinen- und Anlagenbau oder eine vergleichbare Qualifikation Gute Kenntnisse in MS Office Sicheres Kommunikationsvermögen Ausgeprägtes räumliches Vorstellungsvermögen Strukturierte, zuverlässige und eigenständige Arbeitsweise Teamfähigkeit Erfahrung im Umgang mit CAD-Systemen Wünschenswerte Kompetenzen welche Ihr Profil abrunden Innovationsgeist und kreative Lösungsansätze Eigeninitiative und selbstständiges Arbeiten Benefits Attraktive und leistungsgerechte Vergütung Bis zu 30 Tage Urlaub Urlaubs- und Weihnachtsgeld Unbefristete Festanstellung Vielfältige Weiterbildungsmöglichkeiten Vergünstigungen über unser Corporate Benefits Programm JobRad-Leasingangebot für Fahrräder &#x26; E-Bikes Abwechslungsreiche und interessante Tätigkeiten Angenehme, teamgeprägte Arbeitsatmosphäre mit offener Kommunikation Modern ausgestatteter Arbeitsplatz Intensive Einarbeitung „on the Job“ Flache Hierarchien und schnelle Entscheidungen Wir haben Ihr Interesse geweckt? Dann freuen wir uns auf Ihre Bewerbung! Ansprechpartner: Herr Alexander Fürst Geforderte Anlagen: Anschreiben, Lebenslauf, Zeugnisse Find more English Speaking Jobs in Germany on Arbeitnow"
Arbeitnow API,https://www.arbeitnow.com/jobs/companies/motor-ai/technischer-projektmanager-autonome-fahrzeuge-berlin-121068,2026-06-29T08:30:45,MOTOR Ai,Technischer Projektmanager (m/w/d) Autonome Fahrzeuge,Project Management,Berlin,berufserfahren,Project Management,"MOTOR Ai. Ein Name, eine Mission: wir werden autonomes Fahren in Deutschland verfügbar machen. Mit der von uns entwickelten KI sind wir auf dem Weg, das erste zertifizierbare Level-4-Autonomiesystem Europas auf die Straße zu bringen. Seit 2017 arbeitet unser Team aus verschiedenen Bereichen Hand in Hand daran, dies zu bewerkstelligen. Die Zukunft der Mobilität lässt sich nicht aufhalten: unsere Mission ist es, diese Zukunft mitzugestalten. Aufgaben Du bist die treibende Kraft in der Abstimmung mit internen und externen Beteiligten. In Meetings mit unseren Partnern und Kunden trittst du als kompetenter Ansprechpartner auf und baust starke Brücken zwischen den Welten Du nimmst Systemvorschläge unter die Lupe. Mit deinem Gespür für IT-Architektur und IT-Sicherheit bewertest du Risiken frühzeitig und sorgst dafür, dass unsere Systeme stabil und zukunftssicher bleiben Schnittstellen sind für dich kein Fremdwort – du verstehst, wie moderne APIs funktionieren, und nutzt dieses Wissen, um technische Anforderungen im Team optimal zu übersetzen Du behältst den Überblick. Durch kontinuierliche Überwachung und smarte Fehleranalysen spürst du Schwachstellen auf und entwickelst proaktiv Strategien, um Risiken im Keim zu ersticken Gesetzliche Vorschriften und regulatorische Fragen schrecken dich nicht ab – du durchdringst sie und stellst sicher, dass unsere Projekte immer auf der sicheren Seite der Compliance stehen Vom ersten Konzept bis zum Go-Live: Du verantwortest das Anforderungsmanagement, strukturierst die Projektplanung und steuerst die Umsetzung zielgerichtet zum Erfolg Qualifikation Ein erfolgreich abgeschlossenes Studium im Bereich Informatik, Maschinenbau, Wirtschaftsingenieurwesen oder eine vergleichbare Qualifikation mit starkem technischem Bezug Mehrjährige (idealerweise ca. 5–7 Jahre) fundierte Erfahrung im Projektmanagement, in der du komplexe Vorhaben erfolgreich ins Ziel gesteuert hast Du bringst Erfahrung aus der Welt der Mobilität mit – sei es im Automotive-Sektor, der Luft- und Raumfahrt oder verwandten Tech-Branchen Grundlegendes Verständnis von funktionaler Sicherheit (ISO 26262) und Cybersicherheitstechnik (ISO/SAE 21434) sowie die Fähigkeit, sicherheitskritische Auswirkungen bereits in der Projektdefinitionsphase zu bewerten API-Integrationen, der Software-Development-Lifecycle (SDLC) und Systemanforderungen sind für dich keine Fremdwörter, sondern gelebte Praxis Du besitzt das nötige Fingerspitzengefühl und politisches Gespür, um auch in vielschichtigen Stakeholder-Strukturen souverän und erfolgreich zu agieren Du kommunizierst klar, transparent und findest auf jedem Parkett den richtigen Ton Es fällt dir leicht, die Interessen von MOTOR Ai nach außen hin stark und sympathisch zu repräsentieren Verhandlungssichere Deutsch- und Englischkenntnisse in Wort und Schrift Nice to have: Erfahrung mit öffentlich geförderten Projekten (Drittmittel/Fördermittel) Ein Background in der Programmierung oder Softwareentwicklung Einschlägige Zertifizierungen, die dein Profil abrunden (z. B. Scrum, ITIL, PMP) Benefits Bei uns gestaltest du aktiv die Zukunft der nachhaltigen Mobilität mit Du profitierst von regelmäßigem, leistungsbasiertem Feedback mit klaren Zielsetzungen, damit du dich persönlich, fachlich und gehaltstechnisch weiterentwickeln kannst Deine Weiterentwicklung liegt uns am Herzen – deshalb übernehmen wir die Kosten für Fort- und Weiterbildungen Wir unterstützen deine umweltfreundliche Mobilität mit einem Zuschuss zum Jobticket Teamgeist wird bei uns großgeschrieben – auf regelmäßigen Team- und Firmenevents feiern wir gemeinsame Erfolge Ein Unternehmen mit starkem Wachstum erfordert Einsatz (auch vor Ort), dennoch kannst du deine Arbeitszeiten an deine Bedürfnisse anpassen, auch hybrides Arbeiten – nach dem Onboarding kein Problem Dogfriendly Place - In unserem Büro ist dein Vierbeiner willkommen In unseren neuen Räumlichkeiten legen wir viel Wert darauf, uns alle kennenzulernen und gemeinsam die Vision voranzutreiben."
Arbeitnow API,https://www.arbeitnow.com/jobs/companies/lionflence/artist-manager-influencer-manager-mulheim-139980,2026-06-29T08:00:38,Lionflence,Artist Manager / Influencer Manager (m/w/d),Marketing and Communication,Mülheim,,Marketing and Communication,"Was wir Dir bieten: Eine spannende Herausforderung, in der du dich weiterentwickeln kannst, rundum den Bereich Artistmanagement Medien/Social Media, Influencer Marketing und den dazugehörigen Technologien (Software Systeme) Perfekt abgestimmte selbst entwickelte Softwaresysteme für dich als Artistmanager/in und für deine Artists Eine verantwortungsvolle Position in einem engagierten Team Eigenverantwortliches Arbeiten Freiraum zum aktiven Gestalten durch flache Hierarchien und flexible Strukturen Ein vielseitiges, anspruchsvolles und spannendes Aufgabengebiet mit renommierten Kunden So sieht Work-Life-Balance aus: 30 Tage Urlaub Konstruktives Feedback wird gerne gesehen Unsere Firmenkultur hat offene Türen &#x26; Ohren, coole Kolleg*innen und Spaß bei der Arbeit Ein hochmotiviertes, leistungsfähiges Team, welches gemeinsam arbeitet - aber auch gerne gemeinsame Erfolge feiert. Mitgestalten statt nur mitschwimmen - aktive Mitarbeit an fachlichen und kulturellen Themen die auch über den Tellerand hinausgehen Eine spannende Herausforderung, in der du dich weiterentwickeln kannst, rundum den Bereich Medien/Social Media, Influencer Marketing und den dazugehörigen Technologien (Software Systeme) Firmenhandy Firmenlaptop Aufgaben Welche Aufgaben hättest Du? Du bist erster Ansprechpartner für unsere internen Talente Du unterstützt bei der Suche nach neuen Kooperationspartnern, erstellst neue Angebote und bearbeitest eingehende Anfragen Du zeigst dein Verhandlungsgeschick bei Verträgen sowie bei Preisverhandlungen mit Anbietern und Dienstleistern (Kooperationspartnern) Du entwickelst zusammen mit den Talents Konzepte wie auch Content-Formate und unterstützt sie bei der Realisierung Du fungierst als Schnittstelle zwischen den Talents und unseren Partnern, planst ihren Einsatz und sorgst für ihr Wohlbefinden Du identifizierst und akquirierst mögliche neue Talente für bestehende und zukünftige Formate und Sendungen Gemeinsam helfen wir ihnen, zukunftsorientiert zu arbeiten und schaffen neue Möglichkeiten über das Artist dasein hinaus Qualifikation Das bringst Du mit: mind. 1-3 Jahre Erfahrung im Bereich Influencer Marketing, Online Marketing z.B. in einer Digital, Social Media oder PR-Agentur Interesse und Gespür für neueste Digital- &#x26; Konsumententrends Sicherer Umgang mit allen gängigen Social Media Netzwerken und Online-Communities Idealerweise bereits Erfahrung in der Umsetzung und/oder der Konzeption von Social Media und Influencer Marketing Kampagnen Hohe Kreativität und Motivation Fließende Deutschkenntnisse und Englischkenntnisse in Wort und Schrift Über uns: Die Lionflence ist ein junges Unternehmen, welches sich auf Online Marketing, sowie Management spezialisiert hat. Aktuell ist der Hauptsitz in Mülheim an der Ruhr und Berlin gehört seit August 2022 dazu. Zudem unterstützen wir Unternehmen im Bereich Markenaufbau und entwickeln eigene Softwaresysteme. Es erwartet Dich ein erfolgreiches Unternehmen mit flachen Hierarchien. Als Circle-of-Marketing bieten wir Kunden ein umfassendes 360°-Dienstleistungspaket und somit auch Services, die über die gewohnten Dienstleistungen einer Marketing-Agentur hinausgehen.Unser idealer Kandidat ist ein Teamplayer mit ausgeprägten Fähigkeiten im Bereich zwischenmenschlicher Kommunikation und verfügt über praktische Erfahrung.Du hast ein starkes Interesse Artists zu betreuen und möchtest ab sofort spannende Aufgaben in dem Bereich Artist Management übernehmen?Du organisierst leidenschaftlich gerne und bist ein aufgeschlossener Mensch? Dann könntest du perfekt zu uns passen! Find Jobs in Germany on Arbeitnow"
Arbeitnow API,https://www.arbeitnow.com/jobs/companies/lionflence/artist-manager-influencer-manager-berlin-228294,2026-06-29T08:00:38,Lionflence,Artist Manager / Influencer Manager (m/w/d) BERLIN,Marketing and Communication,Berlin,,Marketing and Communication,"Was wir Dir bieten: Eine spannende Herausforderung, in der du dich weiterentwickeln kannst, rundum den Bereich Artistmanagement Medien/Social Media, Influencer Marketing und den dazugehörigen Technologien (Software Systeme) Perfekt abgestimmte selbst entwickelte Softwaresysteme für dich als Artistmanager/in und für deine Artists Eine verantwortungsvolle Position in einem engagierten Team Eigenverantwortliches Arbeiten Freiraum zum aktiven Gestalten durch flache Hierarchien und flexible Strukturen Ein vielseitiges, anspruchsvolles und spannendes Aufgabengebiet mit renommierten Kunden So sieht Work-Life-Balance aus: 30 Tage Urlaub Konstruktives Feedback wird gerne gesehen Unsere Firmenkultur hat offene Türen &#x26; Ohren, coole Kolleg*innen und Spaß bei der Arbeit Ein hochmotiviertes, leistungsfähiges Team, welches gemeinsam arbeitet - aber auch gerne gemeinsame Erfolge feiert. Mitgestalten statt nur mitschwimmen - aktive Mitarbeit an fachlichen und kulturellen Themen die auch über den Tellerand hinausgehen Eine spannende Herausforderung, in der du dich weiterentwickeln kannst, rundum den Bereich Medien/Social Media, Influencer Marketing und den dazugehörigen Technologien (Software Systeme) Firmenhandy Firmenlaptop Du arbeitest mit den neusten System, die Inhouse entwickelt wurden. Dazu gehören z.b Hiimia und unser eigenes Management System Aufgaben Welche Aufgaben hättest Du? Du bist erster Ansprechpartner für unsere internen Talente Du unterstützt bei der Suche nach neuen Kooperationspartnern, erstellst neue Angebote und bearbeitest eingehende Anfragen Du zeigst dein Verhandlungsgeschick bei Verträgen sowie bei Preisverhandlungen mit Anbietern und Dienstleistern (Kooperationspartnern) Du entwickelst zusammen mit den Talents Konzepte wie auch Content-Formate und unterstützt sie bei der Realisierung Du fungierst als Schnittstelle zwischen den Talents und unseren Partnern, planst ihren Einsatz und sorgst für ihr Wohlbefinden Du identifizierst und akquirierst mögliche neue Talente für bestehende und zukünftige Formate und Sendungen Gemeinsam helfen wir ihnen, zukunftsorientiert zu arbeiten und schaffen neue Möglichkeiten über das Artist dasein hinaus Qualifikation Das bringst Du mit: mind. 1-3 Jahre Erfahrung im Bereich Influencer Marketing, Online Marketing z.B. in einer Digital, Social Media oder PR-Agentur Interesse und Gespür für neueste Digital- &#x26; Konsumententrends Sicherer Umgang mit allen gängigen Social Media Netzwerken und Online-Communities Idealerweise bereits Erfahrung in der Umsetzung und/oder der Konzeption von Social Media und Influencer Marketing Kampagnen Hohe Kreativität und Motivation Fließende Deutschkenntnisse und Englischkenntnisse in Wort und Schrift Über uns: Die Lionflence ist ein Unternehmen, welches sich auf Online Marketing, sowie Management spezialisiert hat. Aktuell ist der Hauptsitz in Mülheim an der Ruhr und wir sind auch in Berlin Spandau vertreten. (Eiswerderinsel) Zudem unterstützen wir Unternehmen im Bereich Markenaufbau und entwickeln eigene Softwaresysteme. Es erwartet Dich ein erfolgreiches Unternehmen mit flachen Hierarchien. Als Circle-of-Marketing bieten wir Kunden ein umfassendes 360°-Dienstleistungspaket und somit auch Services, die über die gewohnten Dienstleistungen einer Marketing-Agentur hinausgehen.Unser idealer Kandidat ist ein Teamplayer mit ausgeprägten Fähigkeiten im Bereich zwischenmenschlicher Kommunikation und verfügt über praktische Erfahrung.Du hast ein starkes Interesse Artists zu betreuen und möchtest ab sofort spannende Aufgaben in dem Bereich Artist Management übernehmen?Du organisierst leidenschaftlich gerne und bist ein aufgeschlossener Mensch? Dann könntest du perfekt zu uns passen! Find more English Speaking Jobs in Germany on Arbeitnow"
Arbeitnow API,https://www.arbeitnow.com/jobs/companies/lionflence/junior-artist-manager-influencer-manager-berlin-486540,2026-06-29T08:00:38,Lionflence,Junior Artist Manager / Influencer Manager (m/w/d),Marketing and Communication,Berlin,,Marketing and Communication,"Was wir Dir bieten: Eine spannende Herausforderung, in der du dich weiterentwickeln kannst, rundum den Bereich Artistmanagement Medien/Social Media, Influencer Marketing und den dazugehörigen Technologien (Software Systeme) Perfekt abgestimmte selbst entwickelte Softwaresysteme für dich als Artistmanager/in und für deine Artists Eine verantwortungsvolle Position in einem engagierten Team Eigenverantwortliches Arbeiten Freiraum zum aktiven Gestalten durch flache Hierarchien und flexible Strukturen Ein vielseitiges, anspruchsvolles und spannendes Aufgabengebiet mit renommierten Kunden So sieht Work-Life-Balance aus: 30 Tage Urlaub Konstruktives Feedback wird gerne gesehen Unsere Firmenkultur hat offene Türen &#x26; Ohren, coole Kolleg*innen und Spaß bei der Arbeit Ein hochmotiviertes, leistungsfähiges Team, welches gemeinsam arbeitet - aber auch gerne gemeinsame Erfolge feiert. Mitgestalten statt nur mitschwimmen - aktive Mitarbeit an fachlichen und kulturellen Themen die auch über den Tellerand hinausgehen Eine spannende Herausforderung, in der du dich weiterentwickeln kannst, rundum den Bereich Medien/Social Media, Influencer Marketing und den dazugehörigen Technologien (Software Systeme) Firmenhandy Firmenlaptop Aufgaben Welche Aufgaben hättest Du? Du unterstützt bei der Absprache unserer internen Talente Du unterstützt bei der Suche nach neuen Kooperationspartnern, erstellst neue Angebote und bearbeitest eingehende Anfragen Du arbeitest an deinem Verhandlungsgeschick bei Verträgen sowie bei Preisverhandlungen mit Anbietern und Dienstleistern (Kooperationspartnern) Du unterstützt die Artistmanager zu Konzepte wie auch Content-Formate für Talents und hilfst dabei diese zu realisieren Du fungierst als Schnittstelle zwischen den Talents und unseren Partnern, planst ihren Einsatz und sorgst für ihr Wohlbefinden Du identifizierst und akquirierst mögliche neue Kooperationspartnern und zukünftige Formate und Sendungen Qualifikation Das bringst Du mit: mind. 1 Jahr Erfahrung im Bereich Influencer Marketing, Online Marketing z.B. in einer Digital, Social Media oder PR-Agentur Interesse und Gespür für neueste Digital- &#x26; Konsumententrends Sicherer Umgang mit allen gängigen Social Media Netzwerken und Online-Communities Idealerweise bereits Erfahrung in der Umsetzung und/oder der Konzeption von Social Media und Influencer Marketing Kampagnen Hohe Kreativität und Motivation Fließende Deutschkenntnisse und Englischkenntnisse in Wort und Schrift Über uns: Die Lionflence ist ein junges Unternehmen, welches sich auf Online Marketing, sowie Management spezialisiert hat. Aktuell ist der Hauptsitz in Mülheim an der Ruhr und Berlin gehört seit August 2022 dazu. Zudem unterstützen wir Unternehmen im Bereich Markenaufbau und entwickeln eigene Softwaresysteme. Es erwartet Dich ein erfolgreiches Unternehmen mit flachen Hierarchien. Als Circle-of-Marketing bieten wir Kunden ein umfassendes 360°-Dienstleistungspaket und somit auch Services, die über die gewohnten Dienstleistungen einer Marketing-Agentur hinausgehen.Unser idealer Kandidat ist ein Teamplayer mit ausgeprägten Fähigkeiten im Bereich zwischenmenschlicher Kommunikation und verfügt über praktische Erfahrung.Du hast ein starkes Interesse Artists zu betreuen und möchtest ab sofort spannende Aufgaben in dem Bereich Artist Management übernehmen?Du organisierst leidenschaftlich gerne und bist ein aufgeschlossener Mensch? Dann könntest du perfekt zu uns passen! Find more English Speaking Jobs in Germany on Arbeitnow"
Arbeitnow API,https://www.arbeitnow.com/jobs/companies/lionflence/junior-artist-manager-influencer-manager-mulheim-409127,2026-06-29T08:00:38,Lionflence,Junior Artist Manager / Influencer Manager (m/w/d),Marketing and Communication,Mülheim,,Marketing and Communication,"Was wir Dir bieten: Eine spannende Herausforderung, in der du dich weiterentwickeln kannst, rundum den Bereich Artistmanagement Medien/Social Media, Influencer Marketing und den dazugehörigen Technologien (Software Systeme) Perfekt abgestimmte selbst entwickelte Softwaresysteme für dich als Artistmanager/in und für deine Artists Eine verantwortungsvolle Position in einem engagierten Team Eigenverantwortliches Arbeiten Freiraum zum aktiven Gestalten durch flache Hierarchien und flexible Strukturen Ein vielseitiges, anspruchsvolles und spannendes Aufgabengebiet mit renommierten Kunden So sieht Work-Life-Balance aus: 30 Tage Urlaub Konstruktives Feedback wird gerne gesehen Unsere Firmenkultur hat offene Türen &#x26; Ohren, coole Kolleg*innen und Spaß bei der Arbeit Ein hochmotiviertes, leistungsfähiges Team, welches gemeinsam arbeitet - aber auch gerne gemeinsame Erfolge feiert. Mitgestalten statt nur mitschwimmen - aktive Mitarbeit an fachlichen und kulturellen Themen die auch über den Tellerand hinausgehen Eine spannende Herausforderung, in der du dich weiterentwickeln kannst, rundum den Bereich Medien/Social Media, Influencer Marketing und den dazugehörigen Technologien (Software Systeme) Firmenhandy Firmenlaptop Aufgaben Welche Aufgaben hättest Du? Du unterstützt bei der Absprache unserer internen Talente Du unterstützt bei der Suche nach neuen Kooperationspartnern, erstellst neue Angebote und bearbeitest eingehende Anfragen Du arbeitest an deinem Verhandlungsgeschick bei Verträgen sowie bei Preisverhandlungen mit Anbietern und Dienstleistern (Kooperationspartnern) Du unterstützt die Artistmanager zu Konzepte wie auch Content-Formate für Talents und hilfst dabei diese zu realisieren Du fungierst als Schnittstelle zwischen den Talents und unseren Partnern, planst ihren Einsatz und sorgst für ihr Wohlbefinden Du identifizierst und akquirierst mögliche neue Kooperationspartnern und zukünftige Formate und Sendungen Qualifikation Das bringst Du mit: mind. 1 Jahr Erfahrung im Bereich Influencer Marketing, Online Marketing z.B. in einer Digital, Social Media oder PR-Agentur Interesse und Gespür für neueste Digital- &#x26; Konsumententrends Sicherer Umgang mit allen gängigen Social Media Netzwerken und Online-Communities Idealerweise bereits Erfahrung in der Umsetzung und/oder der Konzeption von Social Media und Influencer Marketing Kampagnen Hohe Kreativität und Motivation Fließende Deutschkenntnisse und Englischkenntnisse in Wort und Schrift Über uns: Die Lionflence ist ein junges Unternehmen, welches sich auf Online Marketing, sowie Management spezialisiert hat. Aktuell ist der Hauptsitz in Mülheim an der Ruhr und Berlin gehört seit August 2022 dazu. Zudem unterstützen wir Unternehmen im Bereich Markenaufbau und entwickeln eigene Softwaresysteme. Es erwartet Dich ein erfolgreiches Unternehmen mit flachen Hierarchien. Als Circle-of-Marketing bieten wir Kunden ein umfassendes 360°-Dienstleistungspaket und somit auch Services, die über die gewohnten Dienstleistungen einer Marketing-Agentur hinausgehen.Unser idealer Kandidat ist ein Teamplayer mit ausgeprägten Fähigkeiten im Bereich zwischenmenschlicher Kommunikation und verfügt über praktische Erfahrung.Du hast ein starkes Interesse Artists zu betreuen und möchtest ab sofort spannende Aufgaben in dem Bereich Artist Management übernehmen?Du organisierst leidenschaftlich gerne und bist ein aufgeschlossener Mensch? Dann könntest du perfekt zu uns passen! Find Jobs in Germany on Arbeitnow"
