source,source_url,date_posted,company,title,category,location,job_type,tags_raw,description
Arbeitnow API,https://www.arbeitnow.com/jobs/companies/angeheuert-gmbh-personalberatung/embedded-software-engineer-nuremberg-290010,2026-07-09T16:00:43,ANGEHEUERT GmbH Personalberatung,Embedded Software Engineer (m/f/d),Remote,Nuremberg,,Remote; IT,"Help develop the embedded software behind one of the world's first scalable road power plants. Our client is a fast growing GreenTech startup based in Mils, Austria, developing one of the world's first scalable road power plants. By transforming existing road infrastructure into a new source of renewable energy , the team is creating a completely new way of generating clean electricity without additional land use. As an Embedded Software Engineer , you will develop the embedded software that controls this groundbreaking technology and helps bring it from prototype to international deployment. Working closely with electrical, mechanical, hydraulic and physics engineers , you will build intelligent control systems, integrate hardware and software, and help shape the future of clean energy infrastructure . If you enjoy taking ownership, solving complex engineering challenges and building products with real world impact, this is your opportunity to leave your mark. Tasks As an Embedded Software Engineer , you will develop the embedded software that powers the next generation of the Road Power Plant and helps prepare the technology for international deployment. Embedded Software Development: Design and develop embedded software for the Road Power Plant and future energy harvesting systems. Firmware Engineering: Implement robust firmware and real time control algorithms for embedded controllers. Simulation &#x26; Validation: Develop and maintain MATLAB/Simulink models for system simulation, validation and optimization. Hardware Integration: Integrate sensors, actuators and communication interfaces into the overall electrical system architecture. Testing &#x26; Debugging: Perform Software in the Loop (SIL), Hardware in the Loop (HIL), laboratory and field testing to validate system performance. Data Infrastructure: Develop and maintain cloud based data storage solutions and databases for pilot installations and operational analysis. Cross Functional Engineering: Collaborate closely with electrical, mechanical, hydraulic and physics teams to create reliable integrated system solutions. Prototype &#x26; Scale Up: Support prototype development and contribute to the transition from prototype to serial production. Continuous Improvement: Optimize software architecture, reliability and overall system performance for future product generations. International Field Projects: Support pilot installations and field testing in Europe and internationally whenever required. Requirements Degree in Electrical Engineering, Electronics, Embedded Systems or a related field. Several years of professional experience in embedded software development using C/C++ or comparable programming languages. Experience working with microcontrollers such as STM32, ARM Cortex M or similar platforms. Experience with MATLAB/Simulink , electrical system simulation and embedded control systems. Knowledge of communication protocols such as CAN, SPI, UART, I2C or Ethernet . Experience with debugging, testing and hardware software integration. Strong ownership mentality with the ability to work independently in a fast paced startup environment. Excellent communication skills in English. German is considered an advantage. Ideally, you also bring experience with Python, Hardware in the Loop testing, Git, renewable energy systems, power electronics or startup environments. Benefits Technology &#x26; Innovation: Develop the embedded software behind one of the world’s first Road Power Plants and contribute to a groundbreaking ClimateTech innovation with global potential. Ownership: Take responsibility for embedded software development, from real time control algorithms and firmware to testing, validation and production readiness. Career Growth: Grow together with a fast growing GreenTech startup and expand your technical responsibilities as the company continues to scale. Interdisciplinary Engineering: Work closely with electrical, mechanical, hydraulic engineers and physicists t"
Arbeitnow API,https://www.arbeitnow.com/jobs/companies/fc-viktoria-1889-berlin-frauen-fussball-gmbh/werkstudentin-communication-community-berlin-290902,2026-07-09T16:00:43,FC Viktoria 1889 Berlin Frauen-Fußball GmbH,Werkstudent*in // Communication & Community,Marketing and Communication,Berlin,Working student,Marketing and Communication,"📍 Berlin ⏱ ca. 15–20 Stunden pro Woche 💶 14,50 € brutto/Stunde 🗓 Start: ab sofort Du liebst es, wenn hinter den Kulissen alles läuft – und auf dem Platz die Energie explodiert? Du willst nicht nur zuschauen, sondern mitgestalten, mitorganisieren und mitschreiben – an einer Geschichte, die den Frauenfußball in Deutschland verändert? Hi! Wir sind FC Viktoria Berlin. ⚽️ Seit der Saison 2025/26 spielen wir in der 2. Bundesliga – und wir sind hier, um mehr zu sein als ein Fußballclub. Gemeinsam mit unserem internationalen Partner Monarch Collective bauen wir etwas auf, das weit über den Platz hinausgeht: eine Community, eine Bewegung, eine neue Art, Frauenfußball zu denken. Modern. Mutig. Inklusiv. Aufgaben Dein Schwerpunkt: Aktivierungen rund um Matchday, Partner &#x26; Community Unterstützung bei der Planung und Umsetzung von Aktivierungen an Spieltagen und Events Logistik &#x26; Materialorganisation – vom Aufbau bis zum Abbau, Branding, Give-aways &#x26; Co. Gästelistenpflege, Einladungsmanagement und Kommunikation mit Partnerinnen und Gästen Onsite-Support an Spieltagen – du bist Ansprechperson für Partner &#x26; Community Erstellung von Checklisten &#x26; Ablaufplänen Nachbereitung: kurze Reportings, Learnings, Fotodokumentation Dein zweiter Fokus: Community &#x26; Inbox Management Beantworten von Nachrichten über Social Media, E-Mail &#x26; weitere Kanäle (z. B. Ticket-Anfragen, Fan-Fragen) Weiterleitung von Anfragen an die richtigen Ansprechpersonen im Club Unterstützung beim Aufbau und der Pflege unserer Fan- und Partnerkontakte Unterstützend: Recherche, Social Listening &#x26; Datenpflege Beobachtung relevanter Social-Media-Kanäle, Trends und Best Practices im (Frauen-)Fußball, Sport &#x26; Entertainment Recherche zu Partnern, Initiativen, Projekten und Community-Formaten Einholen von Fan-Insights (z. B. über Kommentare, Umfragen, Feedback) Pflege von Übersichten, Listen und Datenbanken (z. B. Kontakte, Partner-Aktivierungen, Event-Checklisten) Strukturierte Ablage von Materialien, Reports und Learnings Ergänzend: Unterstützung in der Leadership-Kommunikation Mitwirkung an Social-Media-Posts und Auftritten zentraler Personen (z. B. Entwürfe, Timing) Unterstützung bei der Vor- und Nachbereitung ausgewählter Termine &#x26; Auftritte Pflege eines einfachen Content- und Termin-Überblicks für zentrale Kommunikationsformate Enge Abstimmung mit dem Kommunikations- &#x26; Community-Team Qualifikation Du bist an einer Hochschule immatrikuliert – Fach ist nicht entscheidend, Haltung schon (z. B. Kommunikations-, Medien-, Sport-, Wirtschafts- oder Sozialwissenschaften) Du hast Organisationstalent und Freude daran, Dinge von A bis Z strukturiert umzusetzen Du bringst Social-Media-Kompetenz mit – erste praktische Erfahrung mit Instagram, TikTok oder LinkedIn ist ein Plus Du hast ein redaktionelles Grundverständnis: Sprache ist dir wichtig, du kannst Inhalte zielgruppengerecht formulieren Du bist offen, kommunikativ und hast echte Lust auf Menschen – von Fans über Partnerinnen bis hin zu Team und Staff Du hast Spaß an Live-Situationen: Matchdays, Events, Aktivierungen – auch mal abends oder am Wochenende Du gehst vertraulich mit Informationen um und arbeitest sehr gewissenhaft Themen wie Personal Branding und Leadership-Kommunikation im Sport interessieren dich Sehr gute Deutschkenntnisse in Wort und Schrift, gute Englischkenntnisse sind ein Plus Benefits Einen echten Einblick in den Betrieb eines ambitionierten 2.-Bundesliga-Clubs Verantwortung von Tag eins – kein Kaffeekochen, sondern echte Mitgestaltung Ein diverses, motiviertes Team mit Haltung, Energie und Humor Zugang zu Heimspielen, Events und einem starken Netzwerk aus Sport, Medien &#x26; Kultur Flexible Arbeitszeiten rund um dein Studium Ein Umfeld, das Frauenfußball nicht nur begleitet – sondern aktiv verändert Bereit, das Spiel zu verändern? Dann schick uns deinen Lebenslauf und ein kurzes Motivationsschreiben – auch wenn du nicht jedes Kriterium erfüllst. Wir freuen uns "
Arbeitnow API,https://www.arbeitnow.com/jobs/companies/pertemps-erp/freelance-sap-mako-cloud-consultants-100-remote-europa-weit-frankfurt-am-main-410763,2026-07-09T16:00:43,Pertemps ERP,Freelance SAP MaKo Cloud Consultants (m/w/d) | 100% Remote | Europa-weit,Remote,Frankfurt am Main,"Freelance, berufserfahren",Remote; SAP/ERP Consulting; Development,"Du bist im SAP Utilities Umfeld unterwegs und hast Erfahrung mit Marktkommunikation (MaKo Cloud) ? Dann könnte dieses Projekt interessant für dich sein. Gesucht werden SAP MaKo Cloud Consultants auf Freelance-Basis – vom erfahrenen Consultant bis zum Solution Architect. Voraussetzung sind mindestens 2 Jahre praktische Erfahrung im SAP Utilities Umfeld. Aufgaben Beratung und Umsetzung von Projekten im Bereich SAP Marktkommunikation (MaKo Cloud) Analyse und Optimierung energiewirtschaftlicher Prozesse Mitarbeit bei S/4HANA-Transformationen und SAP Utilities Projekten Konzeption und Integration von Schnittstellen sowie Unterstützung bei regulatorischen Anforderungen Zusammenarbeit mit Kunden und Projektteams bei technischen und fachlichen Fragestellungen Qualifikation SAP MaKo Cloud GPKE, WiM oder weiteren Marktkommunikationsprozessen SAP IS-U / Utilities SAP S/4HANA Utilities Integration, Schnittstellen und Prozessdesign SAP BTP oder Cloud-Technologien sind von Vorteil Benefits Freelance-Projekte 100 % Remote Einsatz innerhalb Europas möglich Projekte in einem spezialisierten SAP Utilities Umfeld Einstieg ab ca. 2 Jahren relevanter Berufserfahrung Wenn du aktuell verfügbar bist oder in den nächsten Monaten ein neues Projekt suchst, freue ich mich über deine Nachricht. Find more English Speaking Jobs in Germany on Arbeitnow"
Arbeitnow API,https://www.arbeitnow.com/jobs/companies/nfon/voice-ai-engineer-all-genders-bremen-437202,2026-07-09T16:00:42,NFON,Voice AI Engineer (all genders),IT,Bremen,berufserfahren,IT,"Dein neuer Job Du baust Stimmen. Nicht konfigurieren, nicht API anbinden – wirklich bauen. Bei botario entwickelst du die Text-To-Speech- und Speech-To-Text-Systeme hinter unseren Voice Agents: Stimmen, die natürlich klingen, in Echtzeit antworten und auch dann verstehen, wenn es am anderen Ende nuschelt. Woran du mitwirken wirst Du baust und verbesserst unsere eigenen TTS und STT-Systeme – vom Modell bis zur Streaming-Inferenz Du optimierst auf niedrige Latenz: Time-to-First-Audio, Streaming-Synthese, effizientes Serving – jede Millisekunde zählt Du arbeitest an Stimmqualität und Natürlichkeit: Prosodie, Betonung, Robustheit bei echten Audiobedingungen Du evaluierst neue Open-Source-Speech-Modelle und bringst die besten Ansätze in unseren Stack Du misst, was du baust: Latenz-Profiling, Qualitäts-Benchmarks, Hörtests Die Qualifikationen, die Du brauchst Du hast praktische Erfahrung mit Sprachtechnologie: TTS, STT, Echtzeit-Audio oder Speech-Modell-Inferenz Begriffe wie Audio-Codec oder Speech Tokenizer sind keine Fremdsprache für dich – oder du bringst einen soliden Torch/ML Background mit und willst genau hier tiefer einsteigen: Dann melde dich trotzdem! Du hast sehr gute Programmierkenntnisse in Python und hast keine Angst, dich auch mit dir fremden Themen auseinander zu setzen Du weißt, warum ein paar hundert Millisekunden Latenz ein Gespräch ruinieren können – und hast Ideen, wie man sie wegoptimiert Wünschenswert: Erfahrung mit dem kommerziellen Einsatz von Speech-Modellen Du arbeitest gerne im Team und mit agilen Methoden Was wir Dir bieten können Als innovatives Unternehmen mit klarer Vision tragen wir aktiv zur Digitalisierung und Transformation der Kommunikationslandschaft bei, indem wir neue Ideen und kreative Lösungsansätze entwickeln und uns von alten Strukturen lösen Kurze Entscheidungswege, die Möglichkeit, sich einzubringen, Dinge zu verändern und neue Technologien einzusetzen Weitläufiges Office am Europahafen: Arbeitsplatz mit Wasserblick! Firmen-Fitness, BusinessBike und ein eigenes Firmenboot Kostenübernahme für E-Learning-Kurse nach Wunsch Regelmäßiger Austausch: Wir besuchen und organisieren interne und öffentliche (KI-)Events Spannende, internationale Kunden aus verschiedensten Branchen Faires, angemessenes Gehalt und Mitarbeiterbeteiligung 30 Tage Urlaub und Möglichkeit zur Teilzeit Top-Hardware, höhenverstellbare Tische und mehrere Monitore an jedem Arbeitsplatz Wir unterstützen die Vereinbarkeit von Beruf, Familie und Privatleben und sind ""Ausgezeichnet Familienfreundlich"" Find Jobs in Germany on Arbeitnow"
Arbeitnow API,https://www.arbeitnow.com/jobs/companies/nfon/voice-ai-engineer-all-genders-bremen-271406,2026-07-09T16:00:42,NFON,Voice AI Engineer (all genders),IT,Bremen,professional / experienced,IT,"Your new role Build voices that power real conversations. At botario, you'll develop the text-to-speech and speech-to-text systems behind our AI Voice Agents—from the underlying models to low-latency, production-ready deployment. You'll help create voice experiences that sound natural, respond in real time, and perform reliably even in challenging real-world conditions. The work you‘ll do Develop and continuously improve our proprietary text-to-speech (TTS) and speech-to-text (STT) systems, from model development to real-time streaming inference. Optimize latency across the entire voice pipeline, including time-to-first-audio, streaming synthesis, and efficient model serving—because every millisecond matters. Improve voice quality and naturalness by working on prosody, pronunciation, and robustness under real-world audio conditions. Evaluate the latest open-source speech models and integrate the most promising approaches into our technology stack. Measure and validate your work through latency profiling, quality benchmarks, and listening tests. Collaborate closely with engineers and cross-functional teams in an agile environment. The qualifications you need Hands-on experience with speech technologies such as text-to-speech (TTS), speech-to-text (STT), real-time audio processing, or speech model inference. Familiarity with concepts such as audio codecs and speech tokenizers—or a strong machine learning and PyTorch background with the motivation to specialize in speech AI. Strong Python programming skills and the curiosity to explore unfamiliar technical challenges. A solid understanding of why low latency is critical for natural conversations and experience optimizing real-time systems. Ideally, experience deploying speech AI models in commercial production environments. A collaborative mindset and experience working in agile teams. What we can offer you The opportunity to shape the future of AI-powered communication in an innovative company with a clear vision. Flat hierarchies, short decision-making paths, and the freedom to contribute ideas and work with the latest technologies. A modern office at Bremen's Europahafen with waterfront views. Company fitness, BusinessBike, and access to our company boat. Funding for the e-learning courses of your choice to support your professional development. Regular knowledge sharing through internal meetups and participation in AI and technology events. Exciting international customers across a wide range of industries. A competitive salary and employee participation program. 30 days of annual leave and flexible part-time options. High-end hardware, height-adjustable desks, and multi-monitor workstations. A family-friendly culture that supports work-life integration and has been officially recognized as a family-friendly employer. Find more English Speaking Jobs in Germany on Arbeitnow"
Arbeitnow API,https://www.arbeitnow.com/jobs/companies/nfon/researcher-applied-ai-all-genders-bremen-253020,2026-07-09T16:00:42,NFON,Researcher Applied AI (all genders),IT,Bremen,berufserfahren,IT,"Dein neuer Job Zwischen Paper und Produkt liegt der spannendste Teil. Bei botario nimmst du die neuesten Ideen aus der AI-Forschung – Speech, LLMs, multimodale Modelle – und findest heraus, was davon wirklich trägt: reproduzieren, verstehen, erweitern und in produktionsreife Systeme überführen. Woran du mitwirken wirst Du verfolgst die Research- und Open-Source-Landschaft systematisch und identifizierst die Ansätze, die für uns relevant sind Du reproduzierst vielversprechende Paper und Modelle und validierst, ob die Ergebnisse halten, was sie versprechen Du designst und fährst eigene Experimente: Ablations, Benchmarks, saubere Evaluationen Du erweiterst bestehende Ansätze mit eigenen Ideen – insbesondere im Bereich Text-To-Speech und Speech-To-Text Du überführst deine Ergebnisse gemeinsam mit dem Team in produktive Systeme Die Qualifikationen, die Du brauchst Du hast einen starken ML-Background (z. B. aus Studium, Promotion oder Praxis) und sehr gute PyTorch-Kenntnisse Du liest Paper nicht nur, sondern implementierst sie – und merkst schnell, wo die Lücken zwischen Paper und Realität liegen Du arbeitest experimentell sauber: reproduzierbare Setups, faire Vergleiche, ehrliche Ergebnisse Du hast sehr gute Programmierkenntnisse in Python und hast keine Angst, dich auch mit dir fremden Themen auseinanderzusetzen Wünschenswert: eigene Projekte, Publikationen oder Open-Source-Beiträge im ML-Bereich – Speech-Erfahrung ist ein Plus, keine Voraussetzung Du arbeitest gerne im Team und mit agilen Methoden Was wir Dir bieten können Als innovatives Unternehmen mit klarer Vision tragen wir aktiv zur Digitalisierung und Transformation der Kommunikationslandschaft bei, indem wir neue Ideen und kreative Lösungsansätze entwickeln und uns von alten Strukturen lösen Kurze Entscheidungswege, die Möglichkeit, sich einzubringen, Dinge zu verändern und neue Technologien einzusetzen Weitläufiges Office am Europahafen: Arbeitsplatz mit Wasserblick! Firmen-Fitness, BusinessBike und ein eigenes Firmenboot Kostenübernahme für E-Learning-Kurse nach Wunsch Regelmäßiger Austausch: Wir besuchen und organisieren interne und öffentliche (KI-)Events Spannende, internationale Kunden aus verschiedensten Branchen Faires, angemessenes Gehalt und Mitarbeiterbeteiligung 30 Tage Urlaub und Möglichkeit zur Teilzeit Top-Hardware, höhenverstellbare Tische und mehrere Monitore an jedem Arbeitsplatz Selbstverständlich: Bio-Obst/Gemüse, Smoothie-Bar, Eis-Flatrate, Thermomix und Reiskocher sowie Getränke (guter Kaffee, Mate etc.) Wir unterstützen die Vereinbarkeit von Beruf, Familie und Privatleben und sind ""Ausgezeichnet Familienfreundlich"" Find Jobs in Germany on Arbeitnow"
Arbeitnow API,https://www.arbeitnow.com/jobs/companies/nfon/researcher-applied-ai-all-genders-bremen-248010,2026-07-09T16:00:42,NFON,Researcher Applied AI (all genders),IT,Bremen,professional / experienced,IT,"Your new role Turn cutting-edge AI research into real-world products. At botario, you'll explore the latest advances in speech AI, large language models, and multimodal AI, identifying the ideas that create real value. From reproducing research to extending it and bringing it into production, you'll help shape the next generation of our AI Agents. The work you‘ll do Continuously monitor AI research and the open-source ecosystem to identify technologies with real product potential. Reproduce promising research papers and models, validating results and assessing their practical applicability. Design and run rigorous experiments, including ablation studies, benchmarking, and systematic evaluations. Extend existing approaches with your own ideas, particularly in the areas of text-to-speech (TTS) and speech-to-text (STT). Collaborate closely with engineering teams to transform research outcomes into production-ready AI systems. Share insights and contribute to a culture of continuous learning and innovation. The qualifications you need A strong background in machine learning gained through industry experience, academic research, or a PhD, combined with solid hands-on expertise in PyTorch. Experience implementing and reproducing research papers, with the ability to identify the gap between published results and real-world applications. A structured, scientific approach to experimentation, with a focus on reproducibility, fair comparisons, and reliable evaluation. Strong Python programming skills and the curiosity to explore unfamiliar technical challenges. Ideally, personal machine learning projects, publications, or open-source contributions. Experience in speech AI is a plus, but not a requirement. A collaborative mindset and experience working in agile teams. What we can offer you The opportunity to shape the future of AI-powered communication in an innovative company with a clear vision. Flat hierarchies, short decision-making paths, and the freedom to contribute ideas and work with the latest technologies. A modern office at Bremen's Europahafen with waterfront views. Company fitness, BusinessBike, and access to our company boat. Funding for the e-learning courses of your choice to support your professional development. Regular knowledge sharing through internal meetups and participation in AI and technology events. Exciting international customers across a wide range of industries. A competitive salary and employee participation program. 30 days of annual leave and flexible part-time options. High-end hardware, height-adjustable desks, and multi-monitor workstations. Fresh organic fruit and vegetables, smoothie bar, unlimited ice cream, Thermomix, rice cooker, and a wide selection of drinks including great coffee and mate. A family-friendly culture that supports work-life integration and has been officially recognized as a family-friendly employer. Find more English Speaking Jobs in Germany on Arbeitnow"
