job_id,date_posted,source,company,title,category,raw_category,seniority,location,job_type,skills,tags_raw,salary_min_usd,salary_max_usd,salary_mid_usd,demand_index,scarcity_score,time_to_fill_days_proxy,application_volume_proxy,source_url,description_preview
raw-0083,2026-06-04,Arbeitnow API,FiPP e.V. Fortbildungsinstitut für pädagogische Praxis,Personalreferent (m/w/d),Product & Project Management,Personnel Specialist,Mid-level,Berlin,berufserfahren,HR,Personnel Specialist,62320,89680,76000,68.1,38,30.3,136,https://www.arbeitnow.com/jobs/companies/fipp-ev-fortbildungsinstitut-fur-padagogische-praxis/personalreferent-berlin-249101,"Du bist eine engagierte Persönlichkeit mit Erfahrung im Personalwesen und suchst eine verantwortungsvolle Aufgabe? Du arbeitest strukturiert, kommunikationsstark, mit Herz und möchtest Deine Fähigkeiten in einem sinnstif"
raw-0084,2026-06-04,Arbeitnow API,DONE!Financials GmbH,Steuerfachangestellte (m/w/d),Software & Engineering,Remote,Mid-level,Berlin,berufserfahren,Finance,Remote; Finance,72160,103840,88000,71.9,38,30.3,136,https://www.arbeitnow.com/jobs/companies/donefinancials-gmbh/steuerfachangestellte-berlin-171907,"Schön, dass Du hier bist! Werde Teil unserer Mission: Buchhaltung besser, verständlicher und greifbarer machen. Wie oft wird über das komplizierte Steuersystem und die deutsche Bürokratie gejammert? Wir bei DONE!Financia"
raw-0085,2026-06-04,Arbeitnow API,Sirius Facilities GmbH,Digital Marketing Specialist (everyone is welcome) - Berlin,Marketing & Growth,Marketing and Communication,Mid-level,Berlin,berufserfahren,Communication,Marketing and Communication,49200,70800,60000,100,38,30.3,136,https://www.arbeitnow.com/jobs/companies/sirius-facilities-gmbh/digital-marketing-specialist-everyone-is-welcome-berlin-137385,"Deine Aufgaben Digital Listings Management Steuerung und Optimierung aller Online-Inserate für unsere Gewerbeflächen Sicherstellung von Datenqualität, Aktualität und Vollständigkeit aller Listings Koordination von Neuers"
raw-0086,2026-06-04,Arbeitnow API,Sphere,Lead Data/Cloud Architect,Data & AI,Data Scientist,Senior/Lead,Munich,,Data Analytics; Data Science; Design; Cloud; CI/CD; AWS; AI,Data Scientist,94095,135405,114750,72.5,69,47.7,95,https://www.arbeitnow.com/jobs/companies/sphere/lead-data-cloud-architect-munich-219606,"Sphere Energy is a dynamic and forward-thinking technology company, committed to developing AI-driven solutions that revolutionize product development processes, with a special focus on the automotive sector. We combine "
raw-0087,2026-06-04,Arbeitnow API,VLD Trade GmbH,E-Commerce Manager mit technischem Verständnis (m/w/d),Software & Engineering,Marketing and Communication,Senior/Lead,Bramsche,,Communication; JavaScript; Excel; SQL; ERP,Marketing and Communication,97416,140184,118800,75.2,48,38.6,123,https://www.arbeitnow.com/jobs/companies/vld-trade-gmbh/e-commerce-manager-mit-technischem-verstandnis-bramsche-178964,"Du möchtest Online Shops nicht nur betreuen, sondern aktiv weiterentwickeln? Du denkst kaufmännisch, arbeitest strukturiert und hast ein gutes Verständnis für digitale Prozesse, Shop Systeme, Marktplätze und Daten? Dann "
raw-0088,2026-06-04,Arbeitnow API,Cygrid GmbH,Founding Engineering Team Lead (HandsOn),Software & Engineering,Management,Senior/Lead,Berlin,manager,Risk Management; Cybersecurity; Onboarding; Frontend; Security; Backend; Startup; Design; Cloud; AI; Go,Management; Team Leader,97416,140184,118800,72.1,72,49,91,https://www.arbeitnow.com/jobs/companies/cygrid-gmbh/founding-engineering-team-lead-handson-berlin-140227,"Berlin • Cybersecurity &#x26; AI Startup • Recently Funded A newly funded cybersecurity startup in Berlin is looking for a Engineering Team Lead to join as a founding team member and help design the core security, identi"
raw-0089,2026-06-04,Arbeitnow API,CloseAI,Customer Success Manager (m/w/d) - Teilzeit 20h,Marketing & Growth,Customer Service,Senior/Lead,Leinfelden-Echterdingen,teamleitung,Customer Service; Onboarding; CRM,Customer Service,66420,95580,81000,61,48,38.6,123,https://www.arbeitnow.com/jobs/companies/closeai/customer-success-manager-teilzeit-20h-leinfelden-echterdingen-22545,"Aufgaben Onboarding &#x26; Betreuung: Du begleitest unsere Kunden bei der Einrichtung und ersten Nutzung von CloseAI. Check-in Calls: Du führst regelmäßige Calls mit unseren Nutzern durch, um den aktuellen Status zu prüf"
raw-0090,2026-06-04,Arbeitnow API,Pflegia,Praktikum im Business Development (Projektmanagement & Prozessoptimierung) (m/w/d),Marketing & Growth,Project Management,Internship/Student,Berlin,"Internship, hilfstätigkeit / student",Project Management; Onboarding; Excel; CRM,Project Management,27060,38940,33000,63.4,38,30.3,136,https://www.arbeitnow.com/jobs/companies/pflegia/praktikum-im-business-development-projektmanagement-prozessoptimierung-berlin-93537,"Du willst nicht nur zuschauen, sondern aktiv mitgestalten? Dann bist Du bei Pflegia genau richtig. Als Praktikant im Business Development unterstützt Du uns dabei, interne Prozesse besser zu verstehen, bereichsübergreife"
raw-0091,2026-06-04,Arbeitnow API,MCI Deutschland GmbH,Project Director Live Communication (m/w/d),Product & Project Management,Management,Senior/Lead,Düsseldorf,teamleitung,Communication,Management; Team Leader,84132,121068,102600,100,48,38.6,123,https://www.arbeitnow.com/jobs/companies/mci-deutschland-gmbh/project-director-live-communication-dusseldorf-463517,"Dein Tag bei uns Du startest nicht in der Umsetzung, sondern dort, wo Kundenanforderungen in wirksame Lösungen übersetzt werden. Ein Kunde kommt mit einer Herausforderung auf dich zu. Vielleicht noch unscharf, vielleicht"
raw-0092,2026-06-04,Arbeitnow API,Indivumed GmbH,Controller (m/w/d),Software & Engineering,Finance,Unspecified,Hamburg,,Finance; Forecasting; Power BI; Excel; SAP,Finance,66387,95533,80960,57.1,38,30.3,136,https://www.arbeitnow.com/jobs/companies/indivumed-gmbh/junior-controller-hamburg-204105,"Indivumed ist ein Biotechnologieunternehmen, das auf Präzisionsonkologie spezialisiert ist. Seit fast 25 Jahren treibt uns unsere übergeordnete Vision an: eine Welt zu schaffen, in der jeder Krebspatientin und jedem Kreb"
raw-0093,2026-06-04,Arbeitnow API,MARTENS & PRAHL Gruppe,Junior Data Consultant (m/w/d),Data & AI,Data Scientist,Entry-level,Lübeck,,Data Science; Power BI,Data Scientist,52275,75225,63750,47.3,43,32.5,129,https://www.arbeitnow.com/jobs/companies/martens-prahl-gruppe/junior-data-consultant-lubeck-481225,"Als Versicherungsmakler ist es unser Ziel, für jeden Bedarf die beste Versicherungslösung zu entwickeln. Dafür arbeiten über 90 mittelständische Versicherungsmakler mit über 1000 Mitarbeitende unter dem Dach der MARTENS "
raw-0094,2026-06-04,Arbeitnow API,traze GmbH,(Senior) Firewall Specialist (m/w/d),Cybersecurity & IT,Remote,Senior/Lead,Hamburg,berufserfahren,Security,Remote; IT Security,88560,127440,108000,71.9,61,44.2,106,https://www.arbeitnow.com/jobs/companies/traze-gmbh/senior-firewall-specialist-hamburg-131746,"Gemeinsam mit unserem Partner, einem international tätigen Industrieunternehmen, suchen wir im Zuge des weiteren Ausbaus des IT-Security-Teams einen Firewall Specialist (m/w/d) für verschiedene Standorte in Deutschland o"
raw-0095,2026-06-04,Arbeitnow API,IndieKidz GmbH,Mandatory Internship(Unpaid): Backend / Full-Stack Developer for AI SaaS,Software & Engineering,Remote,Internship/Student,Berlin,entry,JavaScript; TypeScript; Frontend; Node.js; Backend; Startup; Editing; Design; SaaS; Git; AI,Remote; Software Development,39688,57112,48400,71,46,33.8,125,https://www.arbeitnow.com/jobs/companies/indiekidz-gmbh/mandatory-internshipunpaid-backend-full-stack-developer-for-ai-saas-berlin-152480,"IndieKidz GmbH is a Berlin-based early stage startup building creative learning products for children. Our software product, Occibo , is an AI-assisted children’s book creation platform. It helps authors, parents, teache"
raw-0096,2026-06-04,Arbeitnow API,mammaly,(Senior) Performance Marketing Manager - Paid Social (all genders),Marketing & Growth,Remote,Senior/Lead,Berlin,professional / experienced,Performance Marketing; Advertising; Research; Testing; Startup,Remote; Marketing Manager,66420,95580,81000,64.1,48,38.6,123,https://www.arbeitnow.com/jobs/companies/mammaly/senior-performance-marketing-manager-paid-social-all-genders-berlin-314925,"About mammaly We are mammaly! - und unsere Mission sind gesunde und glückliche Hunde! Deshalb entwickeln wir Premium Supplements für Hunde, die ein langes und gutes Leben ermöglichen. Gegründet in 2020, ist mammaly berei"
raw-0097,2026-06-04,Arbeitnow API,mammaly,(Senior) Performance Copywriter (all genders),Marketing & Growth,Remote,Senior/Lead,Berlin,professional / experienced,Communication; Testing; AI,Remote; Marketing and Communication,66420,95580,81000,93.3,48,38.6,123,https://www.arbeitnow.com/jobs/companies/mammaly/senior-performance-copywriter-all-genders-berlin-484933,"Du bist kein Texter. Du bist ein Umsatzmacher. Du weißt genau, wie ein Funnel tickt, was eine Headline ausmacht und warum Menschen kaufen. Oder es eben nicht tun. Du hast bewiesen, dass deine Texte verkaufen. Und du bist"
raw-0098,2026-06-04,Arbeitnow API,Oxford PV Germany GmbH,Personalreferent (m/w/d),Software & Engineering,HR,Mid-level,Brandenburg,berufserfahren,HR; Excel,HR,72160,103840,88000,70,38,30.3,136,https://www.arbeitnow.com/jobs/companies/oxford-pv-germany-gmbh/personalreferent-brandenburg-379073,Zur Verstärkung unseres Teams suchen wir in Brandenburg an der Havel einen Personalreferenten (m/w/d) . Aufgaben Ansprechpartner(in) für Mitarbeitende und Führungskräfte in allen personalrelevanten Angelegenheiten Erstel
raw-0099,2026-06-04,Arbeitnow API,Xylem,HR Business Partner (m/w/d),Finance & Business,HR,Unspecified,Langenhagen,,HR,HR,51299,73821,62560,68.1,38,30.3,136,https://www.arbeitnow.com/jobs/companies/xylem/hr-business-partner-langenhagen-457814,"Die weltweiten Wasserprobleme werden immer größer und stellen uns ständig vor neue Herausforderungen. Bis 2025 werden 1,8 Milliarden Menschen in Ländern oder Regionen mit absoluter Wasserknappheit leben. Wir sind ein glo"
raw-0100,2026-06-04,Arbeitnow API,Bloom Future,Pflichtpraktikum Online-Marketing,Marketing & Growth,Marketing and Communication,Internship/Student,Heilbronn,Internship,Communication; Performance Marketing; Social Media; Startup,Marketing and Communication,27060,38940,33000,79.8,38,30.3,136,https://www.arbeitnow.com/jobs/companies/bloom-future/pflichtpraktikum-online-marketing-heilbronn-125800,"Du hast Bock auf Startup Atmosphäre, Online Marketing und echte Verantwortung statt langweilige Praktikumsaufgaben? Dann komm zu Bloom Future und hilf uns dabei, eine KI gestützte Berufsorientierungsplattform für Schüler"
raw-0101,2026-06-04,Arbeitnow API,Keil Anlagenbau GmbH & Co. KG,Automatisierer / SPS-Programmierer (m/w/d),Software & Engineering,Automation Engineering,Mid-level,Bohmte,berufserfahren,Automation,Automation Engineering,72160,103840,88000,64.3,38,30.3,136,https://www.arbeitnow.com/jobs/companies/keil-anlagenbau-gmbh-co-kg/automatisierer-sps-programmierer-bohmte-13270,"Technik, die bewegt. Automatisierung, die funktioniert. Bei Keil Anlagenbau entwickeln und realisieren wir individuelle verfahrenstechnische Anlagen für unterschiedlichste Industrien – von Chemie und Bauchemie über Polyu"
raw-0102,2026-06-04,Arbeitnow API,1KOMMA5˚,Werkstudent:in (m/w/d) PR & Communications - CEO Office,Software & Engineering,Marketing and Communication,Internship/Student,Hamburg,"Internship, berufseinstieg",Communication; Startup; AI,Marketing and Communication,39688,57112,48400,96.2,38,30.3,136,https://www.arbeitnow.com/jobs/companies/1komma50/werkstudentin-pr-communications-ceo-office-hamburg-179557,1KOMMA5° Bei 1KOMMA5° verfolgen wir eine Vision: Living on wind and sunlight forever for free . Dafür bauen wir mit Heartbeat AI das Energiesystem der Zukunft. Bist du dabei? Wir bringen regionales Handwerk und skalierba
raw-0103,2026-06-04,Arbeitnow API,eviit GmbH,Minijob: Creative Content Creator / Social Media Allrounder (m/w/d),Marketing & Growth,Social Media Manager,Unspecified,Kayhude,,Social Media; Advertising; Editing; Cloud; Video Editing,Social Media Manager,45264,65136,55200,67.4,46,33.8,125,https://www.arbeitnow.com/jobs/companies/eviit-gmbh/minijob-creative-content-creator-social-media-allrounder-kayhude-250047,"Du liebst Social Media, hast ein Auge für starken Content und willst nicht nur fertige Texte einplanen, sondern echte Creatives von Grund auf mitgestalten ? Du hast Bock auf Content, der auffällt – zwischen tonnenschwere"
raw-0104,2026-06-04,Arbeitnow API,Personalberatung Susan Lange,Steuerberater (m/w/d) in Voll- und Teilzeit,Finance & Business,Finance,Unspecified,Rostock,,Finance,Finance,51299,73821,62560,71.9,38,30.3,136,https://www.arbeitnow.com/jobs/companies/personalberatung-susan-lange/steuerberater-in-voll-und-teilzeit-rostock-379915,"Die Personalberatung Susan Lange in Rostock ist spezialisiert auf die Direktsuche und Vermittlung von Fach- und Führungskräften. Für Bewerber ist unser Service kostenfrei. Im Auftrag unseres Kunden, eine namhafte Steuerb"
raw-0105,2026-06-04,Arbeitnow API,Personalberatung Susan Lange,HR-Assistentin (m/w/d),Marketing & Growth,HR,Unspecified,Rostock,,HR,HR,45264,65136,55200,68.1,38,30.3,136,https://www.arbeitnow.com/jobs/companies/personalberatung-susan-lange/hr-assistentin-rostock-440679,"Die Personalberatung Susan Lange in Rostock ist spezialisiert auf die Direktsuche und Vermittlung von Fach- und Führungskräften. Für Bewerber ist unser Service kostenfrei. Im Auftrag unseres Kunden, ein Unternehmen aus d"
raw-0106,2026-06-04,Arbeitnow API,ganss personal GmbH,Fachinformatiker / IT-Techniker (m/w/d) IT-Support in München,Cybersecurity & IT,System and Network Administration,Unspecified,Munich,,iOS,System and Network Administration,60352,86848,73600,50.5,43,32.5,129,https://www.arbeitnow.com/jobs/companies/ganss-personal-gmbh/fachinformatiker-it-techniker-it-support-in-munchen-munich-153463,"Aufgaben Bereitstellung vom 1st und 2nd Level Client Support im Onsite Team Entgegennahme von Störungen und Bearbeitung von Anfragen Betreuung von Standard-Anwendungen, wie MS-Office und aktuellen Betriebssystemen (Windo"
raw-0107,2026-06-04,Arbeitnow API,ganss personal GmbH,Fachinformatiker / IT-Techniker (m/w/d) IT-Support in Hamburg,Cybersecurity & IT,System and Network Administration,Unspecified,Hamburg,,iOS,System and Network Administration,60352,86848,73600,50.5,43,32.5,129,https://www.arbeitnow.com/jobs/companies/ganss-personal-gmbh/fachinformatiker-it-techniker-it-support-in-hamburg-209782,"Aufgaben Bereitstellung vom 1st und 2nd Level Client Support im Onsite Team Entgegennahme von Störungen und Bearbeitung von Anfragen Betreuung von Standard-Anwendungen, wie MS-Office und aktuellen Betriebssystemen (Windo"
raw-0108,2026-06-04,Arbeitnow API,ganss personal GmbH,Fachinformatiker / IT-Techniker (m/w/d) IT-Support in Stuttgart,Cybersecurity & IT,System and Network Administration,Unspecified,Stuttgart,,iOS,System and Network Administration,60352,86848,73600,50.5,43,32.5,129,https://www.arbeitnow.com/jobs/companies/ganss-personal-gmbh/fachinformatiker-it-techniker-it-support-in-stuttgart-75424,"Aufgaben Bereitstellung vom 1st und 2nd Level Client Support im Onsite Team Entgegennahme von Störungen und Bearbeitung von Anfragen Betreuung von Standard-Anwendungen, wie MS-Office und aktuellen Betriebssystemen (Windo"
raw-0109,2026-06-04,Arbeitnow API,ganss personal GmbH,Fachinformatiker / IT-Techniker (m/w/d) IT-Support in Sindelfingen,Cybersecurity & IT,System and Network Administration,Unspecified,Sindelfingen,,iOS,System and Network Administration,60352,86848,73600,50.5,43,32.5,129,https://www.arbeitnow.com/jobs/companies/ganss-personal-gmbh/fachinformatiker-it-techniker-it-support-in-sindelfingen-278082,"Aufgaben Bereitstellung vom 1st und 2nd Level Client Support im Onsite Team Entgegennahme von Störungen und Bearbeitung von Anfragen Betreuung von Standard-Anwendungen, wie MS-Office und aktuellen Betriebssystemen (Windo"
raw-0110,2026-06-04,Arbeitnow API,Little John Bikes GmbH,Führungstalent (m/w/d),Software & Engineering,Directors,Mid-level,Brandenburg,berufserfahren,Python; JavaScript; API; Cloud,Directors; Chief Executives,72160,103840,88000,94.2,62,40.7,104,https://www.arbeitnow.com/jobs/companies/little-john-bikes-gmbh/fuhrungstalent-brandenburg-437340,"Für unseren beratungsintensiven, stationären Fahrradhandel suchen wir Führungskräfte, die Verantwortung übernehmen und ein Talent für die Entwicklung und Motivation von Mitarbeitern besitzen. Mit Deinem sympathischen abe"
raw-0111,2026-06-04,Arbeitnow API,Little John Bikes GmbH,Führungstalent (m/w/d),Software & Engineering,Directors,Mid-level,Bad Nenndorf,berufserfahren,Python; JavaScript; API; Cloud,Directors; Chief Executives,72160,103840,88000,94.2,62,40.7,104,https://www.arbeitnow.com/jobs/companies/little-john-bikes-gmbh/fuhrungstalent-bad-nenndorf-78043,"Für unseren beratungsintensiven, stationären Fahrradhandel suchen wir Führungskräfte, die Verantwortung übernehmen und ein Talent für die Entwicklung und Motivation von Mitarbeitern besitzen. Mit Deinem sympathischen abe"
raw-0112,2026-06-04,Arbeitnow API,Swiss Life Select,Senior Sales Consultant - Vollzeit (German Speaking),Finance & Business,Finance,Senior/Lead,Bad Krozingen,"Full-time fixed-term, mid",Finance; Onboarding; Sales,Finance; high school or equivalent,75276,108324,91800,73.1,48,38.6,123,https://www.arbeitnow.com/jobs/companies/swiss-life-select/senior-sales-consultant-vollzeit-german-speaking-bad-krozingen-207558,"Du willst Ergebnisse, keine Diskussionen? Du arbeitest strukturiert, hast ein klares Verständnis für saubere Prozesse und weißt, wie wichtig Verlässlichkeit im Vertrieb ist? Dann bist du bei uns genau richtig! Wir suchen"
raw-0113,2026-06-04,Arbeitnow API,premote,Working student - Operations & Customer Support,Cybersecurity & IT,Customer Service,Internship/Student,Berlin,Working student,Customer Service; Project Management; Communication; Automation; Onboarding; Operations; Security; HR,Customer Service,36080,51920,44000,72.6,51,35.9,119,https://www.arbeitnow.com/jobs/companies/premote/working-student-operations-customer-support-berlin-99259,"About premote At premote , we enable companies to let their employees work from abroad without compliance risks . We automate complex compliance processes for international business travel, workations, and assignments —c"
raw-0114,2026-06-04,Arbeitnow API,A-LEVEL,Minijob als Recruiting Support (m/w/d) 10 Stunden die Woche,Marketing & Growth,Remote,Unspecified,Cologne,Side,Recruitment; Operations; Startup; HR,Remote; Recruitment and Selection,45264,65136,55200,71.9,38,30.3,136,https://www.arbeitnow.com/jobs/companies/a-level/minijob-als-recruiting-support-10-stunden-die-woche-cologne-73579,"Warum A-LEVEL? Du möchtest nicht einfach nur Werkstudent:in sein, sondern verstehen, wie Recruiting wirklich funktioniert, von der ersten Ansprache bis zur Einstellung? Bei uns übernimmst du eine zentrale Rolle im Recrui"
raw-0115,2026-06-04,Arbeitnow API,Auxilius.ai,Application Architect - AI Native Startup (m/f/d),Software & Engineering,Software Development,Mid-level,Munich,professional / experienced,Automation; Backend; Startup; Design; Azure; CI/CD; Java; AWS; AI,Software Development,72160,103840,88000,69.2,62,40.7,104,https://www.arbeitnow.com/jobs/companies/auxiliusai/application-architect-ai-native-startup-munich-366138,"You'll join an early-stage, AI-native startup with a product that has already proven market fit. We build cutting-edge AI solutions for Governance, Risk and Compliance (GRC) for enterprises around the world. Our customer"
raw-0116,2026-06-04,Arbeitnow API,Rahantech GmbH,Frontend Developer (m/f/d),Software & Engineering,Web Development,Entry-level,Hamburg,entry,JavaScript; Frontend; Backend; Design; React,Web Development,54120,77880,66000,77.9,46,33.8,125,https://www.arbeitnow.com/jobs/companies/rahantech-gmbh/frontend-developer-hamburg-124986,"Tasks Design and build mobile-first, responsive web pages using HTML, CSS and modern JavaScript frameworks like React, Angular and Vue.js. Ensure web pages are accessible, optimized and perform seamlessly on various devi"
raw-0117,2026-06-04,Arbeitnow API,Rahantech GmbH,Software Developer (m/f/d),Software & Engineering,Software Development,Entry-level,Berlin,entry,JavaScript; Security; Backend; Python; Design; Azure; Cloud; CI/CD; Agile; Scrum; Java; SQL,Software Development,54120,77880,66000,68.5,78,47.5,84,https://www.arbeitnow.com/jobs/companies/rahantech-gmbh/software-developer-berlin-89047,"Tasks Develop and maintain high-quality software solutions using modern technologies. Work on innovative and large-scale projects that impact businesses globally. Collaborate with cross-functional teams to design, build "
raw-0118,2026-06-04,Arbeitnow API,ganss personal GmbH,IT-Techniker Logistikumfeld (m/w/d) in Kerpen,Software & Engineering,System and Network Administration,Unspecified,Kerpen,,Python; JavaScript; API; Cloud,System and Network Administration,66387,95533,80960,94.2,62,40.7,104,https://www.arbeitnow.com/jobs/companies/ganss-personal-gmbh/it-techniker-logistikumfeld-in-kerpen-195700,"Aufgaben Installation, Einrichtung und Fehleridentifikation von Hardware und Software Kommissionierung und Lagerverwaltung Tätigkeiten wie Labeling und Scannen Assetservices sowie Pflege von Kundendatenbanken Bereitstell"
raw-0119,2026-06-04,Arbeitnow API,PIPA GmbH,Senior Retail Performance Marketing Manager,Cybersecurity & IT,Marketing and Communication,Senior/Lead,Hamburg,professional / experienced,Communication; Performance Marketing; Advertising,Marketing and Communication,88560,127440,108000,74.4,53,40.8,116,https://www.arbeitnow.com/jobs/companies/pipa-gmbh/senior-retail-performance-marketing-manager-hamburg-216099,"Our client, Front Row, helps leading brands accelerate their ecommerce growth through digital advertising, retail media expertise, and proprietary technology. To strengthen their Performance Marketing Team, we are lookin"
raw-0120,2026-06-04,Arbeitnow API,PIPA GmbH,Senior Amazon Performance Marketing Manager,Marketing & Growth,Marketing and Communication,Senior/Lead,Hamburg,professional / experienced,Communication; Performance Marketing; Advertising; Excel,Marketing and Communication,66420,95580,81000,73.7,48,38.6,123,https://www.arbeitnow.com/jobs/companies/pipa-gmbh/senior-amazon-performance-marketing-manager-hamburg-464586,"Our client, Front Row, is a leading ecommerce growth partner helping ambitious brands scale their business across global marketplaces and digital channels. By combining strategic consulting, digital advertising expertise"
raw-0121,2026-06-04,Arbeitnow API,agex IT gmbh,Senior Python Developer (f/m/d) wanted! Ref.Nr. 4183!,Software & Engineering,Remote,Senior/Lead,Kiel,,Kubernetes; Operations; Backend; Python; Design; Azure; CI/CD; React; SQL,Remote; IT,97416,140184,118800,69.2,80,52.4,81,https://www.arbeitnow.com/jobs/companies/agex-it-gmbh/senior-python-developer-wanted-refnr-4183-kiel-429862,For a project we are looking for a Senior Python Developer (f/m/d). Aufgaben Data Integration and Processing • analysis and implementation of defined data ingestion and processing components as part of agreed deliverable
raw-0122,2026-06-04,Arbeitnow API,Projektron GmbH,Unterstützung / Administration Hostingumgebung,Software & Engineering,IT,Unspecified,Berlin,,Kubernetes; Docker,IT,66387,95533,80960,47.9,46,33.8,125,https://www.arbeitnow.com/jobs/companies/projektron-gmbh/unterstutzung-administration-hostingumgebung-berlin-32690,Die Projektron GmbH entwickelt und vertreibt die webbasierte Projektmanagement-Software Projektron BCS. Für die Unterstützung unserer europaweit über 820 Kunden sowie die kontinuierliche Weiterentwicklung unserer Softwar
raw-0123,2026-06-04,Arbeitnow API,Theis Konzeptberatung,Kundenberatung bei freier Zeiteinteilung,HR & Recruitment,Private Banking,Unspecified,Mittenaar,Freelance,Recruitment; HR; Onboarding; Communication,Private Banking,42246,60794,51520,73.7,38,30.3,136,https://www.arbeitnow.com/jobs/companies/theis-konzeptberatung/kundenberatung-bei-freier-zeiteinteilung-mittenaar-129272,Als gesellschaftsunabhängiger Finanzdienstleister haben wir seit über 30 Jahren Erfahrung am Markt. Unser Unternehmen bietet umfassende Beratungen für die individuellen Wünsche und Ziele des Kunden im Finanz- und Gesundh
raw-0124,2026-06-04,Arbeitnow API,Berend Heins GmbH,Media Buyer als KI-E-Commerce Operator | Remote,Marketing & Growth,Remote,Unspecified,Cologne,,Video Editing,Remote; Online Marketing,45264,65136,55200,55.5,38,30.3,136,https://www.arbeitnow.com/jobs/companies/berend-heins-gmbh/media-buyer-als-ki-e-commerce-operator-remote-cologne-346228,"Wir beraten seit 2022 ambitionierte E-Commerce-Brands beim profitablen Skalieren. Über 500 begleitete Marken, mehr als 40 Mio. € verwaltetes Werbebudget. Jetzt bauen wir ein zweites Standbein: Statt nur zu beraten, übern"
raw-0125,2026-06-04,Arbeitnow API,Berend Heins GmbH,Performance Marketer als KI-E-Commerce Operator | Remote,Marketing & Growth,Remote,Unspecified,Cologne,,Video Editing,Remote; Online Marketing,45264,65136,55200,55.5,38,30.3,136,https://www.arbeitnow.com/jobs/companies/berend-heins-gmbh/performance-marketer-als-ki-e-commerce-operator-remote-cologne-475189,"Wir beraten seit 2022 ambitionierte E-Commerce-Brands beim profitablen Skalieren. Über 500 begleitete Marken, mehr als 40 Mio. € verwaltetes Werbebudget. Jetzt bauen wir ein zweites Standbein: Statt nur zu beraten, übern"
