source,source_url,date_posted,company,title,category,location,job_type,tags_raw,description
Arbeitnow API,https://www.arbeitnow.com/jobs/companies/rugamer-steiner-consulting-gmbh/crm-marketing-manager-dusseldorf-9356,2026-05-18T15:30:34,Rügamer & Steiner Consulting GmbH,CRM Marketing Manager (m/w/d),Marketing and Communication,Düsseldorf,,Marketing and Communication,"Stellenbeschreibung: Rügamer &#x26; Steiner ist die führende E-Mail Marketing Agentur hinter den erfolgreichsten E-Commerce Unternehmen in DE, AU &#x26; CH. Über 100+ Online Shops vertrauen uns bereits und erreichen mit uns die Herzen &#x26; Geldbeutel ihrer Kunden. Da immer mehr Kunden ihr Vertrauen in Rügamer &#x26; Steiner setzen suchen wir Dich als CRM Marketing Manager (m/w/d). Du bist die zentrale operative Schnittstelle zwischen Strategie, Kunden und Umsetzung. Als Projektmanager stellst du sicher, dass Kampagnen schnell, sauber und effizient umgesetzt werden – ohne Reibungsverluste. Perfekt für dich, wenn du bereits Agenturerfahrung hast und weißt, wie wichtig Tempo, Struktur und saubere Prozesse sind. Aufgaben Deine Aufgaben Operative Umsetzung: Eigenständige Durchführung und technische Umsetzung von Marketing-Aufgaben und Kampagnen im Tagesgeschäft. Daily Management &#x26; Ticketing: Strukturierte Erfassung, Bearbeitung und Nachverfolgung aller eingehenden Aufgaben und Kundenanfragen. Schnelle Kundenkommunikation: Sicherstellung extrem kurzer Reaktionszeiten. Kunden erhalten zeitnah (z. B. innerhalb von 30 bis 60 Minuten) eine erste Rückmeldung oder Zwischenantwort bei Anfragen. Koordination: Steuerung der Zusammenarbeit mit internen Teams (z. B. Grafik und Copy). Du erstellst Briefings, definierst klare Deadlines und nutzt Projektmanagement-Tools (z. B. ClickUp) für reibungslose Abläufe. Qualitätssicherung: Einleitung, Koordination und konsequente Nachverfolgung von Korrekturschleifen bis zur finalen Freigabe. Problemlösung: Schnelles und pragmatisches Lösen von technischen oder organisatorischen Hürden im laufenden Betrieb. Du trägst die Verantwortung für eine zuverlässige operative Umsetzung und die konsequente Einhaltung aller Deadlines. Gleichzeitig stellst du sicher, dass alle Prozesse technisch sauber, fehlerfrei und mit hoher Reaktionsgeschwindigkeit in der Kundenbetreuung umgesetzt werden. Qualifikation Das solltest du sein: ➜ Du hast mindestens 3 Jahre Berufserfahrung im Bereich Projektmanagement und Marketing ➜ Du arbeitest strukturiert, extrem organisiert und proaktiv ➜ Du bist zuverlässig und kannst viele parallele Aufgaben (Tickets) effizient managen ➜ Du denkst lösungsorientiert und bringst technisches Verständnis mit ➜ Du kommunizierst klar, präzise und schnell – sowohl schriftlich als auch mündlich Benefits Was wir dir bieten: Sicherer Arbeitsplatz: Jede Person, die wir einstellen soll langfristig mit uns wachsen. Das Ziel jeder Einstellung ist eine unbefristete Übernahme. Tolle Arbeitsatmosphäre: Der Umgang untereinander ist sehr kollegial und familiär. Wir ziehen alle am gleichen Strang und motivieren uns gegenseitig Bestleistungen zu erzielen und persönlich zu wachsen. Es gibt zudem ein monatliches Team-Lunch auf Kosten der Firma. Gute Vergütung &#x26; Karrierechancen: Unsere Mitarbeiter: innen erhalten eine faire Vergütung und vermögenswirksame Leistungen. Über die nächsten Jahre werden wir weiter wachsen und expandieren. Daher benötigen wir weitere Experten und/oder Führungskräfte ...und noch viel mehr: Modernes Büro in zentraler Lage in Düsseldorf Pempelfort mit Dachterasse und Anschluss an ÖPNV Stetige Weiterbildung &#x26; Karriere Zusammenhalt in einem dynamischen und kollegialen Team Ein attraktives Gehaltsmodell Monatliches Teamessen, Firmen-Events, Messen, Vorträge und Veranstaltungen Sehr gute Arbeitsmittel, beste Hardware von Apple, höhenverstellbare Tische Du erkennst Dich wieder und möchtest mit uns ins Gespräch kommen? Dann bewirb dich noch heute und werde schon bald ein Teil des Teams! Find more English Speaking Jobs in Germany on Arbeitnow"
Arbeitnow API,https://www.arbeitnow.com/jobs/companies/rugamer-steiner-consulting-gmbh/e-mail-marketing-manager-dusseldorf-269665,2026-05-18T15:30:34,Rügamer & Steiner Consulting GmbH,E-Mail Marketing Manager (m/w/d),Marketing and Communication,Düsseldorf,,Marketing and Communication,"Stellenbeschreibung: Rügamer &#x26; Steiner ist die führende E-Mail Marketing Agentur hinter den erfolgreichsten E-Commerce Unternehmen in DE, AU &#x26; CH. Über 100+ Online Shops vertrauen uns bereits und erreichen mit uns die Herzen &#x26; Geldbeutel ihrer Kunden. Da immer mehr Kunden ihr Vertrauen in Rügamer &#x26; Steiner setzen suchen wir Dich als E-Mail Marketing Manager (m/w/d). Du bist die zentrale operative Schnittstelle zwischen Strategie, Kunden und Umsetzung. Als Projektmanager stellst du sicher, dass Kampagnen schnell, sauber und effizient umgesetzt werden – ohne Reibungsverluste. Perfekt für dich, wenn du bereits Agenturerfahrung hast und weißt, wie wichtig Tempo, Struktur und saubere Prozesse sind. Aufgaben Deine Aufgaben Operative Umsetzung: Eigenständige Durchführung und technische Umsetzung von Marketing-Aufgaben und Kampagnen im Tagesgeschäft. Daily Management &#x26; Ticketing: Strukturierte Erfassung, Bearbeitung und Nachverfolgung aller eingehenden Aufgaben und Kundenanfragen. Schnelle Kundenkommunikation: Sicherstellung extrem kurzer Reaktionszeiten. Kunden erhalten zeitnah (z. B. innerhalb von 30 bis 60 Minuten) eine erste Rückmeldung oder Zwischenantwort bei Anfragen. Koordination: Steuerung der Zusammenarbeit mit internen Teams (z. B. Grafik und Copy). Du erstellst Briefings, definierst klare Deadlines und nutzt Projektmanagement-Tools (z. B. ClickUp) für reibungslose Abläufe. Qualitätssicherung: Einleitung, Koordination und konsequente Nachverfolgung von Korrekturschleifen bis zur finalen Freigabe. Problemlösung: Schnelles und pragmatisches Lösen von technischen oder organisatorischen Hürden im laufenden Betrieb. Du trägst die Verantwortung für eine zuverlässige operative Umsetzung und die konsequente Einhaltung aller Deadlines. Gleichzeitig stellst du sicher, dass alle Prozesse technisch sauber, fehlerfrei und mit hoher Reaktionsgeschwindigkeit in der Kundenbetreuung umgesetzt werden. Qualifikation Das solltest du sein: ➜ Du hast mindestens 3 Jahre Berufserfahrung im Bereich Projektmanagement und Marketing ➜ Du arbeitest strukturiert, extrem organisiert und proaktiv ➜ Du bist zuverlässig und kannst viele parallele Aufgaben (Tickets) effizient managen ➜ Du denkst lösungsorientiert und bringst technisches Verständnis mit ➜ Du kommunizierst klar, präzise und schnell – sowohl schriftlich als auch mündlich Benefits Was wir dir bieten: Sicherer Arbeitsplatz: Jede Person, die wir einstellen soll langfristig mit uns wachsen. Das Ziel jeder Einstellung ist eine unbefristete Übernahme. Tolle Arbeitsatmosphäre: Der Umgang untereinander ist sehr kollegial und familiär. Wir ziehen alle am gleichen Strang und motivieren uns gegenseitig Bestleistungen zu erzielen und persönlich zu wachsen. Es gibt zudem ein monatliches Team-Lunch auf Kosten der Firma. Gute Vergütung &#x26; Karrierechancen: Unsere Mitarbeiter: innen erhalten eine faire Vergütung und vermögenswirksame Leistungen. Über die nächsten Jahre werden wir weiter wachsen und expandieren. Daher benötigen wir weitere Experten und/oder Führungskräfte ...und noch viel mehr: Modernes Büro in zentraler Lage in Düsseldorf Pempelfort mit Dachterasse und Anschluss an ÖPNV Stetige Weiterbildung &#x26; Karriere Zusammenhalt in einem dynamischen und kollegialen Team Ein attraktives Gehaltsmodell Monatliches Teamessen, Firmen-Events, Messen, Vorträge und Veranstaltungen Sehr gute Arbeitsmittel, beste Hardware von Apple, höhenverstellbare Tische Du erkennst Dich wieder und möchtest mit uns ins Gespräch kommen? Dann bewirb dich noch heute und werde schon bald ein Teil des Teams! Find more English Speaking Jobs in Germany on Arbeitnow"
Arbeitnow API,https://www.arbeitnow.com/jobs/companies/shereen-patzelt/werkstudent-vertrieb-finanzberatung-praxis-statt-theorie-chemnitz-63009,2026-05-18T15:20:14,Shereen Patzelt,Werkstudent Vertrieb / Finanzberatung (m/w/d) – Praxis statt Theorie,Finance,Chemnitz,"Full-time permanent, entry",Finance; high school or equivalent,"Du studierst…aber hast das Gefühl, dass dich dein Nebenjob nicht wirklich weiterbringt? Du arbeitest für 12–15€ die Stunde. Tauschst Zeit gegen Geld. Und wenn du ehrlich bist: 👉 Du lernst nichts, was dich später wirklich nach vorne bringt 👉 Du baust dir keinen Vorsprung auf 👉 Und nach dem Studium startest du bei null – wie alle anderen Das Problem Die meisten Studenten: jobben nebenbei für kurzfristiges Geld sammeln kaum echte Praxiserfahrung und hoffen, dass „irgendwie schon alles klappt“ 👉 Tut es meistens nicht. Weil Theorie allein dich nicht weiterbringt. Deine Chance bei uns Bei uns arbeitest du nicht einfach als Werkstudent . 👉 Du baust dir parallel zum Studium eine echte Karriere im Finanzvertrieb auf. Das bedeutet: echte Praxiserfahrung echte Verantwortung echtes Einkommen (nicht gedeckelt) Und das Beste: 👉 Du startest ohne Vorerfahrung . Was dich erwartet 6-monatiges Traineeprogramm neben deinem Studium Vorbereitung auf einen anerkannten IHK-Abschluss Persönliches 1:1 Mentoring Schritt-für-Schritt Ausbildung im Vertrieb &amp; Beratung Keine Kaltakquise – du arbeitest mit bestehenden Interessenten 👉 Du lernst nicht nur Theorie – du setzt sie direkt um. Was du im Alltag machst Du arbeitest mit Interessenten, die bereits Bedarf haben Du begleitest Beratungsgespräche (online &amp; vor Ort) Du lernst, wie Finanzstrategien aufgebaut werden Du entwickelst dich Schritt für Schritt zum eigenständigen Berater 👉 Vom Mitlaufen → zum eigenständigen Arbeiten. Dein Weg bei uns 👉 Start als Werkstudent (10–20h/Woche) 👉 Ausbildung &amp; erste eigene Erfahrungen 👉 IHK-Abschluss nach ca. 6 Monaten 👉 Einstieg als Berater (optional Vollzeit nach Studium) 👉 Du entscheidest, wie schnell du wächst. Was wir dir bieten Fixum + Provision während der Einarbeitung Leistungsorientiertes Einkommen (nach oben offen) Flexible Arbeitszeiten (perfekt fürs Studium) Ortsunabhängiges Arbeiten möglich Keine Kaltakquise – Leads werden gestellt Persönliches Mentoring statt „allein klarkommen“ Klare Karriereperspektiven 👉 Du verdienst nicht nur Geld – du baust dir etwas auf. Für wen das passt Du passt zu uns, wenn du: Student bist und mehr willst als einen Nebenjob bereit bist zu lernen und Leistung zu bringen dir früh einen Vorsprung aufbauen willst langfristig etwas Eigenes aufbauen möchtest 👉 Egal welches Studium – entscheidend ist dein Anspruch. Warum das ein Unterschied ist Während andere nach dem Studium anfangen zu suchen… hast du bereits: echte Vertriebserfahrung Kundenkontakt ein skalierbares Einkommen 👉 Du startest nicht bei null – sondern mit Vorsprung. Das ist deine Chance Wenn du dein Studium nutzen willst, um dir mehr als nur einen Abschluss aufzubauen… dann bewirb dich jetzt. Und finde heraus, ob das hier dein nächster Schritt ist. Muss Abitur oder eine abgeschlossene kaufmännische Ausbildung Empathie und Freude an der Beratung von Kunden Eigeninitiative und Zielorientierung Deutsche Sprache Wunsch und/oder abgeschlossenes Studium Find more English Speaking Jobs in Germany on Arbeitnow"
Arbeitnow API,https://www.arbeitnow.com/jobs/companies/schwertfels-consulting-gmbh/prufungsassistent-fur-alle-die-mehr-wollen-als-nur-kontrollieren-augsburg-120847,2026-05-18T15:00:53,Schwertfels Consulting GmbH,"Prüfungsassistent (m/w/d) - Für alle, die mehr wollen als nur kontrollieren",Finance,Augsburg,,Finance,"„Prüfen mit Weitblick, gestalten mit Leidenschaft.“ Du hast ein gutes Verständnis für Zahlen und liebst es, komplexe Daten zu analysieren? In der Wirtschaftsprüfung erhältst du tiefe Einblicke in die finanziellen Strukturen und Abläufe von Unternehmen. Du prüfst Bilanzen, analysierst Geschäftsprozesse und hilfst, die wirtschaftliche Gesundheit von Unternehmen zu bewerten. Dabei baust du deine fachlichen Fähigkeiten kontinuierlich aus und sammelst wertvolle Erfahrung, die dir ein umfassendes Verständnis für betriebliche Zusammenhänge vermittelt. So kannst du deine berufliche Entwicklung gezielt vorantreiben und deine Expertise im Bereich der Unternehmensanalyse und -prüfung erweitern. Klingt nach deinem nächsten Schritt? Dann bewirb dich jetzt und starte durch in der Wirtschaftsprüfung! Tätigkeiten: Mitwirkung bei der Prüfung von Jahres- und Konzernabschlüssen sowie der Erstellung von Jahresabschlüssen für Unternehmen verschiedenster Branchen und Rechtsformen Unterstützung in der laufenden steuerlichen und betriebswirtschaftlichen Beratung Anfertigung von Steuererklärungen und Prüfung von Steuerbescheiden Beteiligung an Due-Diligence-Prüfungen Mitwirkung bei der Durchführung von Unternehmensbewertungen Requirements Abgeschlossenes Studium in Wirtschaftswissenschaften oder einem ähnlichen Bereich Gute Englischkenntnisse Sicherer Umgang mit Microsoft Office, idealerweise auch Erfahrung mit DATEV und/oder Caseware Selbstständige Arbeitsweise, Erfolgsorientierung und ein hohes Verantwortungsbewusstsein Freude an der Bearbeitung komplexer Themen und konzentriertem Arbeiten Benefits Leistungsbezogene Boni und Prämien Flexibilität bei den Arbeitszeiten sowie Möglichkeiten für Home-Office Regelmäßige Fort- und Weiterbildungen Moderne Arbeitsumgebung Angebote zur Förderung der Gesundheit Firmenevents und Teamaktivitäten Gute Anbindung an den öffentlichen Nahverkehr sowie kostenlose Parkmöglichkeiten Find Jobs in Germany on Arbeitnow"
Arbeitnow API,https://www.arbeitnow.com/jobs/companies/acemateai/product-developer-software-developer-berlin-311503,2026-05-18T15:00:52,acemate.ai,Product Developer / Software Developer,Software Development,Berlin,entry,Software Development,"acemate is building an AI learning &#x26; teaching platform for higher and further education institutions. We have strong traction, secured funding and are entering an exciting growth phase. We're looking for a passionate Product Engineer / Software Developer to drive our product forward and help us scale. About acemate Founded in 2024, acemate has quickly become the leading AI learning platform for higher and further education, trusted by top-tier institutions across four countries, including University of Cologne , WHU and the German Chambers of Commerce and Industry (IHKs) . Our Mission: Democratizing access to personalized learning. We don’t believe that AI will replace educators. Instead, we empower them to design and deliver personalized learning experiences at scale. Our Growth: We've raised pre-seed funding and are growing rapidly. While we focus on higher and further education in the DACH area today, we're already expanding into new regions and markets. Our Culture: We’re a young, driven team passionate about tackling the toughest challenges in education. We embrace builder culture and minimize scheduled meetings for ad-hoc discussions and maximized focus on coding and creating. Tasks What You'll Be Doing This role is all about taking ownership of what we build to solve real problems for our users. Working directly alongside the founders as a Product Engineer (Working Student) , you'll connect the dots between design, technical constraints, and what our users actually need. UX &#x26; Product Discovery: No massive spec documents: You will chat directly with users to identify their core pain points, then immediately start coding a solution. Code over mockups: Why spend hours on a Figma file when you can spin up a functional UI right away? We validate our ideas by putting live code in front of users, not static screens. Data-backed intuition: You will use PostHog for real-time tracking, combining that data with your own user empathy to find and resolve friction points immediately. Engineering &#x26; Development: Take full end-to-end ownership of features—from planning the architecture to coding and final deployment. Create and iterate on AI features that actually feel magical, steering clear of simple chatbot wrappers. Adopt a ""ship fast, learn faster"" mindset. You'll push updates rapidly to collect feedback and let data drive your next iterations. Past examples of what you might build: A daily quiz system inspired by Duolingo to keep students engaged with their university courses. Advanced AI pipelines that pull text and images from various document types, embedding those topics into knowledge graphs. A custom authorization engine built to manage increasing access complexity across multiple institutional environments. Tech Stack: Frontend: TypeScript, Next.js, Tailwind CSS Database: Supabase (PostgreSQL) Infrastructure: Cloudflare (Workers, Pages, Workflows, R2, KV), Google Cloud (Gemini, Cloud Run) Tools: Sentry, Langfuse, PostHog, Stripe If you don't know every technology listed here on day one, that's completely fine. We trust your ability to pick up new tools and frameworks quickly on the job. Requirements What We're Looking For Product Sense: You have a gut feeling for good UX/UI and can explain why a certain interface works or fails. User-First Mindset: You enjoy talking to users and translating their ""issues"" into solutions. Startup experience : You’re comfortable in fast-paced, evolving environments Ownership mindset: You think like a founder and treat the product like it’s yours. Commitment to excellence: You’re driven to go above and beyond when it matters. Curiosity and adaptability: Eager to learn new technologies and stay open to innovation. Balanced AI approach: You knew how to code before Cursor and Claude Code, but understand how to leverage them effectively Passion and purpose: High identification with our mission to transform education Benefits Benefits Competitive salary package with equity component "
Arbeitnow API,https://www.arbeitnow.com/jobs/companies/acemateai/software-engineer-intern-working-student-berlin-495917,2026-05-18T15:00:52,acemate.ai,Software Engineer (Intern / Working Student),Software Development,Berlin,"Working student, no experience required / student",Software Development,"acemate is building an AI learning &#x26; teaching platform for higher and further education institutions. We have strong traction, secured funding and are entering an exciting growth phase. We're looking for a passionate Full-Stack Developer (Intern / Working Student) to drive our product forward and help us scale. About acemate Founded in 2024, acemate has quickly become the leading AI learning platform for higher and further education, trusted by top-tier institutions across four countries, including University of Cologne , WHU and the German Chambers of Commerce and Industry (IHKs) . Our Mission: Democratizing access to personalized learning. We don’t believe that AI will replace educators. Instead, we empower them to design and deliver personalized learning experiences at scale. Our Growth: We've raised pre-seed funding and are growing rapidly. While we focus on higher and further education today, we're already expanding into new regions and markets. Our Culture: We’re a young, driven team passionate about tackling the toughest challenges in education. We embrace builder culture and minimize scheduled meetings for ad-hoc discussions and maximized focus on coding and creating. Meet the Team Antong (CEO): BCG, BMW &#x26; Antler background, leads business strategy, DJ by night Jan (CTO): NLP research, experience from SAP &#x26; N26, morning bike commuter Paul (CPO): Product expert with startup and education research background, devoted dog dad Emile (Fullstack): Ex-founder with product &#x26; AI background, ETH graduate, avid runner Anas (Fullstack): TypeScript specialist, functional programming enthusiast, chief photography officer Rohit (Fullstack): Specialist in modern large-scale web architecture, escape room explorer Ammar (Fullstack): Ex‑founder with webdev and blockchain experience, a learning violinist Hanna (Marketing): Social media &#x26; creative design, Scandinavian sports enthusiast turned Berlin city girl Tasks What You'll Do Here Your day-to-day will lean into your personal strengths and interests, spanning both product development and technical infrastructure. Because you're coming in as part of the core team, you'll directly influence our big-picture strategy, product roadmap, and technical architecture. Product Development: Work closely with Paul and Emile to launch new features and refine our existing ones Translate real user feedback into tangible product improvements Technical Leadership: Ensure our systems stay scalable and stable as more users join Constantly update our AI toolchains so we're always leveraging the latest AI advancements Develop on a modern tech foundation running mostly on Google Cloud and Cloudflare Examples of past projects to give you a sense of the work: A Duolingo-style daily quiz system that helps keep students actively learning their university course material Advanced AI pipelines built to extract images and text from various documents and embed them into knowledge graphs A custom authorization engine structured to handle the growing complexity of varied institutional setups Tech Stack: Frontend: TypeScript, Next.js, Tailwind CSS Database: Supabase (PostgreSQL) Infrastructure: Cloudflare (Workers, Pages, Workflows, R2, KV), Google Cloud (Gemini, Cloud Run) Tools: Sentry, Langfuse, PostHog, Stripe Don't worry if you aren't an expert in every technology listed here on day one. We trust your ability to get up to speed fast and learn new tools and frameworks on the job. Requirements What We're Looking For Ownership mindset: You think like a founder and treat the product like it’s yours Commitment to excellence: You’re driven to go above and beyond when it matters Curiosity and adaptability: Eager to learn new technologies and stay open to innovation Balanced AI approach: You knew how to code before Cursor and AI tools, but understand how to leverage them effectively Benefits Benefits Working in a small but driven team built around performance and learning Flexible environment with "
