source,source_url,date_posted,company,title,category,location,job_type,tags_raw,description
Arbeitnow API,https://www.arbeitnow.com/jobs/companies/atolls/senior-frontend-engineer-vuejs-berlin-385101,2026-07-03T06:45:24,Atolls,Senior Frontend Engineer (Vue.js) (m/f/x),,"Berlin, Berlin, Germany",,,"Atolls is the world's largest community-driven shopping platform, active in 20+ markets.&nbsp; We help millions make smarter spending decisions across discovery, evaluation, and (re-)purchase by connecting people with the right brands and retailers. Our 1,000+ team across 10 countries builds products used every day at global scale, where you'll have real ownership and see your impact. Want to shape the destinations people rely on to shop with confidence? Keep reading. About This Role: *]:pointer-events-auto R6Vx5W_threadScrollVars scroll-mb-[calc(var(--scroll-root-safe-area-inset-bottom,0px)+var(--thread-response-height))] scroll-mt-[calc(var(--header-height)+min(200px,max(70px,20svh)))]"" data-turn-id=""request-WEB:b717cf82-95c2-421d-a150-0c7755765e33-0"" data-turn-id-container=""request-WEB:b717cf82-95c2-421d-a150-0c7755765e33-0"" data-testid=""conversation-turn-2"" data-scroll-anchor=""false"" data-turn=""assistant""> We are looking for a Senior Frontend Engineer (Vue.js) to join our Engineering team in Berlin or working remotely from Germany. At Atolls, your role will be instrumental in helping us enhance Atolls' frontend platforms by migrating legacy systems to Vue 3 and improving performance, scalability, and user experience, empowering consumers to make informed and confident shopping decisions. As a key part of our team, you'll be directly involved in building and enhancing the digital destinations our users rely on throughout their shopping journeys. Your contributions will help shape how millions of consumers interact with our platforms, guiding them to make smart, fair, and rewarding choices. Our Benefits: At Atolls, we believe in nurturing both your professional and personal growth. Here's what you can expect: A culture that values personal and professional development, with internal mobility opportunities. A supportive and open-minded team that embraces diverse perspectives and innovative ideas. 32 days of paid vacation plus your birthday off, giving you the time you need to recharge. A flexible hybrid working scheme to balance work and life. Access to a learning budget and internal training to help you grow in your role. Mental health coaching to support your well-being. Regular global and local get-togethers to celebrate successes and build connections. The possibility of taking a sabbatical after three years with the company. A cloud-based company setup, providing flexibility and collaboration opportunities no matter where you are. *These are global benefits that apply to all employees, with additional local perks based on your location. Responsibilities: In this role, you will: Develop and maintain reusable, high-quality Vue.js components and user interfaces. Implement the migration of our codebase from legacy systems like Twig and Vue 2 to Vue 3. Integrate with GraphQL APIs for efficient data fetching and seamless front-end to back-end communication. Oversee code quality through rigorous testing, adherence to best practices, and clean architecture. Collaborate with designers, product managers, and backend engineers in an agile team environment. &nbsp; Your Profile: We're looking for someone with experience building responsive web applications with Vue.js (2/3), including component development, framework migrations (Vue 2 → Vue 3) and GraphQL API integration for scalable e-commerce platforms, who is dedicated to creating exceptional user experiences and driving innovation. You have 6+ years of experience as a Software Developer. Technical Skills: Vue.js (2/3), TypeScript, JavaScript, CSS, Webpack, Vite, Git, GraphQL. Soft Skills: Collaboration, Problem-solving, Team communication, Continuous learning, Code documentation, Cross-functional alignment. Fluent in English with excellent communication skills. Our hiring process : TA Call : Meet one of our Talent Experts and get to know Atolls better. Technical Round : Focus on the technical aspects of the role (Through a Live Case) , and meet your potential manager. Final Round"
Arbeitnow API,https://www.arbeitnow.com/jobs/companies/atolls/senior-java-backend-engineer-berlin-40659,2026-07-03T06:45:24,Atolls,Senior Java Backend Engineer (m/f/x),,"Berlin, Berlin, Germany",,,"Atolls is the world's largest community-driven shopping platform, active in 20+ markets.&nbsp; We help millions make smarter spending decisions across discovery, evaluation, and (re-)purchase by connecting people with the right brands and retailers. Our 1,000+ team across 10 countries builds products used every day at global scale, where you'll have real ownership and see your impact. Want to shape the destinations people rely on to shop with confidence? Keep reading. About This Role: We are looking for a Senior Java Backend Engineer to join our growing engineering team in Berlin or working remotely from Germany .You will play a key role in designing, building, and scaling high-performance backend systems using modern Java technologies and cloud-native architectures. This role is ideal for someone who enjoys working on complex systems, cares deeply about code quality and has a strong architectural mindset. Our Benefits: At Atolls, we believe in nurturing both your professional and personal growth. Here's what you can expect: A culture that values personal and professional development, with internal mobility opportunities. A supportive and open-minded team that embraces diverse perspectives and innovative ideas. 32 days of paid vacation plus your birthday off, giving you the time you need to recharge. A flexible hybrid working scheme to balance work and life. Access to a learning budget and internal training to help you grow in your role. Mental health coaching to support your well-being. Regular global and local get-togethers to celebrate successes and build connections. The possibility of taking a sabbatical after three years with the company. A cloud-based company setup, providing flexibility and collaboration opportunities no matter where you are. *These are global benefits that apply to all employees, with additional local perks based on your location. Responsibilities: As a Senior Java Backend Engineer , you will: Design , develop, and maintain scalable backend services using&nbsp; Java 17 or other recent versions ( 11+ ). Build and evolve microservice-based and event-driven architectures Develop APIs using GraphQL Work with Spring Boot and Spring Reactive (WebFlux) Design and optimize data models using MySQL and NoSQL databases (DynamoDB or MongoDB) Ensure high performance, reliability, and scalability of backend systems Write clean, maintainable, and well-tested code Implement performance testing and end-to-end testing Collaborate closely with product managers, frontend engineers, and DevOps Contribute to architectural decisions and technical best practices Mentor junior engineers and provide technical leadership when needed Collaborate on AI-enabled features, including prompt engineering and backend integrations &nbsp; Your Profile: 8+ years of professional experience in backend development Strong expertise in Java 17 or other recent versions ( 11+ ) Extensive experience with Spring Boot and Spring Reactive Solid knowledge of MySQL and experience with NoSQL databases (DynamoDB or MongoDB) Hands-on experience with Kubernetes Strong understanding of microservice architecture and event-driven systems Experience building and consuming GraphQL APIs Proven experience with performance optimization and testing Experience with end-to-end testing strategies Experience with prompt engineering for AI-powered applications Excellent understanding of software design and architectural patterns Ability to design elegant, scalable, and maintainable system architectures Strong communication skills and excellent English proficiency &nbsp; Bonus points:&nbsp; Cloud experience (AWS/GCP/Azure) Experience with CI/CD pipelines Experience building AI-integrated backend systems Our hiring process : TA Call : Meet one of our Talent Experts and get to know Atolls better. Technical Round : Focus on the technical aspects of the role (Through a Live Case) , and meet your potential manager. Final Round : Meet other Atollians 🏝️ It varies from 1 to 3 "
Arbeitnow API,https://www.arbeitnow.com/jobs/companies/atolls/senior-java-backend-engineer-munich-419252,2026-07-03T06:45:24,Atolls,Senior Java Backend Engineer (m/f/x),,"Munich, Bavaria, Germany",,,"Atolls is the world's largest community-driven shopping platform, active in 20+ markets.&nbsp; We help millions make smarter spending decisions across discovery, evaluation, and (re-)purchase by connecting people with the right brands and retailers. Our 1,000+ team across 10 countries builds products used every day at global scale, where you'll have real ownership and see your impact. Want to shape the destinations people rely on to shop with confidence? Keep reading. About This Role: We are looking for a Senior Java Backend Engineer to join our growing engineering team in Munich&nbsp;or working remotely from Germany . You will play a key role in designing, building, and scaling high-performance backend systems using modern Java technologies and cloud-native architectures. This role is ideal for someone who enjoys working on complex systems, cares deeply about code quality and has a strong architectural mindset. Our Benefits: At Atolls, we believe in nurturing both your professional and personal growth. Here's what you can expect: A culture that values personal and professional development, with internal mobility opportunities. A supportive and open-minded team that embraces diverse perspectives and innovative ideas. 32 days of paid vacation plus your birthday off, giving you the time you need to recharge. A flexible hybrid working scheme to balance work and life. Access to a learning budget and internal training to help you grow in your role. Mental health coaching to support your well-being. Regular global and local get-togethers to celebrate successes and build connections. The possibility of taking a sabbatical after three years with the company. A cloud-based company setup, providing flexibility and collaboration opportunities no matter where you are. *These are global benefits that apply to all employees, with additional local perks based on your location. Responsibilities: As a Senior Java Backend Engineer , you will: Design , develop, and maintain scalable backend services using&nbsp; Java 17 or other recent versions ( 11+ ). Build and evolve microservice-based and event-driven architectures Develop APIs using GraphQL Work with Spring Boot and Spring Reactive (WebFlux) Design and optimize data models using MySQL and NoSQL databases (DynamoDB or MongoDB) Ensure high performance, reliability, and scalability of backend systems Write clean, maintainable, and well-tested code Implement performance testing and end-to-end testing Collaborate closely with product managers, frontend engineers, and DevOps Contribute to architectural decisions and technical best practices Mentor junior engineers and provide technical leadership when needed Collaborate on AI-enabled features, including prompt engineering and backend integrations &nbsp; Your Profile: 8+ years of professional experience in backend development Strong expertise in Java 17 or other recent versions ( 11+ ) Extensive experience with Spring Boot and Spring Reactive Solid knowledge of MySQL and experience with NoSQL databases (DynamoDB or MongoDB) Hands-on experience with Kubernetes Strong understanding of microservice architecture and event-driven systems Experience building and consuming GraphQL APIs Proven experience with performance optimization and testing Experience with end-to-end testing strategies Experience with prompt engineering for AI-powered applications Excellent understanding of software design and architectural patterns Ability to design elegant, scalable, and maintainable system architectures Strong communication skills and excellent English proficiency &nbsp; Bonus points:&nbsp; Cloud experience (AWS/GCP/Azure) Experience with CI/CD pipelines Experience building AI-integrated backend systems Our hiring process : TA Call : Meet one of our Talent Experts and get to know Atolls better. Technical Round : Focus on the technical aspects of the role (Through a Live Case) , and meet your potential manager. Final Round : Meet other Atollians 🏝️ It varies from 1"
Arbeitnow API,https://www.arbeitnow.com/jobs/companies/quantolux-innovation-gmbh/kalibrations-applikationsingenieurin-kleve-38269,2026-07-03T06:30:31,Quantolux Innovation GmbH,Kalibrations- / Applikationsingenieur:in (m/w/d),Engineering,Kleve,,Engineering,"2016 gründeten wir die QuantoLux GmbH mit einem klaren Ziel: die optische Emissions-Spektrometrie (OES) neu denken. 2021 kam die QuantoLux Innovation GmbH dazu, in der unser Flaggschiff-Produkt entsteht: der QLX9 , ein Schlacken-Schnellanalysator für die Stahl- und Metallindustrie. Das QLX9 analysiert Schlacken in unter 20 Sekunden, ohne Probenvorbereitung. Betriebe weltweit nutzen ihn, um Prozesse zu optimieren, Ressourcen zu sparen und Technologien zu ersetzen, die seit Jahrzehnten Standard waren. Wir sind ein kleines, engagiertes Team und wachsen. Für das QLX9 suchen wir jemanden, der die Brücke zwischen Technik und Anwendung baut. Aufgaben Die Kalibrierung ist das Herzstück des QLX9. Sie entscheidet, ob ein Gerät beim Kunden auf Anhieb funktioniert. Als Kalibrations- und Applikationsingenieur:in sind Sie dafür verantwortlich, dass unsere Systeme korrekte Ergebnisse liefern und für die spezifischen Anforderungen jedes Kunden maßgeschneidert sind. Kalibrierungen für den QLX9 installieren, kontrollieren, anpassen und optimieren. Mittelfristig auch neue Kalibrationen für neue Anwendungsfelder entwickeln Bestehende Kalibrationen auf neue Materialien und Prozesse erweitern Kunden weltweit bei Inbetriebnahme und im laufenden Betrieb unterstützen, per Remote-Service und vor Ort Qualitätssicherung vor der Auslieferung Schnittstelle zwischen Produktion, Vertrieb und unseren Kunden Qualifikation Es gibt keinen perfekten Hintergrund für diese Stelle. Wir haben erfolgreiche Kolleg:innen aus der Physik, Elektrotechnik, Chemie und dem Maschinenbau, genauso wie Quereinsteiger, die einfach anpacken wollten. Must have Ein Gespür für physikalisch-chemische Zusammenhänge Sehr gute Deutschkenntnisse in Wort und Schrift (B2) Sehr gute Englischkenntnisse. Unsere Kunden und Partner sind weltweit verteilt, Englisch ist Arbeitsalltag Nice to have Erfahrung in Spektrometrie, Analytik oder Labortechnik Kenntnisse in Metallurgie oder Werkstoffanalytik Programmierkenntnisse Benefits **Jahresgehalt **Abhängig von Ihrer Erfahrung, transparent verhandelt, zusätzlich geldwerte Benefits. 🏖️**30 Tage Urlaub **Urlaubsplanung flexibel nach Absprache 🎓**Bis zu 6 Monate Einarbeitung **Bis zu 2 Jahre Training on the Job ⚡**Echtes Start-up **Flache Hierarchien, kurze Entscheidungswege, keine Konzernfiliale 🌍**Internationale Projekte **Von Europa über Asien bis Amerika 🔩**Wir sind Hardware **KI kann Analytik unterstützen, aber kein Gerät kalibrieren und kein System in einem Stahlwerk installieren. Was wir bauen, bleibt physisch und unverzichtbar. 🌱 Impact durch Portfoliobreite KI wird einzelne Anwendungen verändern, aber nicht alle gleichzeitig. Wir bauen gezielt ein breites Kunden- und Applikationsportfolio auf, quer über viele Industrien der Prozesswelt. Wer mit uns wächst, wächst in eine Technologie hinein, die sich durch Vielfalt selbst absichert. 🌿 Ressourcen schonen, global Unsere Technologie wird dort eingesetzt, wo Rohstoffe gewonnen, veredelt und in neue Werkstoffe verwandelt werden. Jede präzisere Messung bedeutet weniger Ausschuss, weniger Energieverbrauch, weniger Abfall. nteresse? Ein kurzer Lebenslauf reicht. Oder eine Kontaktanfrage über LinkedIn, wenn Ihr Profil aussagekräftig ist. Kein Anschreiben nötig. Schlagen Sie mir direkt einen Termin für ein erstes Gespräch per Webkonferenz vor. Ich richte mich nach Ihnen.QuantoLux Innovation GmbH · Kleve, NRW Alexander Schlemminger Mo–Fr 8:30–17:00 Uhr auf Anfrage auch abends &#x26; am Wochenende 📞 0163 176 89 50 Find more English Speaking Jobs in Germany on Arbeitnow"
Arbeitnow API,https://www.arbeitnow.com/jobs/companies/taxtalentede/steuerberater-in-euskirchen-auf-wunsch-mit-partnerperspektive-gesucht-mindestens-90000eur-278337,2026-07-03T06:30:31,Taxtalente.de,"Steuerberater (m/w/d) in Euskirchen, auf Wunsch mit Partnerperspektive, gesucht - mindestens 90.000€",Directors,Euskirchen,,Directors; Chief Executives,"TaxTalente ist die Nr. 1 Job-Matching Plattform für Jobsuchende in der Steuerberatung. Sie suchen eine positive berufliche Veränderung? Sie möchten den nächsten Schritt in Ihrer Karriere gehen und streben möglicherweise sogar eine Partnerschaft in einer zukunftsorientierten Kanzlei an? Sie möchten endlich wieder in einem positiven Arbeitsumfeld arbeiten, in dem Sie finanziell und persönlich wertgeschätzt werden? Sie suchen nach Tätigkeiten, die Sie auch wirklich weiterbringen? Sofern Sie sich in mindestens einem der genannten Punkte wiederfinden, sollten Sie sich bei uns melden. Wir haben die attraktivsten Arbeitgeber der Steuerberatungsbranche in unserem Netzwerk und bringen zusammen, was zusammengehört. Grenzenlose Entwicklungschancen mit Partnermöglichkeiten, vielschichtige Tätigkeitsbereiche, Gehälter wie in der Industrie und vieles mehr – melden Sie sich bei uns und wir unterstützen Sie auf Ihrem weiteren Karriereweg! Derzeit suchen wir nach einem Steuerberater (m/w/d) für eine unserer Partner-Kanzleien in Euskirchen Bei Rückfragen kannst du dich gerne jederzeit (auch nach deinem Feierabend) direkt telefonisch an Herrn Becker-Koch über folgende Nummer wenden: 015901431130 Aufgaben Wir bringen zusammen, was zusammengehört. Dabei spielt das passende Tätigkeitsprofil natürlich eine entscheidende Rolle. Bei unserer Partnerkanzlei können Sie sich Ihren Aufgabenbereich auf Basis Ihrer persönlichen Stärken und Schwächen selbst zusammenstellen. Erstellung und Review von Jahresabschlüssen Erstellung von Steuererklärungen für Personen- und Kapitalgesellschaften Steuerliche Sonderberatungsprojekte auf Basis individueller Qualifikationen B. in den Bereichen der Erbschaftsteuer oder des Umwandlungssteuerrechts Begleitung von Betriebsprüfungen Teamleitung und Personalverantwortung (optional) Weitere individuell wählbare Tätigkeitsbereiche , die Ihnen Freude bringen Qualifikation Am Ende sollte es für beide Seiten passen. Deshalb wäre es gut, wenn Sie sich in den folgenden Punkten wiederfinden. Kommunikative Art und Freude am Austausch mit Mandanten Sorgfältige , effiziente und gewissenhafte Arbeitsweise Offen für eine digitale Arbeitsweise Führungsverständnis und Verantwortungsbewusstsein gegenüber Mitarbeitern (optional) Ein erfolgreich abgeschlossenes Steuerberaterexamen Leidenschaft für steuerliche Themen Benefits Sie haben genug von 0815 Benefits, von denen Sie nicht wirklich profitieren? Dann sollten Sie einen Blick auf die nachfolgenden Benefits werfen. Außerordentliche Vergütung von 90.000 € bis 130.000 € / Jahr, auf Wunsch auch Partnerperspektive Flexible Gestaltung der Arbeitszeiten sowie die Option auf Home-Office Nettolohnoptimierung mit monatlichen 50,00€ Sachbezugsgutscheinen Umfangreiche Unterstützung bei Weiterbildungsmaßnahmen wie z.B. Fachberater Qualifikationen Modernste Ausstattung mit digitalen Prozessen Starker Teamzusammenhalt und regelmäßige Teamevents Schnell, unkompliziert und effizient Ihren Traumjob finden – ein Versprechen an Sie, dass wir aufgrund unseres selektiven, breit gefächerten und deutschlandweiten Kanzleinetzwerks halten werden. lhre Vorteile mit uns auf einen Blick: Sie führen keine unsinnigen Bewerbungsgespräche mehr, bei denen Sie während des Bewerbungsprozesses merken, dass es (bspw. wegen des Gehalts) sowieso nicht passt - wir klären vor Ihrem Bewerbungsgespräch all Ihre mit uns besprochenen Kriterien mit der Kanzlei ab. Wir führen Ihre Gehaltsverhandlungen und kennen die Gehaltsstrukturen der Branche dabei bestens. 100% Anonymität – solange Sie uns nicht das „Go“ geben und einem Kennenlernen mit Ihrem neuen potentiellen Arbeitgeber zustimmen, erfährt niemand von Ihrem Namen oder Ihren bisherigen Arbeitgebern – Ihre Ihnen wichtigen Kriterien können wir auch zunächst anonym mit unseren Partnerkanzleien klären. Attraktive Kanzleien – die Kanzleien in unserem breit gefächerten Kanzleinetzwerk sind selektiv ausgewählt und heben sich klar von “normalen” Kanzleien ab (z.B. hinsichtlich der Vergütung"
Arbeitnow API,https://www.arbeitnow.com/jobs/companies/taxtalentede/steuerberater-in-reken-auf-wunsch-mit-partnerperspektive-gesucht-mindestens-90000eur-36952,2026-07-03T06:30:30,Taxtalente.de,"Steuerberater (m/w/d) in Reken, auf Wunsch mit Partnerperspektive, gesucht - mindestens 90.000€",Directors,Reken,,Directors; Chief Executives,"TaxTalente ist die Nr. 1 Job-Matching Plattform für Jobsuchende in der Steuerberatung. Sie suchen eine positive berufliche Veränderung? Sie möchten den nächsten Schritt in Ihrer Karriere gehen und streben möglicherweise sogar eine Partnerschaft in einer zukunftsorientierten Kanzlei an? Sie möchten endlich wieder in einem positiven Arbeitsumfeld arbeiten, in dem Sie finanziell und persönlich wertgeschätzt werden? Sie suchen nach Tätigkeiten, die Sie auch wirklich weiterbringen? Sofern Sie sich in mindestens einem der genannten Punkte wiederfinden, sollten Sie sich bei uns melden. Wir haben die attraktivsten Arbeitgeber der Steuerberatungsbranche in unserem Netzwerk und bringen zusammen, was zusammengehört. Grenzenlose Entwicklungschancen mit Partnermöglichkeiten, vielschichtige Tätigkeitsbereiche, Gehälter wie in der Industrie und vieles mehr – melden Sie sich bei uns und wir unterstützen Sie auf Ihrem weiteren Karriereweg! Derzeit suchen wir nach einem Steuerberater (m/w/d) für eine unserer Partner-Kanzleien in Reken Bei Rückfragen kannst du dich gerne jederzeit (auch nach deinem Feierabend) direkt telefonisch an Herrn Becker-Koch über folgende Nummer wenden: 015901431130 Aufgaben Wir bringen zusammen, was zusammengehört. Dabei spielt das passende Tätigkeitsprofil natürlich eine entscheidende Rolle. Bei unserer Partnerkanzlei können Sie sich Ihren Aufgabenbereich auf Basis Ihrer persönlichen Stärken und Schwächen selbst zusammenstellen. Erstellung und Review von Jahresabschlüssen Erstellung von Steuererklärungen für Personen- und Kapitalgesellschaften Steuerliche Sonderberatungsprojekte auf Basis individueller Qualifikationen B. in den Bereichen der Erbschaftsteuer oder des Umwandlungssteuerrechts Begleitung von Betriebsprüfungen Teamleitung und Personalverantwortung (optional) Weitere individuell wählbare Tätigkeitsbereiche , die Ihnen Freude bringen Qualifikation Am Ende sollte es für beide Seiten passen. Deshalb wäre es gut, wenn Sie sich in den folgenden Punkten wiederfinden. Kommunikative Art und Freude am Austausch mit Mandanten Sorgfältige , effiziente und gewissenhafte Arbeitsweise Offen für eine digitale Arbeitsweise Führungsverständnis und Verantwortungsbewusstsein gegenüber Mitarbeitern (optional) Ein erfolgreich abgeschlossenes Steuerberaterexamen Leidenschaft für steuerliche Themen Benefits Sie haben genug von 0815 Benefits, von denen Sie nicht wirklich profitieren? Dann sollten Sie einen Blick auf die nachfolgenden Benefits werfen. Außerordentliche Vergütung von 90.000 € bis 130.000 € / Jahr, auf Wunsch auch Partnerperspektive Flexible Gestaltung der Arbeitszeiten sowie die Option auf Home-Office Nettolohnoptimierung mit monatlichen 50,00€ Sachbezugsgutscheinen Umfangreiche Unterstützung bei Weiterbildungsmaßnahmen wie z.B. Fachberater Qualifikationen Modernste Ausstattung mit digitalen Prozessen Starker Teamzusammenhalt und regelmäßige Teamevents Schnell, unkompliziert und effizient Ihren Traumjob finden – ein Versprechen an Sie, dass wir aufgrund unseres selektiven, breit gefächerten und deutschlandweiten Kanzleinetzwerks halten werden. lhre Vorteile mit uns auf einen Blick: Sie führen keine unsinnigen Bewerbungsgespräche mehr, bei denen Sie während des Bewerbungsprozesses merken, dass es (bspw. wegen des Gehalts) sowieso nicht passt - wir klären vor Ihrem Bewerbungsgespräch all Ihre mit uns besprochenen Kriterien mit der Kanzlei ab. Wir führen Ihre Gehaltsverhandlungen und kennen die Gehaltsstrukturen der Branche dabei bestens. 100% Anonymität – solange Sie uns nicht das „Go“ geben und einem Kennenlernen mit Ihrem neuen potentiellen Arbeitgeber zustimmen, erfährt niemand von Ihrem Namen oder Ihren bisherigen Arbeitgebern – Ihre Ihnen wichtigen Kriterien können wir auch zunächst anonym mit unseren Partnerkanzleien klären. Attraktive Kanzleien – die Kanzleien in unserem breit gefächerten Kanzleinetzwerk sind selektiv ausgewählt und heben sich klar von “normalen” Kanzleien ab (z.B. hinsichtlich der Vergütung, Ben"
