job_id,date_posted,source,company,title,category,raw_category,seniority,location,job_type,skills,tags_raw,salary_min_usd,salary_max_usd,salary_mid_usd,demand_index,scarcity_score,time_to_fill_days_proxy,application_volume_proxy,source_url,description_preview
raw-0126,2026-06-15,Arbeitnow API,Lionflence,Trainee Artist Manager / Influencer Manager (m/w/d),Software & Engineering,Training,Internship/Student,Mülheim,hilfstätigkeit / student,AI; Social Media,Training; Development,39688,57112,48400,90.3,38,30.3,136,https://www.arbeitnow.com/jobs/companies/lionflence/trainee-artist-manager-influencer-manager-mulheim-213044,"Was wir Dir bieten: Eine spannende Herausforderung, in der du dich weiterentwickeln kannst, rundum den Bereich Artistmanagement Medien/Social Media, Influencer Marketing und den dazugehörigen Technologien (Software Syste"
raw-0127,2026-06-15,Arbeitnow API,Lionflence,Trainee Artist Manager / Influencer Manager (m/w/d),Software & Engineering,Marketing and Communication,Internship/Student,Berlin,hilfstätigkeit / student,Communication; Social Media,Marketing and Communication,39688,57112,48400,83.2,38,30.3,136,https://www.arbeitnow.com/jobs/companies/lionflence/trainee-artist-manager-influencer-manager-berlin-56331,"Was wir Dir bieten: Eine spannende Herausforderung, in der du dich weiterentwickeln kannst, rundum den Bereich Artistmanagement Medien/Social Media, Influencer Marketing und den dazugehörigen Technologien (Software Syste"
raw-0128,2026-06-15,Arbeitnow API,Lionflence,Junior Artist Manager / Influencer Manager (m/w/d),Software & Engineering,Marketing and Communication,Senior/Lead,Mülheim,,Communication; Social Media,Marketing and Communication,97416,140184,118800,83.2,48,38.6,123,https://www.arbeitnow.com/jobs/companies/lionflence/junior-artist-manager-influencer-manager-mulheim-14846,"Was wir Dir bieten: Eine spannende Herausforderung, in der du dich weiterentwickeln kannst, rundum den Bereich Artistmanagement Medien/Social Media, Influencer Marketing und den dazugehörigen Technologien (Software Syste"
raw-0129,2026-06-15,Arbeitnow API,Lionflence,Junior Artist Manager / Influencer Manager (m/w/d),Software & Engineering,Marketing and Communication,Senior/Lead,Berlin,,Communication; Social Media,Marketing and Communication,97416,140184,118800,83.2,48,38.6,123,https://www.arbeitnow.com/jobs/companies/lionflence/junior-artist-manager-influencer-manager-berlin-251720,"Was wir Dir bieten: Eine spannende Herausforderung, in der du dich weiterentwickeln kannst, rundum den Bereich Artistmanagement Medien/Social Media, Influencer Marketing und den dazugehörigen Technologien (Software Syste"
raw-0130,2026-06-15,Arbeitnow API,Lionflence,Artist Manager / Influencer Manager (m/w/d) BERLIN,Software & Engineering,Marketing and Communication,Senior/Lead,Berlin,,Communication; Social Media,Marketing and Communication,97416,140184,118800,83.2,48,38.6,123,https://www.arbeitnow.com/jobs/companies/lionflence/artist-manager-influencer-manager-berlin-499944,"Was wir Dir bieten: Eine spannende Herausforderung, in der du dich weiterentwickeln kannst, rundum den Bereich Artistmanagement Medien/Social Media, Influencer Marketing und den dazugehörigen Technologien (Software Syste"
raw-0131,2026-06-15,Arbeitnow API,Lionflence,Artist Manager / Influencer Manager (m/w/d),Software & Engineering,Marketing and Communication,Senior/Lead,Mülheim,,Communication; Social Media,Marketing and Communication,97416,140184,118800,83.2,48,38.6,123,https://www.arbeitnow.com/jobs/companies/lionflence/artist-manager-influencer-manager-mulheim-221696,"Was wir Dir bieten: Eine spannende Herausforderung, in der du dich weiterentwickeln kannst, rundum den Bereich Artistmanagement Medien/Social Media, Influencer Marketing und den dazugehörigen Technologien (Software Syste"
raw-0132,2026-06-15,Arbeitnow API,AdEx Beratungs GmbH,Werkstudent HR Operations (all genders),Software & Engineering,Remote,Internship/Student,Hamburg,Working student,HR; Operations; Excel; Agile,Remote; HR,39688,57112,48400,62.1,38,30.3,136,https://www.arbeitnow.com/jobs/companies/adex-beratungs-gmbh/werkstudent-hr-operations-all-genders-hamburg-461446,WIR SIND… AdEx Partners ist ein eingeschworenes Team erfahrener Beraterinnen und Berater. Wir begleiten unsere Kunden bei ihren komplexen Business Transformationen rund um Digitalisierung und IT. Als Trusted Advisors sin
raw-0133,2026-06-15,Arbeitnow API,Werberitter GmbH,Projektmanager B2B Werbetechnik (m/w/d) - Kunden. Kalkulation. Struktur.,Product & Project Management,Customer Service,Senior/Lead,Berlin,berufserfahren,Customer Service,Customer Service,84132,121068,102600,56.9,48,38.6,123,https://www.arbeitnow.com/jobs/companies/werberitter-gmbh/projektmanager-b2b-werbetechnik-kunden-kalkulation-struktur-berlin-472736,"Tschüss Konzerndenke, Hallo Werberitter! Du liebst es, Projekte sauber aufzusetzen, Kunden kompetent zu beraten und aus Anforderungen klare, wirtschaftliche Angebote zu entwickeln? Dann bist Du bei uns genau richtig. Wir"
raw-0134,2026-06-15,Arbeitnow API,ON-POINT Connect GmbH,Senior Snowflake Consultant (m/w/d) - German speaking,Data & AI,Consulting,Senior/Lead,Düsseldorf,teamleitung,Data Engineering; Security; SQL; AI,Consulting; Engineering,94095,135405,114750,70,69,47.7,95,https://www.arbeitnow.com/jobs/companies/on-point-connect-gmbh/senior-snowflake-consultant-german-speaking-dusseldorf-215386,"Karrierechance als Senior Snowflake Consultant bei ON-POINT Connect! Du willst moderne Datenplattformen nicht nur technisch mitgestalten, sondern anspruchsvolle Snowflake-Projekte aktiv steuern, Teams fachlich führen und"
raw-0135,2026-06-15,Arbeitnow API,Swiss Life Select,Senior Sales Consultant - Vollzeit (German Speaking),Finance & Business,Finance,Senior/Lead,Bad Krozingen,"Full-time fixed-term, mid",Finance; Onboarding; Sales,Finance; high school or equivalent,75276,108324,91800,72.9,48,38.6,123,https://www.arbeitnow.com/jobs/companies/swiss-life-select/senior-sales-consultant-vollzeit-german-speaking-bad-krozingen-218725,"Du willst Ergebnisse, keine Diskussionen? Du arbeitest strukturiert, hast ein klares Verständnis für saubere Prozesse und weißt, wie wichtig Verlässlichkeit im Vertrieb ist? Dann bist du bei uns genau richtig! Wir suchen"
raw-0136,2026-06-15,Arbeitnow API,idealo internet GmbH,Senior Software Engineer (m|w|d),Data & AI,Information technology,Senior/Lead,Berlin,"Full-time permanent, experienced",Data Engineering; TypeScript; Backend; Testing; Python; Design; Cloud; CI/CD; Java; SQL; AWS; CRM,Information technology; professional,94095,135405,114750,65.5,85,54.5,75,https://www.arbeitnow.com/jobs/companies/idealo-internet-gmbh/senior-software-engineer-mwd-berlin-453477,"Team CRM Tech is responsible for delivering the technical infrastructure that enables idealo's CRM campaigns. We build and maintain systems that handle identity resolution, subscriptions, data flows, and message delivery"
raw-0137,2026-06-15,Arbeitnow API,Peter Stenmans,Teamleiter (m/w/d) im Finanzvertrieb (German Speaking),Finance & Business,Finance,Mid-level,Berlin,"Full-time permanent, mid",Finance; Onboarding,Finance; vocational,55760,80240,68000,69.2,38,30.3,136,https://www.arbeitnow.com/jobs/companies/peter-stenmans/teamleiter-im-finanzvertrieb-german-speaking-berlin-354315,"Du bist eine Führungspersönlichkeit, die Verlässlichkeit, klare Strukturen und Teamgeist lebt? Übernimm Verantwortung, optimiere Prozesse und führe dein Team zu Höchstleistungen. Begeistere unsere Kunden mit ehrlicher Be"
raw-0138,2026-06-15,Arbeitnow API,Jan Pethe Interim Management & Consulting GmbH - JPIMC®,Kreditanalyst (m/w/d),Software & Engineering,Credit Analysis,Mid-level,Frankfurt am Main,berufserfahren,Finance; HR,Credit Analysis,72160,103840,88000,70.3,38,30.3,136,https://www.arbeitnow.com/jobs/companies/jan-pethe-interim-management-consulting-gmbh-jpimc/kreditanalyst-frankfurt-am-main-81855,"Für unseren Mandanten, einem internationalen Bankhaus, suchen wir eine/n versierten Kreditanalysten (m/w/d) am Standort Frankfurt am Main in unbefristeter Festanstellung. Aufgaben Kreditprüfung Analyse der Kreditwürdigke"
raw-0139,2026-06-15,Arbeitnow API,Alphapet Ventures GmbH,Senior People Operations Manager (m/w/d),Software & Engineering,HR,Senior/Lead,Munich,"Contract, berufserfahren",HR; Operations; REST,HR,97416,140184,118800,65.1,48,38.6,123,https://www.arbeitnow.com/jobs/companies/alphapet-ventures-gmbh/senior-people-operations-manager-munich-1055,"Deine Aufgaben Standort: München, hybrid (2 Tage/Woche im Office, Rest remote) · Befristet bis Ende Februar 2028 · 30–40 Stunden/Woche Für unser People &#x26; Organization Team in München suchen wir einen Senior People O"
raw-0140,2026-06-15,Arbeitnow API,AMETRAS informatik AG,IT Supporter (m/w/d),Software & Engineering,Helpdesk,Unspecified,Ravensburg,,Operations; Security; SQL,Helpdesk,66387,95533,80960,64.7,46,33.8,125,https://www.arbeitnow.com/jobs/companies/ametras-informatik-ag/it-supporter-ravensburg-133029,Das bewegt uns AMETRAS vision ist eine stark wachsende Tochter innerhalb der AMETRAS Gruppe. Acht Tochterunternehmen und mehr als 240 Mitarbeiter engagieren sich europaweit in der Entwicklung und Umsetzung zukunftsweisen
raw-0141,2026-06-15,Arbeitnow API,Esencia Foods,Werksstudent (m/w/d) Marketing und Kommunikation (5-10h/Woche),Cybersecurity & IT,Marketing and Communication,Internship/Student,Frankfurt am Main,,Communication; Social Media; Operations; Security; Startup; Sales; CRM,Marketing and Communication,36080,51920,44000,73.1,51,35.9,119,https://www.arbeitnow.com/jobs/companies/esencia-foods/werksstudent-marketing-und-kommunikation-5-10h-woche-frankfurt-am-main-159848,"!! FLUENT GERMAN IS A MUST !! THE JOB IS IN PERSON IN FRANKFURT !! KULT FARM develops and produces a new food from mycelium solid state fermentation. As a venture-backed business, we are pioneering this approach. Our mis"
raw-0142,2026-06-15,Arbeitnow API,Diebold Nixdorf Germany,Senior Customer Success Manager (m/w/d),Product & Project Management,Customer Service,Senior/Lead,Paderborn,teamleitung,Customer Service; Sales,Customer Service,84132,121068,102600,68.6,48,38.6,123,https://www.arbeitnow.com/jobs/companies/diebold-nixdorf-germany/senior-customer-success-manager-paderborn-221558,"Erwarten Sie mehr. Stärken Sie Ihr Netzwerk. Unsere Teams automatisieren, digitalisieren und transformieren die Art und Weise, wie mehr als 75 Millionen Menschen rund um den Globus in dieser vernetzten verbraucherzentrie"
raw-0143,2026-06-15,Arbeitnow API,IDKOM Networks GmbH,IT-Consultant Citrix (m/w/d),Software & Engineering,Consulting,Mid-level,Kempten,berufserfahren,Security; Cloud,Consulting; Engineering,72160,103840,88000,87.3,54,37.2,115,https://www.arbeitnow.com/jobs/companies/idkom-networks-gmbh/it-consultant-citrix-kempten-203190,ID.KOM – UNSER HERZ SCHLÄGT DIGITAL! Lassen spannende IT-Projekte und neue Technologien auch Dich pulsieren? Kannst Du Dir etwas unter „selbständiger Teamarbeit“ vorstellen? Wünschst Du Dir einen modernen und flexiblen A
raw-0144,2026-06-15,Arbeitnow API,coolback GmbH,IT Systemadministrator (m/w/d),Software & Engineering,Applications Administration,Mid-level,Hoppegarten,berufserfahren,Python; JavaScript; API; Cloud,Applications Administration,72160,103840,88000,93.5,62,40.7,104,https://www.arbeitnow.com/jobs/companies/coolback-gmbh/it-systemadministrator-hoppegarten-55446,"Wir suchen dich – einen engagierten IT-Systemadministrator (m/w/d), der mehr möchte als nur Kabel sortieren. In dieser verantwortungsvollen Rolle verstärkst du unser IT-Team und unterstützt uns aktiv bei der Administrati"
raw-0145,2026-06-15,Arbeitnow API,KNUTH Werkzeugmaschinen GmbH,Servicetechniker Werkzeugmaschinen (m/w/d),Software & Engineering,Engineering,Unspecified,Bonn,,Python; JavaScript; API; Cloud,Engineering,66387,95533,80960,93.5,62,40.7,104,https://www.arbeitnow.com/jobs/companies/knuth-werkzeugmaschinen-gmbh/servicetechniker-werkzeugmaschinen-bonn-221559,Raus aus der Werkstatt – rein in die Welt der Werkzeugmaschinen Du willst nicht den ganzen Tag am selben Ort sitzen? Als Servicetechniker bei KNUTH bist du bundesweit bei unseren Kunden vor Ort – mit einem eigenen Firmen
raw-0146,2026-06-15,Arbeitnow API,KOS KLIMA Anlagenbau Projektierung und Service GmbH,Marketing / Content Creator (m/w/d) · Teilzeit,Marketing & Growth,Social Media Manager,Unspecified,Weinheim,,Social Media; REST,Social Media Manager,45264,65136,55200,66.8,38,30.3,136,https://www.arbeitnow.com/jobs/companies/kos-klima-anlagenbau-projektierung-und-service-gmbh/marketing-content-creator-teilzeit-weinheim-314903,"Wir wachsen – und verstärken unser Team. Bei kosklima planen wir nicht nur Content – wir fühlen ihn. Als familiengeführtes Unternehmen mit über 45 Jahren Geschichte verbinden wir Verlässlichkeit mit dem Mut, Dinge anders"
raw-0147,2026-06-15,Arbeitnow API,Softr,Head of Demand Generation (Remote),Software & Engineering,Remote,Senior/Lead,Berlin,manager,Communication; Automation; Sales; SaaS; AI,Remote; Marketing Manager,97416,140184,118800,78.2,48,38.6,123,https://www.arbeitnow.com/jobs/companies/softr/head-of-demand-generation-remote-berlin-348333,"Who we are Softr is the first AI-native platform for building business apps such as internal tools and client portals, without any code. If you’re interested in being on the cutting edge of technology and advancing your "
raw-0148,2026-06-15,Arbeitnow API,Angelgym GmbH,Grafikdesigner:in für E-Mail & Ads (Werkstudent/Freelance),Marketing & Growth,Remote,Internship/Student,Hanover,"Working student, hilfstätigkeit / student",Communication; Design; Social Media,Remote; Graphic Arts and Communication Design,27060,38940,33000,86.5,38,30.3,136,https://www.arbeitnow.com/jobs/companies/angelgym-gmbh/grafikdesignerin-fur-e-mail-ads-werkstudent-freelance-hanover-252634,Du bist kreativ und suchst nach einer neuen Herausforderung? Dann bist du bei uns genau richtig. Angelgym ist ein stark wachsendes E-Commerce-Unternehmen und verkauft selbst entwickelte Sportbekleidung fürs Gym. Aufgaben
raw-0149,2026-06-15,Arbeitnow API,Superchat,Engineering Manager (m/f/d),Software & Engineering,Engineering,Senior/Lead,Berlin,,Backend; Java; SaaS; AI,Engineering,97416,140184,118800,72.1,56,42.1,112,https://www.arbeitnow.com/jobs/companies/superchat/engineering-manager-berlin-369636,"At Superchat, we're rebuilding how businesses talk to their customers. The phone call, the contact form, the support ticket: all of it is being replaced by messaging and AI. We're building the platform that runs undernea"
raw-0150,2026-06-15,Arbeitnow API,spized GmbH,Werkstudent (m/w/d) Social Media Marketing,Marketing & Growth,Online Marketing,Internship/Student,Cologne,"Working student, hilfstätigkeit / student",Social Media; Onboarding; Design,Online Marketing,27060,38940,33000,75.6,38,30.3,136,https://www.arbeitnow.com/jobs/companies/spized-gmbh/werkstudent-social-media-marketing-cologne-40924,"Das Trikot ist das Aushängeschild eines Vereins. Ein Trikot ist Liebe, Emotion, Verantwortung &#x26; Tradition. Doch meist haben nur Profiteams die Möglichkeit, ihre Trikots individuell zu gestalten. Hier setzen wir an: "
raw-0151,2026-06-15,Arbeitnow API,spized GmbH,Werkstudent (m/w/d) Social Media,Marketing & Growth,Social Media Manager,Internship/Student,Cologne,Working student,Social Media; Onboarding; Design,Social Media Manager,27060,38940,33000,75.6,38,30.3,136,https://www.arbeitnow.com/jobs/companies/spized-gmbh/werkstudent-social-media-cologne-39668,"Das Trikot ist das Aushängeschild eines Vereins. Ein Trikot ist Liebe, Emotion, Verantwortung &#x26; Tradition. Doch meist haben nur Profiteams die Möglichkeit, ihre Trikots individuell zu gestalten. Hier setzen wir an: "
raw-0152,2026-06-15,Arbeitnow API,Superchat,Director of Engineering (m/f/d),Software & Engineering,Engineering,Senior/Lead,Berlin,,Operations; SaaS; AI; HR,Engineering,97416,140184,118800,74.1,48,38.6,123,https://www.arbeitnow.com/jobs/companies/superchat/director-of-engineering-berlin-77409,"At Superchat, we're rebuilding how businesses talk to their customers. The phone call, the contact form, the support ticket: all of it is being replaced by messaging and AI. We're building the platform that runs undernea"
raw-0153,2026-06-15,Arbeitnow API,solreco GmbH,🚀Senior Consultant SAP Real Estate (m/w/d),Finance & Business,Consulting,Senior/Lead,Langen,"Full-time permanent, experienced",Onboarding; Finance; SAP,Consulting; high school coursework,75276,108324,91800,63.9,48,38.6,123,https://www.arbeitnow.com/jobs/companies/solreco-gmbh/senior-consultant-sap-real-estate-langen-266599,"Das erwartet Dich – Erfahrungen, von denen Du Dein ganzes Leben profitierst: Unser Unternehmen fokussiert sich auf die immobilienwirtschaftlichen Prozesse und deren Abbildung in den SAP-Systemen unserer Kunden – Banken, "
raw-0154,2026-06-15,Arbeitnow API,Kevin Kehr,"Werkstudent (m/w/d) – Finance & Beratung (unternehmerisch, leistungsbasiert)",Finance & Business,Finance,Internship/Student,Hamburg,"Full-time permanent, entry",Finance; Onboarding,Finance; high school or equivalent,30668,44132,37400,69.1,38,30.3,136,https://www.arbeitnow.com/jobs/companies/kevin-kehr/werkstudent-finance-beratung-unternehmerisch-leistungsbasiert-hamburg-293401,"Du studierst und willst mehr als einen „Nebenjob“? Du willst Verantwortung, klare Ziele und ein Umfeld, in dem Leistung zählt? Dann ist diese Werkstudentenrolle dein Einstieg in die Finanzberatung, mit strukturiertem Onb"
raw-0155,2026-06-15,Arbeitnow API,TechBiz Global GmbH,Founding Engineering Team Lead (HandsOn),Software & Engineering,Engineering,Senior/Lead,Berlin,"Full-time permanent, experienced",Risk Management; Cybersecurity; Onboarding; Frontend; Security; Backend; Startup; Go; Design; Cloud; AI,Engineering; bachelor's degree,97416,140184,118800,72.4,72,49,91,https://www.arbeitnow.com/jobs/companies/techbiz-global-gmbh/founding-engineering-team-lead-handson-berlin-474798,"Berlin • Cybersecurity &amp; AI Startup • Recently Funded A newly funded cybersecurity startup in Berlin is looking for a Engineering Team Lead to join as a founding team member and help design the core security, identit"
raw-0156,2026-06-15,Arbeitnow API,Speechify,"Software Engineer, iOS Core Product - Düsseldorf, Germany",Software & Engineering,Unspecified,Unspecified,"Dusseldorf, North Rhine-Westphalia, Germany",,Communication; Frontend; Research; Android; Backend; Startup; Design; iOS; AI,,66387,95533,80960,76.2,46,33.8,125,https://www.arbeitnow.com/jobs/companies/speechify/software-engineer-ios-core-product-dusseldorf-germany-dusseldorf-213333,"The mission of Speechify is to make sure that reading is never a barrier to learning. Over 50 million people use Speechify's text-to-speech products to turn whatever they're reading – PDFs, books, Google Docs, news artic"
raw-0157,2026-06-15,Arbeitnow API,Speechify,"Software Engineer, iOS Core Product - Cologne, Germany",Software & Engineering,Unspecified,Unspecified,"Cologne, North Rhine-Westphalia, Germany",,Communication; Frontend; Research; Android; Backend; Startup; Design; iOS; AI,,66387,95533,80960,76.2,46,33.8,125,https://www.arbeitnow.com/jobs/companies/speechify/software-engineer-ios-core-product-cologne-germany-359653,"The mission of Speechify is to make sure that reading is never a barrier to learning. Over 50 million people use Speechify's text-to-speech products to turn whatever they're reading – PDFs, books, Google Docs, news artic"
raw-0158,2026-06-15,Arbeitnow API,Speechify,"Software Engineer, iOS Core Product - Hamburg, Germany",Software & Engineering,Unspecified,Unspecified,"Hamburg, Hamburg, Germany",,Communication; Frontend; Research; Android; Backend; Startup; Design; iOS; AI,,66387,95533,80960,76.2,46,33.8,125,https://www.arbeitnow.com/jobs/companies/speechify/software-engineer-ios-core-product-hamburg-germany-151559,"The mission of Speechify is to make sure that reading is never a barrier to learning. Over 50 million people use Speechify's text-to-speech products to turn whatever they're reading – PDFs, books, Google Docs, news artic"
raw-0159,2026-06-15,Arbeitnow API,Speechify,"Software Engineer, iOS Core Product - Munich, Germany",Software & Engineering,Unspecified,Unspecified,"Munich, Bavaria, Germany",,Communication; Frontend; Research; Android; Backend; Startup; Design; iOS; AI,,66387,95533,80960,76.2,46,33.8,125,https://www.arbeitnow.com/jobs/companies/speechify/software-engineer-ios-core-product-munich-germany-270823,"The mission of Speechify is to make sure that reading is never a barrier to learning. Over 50 million people use Speechify's text-to-speech products to turn whatever they're reading – PDFs, books, Google Docs, news artic"
raw-0160,2026-06-15,Arbeitnow API,Speechify,"Software Engineer, iOS Core Product - Berlin, Germany",Software & Engineering,Unspecified,Unspecified,"Berlin, Berlin, Germany",,Communication; Frontend; Research; Android; Backend; Startup; Design; iOS; AI,,66387,95533,80960,76.2,46,33.8,125,https://www.arbeitnow.com/jobs/companies/speechify/software-engineer-ios-core-product-berlin-germany-366026,"The mission of Speechify is to make sure that reading is never a barrier to learning. Over 50 million people use Speechify's text-to-speech products to turn whatever they're reading – PDFs, books, Google Docs, news artic"
raw-0161,2026-06-15,Arbeitnow API,isento GmbH,"Fullstack Software Entwickler Java, Angular (m/w/d)",Data & AI,Software Development,Unspecified,Nuremberg,,Full Stack; Java,Software Development,64124,92276,78200,50.4,51,35.9,119,https://www.arbeitnow.com/jobs/companies/isento-gmbh/fullstack-software-entwickler-java-angular-nuremberg-211044,“Any fool can write code that a computer can understand. Good programmers write code that humans can understand.” – Martin Fowler Unser Erfolg? Teamsache! Wir sind isento (portugiesisch: „frei“) und realisieren IT-Projek
raw-0162,2026-06-15,Arbeitnow API,isento GmbH,Software Developer (m/w/d)- Schwerpunkt Angular,Data & AI,Software Development,Unspecified,Nuremberg,,Machine Learning; TypeScript; Docker; Azure; CI/CD; Java,Software Development,64124,92276,78200,48.8,59,39.4,108,https://www.arbeitnow.com/jobs/companies/isento-gmbh/software-developer-schwerpunkt-angular-nuremberg-296768,“Any fool can write code that a computer can understand. Good programmers write code that humans can understand.” – Martin Fowler Unser Erfolg? Teamsache! Wir sind isento (portugiesisch: „frei“) und realisieren IT-Projek
raw-0163,2026-06-15,Arbeitnow API,Bremer Gewürzhandel GmbH,Multichannel E-Commerce Manager (AI-First) (m/w/d),Data & AI,Market Research,Senior/Lead,Bremen,Contract,Research; AI,Market Research; Analysis,94095,135405,114750,92,53,40.8,116,https://www.arbeitnow.com/jobs/companies/bremer-gewurzhandel-gmbh/multichannel-e-commerce-manager-ai-first-bremen-204316,"Amazon • Onlineshop • Marktplätze • Conversion Du denkst nicht in einzelnen Vertriebskanälen, sondern daran, wie wir noch mehr Menschen für unsere Gewürze begeistern können. Umsatz, Conversion und nachhaltiges Wachstum s"
raw-0164,2026-06-15,Arbeitnow API,wabcon,"Bauleiter:in Infrastruktur Sicherheitstechnik, GR Düsseldorf 70.000 - 90.000",Software & Engineering,Building,Unspecified,Düsseldorf,,Python; JavaScript; API; Cloud,Building; Supply; Safety Services Engineering,66387,95533,80960,93.4,62,40.7,104,https://www.arbeitnow.com/jobs/companies/wabcon/bauleiterin-infrastruktur-sicherheitstechnik-gr-dusseldorf-70000-90000-287017,Unser Kunde ist einer der Marktführer im Bereich Sicherheitstechnologie und mehrfach ausgezeichnet als bester Arbeitgeber Deutschlands. Im Kundenauftrag suchen wir einen erfahrenen Bauleiter Infrastruktur Sicherheitstech
raw-0165,2026-06-15,Arbeitnow API,isento GmbH,Senior Software Developer (m/w/d),Software & Engineering,Software Development,Senior/Lead,Nuremberg,,Frontend; Security; Python; Cloud; CI/CD; Java; AWS,Software Development,97416,140184,118800,70.5,80,52.4,81,https://www.arbeitnow.com/jobs/companies/isento-gmbh/senior-software-developer-nuremberg-261705,“Experience is the name everyone gives to their mistakes.” – Oscar Wilde Unser Erfolg? Teamsache! Wir sind isento (portugiesisch: „frei“) und realisieren IT-Projekte in Nürnberg von der Konzeption bis zum Rollout. Als So
raw-0166,2026-06-15,Arbeitnow API,wabcon,"Defence System Architekt (m/w/d) Kommunikationslösungen, hybrid, München 90.000 - 120.000",Software & Engineering,Management,Senior/Lead,Munich,teamleitung,Design,Management; Team Leader,97416,140184,118800,93.2,48,38.6,123,https://www.arbeitnow.com/jobs/companies/wabcon/defence-system-architekt-kommunikationslosungen-hybrid-munchen-90000-120000-munich-136934,Unser Kunde ist ein stark wachsendes Unternehmen im Hightech- und IT-Umfeld und verfolgt ambitionierte Ziele in einer zukunftsorientierten Branche. Mit innovativen Kommunikationslösungen und technologisch anspruchsvollen
raw-0167,2026-06-15,Arbeitnow API,KNUTH Werkzeugmaschinen GmbH,Servicetechniker Werkzeugmaschinen (m/w/d),Software & Engineering,Engineering,Mid-level,Bochum,berufserfahren,Python; JavaScript; API; Cloud,Engineering,72160,103840,88000,93.4,62,40.7,104,https://www.arbeitnow.com/jobs/companies/knuth-werkzeugmaschinen-gmbh/servicetechniker-werkzeugmaschinen-bochum-115958,Raus aus der Werkstatt – rein in die Welt der Werkzeugmaschinen Du willst nicht den ganzen Tag am selben Ort sitzen? Als Servicetechniker bei KNUTH bist du bundesweit bei unseren Kunden vor Ort – mit einem eigenen Firmen
