job_id,date_posted,source,company,title,category,raw_category,seniority,location,job_type,skills,tags_raw,salary_min_usd,salary_max_usd,salary_mid_usd,demand_index,scarcity_score,time_to_fill_days_proxy,application_volume_proxy,source_url,description_preview
raw-0043,2026-05-13,Arbeitnow API,1KOMMA5˚,(Senior) Product Engineer (m/f/d),Software & Engineering,Software Development,Senior/Lead,Hamburg,professional / experienced,TypeScript; Operations; Full Stack; Frontend; Node.js; Backend; Design; CI/CD; React; Figma; GCP; API,Software Development,97416,140184,118800,57.9,64,45.5,102,https://www.arbeitnow.com/jobs/companies/1komma50/senior-product-engineer-hamburg-256034,"1KOMMA5° At 1KOMMA5° , we pursue a clear vision: Living on wind and sunlight forever for free . To make this a reality, we are building the energy system of the future with Heartbeat AI. Want to be part of it?We bring to"
raw-0044,2026-05-13,Arbeitnow API,4creatives GmbH,Creative Team Lead | 100% Remote - (m/w/d),Marketing & Growth,Social Media Manager,Senior/Lead,Nordhorn,,Social Media,Social Media Manager,66420,95580,81000,69.8,48,38.6,123,https://www.arbeitnow.com/jobs/companies/4creatives-gmbh/creative-team-lead-100-remote-nordhorn-383387,"50+ Ads pro Woche. Die größten deutschen E-Commerce Brands. Ein Team, das abliefert. Und eine Person, die das Ganze zusammenhält. Genau diese suchen wir. Wenn du Bock hast… Ein kleines Team wie dein eigenes Business zu f"
raw-0045,2026-05-13,Arbeitnow API,Parte Verwaltung GmbH,WEG-Verwalter / Immobilienverwalter (m/w/d),Marketing & Growth,Finance,Mid-level,Coesfeld,berufserfahren,Finance; CRM; ERP; HR,Finance,49200,70800,60000,63.6,38,30.3,136,https://www.arbeitnow.com/jobs/companies/parte-verwaltung-gmbh/weg-verwalter-immobilienverwalter-coesfeld-47833,"Das bewegen Sie bei uns: Als WEG-Verwalter verantworten Sie eigenständig einen festen Immobilienstand und fungieren als erster Ansprechpartner für Eigentümer und externe Dienstleister. Zudem planen, leiten und dokumentie"
raw-0046,2026-05-13,Arbeitnow API,4creatives GmbH,Creative Project Manager in Vollzeit | 100% Remote - (m/w/d),Marketing & Growth,Social Media Manager,Senior/Lead,Nordhorn,,Social Media,Social Media Manager,66420,95580,81000,69.8,48,38.6,123,https://www.arbeitnow.com/jobs/companies/4creatives-gmbh/creative-project-manager-in-vollzeit-100-remote-nordhorn-403468,"50+ Ads pro Woche. Die größten deutschen E-Commerce Brands. Ein Team, das abliefert. Und eine Person, die das Ganze zusammenhält. Genau diese suchen wir. Wenn du Bock hast… Ein kleines Team wie dein eigenes Business zu f"
raw-0047,2026-05-13,Arbeitnow API,Swiss Life Select,Senior Sales Consultant - Vollzeit (German Speaking),Finance & Business,Finance,Senior/Lead,Bad Krozingen,"Full-time fixed-term, mid",Finance; Onboarding; Sales,Finance; high school or equivalent,75276,108324,91800,76.6,48,38.6,123,https://www.arbeitnow.com/jobs/companies/swiss-life-select/senior-sales-consultant-vollzeit-german-speaking-bad-krozingen-158581,"Du willst Ergebnisse, keine Diskussionen? Du arbeitest strukturiert, hast ein klares Verständnis für saubere Prozesse und weißt, wie wichtig Verlässlichkeit im Vertrieb ist? Dann bist du bei uns genau richtig! Wir suchen"
raw-0048,2026-05-13,Arbeitnow API,Thomann.io,(Senior) Software Quality Engineer (f/x/m) in Tech & Data Team,Software & Engineering,Information technology,Senior/Lead,Berlin,"Full-time permanent, mid",JavaScript; TypeScript; Node.js; Testing; Design; Agile; UI/UX,Information technology; high school or equivalent,97416,140184,118800,62.1,48,38.6,123,https://www.arbeitnow.com/jobs/companies/thomannio/senior-software-quality-engineer-in-tech-data-team-berlin-356619,"Hello! We are Team Quality, a dynamic part of the Tech &amp; Data team at Thomann. True to our name, we are passionate about upholding the highest standards in everything we do. As a well-coordinated team, we work every "
raw-0049,2026-05-13,Arbeitnow API,LichtBlick eMobility GmbH,Werkstudent People & Culture (gn),Marketing & Growth,Recruitment and hr,Internship/Student,Rottendorf,"Internship, student (college)",Recruitment; HR; Onboarding; Operations,Recruitment and hr; high school or equivalent,27060,38940,33000,65,38,30.3,136,https://www.arbeitnow.com/jobs/companies/lichtblick-emobility-gmbh/werkstudent-people-culture-gn-rottendorf-410639,"Lade mit uns das Netzwerk der Zukunft in Rottendorf (Bayern) auf! Wir haben eine Mission: Gemeinsam wollen wir die Mobilität von Morgen gestalten . Wir möchten elektrisches Fahren und Laden für alle möglich machen. Ja, g"
raw-0050,2026-05-13,Arbeitnow API,Verve,Working Student - Financial Accounting (w/m/d),Marketing & Growth,Finance,Internship/Student,Frankfurt am Main,"Part-time fixed-term, student (college)",Finance; Communication; Advertising; Accounting; Excel; ERP,Finance; high school or equivalent,27060,38940,33000,63.3,38,30.3,136,https://www.arbeitnow.com/jobs/companies/verve/working-student-financial-accounting-frankfurt-am-main-162714,"Who We Are Verve has created a more efficient and privacy-focused way to buy and monetize advertising. Verve is an ecosystem of demand and supply technologies fusing data, media, and technology together to deliver result"
raw-0051,2026-05-13,Arbeitnow API,4creatives GmbH,Creative Director in E-Com Agentur | 100% Remote - (m/w/d),Marketing & Growth,Social Media Manager,Senior/Lead,Nordhorn,teamleitung,Social Media,Social Media Manager,66420,95580,81000,69.8,48,38.6,123,https://www.arbeitnow.com/jobs/companies/4creatives-gmbh/creative-director-in-e-com-agentur-100-remote-nordhorn-195418,"50+ Ads pro Woche. Die größten deutschen E-Commerce Brands. Ein Team, das abliefert. Und eine Person, die das Ganze zusammenhält. Genau diese suchen wir. Wenn du Bock hast… Ein kleines Team wie dein eigenes Business zu f"
raw-0052,2026-05-13,Arbeitnow API,FNTIO,Senior AI Systems Engineer (AWS) 100% Remote (m/w/d),Software & Engineering,Remote,Senior/Lead,Frankfurt am Main,,Cloud; AWS; AI,Remote; Consulting; Engineering,97416,140184,118800,82,64,45.5,102,https://www.arbeitnow.com/jobs/companies/fntio/senior-ai-systems-engineer-aws-100-remote-frankfurt-am-main-8458,"FNTIO sind AI-First Systems Engineers für Enterprise. Wir arbeiten seit 2022 produktiv mit AI in echten Kundenprojekten. Siemens, Deutsche Börse, Volkswagen. Wir liefern Projekte mit Ergebnisverantwortung. Kein Body Leas"
raw-0053,2026-05-13,Arbeitnow API,FNTIO,Full-Stack Entwickler (m/w/d) - .NET 100% Remote,Software & Engineering,Remote,Unspecified,Frankfurt am Main,,Frontend; Backend; Testing; Docker; Cloud; CI/CD; .NET; AWS; Git; AI,Remote; Consulting; Engineering,66387,95533,80960,60.6,62,40.7,104,https://www.arbeitnow.com/jobs/companies/fntio/full-stack-entwickler-net-100-remote-frankfurt-am-main-495367,"FNTIO sind AI-First Systems Engineers für Enterprise. Wir arbeiten seit 2022 produktiv mit AI in echten Kundenprojekten. Siemens, Deutsche Börse, Volkswagen. Wir liefern Projekte mit Ergebnisverantwortung. Kein Body Leas"
raw-0054,2026-05-13,Arbeitnow API,wabcon,"Vertriebsingenieur:in Sicherheitstechnik, Nürnberg, 70.000 - 80.000+var. Anteil",Software & Engineering,Sales Engineer,Mid-level,Nuremberg,berufserfahren,Sales; Video Editing; CRM,Sales Engineer,72160,103840,88000,63.7,38,30.3,136,https://www.arbeitnow.com/jobs/companies/wabcon/vertriebsingenieurin-sicherheitstechnik-nurnberg-70000-80000var-anteil-nuremberg-301802,Unser Kunde ist einer der Marktführer im Bereich Sicherheitstechnologie und mehrfach ausgezeichnet als bester Arbeitgeber Deutschlands. Im Kundenauftrag suchen wir einen erfahrenen Vertriebsingenieur (m/w/d) Sicherheitst
raw-0055,2026-05-13,Arbeitnow API,MY Humancapital GmbH,Vergabemanager (m/w/d) Öffentliche Ausschreibung,Cybersecurity & IT,Compliance,Senior/Lead,Munich,,Security; SAP,Compliance; Security,88560,127440,108000,60.1,61,44.2,106,https://www.arbeitnow.com/jobs/companies/my-humancapital-gmbh/vergabemanager-offentliche-ausschreibung-munich-150099,Im Auftrag unseres Partnerunternehmens in München suchen wir Sie zum nächstmöglichen Zeitpunkt als „Vergabemanager (m/w/d) – Öffentliche Ausschreibungen“. Aufgaben Als Vergabemanager (m/w/d) steuern Sie nationale und eur
raw-0056,2026-05-13,Arbeitnow API,Lionflence,Artist Manager / Influencer Manager (m/w/d),Software & Engineering,Marketing and Communication,Senior/Lead,Mülheim,,Communication; Social Media,Marketing and Communication,97416,140184,118800,81.1,48,38.6,123,https://www.arbeitnow.com/jobs/companies/lionflence/artist-manager-influencer-manager-mulheim-80373,"Was wir Dir bieten: Eine spannende Herausforderung, in der du dich weiterentwickeln kannst, rundum den Bereich Artistmanagement Medien/Social Media, Influencer Marketing und den dazugehörigen Technologien (Software Syste"
raw-0057,2026-05-13,Arbeitnow API,Lionflence,Trainee Artist Manager / Influencer Manager (m/w/d),Software & Engineering,Training,Internship/Student,Mülheim,hilfstätigkeit / student,AI; Social Media,Training; Development,39688,57112,48400,76.8,38,30.3,136,https://www.arbeitnow.com/jobs/companies/lionflence/trainee-artist-manager-influencer-manager-mulheim-72087,"Was wir Dir bieten: Eine spannende Herausforderung, in der du dich weiterentwickeln kannst, rundum den Bereich Artistmanagement Medien/Social Media, Influencer Marketing und den dazugehörigen Technologien (Software Syste"
raw-0058,2026-05-13,Arbeitnow API,Lionflence,Trainee Artist Manager / Influencer Manager (m/w/d),Software & Engineering,Training,Internship/Student,Berlin,hilfstätigkeit / student,AI; Social Media,Training; Development,39688,57112,48400,76.8,38,30.3,136,https://www.arbeitnow.com/jobs/companies/lionflence/trainee-artist-manager-influencer-manager-berlin-96174,"Was wir Dir bieten: Eine spannende Herausforderung, in der du dich weiterentwickeln kannst, rundum den Bereich Artistmanagement Medien/Social Media, Influencer Marketing und den dazugehörigen Technologien (Software Syste"
raw-0059,2026-05-13,Arbeitnow API,Lionflence,Artist Manager / Influencer Manager (m/w/d) BERLIN,Software & Engineering,Marketing and Communication,Senior/Lead,Berlin,,Communication; Social Media,Marketing and Communication,97416,140184,118800,81.1,48,38.6,123,https://www.arbeitnow.com/jobs/companies/lionflence/artist-manager-influencer-manager-berlin-431185,"Was wir Dir bieten: Eine spannende Herausforderung, in der du dich weiterentwickeln kannst, rundum den Bereich Artistmanagement Medien/Social Media, Influencer Marketing und den dazugehörigen Technologien (Software Syste"
raw-0060,2026-05-13,Arbeitnow API,Lionflence,Junior Artist Manager / Influencer Manager (m/w/d),Software & Engineering,Marketing and Communication,Senior/Lead,Berlin,,Communication; Social Media,Marketing and Communication,97416,140184,118800,81.1,48,38.6,123,https://www.arbeitnow.com/jobs/companies/lionflence/junior-artist-manager-influencer-manager-berlin-406902,"Was wir Dir bieten: Eine spannende Herausforderung, in der du dich weiterentwickeln kannst, rundum den Bereich Artistmanagement Medien/Social Media, Influencer Marketing und den dazugehörigen Technologien (Software Syste"
raw-0061,2026-05-13,Arbeitnow API,Lionflence,Junior Artist Manager / Influencer Manager (m/w/d),Software & Engineering,Marketing and Communication,Senior/Lead,Mülheim,,Communication; Social Media,Marketing and Communication,97416,140184,118800,81.1,48,38.6,123,https://www.arbeitnow.com/jobs/companies/lionflence/junior-artist-manager-influencer-manager-mulheim-119175,"Was wir Dir bieten: Eine spannende Herausforderung, in der du dich weiterentwickeln kannst, rundum den Bereich Artistmanagement Medien/Social Media, Influencer Marketing und den dazugehörigen Technologien (Software Syste"
raw-0062,2026-05-13,Arbeitnow API,Synctive,Fullstack Developer / Web-App-Entwickler*in (M/W/D),Software & Engineering,Web Development,Unspecified,Bielefeld,,TypeScript; Full Stack; Frontend; Node.js; Backend; Testing; Startup; Cloud; React; REST; SaaS; AWS,Web Development,66387,95533,80960,57.4,62,40.7,104,https://www.arbeitnow.com/jobs/companies/synctive/fullstack-developer-web-app-entwicklerin-bielefeld-155441,"Bist du bereit, Software zu bauen, die echten Einfluss auf den Maschinen- und Anlagenbau hat? Bei Synctive entwickeln wir eine Service- und IoT-Plattform, mit der Maschinenhersteller ihre Anlagen intelligent überwachen, "
raw-0063,2026-05-13,Arbeitnow API,Accenture,HR Ventures & Acquisition Associate Manager (all genders),Product & Project Management,Management,Senior/Lead,Kronberg,berufserfahren,Onboarding; Finance; HR,Management; Team Leader,84132,121068,102600,70.9,48,38.6,123,https://www.arbeitnow.com/jobs/companies/accenture/hr-ventures-acquisition-associate-manager-all-genders-kronberg-186187,"Du arbeitest an der Schnittstelle von People, Strategie und Wachstum: In dieser Rolle begleitest du Accenture bei Unternehmensakquisitionen und gestaltest die HR‑Integration von Anfang an aktiv mit. Deine Mission Als HR "
raw-0064,2026-05-13,Arbeitnow API,visuSolution GmbH,Assistent Personal (m/w/d) Schwerpunkt Recruiting,HR & Recruitment,Recruitment and Selection,Mid-level,Tangerhütte,berufserfahren,Recruitment,Recruitment and Selection,45920,66080,56000,51.5,38,30.3,136,https://www.arbeitnow.com/jobs/companies/visusolution-gmbh/assistent-personal-schwerpunkt-recruiting-tangerhutte-206708,Wir verwirklichen Ideen für besseres Sehen. Die visuSolution GmbH -in der Nähe von Stendal- gehört weltweit zu den führenden Entwicklern und Produzenten von augenoptischen Messinstrumenten und ist Spezialist für hochwert
raw-0065,2026-05-13,Arbeitnow API,fleetster,Senior Full-Stack Engineer (m/f/x) | hybrid,Software & Engineering,Software Development,Senior/Lead,Munich,,Communication; JavaScript; TypeScript; Frontend; Backend; Node.js; React; SaaS; AWS,Software Development,97416,140184,118800,59.5,56,42.1,112,https://www.arbeitnow.com/jobs/companies/fleetster/senior-full-stack-engineer-hybrid-munich-424752,fleetster is a SaaS company located in Munich that provides smart solutions for global fleets and car-sharers to make customers’ daily fleet life as easy as possible. Our product core is the sophisticated software platfo
raw-0066,2026-05-13,Arbeitnow API,Matera GmbH,Customer Onboarding Manager (m/w/d) | Scaling Phase,HR & Recruitment,Customer Service,Senior/Lead,Berlin,berufseinstieg,Customer Service; Onboarding; Sales; SaaS,Customer Service,61992,89208,75600,65,48,38.6,123,https://www.arbeitnow.com/jobs/companies/matera-gmbh/customer-onboarding-manager-scaling-phase-berlin-42654,"In a nutshell: Als Customer Onboarding Manager bist du bei uns genau richtig, wenn du dafür brennst, Kund*innen dank deiner organisatorischen Fähigkeiten und Prozessoptimierung glücklich zu machen. Du begleitest sie beim"
raw-0067,2026-05-13,Arbeitnow API,MY Humancapital GmbH,Senior SAP BTP Developer (m/w/d),Software & Engineering,Software Development,Senior/Lead,Munich,,Kubernetes; JavaScript; Automation; Security; Node.js; Backend; Docker; Cloud; REST; Java; SAP,Software Development,97416,140184,118800,61.3,80,52.4,81,https://www.arbeitnow.com/jobs/companies/my-humancapital-gmbh/senior-sap-btp-developer-munich-287489,Im Auftrag unseres Partnerunternehmens in München suchen wir Sie zum nächstmöglichen Zeitpunkt als „Senior SAP BTP Developer (m/w/d)“. Aufgaben Als Senior SAP BTP Developer (m/w/d) entwickeln und implementieren Sie kompl
raw-0068,2026-05-13,Arbeitnow API,Alteos GmbH,Senior Produktmanager Versicherungsprodukte & Partnerschaften (m/w/d),Marketing & Growth,Project Management,Senior/Lead,Berlin,berufserfahren,Project Management; Operations; Agile; Sales,Project Management,66420,95580,81000,65.5,48,38.6,123,https://www.arbeitnow.com/jobs/companies/alteos-gmbh/senior-produktmanager-versicherungsprodukte-partnerschaften-berlin-418247,"Diese Aufgaben warten auf Dich Du übernimmst die Verantwortung für unserer Produktlinien im Bereich Brokerproducts (Haftpflicht, Hausrat, Unfall und Mietkaution) und entwickelst sie mit einem klaren Blick für Wachstum, K"
raw-0069,2026-05-13,Arbeitnow API,ANGEHEUERT GmbH Personalberatung,Chief Technology Officer (m/w/d) B2B Software,Software & Engineering,IT,Unspecified,Dresden,,AI,IT,66387,95533,80960,83.8,38,30.3,136,https://www.arbeitnow.com/jobs/companies/angeheuert-gmbh-personalberatung/chief-technology-officer-b2b-software-dresden-436386,"📍 Dresden oder Raum Frankfurt a.M. | vor Ort Präsenz Etabliertes B2B Softwareunternehmen | Private Equity Umfeld Unser Kunde ist eine wachstumsorientierte Software Holding, die etablierte B2B Softwareunternehmen weitere"
raw-0070,2026-05-13,Arbeitnow API,ANGEHEUERT GmbH Personalberatung,CTO - B2B Software (m/w/d) Legacy modernisieren,Software & Engineering,IT,Unspecified,Frankfurt am Main,geschäftsleitung,AI,IT,66387,95533,80960,83.8,38,30.3,136,https://www.arbeitnow.com/jobs/companies/angeheuert-gmbh-personalberatung/cto-b2b-software-legacy-modernisieren-frankfurt-am-main-188860,"📍 Dresden oder Raum Frankfurt a.M. | vor Ort Präsenz Etabliertes B2B Softwareunternehmen | Private Equity Umfeld Unser Kunde ist eine wachstumsorientierte Software Holding, die etablierte B2B Softwareunternehmen weitere"
raw-0071,2026-05-13,Arbeitnow API,ARES Consulting GmbH,Werkstudent Marketing (m/w/d),Marketing & Growth,Marketing and Communication,Internship/Student,Munich,"Working student, hilfstätigkeit / student",Communication; Design,Marketing and Communication,27060,38940,33000,89.8,38,30.3,136,https://www.arbeitnow.com/jobs/companies/ares-consulting-gmbh/werkstudent-marketing-munich-422461,"Aufgaben Du übernimmst die Verantwortung für einen unserer Marketingkanäle (LinkedIn) und unterstützt bei der operativen Steuerung und Betreuung Du pflegst und planst LinkedIn-Posts, bereitest Beiträge vor, passt Bilder "
raw-0072,2026-05-13,Arbeitnow API,FION Energy GmbH,IoT Platform Engineer - Energy Systems (f/m/d),Software & Engineering,Embedded Systems,Mid-level,Berlin,professional / experienced,Operations; Startup; Design; Azure; Cloud; Java; Rust; AWS; AI,Embedded Systems; Firmware Development,72160,103840,88000,67,70,44.1,94,https://www.arbeitnow.com/jobs/companies/fion-energy-gmbh/iot-platform-engineer-energy-systems-berlin-199860,"Tasks FION Energy develops software for the dimensioning, intelligent control, and monitoring of industrial energy storage and PV systems. Our AI-driven platform optimizes battery operations across peak shaving, self-con"
raw-0073,2026-05-13,Arbeitnow API,Intermate Media GmbH,Projektmanager:in (gn) - Social Media & Influencer Marketing,Software & Engineering,Marketing and Communication,Senior/Lead,Berlin,berufserfahren,Communication; Social Media; Onboarding; Video Editing,Marketing and Communication,97416,140184,118800,70.9,48,38.6,123,https://www.arbeitnow.com/jobs/companies/intermate-media-gmbh/projektmanagerin-gn-social-media-influencer-marketing-berlin-104591,"Jobbeschreibung Intermate x SAMY – Shaping the State of Social Intermate gehört zu den größten Social-Media- und Influencer-Agenturen im DACH-Raum. Mit mehr als 250 Mates in Berlin, Hamburg, Köln und Remote entwickeln wi"
raw-0074,2026-05-13,Arbeitnow API,LAUDO Designagentur GmbH,(Senior) Projektmanager für Brand & Digital (w/m/d),Marketing & Growth,Management,Senior/Lead,Berlin,,Design; UI/UX; SEO; AI,Management; Team Leader,66420,95580,81000,67.6,48,38.6,123,https://www.arbeitnow.com/jobs/companies/laudo-designagentur-gmbh/senior-projektmanager-fur-brand-digital-berlin-154746,"LAUDO ist die bestbewertete Designagentur in Berlin. Wir kreieren hochwertige digitale Produkte und Marken, deren Designs sich durch Schlichtheit und Innovation ausdrückt. Als Digitalstrateg:innen unterstützen wir Untern"
raw-0075,2026-05-13,Arbeitnow API,wabcon,"IT - Techniker:in Microsoft WinServer2019, Berlin, 50.000 - 60.000",Software & Engineering,Applications Administration,Mid-level,Berlin,berufserfahren,SQL; ERP,Applications Administration,72160,103840,88000,50.4,38,30.3,136,https://www.arbeitnow.com/jobs/companies/wabcon/it-technikerin-microsoft-winserver2019-berlin-50000-60000-493124,"Unser Kunde ist einer der Martführer im Bereich medizintechnischer Präzisionslösungen (Kamerasysteme, minimal-invasiver Gebrauch). Das Portfolio umfasst Systeme, Software und Services für klinische Anwendungen sowie Fors"
raw-0076,2026-05-13,Arbeitnow API,LYNIQ STUDIO,3D-Designer (m/w/d) in Teilzeit - C4D & Redshift,Software & Engineering,Graphic Arts and Communication Design,Unspecified,Bielefeld,,Communication; Design; Motion Design,Graphic Arts and Communication Design,66387,95533,80960,74.5,38,30.3,136,https://www.arbeitnow.com/jobs/companies/lyniq-studio/3d-designer-in-teilzeit-c4d-redshift-bielefeld-172432,"Du lebst für fotorealistische Renderings, beherrscht Cinema 4D im Schlaf und weißt genau, wie du mit Redshift visuelle Welten erschaffst, die begeistern? Dann werde Teil von LYNIQ STUDIO. Wir sind ein spezialisiertes Stu"
raw-0077,2026-05-13,Arbeitnow API,Yoummday,Senior React Engineer - Full Stack & AI Products (m/w/d),Data & AI,Software Development,Senior/Lead,Berlin,professional / experienced,TypeScript; Full Stack; Research; Backend; Testing; Startup; Python; Docker; Design; CI/CD; React; REST,Software Development,94095,135405,114750,59.7,77,51.1,85,https://www.arbeitnow.com/jobs/companies/yoummday/senior-react-engineer-full-stack-ai-products-berlin-312064,"Your mission You don't just want to build features - you want to build AI products that solve real problems for real users, with React as your primary tool and Python as a solid backend foundation? Then you're in the rig"
raw-0078,2026-05-13,Arbeitnow API,Assecor GmbH,Externer Datenschutzbeauftragter (m/w/d) – Splone UG (a company of Assecor),Software & Engineering,IT,Mid-level,Berlin,berufserfahren,Design,IT,72160,103840,88000,87.1,38,30.3,136,https://www.arbeitnow.com/jobs/companies/assecor-gmbh/externer-datenschutzbeauftragter-splone-ug-a-company-of-assecor-berlin-263806,Deine Rolle bei uns Die Splone UG ist eine Tochtergesellschaft der Assecor GmbH und spezialisiert auf Datenschutz und Informationssicherheit im IT‑Umfeld. Als externer Datenschutzbeauftragter (DSB) übernimmst du bei Splo
raw-0079,2026-05-13,Arbeitnow API,Nooxit GmbH,UX / UI Designer (Remote),Software & Engineering,Remote,Mid-level,Berlin,professional / experienced,Communication; Design; User Research; Automation; Accounting; Research; Finance; Figma; SaaS; AI,Remote; Graphic Arts and Communication Design,72160,103840,88000,64.9,38,30.3,136,https://www.arbeitnow.com/jobs/companies/nooxit-gmbh/ux-ui-designer-remote-berlin-376139,"Nooxit builds AI-native finance automation software for medium and large enterprises. We put accounting on autopilot using large language models, document intelligence, and agentic AI workflows to free finance teams from"
raw-0080,2026-05-13,Arbeitnow API,alphacoders,TypeScript Entwickler (m/w/d),Software & Engineering,Software Development,Mid-level,Marsberg,berufserfahren,TypeScript; Backend,Software Development,72160,103840,88000,53.1,46,33.8,125,https://www.arbeitnow.com/jobs/companies/alphacoders/typescript-entwickler-marsberg-159194,"In exklusiver Zusammenarbeit mit unserem Partner, einem produzierenden Unternehmen mit Kunden im B2B und B2C-Umfeld, suchen wir Dich als TypeScript Entwickler (m/w/d) für den Standort in Marsberg . Die Position bietet Di"
raw-0081,2026-05-13,Arbeitnow API,Fischer & Partner Gesellschaft für Personal mbH,Finance Manager o. Accounting Manager (w/m/d) mit Englisch & SAP: remote oder vor Ort,Software & Engineering,Management,Senior/Lead,Hamburg,berufserfahren,Accounting; Finance; SAP,Management; Team Leader,97416,140184,118800,61.1,48,38.6,123,https://www.arbeitnow.com/jobs/companies/fischer-partner-gesellschaft-fur-personal-mbh/finance-manager-o-accounting-manager-mit-englisch-sap-remote-oder-vor-ort-hamburg-429937,"Unser Mandant ist ein national wie international agierendes, technisches Unternehmen mit ca. 2.000 Mitarbeitenden weltweit, ca. 350 Mitarbeitenden in EMEA und ca. 100 Mitarbeitenden am deutschen Standort Hamburg. Hierfür"
raw-0082,2026-05-13,Arbeitnow API,ARES Consulting GmbH,Consultant IT-Security (m/w/d),Cybersecurity & IT,Remote,Unspecified,Munich,,Security; Cloud,Remote; IT Security,60352,86848,73600,88.1,59,39.4,108,https://www.arbeitnow.com/jobs/companies/ares-consulting-gmbh/consultant-it-security-munich-101582,Seit unserer Gründung 2021 sind wir mit unserem Team aus technischen IT-Experten auf Wachstumskurs. Als cloud-native Company beraten und unterstützen wir Unternehmen und öffentliche Auftraggeber hands-on in ihren Projekt
raw-0083,2026-05-13,Arbeitnow API,ARES Consulting GmbH,Senior Consultant Cloud & DevOps Engineering (m/w/d),Software & Engineering,Remote,Senior/Lead,Munich,,Kubernetes; Security; Design; Azure; Cloud; CI/CD; AWS; GCP,Remote; Consulting; Engineering,97416,140184,118800,63.8,96,59.3,60,https://www.arbeitnow.com/jobs/companies/ares-consulting-gmbh/senior-consultant-cloud-devops-engineering-munich-351539,Seit unserer Gründung 2021 sind wir mit unserem Team aus technischen IT-Experten auf Wachstumskurs. Als cloud-native Company beraten und unterstützen wir Unternehmen und öffentliche Auftraggeber hands-on in ihren Projekt
raw-0084,2026-05-13,Arbeitnow API,1KOMMA5˚,Head of Go to Market - Heartbeat AI (m/f/d),Software & Engineering,Software Development,Senior/Lead,Hamburg,professional / experienced,Operations; Sales; AI,Software Development,97416,140184,118800,80.2,48,38.6,123,https://www.arbeitnow.com/jobs/companies/1komma50/head-of-go-to-market-heartbeat-ai-hamburg-235136,"1KOMMA5° At 1KOMMA5° , we pursue a clear vision: Living on wind and sunlight forever for free . To make this a reality, we are building the energy system of the future with Heartbeat AI. Want to be part of it?We bring to"
