job_id,date_posted,source,company,title,category,raw_category,seniority,location,job_type,skills,tags_raw,salary_min_usd,salary_max_usd,salary_mid_usd,demand_index,scarcity_score,time_to_fill_days_proxy,application_volume_proxy,source_url,description_preview
raw-0042,2026-05-28,Arbeitnow API,Kevin Meyer Consulting GmbH,AI-Engineer (m/w/d) - remote,Software & Engineering,Remote,Unspecified,Munich,,Python; Video Editing; AI,Remote; IT,66387,95533,80960,73.2,46,33.8,125,https://www.arbeitnow.com/jobs/companies/kevin-meyer-consulting-gmbh/ai-engineer-remote-munich-207998,"Kevin Meyer Consulting baut Marketing neu - als KI-betriebenes System, das in den Unternehmen unserer Kunden läuft und ihnen gehört. Wir suchen den Menschen, der die technische Umsetzung dieser Systeme verantwortet. Woru"
raw-0043,2026-05-28,Arbeitnow API,Kevin Meyer Consulting GmbH,KI-Automation Builder (m/w/d) - Werkstudent oder Freelance · remote,Software & Engineering,Remote,Internship/Student,Munich,Freelance,JavaScript; Automation; Testing; Python; Video Editing; API,Remote; IT,39688,57112,48400,69.3,54,37.2,115,https://www.arbeitnow.com/jobs/companies/kevin-meyer-consulting-gmbh/ki-automation-builder-werkstudent-oder-freelance-remote-munich-38518,"Bei Kevin Meyer Consulting bauen wir gerade etwas Neues: KI-gestützte Marketing- und Go-to-Market-Systeme, die in den Unternehmen unserer Kunden laufen und ihnen gehören. Für die technische Umsetzung suchen wir jemanden,"
raw-0044,2026-05-28,Arbeitnow API,Visual Statements GmbH,Ausbildung Kaufleute Marketingkommunikation (all genders),Marketing & Growth,Marketing Assistant,Unspecified,Freiburg im Breisgau,Contract,Social Media; Design,Marketing Assistant,45264,65136,55200,89.9,38,30.3,136,https://www.arbeitnow.com/jobs/companies/visual-statements-gmbh/ausbildung-kaufleute-marketingkommunikation-all-genders-freiburg-im-breisgau-445467,Über uns Wir begeistern und inspirieren Millionen von Menschen! Als innovativer Hybrid aus Social Media Publisher und Social Media Agentur vereint das VS Mediahouse einzigartige Expertise in den Bereichen Content-Kreatio
raw-0045,2026-05-27,Arbeitnow API,casavi GmbH,(Senior) Recruiting Manager (m/w/d),Software & Engineering,Remote,Senior/Lead,Munich,berufserfahren,Recruitment; Sales; SaaS; HR,Remote; Recruitment and Selection,97416,140184,118800,60.5,48,38.6,123,https://www.arbeitnow.com/jobs/companies/casavi-gmbh/senior-recruiting-manager-munich-422621,"Dein Job bei uns Als Recruiting Manager (m/w/d) ist es Deine Mission, das Fundament unserer Organisation durch ein qualitativ hochwertiges Recruiting zu sichern, während Du die Recruiting-Prozesse gleichzeitig technologi"
raw-0046,2026-05-27,Arbeitnow API,Lyn the Agency GmbH,Social Media Manager*in,Marketing & Growth,Social Media Manager,Senior/Lead,Düsseldorf,Side,Social Media,Social Media Manager,66420,95580,81000,69.9,48,38.6,123,https://www.arbeitnow.com/jobs/companies/lyn-the-agency-gmbh/social-media-managerin-dusseldorf-224617,"(M/W/D) - Minijob - Düsseldorf Du liebst Social Media, hast ein Auge für Ästhetik und bist immer up to date bei Trends, Reels, TikToks &#x26; viralen Formaten? Dann suchen wir genau dich. Für unser Team in Düsseldorf suc"
raw-0047,2026-05-27,Arbeitnow API,Bonial International GmbH,People Business Partner (x/f/m) (Fixed-Term Contract),Software & Engineering,HR,Mid-level,Berlin,"Contract, professional / experienced",HR; Advertising,HR,72160,103840,88000,53.7,38,30.3,136,https://www.arbeitnow.com/jobs/companies/bonial-international-gmbh/people-business-partner-fixed-term-contract-berlin-157419,"Job Description bonial helps you save time, money and paper! We are a digital advertising partner for offline businesses - we support retailers in their marketing activities and help them find a new audience. Would you l"
raw-0048,2026-05-27,The Muse API,Labcorp,Hospital Phlebotomist 7on/7off,Software & Engineering,Healthcare,Unspecified,"Birmingham, AL",external,Customer Service; Communication; Testing,Healthcare; Mid Level,66387,95533,80960,67,38,30.3,136,https://www.themuse.com/jobs/labcorp/hospital-phlebotomist-7on7off,"Labcorp is seeking a Phlebotomist to work in Birmingham, AL. Work Schedule: 7on/7off Wednesday - Tuesday 10:00PM - 8:30AM Job Responsibilities: Perform blood collections by venipuncture and capillary techniques for all a"
raw-0049,2026-05-27,Arbeitnow API,trafficdesign GmbH,Sales Operations & Automation Manager:in (m/w/d),Marketing & Growth,Business Development,Senior/Lead,Hamburg,berufserfahren,Automation; Operations; Design; Sales; CRM,Business Development,66420,95580,81000,74,48,38.6,123,https://www.arbeitnow.com/jobs/companies/trafficdesign-gmbh/sales-operations-automation-managerin-cologne-184249,"Du hast eine Allergie gegen Stillstand und liebst es, wenn Systeme mit Lichtgeschwindigkeit laufen? ✨ Bei trafficdesign geben wir uns nicht mit „Standard“ zufrieden – wir sind High-End-Agentur und Growth-Partner für inte"
raw-0050,2026-05-27,Arbeitnow API,SINUS Messtechnik GmbH,Marketing- und Vetriebsassistenz,Software & Engineering,Distribution Marketing,Unspecified,Leipzig,,CRM; ERP,Distribution Marketing,66387,95533,80960,57.4,38,30.3,136,https://www.arbeitnow.com/jobs/companies/sinus-messtechnik-gmbh/marketing-und-vetriebsassistenz-leipzig-119941,"Die SINUS Messtechnik GmbH ist ein seit mehr als 35 Jahren am Markt präsenter Messgerätehersteller im Bereich Akustik und Vibration mit Sitz in Leipzig. Schwerpunkt ist die Entwicklung, Fertigung und der Vertrieb der eig"
raw-0051,2026-05-27,Arbeitnow API,MediSteg GmbH,Candidate Experience & Operations Associate (m/w/d),Software & Engineering,Remote,Unspecified,Leipzig,,HR; Onboarding; Operations; CRM,Remote; HR,66387,95533,80960,61.5,38,30.3,136,https://www.arbeitnow.com/jobs/companies/medisteg-gmbh/candidate-experience-operations-associate-leipzig-49810,"Du bist der menschliche Kern eines KI-gestützten Vermittlungsprozesses. MediSteg bringt approbierte internationale Ärztinnen und Ärzte an deutsche Kliniken — und du stellst sicher, dass jeder Schritt dieses Prozesses sow"
raw-0052,2026-05-27,Arbeitnow API,FEEDBACKPEOPLE Management Beratung,Teamleiter:in Backoffice / Office Management (m/w/d),Product & Project Management,Management,Senior/Lead,Greven,teamleitung,Product Management; Project Management; Agile; Stakeholder Management,Management; Team Leader,84132,121068,102600,51.2,48,38.6,123,https://www.arbeitnow.com/jobs/companies/feedbackpeople-management-beratung/teamleiterin-backoffice-office-management-greven-488232,"“Wir glauben an die Macht des Feedbacks” Wir glauben, dass durch anspruchsvolle, feedbackintensive Personalentwicklungsverfahren Mitarbeitende inspiriert und Organisationen erfolgreicher werden. Deswegen bringen wir auße"
raw-0053,2026-05-27,Arbeitnow API,TenMedia GmbH,Tech Content Manager / Online-Redakteur (m/w/d) | Berlin-Mitte | Festanstellung,Software & Engineering,Online Marketing,Senior/Lead,Berlin,,Scrum; Video Editing; SEO,Online Marketing,97416,140184,118800,47.5,48,38.6,123,https://www.arbeitnow.com/jobs/companies/tenmedia-gmbh/tech-content-manager-online-redakteur-berlin-mitte-festanstellung-5103,"Du willst nicht nur über Software schreiben, sondern direkt neben den Entwicklern sitzen, die sie bauen? Dann bist du bei TenMedia richtig. Wir entwickeln seit über 14 Jahren Individualsoftware im Herzen Berlins und such"
raw-0054,2026-05-27,Arbeitnow API,Telura GmbH,Senior Drilling Systems Engineer / Head of Drilling Systems,Software & Engineering,Engineering,Senior/Lead,Munich,professional / experienced,Operations; Design,Engineering,97416,140184,118800,91.4,48,38.6,123,https://www.arbeitnow.com/jobs/companies/telura-gmbh/senior-drilling-systems-engineer-head-of-drilling-systems-munich-404452,"Are you driven by rethinking how drilling systems are designed from first principles? Do you believe the future of geothermal energy depends on radically simpler, faster, and lower-cost drilling architectures? At Telura,"
raw-0055,2026-05-27,Arbeitnow API,Vicoland,Business Development Manager (m/w/d) für wachstumsstarkes Tech-Startup,Marketing & Growth,Business Development,Senior/Lead,Berlin,teamleitung,Startup; SaaS; CRM; SAP,Business Development,66420,95580,81000,56.1,48,38.6,123,https://www.arbeitnow.com/jobs/companies/vicoland/business-development-manager-fur-wachstumsstarkes-tech-startup-berlin-362658,"Über Vicoland Vicoland gibt dem Professional-Services-Markt eine neue Dimension: Virtuelle Unternehmen – „Vicos“. Wir haben Vicos als neue Art von Dienstleister erfunden, effizienter als traditionelle Professional-Servic"
raw-0056,2026-05-27,Arbeitnow API,Lionflence,Junior Artist Manager / Influencer Manager (m/w/d),Software & Engineering,Marketing and Communication,Senior/Lead,Mülheim,,Communication; Social Media,Marketing and Communication,97416,140184,118800,77.4,48,38.6,123,https://www.arbeitnow.com/jobs/companies/lionflence/junior-artist-manager-influencer-manager-mulheim-229845,"Was wir Dir bieten: Eine spannende Herausforderung, in der du dich weiterentwickeln kannst, rundum den Bereich Artistmanagement Medien/Social Media, Influencer Marketing und den dazugehörigen Technologien (Software Syste"
raw-0057,2026-05-27,Arbeitnow API,Lionflence,Junior Artist Manager / Influencer Manager (m/w/d),Software & Engineering,Marketing and Communication,Senior/Lead,Berlin,,Communication; Social Media,Marketing and Communication,97416,140184,118800,77.4,48,38.6,123,https://www.arbeitnow.com/jobs/companies/lionflence/junior-artist-manager-influencer-manager-berlin-230756,"Was wir Dir bieten: Eine spannende Herausforderung, in der du dich weiterentwickeln kannst, rundum den Bereich Artistmanagement Medien/Social Media, Influencer Marketing und den dazugehörigen Technologien (Software Syste"
raw-0058,2026-05-27,Arbeitnow API,Lionflence,Artist Manager / Influencer Manager (m/w/d) BERLIN,Software & Engineering,Marketing and Communication,Senior/Lead,Berlin,,Communication; Social Media,Marketing and Communication,97416,140184,118800,77.4,48,38.6,123,https://www.arbeitnow.com/jobs/companies/lionflence/artist-manager-influencer-manager-berlin-298238,"Was wir Dir bieten: Eine spannende Herausforderung, in der du dich weiterentwickeln kannst, rundum den Bereich Artistmanagement Medien/Social Media, Influencer Marketing und den dazugehörigen Technologien (Software Syste"
raw-0059,2026-05-27,Arbeitnow API,Lionflence,Trainee Artist Manager / Influencer Manager (m/w/d),Software & Engineering,Training,Internship/Student,Berlin,hilfstätigkeit / student,AI; Social Media,Training; Development,39688,57112,48400,75.8,38,30.3,136,https://www.arbeitnow.com/jobs/companies/lionflence/trainee-artist-manager-influencer-manager-berlin-230098,"Was wir Dir bieten: Eine spannende Herausforderung, in der du dich weiterentwickeln kannst, rundum den Bereich Artistmanagement Medien/Social Media, Influencer Marketing und den dazugehörigen Technologien (Software Syste"
raw-0060,2026-05-27,Arbeitnow API,Lionflence,Trainee Artist Manager / Influencer Manager (m/w/d),Software & Engineering,Training,Internship/Student,Mülheim,hilfstätigkeit / student,AI; Social Media,Training; Development,39688,57112,48400,75.8,38,30.3,136,https://www.arbeitnow.com/jobs/companies/lionflence/trainee-artist-manager-influencer-manager-mulheim-323130,"Was wir Dir bieten: Eine spannende Herausforderung, in der du dich weiterentwickeln kannst, rundum den Bereich Artistmanagement Medien/Social Media, Influencer Marketing und den dazugehörigen Technologien (Software Syste"
raw-0061,2026-05-27,Arbeitnow API,Lionflence,Artist Manager / Influencer Manager (m/w/d),Software & Engineering,Marketing and Communication,Senior/Lead,Mülheim,,Communication; Social Media,Marketing and Communication,97416,140184,118800,77.4,48,38.6,123,https://www.arbeitnow.com/jobs/companies/lionflence/artist-manager-influencer-manager-mulheim-433250,"Was wir Dir bieten: Eine spannende Herausforderung, in der du dich weiterentwickeln kannst, rundum den Bereich Artistmanagement Medien/Social Media, Influencer Marketing und den dazugehörigen Technologien (Software Syste"
raw-0062,2026-05-27,Arbeitnow API,Contegy,(Junior) PR & Social Media Consultant - B2B,Marketing & Growth,Public Relations,Entry-level,Munich,,Communication; Social Media; Startup; Figma,Public Relations; Corporate Communication,36900,53100,45000,67.1,38,30.3,136,https://www.arbeitnow.com/jobs/companies/contegy/junior-pr-social-media-consultant-b2b-munich-198881,"Contegy ist die Boutique Agentur für B2B-Unternehmen aus dem Technologie- und Industrieumfeld. Wir unterstützen unsere Kunden dabei, komplexe und erklärungsbedürftige Themen klar und wirkungsvoll zu kommunizieren. Wir su"
raw-0063,2026-05-27,Arbeitnow API,talenthafen GmbH,Head of Staff (m/w/d),Finance & Business,Business Consulting,Senior/Lead,Hamburg,teamleitung,HR,Business Consulting,75276,108324,91800,61.2,48,38.6,123,https://www.arbeitnow.com/jobs/companies/talenthafen-gmbh/head-of-staff-hamburg-459537,"Das sind wir: talenthafen ist eine der wachstumsstärksten Recruiting- &#x26; HR-Tech-Plattformen im DACH-Raum. Wir verbinden Unternehmen mit den richtigen Menschen – schnell, präzise und mit echter Leidenschaft für Peopl"
raw-0064,2026-05-27,Arbeitnow API,Japan Management,Customer Operations & Field Sales Manager (m/f/d),Product & Project Management,Management,Senior/Lead,Düsseldorf,berufserfahren,Operations; Sales,Management; Team Leader,84132,121068,102600,74.7,48,38.6,123,https://www.arbeitnow.com/jobs/companies/japan-management/customer-operations-field-sales-manager-dusseldorf-90746,"Für den Transport chemischer Flüssigkeiten oder anderer anspruchsvoller Medien werden Speziallösungen benötigt, die größtmögliche Effizienz mit einem Höchstmaß an Sicherheit verbinden. Als globaler Entwicklungspartner bi"
raw-0065,2026-05-27,Arbeitnow API,talenthafen GmbH,Performance Marketing Manager (m/w/d),Marketing & Growth,Marketing Manager,Senior/Lead,Hamburg,,Performance Marketing,Marketing Manager,66420,95580,81000,47.1,48,38.6,123,https://www.arbeitnow.com/jobs/companies/talenthafen-gmbh/performance-marketing-manager-hamburg-432010,"Du willst nicht nur Kampagnen managen, sondern Wirkung erzielen? Dann werde Teil unseres Teams als Performance Marketing Manager (m/w/d)! Bei talenthafen arbeitest du an der Schnittstelle von Strategie, Umsetzung und Ber"
raw-0066,2026-05-27,Arbeitnow API,Reverion GmbH,Senior People Manager / HRBP - Production (d/w/m),Product & Project Management,Training,Senior/Lead,Eresing,berufserfahren,AI; Operations; Startup; HR,Training; Development,84132,121068,102600,69.3,48,38.6,123,https://www.arbeitnow.com/jobs/companies/reverion-gmbh/senior-people-manager-hrbp-production-eresing-442275,"Unser Ziel ist eine dezentrale, flexible und CO₂-negative Energieversorgung und genau daran arbeiten wir jeden Tag bei Reverion. Dafür entwickeln wir innovative, reversible Kraftwerke, die Gase wie Biogas oder Wasserstof"
raw-0067,2026-05-27,Arbeitnow API,Quantum- Systems GmbH,Senior Robotics & Machine Learning Engineer (m/f/d) - Fernride GmbH,Data & AI,Internet and software,Senior/Lead,München,"Full-time permanent, experienced",Machine Learning; Research; Testing; Startup; Python; Design; CI/CD; Rust; C++; AI,Internet and software; bachelor's degree,94095,135405,114750,64.7,77,51.1,85,https://www.arbeitnow.com/jobs/companies/quantum-systems-gmbh/senior-robotics-machine-learning-engineer-fernride-gmbh-munchen-258296,"As a Senior Robotics &amp; Machine Learning Engineer, you will shape the next generation of autonomous ground systems. You will design and implement core components of our end‑to‑end autonomy stack — from perception and "
raw-0068,2026-05-27,Arbeitnow API,MY Humancapital GmbH,IT Projektmanager Software Implementierung (m/w/d),Software & Engineering,Project Management,Senior/Lead,Munich,,Project Management,Project Management,97416,140184,118800,51.5,48,38.6,123,https://www.arbeitnow.com/jobs/companies/my-humancapital-gmbh/it-projektmanager-software-implementierung-munich-106017,Im Auftrag unser Partnerunternehmen in München suchen wir Sie als „IT Projektmanager Software Implementierung (m/w/d)“. Aufgaben Als IT Projektmanager (m/w/d) leiten und steuern Sie internationale Kundenprojekte zur Impl
raw-0069,2026-05-27,Arbeitnow API,CUSTOM CAREERS FACTORY GmbH,Bilanzbuchhalter & Accounting (m/w/d),Finance & Business,Controlling,Mid-level,Sonthofen,berufserfahren,Accounting; ERP,Controlling,55760,80240,68000,52,38,30.3,136,https://www.arbeitnow.com/jobs/companies/custom-careers-factory-gmbh/bilanzbuchhalter-accounting-sonthofen-224336,"Das Unternehmen ist in einem stabilen, regional geprägten Versorgungsumfeld tätig und übernimmt eine wichtige Rolle in der kaufmännischen Steuerung seiner Geschäftsprozesse. Die Position ist zentral im Finanzbereich ange"
raw-0070,2026-05-27,Arbeitnow API,MY Humancapital GmbH,Simulationsingenieur Elektrotechnik (m/w/d),Software & Engineering,Engineering,Unspecified,Munich,,Python; JavaScript; API; Cloud,Engineering,66387,95533,80960,85.2,62,40.7,104,https://www.arbeitnow.com/jobs/companies/my-humancapital-gmbh/simulationsingenieur-elektrotechnik-munich-200873,Im Auftrag unser Partnerunternehmen in München suchen wir Sie als „Simulationsingenieur Elektrotechnik (m/w/d)“. Aufgaben Als Simulationsingenieur (m/w/d) modellieren und simulieren Sie das elektrische Bordnetz mithilfe 
raw-0071,2026-05-27,Arbeitnow API,1KOMMA5˚,Internship Energy Analyst (m/f/d),Data & AI,Software Development,Internship/Student,Hamburg,"Internship, no experience required / student",Data Science; Research; Python; SQL; AI,Software Development,38335,55165,46750,64.8,51,35.9,119,https://www.arbeitnow.com/jobs/companies/1komma50/internship-energy-analyst-hamburg-155369,"1KOMMA5° At 1KOMMA5° , we pursue a clear vision: Living on wind and sunlight forever for free . To make this a reality, we are building the energy system of the future with Heartbeat AI. Want to be part of it?We bring to"
raw-0072,2026-05-27,Arbeitnow API,1KOMMA5˚,Working Student Energy Analyst (m/f/d),Data & AI,Software Development,Internship/Student,Hamburg,"Working student, no experience required / student",Data Science; Research; Python; SQL; AI,Software Development,38335,55165,46750,64.8,51,35.9,119,https://www.arbeitnow.com/jobs/companies/1komma50/working-student-energy-analyst-hamburg-397100,"1KOMMA5° At 1KOMMA5° , we pursue a clear vision: Living on wind and sunlight forever for free . To make this a reality, we are building the energy system of the future with Heartbeat AI. Want to be part of it?We bring to"
raw-0073,2026-05-27,Arbeitnow API,Landesfachverband Medienbildung Brandenburg (lmb e.V.),Betreuung digitaler Anlagen und Lerninfrastruktur (m/w/d),Software & Engineering,System and Network Administration,Mid-level,Cottbus,berufserfahren,CRM,System and Network Administration,72160,103840,88000,56.8,38,30.3,136,https://www.arbeitnow.com/jobs/companies/landesfachverband-medienbildung-brandenburg-lmb-ev/betreuung-digitaler-anlagen-und-lerninfrastruktur-cottbus-167568,Der Landesfachverband Medienbildung Brandenburg ist der Ansprechpartner für Medienbildung in Brandenburg. Im Fokus seiner Arbeit steht die Stärkung von Medienkompetenz bei Fachkräften der Kinder- und Jugendarbeit sowie v
raw-0074,2026-05-27,Arbeitnow API,MY Humancapital GmbH,Softwareentwickler VBA / Microsoft Access (m/w/d),Software & Engineering,Software Development,Unspecified,Munich,,Frontend,Software Development,66387,95533,80960,51.5,38,30.3,136,https://www.arbeitnow.com/jobs/companies/my-humancapital-gmbh/softwareentwickler-vba-microsoft-access-munich-341809,Im Auftrag unser Partnerunternehmen in München suchen wir Sie als „Softwareentwickler VBA / Microsoft Access (m/w/d)“. Aufgaben Als Softwareentwickler VBA / Access (m/w/d) pflegen und erweitern bestehende Anwendungssoftw
raw-0075,2026-05-27,Arbeitnow API,trafficdesign GmbH,Werkstudent:in - Sales Operations & Automation (m/w/d),Marketing & Growth,Business Development,Internship/Student,Cologne,Working student,Performance Marketing; Automation; Operations; Design; Sales; CRM,Business Development,27060,38940,33000,69.4,38,30.3,136,https://www.arbeitnow.com/jobs/companies/trafficdesign-gmbh/werkstudentin-sales-operations-automation-cologne-8588,"Du hast eine eingebaute Allergie gegen Stillstand und liebst es, wenn Systeme mit Lichtgeschwindigkeit laufen? ✨ Bei trafficdesign geben wir uns nicht mit „Standard“ zufrieden – wir sind die High-End-Agentur für Performa"
raw-0076,2026-05-27,Arbeitnow API,Omnora GmbH,Business Analyst (m/w/d) – Agentisierung & AI Automation,Data & AI,Software Development,Mid-level,Frankfurt am Main,berufserfahren,Forecasting; Automation; Finance; Sales; AI,Software Development,69700,100300,85000,64.4,43,32.5,129,https://www.arbeitnow.com/jobs/companies/omnora-gmbh/business-analyst-agentisierung-ai-automation-frankfurt-am-main-360412,"Introduction In dieser Rolle baust du den Hebel, der Omnora in der Execution schneller macht als den Markt: Agentisierung. Du identifizierst die Prozesse und Entscheidungsstellen mit dem größten Business-Impact und übers"
raw-0077,2026-05-27,Arbeitnow API,Omnora GmbH,Customer Success Manager (w/m/d),Product & Project Management,Customer Service,Senior/Lead,Frankfurt am Main,berufserfahren,Customer Service,Customer Service,84132,121068,102600,52.5,48,38.6,123,https://www.arbeitnow.com/jobs/companies/omnora-gmbh/customer-success-manager-frankfurt-am-main-145453,Introduction Führe als Customer Success Manager (w/m/d) bei omnora unsere Kunden zu nachhaltigem Erfolg beim Thema Wissenstransfer. Erfolg siehst du vor allem anhand zweier Kriterien: Durch die wertvolle Nutzung unserer 
raw-0078,2026-05-27,Arbeitnow API,Omnora GmbH,Performance Marketing Manager (w/m/d),Marketing & Growth,Marketing and Communication,Senior/Lead,Frankfurt am Main,berufserfahren,Communication; Performance Marketing; Sales,Marketing and Communication,66420,95580,81000,69.4,48,38.6,123,https://www.arbeitnow.com/jobs/companies/omnora-gmbh/performance-marketing-manager-frankfurt-am-main-137158,"Introduction Du willst nicht einfach Anzeigen schalten - du willst Pipelines bauen. Du denkst in Systemen, liebst Zahlen und weißt genau, welcher Hebel welche Wirkung hat? Dann suchen wir genau dich. Bei Omnora übernimms"
raw-0079,2026-05-27,Arbeitnow API,Omnora GmbH,Founding AI Engineer (m/w/d),Software & Engineering,Project Management,Mid-level,Frankfurt am Main,berufserfahren,Project Management; AI,Project Management,72160,103840,88000,66.6,38,30.3,136,https://www.arbeitnow.com/jobs/companies/omnora-gmbh/founding-ai-engineer-frankfurt-am-main-165839,"About The Role And Potential Progression Mit unserer Intelligence Management Plattform lösen wir eine der größten Herausforderungen der kommenden Dekade: Wie Unternehmen ihr Expertenwissen bewahren , bevor es durch Ruhes"
raw-0080,2026-05-27,Arbeitnow API,trafficdesign GmbH,Creative Strategist - Performance Marketing (m/w/d),Marketing & Growth,Online Marketing,Mid-level,Hamburg,berufserfahren,Performance Marketing; Testing; Design,Online Marketing,49200,70800,60000,73.4,38,30.3,136,https://www.arbeitnow.com/jobs/companies/trafficdesign-gmbh/creative-strategist-performance-marketing-hamburg-387344,"Ideas that stick. Strategy that scales. Aufgaben Creative-first Mindset: Du weißt: Creative Testing ist das neue Targeting. Als Creative Strategist entwickelst du datengetriebene Creative-Strategien, die im Performance M"
raw-0081,2026-05-27,Arbeitnow API,Computerra Hard- und Software GmbH,Softwareentwickler (m/w/d),Software & Engineering,Software Development,Unspecified,Wiesbaden,,Kubernetes; JavaScript; TypeScript; Python; Docker; React; Java,Software Development,66387,95533,80960,58.2,54,37.2,115,https://www.arbeitnow.com/jobs/companies/computerra-hard-und-software-gmbh/softwareentwickler-wiesbaden-185331,"Seit unserer Gründung im Jahr 1987 ist Computerra ein etablierter IT-Dienstleister mit Hauptsitz in Wiesbaden. Wir bieten umfassende Lösungen für IT-Infrastrukturen und entwickeln gleichzeitig individuelle Software, die "
raw-0082,2026-05-27,Arbeitnow API,olli design,Teamassistenz / Projektmanagement,Marketing & Growth,Graphic Arts and Communication Design,Unspecified,Hamburg,,Communication; Design; Excel,Graphic Arts and Communication Design,45264,65136,55200,83.1,38,30.3,136,https://www.arbeitnow.com/jobs/companies/olli-design/teamassistenz-projektmanagement-hamburg-459389,Für unsere kleine Design-Agentur im Herzen Hamburgs suchen wir ab Mitte/Ende Juli 2026 eine Teamassistenz / Assistenz der Geschäftsführung in Teilzeit mit Option auf Vollzeit. Unser Büro liegt direkt am Fleet zwischen St
raw-0083,2026-05-27,Arbeitnow API,reboVet Veterinär-Fachgroßhandel GmbH und Co. KG,Marketing Manager (m/w/d),Marketing & Growth,Marketing Manager,Senior/Lead,Bocholt,Contract,Social Media; Cloud,Marketing Manager,66420,95580,81000,82.2,56,42.1,112,https://www.arbeitnow.com/jobs/companies/rebovet-veterinar-fachgrosshandel-gmbh-und-co-kg/marketing-manager-bocholt-378582,"Sind Sie bereit, Ihre berufliche Zukunft in die Hand zu nehmen? Willkommen bei reboVet! Stellen Sie sich vor, Sie arbeiten bei einem Unternehmen, das seit über 45 Jahren die Bedürfnisse seiner Kunden versteht und zuverlä"
raw-0084,2026-05-27,Arbeitnow API,Einklang,(AI) Marketingmanager:in,Marketing & Growth,Marketing Manager,Senior/Lead,Cologne,teamleitung,Performance Marketing; Sales; AI,Marketing Manager,66420,95580,81000,68.3,48,38.6,123,https://www.arbeitnow.com/jobs/companies/einklang/ai-marketingmanagerin-cologne-267838,"Einklang bringt den Stromverbrauch von Unternehmen in Einklang mit Sonne und Wind. Wir kombinieren Batteriespeicher, dynamische Tarife und intelligente Steuerung, damit Mittelständler unabhängiger und günstiger Strom bez"
