job_id,date_posted,source,company,title,category,raw_category,seniority,location,job_type,skills,tags_raw,salary_min_usd,salary_max_usd,salary_mid_usd,demand_index,scarcity_score,time_to_fill_days_proxy,application_volume_proxy,source_url,description_preview
raw-0170,2026-05-27,Arbeitnow API,Taxtalente.de,"Steuerberater (m/w/d) in Bensheim, auf Wunsch mit Partnerperspektive, gesucht - mindestens 90.000€",Software & Engineering,Directors,Unspecified,Bensheim,,Python; JavaScript; API; Cloud,Directors; Chief Executives,66387,95533,80960,85,62,40.7,104,https://www.arbeitnow.com/jobs/companies/taxtalentede/steuerberater-in-bensheim-auf-wunsch-mit-partnerperspektive-gesucht-mindestens-90000eur-167749,TaxTalente ist die Nr. 1 Job-Matching Plattform für Jobsuchende in der Steuerberatung. Sie suchen eine positive berufliche Veränderung? Sie möchten den nächsten Schritt in Ihrer Karriere gehen und streben möglicherweise 
raw-0171,2026-05-27,Arbeitnow API,Taxtalente.de,"Steuerberater (m/w/d) in Stützengrün, auf Wunsch mit Partnerperspektive, gesucht - mindestens 90.000€",Software & Engineering,Directors,Unspecified,Stützengrün,,Python; JavaScript; API; Cloud,Directors; Chief Executives,66387,95533,80960,85,62,40.7,104,https://www.arbeitnow.com/jobs/companies/taxtalentede/steuerberater-in-stutzengrun-auf-wunsch-mit-partnerperspektive-gesucht-mindestens-90000eur-223656,TaxTalente ist die Nr. 1 Job-Matching Plattform für Jobsuchende in der Steuerberatung. Sie suchen eine positive berufliche Veränderung? Sie möchten den nächsten Schritt in Ihrer Karriere gehen und streben möglicherweise 
raw-0172,2026-05-27,Arbeitnow API,Taxtalente.de,"Steuerberater (m/w/d) in Feucht, auf Wunsch mit Partnerperspektive, gesucht - mindestens 90.000€",Software & Engineering,Directors,Unspecified,Feucht,,Python; JavaScript; API; Cloud,Directors; Chief Executives,66387,95533,80960,85,62,40.7,104,https://www.arbeitnow.com/jobs/companies/taxtalentede/steuerberater-in-feucht-auf-wunsch-mit-partnerperspektive-gesucht-mindestens-90000eur-134061,TaxTalente ist die Nr. 1 Job-Matching Plattform für Jobsuchende in der Steuerberatung. Sie suchen eine positive berufliche Veränderung? Sie möchten den nächsten Schritt in Ihrer Karriere gehen und streben möglicherweise 
raw-0173,2026-05-27,Arbeitnow API,Taxtalente.de,"Steuerberater (m/w/d) in Kiedrich, auf Wunsch mit Partnerperspektive, gesucht - mindestens 90.000€",Software & Engineering,Directors,Unspecified,Kiedrich,,Python; JavaScript; API; Cloud,Directors; Chief Executives,66387,95533,80960,85,62,40.7,104,https://www.arbeitnow.com/jobs/companies/taxtalentede/steuerberater-in-kiedrich-auf-wunsch-mit-partnerperspektive-gesucht-mindestens-90000eur-54137,TaxTalente ist die Nr. 1 Job-Matching Plattform für Jobsuchende in der Steuerberatung. Sie suchen eine positive berufliche Veränderung? Sie möchten den nächsten Schritt in Ihrer Karriere gehen und streben möglicherweise 
raw-0174,2026-05-27,Arbeitnow API,Taxtalente.de,"Steuerberater (m/w/d) in Hennigsdorf, auf Wunsch mit Partnerperspektive, gesucht - mindestens 90.000€",Software & Engineering,Directors,Unspecified,Hennigsdorf,,Python; JavaScript; API; Cloud,Directors; Chief Executives,66387,95533,80960,85,62,40.7,104,https://www.arbeitnow.com/jobs/companies/taxtalentede/steuerberater-in-hennigsdorf-auf-wunsch-mit-partnerperspektive-gesucht-mindestens-90000eur-151268,TaxTalente ist die Nr. 1 Job-Matching Plattform für Jobsuchende in der Steuerberatung. Sie suchen eine positive berufliche Veränderung? Sie möchten den nächsten Schritt in Ihrer Karriere gehen und streben möglicherweise 
raw-0175,2026-05-27,Arbeitnow API,BrainersHub GmbH,Werkstudent Digital Marketer (m/w/d),Software & Engineering,Remote,Internship/Student,Hamburg,Working student,SEO,Remote; Online Marketing,39688,57112,48400,46.9,38,30.3,136,https://www.arbeitnow.com/jobs/companies/brainershub-gmbh/werkstudent-digital-marketer-hamburg-161284,"Du studierst Marketing, Business oder einen verwandten Studiengang und willst endlich richtig loslegen? Du interessierst dich für Content Marketing, SEO und digitale Strategien und möchtest lernen, wie moderne Webseiten "
raw-0176,2026-05-27,Arbeitnow API,Stannek GmbH,IT-Consultant Digitalisierung & DATEV Cloud (m/w/d),Finance & Business,Consulting,Unspecified,Hallstadt,,Cloud; HR,Consulting,51299,73821,62560,77.7,46,33.8,125,https://www.arbeitnow.com/jobs/companies/stannek-gmbh/it-consultant-digitalisierung-datev-cloud-hallstadt-194236,"IT-Consultant Digitalisierung &#x26; DATEV Cloud (m/w/d) Cloud, Prozesse &#x26; Digitalisierung für Steuerkanzleien Hallstadt / Hybrid ⚙ Vollzeit Dein Einstieg bei uns Du willst nicht einfach nur Tickets bearbeiten. Du w"
raw-0177,2026-05-27,Arbeitnow API,Smart Battery Solutions GmbH,IT- Expert / Cloud & Infrastructure Administrator (m/w/d),Software & Engineering,System and Network Administration,Unspecified,Kleinostheim,,Cybersecurity; Security; Docker; Azure; Cloud,System and Network Administration,66387,95533,80960,57.5,70,44.1,94,https://www.arbeitnow.com/jobs/companies/smart-battery-solutions-gmbh/it-expert-cloud-infrastructure-administrator-kleinostheim-428146,"Die Smart Battery Solutions GmbH (SBS) ist ein stark wachsendes, hochinnovatives, eigentümergeführtes mittelständisches Unternehmen in der Batteriebranche mit derzeit knapp 80 Mitarbeitern. Seit über 15 Jahren agiert SBS"
raw-0178,2026-05-26,Arbeitnow API,Flix,Senior Data Platform Engineer,Data & AI,Unspecified,Senior/Lead,"Berlin, Berlin, Germany",,Cloud; CI/CD; AWS,,94095,135405,114750,64.2,69,47.7,95,https://www.arbeitnow.com/jobs/companies/flix/senior-data-platform-engineer-berlin-267183,"At Flix, we offer a dynamic work environment with competitive pay, strong growth opportunities, and a tech-driven approach to making travel more accessible, sustainable, and affordable. &nbsp; We're&nbsp;looking for a mo"
raw-0179,2026-05-26,Arbeitnow API,Tensordyne,Working Student AI/ML,Data & AI,Unspecified,Internship/Student,"Munich, Bavaria, Germany",,AI; Generative AI; Communication; Research; Startup; AI/ML; Video Editing,,38335,55165,46750,61.3,59,39.4,108,https://www.arbeitnow.com/jobs/companies/tensordyne/working-student-ai-ml-munich-345668,"About Tensordyne (formerly Recogni) Artificial intelligence (AI) is transforming our world. It can perform cognitive functions that previously only humans could do, such as perceiving interactions across different modali"
raw-0180,2026-05-26,Arbeitnow API,Bolt Technology,"Principal Product Manager, Rides Matching",Data & AI,Unspecified,Senior/Lead,"Berlin, Berlin, Germany",,Machine Learning; Communication; Marketplace; Testing,,94095,135405,114750,59.8,61,44.2,106,https://www.arbeitnow.com/jobs/companies/bolt-technology/principal-product-manager-rides-matching-berlin-331984,"&lt;gh-intro&gt; &lt;text&gt; We are looking for a Principal Product Manager to join the Rides team at Bolt. In this role, you will be accountable for defining and executing the product strategy for our matching and disp"
raw-0181,2026-05-26,Arbeitnow API,Flix,Senior Software Engineer - Mobile/Android (m/f/d),Data & AI,Unspecified,Senior/Lead,"Berlin, Berlin, Germany",,Automation; Onboarding; Android; Backend; Testing; Docker; Design; CI/CD; Agile; Figma; iOS,,94095,135405,114750,57.5,61,44.2,106,https://www.arbeitnow.com/jobs/companies/flix/senior-software-engineer-mobile-android-berlin-256431,"At Flix, we offer a tech-driven environment where innovation meets real-world impact, with competitive pay, strong growth opportunities, and a culture of collaboration and ownership. We're looking for a Senior Software E"
raw-0182,2026-05-26,Arbeitnow API,Flix,"Product Designer (Mobile, Android) (m/f/d) - FlixTech",Data & AI,Unspecified,Unspecified,"Berlin, Berlin, Germany",,Stakeholder Management; Marketplace; Onboarding; Research; Android; Testing; Design; Figma,,64124,92276,78200,60.5,43,32.5,129,https://www.arbeitnow.com/jobs/companies/flix/product-designer-mobile-android-flixtech-berlin-468405,"At Flix, we offer a tech-driven environment where innovation meets real-world impact, with competitive pay, strong growth opportunities, and a culture of collaboration and ownership. &nbsp; We are looking for a&nbsp; Pro"
raw-0183,2026-05-26,Arbeitnow API,SumUp,Mid Data Analyst - Finance,Data & AI,Unspecified,Mid-level,"Berlin, Berlin, Germany",,Stakeholder Management; Data Analytics; Tableau; Finance,,69700,100300,85000,51.2,43,32.5,129,https://www.arbeitnow.com/jobs/companies/sumup/mid-data-analyst-finance-berlin-429308,"About the team: We are looking for a Data Analyst to join and strengthen our Commercial Analytics Team within Finance, supporting SumUp's strategic initiatives. In this role, you will partner closely with the Global and "
raw-0184,2026-05-26,Remotive API,LawnStarter,Staff Product Engineer (Campinas),Data & AI,Product Management,Senior/Lead,Brazil,full_time,Marketplace; TypeScript; Frontend; Security; Research; Backend; AI/ML; React; UI/UX; REST; AWS; Git,AWS; backend; frontend; php; react; security; UI/UX; AI/ML; jira; react native; research; documentation; laravel; Typescript; people management; prototyping; engineering management; marketplace; github; REST; datadog,94095,135405,114750,51.1,77,51.1,85,https://remotive.com/remote-jobs/product/staff-product-engineer-campinas-2090902,"This is a remote role for candidates located in Campinas, Brazil. About LawnStarter LawnStarter is the nation's leading on-demand marketplace for lawn care and outdoor services, with over $100M in annual bookings. We're "
raw-0185,2026-05-26,Arbeitnow API,Sensetik Group GmbH,Werkstudent:in Social Media & Content Creation (m/w/d),Marketing & Growth,Social Media Manager,Internship/Student,County of Rietberg,"Contract, berufseinstieg",Social Media,Social Media Manager,27060,38940,33000,69.5,38,30.3,136,https://www.arbeitnow.com/jobs/companies/sensetik-group-gmbh/werkstudentin-social-media-content-creation-county-of-rietberg-10564,"Die Sensetik Group GmbH ist ein junges DTC-Haus aus Rietberg. Wir bauen mehrere Upcoming Brands im Bereich Beauty, Personal Care und Lifestyle auf — und stehen gerade am Anfang einer großen Wachstumsphase im DACH-Raum. U"
raw-0186,2026-05-26,The Muse API,PNC,Teller,Product & Project Management,Education,Unspecified,"Prescott, AZ",external,Customer Service; Risk Management; Operations; Sales,Education; Mid Level,57334,82506,69920,61.4,38,30.3,136,https://www.themuse.com/jobs/pnc/teller-412e46,"Position Overview At PNC, our people are our greatest differentiator and competitive advantage in the markets we serve. We are all united in delivering the best experience for our customers. We work together each day to "
raw-0187,2026-05-26,The Muse API,GE Vernova,Engineer Controls Engineering,Software & Engineering,Science and Engineering,Unspecified,"Tambaram, India",external,Design,Science and Engineering; Mid Level,66387,95533,80960,100,38,30.3,136,https://www.themuse.com/jobs/gevernova/engineer-controls-engineering-d14131,"Job Description Summary Systems Engineering ist eine funktionsübergreifende technische Disziplin, die sich auf einen Ansatz, eine Denkweise und einen Prozess konzentriert. Alle Tätigkeiten, die sowohl die geschäftlichen "
raw-0188,2026-05-26,Arbeitnow API,Plantforge,Co-Founder | Founders Associate (ab 10h/Woche),Marketing & Growth,Management,Unspecified,Bochum,,Startup,Management; Team Leader,45264,65136,55200,60.8,38,30.3,136,https://www.arbeitnow.com/jobs/companies/plantforge/co-founder-founders-associate-ab-10h-woche-bochum-149637,"Bist du bereit, mit uns die Zukunft der Landwirtschaft zu gestalten? Plantforge sucht einen Co-Founder / Founders Associate, der genauso leidenschaftlich für Indoor-Farming und innovative Technologien brennt wie wir! Wir"
raw-0189,2026-05-26,Arbeitnow API,Right Search,SAP PP/PP-PI/QM Consultant (w/m/d),Product & Project Management,SAP/ERP Consulting,Mid-level,Munich,berufserfahren,ERP; SAP; Sales,SAP/ERP Consulting; Development,62320,89680,76000,61.2,38,30.3,136,https://www.arbeitnow.com/jobs/companies/right-search/sap-pp-pp-pi-qm-consultant-munich-50820,"SAP PP/PP-PI/QM Consultant (w/m/d) München – unbefristet, Vollzeit, bis zu 3 Tage Homeoffice + Firmenwagen nach Probezeit Du willst nicht nur SAP-Module konfigurieren, sondern echte End-to-End-Lösungen bauen – in regulie"
raw-0190,2026-05-26,Arbeitnow API,Right Search,Teamlead Support | Medical Imaging IT (w/m/d),Software & Engineering,System and Network Administration,Senior/Lead,Munich,,Operations; Cloud; SQL,System and Network Administration,97416,140184,118800,72.7,56,42.1,112,https://www.arbeitnow.com/jobs/companies/right-search/teamlead-support-medical-imaging-it-munich-231617,"Teamlead Support – Medical Imaging IT (w/m/d) Büchenbach / München – unbefristet, 40 Std., bis zu 4 Tage Homeoffice Du willst nicht nur Tickets schließen, sondern ein Team aufbauen, Prozesse formen und echte Verantwortun"
raw-0191,2026-05-26,Arbeitnow API,L1VE GmbH,"Senior Post Production Manager (360° VR, international)",Software & Engineering,Project Management,Internship/Student,Berlin,professional / experienced,Project Management; Design,Project Management,39688,57112,48400,80.3,38,30.3,136,https://www.arbeitnow.com/jobs/companies/l1ve-gmbh/senior-post-production-manager-360-vr-international-berlin-41399,"Your mission To strengthen our team, we are looking for a Senior Post Production Manager (360° VR, International) who builds, optimizes, and leads a high-performance 360° VR post-production pipeline for picture and 3D au"
raw-0192,2026-05-26,Arbeitnow API,pechschwarz GmbH,Designer - Brand (m/w/d),Marketing & Growth,Marketing and Communication,Unspecified,Wuppertal,,Communication; Design; Cloud; Figma; AI,Marketing and Communication,45264,65136,55200,84.3,46,33.8,125,https://www.arbeitnow.com/jobs/companies/pechschwarz-gmbh/designer-brand-wuppertal-151111,"Wer wir sind pechschwarz® ist eine multidisziplinäre Markenagentur für Strategy, Branding, Webdesign, Content Creation sowie Search und Social Marketing. Wir entwickeln Marken und digitale Plattformen, die Unternehmen in"
raw-0193,2026-05-26,Arbeitnow API,pechschwarz GmbH,UX Designer (m/w/d),Marketing & Growth,Marketing and Communication,Unspecified,Wuppertal,,Communication; Design; Figma,Marketing and Communication,45264,65136,55200,82,38,30.3,136,https://www.arbeitnow.com/jobs/companies/pechschwarz-gmbh/ux-designer-wuppertal-132791,"Wer wir sind pechschwarz® ist eine multidisziplinäre Markenagentur für Strategy, Branding, Webdesign, Content Creation sowie Search und Social Marketing. Wir entwickeln Marken und digitale Plattformen, die Unternehmen in"
raw-0194,2026-05-26,Arbeitnow API,Iron mountain,Werkstudent (w/m/d)- Imaging Specialist/ Datenerfasser/in (20 Stunden pro Woche),HR & Recruitment,IT,Internship/Student,Berlin,,Operations,IT,25256,36344,30800,72.7,38,30.3,136,https://www.arbeitnow.com/jobs/companies/iron-mountain/werkstudent-imaging-specialist-datenerfasser-in-20-stunden-pro-woche-berlin-310305,Iron Mountain sucht einen motivierten Werkstudent (w/m/d)- Imaging Specialist/ Datenerfasser/in (20 Stunden pro Woche) für unser Digital Operations -Team. In dieser zentralen Rolle sind Sie verantwortlich für die terming
raw-0195,2026-05-26,Arbeitnow API,Stadtwerke Oberursel (Taunus) GmbH,Technischer Objektbetreuer / Liegenschaftsmanager m/w/d,Software & Engineering,Building,Senior/Lead,Oberursel,berufserfahren,Python; JavaScript; API; Cloud,Building; Supply; Safety Services Engineering,97416,140184,118800,84.8,72,49,91,https://www.arbeitnow.com/jobs/companies/stadtwerke-oberursel-taunus-gmbh/technischer-objektbetreuer-liegenschaftsmanager-oberursel-462484,Mit rund 130 Mitarbeitenden im Stadtwerke Oberursel-Konzern geben wir täglich unser Bestes für die Lebensqualität der Menschen in der Region. Als kommunales Energieversorgungsunternehmen bieten wir vielfältige Produkte u
raw-0196,2026-05-26,Arbeitnow API,Logistikbude GmbH,(Senior) Test Automation Engineer (m/w/d),Software & Engineering,Software Development,Senior/Lead,Dortmund,,Automation; Testing; Design; Azure; Cloud; CI/CD; .NET; API; AI; C#,Software Development,97416,140184,118800,66.6,72,49,91,https://www.arbeitnow.com/jobs/companies/logistikbude-gmbh/senior-test-automation-engineer-dortmund-158086,"Lust auf Software-Qualität und Testing? Dann bist du bei uns genau richtig! Wir suchen einen engagierten Software-Tester / QA Engineer (m/w/d), der mit Leidenschaft dafür sorgt, dass unsere Anwendungen fehlerfrei, perfor"
raw-0197,2026-05-26,Arbeitnow API,Logistikbude GmbH,(Senior) AI Software Engineer (m/w/d),Software & Engineering,Software Development,Senior/Lead,Dortmund,,Product Management; Sales; .NET; SaaS; AI; C#,Software Development,97416,140184,118800,58.3,48,38.6,123,https://www.arbeitnow.com/jobs/companies/logistikbude-gmbh/senior-ai-software-engineer-dortmund-369112,"Lust, AI in ein echtes Produkt zu bringen? Dann bist du bei uns genau richtig! Wir suchen einen engagierten Software Developer mit AI-Fokus (m/w/d), der mit uns die nächste Generation unserer Logistik-Plattform mitgestal"
raw-0198,2026-05-26,Arbeitnow API,benuta GmbH,Buchhalter / Finanzbuchhalter (m/w/d),Product & Project Management,Finance,Mid-level,Bonn,"Contract, berufserfahren",Finance; ERP,Finance,62320,89680,76000,61.9,38,30.3,136,https://www.arbeitnow.com/jobs/companies/benuta-gmbh/buchhalter-finanzbuchhalter-bonn-359747,"Jobbeschreibung Willkommen bei benuta, dem führenden E-Commerce-Unternehmen für Teppiche! Seit 2008 begeistern wir über 1,5 Millionen Menschen in 17 Ländern mit unseren Onlineshops. Wir haben es uns zur Aufgabe gemacht, "
raw-0199,2026-05-26,Arbeitnow API,Sanna Lindström GmbH,Social Media Marketing Praktikum (m/w/d),Marketing & Growth,Online Marketing,Internship/Student,Viersen,"Internship, berufserfahren",Social Media; Design,Online Marketing,27060,38940,33000,89.4,38,30.3,136,https://www.arbeitnow.com/jobs/companies/sanna-lindstrom-gmbh/social-media-marketing-praktikum-viersen-78149,Du suchst eine spannende Herausforderung bei einem der stärkst wachsenden Fashion-Brands in Deutschland? SANNA LINDSTRÖM ist ein deutsch-schwedisches Brautmode- und Lifestylelabel. Nationale Bekanntheit hat das Label vor
raw-0200,2026-05-26,Arbeitnow API,Fischer & Partner Gesellschaft für Personal mbH,"Leiter Liquiditätssteuerung, Cashmanagement, Finanzen (w/m/d) mit Entwicklungsperspektive!",Product & Project Management,Management,Mid-level,Berlin,berufserfahren,Product Management; Project Management; Agile; Stakeholder Management,Management; Team Leader,62320,89680,76000,50.8,38,30.3,136,https://www.arbeitnow.com/jobs/companies/fischer-partner-gesellschaft-fur-personal-mbh/leiter-liquiditatssteuerung-cashmanagement-finanzen-mit-entwicklungsperspektive-berlin-79829,"Für eine Unternehmensgruppe mit 10 Beteiligungen bzw. Tochterunternehmen und mit Sitz in Berlin suchen wir Sie als Leiter Liquiditätssteuerung, Cashmanagement und Finanzen (w/m/d) mit Entwicklungsperspektive. Das inhaber"
raw-0201,2026-05-26,Arbeitnow API,STEINZEIT GmbH,Freelancer für Produktzeichnung von Möbeln und Regalsystemen (m/w/d),Product & Project Management,Product Design,Mid-level,Berlin,"Freelance, berufserfahren",Design,Product Design; Industrial Design,62320,89680,76000,100,38,30.3,136,https://www.arbeitnow.com/jobs/companies/steinzeit-gmbh/freelancer-fur-produktzeichnung-von-mobeln-und-regalsystemen-berlin-58266,"Bei STEINZEIT finden Sie das größte Marmorlager Berlins. Seit 25 Jahren fertigen wir für den luxuriösen Innenausbau exklusive Produkte aus Marmor, Onyx, Granit und vielen anderen Natursteinen: Hotel- und Restaurantaussta"
raw-0202,2026-05-26,Arbeitnow API,hey contact heroes GmbH,Mediendesigner/in (m/w/d) als Minijob,Marketing & Growth,Graphic Arts and Communication Design,Unspecified,Hamburg,,Communication; Design; Social Media,Graphic Arts and Communication Design,45264,65136,55200,87.8,38,30.3,136,https://www.arbeitnow.com/jobs/companies/hey-contact-heroes-gmbh/mediendesigner-in-als-minijob-hamburg-609,Mediendesigner/in (m/w/d) als Minijob Die hey contact heroes GmbH ist ein sehr erfolgreicher Kundenservice-Dienstleister mit Sitz in der Hamburger HafenCity. Wir bieten unseren Kunden professionelle Kundendialog-Dienstle
raw-0203,2026-05-26,Arbeitnow API,REM ZERO GmbH,"Energieberater (m/w/d) BEG, iSFP & Fördermittel",Software & Engineering,Engineering,Unspecified,Stuttgart,,Python; JavaScript; API; Cloud,Engineering,66387,95533,80960,84.8,62,40.7,104,https://www.arbeitnow.com/jobs/companies/rem-zero-gmbh/energieberater-beg-isfp-fordermittel-stuttgart-397485,"Wer wir sind Wir sind die REM ZERO – wir haben den klaren Anspruch, alles rundum die energetische Sanierung besser zu machen. Das bedeutet bei uns: kurze Entscheidungswege, flache Hierarchien und der Gestaltungsspielraum"
raw-0204,2026-05-26,Arbeitnow API,Pronux GmbH,Senior Customer Success Manager (m/w/d),Software & Engineering,Customer Service,Senior/Lead,Rosenheim,berufserfahren,Customer Service; Sales; SaaS,Customer Service,97416,140184,118800,61.1,48,38.6,123,https://www.arbeitnow.com/jobs/companies/pronux-gmbh/senior-customer-success-manager-rosenheim-462708,"Du willst nicht nur Kunden betreuen. Du willst Wachstum gestalten. Du denkst strategisch, handelst unternehmerisch und hast Lust, in einem modernen Softwareunternehmen wirklich etwas zu bewegen? Dann suchen wir genau dic"
raw-0205,2026-05-26,Arbeitnow API,Meyerhof Holding GmbH & Co. KG,Kaufmännischer Mitarbeiter - Vertrieb & Operations (m/w/d),Finance & Business,Controlling,Unspecified,Steinfeld,,Operations; Excel; ERP,Controlling,51299,73821,62560,61.5,38,30.3,136,https://www.arbeitnow.com/jobs/companies/meyerhof-holding-gmbh-co-kg/kaufmannischer-mitarbeiter-vertrieb-operations-steinfeld-463417,Die Meyerhof Holding ist eine familiengeführte Unternehmensgruppe im Bereich der Tiergesundheit und -ernährung. Der Hauptsitz befindet sich auf dem historischen Meyerhof in Mühlen. Hier werden aufgrund von Synergieeffekt
raw-0206,2026-05-25,The Muse API,JPMorgan Chase,Fixed Income - Associate,Software & Engineering,Software Engineering,Unspecified,"Mumbai, India",external,Risk Management; Onboarding; Research,Software Engineering; Mid Level,66387,95533,80960,51.8,38,30.3,136,https://www.themuse.com/jobs/jpmorganchase/fixed-income-associate,"You are a strategic thinker passionate about driving solutions using qualitative and quantitative skills. You have found the right team. As the Investments Due Diligence professional in our Fixed Income Multi Asset team,"
raw-0207,2026-05-21,Remotive API,LawnStarter,Staff Product Engineer (São Paulo),Data & AI,Product Management,Senior/Lead,Brazil,full_time,Marketplace; TypeScript; Frontend; Security; Research; Backend; AI/ML; React; UI/UX; REST; AWS; Git,AWS; backend; frontend; php; react; security; UI/UX; AI/ML; jira; react native; research; documentation; laravel; Typescript; people management; prototyping; engineering management; marketplace; github; REST; datadog,94095,135405,114750,49.2,77,51.1,85,https://remotive.com/remote-jobs/product/staff-product-engineer-sao-paulo-2090890,"This is a remote role for candidates located in São Paulo (Brazil) About LawnStarter LawnStarter is the nation's leading on-demand marketplace for lawn care and outdoor services, with over $100M in annual bookings. We're"
raw-0208,2026-05-20,The Muse API,Flex,Business Excellence Leader,Software & Engineering,Business Operations,Senior/Lead,"Guadalajara, Mexico",external,Operations; Design,Business Operations; Mid Level,97416,140184,118800,88.8,48,38.6,123,https://www.themuse.com/jobs/flex/business-excellence-leader-51deab,"Flex is the diversified manufacturing partner of choice that helps market-leading brands design, build and deliver innovative products that improve the world. A career at Flex offers the opportunity to make a difference "
raw-0209,2026-05-20,The Muse API,BD,Operador Multifuncional II,Software & Engineering,Unknown,Unspecified,"Juiz de Fora, Brazil",external,Design,Unknown; Mid Level,66387,95533,80960,100,38,30.3,136,https://www.themuse.com/jobs/bd/operador-multifuncional-ii-97389f,"We are the people who give possibilities purpose BD is one of the largest global medical technology companies in the world. Advancing the world of health™ is our Purpose, and it's no small feat. It takes the imagination "
raw-0210,2026-05-19,Remotive API,EverAI,Mid/Senior AI Cinematic Video Editor,Data & AI,Artificial Intelligence,Senior/Lead,Worldwide,full_time,Editing; Design; Excel; AI/ML; Video Editing; REST; AI; Finance,excel; video; AI/ML; customer acquisition; graphic design; video production; after effects; editing; SOLID; REST; insurance,94095,135405,114750,61.1,61,44.2,106,https://remotive.com/remote-jobs/artificial-intelligence/mid-senior-ai-cinematic-video-editor-2090887,"Our Vision &amp; Products 🚀 EverAI — Building the Future of AI Companionship One of the Top 15 Largest &amp; Fastest-Growing AI Companies in the World 50 Million Users in 2 years — Help Us Reach 100M first, 500M next At"
raw-0211,2026-05-19,The Muse API,KinderCare Learning Companies,Lead Teacher at Upland Elementary School,Software & Engineering,Education,Senior/Lead,"Rancho Cucamonga, CA",external,Customer Service,Education; Senior Level,97416,140184,118800,49.5,48,38.6,123,https://www.themuse.com/jobs/kindercarelearningcompanies/lead-teacher-at-upland-elementary-school,"Futures start here. Where first steps, new friendships, and confident learners are born. At KinderCare Learning Companies, the first and only early childhood education provider recognized with the Gallup Exceptional Work"
