source,source_url,date_posted,company,title,category,location,job_type,tags_raw,description
Arbeitnow API,https://www.arbeitnow.com/jobs/companies/apaleo/senior-full-stack-engineer-python-net-munich-423188,2026-07-23T06:45:24,Apaleo,Senior Full-Stack Engineer (Python & .NET) (f/m/d),,"Munich, Bavaria, Germany",,,"Join Apaleo and Shape the Future of Hospitality Tech! At Apaleo, we're revolutionizing the hospitality industry with our AI-first property management platform, giving businesses the power to build a tech ecosystem that enhances both guest experiences and staff efficiency. With seamless integrations to hundreds of apps through the Apaleo Store, our platform simplifies operations, elevates the guest journey, and drives revenue growth. Are you ready to make an impact? We're looking for a&nbsp; Senior Full-Stack Engineer (Python &amp; .NET) (f/m/d) to join our dynamic team and help shape the future of hospitality technology! What You'll Be Up To Develop and maintain scalable backend services hosted on AWS with a strong focus on Python-based applications and AI-driven products. Contribute to full stack development initiatives, including backend APIs and selected frontend components using TypeScript , HTML , and CSS . Balance speed and quality, ensuring maintainable, reliable, and production-ready code without overengineering . Mentor and support junior AI engineers by providing technical guidance, architectural feedback, and best practices. Collaborate closely with product stakeholders, AI engineers, and cross-functional teams to deliver new AI-related products and platform capabilities. Contribute to future platform initiatives, including potential work within the .NET-based Storefront API ecosystem . What You'll Bring to the Team 5+ years of professional software engineering experience with strong backend development expertise, including advanced proficiency in Python for building scalable backend systems and production-ready services. Experience with cloud platforms such as AWS/ Azure / GCP. Strong understanding of software architecture, code quality practices, and engineering best practices. Ability to work independently, take ownership of projects, and operate effectively as a senior individual contributor. We are looking for candidates with hands-on C#/.NET development experience, given that C#/.NET 10 is our primary backend stack and key to our long-term platform strategy and flexibility. Strong problem-solving, and collaboration skills, especially within fast-growing engineering teams. A proactive mindset with the ability to guide junior engineers and help scale engineering excellence across the organization. Nice to Have: Frontend development experience with TypeScript , HTML , and CSS is a plus. Interest or experience in AI-related products , machine learning, or data engineering environments is beneficial. What We Offer Culture &amp; Growth A Diverse &amp; International Team: Work alongside passionate professionals from over 20 nationalities, bringing unique cultural perspectives, backgrounds, and experiences to shape the future of hospitality tech. Growth &amp; Development: As we scale, so do your opportunities. You'll benefit from 360° feedback reviews, a dedicated learning budget, and plenty of chances to take on more responsibility. Our evolving career framework ensures you have increasing opportunities to learn new skills, advance your career, and make an impact. Autonomy &amp; Ownership: Great ideas can come from anywhere. We empower you to take responsibility, make decisions, and contribute directly in an environment built on trust, transparency, and collaboration. Shape the Future of Hospitality Tech: Be part of a fast-growing scale-up transforming the hospitality industry. From day one, your work drives real impact and you'll have the freedom to bring your ideas to life. Competitive &amp; Fair Compensation: We believe great work deserves great pay. Our salaries are competitive and guided by benchmarking data to ensure fairness across all roles and teams. We make sure to recognize and reward performance and contribution. Perks &amp; Lifestyle Flexible &amp; Remote Work Options: We focus on results, not clocking hours. You can work from home, the office or in a hybrid setup, with flexibility to adapt your schedule"
Arbeitnow API,https://www.arbeitnow.com/jobs/companies/flix/senior-full-stack-engineer-station-management-inventory-berlin-437079,2026-07-23T06:45:22,Flix,Senior Full-Stack Engineer (m/f/d) - Station Management & Inventory,,"Berlin, Berlin, Germany",,,"We are looking for a motivated and curious Senior Full-Stack Engineer (Java/Kotlin) &nbsp;to&nbsp;join our team&nbsp;in&nbsp;Supply&nbsp;Division&nbsp;and drive customer station experience to the next level! &nbsp; In an&nbsp;ever growing&nbsp;network, Flix customers worldwide expect a comfortable and seamless experience at our stations as part of their travel experience. Our self-organized, cross-functional&nbsp;and distributed team builds products to enable Flix station managers to scale management of the station inventory, which a wide range of internal tech teams across Flix depend on, and overall serves to improve the experience at our stations for millions of passengers. &nbsp; In this role, you will continue to shape the product by driving innovation, solving complex challenges, and creating a lasting impact on our organization. &nbsp; About the Role You take ownership of roadmap epics as topic driver, aligning technical requirements and solutions across the team together with the product owner As part of the team you will work closely with business stakeholders on continuously developing and improving the product vision You always keep the business value in mind when making decisions&nbsp; You drive the development process using an agile environment As part of your daily work, you collaborate closely with your fellow team members, for example in pair and ensemble programming, doing code reviews, testing, and operations&nbsp; You frequently deliver new versions of the product, using continuous integration and delivery&nbsp; You work confidently with or learn how to use cutting-edge technologies and tools including but not limited to: &nbsp; Kotlin across server and browser (we use Kotlin a lot!)&nbsp; JVM on server-side (Ktor, Axon Framework)&nbsp; Component-based Frontend (Compose HTML, but we value experience with similar libraries and frameworks)&nbsp; Distributed system architecture (Apache Kafka, HTTP/REST)&nbsp; Infrastructure with CI/CD (AWS, Docker, Kubernetes, Terraform, Datadog, Gitlab)&nbsp; About You 5+ years of software engineering experience, primarily backend development with a JVM language Willingness to work with Kotlin Solid front-end skills with modern front-end stack Experience with event-driven architectures; exposure to event sourcing, CQRS, and domain-driven design (DDD) is a plus Hands-on experience with automation and deployment of applications into cloud infrastructure (e.g., AWS, Azure) using CI/CD pipelines and DevOps best practices&nbsp; Proficiency in system design and architecture You take responsibility for the product and technical decisions Clear written and spoken English communication skills We recognize that everyone carries a unique set of valuable skills and experiences. If you think you could have an impact even though you don't meet 100% of the requirements, we still encourage you to apply. We want to hear from you! &nbsp; What We Offer Travel perks : 12 free Flix vouchers + 12 discount vouchers for friends &amp; family.&nbsp; Work from (M)Anywhere : Depending on your role, work from another location for up to 60 days per year.&nbsp; Hybrid work model : We are an office-first company, but we offer flexibility to balance work and life.&nbsp; Wellbeing support : Access confidential 1:1 counselling, courses, and stress management for yourself and up to four family members.&nbsp; Learning &amp; Development : Take advantage of language classes, training courses, and expert-led sessions to grow your skills.&nbsp; Mentoring Program : Connect with experienced colleagues to gain insights and accelerate your career.&nbsp; To view more local benefits specific to each office location, please check out this link:&nbsp; Locations - Flix Career Why Join Flix? At Flix, we empower our teams to push boundaries and shape the future of mobility. As we continue to scale globally, we harness cutting-edge technology to make mobility smarter, more sustainable, and more affordable. If you're looking for "
Arbeitnow API,https://www.arbeitnow.com/jobs/companies/clariness/senior-business-development-director-hamburg-199577,2026-07-23T06:45:21,Clariness,Senior Business Development Director (f/m/d),,"Hamburg, Germany",,,"Clariness is looking for a Senior Business Development Director (f/md/) based in Germany, UK, US, Serbia, South Africa. - Full-time; unlimited - &nbsp; About the role: &nbsp; Clariness helps patients access clinical trials faster through our ClinLife® platform, active in 50+ countries. In this role, you will turn expertise into real-world impact, connecting patients with studies and accelerating medical breakthroughs. Make your next role matter - help more patients join life-changing studies. &nbsp; As a Senior Business Development Director, you would be responsible for: Prospect, develop, and close new business opportunities within the biotechnology, pharmaceutical, medical device, and CRO sectors. Grow and manage strategic and existing customer accounts. Build strong relationships with clients, partners, distributors, and key opinion leaders. Represent the company at conferences, networking events, and client meetings. Maintain an accurate sales pipeline and provide reliable sales forecasts. Support leadership in achieving commercial objectives and identifying opportunities to improve products, services, and processes. Act as a trusted advisor by bringing market insights and challenging existing approaches to drive continuous improvement. We would like you to have:&nbsp; Bachelor's degree in Business, Life Sciences, Marketing, or a related field, or equivalent professional experience. Minimum 8 years of sales and business development experience with responsibility for achieving commercial targets. Proven experience working with large pharmaceutical companies, biotechnology, CROs, or the broader life sciences industry. Experience across key commercial and marketing disciplines, including communications, demand generation, and product marketing, in international markets. Experience supporting or leading large-scale patient recruitment campaigns. Demonstrated success in building strategic client relationships and driving business growth. Strong communication, negotiation, presentation, and stakeholder management skills. Experience hiring, mentoring, and developing high-performing commercial or marketing talent is an advantage. Self-driven, strategic, and customer-focused with the ability to build lasting partnerships. You may ask now, why should I work for you? Let us give you a few reasons – and you'll learn more during the process. A varied and exciting job with a lot of personal responsibility in an international company, where you can develop and expand your skills. Professional and personal development opportunities - incl. personal development budget. Flexible working hours and mobile working. Regular team events and open feedback culture. A versatile field of activity and challenging projects. A supportive and open company culture, providing the opportunity to collaborate with a diverse and professional team. Impact healthcare by accelerating medical innovation through improved access to clinical trials, potentially bringing needed treatments to patients faster. &nbsp; How to apply &amp; what to expect: &nbsp; Apply via link (CV only; no cover letter required). Introductory call (30 min) → Technical interview → Senior Leadership Interview →&nbsp; Demo Day → Decision. We aim to move promptly and keep you updated at every step. &nbsp; &nbsp; At Clariness , we are proud to be an equal opportunity employer. We celebrate diversity and are committed to creating an inclusive environment for all employees, regardless of race, religion, gender, sexual orientation, national origin, disability or age. For more information, feel free to reach out to Have we sparked your interest? Would you like to become part of our dynamic, curious, and international culture with plenty of room for your ideas and creativity in an inspiring atmosphere? If so, we look forward to receiving your application with details of your desired salary and possible starting date, preferably via our application portal. Clariness GmbH will treat the above informat"
Arbeitnow API,https://www.arbeitnow.com/jobs/companies/clariness/senior-business-development-director-berlin-103249,2026-07-23T06:45:21,Clariness,Senior Business Development Director (f/m/d),,"Berlin, Germany",,,"Clariness is looking for a Senior Business Development Director (f/md/) based in Germany, UK, US, Serbia, South Africa. - Full-time; unlimited - &nbsp; About the role: &nbsp; Clariness helps patients access clinical trials faster through our ClinLife® platform, active in 50+ countries. In this role, you will turn expertise into real-world impact, connecting patients with studies and accelerating medical breakthroughs. Make your next role matter - help more patients join life-changing studies. &nbsp; As a Senior Business Development Director, you would be responsible for: Prospect, develop, and close new business opportunities within the biotechnology, pharmaceutical, medical device, and CRO sectors. Grow and manage strategic and existing customer accounts. Build strong relationships with clients, partners, distributors, and key opinion leaders. Represent the company at conferences, networking events, and client meetings. Maintain an accurate sales pipeline and provide reliable sales forecasts. Support leadership in achieving commercial objectives and identifying opportunities to improve products, services, and processes. Act as a trusted advisor by bringing market insights and challenging existing approaches to drive continuous improvement. We would like you to have:&nbsp; Bachelor's degree in Business, Life Sciences, Marketing, or a related field, or equivalent professional experience. Minimum 8 years of sales and business development experience with responsibility for achieving commercial targets. Proven experience working with large pharmaceutical companies, biotechnology, CROs, or the broader life sciences industry. Experience across key commercial and marketing disciplines, including communications, demand generation, and product marketing, in international markets. Experience supporting or leading large-scale patient recruitment campaigns. Demonstrated success in building strategic client relationships and driving business growth. Strong communication, negotiation, presentation, and stakeholder management skills. Experience hiring, mentoring, and developing high-performing commercial or marketing talent is an advantage. Self-driven, strategic, and customer-focused with the ability to build lasting partnerships. You may ask now, why should I work for you? Let us give you a few reasons – and you'll learn more during the process. A varied and exciting job with a lot of personal responsibility in an international company, where you can develop and expand your skills. Professional and personal development opportunities - incl. personal development budget. Flexible working hours and mobile working. Regular team events and open feedback culture. A versatile field of activity and challenging projects. A supportive and open company culture, providing the opportunity to collaborate with a diverse and professional team. Impact healthcare by accelerating medical innovation through improved access to clinical trials, potentially bringing needed treatments to patients faster. &nbsp; How to apply &amp; what to expect: &nbsp; Apply via link (CV only; no cover letter required). Introductory call (30 min) → Technical interview → Senior Leadership Interview →&nbsp; Demo Day → Decision. We aim to move promptly and keep you updated at every step. &nbsp; &nbsp; At Clariness , we are proud to be an equal opportunity employer. We celebrate diversity and are committed to creating an inclusive environment for all employees, regardless of race, religion, gender, sexual orientation, national origin, disability or age. For more information, feel free to reach out to Have we sparked your interest? Would you like to become part of our dynamic, curious, and international culture with plenty of room for your ideas and creativity in an inspiring atmosphere? If so, we look forward to receiving your application with details of your desired salary and possible starting date, preferably via our application portal. Clariness GmbH will treat the above informat"
Arbeitnow API,https://www.arbeitnow.com/jobs/companies/nviso/junior-security-operations-engineering-consultant-frankfurt-am-main-211814,2026-07-23T06:30:31,NVISO,Junior Security Operations Engineering Consultant (m/w/d),IT Security,Frankfurt am Main,professional / experienced,IT Security,"It all starts with the mission: NVISO is here to protect European society from potentially devastating cyber attacks! This means we offer cyber security services to private and governmental organizations to help them better prepare for, prevent, detect and respond to cyber security incidents. All of this is built on four fundamental values that define who we are: We are Proud, We Break Barriers, We Care and No BS! Tasks As a Junior Security Operations Engineering Consultant (m/w/d) located in Germany you will assist in various Security Operations Center (SOC) projects. You will gain exposure to SOC engineering concepts such as log onboarding, detection engineering, and SIEM technologies. Under the guidance of senior team members, you will support the design and implementation of security solutions for customers across different sectors. You have strong communication and interpersonal skills, which enable you not only to understand requirements, but also to put these requirements into a development plan, explain it to customers and guarantee proper execution. You have an open and approachable mind, in line with NVISO's values. Typical tasks include but are not limited to: Planning and managing the onboarding of new log sources, troubleshooting issues with log sources or systems with clients and vendors; Creating technical and process playbooks; Defining and setting up correlation rules, based on threat intelligence and specific customer requirements; Contributing to incident response procedures; Ensuring you remain up to speed with latest trends and technologies in the SOC field. You are passionate about cyber security, engineering and automation. Building solutions and working with customers energizes you and you look forward to growing in all the aforementioned domains. Requirements You hold citizenship in one of the 32 NATO member states or the Austrian citizenship; 1-2 years of practical experience (such as a SOC Analyst) in the field of cybersecurity or IT is mandatory; Experience with Azure Sentinel, Microsoft Security stack, or SIEM technologies such as Elastic, Splunk, or LogPoint; Experience with scripting in Python and/or other relevant scripting or automation language is a big plus; Ideally, familiarity with SIEM query languages or an interest in learning Sigma and YARA rules; Experience or coursework related to cybersecurity is beneficial. Soft skills Ability to work independently, and keep track of your priorities; Strong interpersonal and verbal/written communication skills that enable the ability to work effectively in a collaborative team environment across the entire company; Excellent English and German communication skills, both verbal and written; A positive, team-oriented, and mission-driven attitude; Ability to prepare and present your work to colleagues. Benefits At NVISO, we care. We are committed to offering you a highly competitive remuneration package including financial and non-financial components: Working and learning from the best people in the European cyber security industry. We have multiple SANS Instructors working at NVISO, our staff has presented at popular hacking conferences (BlackHat, BruCON, OWASP, etc) and all of our technical staff can acquire deep technical security certifications (GSE, GXPN, GREM, GCFA, OSCP, etc); Generous training budget of 10.000 EUR + 10 man days for attending lectures rolling over 2 years; An annual gross base salary between 57.000 EUR and 62.000 EUR, depending on your experience; Support for technical growth with Cloud trainings + certifications (AWS, GCP, Azure); Regular team-building and fun events; Our commitment to coach and counsel you and help you grow; each employee receives a personal coach within the team, whose role is to ensure your well-being and helps you grow in your career! Flexible working hours and home office possibilities (incl. working abroad weeks within the EU); Business Bike Leasing; BahnCard 50 1st class + public transfer ticket; 30 holi"
Arbeitnow API,https://www.arbeitnow.com/jobs/companies/taxtalentede/steuerberater-in-gemmrigheim-auf-wunsch-mit-partnerperspektive-gesucht-mindestens-90000eur-432578,2026-07-23T06:30:31,Taxtalente.de,"Steuerberater (m/w/d) in Gemmrigheim, auf Wunsch mit Partnerperspektive, gesucht - mindestens 90.000€",Directors,Gemmrigheim,,Directors; Chief Executives,"TaxTalente ist die Nr. 1 Job-Matching Plattform für Jobsuchende in der Steuerberatung. Sie suchen eine positive berufliche Veränderung? Sie möchten den nächsten Schritt in Ihrer Karriere gehen und streben möglicherweise sogar eine Partnerschaft in einer zukunftsorientierten Kanzlei an? Sie möchten endlich wieder in einem positiven Arbeitsumfeld arbeiten, in dem Sie finanziell und persönlich wertgeschätzt werden? Sie suchen nach Tätigkeiten, die Sie auch wirklich weiterbringen? Sofern Sie sich in mindestens einem der genannten Punkte wiederfinden, sollten Sie sich bei uns melden. Wir haben die attraktivsten Arbeitgeber der Steuerberatungsbranche in unserem Netzwerk und bringen zusammen, was zusammengehört. Grenzenlose Entwicklungschancen mit Partnermöglichkeiten, vielschichtige Tätigkeitsbereiche, Gehälter wie in der Industrie und vieles mehr – melden Sie sich bei uns und wir unterstützen Sie auf Ihrem weiteren Karriereweg! Derzeit suchen wir nach einem Steuerberater (m/w/d) für eine unserer Partner-Kanzleien in Gemmrigheim Bei Rückfragen kannst du dich gerne jederzeit (auch nach deinem Feierabend) direkt telefonisch an Herrn Becker-Koch über folgende Nummer wenden: 015901431130 Aufgaben Wir bringen zusammen, was zusammengehört. Dabei spielt das passende Tätigkeitsprofil natürlich eine entscheidende Rolle. Bei unserer Partnerkanzlei können Sie sich Ihren Aufgabenbereich auf Basis Ihrer persönlichen Stärken und Schwächen selbst zusammenstellen. Erstellung und Review von Jahresabschlüssen Erstellung von Steuererklärungen für Personen- und Kapitalgesellschaften Steuerliche Sonderberatungsprojekte auf Basis individueller Qualifikationen B. in den Bereichen der Erbschaftsteuer oder des Umwandlungssteuerrechts Begleitung von Betriebsprüfungen Teamleitung und Personalverantwortung (optional) Weitere individuell wählbare Tätigkeitsbereiche , die Ihnen Freude bringen Qualifikation Am Ende sollte es für beide Seiten passen. Deshalb wäre es gut, wenn Sie sich in den folgenden Punkten wiederfinden. Kommunikative Art und Freude am Austausch mit Mandanten Sorgfältige , effiziente und gewissenhafte Arbeitsweise Offen für eine digitale Arbeitsweise Führungsverständnis und Verantwortungsbewusstsein gegenüber Mitarbeitern (optional) Ein erfolgreich abgeschlossenes Steuerberaterexamen Leidenschaft für steuerliche Themen Benefits Sie haben genug von 0815 Benefits, von denen Sie nicht wirklich profitieren? Dann sollten Sie einen Blick auf die nachfolgenden Benefits werfen. Außerordentliche Vergütung von 90.000 € bis 130.000 € / Jahr, auf Wunsch auch Partnerperspektive Flexible Gestaltung der Arbeitszeiten sowie die Option auf Home-Office Nettolohnoptimierung mit monatlichen 50,00€ Sachbezugsgutscheinen Umfangreiche Unterstützung bei Weiterbildungsmaßnahmen wie z.B. Fachberater Qualifikationen Modernste Ausstattung mit digitalen Prozessen Starker Teamzusammenhalt und regelmäßige Teamevents Schnell, unkompliziert und effizient Ihren Traumjob finden – ein Versprechen an Sie, dass wir aufgrund unseres selektiven, breit gefächerten und deutschlandweiten Kanzleinetzwerks halten werden. lhre Vorteile mit uns auf einen Blick: Sie führen keine unsinnigen Bewerbungsgespräche mehr, bei denen Sie während des Bewerbungsprozesses merken, dass es (bspw. wegen des Gehalts) sowieso nicht passt - wir klären vor Ihrem Bewerbungsgespräch all Ihre mit uns besprochenen Kriterien mit der Kanzlei ab. Wir führen Ihre Gehaltsverhandlungen und kennen die Gehaltsstrukturen der Branche dabei bestens. 100% Anonymität – solange Sie uns nicht das „Go“ geben und einem Kennenlernen mit Ihrem neuen potentiellen Arbeitgeber zustimmen, erfährt niemand von Ihrem Namen oder Ihren bisherigen Arbeitgebern – Ihre Ihnen wichtigen Kriterien können wir auch zunächst anonym mit unseren Partnerkanzleien klären. Attraktive Kanzleien – die Kanzleien in unserem breit gefächerten Kanzleinetzwerk sind selektiv ausgewählt und heben sich klar von “normalen” Kanzleien ab (z.B. hinsichtlich der Vergütun"
