source,source_url,date_posted,company,title,category,location,job_type,tags_raw,description
Arbeitnow API,https://www.arbeitnow.com/jobs/companies/nkuber-consulting/niederlassungsleiter-pflege-ingolstadt-233971,2026-07-11T12:30:25,NKuber Consulting,Niederlassungsleiter Pflege (m/w/d),HR,Ingolstadt,,HR,"Niederlassungsleiter (m/w/d) 6000 bis 8000 €, Boni Wir suchen in Ingolstadt für einen Personaldienstleister mit sehr gutem Ruf und deutlichen Umsatzsteigerungen in 2025 einen Niederlassungsleiter (m/w/d) Pflege**.** Ertragsbeteiligung Obelasse-PKW, Handy uvm. Wir sind erreichbar unter 01707984774 Aufgaben Verantwortung für den Ausbau der Standortes Führung und Motivierung eines Teams Erstellung einer Wachstumsstrategie Organisation der Kundenbetreuung und -akquise Organisation der Rekrutierung und Betreuung der externen Mitarbeiter Auf- und Ausbau der Kundennetzwerke Budgetverantwortung Qualifikation Ausbildung Studium oder kaufmännischer oder gewerblich-technischer Beruf Führungserfahrung in der Zeitarbeit mind. 3 Jahre Erfahrung in der Pflege Zugriff auf ein regionales Kundennetz Stressresistenz Soziale Kompetenz Begeisterungsfähigkeit Benefits Urlaubs- und Weihnachtsgeld Altersvorsorge Firmenhandy Wir freuen uns auf Ihre Kontaktaufnahme und sichern Ihnen 100 % Diskretion und einen professionellen Umgang mit Ihren Daten zu. Find Jobs in Germany on Arbeitnow"
Arbeitnow API,https://www.arbeitnow.com/jobs/companies/nkuber-consulting/niederlassungsleiter-pflege-regensburg-152725,2026-07-11T12:30:24,NKuber Consulting,Niederlassungsleiter Pflege (m/w/d),HR,Regensburg,,HR,"Niederlassungsleiter (m/w/d) 6000 bis 8000 €, Boni Wir suchen in Regensburg für einen Personaldienstleister mit sehr gutem Ruf und deutlichen Umsatzsteigerungen in 2025 einen Niederlassungsleiter (m/w/d) Pflege**.** Ertragsbeteiligung Obelasse-PKW, Handy uvm. Wir sind erreichbar unter 01707984774 Aufgaben Verantwortung für den Ausbau der Standortes Führung und Motivierung eines Teams Erstellung einer Wachstumsstrategie Organisation der Kundenbetreuung und -akquise Organisation der Rekrutierung und Betreuung der externen Mitarbeiter Auf- und Ausbau der Kundennetzwerke Budgetverantwortung Qualifikation Ausbildung Studium oder kaufmännischer oder gewerblich-technischer Beruf Führungserfahrung in der Zeitarbeit mind. 3 Jahre Erfahrung in der Pflege Zugriff auf ein regionales Kundennetz Stressresistenz Soziale Kompetenz Begeisterungsfähigkeit Benefits Urlaubs- und Weihnachtsgeld Altersvorsorge Firmenhandy Wir freuen uns auf Ihre Kontaktaufnahme und sichern Ihnen 100 % Diskretion und einen professionellen Umgang mit Ihren Daten zu. Find Jobs in Germany on Arbeitnow"
Arbeitnow API,https://www.arbeitnow.com/jobs/companies/nkuber-consulting/niederlassungsleiter-pflege-nuremberg-227817,2026-07-11T12:30:23,NKuber Consulting,Niederlassungsleiter Pflege (m/w/d),HR,Nuremberg,,HR,"Niederlassungsleiter (m/w/d) 6000 bis 8000 €, Boni Wir suchen in Nürnberg für einen Personaldienstleister mit sehr gutem Ruf und deutlichen Umsatzsteigerungen in 2025 einen Niederlassungsleiter (m/w/d) Pflege**.** Ertragsbeteiligung Obelasse-PKW, Handy uvm. Wir sind erreichbar unter 01707984774 Aufgaben Verantwortung für den Ausbau der Standortes Führung und Motivierung eines Teams Erstellung einer Wachstumsstrategie Organisation der Kundenbetreuung und -akquise Organisation der Rekrutierung und Betreuung der externen Mitarbeiter Auf- und Ausbau der Kundennetzwerke Budgetverantwortung Qualifikation Ausbildung Studium oder kaufmännischer oder gewerblich-technischer Beruf Führungserfahrung in der Zeitarbeit mind. 3 Jahre Erfahrung in der Pflege Zugriff auf ein regionales Kundennetz Stressresistenz Soziale Kompetenz Begeisterungsfähigkeit Benefits Urlaubs- und Weihnachtsgeld Altersvorsorge Firmenhandy Wir freuen uns auf Ihre Kontaktaufnahme und sichern Ihnen 100 % Diskretion und einen professionellen Umgang mit Ihren Daten zu. Find Jobs in Germany on Arbeitnow"
Arbeitnow API,https://www.arbeitnow.com/jobs/companies/nkuber-consulting/niederlassungsleiter-pflege-cologne-454397,2026-07-11T12:30:23,NKuber Consulting,Niederlassungsleiter Pflege (m/w/d),HR,Cologne,,HR,"Niederlassungsleiter (m/w/d) 6000 bis 8000 €, Boni Wir suchen in Köln für einen Personaldienstleister mit sehr gutem Ruf und deutlichen Umsatzsteigerungen in 2025 einen Niederlassungsleiter (m/w/d) Pflege**.** Ertragsbeteiligung Obelasse-PKW, Handy uvm. Wir sind erreichbar unter 01707984774 Aufgaben Verantwortung für den Ausbau der Standortes Führung und Motivierung eines Teams Erstellung einer Wachstumsstrategie Organisation der Kundenbetreuung und -akquise Organisation der Rekrutierung und Betreuung der externen Mitarbeiter Auf- und Ausbau der Kundennetzwerke Budgetverantwortung Qualifikation Ausbildung Studium oder kaufmännischer oder gewerblich-technischer Beruf Führungserfahrung in der Zeitarbeit mind. 3 Jahre Erfahrung in der Pflege Zugriff auf ein regionales Kundennetz Stressresistenz Soziale Kompetenz Begeisterungsfähigkeit Benefits Urlaubs- und Weihnachtsgeld Altersvorsorge Firmenhandy Wir freuen uns auf Ihre Kontaktaufnahme und sichern Ihnen 100 % Diskretion und einen professionellen Umgang mit Ihren Daten zu. Find more English Speaking Jobs in Germany on Arbeitnow"
Arbeitnow API,https://www.arbeitnow.com/jobs/companies/nkuber-consulting/niederlassungsleiter-pflege-mainz-216336,2026-07-11T11:30:29,NKuber Consulting,Niederlassungsleiter Pflege (m/w/d),HR,Mainz,,HR,"Niederlassungsleiter (m/w/d) 6000 bis 8000 €, Boni Wir suchen in Mainz für einen Personaldienstleister mit sehr gutem Ruf und deutlichen Umsatzsteigerungen in 2025 einen Niederlassungsleiter (m/w/d) Pflege**.** Ertragsbeteiligung Obelasse-PKW, Handy uvm. Wir sind erreichbar unter 01707984774 Aufgaben Verantwortung für den Ausbau der Standortes Führung und Motivierung eines Teams Erstellung einer Wachstumsstrategie Organisation der Kundenbetreuung und -akquise Organisation der Rekrutierung und Betreuung der externen Mitarbeiter Auf- und Ausbau der Kundennetzwerke Budgetverantwortung Qualifikation Ausbildung Studium oder kaufmännischer oder gewerblich-technischer Beruf Führungserfahrung in der Zeitarbeit mind. 3 Jahre Erfahrung in der Pflege Zugriff auf ein regionales Kundennetz Stressresistenz Soziale Kompetenz Begeisterungsfähigkeit Benefits Urlaubs- und Weihnachtsgeld Altersvorsorge Firmenhandy Wir freuen uns auf Ihre Kontaktaufnahme und sichern Ihnen 100 % Diskretion und einen professionellen Umgang mit Ihren Daten zu. Find more English Speaking Jobs in Germany on Arbeitnow"
Arbeitnow API,https://www.arbeitnow.com/jobs/companies/nkuber-consulting/niederlassungsleiter-pflege-dresden-399776,2026-07-11T11:30:29,NKuber Consulting,Niederlassungsleiter Pflege (m/w/d),HR,Dresden,,HR,"Niederlassungsleiter (m/w/d) 6000 bis 8000 €, Boni Wir suchen in Dresdeb für einen Personaldienstleister mit sehr gutem Ruf und deutlichen Umsatzsteigerungen in 2025 einen Niederlassungsleiter (m/w/d) Pflege**.** Ertragsbeteiligung Obelasse-PKW, Handy uvm. Wir sind erreichbar unter 01707984774 Aufgaben Verantwortung für den Ausbau der Standortes Führung und Motivierung eines Teams Erstellung einer Wachstumsstrategie Organisation der Kundenbetreuung und -akquise Organisation der Rekrutierung und Betreuung der externen Mitarbeiter Auf- und Ausbau der Kundennetzwerke Budgetverantwortung Qualifikation Ausbildung Studium oder kaufmännischer oder gewerblich-technischer Beruf Führungserfahrung in der Zeitarbeit mind. 3 Jahre Erfahrung in der Pflege Zugriff auf ein regionales Kundennetz Stressresistenz Soziale Kompetenz Begeisterungsfähigkeit Benefits Urlaubs- und Weihnachtsgeld Altersvorsorge Firmenhandy Wir freuen uns auf Ihre Kontaktaufnahme und sichern Ihnen 100 % Diskretion und einen professionellen Umgang mit Ihren Daten zu. Find Jobs in Germany on Arbeitnow"
Arbeitnow API,https://www.arbeitnow.com/jobs/companies/nkuber-consulting/niederlassungsleiter-pflege-darmstadt-134060,2026-07-11T11:30:28,NKuber Consulting,Niederlassungsleiter Pflege (m/w/d),HR,Darmstadt,,HR,"Niederlassungsleiter (m/w/d) 6000 bis 8000 €, Boni Wir suchen in Darmstadt für einen Personaldienstleister mit sehr gutem Ruf und deutlichen Umsatzsteigerungen in 2025 einen Niederlassungsleiter (m/w/d) Pflege**.** Ertragsbeteiligung Obelasse-PKW, Handy uvm. Wir sind erreichbar unter 01707984774 Aufgaben Verantwortung für den Ausbau der Standortes Führung und Motivierung eines Teams Erstellung einer Wachstumsstrategie Organisation der Kundenbetreuung und -akquise Organisation der Rekrutierung und Betreuung der externen Mitarbeiter Auf- und Ausbau der Kundennetzwerke Budgetverantwortung Qualifikation Ausbildung Studium oder kaufmännischer oder gewerblich-technischer Beruf Führungserfahrung in der Zeitarbeit mind. 3 Jahre Erfahrung in der Pflege Zugriff auf ein regionales Kundennetz Stressresistenz Soziale Kompetenz Begeisterungsfähigkeit Benefits Urlaubs- und Weihnachtsgeld Altersvorsorge Firmenhandy Wir freuen uns auf Ihre Kontaktaufnahme und sichern Ihnen 100 % Diskretion und einen professionellen Umgang mit Ihren Daten zu. Find more English Speaking Jobs in Germany on Arbeitnow"
The Muse API,https://www.themuse.com/jobs/flex/automation-technician-e2b532,2026-07-10T19:48:55,Flex,Automation Technician,Software Engineering,"Guadalajara, Mexico",external,Software Engineering; Mid Level,"Flex is the diversified manufacturing partner of choice that helps market-leading brands design, build and deliver innovative products that improve the world. A career at Flex offers the opportunity to make a difference and invest in your growth in a respectful, inclusive, and collaborative environment. If you are excited about a role but don't meet every bullet point, we encourage you to apply and join us to create the extraordinary. Job Summary El Automation Technician 5 estará ubicado en Guadalajara, Norte . Aquí hay algunos ejemplos de las actividades que estarás realizando: Diseño de piezas. Modelado manual Soporte en piso de producción por incidencias Ensamble de zonas de trabajo Pruebas con ensambles Interpretación de diagramas eléctricos. Habilidades indispensables para el rol: Manejo de herramientas de poder Experiencia con Solid Works Conocimientos en robots, mecanismos y sensores Programación de PLC (deseable) Paquetería office básico Inglés (deseable) Aquí hay unos ejemplos de nuestros beneficios: Fondo ahorro Seguro de vida Aguinaldo Prima vacacional Vales de despensa Transporte Comedor Subsidiado . Job Category Production Engineering Required Skills: Optional Skills: Flex is an Equal Opportunity Employer and employment selection decisions are based on merit, qualifications, and abilities. We do not discriminate based on: age, race, religion, color, sex, national origin, marital status, sexual orientation, gender identity, veteran status, disability, pregnancy status, or any other status protected by law. We're happy to provide reasonable accommodations to those with a disability for assistance in the application process. Please email accessibility@flex.com and we'll discuss your specific situation and next steps (NOTE: this email does not accept or consider resumes or applications. This is only for disability assistance. To be considered for a position at Flex, you must complete the application process first)."
The Muse API,https://www.themuse.com/jobs/charlesschwab/specialist-trading-and-trade-support-ea6d52,2026-07-10T19:42:07,Charles Schwab,"Specialist, Trading and Trade Support",Business Operations,"Lone Tree, CO, Westlake, TX",external,Business Operations; Senior Level,"Pay range: USD $24.66 - $47.07 / Hour Your opportunity At Schwab, you're empowered to make an impact on your career. Here, innovative thought meets creative problem solving, helping us challenge the status quo and transform the finance industry together. We believe in the importance of in-office collaboration and fully intend for the selected candidate for this role to work on site in the specified location(s). The CSIM Trade Operations Team (TOPS) plays a critical role in supporting Schwab's mutual fund and exchange traded fund (ETF) business by providing operational oversight and control across the trade lifecycle. In this role, you will help ensure the accurate processing, confirmation, settlement, and reconciliation of investment transactions, enabling portfolio managers and traders to focus on delivering positive outcomes for clients. Your work will directly contribute to maintaining the integrity, efficiency, and reliability of Schwab's investment operations. As a Trade Operations Analyst, you will partner with internal teams and external service providers-including brokers, custodians, accountants, and other market participants-to resolve trade, cash, and position discrepancies, monitor corporate actions, and maintain the quality and accuracy of critical operational data. You will use analytical thinking and problem-solving skills to investigate issues, identify process improvements, and support operational projects that enhance efficiency and strengthen controls. This role offers the opportunity to build expertise in trading and settlement processes while developing strong cross-functional relationships and influencing outcomes across a complex operating environment. You'll join a collaborative team that values accountability, continuous improvement, and partnership. Through exposure to a broad range of operational activities and industry participants, you'll have opportunities to expand your knowledge of investment operations, develop technical expertise, and make meaningful contributions to Schwab Asset Management's success. What you have Required Qualifications Bachelor's degree. 1+ years of professional experience in financial services, operations, accounting, business administration, investment operations, or a related field. Knowledge of trading and settlement processes for equity and/or fixed income securities. Demonstrated ability to analyze information, evaluate alternatives, and make sound decisions to resolve operational issues. Ability to identify, investigate, and solve problems independently while managing multiple priorities. Strong communication skills with the ability to build collaborative relationships across teams and with external partners. Ability to work effectively in a team-oriented environment while adapting to changing priorities and business needs. Strong attention to detail with the ability to maintain data accuracy and support operational controls. Ability to work a flexible 8-hour schedule between 7:00 AM and 5:00 PM CST. Preferred Qualifications 1+ years of experience in trade operations, investment operations, settlements, reconciliations, or related financial operations functions. Experience partnering with brokers, custodians, prime brokers, fund accountants, or other financial services vendors. Experience monitoring vendor performance metrics and supporting operational oversight activities. Experience identifying workflow improvements and contributing to process optimization initiatives. Experience supporting operational projects or system enhancement initiatives. Familiarity with Omgeo Central Trade Manager (CTM). Experience using BlackRock Aladdin or similar investment management platforms. In addition to the salary range, this role is eligible for bonus or incentive opportunities. What's in it for you At Schwab, you're empowered to shape your future. We champion your growth through meaningful work, continuous learning, and a culture of trust and collaboration-so you can build the "
Remotive API,https://remotive.com/remote-jobs/software-development/staff-software-engineer-product-belo-horizonte-2091056,2026-07-09T14:45:43,LawnStarter,"Staff Software Engineer, Product (Belo Horizonte)",Software Development,Brazil,full_time,AWS; backend; frontend; php; react; security; UI/UX; AI/ML; jira; react native; documentation; laravel; Typescript; people management; prototyping; engineering management; marketplace; github; REST; datadog,"This is a remote role for candidates located in Belo Horizonte, Brazil. About LawnStarter LawnStarter is the nation's leading on-demand marketplace for lawn care and outdoor services, with over $100M in annual bookings. We're expanding beyond lawn care to become the one-stop shop for all home services — operating across three brands (LawnStarter, Lawn Love, Home Gnome) on a single shared platform. About Engineering at LawnStarter We build in small, focused initiative teams: a Product Engineer working alongside a PM and a designer, supported by an Engineering Manager who helps you grow. You'll also work shoulder-to-shoulder with engineering peers across initiatives in a shared codebase. The whole team owns whether the work moves its metric. AI coding agents are a force multiplier here — they give a small, senior team the leverage to ship more, faster, and at a higher bar for quality. We hire engineers who are wired for ownership and energized by shipping to a real marketplace with customers and pros on both sides. The Role You're the engineering anchor of an initiative — working as part of a tight team with your PM and designer, and alongside engineering peers on adjacent initiatives. You have a hand in the full lifecycle: shaping the problem, deciding the technical approach, directing AI agents to implement much of the code, shipping to production, and — with your team — owning the outcome. You're measured by impact, not by lines of code merged. When an agent can ship something safely, your job is to make sure it's done right and the metric moves. When the work calls for careful, hand-written code in a sensitive area, you write it yourself. What makes this role exciting: You ship end-to-end. From problem-framing through production to the post-launch metric review — you see the whole arc and own the result with your team. You work as a true product partner. You sit at the table with PM and design, bringing engineering judgment to product calls and product sense to engineering calls. You get real autonomy — with the right checkpoints. You make most technical calls yourself, with architect review on significant architectural decisions and fast input from peers. You operate at a staff bar. You're trusted to make the call, ship the hard thing, and stand behind the outcome. What You'll Own The technical approach — architecture, data model, integration choices, rollout plan, observability, and rollback strategy for your initiative. You make most calls yourself and bring significant architectural decisions to architect review; you document them, and revisit if the data says you were wrong. Implementation quality — the prompts, guardrails, evals, tests, and review loop that let agents ship safe, correct, production-ready code. Most lines will be agent-authored, and you're accountable for them — held to the same standard as the rest of the team working in a shared codebase. Cross-functional partnership — daily working contact with your PM (scope, tradeoffs) and designer (UX decisions, in-tool prototyping), regular collaboration with engineering peers, and weekly check-ins with your EM. The initiative outcome — the metric the initiative was set up to move. With your PM, you present results 2–4 weeks post-launch and share the ""did it work"" answer. A high bar for what ships — production correctness, security, performance, observability, and the experience for customers and pros. Agents accelerate you; they don't lower the bar. Problems to Solve Leading AI agents at a staff-level quality bar Most of the code on your initiative will be authored by AI agents. The craft is making them ship as if a senior engineer wrote it: prompts that encode our conventions, evals that catch issues before merge, tests that exercise the edges, observability that catches a regression before a customer does. How do you build a workflow that lets a small team ship far more than its size would suggest? Owning decisions with high autonomy You have real latitude to "
Remotive API,https://remotive.com/remote-jobs/software-development/staff-software-engineer-product-montevideo-2091058,2026-07-09T14:43:46,LawnStarter,"Staff Software Engineer, Product (Montevideo)",Software Development,Uruguay,full_time,AWS; backend; frontend; php; react; security; UI/UX; AI/ML; jira; react native; documentation; laravel; Typescript; people management; prototyping; engineering management; marketplace; github; REST; datadog,"This is a remote role for candidates located in Montevideo, Uruguay. About LawnStarter LawnStarter is the nation's leading on-demand marketplace for lawn care and outdoor services, with over $100M in annual bookings. We're expanding beyond lawn care to become the one-stop shop for all home services — operating across three brands (LawnStarter, Lawn Love, Home Gnome) on a single shared platform. About Engineering at LawnStarter We build in small, focused initiative teams: a Product Engineer working alongside a PM and a designer, supported by an Engineering Manager who helps you grow. You'll also work shoulder-to-shoulder with engineering peers across initiatives in a shared codebase. The whole team owns whether the work moves its metric. AI coding agents are a force multiplier here — they give a small, senior team the leverage to ship more, faster, and at a higher bar for quality. We hire engineers who are wired for ownership and energized by shipping to a real marketplace with customers and pros on both sides. The Role You're the engineering anchor of an initiative — working as part of a tight team with your PM and designer, and alongside engineering peers on adjacent initiatives. You have a hand in the full lifecycle: shaping the problem, deciding the technical approach, directing AI agents to implement much of the code, shipping to production, and — with your team — owning the outcome. You're measured by impact, not by lines of code merged. When an agent can ship something safely, your job is to make sure it's done right and the metric moves. When the work calls for careful, hand-written code in a sensitive area, you write it yourself. What makes this role exciting: You ship end-to-end. From problem-framing through production to the post-launch metric review — you see the whole arc and own the result with your team. You work as a true product partner. You sit at the table with PM and design, bringing engineering judgment to product calls and product sense to engineering calls. You get real autonomy — with the right checkpoints. You make most technical calls yourself, with architect review on significant architectural decisions and fast input from peers. You operate at a staff bar. You're trusted to make the call, ship the hard thing, and stand behind the outcome. What You'll Own The technical approach — architecture, data model, integration choices, rollout plan, observability, and rollback strategy for your initiative. You make most calls yourself and bring significant architectural decisions to architect review; you document them, and revisit if the data says you were wrong. Implementation quality — the prompts, guardrails, evals, tests, and review loop that let agents ship safe, correct, production-ready code. Most lines will be agent-authored, and you're accountable for them — held to the same standard as the rest of the team working in a shared codebase. Cross-functional partnership — daily working contact with your PM (scope, tradeoffs) and designer (UX decisions, in-tool prototyping), regular collaboration with engineering peers, and weekly check-ins with your EM. The initiative outcome — the metric the initiative was set up to move. With your PM, you present results 2–4 weeks post-launch and share the ""did it work"" answer. A high bar for what ships — production correctness, security, performance, observability, and the experience for customers and pros. Agents accelerate you; they don't lower the bar. Problems to Solve Leading AI agents at a staff-level quality bar Most of the code on your initiative will be authored by AI agents. The craft is making them ship as if a senior engineer wrote it: prompts that encode our conventions, evals that catch issues before merge, tests that exercise the edges, observability that catches a regression before a customer does. How do you build a workflow that lets a small team ship far more than its size would suggest? Owning decisions with high autonomy You have real latitude to mak"
