source,source_url,date_posted,company,title,category,location,job_type,tags_raw,description
Arbeitnow API,https://www.arbeitnow.com/jobs/companies/think-about-it-gmbh/senior-it-administrator-bochum-369664,2026-07-02T09:31:58,think about IT GmbH,Senior IT Administrator (m/w/d),IT,Bochum,,IT,"Die thinkGROUP ist eine erfolgreiche Systemhausgruppe, die ständig nach Innovation strebt und großen Wert auf die kontinuierliche Optimierung unserer internen Prozesse legt. Die Nutzung modernster Technologien ist kein Selbstzweck, sondern die Ausprägung unseres Innovationsgeistes und gelebter Kundenorientierung. Hervorragender IT-Service bedarf optimaler Systeme. Unser motiviertes Team gibt täglich sein Bestes, um unsere Kunden immer wieder neu zu begeistern. Wir suchen Dich zum nächstmöglichen Zeitpunkt als Teammitglied unseres Fachbereichs Technical Consuting am Standort Bochum. Werde Teil der thinkGROUP und unterstütze uns als Senior IT Administrator (m/w/d). Nach Rücksprache kann die Tätigkeit ebenfalls in unseren Niederlassungen Münster, Hamburg, Mainz, Nürnberg oder Leipzig ausgebübt werden. Aufgaben Administration und Wartung unserer internen IT-Systeme und Netzwerke Installation, Konfiguration und Aktualisierung von Hard- und Software Unterstützung der Mitarbeiter bei IT-technischen Fragen und Problemen Überwachung der Systemleistung und Durchführung von regelmäßigen Backups Implementierung von Sicherheitsmaßnahmen zum Schutz der IT-Infrastruktur Dokumentation von IT-Prozessen und -Systemen Qualifikation abgeschlossene IT-Ausbildung (z.B. Fachinformatiker/in für Systemintegration oder Informationselektroniker/in) oder eine vergleichbare Qualifikation Berufserfahrung in der IT-Administration fundierte Kenntnisse in Windows-Betriebssystemen sowie Netzwerktechnologien Erfahrung mit Virtualisierungstechnologien ist von Vorteil ausgezeichnete Problemlösungsfähigkeiten und eine analytische Denkweise Teamfähigkeit, Kommunikationsstärke und eine serviceorientierte Einstellung Benefits Home-Office Anteil jährlich bis zu 4 Wochen Workation - mobiles Arbeiten aus dem europäischen Ausland umfangreiches Onboarding ergänzt durch unser Buddy-Programm jährliches Weiterbildungsbudget Mitarbeiter werben Mitarbeiter-Prämie in Höhe von 1.000€ 200€ Arbeitgeberzuschuss für Deine Arbeitsplatzbrille kostenfreies Mittagessen am Healthy Wednesday Arbeitgeberzuschuss zur Vermögensbildung hoher Grad der persönlichen Entfaltung sowie individuelle Förderung Trainingsmöglichkeiten im hauseigenen Fitnessstudio Bike-Leasing-Angebote für Dich und Deine Familie Personalrabatte und Vergünstigungen bei zahlreichen Kooperationspartnern gemeinsame Freizeitaktivitäten Freue Dich auf ein Team, welches auch abseits der Arbeit zusammenhält. Auf unserer Karriereseite gewinnst Du einen ersten persönlichen Eindruck und erfährst, was die thinkGROUP auszeichnet. Du und die thinkGROUP - das passt? Wir freuen uns auf Deine Bewerbung über unsere Karriereseite Angabe Deiner Gehaltsvorstellung und Deines frühestmöglichen Eintrittstermins! Bei fachlichen Rückfragen vermitteln wir Dir gerne schnell und unkompliziert den Kontakt zur Fachabteilung. think about IT GmbH z.H. Alexander Bieber HR Manager Gesundheitscampus-Süd 19 44801 Bochum Find more English Speaking Jobs in Germany on Arbeitnow"
Arbeitnow API,https://www.arbeitnow.com/jobs/companies/think-about-it-gmbh/it-system-engineer-bochum-127839,2026-07-02T09:31:57,think about IT GmbH,IT-System Engineer (m/w/d),IT,Bochum,,IT,"Die thinkGROUP ist eine erfolgreiche Systemhausgruppe, die ständig nach Innovation strebt und großen Wert auf die kontinuierliche Optimierung unserer internen Prozesse legt. Die Nutzung modernster Technologien ist kein Selbstzweck, sondern die Ausprägung unseres Innovationsgeistes und gelebter Kundenorientierung. Hervorragender IT-Service bedarf optimaler Systeme. Unser motiviertes Team gibt täglich sein Bestes, um unsere Kunden immer wieder neu zu begeistern. Wir suchen Dich zum nächstmöglichen Zeitpunkt als Teammitglied unseres Fachbereichs IT-Consulting am Standort Bochum. Werde Teil der thinkGROUP und unterstütze uns als IT-System Engineer (m/w/d). Aufgaben Betriebsverantwortung der Windows Server Infrastruktur unserer Kunden einschließlich der eingesetzten Produkte und Features Bearbeitung von Incidents sowie Service Requests proaktive Überwachung der Windows Server in den Kunden-Umgebungen eigenstädige Anpassung von Systemkonfigurationen sowie die Erstellung und Ergänzung entsprechender Dokumentationen selbstständige Installation und Projektübernahme im Bereich Windows Server Migration älterer Installationen auf aktuelle Stadards inkl. sämtlicher Abhängigkeiten fachliche Beratung von Kunden im Zusammenhang mit dem aktuellen Betriebsszenario Qualifikation abgeschlossenes technisches Studium oder vergleichbare Ausbildung (z.B. Fachinformatiker/in Systemintegration) mehrjährige Berufserfahrung in den oben genannten Tätigkeiten Kenntnisse der Technologien Windows 2008 - 2019 inkl. Migrationswege einzelner Dienste/Services Kenntnisse Windows Server bis 2024 dienstleistungsorientierte und zuverlässige Arbeitsweise sicheres Auftreten sowie gute Deutsch- und Englischkenntnisse in Wort und Schrift praktische Erfahrung im Bereich Firewalling und Windows Powershell Know-how von Vorteil Zertifizierungen wie bspw. MCSA/MCSE sowie Erfahrung im Incident- und Problemmanagement wünschenswert Fahrerlaubnis B PKW/Kleinbusse (alt: FS 3) wünschenswert Benefits Home-Office Anteile jährlich bis zu 4 Wochen Workation - mobiles Arbeten aus dem europäischen Ausland umfangreiches Onboarding ergänzt durch unser Buddy-Programm jährliches Weiterbildungsbudget Mitarbeiter werben Mitarbeiter-Prämie in Höhe von 1.000€ 200€ Arbeitgeberzuschuss zu Deiner Arbeitsplatzbrille kostenfreies Mittagessen am Healthy Wednesday Arbeitgeberzuschuss zur Vermögensbildung hoher Grad der persönlichen Entfaltung sowie individuelle Förderung Trainingsmöglichkeiten im hauseigenen Fitnessstudio Bike-Leasing-Angebote für Dich und Deine Familie Personalrabatte und Vergünstigungen bei zahlreichen Kooperationspartnern gemeinsame Freizeitaktivitäten Freue Dich auf ein Team, welces auch abseits der Arbeit zusammenhält. Auf unserer Karriereseite gewinnst Du einen ersten persönlichen Eindruck und erfährst was die thinkGROUP auszeichnet. Du und die thinkGROUP - das passt? Wir freuen uns auf Deine aussagekräftige Bewerbung mit Angabe Deiner Gehaltsvorstellung und Deines frühestmöglichen Eintrittstermins! Bei fachlichen Rückfragen vermitteln wir Dir gerne schnell und unkompliziert den Kontakt zur Fachabteilung. think about IT GmbH z.H. Alexander Bieber HR Manager Gesundheitscampus-Süd 19 44801 Bochum Find more English Speaking Jobs in Germany on Arbeitnow"
Arbeitnow API,https://www.arbeitnow.com/jobs/companies/think-about-it-gmbh/it-systemelektroniker-bochum-64949,2026-07-02T09:31:57,think about IT GmbH,IT-Systemelektroniker (m/w/d),IT,Bochum,,IT,"Die thinkGROUP ist eine erfolgreiche Systemhausgruppe, die ständig nach Innovation strebt und großen Wert auf die kontinuierliche Optimierung unserer internen Prozesse legt. Die Nutzung modernster Technologien ist kein Selbstzweck, sondern die Ausprägung unseres Innovationsgeistes und gelebter Kundenorientierung. Hervorragender IT-Service bedarf optimaler Systeme. Unser motiviertes Team gibt täglich sein Bestes, um unsere Kunden immer wieder neu zu begeistern. Wir suchen Dich zum nächstmöglichen Zeitpunkt als Teammitglied unseres Fachbereichs Technical Services in Bochum. Werde Teil der thinkGROUP und unterstütze uns als IT-Systemelektroniker (m/w/d). Aufgaben Instandsetzung von IT-Komponenten Umbau und Erweiterung von Arbeitsplatz-Hardware Installation und Konfiguration von Hardware im Client- und Serverbereich selbstständige Softwareinstallation Lösen von Hard- und Softwareproblemen sowie Bearbeiten von Tickets innerhalb vorgegebener Servicelevel eigenständige Installationsänderungen und ggf. Softwarekonfigurationen Qualifikation abgeschlossene Ausbildung (z.B. IT-Systemelektroniker/in, Informationselektroniker/in oder Mechatroniker/in) oder gleichwertige Qualifikation erste Erfahrung in der Wartung von IT-Komponenten sowie in der Umsetzung von Kundenanforderungen erste Erfahrung in der Reparatur von Hardware (Notebook, PC) Zertifikate von Lenovo, Dell oder Hewlett Packard sind von Vorteil, aber nicht zwingend erforderlich teamorientierte Arbeitsweise Benefits umfangreiches Onboarding ergänzt durch unser Buddy-Programm jährliches Weiterbildungsbudget Mitarbeiter werben Mitarbeiter-Prämie in Höhe von 1.000€ 200€ Arbeitgeberzuschuss für Deine Arbeitsplatzbrille kostenfreies Mittagessen am Healthy Wednesday Arbeitgeberzuschuss zur Vermögensbildung hoher Grad der persönlichen Entfaltung sowie individuelle Förderung Trainingsmöglichkeiten im hauseigenen Fitnessstudio Bike-Leasing-Angebote für Dich und Deine Familie Personalrabatte und Vergünstigungen bei zahlreichen Kooperationspartnern gemeinsame Freizeitaktivitäten Freue Dich auf ein Team, welches auch abseits der Arbeit zusammenhält. Hier gewinnst Du einen ersten persönlichen Eindruck und erfährst, was die thinkGROUP auszeichnet. Du und die thinkGROUP - das passt? Wir freuen uns auf Deine aussagekräftige Bewerbung mit Angabe Deiner Gehaltsvorstellung und Deines frühestmöglichen Eintrittstermins! Bei fachlichen Rückfragen vermitteln wir Dir gerne schnell und unkompliziert den Kontakt zur Fachabteilung. think about IT GmbH z.H. Alexander Bieber HR Manager Gesundheitscampus-Süd 19 44801 Bochum Tel: 0234/3336721-6067 Find more English Speaking Jobs in Germany on Arbeitnow"
Arbeitnow API,https://www.arbeitnow.com/jobs/companies/volentum-deutschland-gmbh/it-systemadministrator-fachinformatiker-systemintegration-furth-256326,2026-07-02T09:31:56,VOLENTUM Deutschland GmbH,IT-Systemadministrator / Fachinformatiker Systemintegration (m/w/d),System and Network Administration,Fürth,berufserfahren,System and Network Administration,"Du arbeitest in der IT, bringst Erfahrung in der Systemadministration, IT-Infrastruktur oder im Support mit und möchtest Dich beruflich weiterentwickeln? Dann könnten spannende Karrierechancen auf Dich warten, die nicht nur irgendein Job sind. Wir von VOLENTUM sprechen regelmäßig mit Unternehmen, die qualifizierte IT-Fachkräfte suchen. Ob Administration von Servern und Clients, Betreuung von Netzwerken, Cloud-Services, IT-Security, Benutzerverwaltung, Troubleshooting oder die Weiterentwicklung moderner IT-Landschaften: Wenn Dir stabile Systeme wichtig sind, Du lösungsorientiert arbeitest und Dich als verlässliche Ansprechpartner für IT-Themen verstehst, freuen wir uns darauf, Dich kennenzulernen. Aufgaben Administration, Betreuung und Weiterentwicklung von IT-Systemen, Servern, Clients und Netzwerkinfrastrukturen. Installation, Konfiguration und Wartung von Windows- oder Linux-Systemen sowie zugehöriger Anwendungen und Dienste. Betreuung von Microsoft-365-, Azure-, Active-Directory-, Exchange-, VMware-, Hyper-V- oder vergleichbaren Umgebungen. Analyse und Behebung von Störungen im 1st-, 2nd- oder 3rd-Level-Support, je nach Erfahrung und Einsatzbereich. Verwaltung von Benutzerkonten, Gruppenrichtlinien, Berechtigungen, Endgeräten und IT-Arbeitsplätzen. Überwachung der Systemverfügbarkeit, Durchführung von Backups sowie Mitwirkung bei IT-Sicherheits- und Datenschutzmaßnahmen. Dokumentation von IT-Prozessen, Systemänderungen und technischen Lösungen. Zusammenarbeit mit Fachbereichen, externen Dienstleistern, IT-Leitung und internen Projektteams. Je nach Erfahrung: Übernahme von Verantwortung in IT-Projekten, Automatisierung, Cloud-Migration, IT-Security, Netzwerkadministration oder fachlicher Anleitung im Team. Qualifikation Abgeschlossene Ausbildung im IT-Bereich, zum Beispiel als Fachinformatiker für Systemintegration, IT-Systemelektroniker, ein Studium der Informatik / Wirtschaftsinformatik oder eine vergleichbare Qualifikation. Erfahrung in der IT-Administration, Systemadministration, Netzwerktechnik oder im IT-Support. Kenntnisse in der Administration von Windows-Servern, Clients, Active Directory, Microsoft 365 oder vergleichbaren IT-Umgebungen. Erfahrung mit Virtualisierungslösungen wie VMware, Hyper-V oder vergleichbaren Technologien ist von Vorteil. Kenntnisse in Netzwerktechnik, zum Beispiel TCP/IP, DNS, DHCP, VPN, Firewalls, Switches oder WLAN-Infrastrukturen. Erfahrung mit Backup-Lösungen, Monitoring, Endpoint Security, Patchmanagement oder IT-Sicherheitsmaßnahmen ist willkommen. Kenntnisse in Linux, Azure, PowerShell, Scripting, Cloud-Services oder Automatisierung sind von Vorteil, aber nicht zwingend erforderlich. Eine strukturierte, lösungsorientierte und zuverlässige Arbeitsweise. Freude daran, technische Probleme zu analysieren, Anwender zu unterstützen und IT-Systeme nachhaltig zu verbessern. Sehr gute Deutschkenntnisse in Wort und Schrift. Benefits Unbefristete Festanstellung direkt bei unserem Kunden. Ein an Deinen Kenntnissen und Erfahrungen orientiertes, attraktives Gehalt. Individuelle Berücksichtigung Deiner fachlichen Schwerpunkte und bevorzugten Einsatzbereiche. Karriere-Begleitung während Deiner Einarbeitung und auch darüber hinaus. Spannende IT-Umgebungen mit Entwicklungsmöglichkeiten in Bereichen wie Infrastruktur, Cloud, Security, Netzwerk oder IT-Projektmanagement. Hast Du Interesse daran, uns kennenzulernen? Dann freuen wir uns auf Deine Bewerbung! Für Rückfragen zu deinen beruflichen Möglichkeiten steht Dir Julia Derks gern jederzeit als Ansprechpartnerin zur Verfügung: +49 1579 2468643. Find more English Speaking Jobs in Germany on Arbeitnow"
Arbeitnow API,https://www.arbeitnow.com/jobs/companies/ecowindow-gruppe/full-stack-developerin-berlin-408219,2026-07-02T09:31:56,ecowindow Gruppe,Full-Stack Developer:in (m/w/d),Software Development,Berlin,berufserfahren,Software Development,"Die ecowindow Gruppe treibt die Digitalisierung im Fenster- und Türenmarkt aktiv voran – und denkt Prozesse dabei neu. Unser Anspruch: klare Strukturen, schnelle Abläufe und ein Kundenservice, der nicht nur funktioniert, sondern überzeugt. Wir verbinden traditionelles Handwerk mit smarten digitalen Lösungen und bauen so eine Organisation, die mit uns wächst. Effizienz, Pragmatismus und ein bewusster Umgang mit Ressourcen sind für uns dabei kein Buzzword, sondern Alltag. Für den weiteren Ausbau unserer internen Strukturen suchen wir zum nächstmöglichen Zeitpunkt eine:n Full-Stack Developer:in (m/w/d). Aufgaben Entwicklung und Weiterentwicklung der Webseiten ecowindow - deutsche-fensterbau und fenstermaxx24 sowie dessen Online-Konfigurator Konzeption und Umsetzung neuer Frontend- und Backend-Funktionen Entwicklung und Anbindung von APIs sowie Schnittstellen zu ERP-, CRM- und Drittsystemen Optimierung von Performance, Benutzerfreundlichkeit und Conversion im Online-Shop und Konfigurator Analyse und Behebung von Fehlern sowie Sicherstellung einer hohen Codequalität Enge Zusammenarbeit mit Produktmanagement und Fachbereichen zur kontinuierlichen Weiterentwicklung unserer digitalen Produkte Qualifikation Mehrjährige Berufserfahrung als Full-Stack Developer mit Schwerpunkt Webanwendungen Sehr gute Kenntnisse in PHP, JavaScript/TypeScript, HTML und CSS sowie Erfahrung mit modernen Frontend-Frameworks Erfahrung mit WooCommerce , WordPress und der Entwicklung bzw. Anpassung von Plugins und Themes Erfahrung mit REST-APIs, Datenbanken (MySQL) und der Anbindung externer Systeme Strukturierte, eigenverantwortliche Arbeitsweise sowie ausgeprägtes analytisches Denkvermögen Hoher Qualitätsanspruch, Teamgeist und Freude daran, digitale Produkte kontinuierlich weiterzuentwickeln Benefits Unbefristeter Arbeitsvertrag mit langfristiger Perspektive in einem wachsenden Unternehmen Attraktive Vergütung mit leistungsgerechter Bezahlung Modern ausgestatteter Arbeitsplatz mit leistungsstarker Hardware und aktueller Software Kurze Entscheidungswege und ein agiles Team, in dem Ideen schnell umgesetzt werden 28 Urlaubstage sowie eine betriebliche Altersvorsorge Klingt spannend für dich? Dann freuen wir uns auf deine Bewerbung und darauf, dich kennenzulernen! Find more English Speaking Jobs in Germany on Arbeitnow"
Arbeitnow API,https://www.arbeitnow.com/jobs/companies/sbc-steuerberater-rechtsanwalte-gbr/steuerfachangestellter-steuerfachwirt-bilanzbuchhalter-trainee-steuerberatung-darmstadt-235383,2026-07-02T09:31:56,SBC Steuerberater Rechtsanwälte GbR,Steuerfachangestellter / Steuerfachwirt / Bilanzbuchhalter / Trainee Steuerberatung (m/w/d),Training,Darmstadt,hilfstätigkeit / student,Training; Development,"Partnerschaft auf Augenhöhe. Wir stellen uns vor. Seit nunmehr 20 Jahren stellen wir an unseren beiden Standorten in Bad Homburg und Darmstadt einen verlässlichen Partner dar – für unsere breitgefächerte Mandantschaft und allen voran für unser loyales, knapp 30-köpfiges Team. Wir sind der festen Überzeugung, dass Mitarbeiterzufriedenheit mit unserem Kanzleierfolg einhergeht, und geben unser Bestes, dies auch beizubehalten. Denn ein gutes Betriebsklima zu gewährleisten, liegt vor allem in der Hand der Kanzleiführung. Herausforderungen im Kollektiv anzugehen ist nicht nur förderlich für das Wohlbefinden innerhalb unserer heiligen Hallen – es ist auch noch die perfekte Grundlage für eine vielversprechende Karriere, bei der wir Dich selbstverständlich unterstützen werden. Aufgaben So vielfältig wie das Steuerrecht. Dein Aufgabengebiet. Wie ein klassischer Tag bei SBC aussieht? Das hängt ganz von Dir ab! Denn Deinen individuellen Tätigkeitsbereich erstellen wir, natürlich in enger Abstimmung mit Dir, basierend auf Deinen Interessen, Talenten und Fähigkeiten. Und da jeder Mensch seine eigenen Stärken (und Schwächen) hat, gestaltet sich Dein Arbeitsalltag ganz nach Deinem Geschmack. Unter anderem erwarten Dich folgende Aufgaben: Eigenverantwortliche Betreuung unserer Mandanten Finanzbuchhaltung Erstellen von Steuererklärungen und Jahresabschlüssen Bearbeitung steuerlicher Fragestellungen Vorbereitung und Begleitung von Betriebsprüfungen Kommunikation mit Mandanten Weitere Tätigkeiten, die Dir Spaß bereiten Qualifikation Wir bringen Dich weiter. Und Du bringst ein paar Dinge mit. Wir sind innerhalb der Branche für eine oft langjährige Zusammenarbeit bekannt – mit Mitarbeitern und Mandanten. Dies ist ein Indikator dafür, dass sich das Team und die Mandantschaft bei uns wohlfühlen und auch in beruflicher Hinsicht zufrieden mit unserer Kanzlei sind. Eine ausgeprägte Teamfähigkeit und eine verlässliche, strukturierte Arbeitsweise sind daher nicht verhandelbar. Zudem legst Du folgende Eigenschaften an den Tag: Ausbildung zum Steuerfachangestellten, Steuerfachwirt oder Bilanzbuchhalter (alle m/w/d) Gute Kenntnisse in MS-Office und DATEV Im Optimalfall 2 Jahre Berufserfahrung Digitalisierung ist für Dich der nötige Fortschritt Veränderungen gegenüber bist Du aufgeschlossen Benefits Wer etwas will, muss auch etwas zu bieten haben. Und das haben wir! Obstkörbe und Gratis-Kaffee sind zwar schön, aber sicherlich nicht der entscheidende Faktor, wenn es um die Zufriedenheit des Teams geht. Um einen attraktiven Arbeitgeber darzustellen, bedarf es spürbarer Benefits und Annehmlichkeiten, die sowohl das Berufs- als auch das Privatleben positiv beeinflussen und Dir den Alltag erleichtern. Dazu gehört beispielsweise, dass der Zusammenhalt und ein angenehmes Miteinander über dem Umsatz stehen sollten – Mitarbeiter, die schlechte Stimmung verbreiten und ihre Ellbogen ausfahren, haben keinen Platz in unserer Mitte. Da gehen wir keine Kompromisse ein. Außerdem erwarten Dich: Flexible Arbeitszeiten und Modelle, inklusive Home-Office: Uns ist wichtig, dass die Qualität Deiner Arbeit stimmt – wann und wo Du diese erbringst, spielt eher eine sekundäre Rolle. Work-Life-Balance: Arbeit ist wichtig, jedoch nicht das Wichtigste im Leben. Um Berufs- und Privatleben optimal unter einen Hut zu bekommen, bedarf es der Unterstützung Deines Arbeitgebers – auf uns kannst Du zählen. Team-Events: Nur eine Weihnachtsfeier und das war’s wieder für ein Jahr? Nicht bei uns – regelmäßige ausgefallene Veranstaltungen wie Städtetrips, Krimi-Dinner, Ski-Ausflüge und andere gemeinsame Happy Hours wie Restaurantbesuche sorgen dafür, dass es auch neben dem Kanzleialltag nie langweilig wird. Fort- und Weiterbildungsangebote inkl. eigener Mentor: Man kann Fachkräfte einkaufen – oder auf die eigenen Talente setzen. Durch weitreichende Fortbildungsangebote helfen wir Dir, die Karriereleiter nach oben zu klettern. Ob nun durch unsere substanzielle und finanzielle Unterstützung - oder eine"
Arbeitnow API,https://www.arbeitnow.com/jobs/companies/sbc-steuerberater-rechtsanwalte-gbr/steuerfachangestellter-steuerfachwirt-bilanzbuchhalter-trainee-steuerberatung-bad-homburg-48039,2026-07-02T09:31:56,SBC Steuerberater Rechtsanwälte GbR,Steuerfachangestellter / Steuerfachwirt / Bilanzbuchhalter / Trainee Steuerberatung (m/w/d),Training,Bad Homburg,hilfstätigkeit / student,Training; Development,"Partnerschaft auf Augenhöhe. Wir stellen uns vor. Seit nunmehr 20 Jahren stellen wir an unseren beiden Standorten in Bad Homburg und Darmstadt einen verlässlichen Partner dar – für unsere breitgefächerte Mandantschaft und allen voran für unser loyales, knapp 30-köpfiges Team. Wir sind der festen Überzeugung, dass Mitarbeiterzufriedenheit mit unserem Kanzleierfolg einhergeht, und geben unser Bestes, dies auch beizubehalten. Denn ein gutes Betriebsklima zu gewährleisten, liegt vor allem in der Hand der Kanzleiführung. Herausforderungen im Kollektiv anzugehen ist nicht nur förderlich für das Wohlbefinden innerhalb unserer heiligen Hallen – es ist auch noch die perfekte Grundlage für eine vielversprechende Karriere, bei der wir Dich selbstverständlich unterstützen werden. Aufgaben So vielfältig wie das Steuerrecht. Dein Aufgabengebiet. Wie ein klassischer Tag bei SBC aussieht? Das hängt ganz von Dir ab! Denn Deinen individuellen Tätigkeitsbereich erstellen wir, natürlich in enger Abstimmung mit Dir, basierend auf Deinen Interessen, Talenten und Fähigkeiten. Und da jeder Mensch seine eigenen Stärken (und Schwächen) hat, gestaltet sich Dein Arbeitsalltag ganz nach Deinem Geschmack. Unter anderem erwarten Dich folgende Aufgaben: Eigenverantwortliche Betreuung unserer Mandanten Finanzbuchhaltung Erstellen von Steuererklärungen und Jahresabschlüssen Bearbeitung steuerlicher Fragestellungen Vorbereitung und Begleitung von Betriebsprüfungen Kommunikation mit Mandanten Weitere Tätigkeiten, die Dir Spaß bereiten Qualifikation Wir bringen Dich weiter. Und Du bringst ein paar Dinge mit. Wir sind innerhalb der Branche für eine oft langjährige Zusammenarbeit bekannt – mit Mitarbeitern und Mandanten. Dies ist ein Indikator dafür, dass sich das Team und die Mandantschaft bei uns wohlfühlen und auch in beruflicher Hinsicht zufrieden mit unserer Kanzlei sind. Eine ausgeprägte Teamfähigkeit und eine verlässliche, strukturierte Arbeitsweise sind daher nicht verhandelbar. Zudem legst Du folgende Eigenschaften an den Tag: Ausbildung zum Steuerfachangestellten, Steuerfachwirt oder Bilanzbuchhalter (alle m/w/d) Gute Kenntnisse in MS-Office und DATEV Im Optimalfall 2 Jahre Berufserfahrung Digitalisierung ist für Dich der nötige Fortschritt Veränderungen gegenüber bist Du aufgeschlossen Benefits Wer etwas will, muss auch etwas zu bieten haben. Und das haben wir! Obstkörbe und Gratis-Kaffee sind zwar schön, aber sicherlich nicht der entscheidende Faktor, wenn es um die Zufriedenheit des Teams geht. Um einen attraktiven Arbeitgeber darzustellen, bedarf es spürbarer Benefits und Annehmlichkeiten, die sowohl das Berufs- als auch das Privatleben positiv beeinflussen und Dir den Alltag erleichtern. Dazu gehört beispielsweise, dass der Zusammenhalt und ein angenehmes Miteinander über dem Umsatz stehen sollten – Mitarbeiter, die schlechte Stimmung verbreiten und ihre Ellbogen ausfahren, haben keinen Platz in unserer Mitte. Da gehen wir keine Kompromisse ein. Außerdem erwarten Dich: Flexible Arbeitszeiten und Modelle, inklusive Home-Office: Uns ist wichtig, dass die Qualität Deiner Arbeit stimmt – wann und wo Du diese erbringst, spielt eher eine sekundäre Rolle. Work-Life-Balance: Arbeit ist wichtig, jedoch nicht das Wichtigste im Leben. Um Berufs- und Privatleben optimal unter einen Hut zu bekommen, bedarf es der Unterstützung Deines Arbeitgebers – auf uns kannst Du zählen. Team-Events: Nur eine Weihnachtsfeier und das war’s wieder für ein Jahr? Nicht bei uns – regelmäßige ausgefallene Veranstaltungen wie Städtetrips, Krimi-Dinner, Ski-Ausflüge und andere gemeinsame Happy Hours wie Restaurantbesuche sorgen dafür, dass es auch neben dem Kanzleialltag nie langweilig wird. Fort- und Weiterbildungsangebote inkl. eigener Mentor: Man kann Fachkräfte einkaufen – oder auf die eigenen Talente setzen. Durch weitreichende Fortbildungsangebote helfen wir Dir, die Karriereleiter nach oben zu klettern. Ob nun durch unsere substanzielle und finanzielle Unterstützung - oder eine"
