source,source_url,date_posted,company,title,category,location,job_type,tags_raw,description
Arbeitnow API,https://www.arbeitnow.com/jobs/companies/ito-consult-gmbh/frontend-dev-vuejs-finde-in-6-fragen-raus-ob-du-zu-uns-passt-dresden-101034,2026-05-04T10:00:45,ito consult GmbH,"Frontend-Dev Vue.js? Finde in 6 Fragen raus, ob du zu uns passt:",IT,Dresden,,IT,"Aufgaben 1. Vue.js ist für dich... A) ...irgendein JavaScript-Framework? B) ...Pinia, Nuxt, Composables — dein tägliches Handwerkszeug. ✅ 2. Ein Figma-Design landet auf deinem Tisch... A) ...du baust es ungefähr nach. B) ...du baust es pixel-präzise nach — und fragst nach, wenn etwas keinen Sinn ergibt. ✅ 3. Du siehst eine schlecht strukturierte CSS-Datei... A) ...und scrollst schnell weiter. B) ...und weißt sofort, wie du das besser machst.✅ 4. Kundenkontakt... A) ...soll bitte die anderen machen. B) ...hilft dir, Software zu bauen, die wirklich funktioniert.✅ 5. Mittagspause heißt bei dir... A) ...Schreibtisch, Sandwich, weiter. B) ...frisch kochen, Tischkicker, dann mit klarem Kopf zurück.✅ 6. Du willst... A) ...Tickets abarbeiten und Feierabend. B) ...mitdenken, mitgestalten, Projekte von der Analyse bis zum Deployment mitprägen.✅ 🟢 4+ x ✅ = JOIN US. Qualifikation ✅ HTML5 &#x26; CSS auf Expertenniveau — das ist keine Floskel, das ist Fundament ✅ Vue.js (Nuxt, Pinia), Git, Figma — gut drauf, nicht nur gehört ✅ Ein echtes Gespür für UI/UX — du weißt, warum ein Button links besser ist als rechts ✅ Tailwind, REST-APIs, Shopware 6, Frontend-Testing — Vorkenntnisse willkommen, kein Muss ✅ 3 Jahre Frontend-Erfahrung ✅ Du findest Wege und suchst nicht nach Gründen ✅ kindliches Interesse an Zukunftstechnologien Benefits ✅ das Übliche + ✅ die Möglichkeit über dich selbst hinauszuwachsen Find Jobs in Germany on Arbeitnow"
Arbeitnow API,https://www.arbeitnow.com/jobs/companies/matera-gmbh/team-lead-accounting-scaling-phase-berlin-446026,2026-05-04T09:30:38,Matera GmbH,Team Lead Accounting | Scaling Phase,Management,Berlin,manager,Management; Team Leader,"In a nutshell: Als Team Lead Accounting bist du bei uns genau richtig, wenn du erste Führungserfahrung mitbringst, Verantwortung für ein fünfköpfiges Team übernehmen und eine zentrale Kunden-Pipeline steuern möchtest. In enger Zusammenarbeit mit deinem Manager Max entwickelst du deine Führungskompetenzen weiter und arbeitest aktiv an teamübergreifenden Projekten im Team. Tasks Deine Rolle bei Matera: Du stellst sicher, dass ICs Prozesse einhalten, Aufgaben priorisieren, die Kunden-Pipeline kontrollieren und ihre Performance optimieren. Du sorgst für Motivation, führst Meetings und passt deinen Führungsstil individuell an die Bedürfnisse deiner ICs an. Du lebst die Matera-Kultur vor, entwickelst proaktiv Lösungen für Herausforderungen und gestaltest aktiv die Weiterentwicklung des Teams. Du unterstützt dein Team dabei, eine hochwertige Kundenkommunikation sicherzustellen und stehst beratend zur Seite, um den Austausch mit Kund*innen optimal zu gestalten. Requirements Das bringst du mit: Du bringst erste Führungserfahrung mit, z. B. als Manager_in, Teamlead, Trainee-Verantwortliche_r oder in einer ähnlichen Rolle. Du verstehst die Anforderungen anderer Teams und förderst eine gute bereichsübergreifende Zusammenarbeit. Du hast Erfahrung im Projektmanagement oder hast erfolgreich an bereichsübergreifenden Projekten mitgewirkt. Du sprichst Deutsch auf C2 Nivea und kannst sicher auf Englisch kommunizieren Bei Matera garantieren wir Chancengleichheit und Vielfalt. Hier bist du so willkommen, wie du bist! Benefits Deine Aussichten: Vergütung bis zu 50.000€ zum Einstieg mit klaren Entwicklungsperspektiven anhand von Careerpaths Attraktive Anteilsoptionen am Unternehmen Vergünstigte Mitgliedschaft für den Urban Sports Club, Lunch-Gutscheine und ÖPNV-Zuschuss Abwechslungsreicher Arbeitsalltag mit langfristigen Weiterentwicklungsmöglichkeiten Ein wertschätzendes Umfeld, in dem der Spaß auch nicht zu kurz kommt:) Unsere Mission: Unsere Mission bei Matera ist es, Wohnungseigentümer*innen glücklich zu machen! Durch uns können sie ihre Immobilie transparent und einfach selbst verwalten oder die Verwaltung ganzheitlich in unsere Hände legen und dadurch eine Menge Zeit und Geld sparen. Seit 2017 sind wir auf dem französischen Markt aktiv und machen bereits jeden Tag das Leben von mehr als 100.000 Wohnungseigentümer*innen besser. In Deutschland haben wir seit 2021 ebenfalls einen großartigen Start mit einem ambitionierten Team hingelegt. Um unser Team kennenzulernen und Eindrücke von unserer Kultur zu bekommen, schaue gerne bei uns auf LinkedIn oder auf Instagram vorbei! Find more English Speaking Jobs in Germany on Arbeitnow"
Arbeitnow API,https://www.arbeitnow.com/jobs/companies/matera-gmbh/teamleitung-buchhaltung-wachstumsphase-berlin-372881,2026-05-04T09:30:38,Matera GmbH,Teamleitung Buchhaltung | Wachstumsphase,Accounts Receivable,Berlin,manager,Accounts Receivable,"In a nutshell: Als Team Lead Accounting bist du bei uns genau richtig, wenn du unser fünfköpfiges Team aus Account Manager*innen leiten und weiterentwickeln möchtest. In enger Zusammenarbeit mit unserem Head of Max entwickelst du deine Führungskompetenzen weiter und arbeitest aktiv an teamübergreifenden Projekten sowie der Optimierung von Prozessen. Starte ab sofort, oder in den nächsten 3 Monaten in Vollzeit. Tasks Deine Rolle bei Matera: Du stellst sicher, dass dein Team Prozesse einhält, klar priorisieren kann und motivierst dein Team jeden Tag aufs Neue. Du führst deine eigene, kleine Kundenpipeline (laufende Buchhaltung von Objekten) und gehst mit gutem Beispiel voran. Du lebst die Matera-Kultur vor, entwickelst proaktiv Lösungen für Herausforderungen und gestaltest aktiv die Weiterentwicklung des Teams und dem gesamten Accountingbereichs. Du unterstützt dein Team dabei, eine hochwertige Kundenkommunikation sicherzustellen und stehst beratend zur Seite, um den Austausch optimal zu gestalten. Requirements Das bringst du mit: Du bringst erste Führungserfahrung mit, z. B. als Manager_in, Teamlead, Trainee-Verantwortliche_r oder in einer ähnlichen Rolle. Du hast bereits erste Erfahrung in der Immobilienbuchhaltung, oder andere Berührungspunkte mit dem Thema Hausverwaltung. Du hast Erfahrung im Projektmanagement oder hast erfolgreich an bereichsübergreifenden Projekten mitgewirkt. Du sprichst Deutsch auf C2 Niveau und kannst sicher auf Englisch kommunizieren Bei Matera garantieren wir Chancengleichheit und Vielfalt. Hier bist du so willkommen, wie du bist! Benefits Deine Aussichten: Vergütung bis zu 60.000€ zum Einstieg mit klaren Entwicklungsperspektiven anhand von Careerpaths Vergünstigte Mitgliedschaft für den Urban Sports Club, Lunch-Gutscheine und ÖPNV-Zuschuss Abwechslungsreicher Arbeitsalltag mit langfristigen Weiterentwicklungsmöglichkeiten Ein wertschätzendes Umfeld, in dem der Spaß auch nicht zu kurz kommt:) Unsere Mission: Unsere Mission bei Matera ist es, Wohnungseigentümer*innen glücklich zu machen! Durch uns können sie ihre Immobilie transparent und einfach selbst verwalten oder die Verwaltung ganzheitlich in unsere Hände legen und dadurch eine Menge Zeit und Geld sparen. Seit 2017 sind wir auf dem französischen Markt aktiv und machen bereits jeden Tag das Leben von mehr als 100.000 Wohnungseigentümer*innen besser. In Deutschland haben wir seit 2021 ebenfalls einen großartigen Start mit einem ambitionierten Team hingelegt. Um unser Team kennenzulernen und Eindrücke von unserer Kultur zu bekommen, schaue gerne bei uns auf LinkedIn oder auf Instagram vorbei! Find more English Speaking Jobs in Germany on Arbeitnow"
Arbeitnow API,https://www.arbeitnow.com/jobs/companies/swiss-life-select/senior-sales-consultant-vollzeit-german-speaking-bad-krozingen-350624,2026-05-04T09:20:17,Swiss Life Select,Senior Sales Consultant - Vollzeit (German Speaking),Finance,Bad Krozingen,"Full-time fixed-term, mid",Finance; high school or equivalent,"Du willst Ergebnisse, keine Diskussionen? Du arbeitest strukturiert, hast ein klares Verständnis für saubere Prozesse und weißt, wie wichtig Verlässlichkeit im Vertrieb ist? Dann bist du bei uns genau richtig! Wir suchen einen Senior Sales Consultant (m/w/d), der mit klarem Fokus auf Abschlussquote, Systemtreue und messbare Resultate arbeitet. In dieser Position übernimmst du Verantwortung für die direkte Kundengewinnung, führst strukturierte Verkaufsgespräche anhand erprobter Leitfäden und unterstützt beim Ausbau unserer Vertriebsprozesse. Visionen überlassen wir anderen, du bringst Klarheit, Kontrolle und Umsetzung. Deine Aufgaben Kundengewinnung mit Struktur: Gezielte Ansprache potenzieller Kunden, Bedarfsanalyse und Führung durch unseren klar definierten Vertriebsprozess. Pflege stabiler Kundenbeziehungen: Saubere Betreuung mit nachvollziehbaren Abläufen, festen Schritten und dokumentierten Follow-ups. Vertriebsprozesse umsetzen: Einhaltung von Standards, Arbeit mit KPIs und Sicherstellung, dass kein Schritt ausgelassen wird. Teamverantwortung übernehmen: Enge Zusammenarbeit mit dem Team, klare Übergaben und Orientierung durch feste Strukturen. Was wir dir bieten Stabilität &amp; Klarheit: Strukturierte Prozesse, feste Zuständigkeiten und ein durchdachtes Vertriebssystem. Arbeitsplatz mit Planbarkeit: Geregelte Abläufe, messbare Ergebnisse und ein klarer Erwartungshorizont. Modernes Büro in Freiburg: Konzentrationsfördernde Umgebung mit klarer Aufgabentrennung und ruhiger Atmosphäre. Strukturiertes Onboarding: Systematische Einarbeitung, Schritt für Schritt. Teamorientierte Umsetzung: Jeder kennt seinen Bereich, alles greift ineinander, ohne Reibungsverluste. Mehrjährige Vertriebserfahrung, idealerweise im Beratungs- oder Agenturumfeld. Freude an Zielen, Zahlen und dem sichtbaren Erfolg von klaren Abläufen. Unternehmerisches Denken, strukturierte Umsetzung und eigenverantwortliches Handeln. Klare Kommunikation in Deutsch und Englisch, sachlich, effizient, ohne Umwege. Führung mit Struktur, nicht mit Vision, sondern mit System. Find more English Speaking Jobs in Germany on Arbeitnow"
Arbeitnow API,https://www.arbeitnow.com/jobs/companies/rudolf-hensel-gmbh/anwendungstechniker-fur-brandschutzbeschichtungen-bornsen-425989,2026-05-04T09:00:34,Rudolf Hensel GmbH,Anwendungstechniker für Brandschutzbeschichtungen (m/w/d),Engineering,Börnsen,,Engineering,"Du kannst auf nachweisbare Erfolge in deiner beruflichen Laufbahn zurückblicken und strebst nach persönlichem sowie beruflichem Wachstum? Du möchtest nicht nur Projekte verwalten, sondern deine Kenntnisse in einem neuen Arbeitsumfeld einbringen, um Kunden zu begeistern und Lösungen aktiv mitzugestalten? Dann bist du bei uns genau richtig. Als mittelständisches, konzernunabhängiges Unternehmen entwickeln und produzieren wir in der Nähe von Hamburg innovative Beschichtungssysteme für den passiven baulichen Brandschutz „Made in Germany“. Unsere Marken HENSOTHERM® und HENSOMASTIK® stehen weltweit für Qualität, Sicherheit und Nachhaltigkeit. In der Technik sind wir ein kleines, motiviertes Team mit kurzen Wegen, viel Eigenverantwortung und Lust auf gute Zusammenarbeit. Aufgaben Du bist die Schnittstelle zwischen Labor, Produktion und unseren Kunden und sorgst dafür, dass unsere Beschichtungslösungen in der Praxis perfekt funktionieren. Du führst Freigabeprüfungen unserer Produktionsansätze im Rahmen der Qualitätssicherung durch Du prüfst die Verarbeitungseigenschaften von sowohl neu entwickelten als auch bestehenden Produkten sowie deren Optimierung zusammen mit der Entwicklungsabteilung Du bereitest Versuchskörper (Platten und Bauteile) für die Durchführung von internen und externen Brandprüfungen vor Du begleitest Produkteinführungen entweder intern oder direkt beim Kunden vor Ort Du entwickelst, dokumentierst und optimierst Applikationsprozesse Du führst Tests durch und bewertest die Ergebnisse (z. B. Haftung, Korrosionsschutz, Optik) Du kümmerst dich um die Wartung unserer Spritzgeräte Qualifikation Abgeschlossene Berufsausbildung als Lackierer (m/w/d), Verfahrensmechaniker für Beschichtungstechnik (m/w/d), Lacktechniker (m/w/d) oder eine vergleichbare Ausbildung Freude am selbständigen und systematischen Arbeiten Organisationstalent und Spaß am Arbeiten im Team Erste Erfahrungen im Bereich der lacktechnischen Applikationstechnik sind von Vorteil, aber kein Muss Sicherer Umgang mit den gängigen MS Office-Anwendungen sehr Gute Deutschkenntnisse und vorzugsweise auch Englischkenntnisse Benefits Strukturierte Einarbeitung durch einen festen Mentor Langfristige Perspektive in einem wachsenden, innovationsstarken Familienunternehmen Individuelle Weiterbildungsmöglichkeiten Abwechslungsreiche, verantwortungsvolle Tätigkeit mit Gestaltungsspielraum Unbefristeter Arbeitsvertrag mit attraktiver Vergütung Arbeitgeberleistungen: Vermögenswirksame Leistungen Arbeitgeberfinanzierte betriebliche Krankenzusatzversicherung Unfallversicherung Zuschuss zur Altersvorsorge Betriebssport durch Personaltrainer und Physiotherapie Regelmäßige Teamevents und Veranstaltungen Find more English Speaking Jobs in Germany on Arbeitnow"
Arbeitnow API,https://www.arbeitnow.com/jobs/companies/ocono-apd-schlauchtechnik-gmbh/zerspanungsmechaniker-morfelden-walldorf-252224,2026-05-04T09:00:34,Ocono APD Schlauchtechnik GmbH,Zerspanungsmechaniker (m/w/d),Engineering,Mörfelden-Walldorf,,Engineering,"Die Ocono VACUFLEX GmbH ist ein international tätiges Unternehmen und Marktführer in der Entwicklung und Herstellung von Kunststoffschläuchen und Kunststoffschlauchleitungen. Hinter der Ocono VACUFLEX GmbH steckt kein anonymer Großkonzern, sondern ein familiäres und engagiertes Team , für welches wir DICH als: Zerspanungsmechaniker (m/w/d) suchen! Was Du bei uns bewirkst? CNC-Schwerpunkt (80%): Du richtest unsere Haas-Maschinen selbstständig ein, programmierst und bedienst sie souverän. Du verantwortest die Einzelteilfertigung von Neukonstruktionen und Reparaturbauteilen. Konventionelle Fertigung (20%): Bei schnellen Anpassungen oder Instandsetzungsaufgaben nutzt du dein Know-how an konventionellen Dreh- und Fräsmaschinen. Präzision nach Zeichnung: Du fertigst komplexe Werkzeuge und Vorrichtungen für unsere Schlauchproduktion exakt nach technischen Zeichnungen. Zukunft mitgestalten: Du hast die Möglichkeit, dich im Bereich CAD/CAM-Programmierung aktiv weiterzuentwickeln. Das bist DU: Ausbildung: Abgeschlossene Ausbildung als Zerspanungs- oder Werkzeugmechaniker. Erfahrung: Du bringst 1 bis 5 Jahre Berufserfahrung mit – idealerweise in der Einzelteilfertigung oder im Vorrichtungsbau (keine reine Großserie). Technik-Know-how: Du bist sicher im Umgang mit CNC-Steuerungen (idealerweise Haas ) und verfügst über solide Grundlagen in der konventionellen Bearbeitung. Arbeitsweise: Du arbeitest strukturiert und eigenverantwortlich innerhalb unseres schlagkräftigen 5-köpfigen Werkstatt-Teams . Bereitschaft: Du arbeitest im wöchentlichen Wechsel im 2-Schicht-System (Früh- und Spätschicht). Was Du bei uns findest! Gehalt Ein faires, transparentes Monatsbrutto von 3.500 € bis 3.800 € (je nach Erfahrung). Keine halben Sachen Du erhältst einen unbefristeten Arbeitsvertrag Du arbeitest in einem klasse Team : Wir sind engagiert, motiviert und ziehen an einem Strang Für uns selbstverständlich : 30 Tage Urlaub Mit uns fit halten : Lease dir dein eigenes JobRad oder sichere dir vergünstigte Konditionen in einem Fitnessstudio Bei uns gibt es 0% Bullshit: Kurze Kommunikationswege, flache Hierarchien, hilfsbereite Kolleg/innen Weitere Benefits: Teamevents, Weihnachtsfeier, Sommerfest, vergünstigte Angebote (z. B. Reisen, E-Commerce, Bekleidung, Verträge) Find more English Speaking Jobs in Germany on Arbeitnow"
Arbeitnow API,https://www.arbeitnow.com/jobs/companies/projekt-3t-gmbh/senior-inhouse-consultant-document-ai-gn-dortmund-291673,2026-05-04T09:00:34,Projekt 3T GmbH,Senior Inhouse Consultant Document AI (gn),Remote,Dortmund,berufserfahren,Remote; Business Consulting,"Remote - Voll- oder Teilzeit (80%) - Festanstellung Für unseren Mandanten, ein großes Unternehmen mit komplexen, dokumentenintensiven Geschäftsprozessen, suchen wir eine erfahrene Beratungspersönlichkeit an der Schnittstelle von Dokumentenmanagement, Inputmanagement, KI-Lösungen und digitaler Prozessautomatisierung . Das Unternehmen treibt seine digitale Transformation konsequent voran und arbeitet im KI-Umfeld strategisch mit einem der führenden internationalen Tech-Unternehmen zusammen. Dadurch erhält die zuständige Squad Zugang zu besonderen technologischen Ressourcen, aktueller KI-Expertise und einem Umfeld, in dem moderne Lösungen direkt in produktive Geschäftsprozesse überführt werden. Die Rolle eignet sich besonders für Senior Consultants aus Beratung, Technologie- oder Transformationsumfeldern, die Erfahrung mit KI-Lösungen und dokumentenbasierten Prozessen mitbringen und den nächsten Schritt in eine wirkungsvolle Inhouse-Rolle gehen möchten. Im Mittelpunkt stehen fachliche Konzeption, Stakeholder-Steuerung und die Umsetzung konkreter Use Cases – nicht klassische Linienroutine. Aufgaben Im Mittelpunkt stehen konkrete KI-Use-Cases mit hoher Relevanz (z.B. jährlich rund 8 bis 10 Millionen eingehende E-Mails inklusive Anhängen sollen mithilfe von KI und digitalen Lösungen intelligenter verarbeitet werden). Zu deinen Aufgaben gehören: Fachliche Steuerung und Weiterentwicklung intelligenter Input- und Dokumentenmanagementprozesse Analyse und Optimierung dokumentenbasierter End-to-End-Prozesse mit hohem Automatisierungspotenzial Entwicklung von Zielbildern, Lösungskonzepten, Roadmaps und umsetzbaren Use Cases Übersetzung von Business-Anforderungen in Features, User Stories und priorisierte Umsetzungsschritte Bewertung von KI-gestützten Lösungsansätzen für Dokumententrennung, Klassifikation, Datenextraktion und Routing Enge Zusammenarbeit mit Fachbereichen, IT, Dienstleistern und Management in einer agilen Squad-Struktur Stakeholder-Management und Aufbereitung komplexer Sachverhalte für Entscheidungsprozesse Begleitung von Prototypen, Tests und produktiven Lösungen Auswertung von Modell- und Prozessergebnissen zur Verbesserung von Qualität, Effizienz und Wirtschaftlichkeit Sicherstellung eines verantwortungsvollen KI-Einsatzes mit Blick auf Datenschutz, Governance, Bias und Risiken Wissenstransfer und Unterstützung beim Aufbau von KI- und Prozesskompetenz im Unternehmen Qualifikation Du bringst Beratungserfahrung, Prozessverständnis und Praxisbezug zu KI- oder Automatisierungslösungen im Dokumentenmanagement mit und möchtest diese in einer langfristigen Inhouse-Rolle wirksam einsetzen. Wichtig sind insbesondere: Erfahrung als Senior Consultant, Business Consultant, Transformation Consultant, Product Owner oder vergleichbare Rolle im digitalen Prozessumfeld Sehr gutes Verständnis von Dokumentenmanagement, Inputmanagement, Workflowmanagement oder dokumentenbasierten Geschäftsprozessen Erfahrung in der Konzeption, Optimierung oder Steuerung komplexer Prozess- und Transformationsvorhaben Praxisbezug zu KI-Lösungen, Document AI, Prompt Engineering oder KI-gestützter Prozessautomatisierung Verständnis für Klassifikation, Extraktion, Dokumententrennung, Routing und Workflow-Automatisierung Fähigkeit, fachliche Anforderungen in Roadmaps, Features, User Stories und umsetzbare Lösungskonzepte zu übersetzen Erfahrung im Stakeholder-Management über Fachbereich, IT, Dienstleister und Management hinweg Analytische Stärke, Strukturierungsfähigkeit und sicheres Auftreten auf unterschiedlichen Ebenen Grundverständnis für Schnittstellen, APIs, Cloud-Anwendungen oder Systemintegration ist von Vorteil Sehr gute Deutschkenntnisse sowie verhandlungssichere Englischkenntnisse Benefits Dich erwartet eine Inhouse-Rolle mit Beratungscharakter, hoher Sichtbarkeit und klarer Umsetzungsorientierung. Du arbeitest an einem konkreten KI-Transformationsvorhaben mit erheblichem operativem Impact und gestaltest moderne Dokumentenverarbeitung langfristig mit. G"
Arbeitnow API,https://www.arbeitnow.com/jobs/companies/projekt-3t-gmbh/senior-ai-solution-engineer-document-intelligence-gn-dortmund-216163,2026-05-04T09:00:34,Projekt 3T GmbH,Senior AI Solution Engineer Document Intelligence (gn),Remote,Dortmund,berufserfahren,Remote; Consulting; Engineering,"Für unseren Mandanten, ein großes Unternehmen mit komplexen, dokumentenintensiven Geschäftsprozessen, suchen wir eine KI-erfahrene Persönlichkeit an der Schnittstelle von Document AI, Prompt Engineering, Inputmanagement und Prozessautomatisierung . Das Unternehmen treibt seine digitale Transformation konsequent voran und arbeitet im KI-Umfeld strategisch mit einem der führenden internationalen Tech-Unternehmen zusammen. Dadurch erhält die Squad Zugang zu besonderen technologischen Ressourcen, aktueller KI-Expertise und einem Umfeld, in dem KI-Lösungen mit echtem Business Impact umgesetzt werden. Die Rolle ist ideal für AI Engineers, Prompt Engineers oder technologieorientierte Dokumentenmanagement-Profile, die KI nicht nur technisch entwickeln, sondern stärker fachlich-konzeptionell einsetzen möchten. Du arbeitest nah an Business-Prozessen, übersetzt Anforderungen in wirksame KI-Lösungen und gestaltest intelligente Dokumentenverarbeitung im operativen Maßstab. Aufgaben Im Mittelpunkt stehen konkrete KI-Use-Case mit hoher Relevanz (z.B. jährlich rund 8 bis 10 Millionen eingehende E-Mails inklusive Anhängen sollen mithilfe von KI und digitalen Lösungen intelligenter verarbeitet werden). Zu deinen Aufgaben gehören: Entwicklung, Bewertung und Optimierung von KI-gestützten Lösungsansätzen für Dokumentenanalyse, Klassifikation, Extraktion und Routing Prompting und fachliche Optimierung von KI-Modellen im Kontext intelligenter Dokumentenverarbeitung Konzeption von Logiken zur Dokumententrennung, Datenerkennung und Weiterleitung in nachgelagerte Prozesse Analyse von Modell- und Prozessergebnissen zur Verbesserung von Qualität, Effizienz, Kosten und Stabilität Übersetzung fachlicher Anforderungen in Features, User Stories, Testszenarien und produktionsnahe Lösungskonzepte Enge Zusammenarbeit mit Fachbereichen, IT, Dienstleistern und Management in einer agilen Squad-Struktur Begleitung von Prototypen, Tests und produktiven Lösungen Sicherstellung eines verantwortungsvollen KI-Einsatzes mit Blick auf Datenschutz, Governance, Bias und Risiken Unterstützung beim Aufbau von KI-Kompetenz durch Sparring, Workshops und Wissenstransfer Qualifikation Du bringst Erfahrung mit KI, Prompting oder AI-basierten Automatisierungslösungen mit und möchtest diese stärker im fachlichen Kontext dokumentenbasierter Prozesse einsetzen. Wichtig sind insbesondere: Erfahrung als AI Engineer, Prompt Engineer, Data-/ML-orientiertes Profil oder technologieaffine:r Spezialist:in im Dokumentenmanagement Praxisbezug zu KI-Anwendungen, Prompt Engineering, LLMs, NLP oder KI-gestützter Dokumentenanalyse Verständnis für Klassifikation, Extraktion, Dokumententrennung, Routing und Prozessautomatisierung Erfahrung mit Document-AI-Lösungen wie Google Document AI, Vertex AI oder vergleichbaren Plattformen ist von Vorteil Grundverständnis für Schnittstellen, APIs, Cloud-Anwendungen oder Systemintegration Interesse daran, technische KI-Expertise stärker fachlich, konzeptionell und prozessnah einzubringen Erfahrung im Dokumentenmanagement, Inputmanagement oder Workflowmanagement ist wünschenswert Fähigkeit, komplexe Anforderungen zu strukturieren und in umsetzbare Lösungsansätze zu übersetzen Analytische Stärke, Eigeninitiative und Freude an interdisziplinärer Zusammenarbeit Sehr gute Deutschkenntnisse Benefits Dich erwartet eine Rolle mit hohem KI-Bezug, konkretem Umsetzungsfokus und großem Gestaltungsspielraum. Du arbeitest nicht an abstrakten Proofs of Concept, sondern an einem zentralen Use Case mit erheblichem Prozessimpact. Geboten werden u.a.: Remote-Arbeit als vollwertige Arbeitsform Arbeit an einem skalierbaren Document-AI-Use-Case mit Millionenvolumen Zugang zu besonderen KI-Ressourcen durch eine strategische Tech-Partnerschaft Enge Zusammenarbeit in einer interdisziplinären Squad Moderne, agile Arbeitsstrukturen Flexible Arbeitszeiten und 30 Tage Urlaub Attraktive Zusatzleistungen, unter anderem Mobilitätsangebote wie E-Bike-Leasing Ein Umfeld, in dem du KI-Lösungen fa"
