job_id,date_posted,source,company,title,category,raw_category,seniority,location,job_type,skills,tags_raw,salary_min_usd,salary_max_usd,salary_mid_usd,demand_index,scarcity_score,time_to_fill_days_proxy,application_volume_proxy,source_url,description_preview
raw-0085,2026-06-24,Arbeitnow API,Fischer & Partner Gesellschaft für Personal mbH,Entgeltabrechner und/oder Personalsachbearbeiter für attraktiven Arbeitgeber,HR & Recruitment,Compensation and Benefits,Mid-level,Waiblingen,berufserfahren,Recruitment; HR; Onboarding; Communication,Compensation and Benefits,45920,66080,56000,71.5,38,30.3,136,https://www.arbeitnow.com/jobs/companies/fischer-partner-gesellschaft-fur-personal-mbh/entgeltabrechner-und-oder-personalsachbearbeiter-fur-attraktiven-arbeitgeber-waiblingen-498299,Zum nächstmöglichen Zeitpunkt suchen wir Sie als Entgeltabrechner und/oder Personalsachbearbeiter für einen sehr attraktiven Arbeitgeber in einem regional fest verwurzelten und sehr bekannten Unternehmen mit ca. 500 Mita
raw-0086,2026-06-24,Arbeitnow API,SK Group & Project GbR,UGC Content Creator,Marketing & Growth,Remote,Entry-level,Berlin,"Freelance, berufseinstieg",Social Media,Remote; Marketing Manager,36900,53100,45000,77.4,38,30.3,136,https://www.arbeitnow.com/jobs/companies/sk-group-project-gbr/ugc-content-creator-berlin-406997,"Bei SK Group &#x26; Project GbR haben Sie die spannende Gelegenheit, als UGC Content Creator Teil eines dynamischen und kreativen Teams zu werden. In dieser Rolle sind Sie dafür verantwortlich, ansprechende und authentis"
raw-0087,2026-06-24,Arbeitnow API,encoway GmbH,Werkstudent:in im Bereich Beratung für Produktkonfiguration (w/m/d),Software & Engineering,Internet and software,Internship/Student,Bremen,"Part-time permanent, student (college)",Python; JavaScript; API; Cloud,Internet and software; bachelor's degree,39688,57112,48400,98.3,62,40.7,104,https://www.arbeitnow.com/jobs/companies/encoway-gmbh/werkstudentin-im-bereich-beratung-fur-produktkonfiguration-bremen-177536,"Als motivierte:r Werkstudent:in bieten wir Dir einen spannenden Einstieg in unsere Produktmodellierung und Du wirst Teil eines engagierten und sympathischen Teams, welches unsere Kund:innen rund um Produktmodellierung, K"
raw-0088,2026-06-24,Arbeitnow API,eleQtron GmbH,Working Student (f/m/d) – Process & Quality Management,Software & Engineering,Other,Internship/Student,Hamburg,"Part-time fixed-term, student (college)",Operations,Other; bachelor's degree,39688,57112,48400,71.8,38,30.3,136,https://www.arbeitnow.com/jobs/companies/eleqtron-gmbh/working-student-process-quality-management-hamburg-100594,eleQtron develops and operates full-stack quantum computers based on trapped-ion technology. Quantum computing is a new computing paradigm rapidly approaching commercial viability. Our unique approach combines laser-cool
raw-0089,2026-06-24,Arbeitnow API,Shereen Patzelt,Werkstudent Vertrieb / Finanzberatung (m/w/d) – Praxis statt Theorie,Finance & Business,Finance,Internship/Student,Chemnitz,"Full-time permanent, entry",Finance; Onboarding,Finance; high school or equivalent,30668,44132,37400,72.4,38,30.3,136,https://www.arbeitnow.com/jobs/companies/shereen-patzelt/werkstudent-vertrieb-finanzberatung-praxis-statt-theorie-chemnitz-761,"Du studierst und willst mehr als einen „Nebenjob“? Du willst Verantwortung, klare Ziele und ein Umfeld, in dem Leistung zählt? Dann ist diese Werkstudentenrolle dein Einstieg in die Finanzberatung, mit strukturiertem Onb"
raw-0090,2026-06-24,Arbeitnow API,sirius-net GmbH,Fachinformatiker:in Systemintegration (m/w/d),Software & Engineering,IT,Unspecified,Stuttgart,,Cloud; REST,IT,66387,95533,80960,84.6,46,33.8,125,https://www.arbeitnow.com/jobs/companies/sirius-net-gmbh/fachinformatikerin-systemintegration-stuttgart-395663,"Du begeisterst Dich für IT-Infrastrukturen, Server und Netzwerke und möchtest dafür sorgen, dass verteilte Systeme zuverlässig und sicher laufen? Wir suchen Verstärkung für unser Team – egal ob Berufseinsteiger:in oder m"
raw-0091,2026-06-24,Arbeitnow API,Bahmann Coaching GmbH,Diätassistent (m/w/d) für Abnehmcoaching,Finance & Business,Business Consulting,Mid-level,Hanover,berufserfahren,Excel; Finance; Accounting; Forecasting,Business Consulting,55760,80240,68000,57,38,30.3,136,https://www.arbeitnow.com/jobs/companies/bahmann-coaching-gmbh/diatassistent-fur-abnehmcoaching-hanover-279568,"Jobbeschreibung Du willst lernen, wie Fitness- und Ernährungsberatung richtig geht, Teil eines erfahrenen Teams sein und selbst täglich mit neuen Kunden sprechen? Mein Name ist Jan Bahmann und ich habe Bahmann Coaching v"
raw-0092,2026-06-24,Arbeitnow API,Lionflence,Artist Manager / Influencer Manager (m/w/d),Software & Engineering,Marketing and Communication,Senior/Lead,Mülheim,,Communication; Social Media,Marketing and Communication,97416,140184,118800,88,48,38.6,123,https://www.arbeitnow.com/jobs/companies/lionflence/artist-manager-influencer-manager-mulheim-303339,"Was wir Dir bieten: Eine spannende Herausforderung, in der du dich weiterentwickeln kannst, rundum den Bereich Artistmanagement Medien/Social Media, Influencer Marketing und den dazugehörigen Technologien (Software Syste"
raw-0093,2026-06-24,Arbeitnow API,Lionflence,Artist Manager / Influencer Manager (m/w/d) BERLIN,Software & Engineering,Marketing and Communication,Senior/Lead,Berlin,,Communication; Social Media,Marketing and Communication,97416,140184,118800,88,48,38.6,123,https://www.arbeitnow.com/jobs/companies/lionflence/artist-manager-influencer-manager-berlin-340036,"Was wir Dir bieten: Eine spannende Herausforderung, in der du dich weiterentwickeln kannst, rundum den Bereich Artistmanagement Medien/Social Media, Influencer Marketing und den dazugehörigen Technologien (Software Syste"
raw-0094,2026-06-24,Arbeitnow API,Lionflence,Junior Artist Manager / Influencer Manager (m/w/d),Software & Engineering,Marketing and Communication,Senior/Lead,Berlin,,Communication; Social Media,Marketing and Communication,97416,140184,118800,88,48,38.6,123,https://www.arbeitnow.com/jobs/companies/lionflence/junior-artist-manager-influencer-manager-berlin-335961,"Was wir Dir bieten: Eine spannende Herausforderung, in der du dich weiterentwickeln kannst, rundum den Bereich Artistmanagement Medien/Social Media, Influencer Marketing und den dazugehörigen Technologien (Software Syste"
raw-0095,2026-06-24,Arbeitnow API,Lionflence,Junior Artist Manager / Influencer Manager (m/w/d),Software & Engineering,Marketing and Communication,Senior/Lead,Mülheim,,Communication; Social Media,Marketing and Communication,97416,140184,118800,88,48,38.6,123,https://www.arbeitnow.com/jobs/companies/lionflence/junior-artist-manager-influencer-manager-mulheim-9924,"Was wir Dir bieten: Eine spannende Herausforderung, in der du dich weiterentwickeln kannst, rundum den Bereich Artistmanagement Medien/Social Media, Influencer Marketing und den dazugehörigen Technologien (Software Syste"
raw-0096,2026-06-24,Arbeitnow API,Lionflence,Trainee Artist Manager / Influencer Manager (m/w/d),Software & Engineering,Marketing and Communication,Internship/Student,Berlin,hilfstätigkeit / student,Communication; Social Media,Marketing and Communication,39688,57112,48400,88,38,30.3,136,https://www.arbeitnow.com/jobs/companies/lionflence/trainee-artist-manager-influencer-manager-berlin-374496,"Was wir Dir bieten: Eine spannende Herausforderung, in der du dich weiterentwickeln kannst, rundum den Bereich Artistmanagement Medien/Social Media, Influencer Marketing und den dazugehörigen Technologien (Software Syste"
raw-0097,2026-06-24,Arbeitnow API,Lionflence,Trainee Artist Manager / Influencer Manager (m/w/d),Software & Engineering,Training,Internship/Student,Mülheim,hilfstätigkeit / student,AI; Social Media,Training; Development,39688,57112,48400,87.4,38,30.3,136,https://www.arbeitnow.com/jobs/companies/lionflence/trainee-artist-manager-influencer-manager-mulheim-262087,"Was wir Dir bieten: Eine spannende Herausforderung, in der du dich weiterentwickeln kannst, rundum den Bereich Artistmanagement Medien/Social Media, Influencer Marketing und den dazugehörigen Technologien (Software Syste"
raw-0098,2026-06-24,Arbeitnow API,Growthartig GmbH,Praktikum Design / Grafikdesign (m/w/d),Marketing & Growth,Graphic Arts and Communication Design,Internship/Student,Berlin,Internship,Communication; Design; Startup; Cloud; Figma,Graphic Arts and Communication Design,27060,38940,33000,78.9,46,33.8,125,https://www.arbeitnow.com/jobs/companies/growthartig-gmbh/praktikum-design-grafikdesign-berlin-147569,"Du liebst gutes Design, hast ein Auge für Ästhetik und möchtest lernen, wie aus Ideen performante Creatives werden? Dann bist du bei uns genau richtig! Gemeinsam mit unserem Creative Team bringst du Marken visuell zum Le"
raw-0099,2026-06-24,Arbeitnow API,RegioVision GmbH Schwerin,Finanz- und Projektassistenz,Product & Project Management,Process Management,Mid-level,Schwerin,berufserfahren,Product Management; Project Management; Agile; Stakeholder Management,Process Management,62320,89680,76000,56.2,38,30.3,136,https://www.arbeitnow.com/jobs/companies/regiovision-gmbh-schwerin/finanz-und-projektassistenz-schwerin-190727,"Zahlen, die etwas bewegen. Projekte, die Europa verbinden. RegioVision GmbH Schwerin ist kein gewöhnlicher Arbeitgeber. Wir begleiten Menschen auf ihrem Weg in Beschäftigung – mit Bildungsangeboten, Coaching und einem wa"
raw-0100,2026-06-24,Arbeitnow API,conteam gruppe,Social Media Manager (m/w/d),Data & AI,Social Media Manager,Senior/Lead,Frankfurt am Main,,Social Media; Generative AI; Video Editing; AI,Social Media Manager,94095,135405,114750,69,61,44.2,106,https://www.arbeitnow.com/jobs/companies/conteam-gruppe/social-media-manager-frankfurt-am-main-452089,"Kampagnen, die du wiedererkennst – für Marken wie DB Schenker, Volkswagen, Opel, VDO, Süwag und Swiss Life Ein eingespieltes Team aus Spezialist:innen, das Handwerk, Qualität und Details ernst nimmt Echte Entwicklung – W"
raw-0101,2026-06-24,Arbeitnow API,conteam gruppe,Client Service Director (m/w/d),Product & Project Management,Management,Senior/Lead,Frankfurt am Main,,Finance; AI,Management; Team Leader,84132,121068,102600,83.5,48,38.6,123,https://www.arbeitnow.com/jobs/companies/conteam-gruppe/client-service-director-frankfurt-am-main-315377,"Kampagnen, die du wiedererkennst – für Marken wie DB Schenker, Volkswagen, Opel, VDO, Süwag und Swiss Life Ein eingespieltes Team aus Spezialist:innen, das Handwerk, Qualität und Details ernst nimmt Echte Entwicklung – W"
raw-0102,2026-06-24,Arbeitnow API,conteam gruppe,Retoucher / Compositing Artist (m/f/d),Marketing & Growth,Media,Mid-level,Frankfurt am Main,professional / experienced,Design; Generative AI; Communication; Advertising; Editing; AI,Media; Screen and Web Design,49200,70800,60000,69.2,46,33.8,125,https://www.arbeitnow.com/jobs/companies/conteam-gruppe/retoucher-compositing-artist-frankfurt-am-main-159369,"Campaigns you’ll actually recognise – for brands like BMW, Porsche, OPEL, Bentley, Hyundai and more A tight-knit team of specialists who care about craft, quality and getting the details right Room to grow – especially i"
raw-0103,2026-06-24,Arbeitnow API,KUHN GmbH,Programmierer*in für interne Anwendungen,HR & Recruitment,IT,Internship/Student,Höpfingen,,React; C#,IT,25256,36344,30800,55.1,38,30.3,136,https://www.arbeitnow.com/jobs/companies/kuhn-gmbh/programmiererin-fur-interne-anwendungen-hopfingen-483505,"Wir bei KUHN arbeiten mit großem Engagement daran, die besten Lösungen für unserer Kunden im In- und Ausland zu garantieren. Das können wir, weil eigenverantwortliches Arbeiten und Teamgeist bei KUHN keine Gegensätze sin"
raw-0104,2026-06-24,Arbeitnow API,requisimus Holding GmbH,Senior Embedded Solution Architect (Automotive) (m/w/x) FREELANCE,Software & Engineering,Remote,Senior/Lead,Ulm,"Freelance, berufserfahren",Cybersecurity; Security; Android,Remote; Embedded Systems; Firmware Development,97416,140184,118800,53.2,64,45.5,102,https://www.arbeitnow.com/jobs/companies/requisimus-holding-gmbh/senior-embedded-solution-architect-automotive-freelance-ulm-101567,"Für die Unterstützung in mehreren Kundenprojekten suchen wir einen erfahrenen Experten, der sowohl über tiefgehende technische Expertise als auch über ausgeprägte Kommunikations- und Moderationsfähigkeiten verfügt. Wir s"
raw-0105,2026-06-24,Arbeitnow API,Moin Marketing GmbH,(Senior) Media Manager (m/w/d) (Vollzeit in Hamburg),Marketing & Growth,Marketing and Communication,Senior/Lead,Hamburg,,Communication; Testing; Cloud; Video Editing; Sales,Marketing and Communication,66420,95580,81000,81.6,56,42.1,112,https://www.arbeitnow.com/jobs/companies/moin-marketing-gmbh/senior-media-manager-hamburg-269081,"Gestalte und führe einen unserer wichtigsten Wachstumsbereiche, von Amazon DSP bis Full Funnel Media. Vollzeit · Hamburg · hybrid · ab sofort Du kennst das Amazon und Retail Media Universum in und auswendig und willst me"
raw-0106,2026-06-24,Arbeitnow API,Riverstate Premium Recruiting,Stellvertretender Werkstattleiter (m/w/d) | 52.000 - 60.000 €,Software & Engineering,Automotive Engineering,Mid-level,Fürth,berufserfahren,Python; JavaScript; API; Cloud,Automotive Engineering,72160,103840,88000,98.3,62,40.7,104,https://www.arbeitnow.com/jobs/companies/riverstate-premium-recruiting/stellvertretender-werkstattleiter-52000-60000-eur-furth-184191,"Mit bis zu 60.000 € Jahresgehalt auf 13 Monatsgehälter, Personalverantwortung, 30 Urlaubstagen und einer Schlüsselrolle zwischen Werkstatt, Kunden und Serviceleitung erwartet Sie eine Position für erfahrene Praktiker mit"
raw-0107,2026-06-24,Arbeitnow API,JobAtlas,IT-Systemadministrator / First-Level-Support (m/w/d),Software & Engineering,System and Network Administration,Unspecified,Werne,,Python; JavaScript; API; Cloud,System and Network Administration,66387,95533,80960,98.3,62,40.7,104,https://www.arbeitnow.com/jobs/companies/jobatlas/it-systemadministrator-first-level-support-werne-293676,"Du suchst einen IT-Job mit Abwechslung? Dann ist das Deine Chance! Für ein führendes Großhandelsunternehmen suchen wir Dich, um das IT-Team am Standort in Werne zu verstärken. Als IT-Systemadministrator / First-Level-Sup"
raw-0108,2026-06-24,Arbeitnow API,Broeder Ruckh Consulting GmbH,Softwareentwickler (gn) C# und Cloud,Software & Engineering,Software Development,Mid-level,Stuttgart,berufserfahren,Kubernetes; Azure; Cloud; Scrum; .NET; C#; HR,Software Development,72160,103840,88000,59,62,40.7,104,https://www.arbeitnow.com/jobs/companies/broeder-ruckh-consulting-gmbh/softwareentwickler-gn-c-und-cloud-stuttgart-388400,"Unser Mandant ist Technologieführer in der Gesundheitsbranche mit über 1000 Mitarbeitenden. Aufgaben Entwicklung anspruchsvoller medizinischer Softwareprodukte, agil (SCRUM) im regulierten Umfeld Analyse, Spezifikation u"
raw-0109,2026-06-24,Arbeitnow API,KARRIEREMACHER GmbH,IT-Systemadministrator in Teilzeit (m/w/d),Software & Engineering,Applications Administration,Unspecified,Munich,,Security; Cloud,Applications Administration,66387,95533,80960,87.4,54,37.2,115,https://www.arbeitnow.com/jobs/companies/karrieremacher-gmbh/it-systemadministrator-in-teilzeit-munich-168348,Bei unserer Kundin handelt es sich um eine renommierte Notariatskanzlei im Herzen Münchens. Mit einem hochspezialisierten Team von rund 25 Mitarbeitenden begleitet sie ihre Mandanten bei anspruchsvollen Immobilien- und U
raw-0110,2026-06-24,Arbeitnow API,momox,Junior Recruiter (m/w/d),HR & Recruitment,HR,Entry-level,Leipzig,,HR; Onboarding,HR,34440,49560,42000,70.1,38,30.3,136,https://www.arbeitnow.com/jobs/companies/momox/junior-recruiter-leipzig-157334,"Unsere Mission Wir haben es uns zur Aufgabe gemacht, unseren Planeten zu retten – ein Second Hand Produkt nach dem anderen. Werde Teil unseres Recruiting-Teams in Leipzig und besetze gemeinsam mit deinen neuen Lieblingsk"
raw-0111,2026-06-24,Arbeitnow API,getpress,Junior PR Manager (m/w/d) – Remote oder Berlin,Marketing & Growth,Remote,Senior/Lead,Berlin,berufseinstieg,Communication; Social Media; AI,Remote; Marketing and Communication,66420,95580,81000,91.1,48,38.6,123,https://www.arbeitnow.com/jobs/companies/getpress/junior-pr-manager-remote-oder-berlin-315359,"Overview PR steht vor einem strukturellen Bruch. Vertrauen verschiebt sich, Sichtbarkeit wird neu verteilt, KI wächst exponentiell. Wir bei getpress glauben, dass Reputation in den nächsten zehn Jahren der entscheidende "
raw-0112,2026-06-24,Arbeitnow API,getpress,PR Manager (m/w/d) – Remote oder Berlin,Marketing & Growth,Remote,Senior/Lead,Berlin,berufserfahren,Communication; AI,Remote; Marketing and Communication,66420,95580,81000,98,48,38.6,123,https://www.arbeitnow.com/jobs/companies/getpress/pr-manager-remote-oder-berlin-258569,"Overview PR steht vor einem strukturellen Bruch. Vertrauen verschiebt sich, Sichtbarkeit wird neu verteilt, KI wächst exponentiell. Wir bei getpress glauben, dass Reputation in den nächsten zehn Jahren der entscheidende "
raw-0113,2026-06-24,Arbeitnow API,MANAGEMENT mobil Personalberatung,Hybrides Arbeiten: Systemplaner / Fachplaner (w/m/d) Technische Gebäudeausrüstung,Software & Engineering,Building,Mid-level,Jülich,berufserfahren,Excel,Building; Supply; Safety Services Engineering,72160,103840,88000,60.6,38,30.3,136,https://www.arbeitnow.com/jobs/companies/management-mobil-personalberatung/hybrides-arbeiten-systemplaner-fachplaner-technische-gebaudeausrustung-julich-299551,"Seit 1999 - also nunmehr über 25 Jahre - sind wir kompetenter und etablierter Personalpartner der Branche Architektur / Ingenieurwesen, Immobilien und Bauwirtschaft, wenn es um die erfolgreiche Besetzung von Positionen f"
raw-0114,2026-06-24,Arbeitnow API,Quantum- Systems GmbH,Senior Platform Engineer – Cloud & ML Platform (m/f/d),Data & AI,Internet and software,Senior/Lead,Gilching,"Full-time permanent, mid",Machine Learning; Kubernetes; Automation; Operations; Security; Design; Azure; Cloud; AWS; AI,Internet and software; professional,94095,135405,114750,68.4,93,58,64,https://www.arbeitnow.com/jobs/companies/quantum-systems-gmbh/senior-platform-engineer-cloud-ml-platform-gilching-100040,"As a Platform Engineer – Cloud &amp; ML Platform (m/f/d), you will be a key contributor to the cloud-native infrastructure that powers our AI and autonomy development at global scale. You will design, deploy, operate, an"
raw-0115,2026-06-24,Arbeitnow API,clayton Umwelt-Consult GmbH,Projektleiter / Gutachter (m/w/d) im Fachbereich Altlasten / Umweltschäden,Software & Engineering,Engineering,Unspecified,Ludwigshafen,,Python; JavaScript; API; Cloud,Engineering,66387,95533,80960,98.2,62,40.7,104,https://www.arbeitnow.com/jobs/companies/clayton-umwelt-consult-gmbh/projektleiter-gutachter-im-fachbereich-altlasten-umweltschaden-ludwigshafen-449817,"CLAYTON ist seit über 30 Jahren ein expandierendes und nachhaltig erfolgreiches Ingenieur- und Consultingunternehmen für ALTLASTEN, Umweltschäden und schwerpunktmäßig im Bereich BAUGRUND/GEOTECHNIK. Dieses Jahr erarbeite"
raw-0116,2026-06-24,Arbeitnow API,Placed Technologies GmbH,Werkstudent:in / Praktikant:in (m/w/d) Product Testing & AI Automation,Software & Engineering,Quality Assurance,Internship/Student,Berlin,"Working student, berufseinstieg",Product Management; Automation; Operations; Testing; API; CRM; AI,Quality Assurance; Inspection,39688,57112,48400,71,46,33.8,125,https://www.arbeitnow.com/jobs/companies/placed-technologies-gmbh/werkstudentin-praktikantin-product-testing-ai-automation-berlin-40623,"PLACED ist ein Technologieunternehmen aus Berlin-Mitte. Wir entwickeln KI-Software für Personalvermittler:innen, die den Vertrieb ihrer Kandidat:innen besser steuern wollen. Unser Produkt hilft Teams, aus Profilen von Ka"
raw-0117,2026-06-24,Arbeitnow API,Stellantis &You Deutschland GmbH,Junior-Controller in der kaufmännischen Abteilung (m/w/d),Product & Project Management,Finance,Entry-level,Hamburg,,Finance; Excel; SAP,Finance,46740,67260,57000,59.9,38,30.3,136,https://www.arbeitnow.com/jobs/companies/stellantis-you-deutschland-gmbh/junior-controller-in-der-kaufmannischen-abteilung-hamburg-301405,"STELLANTIS &#x26;YOU - Mit starken Marken Zukunft gestalten. Die aktuelle Produktpalette unserer Marken ABARTH, ALFA ROMEO, CITROËN, FIAT, FIAT PROFESSIONAL, JEEP, LEAPMOTOR, Opel und PEUGEOT, ist die umfassendste und mo"
raw-0118,2026-06-24,Arbeitnow API,HolDeinePlakette,KfZ-Prüfassistent & Fahrer für Hol- und Bringservice | KfZ-Prüfstelle (m/w/d),Software & Engineering,Automotive Engineering,Unspecified,Kitzingen,,Python; JavaScript; API; Cloud,Automotive Engineering,66387,95533,80960,98.2,62,40.7,104,https://www.arbeitnow.com/jobs/companies/holdeineplakette/kfz-prufassistent-fahrer-fur-hol-und-bringservice-kfz-prufstelle-kitzingen-476763,"Wir sind HolDeinePlakette , das schnellstwachsende Ingenieurbüro Deutschlands - spezialisiert auf die Durchführung von Haupt- und Abgasuntersuchungen gemäß §29 StVZO sowie auf Schadensgutachten. Mit unserer Arbeit leiste"
raw-0119,2026-06-24,Arbeitnow API,EMIL Group GmbH,Werkstudent im Recruiting (w/m/d/x),Product & Project Management,Recruitment and Selection,Internship/Student,Berlin,"Working student, berufseinstieg",Recruitment; iOS; HR,Recruitment and Selection,34276,49324,41800,53.9,38,30.3,136,https://www.arbeitnow.com/jobs/companies/emil-group-gmbh/werkstudent-im-recruiting-x-berlin-285033,DEINE ROLLE Als Werkstudent im Recruiting (w/m/d/x) unterstützt du das EMIL Recruiting Team über den gesamten Recruiting-Prozess für Tech- und Non-Tech Profile. Du arbeitest dabei eng mit unserem Senior Recruiter zusamme
raw-0120,2026-06-24,Arbeitnow API,HolDeinePlakette,KfZ-Prüfassistent & Fahrer für Hol- und Bringservice | KfZ-Prüfstelle (m/w/d),Software & Engineering,Automotive Engineering,Unspecified,Duisburg,,Python; JavaScript; API; Cloud,Automotive Engineering,66387,95533,80960,98.2,62,40.7,104,https://www.arbeitnow.com/jobs/companies/holdeineplakette/kfz-prufassistent-fahrer-fur-hol-und-bringservice-kfz-prufstelle-duisburg-343450,"Wir sind HolDeinePlakette , das schnellstwachsende Ingenieurbüro Deutschlands - spezialisiert auf die Durchführung von Haupt- und Abgasuntersuchungen gemäß §29 StVZO sowie auf Schadensgutachten. Mit unserer Arbeit leiste"
raw-0121,2026-06-24,Arbeitnow API,Immobilienberatung Bremen GmbH,Immobiliengutachter Senior/ Junior/ Trainee (m/w/d) in Vollzeit - Immobilienberatung Bremen GmbH,HR & Recruitment,Training,Internship/Student,Bremen,hilfstätigkeit / student,AI,Training; Development,25256,36344,30800,97.4,38,30.3,136,https://www.arbeitnow.com/jobs/companies/immobilienberatung-bremen-gmbh/immobiliengutachter-senior-junior-trainee-in-vollzeit-immobilienberatung-bremen-gmbh-107601,"Die Immobilienberatung Bremen GmbH ist ein über die Grenzen der Freien Hansestadt Bremen hinaus tätiges Immobilienberatungsunternehmen mit dem Anspruch, einen neuen Standard in der Immobilienvermittlung und Immobilienber"
raw-0122,2026-06-24,Arbeitnow API,Cell Labs,People Operations Manager,Software & Engineering,Administration,Senior/Lead,Berlin,,Onboarding; Operations; Startup; HR,Administration,97416,140184,118800,67,48,38.6,123,https://www.arbeitnow.com/jobs/companies/cell-labs/people-operations-manager-berlin-80986,"Join the build. Not the buzz. We don’t build apps, we build real hardware . Our team designs and develops humanoid robots and the intelligent systems behind them, tangible technology that pushes boundaries and redefines "
raw-0123,2026-06-24,Arbeitnow API,HolDeinePlakette,KfZ-Prüfassistent & Fahrer für Hol- und Bringservice | KfZ-Prüfstelle (m/w/d),Software & Engineering,Automotive Engineering,Unspecified,Solingen,,Python; JavaScript; API; Cloud,Automotive Engineering,66387,95533,80960,98.2,62,40.7,104,https://www.arbeitnow.com/jobs/companies/holdeineplakette/kfz-prufassistent-fahrer-fur-hol-und-bringservice-kfz-prufstelle-solingen-125685,"Wir sind HolDeinePlakette , das schnellstwachsende Ingenieurbüro Deutschlands - spezialisiert auf die Durchführung von Haupt- und Abgasuntersuchungen gemäß §29 StVZO sowie auf Schadensgutachten. Mit unserer Arbeit leiste"
raw-0124,2026-06-24,Arbeitnow API,Immobilienberatung Bremen GmbH,Head of Staff (m/w/d) in Vollzeit - Immobilienberatung Bremen GmbH,Product & Project Management,Training,Internship/Student,Bremen,hilfstätigkeit / student,AI,Training; Development,34276,49324,41800,97.4,38,30.3,136,https://www.arbeitnow.com/jobs/companies/immobilienberatung-bremen-gmbh/head-of-staff-in-vollzeit-immobilienberatung-bremen-gmbh-206071,"Die Immobilienberatung Bremen GmbH ist ein über die Grenzen der Freien Hansestadt Bremen hinaus tätiges Immobilienberatungsunternehmen mit dem Anspruch, einen neuen Standard in der Immobilienvermittlung und Immobilienber"
raw-0125,2026-06-24,Arbeitnow API,Oetinger Aluminium GmbH,SAP Anwendungsbetreuer (m/w/d) - in Vollzeit,HR & Recruitment,SAP/ERP Consulting,Mid-level,Weißenhorn,berufserfahren,ERP; SAP,SAP/ERP Consulting; Development,45920,66080,56000,52.8,38,30.3,136,https://www.arbeitnow.com/jobs/companies/oetinger-aluminium-gmbh/sap-anwendungsbetreuer-in-vollzeit-weissenhorn-135687,Die OETINGER Aluminium GmbH produziert mit ihren 400 Mitarbeitern an zwei Standorten im Süden Deutschlands und einem Standort in Tschechien ca. 220.000 Tonnen Aluminiumlegierungen aus Recyclingmaterial. OETINGER ist dami
