source,source_url,date_posted,company,title,category,location,job_type,tags_raw,description
Arbeitnow API,https://www.arbeitnow.com/jobs/companies/future-demand/associate-product-manager-delivery-berlin-42622,2026-07-22T08:00:29,Future Demand,"Associate Product Manager, Delivery (m/f/d)",Product Management,Berlin,manager,Product Management,"We are looking for a Associate Product Delivery Manager to help turn product priorities into clear, well-organized work for our engineering and design teams. Working closely with our Product Lead, you will help define new features, prepare upcoming work, coordinate requirements, and keep track of sprint progress. You will bring structure and clarity to the product-development process while growing your product-management skills through hands-on experience and mentorship. This is a good opportunity for someone early in their product career who is organized, curious, and comfortable collaborating across different disciplines. Tasks Draft feature scopes, requirements, user stories, and acceptance criteria with guidance from the Product Lead. Help maintain and organize the product backlog. Prepare features and tasks for refinement and sprint planning. Coordinate requirements and open questions between product, engineering, and design. Track sprint status, delivery progress, dependencies, and blockers. Keep the team and relevant stakeholders informed about progress and changes. Support planning, refinement, reviews, and other product-delivery meetings. Document product requirements, decisions, and changes. Gather the information needed for prioritization discussions. Contribute recommendations while the Product Lead retains final prioritization responsibility. Help improve the team’s product-development and delivery processes. Take on greater product ownership as your skills and experience develop. Requirements What we’re looking for Approximately 1–3 years of relevant experience in product management, project coordination, business analysis, software delivery, design, QA, or a related area. Relevant internships and working-student experience may count. Some experience working with software engineering, design, or other multidisciplinary teams. The ability to turn discussions and ideas into clear written requirements and action items. Strong organizational skills and attention to detail. Clear and thoughtful written and verbal communication. Confidence following up on open questions, dependencies, and commitments. Curiosity about users, technology, and how digital products are built. A collaborative mindset and willingness to ask questions and learn. Basic familiarity with agile product development and tools such as Jira, Linear, Notion, or Confluence. Helpful, but not required Experience writing user stories or acceptance criteria. Familiarity with sprint planning, backlog refinement, or software-release processes. Enough technical curiosity to learn about APIs, data flows, system dependencies, and implementation trade-offs. Experience working in a startup, scale-up, or another quickly changing environment. You do not need to meet every item on this list. We care about your potential, judgment, communication skills, and willingness to learn. What success looks like within your first six months: Upcoming features and tasks are documented clearly and prepared on time. Sprint progress, dependencies, and blockers are visible to the team. Product decisions and requirement changes are consistently documented. Engineering and design know where to find the information they need. Open questions are identified and brought to the right people early. The Product Lead has reliable support across planning, prioritization, and delivery. You begin handling smaller features with increasing independence. Benefits We offer an exciting environment at the interface between IT and entertainment and marketing as part of an ambitious, international and results-orientated team in a young startup. You work with an excellent international team with varied tasks with a wide range of great opportunities An attractive and competitive salary Monthly learning budget Urban Sports Club membership support Support for your favourite means of transport - we help finance your new bike or your public transport subscription We are a startup in one of the cultural hubs i"
Arbeitnow API,https://www.arbeitnow.com/jobs/companies/bruggen-engineering-gmbh/senior-systemingenieur-systeminfrastruktur-in-nurnberg-remote-1705-mannheim-56666,2026-07-22T07:30:32,BRÜGGEN ENGINEERING GmbH,Senior Systemingenieur (m/w/d) Systeminfrastruktur in Nürnberg / Remote (1705),Remote,Mannheim,,Remote; Engineering,"Ihre Karriere im Bereich Automotive Power Electronic. Mit BRÜGGEN ENGINEERING entwickeln Sie die Systeminfrastruktur moderner Hochvolt-Invertersysteme für hybride und vollelektrische Fahrzeuge. Sie übernehmen die technische Verantwortung für Systemfunktionen, koordinieren interdisziplinäre Entwicklungsteams und gestalten gemeinsam mit Kunden robuste und zukunftsfähige Systemlösungen. Aufgaben Systementwicklung: Sie verantworten die Entwicklung und Umsetzung von Systeminfrastrukturfunktionen für Hochvolt-Inverter über den gesamten Produktlebenszyklus. Systemkonzepte: Sie entwickeln robuste Konzepte und Anforderungen unter Berücksichtigung von Qualität, Leistung, Kosten und Terminen. Koordination: Sie steuern die Zusammenarbeit zwischen Hardware, Software, Kalibrierung, Safety und Test. Kundenkommunikation: Sie führen technische Abstimmungen und fungieren als zentrale Ansprechperson für die verantworteten Funktionen. Fehleranalyse: Sie identifizieren Ursachen technischer Probleme und entwickeln wirksame Lösungen auf Systemebene. Funktionale Sicherheit: Sie unterstützen Sicherheitskonzepte, SFMEA und FTA gemäß ISO 26262. Projektsteuerung: Sie berichten über Status, Risiken und Maßnahmen und unterstützen die fachliche Führung der Projektteams. Qualifikation Qualifikation: Abgeschlossenes Masterstudium in Fahrzeugtechnik, Elektrotechnik, Elektronik, Mechatronik oder einer vergleichbaren Fachrichtung Erfahrung: Mindestens zehn Jahre Berufserfahrung in der automobilen Systementwicklung, idealerweise im Bereich Hochvolt-Inverter, Leistungselektronik oder elektrifizierte Antriebe Systemengineering: Fundierte Kenntnisse in den Bereichen Anforderungsentwicklung, Systemarchitektur, Integration, Verifikation und Validierung Fachwissen: Erfahrung mit Stromversorgungen, Mikrocontroller-Sicherheitsmechanismen und weiteren Infrastrukturfunktionen von Hochvolt-Invertern Problemlösung: Ausgeprägte Erfahrung in Trouble-Shooting, Root-Cause-Analyse und technischer Entscheidungsfindung Sicherheit: Kenntnisse der funktionalen Sicherheit nach ISO 26262 sowie der Hochvoltsicherheit Tools: Erfahrung mit Polarion, JIRA, Enterprise Architect und MATLAB/Simulink von Vorteil Kommunikation: Sehr gute Englischkenntnisse, Deutschkenntnisse von Vorteil, sowie Reisebereitschaft nach Luxemburg von bis zu 25 % Benefits Attraktive Konditionen: Unbefristete Vollzeitstelle mit einer Vergütung, die Ihrer Qualifikation und Erfahrung entspricht Zukunftssichere Projekte: Übernehmen Sie technische Verantwortung für Hochvolt-Inverter und elektrische Antriebssysteme Dynamisches Team: Kollegiales Umfeld mit kurzen Entscheidungswegen Wir freuen uns auf Ihre aussagekräftigen Bewerbungsunterlagen mit Angabe Ihres frühesten Starttermins und Ihrer Gehaltsvorstellung. Ihr Ansprechpartner für Ihre Bewerbung ist: Herr Dipl.-Ing. Thomas Keller Find more English Speaking Jobs in Germany on Arbeitnow"
Arbeitnow API,https://www.arbeitnow.com/jobs/companies/jobbusters-gmbh/bilanzbuchhalter-senior-accountant-stuttgart-11744,2026-07-22T07:30:32,Jobbusters® GmbH,Bilanzbuchhalter / Senior Accountant (m/w/d),Finance,Stuttgart,,Finance,"Die Jobbusters vermittelt im Rahmen der Direktvermittlung an ein erfolgreiches, familiengeführtes Produktionsunternehmen mit langjähriger Tradition und internationaler Ausrichtung. Unser Mandant entwickelt und produziert hochwertige Spezialprodukte für anspruchsvolle Industriekunden und steht für Qualität, Innovation sowie nachhaltiges Wachstum. Zur Verstärkung des Finance-Teams suchen wir zum nächstmöglichen Zeitpunkt einen engagierten Bilanzbuchhalter / Senior Accountant (m/w/d) . Aufgaben Eigenständige Erstellung und Analyse von Monats-, Quartals- und Jahresabschlüssen gemäß HGB Unterstützung bei der Aufstellung des Konzernabschlusses sowie bei Konsolidierungsprozessen innerhalb der Unternehmensgruppe Überwachung und kontinuierliche Verbesserung von Abschluss- und Berichtsprozessen hinsichtlich Qualität und Termintreue Betreuung zentraler Bereiche der Finanzbuchhaltung und Sicherstellung reibungsloser Abläufe Abstimmung von Haupt- und Nebenbuchkonten sowie konzerninternen Verrechnungen Kompetente Schnittstelle für externe Prüfer, Berater und interne Fachbereiche Organisation und Begleitung von Jahresabschluss-, Steuer- und Betriebsprüfungen Fachliche Unterstützung des Managements bei finanzwirtschaftlichen und bilanziellen Fragestellungen Mitwirkung bei steuerlichen Sachverhalten und der Erstellung behördlicher MeldungenIdentifikation von Optimierungspotenzialen innerhalb der Finanzprozesse und deren Umsetzung Weiterentwicklung digitaler Arbeitsabläufe, Reporting-Instrumente und Automatisierungslösungen Mitarbeit in unternehmensweiten Projekten mit Bezug zu Finance, Reporting und Compliance Qualifikation Abgeschlossenes Studium mit Schwerpunkt Finanzen, Rechnungswesen oder Controlling beziehungsweise eine vergleichbare Qualifikation, beispielsweise als Bilanzbuchhalter (IHK) Mehrjährige praktische Erfahrung im Bereich Accounting, Finanzbuchhaltung oder Abschlusserstellung Fundiertes Wissen in der Rechnungslegung nach HGB und sicherer Umgang mit Jahresabschlüssen Kenntnisse im Konzernrechnungswesen oder in Konsolidierungsprozessen sind von Vorteil Souveränes Auftreten gegenüber externen Prüfern, Steuerberatern und internen Stakeholdern Anwenderkenntnisse in ERP-Systemen, idealerweise im Umfeld moderner Microsoft-LösungenSehr gute Fähigkeiten im Umgang mit Excel sowie ein ausgeprägtes Verständnis für Zahlen und Prozesse Begeisterung für digitale Transformation, Prozessoptimierung und moderne Finanzorganisationen Strukturierte, eigenverantwortliche und zielorientierte Arbeitsweise Kommunikationsstärke, analytisches Denkvermögen und ein hohes Maß an Verantwortungsbewusstsein Gute Englischkenntnisse für den Austausch mit internationalen Ansprechpartnern Benefits Eine vielseitige Position mit hoher Eigenverantwortung und langfristiger Perspektive Direkte Zusammenarbeit mit Entscheidungsträgern in einem erfolgreichen mittelständischen Unternehmensumfeld Kurze Kommunikationswege und ein unkompliziertes, kollegiales Miteinander Möglichkeit, Prozesse aktiv mitzugestalten und eigene Ideen einzubringen Modernes Arbeitsumfeld mit Fokus auf Innovation und DigitalisierungIndividuelle Förderung durch fachliche und persönliche Weiterbildungsangebote Gute Verkehrsanbindung und komfortable Erreichbarkeit des StandortsFahrradleasing-Angebot für eine nachhaltige Mobilität Attraktive Rahmenbedingungen inklusive zusätzlicher Benefits Dann freuen wir uns auf Ihre Bewerbung. Die Jobbuster begleiten Sie während des gesamten Bewerbungsprozesses und steht Ihnen als persönlicher Ansprechpartner jederzeit zur Verfügung. Bewerben Sie sich jetzt und gestalten Sie die Zukunft eines erfolgreichen mittelständischen Unternehmens aktiv mit. Find more English Speaking Jobs in Germany on Arbeitnow"
Arbeitnow API,https://www.arbeitnow.com/jobs/companies/jobbusters-gmbh/bilanzbuchhalter-hamburg-92234,2026-07-22T07:30:31,Jobbusters® GmbH,Bilanzbuchhalter (m/w/d),Finance,Hamburg,,Finance,"Für ein etabliertes, international agierendes Unternehmen aus dem technischen Umfeld suchen wir im Rahmen der Direktvermittlung einen engagierten Bilanzbuchhalter (m/w/d) am Standort Hamburg. Unser Mandant überzeugt durch langjährige Erfahrung, eine hohe Marktpräsenz sowie einen starken Fokus auf Qualität und kontinuierliche Weiterentwicklung. Zur Verstärkung des Finance-Teams wird zum nächstmöglichen Zeitpunkt eine erfahrene Persönlichkeit gesucht, die ihre Expertise in der Bilanzbuchhaltung einbringen und aktiv zur Optimierung der Finanzprozesse beitragen möchte. Aufgaben Eigenverantwortliche Erstellung von Monats-, Quartals- und Jahresabschlüssen nach HGB Mitwirkung bei der Erstellung des Konzernabschlusses einschließlich Konsolidierung von Tochtergesellschaften Sicherstellung einer hohen Abschlussqualität sowie termingerechter Reporting- und Abschlussprozesse Verantwortung für ausgewählte Bereiche der laufenden Finanzbuchhaltung Durchführung von Konten-, Intercompany- und SaldenabstimmungenAnsprechpartner für Wirtschaftsprüfer, Steuerberater, Betriebsprüfer sowie interne Fachabteilungen Vorbereitung und Begleitung von Jahresabschluss- und Betriebsprüfungen Unterstützung der Geschäftsführung bei bilanziellen, betriebswirtschaftlichen und prozessbezogenen Fragestellungen Mitarbeit bei steuerlichen Themenstellungen und statistischen Meldungen Analyse, Optimierung und Digitalisierung von Accounting- und Finance-Prozessen Aktive Mitgestaltung effizienter Workflows, Automatisierungen und moderner Reporting-Strukturen Mitarbeit an bereichsübergreifenden Projekten und Sonderthemen Qualifikation Erfolgreich abgeschlossenes betriebswirtschaftliches Studium mit Schwerpunkt Rechnungswesen, Finanzen oder Controlling oder eine Weiterbildung zum geprüften Bilanzbuchhalter (IHK) Mehrjährige Berufserfahrung im Finanz- und Rechnungswesen eines mittelständischen Unternehmens oder Konzerns Fundierte Kenntnisse in der Bilanzierung und Abschlusserstellung nach HGB Erfahrung in der Konzernkonsolidierung von VorteilSicheres Auftreten im Umgang mit Wirtschaftsprüfern und Steuerberatern Gute ERP-Kenntnisse, idealerweise in Microsoft Dynamics 365 Business Central Sehr gute Excel-Kenntnisse sowie eine ausgeprägte Zahlen- und ProzessaffinitätInteresse an Digitalisierung, Automatisierung und modernen Finance-Strukturen Selbstständige, strukturierte und lösungsorientierte ArbeitsweiseUnternehmerisches Denken, Kommunikationsstärke und Verantwortungsbewusstsein Gute Englischkenntnisse für die Zusammenarbeit mit internationalen Gesellschaften Benefits Verantwortungsvolle Schlüsselposition mit direktem Einfluss auf die Weiterentwicklung des Finanzbereichs Langfristige Perspektive in einem erfolgreichen und wirtschaftlich stabilen Unternehmen Flache Hierarchien und kurze EntscheidungswegeHoher Gestaltungsspielraum bei der Optimierung von Prozessen und Strukturen Moderne Arbeitsumgebung mit zukunftsorientierten Digitalisierungsprojekten Individuelle Weiterbildungs- und Entwicklungsmöglichkeiten Sehr gute Erreichbarkeit mit öffentlichen Verkehrsmitteln Dann freuen wir uns auf Ihre Bewerbung. Die Jobbuster begleiten Sie während des gesamten Bewerbungsprozesses und steht Ihnen als persönlicher Ansprechpartner jederzeit zur Verfügung. Bewerben Sie sich jetzt und gestalten Sie die Zukunft eines erfolgreichen mittelständischen Unternehmens aktiv mit. Find more English Speaking Jobs in Germany on Arbeitnow"
Arbeitnow API,https://www.arbeitnow.com/jobs/companies/kohnle-partner/auszubildender-zum-steuerfachangestellten-karlsruhe-167151,2026-07-22T07:30:31,Kohnle & Partner,Auszubildender zum Steuerfachangestellten (m/w/d),Finance,Karlsruhe,Apprenticeship,Finance,"Kohnle &#x26; Partner, die etwas andere Steuerkanzlei. Modernste Technik, digitale Prozesse, dynamisches Wachstum, führende Experten, hochwertige Büros, überdurchschnittliche Bezahlung, ein hoch motiviertes Team und vieles mehr – wir reden nicht nur von Top-Arbeitsbedingungen, wir schaffen diese auch. Die besten Arbeitsbedingungen und unser dynamisches Team sind seit über 50 Jahren die Grundlage für den Erfolg unserer Kanzlei. Inzwischen sind wir eine der führenden Kanzleien in der Region Baden und stehen Unternehmen sowie Privatpersonen als kompetenter Partner, leidenschaftliche Problemlöser und innovative Zukunftsdenker zur Seite. Werde jetzt ein Teil unseres Teams an einem unserer Standorte in Karlsruhe, Weingarten, Offenburg oder Karlsbad. Aufgaben Als Steuerfachangestellter kannst du deutlich mehr, als nur mit Zahlen zu jonglieren. Im Zuge deiner Ausbildung unterstützen wir dich dabei, persönlich als auch fachlich den nächsten Schritt zu gehen, um unseren Mandanten künftig in steuerlichen und betriebswirtschaftlichen Themen vollumfänglich und kompetent zur Seite zu stehen. Erstellung von kleinen Steuererklärungen und abwechslungsreichen Finanzbuchhaltungen Vorbereitung und Unterstützung bei der Erstellung von Jahresabschlüssen Prüfung von Steuerbescheiden und Korrespondenz mit dem Finanzamt Durchführung von Recherchetätigkeiten Unterstützung bei der digitalen Transformation Weitere Themenbereiche, die dir Spaß bereiten und in denen du deine Stärken hast Qualifikation Du bist kommunikativ und arbeitest gerne mit Menschen Worten lässt du gerne Taten folgen Offenheit gegenüber Neuem und Veränderungen Du hast hohe Ansprüche an die Qualität deiner Arbeit Wünschenswert wäre: Fachhochschulreife / allgemeine Hochschulreife oder Realschulabschluss mit guten Noten Erste Erfahrung mit MS-Office Anwendungen, insbesondere Word und Excel Benefits Warum Kohnle &#x26; Partner Diese Frage haben wir auch unseren Mitarbeitern gestellt. In unserer jährlichen Mitarbeiterbefragung kam heraus, dass unsere Teammitglieder uns als Arbeitgeber nahezu ausnahmslos an Freunde und Bekannte weiterempfehlen würden und somit wirklich gerne bei uns arbeiten. Weitere Ergebnisse unserer Umfrage zeigen wir dir gerne in einem ersten persönlichen Kennenlerngespräch. Darüber hinaus kannst du dich bei uns auf die folgenden Benefits freuen: Überdurchschnittliche Bezahlung Zahlreiche Events (Sommerfest, Betriebsausflüge, Weihnachtsfeier und mehr) Flexible Arbeitszeiten Sorgfältige Einarbeitung Fortbildungsflatrate Kanzlei-eigenes Fitnessstudio oder Mitgliedschaft in einem Studio (je nach Standort) Modernste Technik und digitale Prozesse Gesundheitsbenefits Hochwertige Büros &#x26; Einrichtung Eigene Parkplätze (je nach Standort) Klimatisierte Räumlichkeiten Social Areas (auch im Außenbereich) Wir freuen uns auf dich und deine Bewerbung! Find Jobs in Germany on Arbeitnow"
Arbeitnow API,https://www.arbeitnow.com/jobs/companies/kohnle-partner/auszubildender-zum-steuerfachangestellten-weingarten-358601,2026-07-22T07:30:31,Kohnle & Partner,Auszubildender zum Steuerfachangestellten (m/w/d),Finance,Weingarten,Apprenticeship,Finance,"Kohnle &#x26; Partner, die etwas andere Steuerkanzlei. Modernste Technik, digitale Prozesse, dynamisches Wachstum, führende Experten, hochwertige Büros, überdurchschnittliche Bezahlung, ein hoch motiviertes Team und vieles mehr – wir reden nicht nur von Top-Arbeitsbedingungen, wir schaffen diese auch. Die besten Arbeitsbedingungen und unser dynamisches Team sind seit über 50 Jahren die Grundlage für den Erfolg unserer Kanzlei. Inzwischen sind wir eine der führenden Kanzleien in der Region Baden und stehen Unternehmen sowie Privatpersonen als kompetenter Partner, leidenschaftliche Problemlöser und innovative Zukunftsdenker zur Seite. Werde jetzt ein Teil unseres Teams an einem unserer Standorte in Karlsruhe, Weingarten, Offenburg oder Karlsbad. Aufgaben Als Steuerfachangestellter kannst du deutlich mehr, als nur mit Zahlen zu jonglieren. Im Zuge deiner Ausbildung unterstützen wir dich dabei, persönlich als auch fachlich den nächsten Schritt zu gehen, um unseren Mandanten künftig in steuerlichen und betriebswirtschaftlichen Themen vollumfänglich und kompetent zur Seite zu stehen. Erstellung von kleinen Steuererklärungen und abwechslungsreichen Finanzbuchhaltungen Vorbereitung und Unterstützung bei der Erstellung von Jahresabschlüssen Prüfung von Steuerbescheiden und Korrespondenz mit dem Finanzamt Durchführung von Recherchetätigkeiten Unterstützung bei der digitalen Transformation Weitere Themenbereiche, die dir Spaß bereiten und in denen du deine Stärken hast Qualifikation Du bist kommunikativ und arbeitest gerne mit Menschen Worten lässt du gerne Taten folgen Offenheit gegenüber Neuem und Veränderungen Du hast hohe Ansprüche an die Qualität deiner Arbeit Wünschenswert wäre: Fachhochschulreife / allgemeine Hochschulreife oder Realschulabschluss mit guten Noten Erste Erfahrung mit MS-Office Anwendungen, insbesondere Word und Excel Benefits Warum Kohnle &#x26; Partner Diese Frage haben wir auch unseren Mitarbeitern gestellt. In unserer jährlichen Mitarbeiterbefragung kam heraus, dass unsere Teammitglieder uns als Arbeitgeber nahezu ausnahmslos an Freunde und Bekannte weiterempfehlen würden und somit wirklich gerne bei uns arbeiten. Weitere Ergebnisse unserer Umfrage zeigen wir dir gerne in einem ersten persönlichen Kennenlerngespräch. Darüber hinaus kannst du dich bei uns auf die folgenden Benefits freuen: Überdurchschnittliche Bezahlung Zahlreiche Events (Sommerfest, Betriebsausflüge, Weihnachtsfeier und mehr) Flexible Arbeitszeiten Sorgfältige Einarbeitung Fortbildungsflatrate Kanzlei-eigenes Fitnessstudio oder Mitgliedschaft in einem Studio (je nach Standort) Modernste Technik und digitale Prozesse Gesundheitsbenefits Hochwertige Büros &#x26; Einrichtung Eigene Parkplätze (je nach Standort) Klimatisierte Räumlichkeiten Social Areas (auch im Außenbereich) Wir freuen uns auf dich und deine Bewerbung! Find Jobs in Germany on Arbeitnow"
Arbeitnow API,https://www.arbeitnow.com/jobs/companies/kohnle-partner/auszubildender-zum-steuerfachangestellten-offenburg-291836,2026-07-22T07:30:31,Kohnle & Partner,Auszubildender zum Steuerfachangestellten (m/w/d),Finance,Offenburg,Apprenticeship,Finance,"Kohnle &#x26; Partner, die etwas andere Steuerkanzlei. Modernste Technik, digitale Prozesse, dynamisches Wachstum, führende Experten, hochwertige Büros, überdurchschnittliche Bezahlung, ein hoch motiviertes Team und vieles mehr – wir reden nicht nur von Top-Arbeitsbedingungen, wir schaffen diese auch. Die besten Arbeitsbedingungen und unser dynamisches Team sind seit über 50 Jahren die Grundlage für den Erfolg unserer Kanzlei. Inzwischen sind wir eine der führenden Kanzleien in der Region Baden und stehen Unternehmen sowie Privatpersonen als kompetenter Partner, leidenschaftliche Problemlöser und innovative Zukunftsdenker zur Seite. Werde jetzt ein Teil unseres Teams an einem unserer Standorte in Karlsruhe, Weingarten, Offenburg oder Karlsbad. Aufgaben Als Steuerfachangestellter kannst du deutlich mehr, als nur mit Zahlen zu jonglieren. Im Zuge deiner Ausbildung unterstützen wir dich dabei, persönlich als auch fachlich den nächsten Schritt zu gehen, um unseren Mandanten künftig in steuerlichen und betriebswirtschaftlichen Themen vollumfänglich und kompetent zur Seite zu stehen. Erstellung von kleinen Steuererklärungen und abwechslungsreichen Finanzbuchhaltungen Vorbereitung und Unterstützung bei der Erstellung von Jahresabschlüssen Prüfung von Steuerbescheiden und Korrespondenz mit dem Finanzamt Durchführung von Recherchetätigkeiten Unterstützung bei der digitalen Transformation Weitere Themenbereiche, die dir Spaß bereiten und in denen du deine Stärken hast Qualifikation Du bist kommunikativ und arbeitest gerne mit Menschen Worten lässt du gerne Taten folgen Offenheit gegenüber Neuem und Veränderungen Du hast hohe Ansprüche an die Qualität deiner Arbeit Wünschenswert wäre: Fachhochschulreife / allgemeine Hochschulreife oder Realschulabschluss mit guten Noten Erste Erfahrung mit MS-Office Anwendungen, insbesondere Word und Excel Benefits Warum Kohnle &#x26; Partner Diese Frage haben wir auch unseren Mitarbeitern gestellt. In unserer jährlichen Mitarbeiterbefragung kam heraus, dass unsere Teammitglieder uns als Arbeitgeber nahezu ausnahmslos an Freunde und Bekannte weiterempfehlen würden und somit wirklich gerne bei uns arbeiten. Weitere Ergebnisse unserer Umfrage zeigen wir dir gerne in einem ersten persönlichen Kennenlerngespräch. Darüber hinaus kannst du dich bei uns auf die folgenden Benefits freuen: Überdurchschnittliche Bezahlung Zahlreiche Events (Sommerfest, Betriebsausflüge, Weihnachtsfeier und mehr) Flexible Arbeitszeiten Sorgfältige Einarbeitung Fortbildungsflatrate Kanzlei-eigenes Fitnessstudio oder Mitgliedschaft in einem Studio (je nach Standort) Modernste Technik und digitale Prozesse Gesundheitsbenefits Hochwertige Büros &#x26; Einrichtung Eigene Parkplätze (je nach Standort) Klimatisierte Räumlichkeiten Social Areas (auch im Außenbereich) Wir freuen uns auf dich und deine Bewerbung! Find Jobs in Germany on Arbeitnow"
Arbeitnow API,https://www.arbeitnow.com/jobs/companies/bachmann-executive/ra-spezialisten-trossingen-488060,2026-07-22T07:30:31,Bachmann-Executive,RA-Spezialisten (m/w/d),Project Management,Trossingen,,Project Management,"Für ein international erfolgreiches Unternehmen suche ich einen RA-Spezialisten (m/w/d). Aufgaben Verantwortung für nationale und internationale Produktzulassungen Sicherstellung der regulatorischen Compliance nach MDR und relevanten Normen Betreuung von Produktänderungen sowie Post-Market-Surveillance-Aktivitäten Unterstützung von Entwicklungsprojekten aus regulatorischer Sicht Zusammenarbeit mit Behörden, Benannten Stellen und internen Fachbereichen Qualifikation Erfahrung im Bereich Regulatory Affairs Gute Kenntnisse der MDR (EU) 2017/745 sowie relevanter Normen (u. a. ISO 13485, ISO 14791, IEC 60601-1, IEC 62304 und ISO 10993) Strukturierte und eigenverantwortliche Arbeitsweise Sehr gute Deutsch- und Englischkenntnisse Find more English Speaking Jobs in Germany on Arbeitnow"
