job_id,date_posted,source,company,title,category,raw_category,seniority,location,job_type,skills,tags_raw,salary_min_usd,salary_max_usd,salary_mid_usd,demand_index,scarcity_score,time_to_fill_days_proxy,application_volume_proxy,source_url,description_preview
raw-0085,2026-05-13,Arbeitnow API,Nayoki Performance GmbH,Office & Team Assistant (m/w/d) in Teilzeit (25-30 Std./Woche),Marketing & Growth,Marketing Assistant,Mid-level,Munich,berufserfahren,Performance Marketing; Social Media; Finance; HR,Marketing Assistant,49200,70800,60000,65.7,38,30.3,136,https://www.arbeitnow.com/jobs/companies/nayoki-performance-gmbh/office-team-assistant-in-teilzeit-25-30-std-woche-munich-199515,"Die Nayoki GmbH ist eine inhabergeführte Digitalagentur mit Sitz in München, gegründet im Jahr 2004. Zur Unternehmensgruppe gehören vier weitere spezialisierte Einheiten in den Bereichen Performance Marketing, Social Med"
raw-0086,2026-05-13,Arbeitnow API,Yenlo,Senior Business Development Representative (DACH Region),Data & AI,Information technology,Senior/Lead,Frankfurt,"Full-time permanent, experienced",Sales; API,Information technology; bachelor's degree,94095,135405,114750,84.9,61,44.2,106,https://www.arbeitnow.com/jobs/companies/yenlo/senior-business-development-representative-dach-region-frankfurt-439167,"We are looking for an entrepreneurial Senior Business Development Representative to spearhead our growth in Germany, Austria, and Switzerland. You will build strategic relationships at C-level with German enterprise orga"
raw-0087,2026-05-13,Arbeitnow API,encoway GmbH,Werkstudent:in Sales-Support im Innovationslabor DOCK ONE in Bremen (m/w/d),Software & Engineering,Internet and software,Internship/Student,Bremen,"Part-time fixed-term, student (college)",Sales,Internet and software; bachelor's degree,39688,57112,48400,81.7,38,30.3,136,https://www.arbeitnow.com/jobs/companies/encoway-gmbh/werkstudentin-sales-support-im-innovationslabor-dock-one-in-bremen-85611,"Als Werkstudent:in im Sales Support erhältst Du einen direkten Einblick in den B2B‑Vertrieb unseres erfolgreichen IT-Unternehmens. Gemeinsam mit Deinem Team, im Innovationslabor DOCK ONE, arbeitest Du am Vertrieb unseres"
raw-0088,2026-05-13,Arbeitnow API,Heringer Consulting GmbH,Marketing Manager:in B2B (m/w/d),Software & Engineering,Marketing and Communication,Senior/Lead,Cologne,berufserfahren,Communication; Cloud; Sales; SEO,Marketing and Communication,97416,140184,118800,84.1,56,42.1,112,https://www.arbeitnow.com/jobs/companies/heringer-consulting-gmbh/marketing-managerin-b2b-cologne-498201,"Heringer Consulting – Data Talent at your side. Wir sind die Heringer Consulting GmbH, ein wachsendes Beratungsunternehmen mit Schwerpunkt auf Data &#x26; Business Intelligence sowie Künstlicher Intelligenz. Seit 2010 un"
raw-0089,2026-05-13,Arbeitnow API,Medivise Healthcare GmbH,Strategischer Marketing Manager / Generalist (all genders) - HealthTech Start-up,Marketing & Growth,Remote,Senior/Lead,Berlin,berufserfahren,Social Media; Startup,Remote; Marketing Manager,66420,95580,81000,64.4,48,38.6,123,https://www.arbeitnow.com/jobs/companies/medivise-healthcare-gmbh/strategischer-marketing-manager-generalist-all-genders-healthtech-start-up-berlin-64854,"Bei uns bist du mehr als nur Marketing Manager: Du baust gemeinsam mit uns das Marketing auf und entwickelst Marktstrategien. Dabei arbeitest du eng mit unserem Führungsteam zusammen, übernimmst früh Verantwortung und ge"
raw-0090,2026-05-13,Arbeitnow API,softgate,Lead Softwareentwickler Cloud & Medizintechnik (m/w/d),Software & Engineering,Engineering,Senior/Lead,Erlangen,,Kubernetes; Security; Python; Docker; Azure; Cloud; CI/CD; Scrum; REST; AWS; C#,Engineering,97416,140184,118800,59.7,88,55.8,71,https://www.arbeitnow.com/jobs/companies/softgate/lead-softwareentwickler-cloud-medizintechnik-erlangen-101324,"Wir entwickeln Software, die Leben retten kann, und gestalten gemeinsam die Medizintechnik von morgen. Als etabliertes und stabiles Unternehmen verfügen wir vielleicht nicht über all die Gimmicks anderer Arbeitgeber, daf"
raw-0091,2026-05-13,Arbeitnow API,think about IT GmbH,Service Desk Spezialist - Onsite in Köln (m/w/d),Software & Engineering,IT,Unspecified,Cologne,,Onboarding; iOS; SAP,IT,66387,95533,80960,56.5,38,30.3,136,https://www.arbeitnow.com/jobs/companies/think-about-it-gmbh/service-desk-spezialist-onsite-in-koln-cologne-71797,Wir suchen Dich zum nächstmöglichen Zeitpunkt als Teammitglied unseres Fachbereichs Service Desk am Standort Köln . Werde Teil der thinkGROUP und unterstütze uns als Service Desk Spezialist (m/w/d) Aufgaben Deine Tätigke
raw-0092,2026-05-13,Arbeitnow API,Projekt 3T GmbH,Geschäftsführer/in DACH (gn) - HR Services-Plattform,Marketing & Growth,Remote,Unspecified,Dortmund,geschäftsleitung,Operations; Sales; AI; HR,Remote; Directors; Chief Executives,45264,65136,55200,76.2,38,30.3,136,https://www.arbeitnow.com/jobs/companies/projekt-3t-gmbh/geschaftsfuhrer-in-dach-gn-hr-services-plattform-dortmund-158476,Du willst die Transformation der Personaldienstleistungsbranche in erster Reihe mitgestalten? Unser Kunde ist eine der führenden Plattformen für HR Services und seit einigen Jahrzehnten erfolgreich am Markt. Mit großer e
raw-0093,2026-05-13,Arbeitnow API,zetcom group,Support Specialist (w/m/d),Software & Engineering,Software Development,Mid-level,Berlin,berufserfahren,SaaS,Software Development,72160,103840,88000,52.5,38,30.3,136,https://www.arbeitnow.com/jobs/companies/zetcom-group/support-specialist-berlin-156552,"zetcom ist einer der weltweiten Marktführer im Bereich von Kulturinstitutionen (Museen &#x26; Sammlungen), Verwaltungsorganisationen (Stiftungen &#x26; Vereine) und Umweltabteilungen (Regierungen &#x26; Unternehmen). Meh"
raw-0094,2026-05-13,Arbeitnow API,big. bechtold-gruppe,Prozessmanager:in,Data & AI,Customer Service,Senior/Lead,Karlsruhe,berufserfahren,Customer Service; Data Analytics; Onboarding; Security; Design; ERP,Customer Service,94095,135405,114750,62.6,61,44.2,106,https://www.arbeitnow.com/jobs/companies/big-bechtold-gruppe/prozessmanagerin-karlsruhe-88409,"big. family of services Beraten, planen, betreiben: wir sind ein erfahrener und kompetenter Dienstleistungspartner rund ums Gebäude- und das ein Gebäudeleben lang. Für die Kunden bedeutet das: In jeder einzelnen Dienstle"
raw-0095,2026-05-13,Arbeitnow API,HörPartner GmbH,Mitarbeiterin im Bereich Marketing (m/w/d) 30 - 40 h,Marketing & Growth,Trade Marketing,Unspecified,Berlin,,Social Media; Cloud; Video Editing,Trade Marketing,45264,65136,55200,77.3,46,33.8,125,https://www.arbeitnow.com/jobs/companies/horpartner-gmbh/mitarbeiterin-im-bereich-marketing-30-40-h-berlin-180013,"HörPartner ist ein führendes Hörakustik-Unternehmen mit über 50 Fachgeschäften. Wir legen Wert auf exzellente Beratung, innovative Technik und ein menschliches Miteinander – für unsere Kunden und Dich. Zur Verstärkung un"
raw-0096,2026-05-13,Arbeitnow API,Hoffmann.Recruiting & More,HR Manager / HR Allrounder (m/w/d) - Produktionsumfeld I Raum Pforzheim,Product & Project Management,Personnel Specialist,Senior/Lead,Pforzheim,,HR,Personnel Specialist,84132,121068,102600,64.4,48,38.6,123,https://www.arbeitnow.com/jobs/companies/hoffmannrecruiting-more/hr-manager-hr-allrounder-produktionsumfeld-i-raum-pforzheim-431224,Mein Auftraggeber ist ein mittelständisches Unternehmen mit Sitz im Raum Pforzheim und produziert mit einem leistungsstarken Maschinenpark qualitativ hochwertige Druckerzeugnisse / Printprodukte in großen Auflagen. Gesuc
raw-0097,2026-05-13,Arbeitnow API,Wavestone Germany AG,IT Projektmanager (m/w/d) (Ref.Nr.: 46748),Software & Engineering,IT,Senior/Lead,Frankfurt am Main,"Freelance, berufserfahren",Security,IT,97416,140184,118800,66.5,56,42.1,112,https://www.arbeitnow.com/jobs/companies/wavestone-germany-ag/it-projektmanager-refnr-46748-frankfurt-am-main-197008,"Wir suchen einen erfahrenen Projektmanager . Der Schwerpunkt der Rolle liegt in der agilen Projektbegleitung, der Business Analyse sowie im Requirements Engineering innerhalb eines komplexen Projektumfelds. Key Facts Sta"
raw-0098,2026-05-13,Arbeitnow API,Wavestone Germany AG,IT Projektmanager (m/w/d) (Ref.Nr.: 46747),Software & Engineering,IT,Senior/Lead,Frankfurt am Main,"Freelance, berufserfahren",Security,IT,97416,140184,118800,66.5,56,42.1,112,https://www.arbeitnow.com/jobs/companies/wavestone-germany-ag/it-projektmanager-refnr-46747-frankfurt-am-main-64989,"Wir suchen einen Projektmanager (m/w/d) zur Unterstützung eines umfassenden Projekts im Bereich Customer Experience. Die Rolle umfasst die Steuerung von Projektplänen, das Management von Risiken sowie die Ermittlung und "
raw-0099,2026-05-13,Arbeitnow API,Auriva Capital,Kaltakquisiteur / B2B Sales Manager (m/w/d),Software & Engineering,Marketing and Communication,Internship/Student,Bad Homburg,"Internship, berufseinstieg",Communication; Sales,Marketing and Communication,39688,57112,48400,87,38,30.3,136,https://www.arbeitnow.com/jobs/companies/auriva-capital/kaltakquisiteur-b2b-sales-manager-bad-homburg-110661,"Investor Relations &#x26; Lead Generation Die Auriva Capital unterstützt Unternehmen dabei, Zugang zu relevanten Investorenkontakten zu erhalten. Für den Ausbau unseres Vertriebs suchen wir einen kommunikationsstarken Ka"
raw-0100,2026-05-13,Arbeitnow API,K-tronik GmbH,Software Automation Engineer für Software Defined Radio (m/w/x),Software & Engineering,Software Development,Mid-level,Hanover,berufserfahren,Automation; Python; Design; CI/CD,Software Development,72160,103840,88000,71.9,46,33.8,125,https://www.arbeitnow.com/jobs/companies/k-tronik-gmbh/software-automation-engineer-fur-software-defined-radio-munich-272763,Projektbeschreibung: Technologie begeistert Sie? Uns auch! Zur Verstärkung unseres Expertenteams bei unserem Kunden aus der Funk- und Kommunikationsbranche suchen wir einen Software Automation Engineer für Software Defin
raw-0101,2026-05-13,Arbeitnow API,Biomatch GmbH,Consultant Indirect Tax & Compliance (m/w/d),Product & Project Management,Finance,Unspecified,Frankfurt am Main,,Finance; Accounting; SAP,Finance,57334,82506,69920,61.1,38,30.3,136,https://www.arbeitnow.com/jobs/companies/biomatch-gmbh/consultant-indirect-tax-compliance-frankfurt-am-main-278585,Für ein international agierendes Unternehmen suchen wir zum nächstmöglichen Zeitpunkt Verstärkung im Bereich Finance &#x26; Taxes. In dieser Rolle agieren Sie als zentrale Schnittstelle für die steuerliche Compliance und
raw-0102,2026-05-13,Arbeitnow API,Deutscher Bauservice GmbH,Projektplaner/Terminplaner (m/w/d) - Infrastrukturausbau und Trassenbau,Software & Engineering,Power Engineering and Environmental Engineering,Unspecified,Molbergen,,Python; JavaScript; API; Cloud,Power Engineering and Environmental Engineering,66387,95533,80960,93.2,62,40.7,104,https://www.arbeitnow.com/jobs/companies/deutscher-bauservice-gmbh/projektplaner-terminplaner-infrastrukturausbau-und-trassenbau-molbergen-78352,"Die Energiewende ist eines der größten Infrastrukturprojekte unserer Zeit. Damit der Strom fließen kann, brauchen wir Menschen, die den Überblick behalten, wenn es komplex wird. Wir suchen einen versierten Terminplaner ("
raw-0103,2026-05-13,Arbeitnow API,Deutscher Bauservice GmbH,Projektentwickler (m/w/d) für erneuerbare Energien,Software & Engineering,Power Engineering and Environmental Engineering,Unspecified,Molbergen,,Python; JavaScript; API; Cloud,Power Engineering and Environmental Engineering,66387,95533,80960,93.2,62,40.7,104,https://www.arbeitnow.com/jobs/companies/deutscher-bauservice-gmbh/projektentwickler-fur-erneuerbare-energien-molbergen-436068,"Eine spannende Herausforderung für die nächsten Jahre in Deutschland wird ohne Frage die Etablierung Erneuerbare Energien sein. Du hast Lust, Deinen entscheidenden Beitrag dazu zu leisten? Dann bist Du bei uns genau rich"
raw-0104,2026-05-13,Arbeitnow API,Deutscher Bauservice GmbH,Windparkplaner (m/w/d),Product & Project Management,Project Management,Unspecified,Molbergen,,Project Management,Project Management,57334,82506,69920,53.6,38,30.3,136,https://www.arbeitnow.com/jobs/companies/deutscher-bauservice-gmbh/windparkplaner-molbergen-440868,"Wir entwickeln uns aktuell rasant zu einem führenden Anbieter im Bereich Dienstleistungen für Ingenieurbüros und Tiefbauunternehmen. Um unsere bestehenden Projekte oder auch Projektbereiche weiter auszubauen, suchen wir "
raw-0105,2026-05-13,Arbeitnow API,Jobbusters® GmbH,Finanzbuchhalter (m/w/d),Finance & Business,Finance,Unspecified,Nuremberg,,Finance,Finance,51299,73821,62560,79.5,38,30.3,136,https://www.arbeitnow.com/jobs/companies/jobbusters-gmbh/finanzbuchhalter-nuremberg-5581,Zahlenjäger/in &#x26; Geistervertreiber/in der Buchhaltung gesucht! 📍 Standort: Nürnberg 🕰️ Eintritt: so schnell wie dein Taschenrechner rechnet 📄 Beschäftigungsart: Vollzeit Du spürst es genau – da spukt noch etwas i
raw-0106,2026-05-13,Arbeitnow API,EterniTeam GmbH,Kaufmännischer Geschäftsführer (w/m/d),Software & Engineering,Directors,Unspecified,Rheda-Wiedenbrück,,Operations,Directors; Chief Executives,66387,95533,80960,75.1,38,30.3,136,https://www.arbeitnow.com/jobs/companies/eterniteam-gmbh/kaufmannischer-geschaftsfuhrer-rheda-wiedenbruck-209247,"Wer sind wir? EterniTeam hat die Lösung für Deutschlands größtes Problem im Unternehmertum: die Unternehmensnachfolge. Mit einem neuen, revolutionären Ansatz sichern wir die Nachfolge einiger der gut 1 Millionen Unterneh"
raw-0107,2026-05-13,Arbeitnow API,Der Küchentreff Vertriebs GmbH,Steuerfachangestellte (m/w/d) - Rechnungswesen & Controlling 3-4-Tage-Woche möglich | Flexible Arbeitsmodelle | Teilzeit oder GfB / Minijob,Software & Engineering,Controlling,Mid-level,Westhausen,berufserfahren,Excel,Controlling,72160,103840,88000,56.8,38,30.3,136,https://www.arbeitnow.com/jobs/companies/der-kuchentreff-vertriebs-gmbh/steuerfachangestellte-rechnungswesen-controlling-3-4-tage-woche-moglich-flexible-arbeitsmodelle-teilzeit-oder-gfb-minijob-westhausen-329054,"Standort: Westhausen Start: ab sofort Vertragsart: Teilzeit (ca 15 Std. /Woche) oder GfB / Minijob Die Verteilung der Arbeitszeit kann flexibel angepasst werden. Du liebst Zahlen, Prozesse und Verantwortung? In unserem N"
raw-0108,2026-05-13,Arbeitnow API,EterniTeam GmbH,Kaufmännischer Geschäftsführer (w/m/d),Software & Engineering,Directors,Unspecified,Hamm,,Operations,Directors; Chief Executives,66387,95533,80960,75.1,38,30.3,136,https://www.arbeitnow.com/jobs/companies/eterniteam-gmbh/kaufmannischer-geschaftsfuhrer-hamm-310621,"Wer sind wir? EterniTeam hat die Lösung für Deutschlands größtes Problem im Unternehmertum: die Unternehmensnachfolge. Mit einem neuen, revolutionären Ansatz sichern wir die Nachfolge einiger der gut 1 Millionen Unterneh"
raw-0109,2026-05-13,Arbeitnow API,Deutscher Bauservice GmbH,Bauleiter (m/w/d) - Windparkbau,Software & Engineering,Engineering,Unspecified,Frankfurt am Main,,Python; JavaScript; API; Cloud,Engineering,66387,95533,80960,93.2,62,40.7,104,https://www.arbeitnow.com/jobs/companies/deutscher-bauservice-gmbh/bauleiter-windparkbau-frankfurt-am-main-418886,Die Welt verändert sich - Du Dich auch? Deine Zukunft beginnt heute! Im Zeitalter der Energiewende setzen wir auf neue Wege und mit dem offiziellen Titel als Wachstumschampion setzen wir nicht nur Maßstäbe in Qualität un
raw-0110,2026-05-13,Arbeitnow API,Deutscher Bauservice GmbH,Bauleiter (m/w/d) - Windparkbau,Software & Engineering,Engineering,Unspecified,Aschersleben,,Python; JavaScript; API; Cloud,Engineering,66387,95533,80960,93.2,62,40.7,104,https://www.arbeitnow.com/jobs/companies/deutscher-bauservice-gmbh/bauleiter-windparkbau-aschersleben-475937,Die Welt verändert sich - Du Dich auch? Deine Zukunft beginnt heute! Im Zeitalter der Energiewende setzen wir auf neue Wege und mit dem offiziellen Titel als Wachstumschampion setzen wir nicht nur Maßstäbe in Qualität un
raw-0111,2026-05-13,Arbeitnow API,HolzHaus Bonndorf GmbH,Mitarbeiter Personal & Administration (m/w/d),Product & Project Management,Administration,Entry-level,Bonndorf,berufseinstieg,Onboarding,Administration,46740,67260,57000,68.7,38,30.3,136,https://www.arbeitnow.com/jobs/companies/holzhaus-bonndorf-gmbh/mitarbeiter-personal-administration-bonndorf-331997,"Du suchst eine vielseitige Aufgabe im Personalbereich und in der Administration, bei der Du operativ mit anpacken kannst? Dann könnte diese Rolle gut zu Dir passen. HolzHaus Bonndorf ist ein modernes Holzbauunternehmen i"
raw-0112,2026-05-13,Arbeitnow API,Jobbusters® GmbH,Finanzbuchhalter (m/w/d),Finance & Business,Finance,Unspecified,Passau,,Finance,Finance,51299,73821,62560,79.5,38,30.3,136,https://www.arbeitnow.com/jobs/companies/jobbusters-gmbh/finanzbuchhalter-passau-446562,"Für unseren renommierten Auftraggeber, ein international tätiges Unternehmen suchen wir zum nächstmöglichen Zeitpunkt einen erfahrenen Finanzbuchhalter (m/w/d) in unbefristeter Festanstellung. In dieser Position haben Si"
raw-0113,2026-05-13,Arbeitnow API,Deutscher Bauservice GmbH,Bauleiter (m/w/d) - Windparkbau,Software & Engineering,Engineering,Unspecified,Freiburg im Breisgau,,Python; JavaScript; API; Cloud,Engineering,66387,95533,80960,93.2,62,40.7,104,https://www.arbeitnow.com/jobs/companies/deutscher-bauservice-gmbh/bauleiter-windparkbau-freiburg-im-breisgau-174199,Die Welt verändert sich - Du Dich auch? Deine Zukunft beginnt heute! Im Zeitalter der Energiewende setzen wir auf neue Wege und mit dem offiziellen Titel als Wachstumschampion setzen wir nicht nur Maßstäbe in Qualität un
raw-0114,2026-05-13,Arbeitnow API,LuConsult GmbH,Network-Engineer (m/w/d) - Access und Datacenter Consulting,Software & Engineering,Consulting,Mid-level,Offenbach am Main,"Full-time permanent, experienced",CI/CD,Consulting; high school coursework,72160,103840,88000,55.7,38,30.3,136,https://www.arbeitnow.com/jobs/companies/luconsult-gmbh/network-engineer-access-und-datacenter-consulting-offenbach-am-main-346912,"Als Netzwerkingenieur/in bei uns spielst Du eine zentrale Rolle bei der Bereitstellung professioneller Netzwerklösungen für unsere Kunden. Du analysierst die Anforderungen der Kunden, entwirfst skalierbare und robuste Ne"
raw-0115,2026-05-13,Arbeitnow API,Shereen Patzelt,Werkstudent Vertrieb / Finanzberatung (m/w/d) – Praxis statt Theorie,Finance & Business,Finance,Internship/Student,Chemnitz,"Full-time permanent, entry",Finance,Finance; high school or equivalent,30668,44132,37400,79.5,38,30.3,136,https://www.arbeitnow.com/jobs/companies/shereen-patzelt/werkstudent-vertrieb-finanzberatung-praxis-statt-theorie-chemnitz-29242,"Du studierst…aber hast das Gefühl, dass dich dein Nebenjob nicht wirklich weiterbringt? Du arbeitest für 12–15€ die Stunde. Tauschst Zeit gegen Geld. Und wenn du ehrlich bist: 👉 Du lernst nichts, was dich später wirklic"
raw-0116,2026-05-13,Arbeitnow API,Jobbusters® GmbH,Buchhalter (m/w/d),Product & Project Management,Finance,Unspecified,Gröbenzell,,Finance,Finance,57334,82506,69920,79.5,38,30.3,136,https://www.arbeitnow.com/jobs/companies/jobbusters-gmbh/buchhalter-grobenzell-384571,"Wir bieten Ihnen die Chance, sich vielseitig einzubringen und Verantwortung zu übernehmen – in einem Unternehmen mit Herz, welches wir persönlich sehr gut kennen und die inhaberführte, freundliche Kultur wertschätzen. Un"
raw-0117,2026-05-13,Arbeitnow API,Mytheresa,Online Marketing Manager Display and Paid Social (f/m/d),Data & AI,Marketing Manager,Senior/Lead,Munich,professional / experienced,Performance Marketing; Forecasting; Automation; Power BI; Excel,Marketing Manager,94095,135405,114750,49.9,53,40.8,116,https://www.arbeitnow.com/jobs/companies/mytheresa/online-marketing-manager-display-and-paid-social-munich-294164,"To support our Performance Marketing team we are searching for a Online Marketing Manager – Display and Paid Social (f/m/d) to be based in our Munich office. Tasks Plan, manage, and optimize Paid Social and Display campa"
raw-0118,2026-05-13,Arbeitnow API,Jobbusters® GmbH,WEG-Buchhalter (m/w/d),Product & Project Management,Finance,Unspecified,Munich,,Finance,Finance,57334,82506,69920,79.5,38,30.3,136,https://www.arbeitnow.com/jobs/companies/jobbusters-gmbh/weg-buchhalter-munich-323799,"Mit Ihrem scharfen Spürsinn für WEG-Buchhaltung und Ihrer freundlichen, bodenständigen Art sind Sie für Kolleginnen, Kollegen und Eigentümer ein vertrauensvoller Ansprechpartner – fast wie ein guter Hausgeist, der stets "
raw-0119,2026-05-13,Arbeitnow API,Haimerl & Raßhofer Partner GmbH,Lohnbuchhalter (m/w/d) | Bis zu 65.000 € Jahresgehalt,Finance & Business,Finance,Unspecified,Landshut,,Finance,Finance,51299,73821,62560,79.5,38,30.3,136,https://www.arbeitnow.com/jobs/companies/haimerl-rasshofer-partner-gmbh/lohnbuchhalter-bis-zu-65000-eur-jahresgehalt-landshut-463769,"Wachse mit uns. Über dich hinaus. Wir sind Haimerl &#x26; Raßhofer Partner – eine Kanzlei, die Steuerberatung neu denkt. Unser Ziel ist es, unsere Mandanten, unser Team und uns selbst stetig auf das nächste Level zu brin"
raw-0120,2026-05-13,Arbeitnow API,Deutscher Bauservice GmbH,Projektmanager (m/w/d) Wegerecht und Flächensicherung - Erneuerbare Energien,Product & Project Management,Project Management,Senior/Lead,Molbergen,,Project Management,Project Management,84132,121068,102600,53.6,48,38.6,123,https://www.arbeitnow.com/jobs/companies/deutscher-bauservice-gmbh/projektmanager-wegerecht-und-flachensicherung-erneuerbare-energien-molbergen-496669,"Du willst die Energiewende nicht nur begleiten – du willst sie aktiv gestalten? Dann bist du bei uns genau richtig. Wir entwickeln und realisieren Projekte im Bereich Windenergie, Photovoltaik, Batteriespeicher (BESS) un"
raw-0121,2026-05-13,Arbeitnow API,Trigon Gruppe GmbH,Technischer Sachbearbeiter (w/m/d) Wohn- und Gewerbeimmobilien,Software & Engineering,Building,Mid-level,Berlin,berufserfahren,Python; JavaScript; API; Cloud,Building; Supply; Safety Services Engineering,72160,103840,88000,93.2,62,40.7,104,https://www.arbeitnow.com/jobs/companies/trigon-gruppe-gmbh/technischer-sachbearbeiter-wohn-und-gewerbeimmobilien-berlin-279168,"Über uns Die Trigon Unternehmensgruppe ist ein etabliertes Berliner Immobilienunternehmen mit Fokus auf die Entwicklung, Verwaltung und Vermietung von Wohn- und Gewerbeimmobilien. Der Bestand umfasst rund 4.000 Wohn- und"
raw-0122,2026-05-13,Arbeitnow API,Trigon Gruppe GmbH,Junior IT-Systemadministrator (w/m/d) - inhouse - German C1+,Cybersecurity & IT,System and Network Administration,Entry-level,Berlin,,Security; Cloud; Risk Management; Technical Support,System and Network Administration,49200,70800,60000,65.7,59,39.4,108,https://www.arbeitnow.com/jobs/companies/trigon-gruppe-gmbh/junior-it-systemadministrator-inhouse-german-c1-berlin-388670,Systemadministration · 1st Level Support · MS 365 · Netzwerkadministration · IT-Infrastruktur · Helpdesk · 2nd Level Support · IT-Rollout Über uns: Die Trigon Unternehmensgruppe ist ein etabliertes Berliner Immobilienunt
raw-0123,2026-05-13,Arbeitnow API,Louco Event Media GmbH,ISTQB® Certified QA Tester (Mobile Apps) Event Discovery Platform (m/f/d),Data & AI,Remote,Unspecified,Offenbach,Contract,Communication; Marketplace; Onboarding; Android; Backend; Testing; Startup; CI/CD; Agile; UI/UX; iOS,Remote; Quality Assurance; Inspection,64124,92276,78200,57.8,51,35.9,119,https://www.arbeitnow.com/jobs/companies/louco-event-media-gmbh/istqb-certified-qa-tester-mobile-apps-event-discovery-platform-offenbach-207574,"Louco is building a new generation event discovery platform that connects users, creators and the entertainment industry. Our goal is not just to build another event app – we want to rethink how people find &#x26; attend"
raw-0124,2026-05-13,Arbeitnow API,getpress,PR Manager (m/w/d) – Remote oder Berlin,Marketing & Growth,Remote,Senior/Lead,Berlin,berufserfahren,Communication; AI,Remote; Marketing and Communication,66420,95580,81000,88.1,48,38.6,123,https://www.arbeitnow.com/jobs/companies/getpress/pr-manager-remote-oder-berlin-175658,"Overview PR steht vor einem strukturellen Bruch. Vertrauen verschiebt sich, Sichtbarkeit wird neu verteilt, KI wächst exponentiell. Wir bei getpress glauben, dass Reputation in den nächsten zehn Jahren der entscheidende "
raw-0125,2026-05-13,Arbeitnow API,4creatives GmbH,Assistenz Finance & Controlling (m/w/d) - Minijob oder Teilzeitbasis (20h) | 100% Remote,Product & Project Management,Remote,Mid-level,Nordhorn,berufserfahren,Finance; Excel,Remote; Controlling,62320,89680,76000,68.1,38,30.3,136,https://www.arbeitnow.com/jobs/companies/4creatives-gmbh/assistenz-finance-controlling-minijob-oder-teilzeitbasis-20h-100-remote-nordhorn-281187,"Chaos, Unordnung und Zahlen-Wirrwarr bei der Arbeit nerven dich? Uns auch! Wenn du Lust hast… ohne enge Vorgaben selbstständig zu arbeiten und Verantwortung zu übernehmen Ordnung in Rechnungen, KPIs und Überweisungen zu "
raw-0126,2026-05-13,Arbeitnow API,CAPERA GmbH & Co. KG,EHS Manager (m/w/d) Schwerpunkt Arbeitssicherheit und Safety Culture - Hybrid in Duisburg,Software & Engineering,Engineering,Senior/Lead,Duisburg,,Python; JavaScript; API; Cloud,Engineering,97416,140184,118800,93.2,72,49,91,https://www.arbeitnow.com/jobs/companies/capera-gmbh-co-kg/ehs-manager-schwerpunkt-arbeitssicherheit-und-safety-culture-hybrid-in-duisburg-149958,"Arbeitssicherheit ist für Sie mehr als nur Compliance, sondern eine Herzensangelegenheit? Dann gestalten Sie als EHS Business Partner (m/w/d) bei international tätigen Produktionsunternehmen den Kulturwandel zu mehr Sich"
