source,source_url,date_posted,company,title,category,location,job_type,tags_raw,description
Arbeitnow API,https://www.arbeitnow.com/jobs/companies/ruf-gmbh/bis-2500-eur-20h-werkstudent-recruiting-augsburg-192334,2026-05-19T18:30:31,Ruf GmbH,Bis 2.500 €/20h - Werkstudent Recruiting (m/w/d),Remote,Augsburg,,Remote; HR,"Remote | 17 € / Stunde + Umsatzbeteiligung (2 - 5%) | 20 Stunden pro Woche Du hast bereits Erfahrung im Active Sourcing oder Recruiting und möchtest nicht nur „Profile suchen“, sondern wirklich Verantwortung übernehmen und Leistung zeigen? Dann könnte das hier spannend für dich sein: Wir sind die Ruf GmbH – eine spezialisierte Personalberatung mit Fokus auf Spedition &#x26; Logistik. Wir unterstützen deutschlandweit Speditionen bei der Besetzung von Fach- und Führungspositionen. Als kleines, wachsendes Team arbeiten wir sehr direkt, schnell und leistungsorientiert. Bei uns bist du nicht nur Unterstützung im Hintergrund, sondern arbeitest aktiv an echten Besetzungen mit und übernimmst Schritt für Schritt mehr Verantwortung. Die Rolle startet im Active Sourcing – perspektivisch übernimmst du aber auch eigene Kandidatengespräche und später erste Mandate eigenständig. Aufgaben Du identifizierst passende Kandidaten über LinkedIn, Xing und weitere Plattformen Du sprichst Kandidaten aktiv an und führst erste Qualifizierungsgespräche Du arbeitest direkt an laufenden Besetzungen mit und unterstützt im gesamten Recruitingprozess Du arbeitest eng mit der Geschäftsführung zusammen und bekommst früh Verantwortung Perspektivisch übernimmst du eigene Kandidatengespräche und erste Mandate eigenständig Qualifikation Recruiting: Erfahrung im Active Sourcing/Recruiting zwingend erforderlich Branche: Erfahrung in der Logistik nice to have, aber nicht zwingend notwendig Arbeitsweise: Leistungsorientiert, eigenständig und zuverlässig Mindset: Lust, Gas zu geben und dich langfristig weiterzuentwickeln Benefits 17 € brutto pro Stunde Zusätzliche Umsatzbeteiligung bei jedem Placement, an dem du beteiligt bist (2–5 %) 100 % Remote 20 Stunden pro Woche 📩 Interesse? Dann schick uns einfach deinen Lebenslauf oder dein LinkedIn/Xing-Profil, gern auch per Whatsapp. Stefan Ruf Ruf GmbH Tel: 0157 75229034 Find more English Speaking Jobs in Germany on Arbeitnow"
Arbeitnow API,https://www.arbeitnow.com/jobs/companies/iffarth-consulting/head-of-member-relations-leiter-mitgliederbetreuung-frankfurt-am-main-491913,2026-05-19T18:30:30,Iffarth Consulting,Head of Member Relations / Leiter Mitgliederbetreuung (m/w/d),CRM,Frankfurt am Main,teamleitung,CRM; Direct Marketing,"ÜBER DEN VERBAND: Bei unserem Mandanten handelt es sich um einen Bundesindustrieverband einer Zukunftsbranche im Schnittstellenbereich ""Digitales und Energie"". Dieser schafft nicht nur vielfältige neue Arbeitsplätze in Deutschland, sondern ist maßgeblich Treiber für technische Innovationen in Richtung Digitalisierung. Entsprechend versteht sich der Verband als Brücke in Richtung Öffentlichkeit und Politik, um das Wachstum seiner Branche gemeinsam zu stärken und ihre Wahrnehmung in Wirtschaft, Gesellschaft und Politik zu verbessern. Er ist zudem in ein europaweites Netzwerk aus gleichen nationalen Dachvereinigungen eingebettet. Diese Stelle ist in Vollzeit am Standort Frankfurt a. M. zu besetzen und kann hybrid ausgeübt werden, sofern eine Wohnnähe zum Großraum Frankfurt a. M. gegeben ist. Aufgaben Du übernimmst die Gesamtverantwortung für unsere Member Experience unserer Mitgliedsunternehmen – vom ersten Kontakt und Onboarding über die ganzheitliche Betreuung während ihrer Verbandszugehörigkeit bis hin zum Renewal/Win‑back. Du entwickelst den Mitgliederservice strategisch weiter, baust entsprechend skalierbare Prozesse und CRM-Lösungen auf und sorgst dafür, dass Mitglieder den konkreten Nutzen unseres Industrieverbands spüren – und jederzeit nachvollziehen können. Ziel ist es, Mitgliedermehrwert messbar zu liefern und sichtbar zu machen. DAS SIND DEINE AUFGABEN IM DETAIL: Member Lifecycle &#x26; Member Success End‑to‑End‑Verantwortung für Onboarding, Betreuung, Aktivierung, Bindung und Rückgewinnung Aufbau eines Key‑Account‑Modells und Durchführung regelmäßiger Zufriedenheitsbefragungen Mehrwert &#x26; Portfolio Entwicklung eines attraktiven Leistungsportfolios für unsere Mitgliedsunternehmen einschließlich einer Balance der unterschiedlichen Mitgliedergruppeninteressen „Member Value“ sichtbar machen: Quarterly Member Value Report, Nutzenkommunikation, segmentierte Benefit‑Logik – als Hebel für die Kosten‑Nutzen‑Wahrnehmung Kommunikation als Mitgliederservice Mitarbeit am Mitglieder‑Newsletter als Serviceprodukt mit Fokus auf Zielgruppenspezifische Themen Networking &#x26; Events (Member Experience) Du führst das Team Event- und Projektmanagement und entwickelst mit ihnen neue Formate und verantwortest einen unserer drei Kernbereiche. Engagement &#x26; Arbeitsgruppen Systematische Aktivierung von Mitgliedern in Arbeitsgruppen: klare Aufträge, Output‑Rhythmen (Best Practices, Benchmarks/Marktdaten, Initiativen) Prozesse, CRM &#x26; Steuerung Optimierung/Digitalisierung der Mitgliedschaftsprozesse und Pflege/Weiterentwicklung des CRM Definition von KPIs (Retention, Wachstum, Engagement, Servicequalität) und regelmäßiges Reporting an die Geschäftsführung Qualifikation DAS WÜNSCHEN WIR UNS VON DIR: Mehrjährige Erfahrung in Mitgliederbetreuung bzw. Community Management, idealerweise im Verbands- oder Kammerumfeld Nachweisbare Erfahrung im CRM-spezfischen Prozessdesign, Datenqualität &#x26; Reporting Ausgeprägte Service‑ und Stakeholderorientierung mit diplomatischen Geschick (Zielkonflikte zwischen Mitgliedergruppen moderieren) Erfahrung im Bereich von Mitgliedskampagnen sowie die Fähigkeit zur synergetischen Zusammenarbeit mit anderen Schnittstellen (Kommunikation/Event/Public Affairs) Sehr gute Deutschkenntnisse; Englisch sicher im beruflichen Kontext (internationale Mitgliederstruktur) Benefits UNSER ANGEBOT: Direkteinstieg und persönliche Entwicklungsperspektive in einer dynamischen und innovativen Zukunftsbranche mit internationalem Netzwerk und Möglichkeiten Mitarbeit in einem professionellen, hochmotiviertem Team und engem Austausch mit Präsidium, Geschäftsführung und diversen namhaften Mitgliedsunternehmen Verantwortungsvolle Aufgabe mit viel Gestaltungsspielraum sowie der Möglichkeit, diese Aufgabe zu ""deiner"" zu machen Job am ""Nabel der Zeit"" in einem Verband, dessen Branche in Europa kontinuierlich wächst und auch politisch enorm an Bedeutung gewinnt Direkter Zugang zu Entscheider:innen aus Politik, Wirtschaft und Gesell"
Arbeitnow API,https://www.arbeitnow.com/jobs/companies/gonder-group/manager-unternehmenssteuerung-controlling-reporting-frankfurt-am-main-132855,2026-05-19T17:00:29,GONDER Group,"Manager Unternehmenssteuerung, Controlling & Reporting (m/w/d)",Controlling,Frankfurt am Main,berufserfahren,Controlling,"Sie möchten Controlling und Reporting nicht nur verwalten, sondern aktiv zur Unternehmenssteuerung beitragen? Dann passen Sie gut zu uns. Wir suchen eine Person, die Zahlen, Prozesse und operative Zusammenhänge versteht und daraus klare Entscheidungsgrundlagen entwickelt. Sie bauen Reports, Dashboards und Kennzahlen auf, analysieren Abweichungen und unterstützen Geschäftsführung sowie Fachbereiche dabei, schneller und fundierter zu steuern. Willkommen bei der GONDER Group Die GONDER Group ist ein führendes Familienunternehmen mit Sitz in Frankfurt am Main, das seit über 100 Jahren im Bereich des infrastrukturellem Gebäudemanagement tätig ist. Mit unseren fast 4.000 engagierten Mitarbeitern sind wir deutschlandweit ein verlässlicher Partner für Facility Management, Inhouse-Logistik und Personaldienstleistungen. Warum die GONDER Group? Tradition trifft Innovation: Wir setzen auf bewährte Methoden und modernste Technologien (z.B. Digitalisierung &#x26; Robotik) Karriereentwicklung: Wir bieten vielfältige Aufstiegsmöglichkeiten und fördern kontinuierliche Weiterbildung. Nachhaltigkeit: Gemeinsam mit unseren Kunden setzen wir auf nachhaltige Dienstleistungen und sind stolz auf unser EcoVadis Platinum Rating. Teamkultur: Bei uns steht der Mensch im Mittelpunkt. Wir legen großen Wert auf ein positives Arbeitsklima und Teamarbeit. Aufgaben Ihre Aufgaben umfassen unter anderem: Aufbau und Weiterentwicklung von Dashboards, Reports und Live KPIs Erstellung von Auswertungen für Geschäftsführung, Operations, Finance, Controlling und Personal Analyse von Objekt, Kunden, Mitarbeiter, Umsatz, Kosten und Ergebnisdaten Entwicklung von Reports zu Krankenquoten, Stunden, Produktivität, Nachkalkulationen und Forecasts Unterstützung bei Kundenanalysen, Margenanalysen und Objektbewertungen Zusammenführung und Aufbereitung von Daten aus ERP, Zeiterfassung, Lohn, CRM und weiteren Systemen Verbesserung der Datenqualität und Strukturierung von Datenquellen Automatisierung wiederkehrender Reportings Aufbau von Frühwarnindikatoren für operative und kaufmännische Abweichungen Enge Zusammenarbeit mit Fachbereichen zur Definition sinnvoller Kennzahlen Übersetzung von Daten in klare Handlungsempfehlungen Qualifikation Abgeschlossene kaufmännische Ausbildung, betriebswirtschaftliches Studium oder vergleichbare Qualifikation Erfahrung im Reporting, Controlling, Business Intelligence, Data Analytics oder in einer ähnlichen Rolle Sehr gute Excel Kenntnisse Erfahrung mit Power BI, JetReport, Tableau oder vergleichbaren Reporting und BI Tools Gutes Verständnis für kaufmännische Kennzahlen, Kostenrechnung, Margen, Umsätze und operative Steuerung Fähigkeit, Daten aus verschiedenen Quellen zusammenzuführen, zu prüfen und verständlich aufzubereiten Analytisches Denken und ein gutes Gespür für praktische Fragestellungen im Tagesgeschäft Erfahrung mit ERP Systemen, idealerweise Microsoft Dynamics NAV / Navision oder Business Central, ist von Vorteil Erfahrung mit Datenbanken, SQL oder Schnittstellen ist ein Plus, aber kein Muss Strukturierte, genaue und eigenständige Arbeitsweise Kommunikationsstärke und die Fähigkeit, komplexe Zahlen einfach zu erklären Interesse daran, ein wachsendes mittelständisches Unternehmen datenbasierter zu steuern Benefits Eine verantwortungsvolle Schlüsselrolle an der Schnittstelle von ERP, Finance, Controlling und Digitalisierung Leistungsgerechte, übertarifliche Vergütung, fair und immer pünktlich Viel Gestaltungsspielraum in einem modernen mittelständischen Familienunternehmen Kurze Entscheidungswege und direkte Zusammenarbeit mit Geschäftsführung, Fachbereichen und externen Partnern Moderne digitale Arbeitsmittel und Offenheit für neue Technologien Bikeleasing GONDER eHealth, unser Angebot für Gesundheit und Wellbeing Mitarbeiter Rabatte bei vielen namhaften Herstellern und Marken Wöchentliches Mittagessen im Team Wenn Sie Lust haben, Transparenz zu schaffen, Kennzahlen sinnvoll aufzubauen und die Steuerung eines wachsenden Familienunterne"
Arbeitnow API,https://www.arbeitnow.com/jobs/companies/gonder-group/finance-process-manager-digitalisierung-rechnungswesen-frankfurt-am-main-286754,2026-05-19T17:00:29,GONDER Group,Finance Process Manager / Digitalisierung Rechnungswesen (m/w/d),Business Operations,Frankfurt am Main,,Business Operations,"Sie möchten kaufmännische Prozesse nicht nur bearbeiten, sondern aktiv automatisieren, digitalisieren und einfacher machen? Dann passen Sie gut zu uns. Wir suchen eine pragmatische Persönlichkeit, die Abläufe versteht, manuelle Tätigkeiten erkennt und gemeinsam mit den Fachbereichen digitale Lösungen umsetzt. Im Mittelpunkt stehen nicht theoretische Konzepte, sondern konkrete Verbesserungen im Tagesgeschäft: weniger Papier, weniger Doppelarbeit, klarere Prozesse und sinnvoll eingesetzte Tools. Willkommen bei der GONDER Group Die GONDER Group ist ein führendes Familienunternehmen mit Sitz in Frankfurt am Main, das seit über 100 Jahren im Bereich des infrastrukturellem Gebäudemanagement tätig ist. Mit unseren fast 4.000 engagierten Mitarbeitern sind wir deutschlandweit ein verlässlicher Partner für Facility Management, Inhouse-Logistik und Personaldienstleistungen. Warum die GONDER Group? Tradition trifft Innovation: Wir setzen auf bewährte Methoden und modernste Technologien (z.B. Digitalisierung &#x26; Robotik) Karriereentwicklung: Wir bieten vielfältige Aufstiegsmöglichkeiten und fördern kontinuierliche Weiterbildung. Nachhaltigkeit: Gemeinsam mit unseren Kunden setzen wir auf nachhaltige Dienstleistungen und sind stolz auf unser EcoVadis Platinum Rating. Teamkultur: Bei uns steht der Mensch im Mittelpunkt. Wir legen großen Wert auf ein positives Arbeitsklima und Teamarbeit. Aufgaben Ihre Aufgaben umfassen unter anderem: Analyse bestehender kaufmännischer, administrativer und operativer Abläufe im Rechnungswesen, Controlling und Reporting Identifikation von manuellen, repetitiven und papierbasierten Tätigkeiten im Finance Bereich Entwicklung und Umsetzung einfacher, praxistauglicher Automatisierungen zur Entlastung der Fachbereiche Reduzierung von Papier, Doppelarbeit, manueller Datenerfassung und Medienbrüchen Verbindung verschiedener Systeme, Datenquellen und Workflows, insbesondere im ERP, Finance und Reporting Umfeld Nutzung moderner Tools wie Microsoft Power Automate, Make, Zapier, Copilot, ChatGPT Enterprise sowie CRM und ERP Systeme Mitarbeit bei der Weiterentwicklung von Finanzprozessen im ERP System, insbesondere Business Central / Navision Verbesserung und Standardisierung von Abläufen in Debitoren, Kreditoren, Sachkonten, Abrechnung und Monatsabschluss Aufbau digitaler Workflows für wiederkehrende kaufmännische Prozesse Erstellung und Weiterentwicklung von Auswertungen, Reportings und Kennzahlen zur besseren Steuerung von Finance Prozessen Schnittstelle zwischen Finance, Controlling, operativen Einheiten, IT und externen Dienstleistern Unterstützung bei der Einführung neuer Tools, Softwarelösungen und digitaler Arbeitsweisen Dokumentation neuer Prozesse sowie Schulung und Unterstützung interner Anwender Qualifikation Abgeschlossene kaufmännische Ausbildung, betriebswirtschaftliches Studium oder eine vergleichbare Qualifikation Mehrjährige Erfahrung im Rechnungswesen, Controlling, Finance Operations oder in kaufmännischen Prozessen Sehr gutes Verständnis für Debitoren, Kreditoren, Sachkonten, Abrechnung, Monatsabschluss und Reporting Erfahrung in der Analyse, Verbesserung und Dokumentation von Geschäftsprozessen Sicherer Umgang mit Excel Erfahrung mit ERP Systemen, idealerweise Microsoft Dynamics NAV / Navision oder Business Central Erfahrung mit Reporting Tools wie JetReport, Power BI oder vergleichbaren Lösungen ist von Vorteil Interesse an Digitalisierung, Automatisierung und modernen Tools zur Verbesserung kaufmännischer Abläufe Fähigkeit, kaufmännische Anforderungen klar zu strukturieren und in umsetzbare Lösungen zu übersetzen Eigenständige, genaue und pragmatische Arbeitsweise Freude daran, mit Fachbereichen zusammenzuarbeiten und operative Probleme wirklich zu lösen Hands on Mentalität und der Anspruch, Finance Prozesse aktiv weiterzuentwickeln Benefits Eine verantwortungsvolle Schlüsselrolle an der Schnittstelle von ERP, Finance, Controlling und Digitalisierung Leistungsgerechte, übertarifliche Vergütung, f"
Arbeitnow API,https://www.arbeitnow.com/jobs/companies/gonder-group/leiter-digitalisierung-ki-automatisierung-frankfurt-am-main-432506,2026-05-19T17:00:28,GONDER Group,"Leiter Digitalisierung, KI & Automatisierung (m/w/d)",Project Management,Frankfurt am Main,teamleitung,Project Management,"Sie möchten die digitale Weiterentwicklung eines wachsenden Familienunternehmens aktiv verantworten und gestalten? Dann passen Sie gut zu uns. Wir suchen eine Persönlichkeit, die Digitalisierung, KI und Automatisierung strategisch denkt, aber vor allem praktisch umsetzt. Sie arbeiten eng mit Geschäftsführung, Fachbereichen, IT und externen Partnern zusammen und sorgen dafür, dass aus Ideen konkrete Verbesserungen werden. Willkommen bei der GONDER Group Die GONDER Group ist ein führendes Familienunternehmen mit Sitz in Frankfurt am Main, das seit über 100 Jahren im Bereich des infrastrukturellem Gebäudemanagement tätig ist. Mit unseren fast 4.000 engagierten Mitarbeitern sind wir deutschlandweit ein verlässlicher Partner für Facility Management, Inhouse-Logistik und Personaldienstleistungen. Warum die GONDER Group? Tradition trifft Innovation: Wir setzen auf bewährte Methoden und modernste Technologien (z.B. Digitalisierung &#x26; Robotik) Karriereentwicklung: Wir bieten vielfältige Aufstiegsmöglichkeiten und fördern kontinuierliche Weiterbildung. Nachhaltigkeit: Gemeinsam mit unseren Kunden setzen wir auf nachhaltige Dienstleistungen und sind stolz auf unser EcoVadis Platinum Rating. Teamkultur: Bei uns steht der Mensch im Mittelpunkt. Wir legen großen Wert auf ein positives Arbeitsklima und Teamarbeit. Aufgaben Ihre Aufgaben umfassen unter anderem: Verantwortung für die digitale Weiterentwicklung und Automatisierung zentraler Unternehmensprozesse Analyse und Optimierung bestehender administrativer, kaufmännischer und operativer Abläufe Identifikation von manuellen, repetitiven und papierbasierten Prozessen sowie Ableitung konkreter Verbesserungen Entwicklung und Umsetzung praxistauglicher Automatisierungen mit modernen digitalen Tools Verbindung verschiedener Systeme, Datenquellen und Workflows zur Reduzierung von Medienbrüchen Praktischer Einsatz von KI Tools zur Vereinfachung interner Arbeitsabläufe Entwicklung und Umsetzung einer pragmatischen Digitalisierungs Roadmap gemeinsam mit der Geschäftsführung Priorisierung von Digitalisierungs, Automatisierungs und KI Projekten nach Nutzen, Aufwand und Umsetzbarkeit Einführung und Weiterentwicklung moderner Tools, Softwarelösungen und digitaler Arbeitsweisen Steuerung externer Dienstleister, Softwareanbieter und Implementierungspartner Zentrale Schnittstelle zwischen Geschäftsführung, Fachbereichen, IT und externen Partnern Begleitung von Softwareeinführungen, Prozessveränderungen und Rollouts Dokumentation neuer Prozesse sowie Schulung und Begleitung interner Anwender Mitarbeit bei der Weiterentwicklung unserer digitalen Arbeitsweise im Unternehmen Qualifikation Abgeschlossene kaufmännische Ausbildung, betriebswirtschaftliches Studium, Wirtschaftsinformatik oder eine vergleichbare Qualifikation Mehrjährige Erfahrung in Digitalisierung, Prozessmanagement, Projektmanagement, Operations, IT naher Transformation oder einer vergleichbaren Rolle Nachweisbare Erfahrung in der Umsetzung konkreter Digitalisierungs, Automatisierungs oder Softwareprojekte Gutes Verständnis für administrative, kaufmännische und operative Prozesse Erfahrung in der Einführung oder Weiterentwicklung von Unternehmenssoftware, idealerweise ERP, CRM, BI, Microsoft 365 oder Automatisierungstools Interesse an KI Anwendungen, Automatisierung und modernen digitalen Tools mit klarem Praxisbezug Fähigkeit, Anforderungen aus Fachbereichen zu verstehen, zu strukturieren und in umsetzbare Projekte zu übersetzen Erfahrung in der Steuerung externer Dienstleister, Softwareanbieter oder Implementierungspartner Sehr gute Kommunikationsfähigkeit und Freude daran, Mitarbeiter auf unterschiedlichen Ebenen mitzunehmen Strukturierte, pragmatische und eigenständige Arbeitsweise Fähigkeit, Prioritäten zu setzen und Projekte konsequent voranzubringen Hands on Mentalität und der Anspruch, Prozesse aktiv und messbar zu verbessern Benefits Eine verantwortungsvolle Schlüsselrolle an der Schnittstelle von ERP, Finance, Controlling und Digi"
Arbeitnow API,https://www.arbeitnow.com/jobs/companies/auxxo-female-catalyst-fund/finance-operations-werksstudentin-berlin-317911,2026-05-19T16:30:37,Auxxo Female Catalyst Fund,Finance & Operations Werksstudent:in (m/w/d),Controlling,Berlin,Working student,Controlling,"🌼 Über Auxxo Bei Auxxo investieren wir in die stärksten von Frauen (mit)gegründeten Pre-Seed und Seed Startups in Europa. Wir fördern die gleichberechtigte Teilhabe von Frauen als Gründerinnen und Investorinnen im Venture Capital – angetrieben durch unser Netzwerk, langjährige Erfahrung und Aufrichtigkeit. 🚀 Deine Mission Wir suchen ein analytisches und organisatorisches Talent als operative Unterstützung unserer CFO. Du übernimmst Verantwortung für kritische Datenprozesse, unterstützt bei Transaktionen und sorgst für reibungslose Abläufe im Herzen unseres VC Fonds. Du wirst viel über Startups und die Funktionsweise von Venture Capital lernen, es handelt sich aber explizit nicht um eine Investment Rolle. Aufgaben Finanzen &#x26; Admin: Koordination von Anfragen externer Dienstleister/Institutionen, Unterstützung bei Spesenabrechung und Office Operations; Optional: Unterstützung bei Events. Datenbankmanagement: Aufbau und Pflege unserer Capables, der Portfolio und Investoren Datenbank, sowie unserer internen Kennzahlen. Reporting &#x26; Analyse: Unterstützung bei der Erstellung von LP-Reportings sowie Vorbereitung von Ad-hoc-Auswertungen und Finanzanalysen. Prozessautomatisierung: Proaktive Suche und Implementierung von Automatisierungen zur Skalierung unsere Abläufe im Backoffice. Qualifikation 🌺 Wen wir suchen: Du kommunizierst gern und professionell mit verschiedenen Stakeholdern und hast dabei eine offene und positive Grundeinstellung. Du bringst bereits praktische Erfahrung im Bereich Finance und/oder Operations mit, z. B. durch Praktika oder vorherige Berufstätigkeit. Ein Hintergrund in BWL, VWL oder Wirtschaftsinformatik ist von Vorteil. Du denkst proaktiv mit und steuerst gern Prozesse, dabei behältst du den Überblick und vergisst (fast) nichts. Du arbeitest gerne und dabei extrem präzise mit Daten und beherrschst Excel/Google Sheets sicher. Du hast Spaß daran, administrative Hürden durch Automatisierung und smarte Tools zu lösen und hast damit auch schon erste Erfahrungen gesammelt. Sprachen: Verhandlungssicheres Deutsch und Englisch. Ein Großteil unserer Arbeit ist auf Englisch. Benefits 🍋 Warum du zu uns kommen solltest. Werde Teil eines ehrgeizigen, lebendigen und emphatischen Teams, das jeden Tag mit Leidenschaft daran arbeitet, den Status quo zu verändern. Bekomme einen umfassenden Einblick in das Backoffice eines VC Fonds. Deine Arbeit wird uns als Organisation besser machen, spüre den Impact, den du machen kannst. Arbeite in einer flexiblen Umgebung, in unserem Office in Berlin Mitte und wenn du magst zum Teil auch von zu Hause. 📨 Wie du dich bewerben kannst: Bitte beantworte zwei dieser drei Fragen in einem Cover Letter, es können gern auch Stichpunkte sein. 1. Was reizt dich an dieser Rolle bei uns: worauf hast du richtig Lust und woran denkst du, kannst du lernen? 2. Erinnere dich: Wann hast du einen kritischen Fehler fast übersehen – und wie hast du ihn trotzdem gefangen? 3. Automatisierung ist dein Lieblingswort? Erzähl uns von einer Aufgabe, die du durch Tools/Automationen überflüssig gemacht hast – damit hast du nicht nur Zeit, sondern auch Fehler eliminiert. Wie geht es dann weiter?: Wir werden dich bitten, uns ein kurzes Video zu schicken, um dich noch besser kennen zu lernen 30 Minuten Videointerview mit unserer CFO 60 Minuten persönliches Interview mit unserer CFO und einem weiteren Teammitglied Wir bieten ein familien- und lebensfreundliches Arbeitsumfeld inklusive flexibler Arbeitszeiten. Wir feiern Vielfalt und setzen uns für den Aufbau von Teams ein, die eine Vielzahl von Hintergründen, Perspektiven und Fähigkeiten repräsentieren. Daher ermutigen wir ausdrücklich auch BewerberInnen mit scheinbar unkonventionellen Lebensläufen, sich bei uns zu bewerben. Find Jobs in Germany on Arbeitnow"
