job_id,date_posted,source,company,title,category,raw_category,seniority,location,job_type,skills,tags_raw,salary_min_usd,salary_max_usd,salary_mid_usd,demand_index,scarcity_score,time_to_fill_days_proxy,application_volume_proxy,source_url,description_preview
raw-0169,2026-05-13,Arbeitnow API,Wellhub,Sales Development Senior Manager,Software & Engineering,Unspecified,Senior/Lead,"Berlin, Berlin, Germany",,Onboarding; Research; Sales; AI,,97416,140184,118800,73.2,48,38.6,123,https://www.arbeitnow.com/jobs/companies/wellhub/sales-development-senior-manager-berlin-297977,"Your wellbeing, our mission. Join a company shaping a healthier world. GET TO KNOW US At Wellhub we're revolutionizing workplace wellness. Our platform connects employees worldwide to the best partners for fitness, mindf"
raw-0170,2026-05-13,Arbeitnow API,Wellhub,Client Success Account Executive II,Software & Engineering,Unspecified,Unspecified,"Cologne, North Rhine-Westphalia, Germany",,Customer Service; Communication; Operations; Sales; HR,,66387,95533,80960,74,38,30.3,136,https://www.arbeitnow.com/jobs/companies/wellhub/client-success-account-executive-ii-cologne-130473,"Your wellbeing, our mission. Join a company shaping a healthier world. GET TO KNOW US At Wellhub we're revolutionizing workplace wellness. Our platform connects employees worldwide to the best partners for fitness, mindf"
raw-0171,2026-05-13,Arbeitnow API,Wellhub,Client Success Account Executive II,Software & Engineering,Unspecified,Unspecified,"Berlin, Berlin, Germany",,Customer Service; Communication; Operations; Sales; HR,,66387,95533,80960,74,38,30.3,136,https://www.arbeitnow.com/jobs/companies/wellhub/client-success-account-executive-ii-berlin-441995,"Your wellbeing, our mission. Join a company shaping a healthier world. GET TO KNOW US At Wellhub we're revolutionizing workplace wellness. Our platform connects employees worldwide to the best partners for fitness, mindf"
raw-0172,2026-05-13,Arbeitnow API,Samsara,"Director, Mid-Market Sales - Mainland Europe",Software & Engineering,Unspecified,Senior/Lead,"Munich, Bavaria, Germany",,Recruitment; Onboarding; Operations; Design; Cloud; Video Editing; Sales; SaaS,,97416,140184,118800,72.2,56,42.1,112,https://www.arbeitnow.com/jobs/companies/samsara/director-mid-market-sales-mainland-europe-munich-349100,"Who we are Samsara (NYSE: IOT) is the pioneer of the Connected Operations™ Cloud, which is a platform that enables organizations that depend on physical operations to harness Internet of Things (IoT) data to develop acti"
raw-0173,2026-05-13,Arbeitnow API,Wolt - English,"Senior Manager, Growth Strategy (Marketing)",Data & AI,Unspecified,Senior/Lead,"Berlin, Berlin, Germany",,Performance Marketing; Data Science; Testing; Finance; Design,,94095,135405,114750,64.7,53,40.8,116,https://www.arbeitnow.com/jobs/companies/wolt-english/senior-manager-growth-strategy-marketing-berlin-229747,"About Wolt At Wolt, we create technology that brings joy, simplicity and earnings to the neighborhoods of the world. In 2014 we started with delivery of restaurant food. Now we're building the delivery of (almost) everyt"
raw-0174,2026-05-13,Arbeitnow API,KoCoS Messtechnik AG,Produktmanager/ Elektroingenieur - Bereich elektrische Messtechnik (m/w/d),Software & Engineering,Engineering,Senior/Lead,Korbach,,Python; JavaScript; API; Cloud,Engineering,97416,140184,118800,93.1,72,49,91,https://www.arbeitnow.com/jobs/companies/kocos-messtechnik-ag/produktmanager-elektroingenieur-bereich-elektrische-messtechnik-korbach-450144,Mit modernster Messtechnik gestalten wir die Energiewende KoCoS steht seit mehr als 35 Jahren für innovative Mess- und Prüftechnik. Ob in der elektrischen Energieversorgung oder in der laseroptischen Qualitätsüberwachung
raw-0175,2026-05-13,Arbeitnow API,Taxtalente.de,"Steuerberater (m/w/d) in Beuren, auf Wunsch mit Partnerperspektive, gesucht - mindestens 90.000€",Software & Engineering,Directors,Unspecified,Beuren,,Python; JavaScript; API; Cloud,Directors; Chief Executives,66387,95533,80960,93.1,62,40.7,104,https://www.arbeitnow.com/jobs/companies/taxtalentede/steuerberater-in-beuren-auf-wunsch-mit-partnerperspektive-gesucht-mindestens-90000eur-415628,TaxTalente ist die Nr. 1 Job-Matching Plattform für Jobsuchende in der Steuerberatung. Sie suchen eine positive berufliche Veränderung? Sie möchten den nächsten Schritt in Ihrer Karriere gehen und streben möglicherweise 
raw-0176,2026-05-13,Arbeitnow API,Taxtalente.de,"Steuerberater (m/w/d) in Senftenberg, auf Wunsch mit Partnerperspektive, gesucht - mindestens 90.000€",Software & Engineering,Directors,Unspecified,Senftenberg,,Python; JavaScript; API; Cloud,Directors; Chief Executives,66387,95533,80960,93.1,62,40.7,104,https://www.arbeitnow.com/jobs/companies/taxtalentede/steuerberater-in-senftenberg-auf-wunsch-mit-partnerperspektive-gesucht-mindestens-90000eur-28900,TaxTalente ist die Nr. 1 Job-Matching Plattform für Jobsuchende in der Steuerberatung. Sie suchen eine positive berufliche Veränderung? Sie möchten den nächsten Schritt in Ihrer Karriere gehen und streben möglicherweise 
raw-0177,2026-05-13,Arbeitnow API,Taxtalente.de,"Steuerberater (m/w/d) in Chemnitz, auf Wunsch mit Partnerperspektive, gesucht - mindestens 90.000€",Software & Engineering,Directors,Unspecified,Chemnitz,,Python; JavaScript; API; Cloud,Directors; Chief Executives,66387,95533,80960,93.1,62,40.7,104,https://www.arbeitnow.com/jobs/companies/taxtalentede/steuerberater-in-chemnitz-auf-wunsch-mit-partnerperspektive-gesucht-mindestens-90000eur-154552,TaxTalente ist die Nr. 1 Job-Matching Plattform für Jobsuchende in der Steuerberatung. Sie suchen eine positive berufliche Veränderung? Sie möchten den nächsten Schritt in Ihrer Karriere gehen und streben möglicherweise 
raw-0178,2026-05-13,Arbeitnow API,Taxtalente.de,"Steuerberater (m/w/d) in Mülheim an der Ruhr, auf Wunsch mit Partnerperspektive, gesucht - mindestens 90.000€",Software & Engineering,Directors,Unspecified,Mülheim an der Ruhr,,Python; JavaScript; API; Cloud,Directors; Chief Executives,66387,95533,80960,93.1,62,40.7,104,https://www.arbeitnow.com/jobs/companies/taxtalentede/steuerberater-in-mulheim-an-der-ruhr-auf-wunsch-mit-partnerperspektive-gesucht-mindestens-90000eur-348967,TaxTalente ist die Nr. 1 Job-Matching Plattform für Jobsuchende in der Steuerberatung. Sie suchen eine positive berufliche Veränderung? Sie möchten den nächsten Schritt in Ihrer Karriere gehen und streben möglicherweise 
raw-0179,2026-05-13,Arbeitnow API,Taxtalente.de,"Steuerberater (m/w/d) in Borna, auf Wunsch mit Partnerperspektive, gesucht - mindestens 90.000€",Software & Engineering,Directors,Unspecified,Borna,,Python; JavaScript; API; Cloud,Directors; Chief Executives,66387,95533,80960,93.1,62,40.7,104,https://www.arbeitnow.com/jobs/companies/taxtalentede/steuerberater-in-borna-auf-wunsch-mit-partnerperspektive-gesucht-mindestens-90000eur-336098,TaxTalente ist die Nr. 1 Job-Matching Plattform für Jobsuchende in der Steuerberatung. Sie suchen eine positive berufliche Veränderung? Sie möchten den nächsten Schritt in Ihrer Karriere gehen und streben möglicherweise 
raw-0180,2026-05-13,Arbeitnow API,Taxtalente.de,"Steuerberater (m/w/d) in Gütersloh, auf Wunsch mit Partnerperspektive, gesucht - mindestens 90.000€",Software & Engineering,Directors,Unspecified,Gütersloh,,Python; JavaScript; API; Cloud,Directors; Chief Executives,66387,95533,80960,93.1,62,40.7,104,https://www.arbeitnow.com/jobs/companies/taxtalentede/steuerberater-in-gutersloh-auf-wunsch-mit-partnerperspektive-gesucht-mindestens-90000eur-124936,TaxTalente ist die Nr. 1 Job-Matching Plattform für Jobsuchende in der Steuerberatung. Sie suchen eine positive berufliche Veränderung? Sie möchten den nächsten Schritt in Ihrer Karriere gehen und streben möglicherweise 
raw-0181,2026-05-13,Arbeitnow API,Taxtalente.de,"Steuerberater (m/w/d) in Leipzig, auf Wunsch mit Partnerperspektive, gesucht - mindestens 90.000€",Software & Engineering,Directors,Unspecified,Leipzig,,Python; JavaScript; API; Cloud,Directors; Chief Executives,66387,95533,80960,93.1,62,40.7,104,https://www.arbeitnow.com/jobs/companies/taxtalentede/steuerberater-in-leipzig-auf-wunsch-mit-partnerperspektive-gesucht-mindestens-90000eur-340632,TaxTalente ist die Nr. 1 Job-Matching Plattform für Jobsuchende in der Steuerberatung. Sie suchen eine positive berufliche Veränderung? Sie möchten den nächsten Schritt in Ihrer Karriere gehen und streben möglicherweise 
raw-0182,2026-05-13,Arbeitnow API,Taxtalente.de,"Steuerberater (m/w/d) in Heppenheim, auf Wunsch mit Partnerperspektive, gesucht - mindestens 90.000€",Software & Engineering,Directors,Unspecified,Heppenheim,,Python; JavaScript; API; Cloud,Directors; Chief Executives,66387,95533,80960,93.1,62,40.7,104,https://www.arbeitnow.com/jobs/companies/taxtalentede/steuerberater-in-heppenheim-auf-wunsch-mit-partnerperspektive-gesucht-mindestens-90000eur-419026,TaxTalente ist die Nr. 1 Job-Matching Plattform für Jobsuchende in der Steuerberatung. Sie suchen eine positive berufliche Veränderung? Sie möchten den nächsten Schritt in Ihrer Karriere gehen und streben möglicherweise 
raw-0183,2026-05-13,Arbeitnow API,Taxtalente.de,"Steuerberater (m/w/d) in Bremerhaven, auf Wunsch mit Partnerperspektive, gesucht - mindestens 90.000€",Software & Engineering,Directors,Unspecified,Bremerhaven,,Python; JavaScript; API; Cloud,Directors; Chief Executives,66387,95533,80960,93.1,62,40.7,104,https://www.arbeitnow.com/jobs/companies/taxtalentede/steuerberater-in-bremerhaven-auf-wunsch-mit-partnerperspektive-gesucht-mindestens-90000eur-7766,TaxTalente ist die Nr. 1 Job-Matching Plattform für Jobsuchende in der Steuerberatung. Sie suchen eine positive berufliche Veränderung? Sie möchten den nächsten Schritt in Ihrer Karriere gehen und streben möglicherweise 
raw-0184,2026-05-13,Arbeitnow API,Taxtalente.de,"Steuerberater (m/w/d) in Ebenweiler, auf Wunsch mit Partnerperspektive, gesucht - mindestens 90.000€",Software & Engineering,Directors,Unspecified,Ebenweiler,,Python; JavaScript; API; Cloud,Directors; Chief Executives,66387,95533,80960,93.1,62,40.7,104,https://www.arbeitnow.com/jobs/companies/taxtalentede/steuerberater-in-ebenweiler-auf-wunsch-mit-partnerperspektive-gesucht-mindestens-90000eur-71177,TaxTalente ist die Nr. 1 Job-Matching Plattform für Jobsuchende in der Steuerberatung. Sie suchen eine positive berufliche Veränderung? Sie möchten den nächsten Schritt in Ihrer Karriere gehen und streben möglicherweise 
raw-0185,2026-05-13,Arbeitnow API,Taxtalente.de,"Steuerberater (m/w/d) in Sylt, auf Wunsch mit Partnerperspektive, gesucht - mindestens 90.000€",Software & Engineering,Directors,Unspecified,Sylt,,Python; JavaScript; API; Cloud,Directors; Chief Executives,66387,95533,80960,93.1,62,40.7,104,https://www.arbeitnow.com/jobs/companies/taxtalentede/steuerberater-in-sylt-auf-wunsch-mit-partnerperspektive-gesucht-mindestens-90000eur-98434,TaxTalente ist die Nr. 1 Job-Matching Plattform für Jobsuchende in der Steuerberatung. Sie suchen eine positive berufliche Veränderung? Sie möchten den nächsten Schritt in Ihrer Karriere gehen und streben möglicherweise 
raw-0186,2026-05-13,Arbeitnow API,Taxtalente.de,"Steuerberater (m/w/d) in Erftstadt, auf Wunsch mit Partnerperspektive, gesucht - mindestens 90.000€",Software & Engineering,Directors,Unspecified,Erftstadt,,Python; JavaScript; API; Cloud,Directors; Chief Executives,66387,95533,80960,93.1,62,40.7,104,https://www.arbeitnow.com/jobs/companies/taxtalentede/steuerberater-in-erftstadt-auf-wunsch-mit-partnerperspektive-gesucht-mindestens-90000eur-230459,TaxTalente ist die Nr. 1 Job-Matching Plattform für Jobsuchende in der Steuerberatung. Sie suchen eine positive berufliche Veränderung? Sie möchten den nächsten Schritt in Ihrer Karriere gehen und streben möglicherweise 
raw-0187,2026-05-13,Arbeitnow API,Little John Bikes GmbH,Führungstalent (m/w/d),Software & Engineering,Directors,Unspecified,Eisenach,,Python; JavaScript; API; Cloud,Directors; Chief Executives,66387,95533,80960,93.1,62,40.7,104,https://www.arbeitnow.com/jobs/companies/little-john-bikes-gmbh/fuhrungstalent-eisenach-176023,"Für unseren beratungsintensiven, stationären Fahrradhandel suchen wir Führungskräfte, die Verantwortung übernehmen und ein Talent für die Entwicklung und Motivation von Mitarbeitern besitzen. Mit Deinem sympathischen abe"
raw-0188,2026-05-13,Arbeitnow API,Adsmasters GmbH,Amazon Advertising Manager (m/w/d),Marketing & Growth,Remote,Senior/Lead,Düsseldorf,,Communication; Project Management; Advertising,Remote; Marketing and Communication,66420,95580,81000,64.3,48,38.6,123,https://www.arbeitnow.com/jobs/companies/adsmasters-gmbh/amazon-advertising-manager-dusseldorf-194406,"Wir bei AdsMasters unterstützen führende Marken, internationale Händler und starke D2C-Brands dabei, ihr Amazon-Business nachhaltig zu skalieren. Als Senior Amazon Account Manager:in übernimmst du die Verantwortung für k"
raw-0189,2026-05-13,Arbeitnow API,noris network AG,Senior IT Project Manager (m/w/d) / Technischer Projektleiter,Cybersecurity & IT,Remote,Senior/Lead,Nuremberg,berufserfahren,Project Management; Security; Cloud,Remote; Project Management,88560,127440,108000,76.5,69,47.7,95,https://www.arbeitnow.com/jobs/companies/noris-network-ag/senior-it-project-manager-technischer-projektleiter-nuremberg-11794,"Die noris network AG bietet Unternehmen Lösungen in den Bereichen IT-Outsourcing, Cloud Services, Network &#x26; Security und Datacenter. Technologische Basis dieser Services ist eine leistungsfähige IT-Infrastruktur mit"
raw-0190,2026-05-13,Arbeitnow API,talentfluss,Junior Personalberater (m/f/d) - Düsseldorf,Software & Engineering,Recruitment and Selection,Entry-level,Düsseldorf,,Recruitment; Customer Service; Communication; Research; Sales,Recruitment and Selection,54120,77880,66000,68.1,38,30.3,136,https://www.arbeitnow.com/jobs/companies/talentfluss/junior-personalberater-dusseldorf-202247,"Wir suchen ambitionierte Absolvent:innen, die ihre Karriere im Bereich Sales und Recruitment starten möchten. In dieser Rolle übernimmst du sowohl die Gewinnung und Betreuung von Kunden als auch die Ansprache und Begleit"
raw-0191,2026-05-13,Arbeitnow API,Hochschul-IT-Services.nrw,Cybersecurity Engineer (m/w/d),Software & Engineering,IT Security,Unspecified,Düsseldorf,,Security; Cybersecurity; Cloud,IT Security,66387,95533,80960,74.3,62,40.7,104,https://www.arbeitnow.com/jobs/companies/hochschul-it-servicesnrw/cybersecurity-engineer-dusseldorf-486497,"Arbeite an echter Security im laufenden Betrieb und entwickle sie aktiv weiter HITS.nrw ist ein neu gegründeter, zentraler IT-Dienstleister für die öffentlichen Hochschulen in Nordrhein-Westfalen. Unsere Mission: Gemeins"
raw-0192,2026-05-13,Arbeitnow API,Hochschul-IT-Services.nrw,Senior Cybersecurity Engineer / Security Architect (m/w/d),Software & Engineering,IT Security,Senior/Lead,Düsseldorf,,Security; Cybersecurity; Cloud,IT Security,97416,140184,118800,74.3,72,49,91,https://www.arbeitnow.com/jobs/companies/hochschul-it-servicesnrw/senior-cybersecurity-engineer-security-architect-dusseldorf-84147,"Baue Security, die im Betrieb wirklich funktioniert HITS.nrw ist ein neu gegründeter, zentraler IT-Dienstleister für die öffentlichen Hochschulen in Nordrhein-Westfalen. Unsere Mission: Gemeinsam mit den Fachhochschulen "
raw-0193,2026-05-12,Arbeitnow API,Advertical,(Creative) AI & Automations Specialist (m/wd),Software & Engineering,Marketing and Communication,Unspecified,Cologne,,Communication; Operations; Testing; AI,Marketing and Communication,66387,95533,80960,78.2,38,30.3,136,https://www.arbeitnow.com/jobs/companies/advertical/creative-ai-automations-specialist-m-wd-cologne-469227,"Es ist 18:00 Uhr und du verlässt das Office. Du bist glücklich und erfüllt, weil heute der erste Tag deines neuen Jobs bei Advertical in Köln war. Während du mit der U-Bahn oder deinem neuen Corporate E-Bike nach Hause f"
raw-0194,2026-05-12,Arbeitnow API,Lansweeper,"Senior Account Executive, Enterprise DACH",Software & Engineering,Sales,Senior/Lead,Berlin,"Full-time permanent, experienced",Sales; Communication; Forecasting; Security; SaaS; CRM,Sales; bachelor's degree,97416,140184,118800,65.6,56,42.1,112,https://www.arbeitnow.com/jobs/companies/lansweeper/senior-account-executive-enterprise-dach-berlin-333345,"Senior Account Executive, Enterprise DACH Locations Open for this role are; Germany, Netherlands, Belgium and UK **Note: German Language proficiency is a MUST Context &amp; Impact: We are hiring a Senior Enterprise Accou"
raw-0195,2026-05-12,Arbeitnow API,BAUFIPUR,Baufinanzierungsberater(-in),HR & Recruitment,Private Banking,Mid-level,Esslingen,berufserfahren,Recruitment; HR; Onboarding; Communication,Private Banking,45920,66080,56000,69,38,30.3,136,https://www.arbeitnow.com/jobs/companies/baufipur/baufinanzierungsberater-in-esslingen-107417,"Du hast Erfahrung im Banken-, Finanzierungs- oder Immobilienfinanzierungsbereich und möchtest Kunden bei einer der wichtigsten finanziellen Entscheidungen ihres Lebens begleiten? Dann freuen wir uns, dich kennenzulernen."
raw-0196,2026-05-12,Arbeitnow API,amaflow GmbH,Projektmanager (m/w/d) bei der amaflow GmbH,Marketing & Growth,Marketing Manager,Senior/Lead,Flensburg,,SEO; Google Analytics; Paid Marketing; Content Strategy,Marketing Manager,66420,95580,81000,45.5,48,38.6,123,https://www.arbeitnow.com/jobs/companies/amaflow-gmbh/projektmanager-bei-der-amaflow-gmbh-flensburg-236735,"Wir sind amaflow – eine Agentur für E-Commerce, digitale Markenentwicklung und Performance-Marketing mit Fokus auf Amazon. Zur Verstärkung unseres Teams suchen wir ab sofort einen Projektmanager (m/w/d), der Projekte str"
raw-0197,2026-05-12,The Muse API,Schneider Electric,Tender Engineer,Software & Engineering,Software Engineering,Unspecified,"Entroncamento, Portugal",external,Operations; Finance; Design; Sales,Software Engineering; Mid Level,66387,95533,80960,80.6,38,30.3,136,https://www.themuse.com/jobs/schneiderelectric/tender-engineer-d57051,"Services Tender Engineer - Shaping Value Through Services 🌱 Curious to shape the future through Services? Are you curious about how Services business helps shape the future of energy, sustainability, and customer experi"
raw-0198,2026-05-12,Arbeitnow API,Foodiary GmbH,Content Creator für Gesundheitsplattform,Marketing & Growth,Remote,Mid-level,Munich,"Freelance, berufserfahren",Social Media; Video Editing,Remote; Social Media Manager,49200,70800,60000,60.9,38,30.3,136,https://www.arbeitnow.com/jobs/companies/foodiary-gmbh/content-creator-fur-gesundheitsplattform-munich-391731,"Du liebst Gesundheit, Ernährung und Storytelling? Dann sollten wir uns kennenlernen. Wir sind Foodiary – eine Gesundheitsplattform, die Menschen dabei unterstützt, langfristig gesünder zu leben, und Ernährungscoaches dab"
raw-0199,2026-05-12,Arbeitnow API,FOMO Berlin,Social Media Support (f/m/d),Cybersecurity & IT,Marketing and Communication,Unspecified,Berlin,Freelance,Communication; Social Media,Marketing and Communication,60352,86848,73600,80.8,43,32.5,129,https://www.arbeitnow.com/jobs/companies/fomo-berlin/social-media-support-berlin-198760,"Want to be part of defining what FOMO ( https://www.instagram.com/fomoberlin247 ) looks like? We’re opening the door for a creative mind who’s ready to bring ideas, energy, and a love for extraordinary projects to the ta"
raw-0200,2026-05-12,The Muse API,GE Vernova,Fabrication & CAD Technician,Software & Engineering,Science and Engineering,Unspecified,"Saratoga Springs, NY",external,Operations; Research; Excel,Science and Engineering; Senior Level,66387,95533,80960,63.4,38,30.3,136,https://www.themuse.com/jobs/gevernova/fabrication-cad-technician-8191d5,"Job Description Summary The robotics team technician plays a critical hands-on role supporting the Robotics &amp; Computer Vision team at GE Vernova Advanced Research. This position provides CAD-to-fabrication support, l"
raw-0201,2026-05-12,Arbeitnow API,Distribusion Technologies,"Senior Product Manager, Search (all genders)",Software & Engineering,Information technology,Senior/Lead,Berlin,"Full-time permanent, experienced",Marketplace; API,Information technology; bachelor's degree,97416,140184,118800,68.9,56,42.1,112,https://www.arbeitnow.com/jobs/companies/distribusion-technologies/senior-product-manager-search-all-genders-berlin-47054,"Distribusion is the world’s leading ground transportation marketplace and gives travellers seamless access to ground transportation online, from search to ticket purchase. We have built a cutting-edge B2B technology plat"
raw-0202,2026-05-12,Arbeitnow API,ANGEHEUERT GmbH,Senior Consultant – Healthcare (m/w/d),Product & Project Management,Consulting,Senior/Lead,"München, Deutschland","Full-time permanent, mid",Onboarding,Consulting; high school coursework,84132,121068,102600,68.4,48,38.6,123,https://www.arbeitnow.com/jobs/companies/angeheuert-gmbh/senior-consultant-healthcare-munchen-deutschland-125618,"Bereit für deine Karriere als Senior Consultant – Healthcare ? Du willst im Healthcare Bereich wirklich etwas bewegen? Werde Teil einer aufstrebenden Boutique-Beratung, die neue Maßstäbe im Gesundheitswesen setzt. Die Ku"
raw-0203,2026-05-12,Arbeitnow API,Progyny Global,Software Engineering Manager (m/f/x),Data & AI,Management,Senior/Lead,Berlin,manager,Communication; TypeScript; Onboarding; Frontend; Backend; Startup; Python; Design; AI/ML; Cloud; CI/CD; React,Management; Team Leader,94095,135405,114750,67.9,69,47.7,95,https://www.arbeitnow.com/jobs/companies/progyny-global/software-engineering-manager-berlin-446041,"About Us We are Progyny Global , the international arm of Progyny Inc. - the leading fertility and family-building benefits provider in the US. Our shared mission? To make fertility and family-forming care accessible eve"
raw-0204,2026-05-11,Remotive API,Coalition Technologies,Office Assistant,Software & Engineering,Marketing,Unspecified,Worldwide,full_time,WordPress; Frontend; Startup; Shopify; Excel; SQL; Git; Data Analysis; Communication,CSS; excel; frontend; git; html; illustrator; magento; photoshop; php; shopify; wordpress; MySQL; startup; responsive; themes; bootstrap; insurance; jQuery; Ajax,66387,95533,80960,53.7,38,30.3,136,https://remotive.com/remote-jobs/marketing/office-assistant-1680495,"WHY YOU SHOULD APPLY: Coalition Technologies is devoted to delivering clients the highest quality work while providing our team a fun, thriving, and innovative environment. Along with the opportunity for tremendous caree"
raw-0205,2026-05-11,The Muse API,Eaton,Plant Manager,Software & Engineering,Human Resources and Recruitment,Senior/Lead,"Jackson, MI",external,Recruitment; Customer Service; Operations; Finance; Sales; HR,Human Resources and Recruitment; Senior Level,97416,140184,118800,67.5,48,38.6,123,https://www.themuse.com/jobs/eaton/plant-manager-6b86b7,"Eaton's Aerospace Business is hiring a Plant Manager for one of their largest facilities in North America. This position will be based in Jackson, MI. Position Overview: Reporting directly to the Director of Operations, "
raw-0206,2026-05-11,Remotive API,Caul Group,Director of Revenue Systems and AI Automation (Offshore),Data & AI,Artificial Intelligence,Senior/Lead,LATAM,contract,Automation; Onboarding; AI/ML; REST; API; CRM; AI; HR,api; AI/ML; automation; documentation; CRM; analytics; systems architecture; onboarding; infrastructure; REST,94095,135405,114750,64.7,69,47.7,95,https://remotive.com/remote-jobs/artificial-intelligence/director-of-revenue-systems-and-ai-automation-offshore-2090878,"This search is open exclusively to candidates based in Latin America. Preference for Uruguay, Costa Rica, or Colombia. BACKGROUND CONTEXT Every department at Caul Group is generating AI and automation ideas faster than t"
raw-0207,2026-05-09,Remotive API,nooro,iOS Developer,Software & Engineering,Software Development,Unspecified,USA,full_time,Security; Backend; Startup; Agile; Figma; UI/UX; REST; Git; API; iOS,api; backend; git; ios; security; swift; UI/UX; Figma; agile; healthcare; startup; core data; github; REST; MVVM; mobile development,66387,95533,80960,54.4,54,37.2,115,https://remotive.com/remote-jobs/software-development/ios-developer-1956455,"WHO ARE WE? At nooro, we're revolutionizing pain management for seniors. Our platform is transforming how older adults engage with pain management at home. We're on a mission to make wellness more accessible and effectiv"
raw-0208,2026-05-09,The Muse API,"The TJX Companies, Inc.",Associé/Associée de Magasin de Détail Temps Partiel St-Hyacinthe Galerie de St-hyacinthe,Data & AI,Data and Analytics,Unspecified,"Saint-Hyacinthe, Canada",external,Communication,Data and Analytics; Mid Level,64124,92276,78200,91,43,32.5,129,https://www.themuse.com/jobs/thetjxcompaniesinc/associeassociee-de-magasin-de-detail-temps-partiel-sthyacinthe-galerie-de-sthyacinthe-f5b97a,"TJX Canada At TJX Canada, every day brings new opportunities for growth, exploration, and achievement. You'll be part of our vibrant team that embraces diversity, fosters collaboration, and prioritizes your development. "
raw-0209,2026-05-09,The Muse API,GE Vernova,Senior New Technology Introduction Leader,Data & AI,Data and Analytics,Senior/Lead,"Cambridge, MA, Flexible / Remote",external,Cybersecurity; Security; Design; AI,Data and Analytics; Senior Level,94095,135405,114750,69.7,69,47.7,95,https://www.themuse.com/jobs/gevernova/senior-new-technology-introduction-leader-4a46f2,"Job Description Summary Job Summary Lead the scouting, evaluation, and incubation of digital and AI solutions across Gas Power Global Supply Chain. This role operates at the intersection of frontline operational reality "
