source,source_url,date_posted,company,title,category,location,job_type,tags_raw,description
Arbeitnow API,https://www.arbeitnow.com/jobs/companies/hey-little-gmbh/werkstudent-im-online-marketing-baiersdorf-186272,2026-07-21T15:00:28,Hey Little GmbH,Werkstudent (m/w/d) im (Online) Marketing,Online Marketing,Baiersdorf,Working student,Online Marketing,"Hey Little - Dein Einstieg in ein nachhaltiges Startup mit Zukunft! Du liebst Social Media, Creator Content und packende Geschichten? Perfekt! Werde Teil eines motivierten Teams, das die Art und Weise verändert, wie Familien Babyprodukte nutzen. Starte jetzt deine Karriere bei Hey Little und gestalte die Zukunft des nachhaltigen Konsums mit! Wir sind ein innovatives Unternehmen, das den Markt für Babyausstattung revolutioniert. Mit unserem innovativen Miet- und Kaufkonzept ermöglichen wir Familien maximale Flexibilität: Ob neu oder hochwertig aufbereitet - unsere Produkte können ab einem Monat gemietet oder gekauft werden. Aufgaben Gestalte mit uns die Social Media Zukunft von Hey Little! Als Werkstudent (m/w/d) im (Online) Marketing wirst du Teil unserer Marketing-Welt und unterstützt uns dabei, kreative Kampagnen, Kooperationen und Content-Ideen umzusetzen. Tauche ein in ein Umfeld, in dem du direkt mit Influencern, Brands und unserem Team zusammenarbeitest. Deine Mission Unterstütze bei der Planung, Organisation und Umsetzung von Influencer-Marketing-Kampagnen auf Instagram und TikTok Koordiniere Kooperationen mit Influencern und anderen Brands, inklusive Abstimmung, Timings und Kommunikation Begleite Gewinnspiele und gemeinsame Social-Media-Aktivierungen von der Idee bis zur Auswertung Entwickle kreative TikTok-Content-Ideen und unterstütze bei Videodreh, Schnitt und Veröffentlichung Erstelle Briefings für Reels, Stories und Posts und sorge dafür, dass Content zu Marke, Zielgruppe und Kampagnenziel passt Recherchiere passende Creator, Trends und Kooperationspotenziale für unsere Marke Dein Impact Treibe spannende Kampagnen mit Influencern und Kooperationspartnern aktiv voran Bringe frische Content-Ideen für Instagram und TikTok ein und setze sie gemeinsam mit dem Team um Unterstütze die Kommunikation zwischen Creator, Brand-Partnern und internen Teams Analysiere Kampagnen-Performance und erstelle Reportings mit klaren Learnings Optimiere laufende Social-Media- und Influencer-Maßnahmen anhand relevanter KPIs Qualifikation Deine Expertise Du studierst im Bereich BWL, Kommunikation oder (Digitales) Marketing und hast noch mindestens 2 Semester vor dir Du hast bereits erste wertvolle praktische Erfahrungen im E-Commerce und Content Marketing gesammelt Du verfügst über ein fundiertes wirtschaftliches Grundverständnis und bewegst dich sicher in der digitalen Welt Deine Skills Du kennst dich mit Instagram, TikTok und aktuellen Social-Media-Trends bestens aus Du hast ein gutes Gespür für Creator Content, Storytelling und zielgruppengerechte Kommunikation Du formulierst sicher auf Deutsch und kannst klare, verständliche Briefings erstellen Du hast Lust auf Videocontent und idealerweise erste Erfahrung mit Dreh oder einfachem Schnitt Du arbeitest datenorientiert und kannst Kampagnenergebnisse strukturiert auswerten Deine Arbeitsweise Du gehst Aufgaben eigenständig und lösungsorientiert an Du überzeugst durch deine schnelle Auffassungsgabe und zuverlässige Arbeitsweise Du bringst mindestens 16 Stunden pro Woche Engagement in unser Team ein Nice to have, aber kein Muss Erste Erfahrungen mit Influencer-Tools, Reporting-Tools oder Content Management Systemen Vertrautheit mit Canva, CapCut, Meta Business Suite oder ähnlichen Marketing-Tools Benefits Dein Arbeitsumfeld bei uns Faire Vergütung: Bei uns erhältst du von Anfang an eine attraktive und marktgerechte Vergütung, die deine Qualifikationen und deinen Einsatz widerspiegelt. Regelmäßige Feedback-Gespräche zur persönlichen Entwicklung sind für uns selbstverständlich. Work-Life-Balance der Extraklasse: In unserem hauseigenen Premium-Fitnessbereich wartet modernste Ausstattung auf dich - nur wenige Schritte von deinem Arbeitsplatz entfernt. Trainiere flexibel und ohne Wartezeiten in exklusiver Business-Atmosphäre. Zusätzlich hast du die Möglichkeit, dein Workout durch externe Kurse zu ergänzen. Der perfekte Mix für dein individuelles Fitnessprogramm, wann immer es in deinen Tagesablauf "
Arbeitnow API,https://www.arbeitnow.com/jobs/companies/ls-onlinevertrieb/vertriebsmitarbeiter-mwd-plossberg-448779,2026-07-21T15:00:28,LS Onlinevertrieb,Vertriebsmitarbeiter m|w|d|,Remote,Plößberg,,Remote; Marketing and Communication,"Wir suchen engagierte Vertriebsmitarbeiter zur Erweiterung des Teams im Bereich Gesundheit und Prävention. In Zusammenarbeit mit Next Level Health bieten wir eine strukturierte, flexible Tätigkeit im Homeoffice auf selbstständiger Basis. Quereinsteiger und Profis sind gleichermaßen willkommen. Aufgaben Interessentenbetreuung: - Kontaktaufnahme mit Interessenten - Durchführung von Informations- und Beratungsgesprächen per Telefon oder Videocall - Ermittlung des individuellen Bedarfs - Beantwortung von Fragen zu Produkten und Dienstleistungen Vertrieb und Beratung: - Vorstellung unserer Lösungen im Bereich Gesundheit und Prävention - Begleitung von Interessenten während des Entscheidungsprozesses - Aufbau und Pflege langfristiger Kundenbeziehungen - Dokumentation von Gesprächen und Kontakten Qualifikation Das bringst du mit: - Freude am Umgang mit Menschen - Gute Kommunikationsfähigkeiten - Freundliches und professionelles Auftreten - Zuverlässige und eigenverantwortliche Arbeitsweise - Interesse an Gesundheit und Prävention - Vertriebserfahrung ist von Vorteil, jedoch keine Voraussetzung Benefits Firmenwagen Flexible Arbeitszeiten Homeoffice Mentoring Mitarbeiterrabatte Private Altersvorsorge Remote arbeiten Die Vergütung erfolgt auf Provisionsbasis und richtet sich nach deinem persönlichen Einsatz und den erzielten Ergebnissen. Nach deiner Bewerbung erhältst du einen kurzen Fragebogen zur Vorqualifizierung. Im Anschluss prüfen wir gemeinsam, ob die Voraussetzungen für eine erfolgreiche Zusammenarbeit erfüllt sind. Wir freuen uns auf deine Bewerbung! Find more English Speaking Jobs in Germany on Arbeitnow"
Arbeitnow API,https://www.arbeitnow.com/jobs/companies/nextcloud/hr-generalist-stuttgart-43264,2026-07-21T15:00:27,Nextcloud,HR Generalist,Remote,Stuttgart,professional / experienced,Remote; Personnel Specialist,"At Nextcloud we help our users achieve a safe home for all their data. Secure, under your control and developed in an open, transparent and trustworthy way. Our Team of >170 is distributed in 30 countries worldwide. We work remotely and our work culture is shaped by mutual trust, enthusiasm and a strong belief in the principles of open source. At Nextcloud our team is our most important asset. Human Resources plays crucial role in aligning our team to business objectives, promoting company values, and shaping a positive culture. This position requires a practical approach to problem-solving and the ability to build interpersonal relationships at all levels of the company. Tasks Manage the entire employee life-cycle-process for our growing and worldwide-distributed team Take responsibility for compliance with German, French and Dutch employment laws and regulations, reducing legal risks, and ensuring regulatory compliance Participate in probationary period reviews, annual review meetings as well as disciplinary meetings Support with the implementation of an HR software from scratch Build bridges between management and the team by addressing demands, grievances, or other issues with diplomacy and care Strengthen our middle management with leadership advice Administrative tasks such as tracking sickness quota or annual leave absences Requirements Degree in Human Resources or related field Hands-on experience with HR practices and employee management Strong understanding of German or French labour law and legal requirements Fluent in English and at least two of relevant languages (French, Spanish, Dutch, German, others) Excellent listening skills and meticulous attention to detail Reliability, discretion and confidentiality are crucial Benefits A distributed, open team with a passion for working on and within the open source community A fun and diverse team A product which pushes the boundaries of technology with a global user and contributor community A competitive salary Remote work and flexibility for a healthy work-life balance Time for personal growth and education We especially encourage applications by people from under-represented groups. Find Jobs in Germany on Arbeitnow"
Arbeitnow API,https://www.arbeitnow.com/jobs/companies/gocomo-gmbh/senior-creator-marketing-coordinator-berlin-417088,2026-07-21T15:00:27,gocomo GmbH,(Senior) Creator Marketing Coordinator (m/w/d),Marketing and Communication,Berlin,berufserfahren,Marketing and Communication,"Deine Rolle Du weißt, was erfolgreiche Creator-Kampagnen ausmacht, erkennst Trends bevor sie viral gehen und hast ein Gespür für starke Markenstrategien? Dann bist du hier genau richtig! In dieser Rolle bringst du dein strategisches Know-how ein, arbeitest auf Augenhöhe mit Kunden und Creators und gestaltest innovative Marketingansätze, die echten Impact haben. Wenn du Lust hast, die Zukunft der Creator Economy mitzugestalten und deine Expertise auf das nächste Level zu heben – let’s talk! Deine Aufgaben Strategische Kampagnensteuerung: Planung, Umsetzung und Optimierung von Influencer-Marketing-Kampagnen mit Fokus auf Performance und Brand Awareness Enge Kundenbetreuung: Zusammenarbeit mit dem Key Account Management zur Sicherstellung der individuellen Kundenstrategie Projektmanagement: Erstellung von wöchentlichen Updates, Vorbereitung und Durchführung von Kundenterminen sowie Entwicklung langfristiger Kundenbindungsmaßnahmen Markt- und Wettbewerbsanalysen: Identifikation von Trends, Analyse des Wettbewerbsumfeldes und Ableitung strategischer Maßnahmen Budget- &#x26; Margenverantwortung: Steuerung und Kontrolle von Kosten, Budgets und Margenzielen zur Sicherstellung der wirtschaftlichen Effizienz Interne &#x26; externe Kommunikation: Schnittstellenfunktion zwischen Kunden, Creators und internen Teams, um einen reibungslosen Ablauf der Kampagnen zu gewährleisten Paid Media Management: Verantwortung für Performance-Marketing-Kampagnen auf Plattformen wie Meta und TikTok zur Maximierung der Kampagnen Ergebnisse Dein Profil Mindestens 3 Jahre Erfahrung im Influencer-Marketing, Projektmanagement oder einer vergleichbaren Position Ausgezeichnete Kommunikationsfähigkeiten und ein sicheres Gespür für den Umgang mit Kunden, Creators und Stakeholdern Erfahrung in Budgetmanagement sowie der Optimierung von Prozessen für eine effiziente Kampagnensteuerung Tiefes Verständnis für Social Media, Influencer-Marketing und Paid Media, idealerweise mit Erfahrung in der Steuerung von Paid-Kampagnen Hohe Diplomatie und Fingerspitzengefühl, um verschiedene Interessen geschickt zu managen Ein echter Teamplayer mit einer ausgeprägten Hands-on-Mentalität, Eigeninitiative und Leidenschaft für das Creator-Ökosystem Warum wir? Attraktives Gehalt &#x26; flexibles Arbeiten – Bei uns arbeitest du hybrid, mit Workation-Möglichkeit und flexiblen Arbeitszeiten, damit du Job und Leben optimal verbinden kannst Top-Equipment für dich – Damit du effizient arbeiten kannst, stellen wir dir modernste Technik zur Verfügung Offene Unternehmenskultur &#x26; Entwicklungsmöglichkeiten – Wir leben eine transparente Feedbackkultur und bieten dir Raum für deine persönliche und fachliche Weiterentwicklung Legendäre Team-Events &#x26; Offsites – Ob After-Work, Team-Retreat oder große Offsites – wir feiern unsere Erfolge und stärken den Teamgeist Sachbezug &#x26; Fitness-Benefit – monatlicher Sachbezug von 50€ zur freien Nutzung, u.a. für eine vollständig abgedeckte Mitgliedschaft bei Urban Sports Club (M-Plan). Betriebliche Altersvorsorge (bAV) – Wir unterstützen dich dabei, frühzeitig für deine Zukunft vorzusorgen Hundefreundliches Büro im Herzen Berlins – Dein Vierbeiner ist bei uns herzlich willkommen und freut sich auf neue Büro-Buddies Find Jobs in Germany on Arbeitnow"
Arbeitnow API,https://www.arbeitnow.com/jobs/companies/gocomo-gmbh/creator-marketing-coordinator-berlin-203666,2026-07-21T15:00:26,gocomo GmbH,Creator Marketing Coordinator (m/w/d),Marketing and Communication,Berlin,berufserfahren,Marketing and Communication,"Deine Rolle Du hast bereits Erfahrung im Influencer Marketing, weißt, wie man Kampagnen steuert, und liebst es, Marken mit den richtigen Creators zu vernetzen? Dann ist das deine Chance, noch mehr Impact zu schaffen! In dieser Rolle koordinierst du kreative Kampagnen, hältst die Fäden zwischen Kunden, Creators und internen Teams zusammen und sorgst dafür, dass jede Strategie sitzt. Du bringst dein Gespür für Trends und Performance ein und entwickelst Influencer-Marketing-Maßnahmen, die wirklich was bewegen. Ready für den nächsten Schritt? Let's talk! Deine Aufgaben Kampagnenmanagement: Planung, Umsetzung und Steuerung von Influencer-Marketing-Kampagnen in enger Abstimmung mit dem Team Kundenkommunikation: Unterstützung bei der Kundenbetreuung, Erstellung von wöchentlichen Updates und Vorbereitung von Meetings Markt- und Wettbewerbsanalysen: Identifikation von Trends und Entwicklung von Ideen zur Stärkung der Kundenstrategie Budget- &#x26; Kostenkontrolle: Unterstützung bei der Verwaltung von Budgets und der Sicherstellung wirtschaftlicher Zielvorgaben Interne Koordination: Enge Zusammenarbeit mit dem Key Account Management sowie Unterstützung beim Kundenausbau Paid Media Unterstützung: Mitarbeit an Paid-Kampagnen auf Plattformen wie Meta und TikTok Dein Profil Mindestens 2 Jahre Erfahrung im Influencer-Marketing, Projektmanagement oder einer vergleichbaren Rolle Gute Kommunikationsfähigkeiten und ein sicheres Gespür für den Umgang mit Kunden und Creators Erste Erfahrung im Budgetmanagement sowie in der Prozessoptimierung Grundlegendes Verständnis für Social Media, Influencer-Marketing und Paid Media, mit dem Wunsch, sich weiterzuentwickeln Teamplayer-Mentalität, Hands-on-Mentalität und Eigeninitiative Sehr gute Deutschkenntnisse (mind. C2) sowie gute Englischkenntnisse in Wort und Schrift Diplomatisches Geschick im Umgang mit unterschiedlichen Stakeholdern Warum wir? Attraktives Gehalt &#x26; flexibles Arbeiten – Bei uns arbeitest du hybrid, mit Workation-Möglichkeit und flexiblen Arbeitszeiten, damit du Job und Leben optimal verbinden kannst Top-Equipment für dich – Damit du effizient arbeiten kannst, stellen wir dir modernste Technik zur Verfügung Offene Unternehmenskultur &#x26; Entwicklungsmöglichkeiten – Wir leben eine transparente Feedbackkultur und bieten dir Raum für deine persönliche und fachliche Weiterentwicklung Legendäre Team-Events &#x26; Offsites – Ob After-Work, Team-Retreat oder große Offsites – wir feiern unsere Erfolge und stärken den Teamgeist Sachbezug &#x26; Fitness-Benefit – monatlicher Sachbezug von 50€ zur freien Nutzung, u.a. für eine vollständig abgedeckte Mitgliedschaft bei Urban Sports Club (M-Plan). Betriebliche Altersvorsorge (bAV) – Wir unterstützen dich dabei, frühzeitig für deine Zukunft vorzusorgen Hundefreundliches Büro im Herzen Berlins – Dein Vierbeiner ist bei uns herzlich willkommen und freut sich auf neue Büro-Buddies Find more English Speaking Jobs in Germany on Arbeitnow"
Arbeitnow API,https://www.arbeitnow.com/jobs/companies/gocomo-gmbh/influencer-marketing-manager-berlin-247002,2026-07-21T15:00:25,gocomo GmbH,Influencer Marketing Manager (m/w/d),Marketing and Communication,Berlin,berufserfahren,Marketing and Communication,"Deine Rolle Du hast bereits Erfahrung im Influencer Marketing, weißt, wie man Kampagnen steuert, und liebst es, Marken mit den richtigen Creators zu vernetzen? Dann ist das deine Chance, noch mehr Impact zu schaffen! In dieser Rolle koordinierst du kreative Kampagnen, hältst die Fäden zwischen Kunden, Creators und internen Teams zusammen und sorgst dafür, dass jede Strategie sitzt. Du bringst dein Gespür für Trends und Performance ein und entwickelst Influencer-Marketing-Maßnahmen, die wirklich was bewegen. Ready für den nächsten Schritt? Let's talk! Deine Aufgaben Kampagnenmanagement: Planung, Umsetzung und Steuerung von Influencer-Marketing-Kampagnen in enger Abstimmung mit dem Team Kundenkommunikation: Unterstützung bei der Kundenbetreuung, Erstellung von wöchentlichen Updates und Vorbereitung von Meetings Markt- und Wettbewerbsanalysen: Identifikation von Trends und Entwicklung von Ideen zur Stärkung der Kundenstrategie Budget- &#x26; Kostenkontrolle: Unterstützung bei der Verwaltung von Budgets und der Sicherstellung wirtschaftlicher Zielvorgaben Interne Koordination: Enge Zusammenarbeit mit dem Key Account Management sowie Unterstützung beim Kundenausbau Paid Media Unterstützung: Mitarbeit an Paid-Kampagnen auf Plattformen wie Meta und TikTok Dein Profil Mindestens 2 Jahre Erfahrung im Influencer-Marketing, Projektmanagement oder einer vergleichbaren Rolle Gute Kommunikationsfähigkeiten und ein sicheres Gespür für den Umgang mit Kunden und Creators Erste Erfahrung im Budgetmanagement sowie in der Prozessoptimierung Grundlegendes Verständnis für Social Media, Influencer-Marketing und Paid Media, mit dem Wunsch, sich weiterzuentwickeln Teamplayer-Mentalität, Hands-on-Mentalität und Eigeninitiative Sehr gute Deutschkenntnisse (mind. C2) sowie gute Englischkenntnisse in Wort und Schrift Diplomatisches Geschick im Umgang mit unterschiedlichen Stakeholdern Warum wir? Attraktives Gehalt &#x26; flexibles Arbeiten – Bei uns arbeitest du hybrid, mit Workation-Möglichkeit und flexiblen Arbeitszeiten, damit du Job und Leben optimal verbinden kannst Top-Equipment für dich – Damit du effizient arbeiten kannst, stellen wir dir modernste Technik zur Verfügung Offene Unternehmenskultur &#x26; Entwicklungsmöglichkeiten – Wir leben eine transparente Feedbackkultur und bieten dir Raum für deine persönliche und fachliche Weiterentwicklung Legendäre Team-Events &#x26; Offsites – Ob After-Work, Team-Retreat oder große Offsites – wir feiern unsere Erfolge und stärken den Teamgeist Sachbezug &#x26; Fitness-Benefit – monatlicher Sachbezug von 50€ zur freien Nutzung, u.a. für eine vollständig abgedeckte Mitgliedschaft bei Urban Sports Club (M-Plan). Betriebliche Altersvorsorge (bAV) – Wir unterstützen dich dabei, frühzeitig für deine Zukunft vorzusorgen Hundefreundliches Büro im Herzen Berlins – Dein Vierbeiner ist bei uns herzlich willkommen und freut sich auf neue Büro-Buddies Find Jobs in Germany on Arbeitnow"
Arbeitnow API,https://www.arbeitnow.com/jobs/companies/hohn-digital/it-leiter-boppard-365798,2026-07-21T14:30:28,Hohn Digital,IT-Leiter (m/w/d),IT,Boppard,,IT,"Heinze Solutions steht für jahrzehntelange Erfahrung und Präzision . Mit hochwertigen Produkten und kontinuierlicher Weiterentwicklung bieten wir eine langfristige Perspektive in einem stabilen Umfeld. Aufgaben Sicherstellung des laufenden IT-Betriebs sowie Administration von Server-, Netzwerk- und Client-Infrastruktur Betreuung von Windows- und Linux-Systemen inkl. Active Directory, Exchange und Virtualisierung Unterstützung der Mitarbeitenden im IT-Support sowie Einrichtung und Pflege von Arbeitsplätzen Planung, Koordination und Umsetzung von IT- und Digitalisierungsprojekten Steuerung externer Dienstleister sowie Dokumentation und Weiterentwicklung der IT-Systeme und Prozesse Qualifikation Mehrjährige Erfahrung in der Systemadministration mit Fokus auf Windows-Server, Netzwerke und IT-Infrastruktur Breites technisches Know-How in Bereichen wie Active Directory, Virtualisierung, Netzwerk und IT-Security Strukturierte, eigenverantwortliche und lösungsorientierte Arbeitsweise Kommunikationsstärke im Umgang mit Anwendern, Fachbereichen und externen Dienstleistern Führerschein der Klasse B Benefits Sicherer und unbefristeter Arbeitsplatz: Als Unternehmen mit über 60 Jahren Erfahrung und einem breiten Kundenstamm bieten wir Dir eine stabile Basis, auf die Du bauen kannst. Kollegen, die zusammenhalten: Du arbeitest mit netten, hilfsbereiten Kollegen zusammen und wirst optimal eingearbeitet - hier ziehen alle an einem Strang. Abwechslungsreicher Arbeitsalltag mit verantwortungsvollen Aufgabenbereichen. Flexible Arbeitszeiten: Wir bieten Dir ein flexibles Gleitzeitmodell mit Kernarbeitszeiten zwischen 9 und 15 Uhr. Urlaubsgeld und Weihnachtsgeld gibt es abhängig vom Unternehmenserfolg zusätzlich zu Deiner leistungsgerechten Vergütung. Teamevents wie unser Oktoberfest, wo wir zusammenkommen und richtig Spaß haben. Überstundenkonto: Bei uns werden Überstunden selbstverständlich erfasst und ausgezahlt oder abgefeiert. 30 Tage Urlaub, damit Du genügend Erholung bekommst - 3 Wochen am Stück problemlos möglich. Vermögenswirksame Leistungen sowie betriebliche Altersvorsorge, damit Du in Zukunft bestens abgesichert bist. Weiterentwicklungsmöglichkeiten: Wir unterstützen unsere Mitarbeiter durch Schulungen und individuelle Lernmöglichkeiten dabei, sich weiterzuentwickeln. Chefs auf Augenhöhe, mit denen Du über alles sprechen kannst und deren Türen offen stehen. Betriebliche Krankenversicherung, damit Du Leistungen bekommst, die über den gesetzlichen Rahmen hinausgehen. Klingt interessant? Jetzt online bewerben ohne Anschreiben und Lebenslauf. Find more English Speaking Jobs in Germany on Arbeitnow"
Arbeitnow API,https://www.arbeitnow.com/jobs/companies/1komma50/kundenbetreuung-losungs-zufriedenheitsmanagement-berlin-179794,2026-07-21T14:30:26,1KOMMA5˚,Kundenbetreuung (m/w/d) – Lösungs- & Zufriedenheitsmanagement,Remote,Berlin,berufserfahren,Remote; Customer Service,"1KOMMA5° Bei 1KOMMA5° verfolgen wir eine Vision: Living on wind and sunlight forever for free . Dafür bauen wir mit Heartbeat AI das Energiesystem der Zukunft. Bist du dabei? Wir bringen regionales Handwerk und skalierbare Software zusammen: Solar, Speicher, Wärmepumpe und E-Mobilität denken wir nicht einzeln, sondern steuern sie als intelligentes, integriertes Gesamtsystem in unserem virtuellen Kraftwerk. Direkt verbunden mit dem Strommarkt – in Echtzeit, vollautomatisiert. So wird Energie dann genutzt, wenn sie erneuerbar verfügbar und besonders günstig ist. Bis 2030 wollen wir 1,5 Millionen Haushalte auf erneuerbare Energien umstellen. Über 3.000 Menschen arbeiten jeden Tag daran, an mehr als 80 Standorten weltweit, von Finnland bis Australien. Du willst Verantwortung übernehmen und Lösungen bauen, die wirklich zählen? Bewirb dich jetzt und gestalte mit uns die Energiewelt von morgen. Deine Position Du bist Ansprechpartner für den 1st-Level, sowie für die Standortleiter und hast ebenso Bewertungsportale und Social Media Kanäle im Blick Du bist verantwortlich für die fallabschließende Lösung von komplexen technischen und kaufmännischen Anfragen unserer Kund*innen Du kümmerst dich um die Bearbeitung von Datenschutzanfragen, sowie rechtlichen Anfragen, in Abstimmung mit der Rechtsabteilung Du bildest die Schnittstelle zwischen unseren Kund*innen, Customer Care, den Fachbereichen und den einzelnen Niederlassungs-Unternehmen Du identifizierst Soft- und Hardwarefehler und unterstützt die Fachbereiche bei deren Behebung Du analysiert Beschwerdegründe, erkennst Prozessunstimmigkeiten und weist auf Prozessoptimierungen hin Dein Profil Du bringst mindestens 3 Jahre relevante Berufserfahrung im Customer Service Bereich mit Du bist technikaffin und hast Lust zu verstehen, wie alles rund um erneuerbare Energien funktioniert Du bist kommunikativ und hast Spaß Menschen zu helfen und Dinge zu verändern, komplizierte Vorgänge kannst Du so erklären, dass es für jeden verständlich ist Du sprichst fließend deutsch (C-Level), Englisch Sprachkenntnisse sind wünschenswert Benefits Du hast die Möglichkeit in unseren brandneuen Büros in der Hamburger Innenstadt, Berlin &#x26; München zu arbeiten und/oder remote Nutze dein technisches Equipment auch abseits der Arbeit in deiner Freizeit Du bist Teil eines schnell wachsenden Unternehmens mit viel Entwicklungspotenzi al , wo du eigenständig etwas aufbauen kannst und deinen Impact spürst Bewege dich in flachen Hierarchien , übernimm schon während deiner Einarbeitung Verantwortung und arbeite direkt mit Teilen des Managements zusammen Mit deiner Arbeit unterstützt du den Megatrend “Energie- und Mobilitätswende” und leistest einen konkreten Beitrag zum nachhaltigen Umbau unserer Energie-Infrastruktur Sei aktiv und nutze das Angebot von über 7.600 Sportpartnern mit dem EGYM-Wellpass Ob Citybike oder E-Bike – mit unserem Jobrad-Leasing bleibst du flexibel und bist umweltfreundlich unterwegs Profitiere von Benefits &#x26; Rabatten durch Futurebens Find more English Speaking Jobs in Germany on Arbeitnow"
